,Link,Anfitrion,Descripcion,Precio,Comuna,Region,Titulo1,lat,long,ScarpDate
0,https://www.facebook.com/marketplace/item/6487215481292780/?ref=search&referral_code=null&referral_story_type=post&tracking=browse_serp%3A9c1d485e-9f13-46df-93b4-85424b7b3d41,Keno Andrés Tapia,"Ubicadas en el pueblo huanta km 108 ruta d-41 (ver ultima foto del mapa)

3 cabañas totalmente equipadas (incluye cocina equipada, loza, implementos, gas incorporado, calefond, sábanas y ropa de cama limpia)

Cada cabaña con capacidad para 5 personas (1 dormitorio matrimonial y un segundo dormitorio con tres camas de una plaza)

Valor de arriendo $70.000 diario 

Mínimo de arriendo 2 días 

Piscina quinchos, mesa de pool, tv satelital, wifi internet satelital.

Cada cabaña cuenta con 1 estacionamiento.

90% de disponibilidad para el mes de febrero, consulte por fechas.

5️⃣6️⃣9️⃣ 9️⃣3️⃣2️⃣0️⃣ 8️⃣1️⃣9️⃣6️⃣ Ver menos",70000.0,La Serena,Coquimbo,Cabañas turísticas valle de elqui,-29.885559082031,-71.229858398438,15-02-2023
