,Link,Anfitrion,Descripcion,Precio,Comuna,Region,Titulo1,lat,long,ScarpDate
0,https://www.facebook.com/marketplace/item/3333330576920978/?ref=search&referral_code=null&referral_story_type=post&tracking=browse_serp%3A9c1d485e-9f13-46df-93b4-85424b7b3d41,Arriendos Puertas del Mar,"Arriendo pieza de forma diaria en puertas del mar, La Serena ",30000.0,La Serena,Coquimbo,Pieza diario,-29.902038574219,-71.251831054688,15-02-2023
0,https://www.facebook.com/marketplace/item/552075293545526/?ref=search&referral_code=null&referral_story_type=post&tracking=browse_serp%3A9c1d485e-9f13-46df-93b4-85424b7b3d41,Fernanda Varas,"Caba침a disponible con dos habitaciones, 1 cama matrimonial y dos cama de 1 plaza y media.
1 ba침o
Comedor
Cocina ( Equipada)
Terreno cercado para estacionamiento 
Ubicada a metros de la playa de La Serena, a minutos del centro de la ciudad, supermercados y Mall Plaza.
M치s detalles y consultas al WhatsApp [hidden information] Ver menos",50000.0,Coquimbo,Coquimbo,Arriendo de caba침a en La Serena,-29.951477050781,-71.273803710938,15-02-2023
