,Titulo1,Titulo2,Comuna,Region,Capacidad,Camas,N_Habitaciones,Habitaciones,Baños,Tipo_Baños,Precio,lat,lon,Ubicacion,Ubides,Descripcion,Servicios,Nota,Nnota,Anfitrion,Registro,Link
0,Depto. con vista y acceso a playa La Herradura,Condo entero,Coquimbo,Región de Coquimbo,4,3,2, Habitación,2,privado,35.0,-29.981,-71.3508,"https://maps.google.com/maps?ll=-29.981,-71.3508&z=14&t=m&hl=es&gl=CL&mapclient=apiv3",,"Departamento en piso 9 equipado para 4 personas, con puerta de acceso directo a una de las playas más hermosas de Chile, ""La Herradura"" y de aguas tranquilas. Además, a 10 Km. se encuentra la ciudad de La Serena  y en los alrededores podrás disfrutar  del Valle de Elqui a 70 Km.
La piscina se encuentra abierta generalmente entre diciembre y febrero. (Los Lunes cerrado) Durante el resto del año, en general, está cerrada. Sugiero a mis huéspedes que le guste la playa más que solo piscina.


El departamento está completamente equipado para 4 personas y cuenta con vista hermosa al mar. Tiene 2 dormitorios y 2 baños. El condominio tiene acceso directo a la playa. Cuenta, además, con piscina (no muy grande) el cual se deben respetar las reglas que establece el condominio y cuenta con estacionamiento gratuito. La piscina en general se encuentra habilitada para el baño en temporada de verano y cerrada el resto del año por frío. Será abierta en el verano 2023 pero, dependiendo de las circunstancias podrían haber aforos máximos y cumplir las exigencias del condominio. No es una piscina muy grande por lo que sugiero que mis huéspedes prefieran playa más que piscina.","['Acceso a la playa', 'Frente a la playa']",4.93,91,María Luisa,07-2017,https://www.airbnb.cl/rooms/19876363?adults=1&children=0&infants=0&pets=0&check_in=2023-03-09&check_out=2023-03-15&previous_page_section_name=1000&federated_search_id=5c1f3522-f23f-4fc3-815d-8282c96fc496
1,Maravilloso Departamento con SPA Frente al Mar.,Vivienda rentada entero,Coquimbo,Región de Coquimbo,6,5,2, Habitación,2,privado,95.0,-29.9825,-71.3522,"https://maps.google.com/maps?ll=-29.9825,-71.3522&z=14&t=m&hl=es&gl=CL&mapclient=apiv3",,"Arriendo precioso Departamento con SPA en Condominio Costa Herradura de Coquimbo.
Se ubica en Primera Linea Costera, piso 6, JUSTO FRENTE AL MAR equipado completamente con todo lo necesario para darse unos merecidos días de descanso. Tiene en la azotea un SPA con instalaciones gratuitas de Baños de Vapor, Sauna, Gimnasio y ademas un Jacuzzi panorámico a bajo costo con vista al mar y las estrellas, previa reserva
Cuenta ademas con una hermosa Piscina, Quinchos y acceso directo a la Playa.


Este departamento es nuevo y de alta calidad, se ubica en la mejor playa de Coquimbo, es como estár en la playa misma. El sector es bastante bueno, se puede caminar de noche y día sin preocupaciones, no hay saturación vehicular, hay buenos restaurantes cerca, lugares de esparcimiento, muy buena conectividad, los jardines del condominio son hermosos e incluso se pueden practicar deportes náuticos ya que el mar es muy tranquilo. En el edificio se alquilan Kayaks para salir a navegar durante el día con precios especiales para huéspedes. En suma, es un paraíso.","['Acceso a la playa', 'Frente a la playa']",4.85,153,Isabel,09-2018,https://www.airbnb.cl/rooms/23963186?adults=1&children=0&infants=0&pets=0&check_in=2023-03-01&check_out=2023-03-06&previous_page_section_name=1000&federated_search_id=5c1f3522-f23f-4fc3-815d-8282c96fc496
2,★ Primer Piso Primera Línea al lado de la Playa! ★,Condo entero,Puerto Velero,Coquimbo,8,7,3, Habitación,2,privado,105.333,-30.2408,-71.4765,"https://maps.google.com/maps?ll=-30.2408,-71.4765&z=14&t=m&hl=es&gl=CL&mapclient=apiv3",,"Probablemente el mejor (o uno de los mejores) departamento en todo Puerto Velero. La mejor ubicación, Primera Línea y Primer Piso! A menos de 50 metros de la playa con bajada directa, la mejor vista,  amplio jardín privado, terraza, hamaca, reposeras. Departamento amplio y equipado para disfrutar de unas vacaciones inolvidables. Sencillamente un estándar superior a otros departamentos de Puerto Velero!


✓Exclusivo departamento ✓ Primer piso ✓Primera Línea ✓La mejor vista despejada ✓Jardín privado amplio ✓Acceso directo a la playa a pasos de distancia ✓Completamente remodelado y equipado ✓ Espacioso living comedor, cocina, terraza ✓Todas las habitaciones incluyendo cocina con vista al mar, la playa Socos y la península de Tongoy ✓Cuenta con 3 dormitorios y 2 baños ✓No hay camas en comedor, living ni sofá-camas ✓Estacionamiento privado con toldo incluido ✓Disfrutarás del departamento completo.

✓Reposeras ✓Hamaca ✓Mesa de terraza ✓Wifi gratuito ✓2 Smart TV's LED con TV-Cable ✓Máquina Nespresso ✓3 Estufas Eléctricas ✓Ventanas Termopanel ✓Cocina amplia y equipada ✓Lava Vajillas ✓Horno eléctrico ✓Microondas ✓Lavadora/Secadora  ✓Plancha ✓Secador de pelo.

SIN CARGO ""TARIFA POR SERVICIO"": A diferencia de otras publicaciones nosotros no cobramos ""Tarifa por servicio"". Te invitamos a comparar el costo total.","['Acceso a playa Público o compartido', 'Frente a la playa']",4.82,17,Daniel,11-2017,https://www.airbnb.cl/rooms/48301966?adults=1&children=0&infants=0&pets=0&check_in=2023-04-16&check_out=2023-04-21&previous_page_section_name=1000&federated_search_id=5c1f3522-f23f-4fc3-815d-8282c96fc496
3,"Departamento 2b,2d. A una cuadra de la Playa.",Condo entero,Coquimbo,Chile,5,4,2, Habitación,2,privado,40.0,-29.94756,-71.28918,"https://maps.google.com/maps?ll=-29.94756,-71.28918&z=14&t=m&hl=es&gl=CL&mapclient=apiv3",,"Departamento hasta  5 personas. Dos piezas, dos baños, cocina cerrada, internet Wifi. Estacionamiento techado. A una cuadra de la playa, y del Casino de Coquimbo. Vista a bahía de Coquimbo (ver fotos). No incluye toallas, solo tv abierta y Amazon prime.
Check in 16:00 check out 12:00","['Acceso a playa Público o compartido', 'Frente a la playa']",4.96,49,Eduardo,04-2017,https://www.airbnb.cl/rooms/51308688?adults=1&children=0&infants=0&pets=0&check_in=2023-03-19&check_out=2023-03-24&previous_page_section_name=1000&federated_search_id=5c1f3522-f23f-4fc3-815d-8282c96fc496
4,La Serena maravillas de Chile,Condo entero,La Serena,Región de Coquimbo,4,6,3, Habitación,2,privado,28.0,-29.89289,-71.25107,"https://maps.google.com/maps?ll=-29.89289,-71.25107&z=14&t=m&hl=es&gl=CL&mapclient=apiv3",,"El depto tiene cerca dos supermercados y esta cinco minuto en auto a la costanera Av del mar, donde encontrarás restaurantes ,bares y paseos en  bicicletas, condominio con seguridad 24 hrs y estacionamiento privado, y bastante locomoción.

El espacio
Tres dormitorios, dos baños cocina americana equipada  balcón, lugar tranquilo.Terraza con vista a la horizonte con puesta de sol.",['Cocina'],4.51,69,Marcelo,06-2018,https://www.airbnb.cl/rooms/25921153?adults=1&children=0&infants=0&pets=0&check_in=2023-03-01&check_out=2023-03-06&previous_page_section_name=1000&federated_search_id=5c1f3522-f23f-4fc3-815d-8282c96fc496
5,"♥ Tu Destino, Tu Vista, Tu SPA ☀",Vivienda rentada entero,Coquimbo,Región de Coquimbo,4,3,2, Habitación,2,privado,86.0,-29.9825,-71.3522,"https://maps.google.com/maps?ll=-29.9825,-71.3522&z=14&t=m&hl=es&gl=CL&mapclient=apiv3",,"Nuestros huéspedes lo dicen: Es el lugar perfecto para vacaciones o escapes de la ciudad ☀.
Te ofrecemos un lugar Nuevo e Impecable, con una Vista infinita al mar, Spa,  Acceso directo a la playa, Piscina, ¡y mucho más!
Tendrás 2 habitaciones, 2 baños completos, cocina full-equipada, TV cable, HBO Max, Wifi, Audio bluetooth, Libros y  más. ¡Nuestra hospitalidad hará que te sientas como en casa!. 
Nos encargaremos de que tu experiencia sea increíble y garantizamos que vas a volver a visitarnos ♥.


Completamente equipado (utensilios de cocina, ollas, vajilla, cubiertos, vasos, copas, ... ¡todo lo que imaginas! ).
Incluye sistema de sonido portátil Bose (bluetooth), WiFi de alta velocidad y calidad, HBO Max, TV cable, libros, revistas, 1 silla de playa, sombrilla y mucho más. ¿Necesitas algo adicional? ¡Consúltanos y veremos cómo ayudarte!","['Acceso a la playa', 'Frente a la playa']",4.98,128,Carlos,06-2017,https://www.airbnb.cl/rooms/19311735?adults=1&children=0&infants=0&pets=0&check_in=2023-03-01&check_out=2023-03-06&previous_page_section_name=1000&federated_search_id=5c1f3522-f23f-4fc3-815d-8282c96fc496
6,Departamento en La Serena,Vivienda rentada entero,La Serena,Coquimbo,5,4,2, Habitación,2,privado,37.26,-29.9485,-71.2495,"https://maps.google.com/maps?ll=-29.9485,-71.2495&z=14&t=m&hl=es&gl=CL&mapclient=apiv3",,"El departamento se encuentra en una zona acomodada de La Serena, cuenta con guardias 24/7 con control de acceso vehicular, lo que hace el entorno muy seguro para alojar y salir a disfrutar tranquilos. Su ubicación permite locomoción directamente fuera del portón. Si tienes vehículo, estás a 10 minutos de la Avenida del Mar. Si deseas caminar, te permite acceso a supermercados, negocios locales y farmacias en pocos minutos. 
Usted y su familia disfrutarán este alojamiento!


Es un condominio de departamentos de 4 pisos con distintas torres, ubicado en una zona acomodada de La Serena llamado El Milagro. No cuenta con ascensor.",['Acceso la playa Público o compartido'],,,Brayan,02-2020,https://www.airbnb.cl/rooms/821047974681555704?adults=1&children=0&infants=0&pets=0&check_in=2023-03-01&check_out=2023-03-07&previous_page_section_name=1000&federated_search_id=5c1f3522-f23f-4fc3-815d-8282c96fc496
7,☼ Primer Piso Primera Línea al lado de la Playa! ☼,Condo entero,Puerto Velero,Coquimbo,5,4,2, Habitación,2,privado,96.278,-30.2411,-71.4767,"https://maps.google.com/maps?ll=-30.2411,-71.4767&z=14&t=m&hl=es&gl=CL&mapclient=apiv3",,"Probablemente el mejor departamento en todo Puerto Velero. La mejor ubicación, Primera Línea y Primer Piso! A menos de 50 metros de la playa con bajada directa, la mejor vista,  amplio jardín privado, terraza, hamaca, reposeras. Departamento amplio y equipado para disfrutar de unas vacaciones inolvidables. Sencillamente un estándar superior a otros departamentos de Puerto Velero!


✓Exclusivo departamento ✓ Primer piso ✓Primera Línea ✓La mejor vista despejada ✓Jardín privado amplio ✓Acceso directo a la playa a pasos de distancia ✓Completamente remodelado y equipado ✓ Espacioso living comedor, cocina, terraza ✓Todas las habitaciones incluyendo cocina con vista al mar, la playa Socos y la península de Tongoy ✓Cuenta con 2 dormitorios y 2 baños ✓No hay camas en comedor, living ni sofá-camas ✓Estacionamiento privado con toldo incluido ✓Disfrutarás del departamento completo.

✓Reposeras ✓Hamaca ✓Mesa de terraza ✓Wifi gratuito ✓2 Smart TV's LED con TV-Cable ✓Máquina Nespresso ✓3 Estufas Eléctricas ✓Ventanas Termopanel ✓Cocina Equipada ✓Lava Vajillas ✓Horno eléctrico ✓Microondas ✓Lavadora/Secadora  ✓Plancha ✓Secador de pelo.

IMPORTANTE: Este arriendo para 5 o menos huéspedes no tendrá disponible una de las habitaciones extra que tiene (permanecerá cerrada). Consulte la posibilidad de agregar una habitación adicional para 3 personas por un cargo extra (Para 8 personas en total).

SIN CARGO ""TARIFA POR SERVICIO"": A diferencia de otras publicaciones nosotros no cobramos ""Tarifa por servicio"". Te invitamos a comparar el costo total.","['Acceso a la playa', 'Frente a la playa']",5.0,27,Daniel,11-2017,https://www.airbnb.cl/rooms/49547795?adults=1&children=0&infants=0&pets=0&check_in=2023-04-16&check_out=2023-04-21&previous_page_section_name=1000&federated_search_id=5c1f3522-f23f-4fc3-815d-8282c96fc496
8,Hermoso dpa a una cuadra de la playa vistas al mar,Vivienda rentada entero,La Serena,Coquimbo,5,4,3, Habitación,2,privado,60.0,-29.92163,-71.27359,"https://maps.google.com/maps?ll=-29.92163,-71.27359&z=14&t=m&hl=es&gl=CL&mapclient=apiv3",,"Departamento a una cuadra de Avenida del Mar.

El espacio
Cómodo departamento, equipado para 5 personas, a solo una cuadra de Av. del Mar. Muy bien ubicado, cuenta con estacionamiento, Internet, televisor y vista al mar.",['Costa'],4.96,27,Javi,11-2019,https://www.airbnb.cl/rooms/47022556?adults=1&children=0&infants=0&pets=0&check_in=2023-03-01&check_out=2023-03-06&previous_page_section_name=1000&federated_search_id=5c1f3522-f23f-4fc3-815d-8282c96fc496
9,Pulcro y luminoso departamento en Avenida Pacífico,Vivienda rentada entero,La Serena,Región de Coquimbo,5,4,2, Habitación,2,privado,45.0,-29.9312,-71.2784,"https://maps.google.com/maps?ll=-29.9312,-71.2784&z=14&t=m&hl=es&gl=CL&mapclient=apiv3",,"55 metros cuadrados con un lindo balcón. Ubicado a pasos de 4 esquinas y de la avenida del mar. Encontrarás diversión y tranquilidad a la vez.

Departamento full equipado  y pensado para que no te falte nada durante la estadía. Cuenta con mallas de seguridad en balcón y ventanas. Puedo habilitar cuna para bebé. 

Nota: la piscina y quincho están sujetos a disponibilidad según mantenciones y reparaciones.


El edificio tiene 8 pisos y el departamento está en el piso 6. Caminando se encuentra a 4 minutos de la playa (avenida del mar / 4 esquinas). Ideal para familias, parejas o viajes de trabajo. Cuenta con tv con cable, wifi, lavadora, entre otros.",['Acceso a la playa'],4.95,164,Ian,12-2016,https://www.airbnb.cl/rooms/16837837?adults=1&children=0&infants=0&pets=0&check_in=2023-03-01&check_out=2023-03-07&previous_page_section_name=1000&federated_search_id=5c1f3522-f23f-4fc3-815d-8282c96fc496
10,Departamento La Serena Excelente Ubicación,Vivienda rentada entero,La Serena,Coquimbo,5,4,2, Habitación,2,privado,46.0,-29.92163,-71.27461,"https://maps.google.com/maps?ll=-29.92163,-71.27461&z=14&t=m&hl=es&gl=CL&mapclient=apiv3",,"Lindo departamento en octavo piso en sector de playa cuatro esquinas.  Completamente equipado para 5 personas.  A una cuadra de la Playa en tranquilo sector. Condominio con piscina, quinchos, sala de lavandería,  ascensores.",['Acceso a la playa'],4.80,5,Elqui Advisers,01-2019,https://www.airbnb.cl/rooms/53817135?adults=1&children=0&infants=0&pets=0&check_in=2023-03-13&check_out=2023-03-19&previous_page_section_name=1000&federated_search_id=5c1f3522-f23f-4fc3-815d-8282c96fc496
11,Depto de 2piezas matrimoniales muy cercano a playa,Vivienda rentada entero,La Serena,Coquimbo,4,2,2, Habitación,2,privado,49.4,-29.92123,-71.27503,"https://maps.google.com/maps?ll=-29.92123,-71.27503&z=14&t=m&hl=es&gl=CL&mapclient=apiv3",,"Departamento completamente equipado, a sólo 1 cuadra la avenida del mar. Inmejorable ubicación, cerca de la playa pero a la vez muy tranquilo. Dos piezas equipadas con camas dobles (una de 2 plazas en pieza principal, y una tamaño full en segunda pieza). 
Cuenta con televisión, microondas, plancha, secador de pelo, calefactor, lavadora y parrilla eléctrica. 
Equipado para un máximo de 4 personas.
Ubicado en un 4tp piso, en edificio de 10 pisos con ascensor. Vista al norte


Hermoso departamento, con todo lo necesario para una cómoda estadía (parrilla eléctrica, plancha, secador de pelo, microondas, wifi, netflix, zapping tv).
A sólo una cuadra de la playa, cercano a restaurantes, bares, cafés. Muy tranquilo en las noches para un buen descanso.",['Acceso la playa Público o compartido'],4.96,72,Alicia,04-2013,https://www.airbnb.cl/rooms/45690885?adults=1&children=0&infants=0&pets=0&check_in=2023-03-01&check_out=2023-03-06&previous_page_section_name=1000&federated_search_id=5c1f3522-f23f-4fc3-815d-8282c96fc496
12,EXCELENTE depto en Los Molles - Frente a PLAYA,Condo entero,Los Molles,Valparaíso,7,5,3, Habitación,2,privado,60.872,-32.23927,-71.51551,"https://maps.google.com/maps?ll=-32.23927,-71.51551&z=14&t=m&hl=es&gl=CL&mapclient=apiv3",,"Departamento en ""Bordemar Los Molles""

3 Dormitorios + 2 baños (80 mts2)

Capacidad 7 personas

Terraza con vista al mar (PISO 4 sin ascensor)

TV Cable

Piscina

A 20 mts de la playa

Estacionamiento INCLUIDO

Arrienda dueño

**Valor arriendo NO INCLUYE sabanas ni toallas","['Acceso a la playa', 'Frente a la playa']",4.80,35,Daniel,01-2018,https://www.airbnb.cl/rooms/52399435?adults=1&children=0&infants=0&pets=0&check_in=2023-03-06&check_out=2023-03-11&previous_page_section_name=1000&federated_search_id=5c1f3522-f23f-4fc3-815d-8282c96fc496
13,The Sunset Station / Depto. Vista Frontal Mar,Vivienda rentada entero,La Serena,Región de Coquimbo,4,3,2, Habitación,2,privado,79.0,-29.90674,-71.27464,"https://maps.google.com/maps?ll=-29.90674,-71.27464&z=14&t=m&hl=es&gl=CL&mapclient=apiv3",,"Este hermoso apartamento frente a la playa se encuentra en el séptimo piso y tiene una vista privilegiada de la playa. Es el lugar perfecto para parejas o una familia de 4 personas.  Desde el balcón que da a la playa se puede ver Coquimbo al sur y al norte el famoso hito de esta ciudad, su faro. Desde la parte posterior del piso se puede ver la ciudad y las montañas en el Valle de Elqui.


La forma en que se ha decorado este piso está en línea con su entorno natural y es minimalista. La ubicación es ideal. Además de estar justo en la playa, está muy cerca del centro de la ciudad, parques, supermercados y el centro comercial. El aeropuerto está a solo 20 minutos en coche y se puede organizar el traslado.","['Acceso a la playa', 'Frente a la playa']",4.88,25,Silvana,03-2019,https://www.airbnb.cl/rooms/32818388?adults=1&children=0&infants=0&pets=0&check_in=2023-03-06&check_out=2023-03-11&previous_page_section_name=1000&federated_search_id=5c1f3522-f23f-4fc3-815d-8282c96fc496
14,"Cómodo Depto con Piscina, Terraza y quincho !!!",Vivienda rentada entero,La Serena,Coquimbo,7,5,3, Habitación,2,privado,50.0,-29.8989,-71.26821,"https://maps.google.com/maps?ll=-29.8989,-71.26821&z=14&t=m&hl=es&gl=CL&mapclient=apiv3",,"Lindo y cómodo departamento ubicado en condominio sector Laguna del mar, 3 habitaciones, 2 baños, estacionamiento, terraza, lavadora-secadora, Smart tv Qled, Wifi, Directv go, y todas las comodidades de tu hogar,

Además el condominio cuenta con zona de quinchos, zona de juegos, piscina y zona para deporte  !!!


Departamento central, lugar muy tranquilo, cerca de la playa sector el faro, restoranes, supermercados, centro de comercio, mall puertas del mar, mall plaza la Serena y más","['Acceso a playa Público o compartido', 'Frente a la playa']",4.83,6,Mario,01-2019,https://www.airbnb.cl/rooms/54000711?adults=1&children=0&infants=0&pets=0&check_in=2023-03-07&check_out=2023-03-13&previous_page_section_name=1000&federated_search_id=5c1f3522-f23f-4fc3-815d-8282c96fc496
15,Ubicación genial en 4 esquinas. A pasos del mar,Condo entero,La Serena,Coquimbo,6,5,3, Habitación,2,privado,73.0,-29.92386,-71.2742,"https://maps.google.com/maps?ll=-29.92386,-71.2742&z=14&t=m&hl=es&gl=CL&mapclient=apiv3",,"Amplio y cómodo Depto. de 3 dormitorios y 2 baños, ubicado en el sector de 4 esquinas, a  una cuadra y media de la playa.

Ubicación fantástica, cercana a servicios de turismo, gastronomía, entretenimiento y comercio, entre otras cosas

Hay wifi y TV cable. 
Smart TV en dos dormitorios y en el living. 
1 Estacionamiento privado dentro del complejo. También hay piscina, quinchos y sala de juegos (taca taca/ping pong).
3er piso.
Opción de arrendar sábanas si no viajas con ellas


El departamento está ubicado en el tercer piso de un condominio nuevo y con lindo diseño. Queda cerca de todo lo que necesitas para pasar agradables días de descanso (comercio, restaurantes y lugares de interés). El lugar está muy cerca de la playa, puedes ir caminando y te tomará 3 minutos.
El conjunto residencial tiene áreas verdes, quinchos techados y bien delimitados, piscina y juegos infantiles.
La decoración del departamento es minimalista y es realmente muy confortable.",['Acceso a la playa'],4.68,19,Macarena,03-2018,https://www.airbnb.cl/rooms/52528292?adults=1&children=0&infants=0&pets=0&check_in=2023-03-01&check_out=2023-03-06&previous_page_section_name=1000&federated_search_id=5c1f3522-f23f-4fc3-815d-8282c96fc496
16,"☀1era Línea 1er Piso con Piscina, Jardín y Playa!☀",Vivienda rentada entero,Puerto Velero,Coquimbo,7,6,2, Habitación,2,privado,90.551,-30.2424,-71.4753,"https://maps.google.com/maps?ll=-30.2424,-71.4753&z=14&t=m&hl=es&gl=CL&mapclient=apiv3",,"Uno de los mejores departamentos en todo Puerto Velero. La mejor ubicación, Primera Línea y Primer Piso! Recién remodelado con espectacular Piscina a 30 metros y bajada directa a la Playa que está a 120 mts!  la mejor vista,  amplio jardín (ideal niños), terraza, reposeras. Departamento amplio y equipado para disfrutar de unas vacaciones inolvidables. Sencillamente un estándar superior a otros departamentos de Puerto Velero!


✓Exclusivo departamento ✓ Primer piso ✓Primera Línea ✓La mejor vista despejada ✓Jardín amplio ✓Acceso directo a piscina y playa a pasos de distancia ✓Recién remodelado y totalmente equipado ✓ Espacioso living comedor y terraza  ✓Increíble vista al mar, la playa Socos y la península de Tongoy ✓Cuenta con 2 dormitorios y 2 baños ✓No hay camas en comedor, living ni sofá-camas ✓Estacionamiento privado ✓Disfrutarás del departamento completo.

✓Reposeras ✓Mesa de terraza ✓Wifi gratuito ✓2 Smart TV's LED con TV-Cable ✓Máquina Nespresso ✓3 Estufas Eléctricas ✓Ventanas Termopanel PVC nuevas ✓Moderna Cocina equipadísima ✓Lava Vajillas ✓Horno eléctrico ✓Microondas ✓Lavadora/Secadora  ✓Plancha ✓Secador de pelo.


SIN CARGO ""TARIFA POR SERVICIO"": A diferencia de otras publicaciones nosotros no cobramos ""Tarifa por servicio"". Te invitamos a comparar el costo total.","['Acceso a la playa', 'Frente a la playa']",5.0,9,Daniel,11-2017,https://www.airbnb.cl/rooms/642412048765613150?adults=1&children=0&infants=0&pets=0&check_in=2023-04-09&check_out=2023-04-14&previous_page_section_name=1000&federated_search_id=5c1f3522-f23f-4fc3-815d-8282c96fc496
17,La Serena Vista al Mar ubicación privilegiada!,Condo entero,La Serena,Coquimbo,5,4,2, Habitación,2,privado,46.607,-29.92449,-71.2745,"https://maps.google.com/maps?ll=-29.92449,-71.2745&z=14&t=m&hl=es&gl=CL&mapclient=apiv3",,"Descuento x Semana!
Excelente departamento, ubicación privilegiada a una cuadra de la playa. Avenida cuatro esquinas.
Cercano a Pubs, Restaurantes, Almacenes y Comercio.
Malla de Seg.
Condominio cuenta con piscina-6 quinchos-Lavanderia.
1 estacionamiento gratis en el recinto
2 Smart TV
Apto fumadores en Terraza
Esterillas Playa
Quitasol
Por Covid no se considera toallas personales y de cocina.
Internet-Wifi.
Tu estadía es una ocasión especial, coméntanos y lo hacemos para ti, con costo extra.


Cómodo y acogedor.
Malla de Seguridad 
10Min a Terminal de buses.
18Min Aeropuerto La Florida
10Min Lider","['Acceso a la playa', 'Frente a la playa']",4.93,43,Dylan Axl,11-2020,https://www.airbnb.cl/rooms/46536518?adults=1&children=0&infants=0&pets=0&check_in=2023-03-05&check_out=2023-03-10&previous_page_section_name=1000&federated_search_id=5c1f3522-f23f-4fc3-815d-8282c96fc496
18,Acogedor depto en Los Molles - Frente a Playa,Condo entero,Los Molles,Región de Valparaíso,6,5,3, Habitación,2,privado,65.0,-32.2368,-71.5121,"https://maps.google.com/maps?ll=-32.2368,-71.5121&z=14&t=m&hl=es&gl=CL&mapclient=apiv3",,"Depto en Los Molles - Vista Al Mar (frente a La Playa)

 Departamento en CONDOMINIO  ""Bordemar Los Molles"" 

En el piso 3 (edificio sin ascensor)

3 Dormitorios + 2 baños (80 mts2) 

Capacidad 6 personas 

Terraza con vista al mar 

Piscina 

A 20 mts de la playa 

1 estacionamiento INCLUIDO

TV Cable

WIFI (ilimitado)

*No se incluye sábanas ni toallas


Ambiente acogedor y familiar. 
Full equipado para un excelente descanso.
Ubicado en excelente condominio
Acceso a la playa caminando
A pasos de restaurantes y locales comerciales","['Acceso a la playa', 'Frente a la playa']",4.77,135,Daniel,01-2018,https://www.airbnb.cl/rooms/22832183?adults=1&children=0&infants=0&pets=0&check_in=2023-03-04&check_out=2023-03-09&previous_page_section_name=1000&federated_search_id=02edc087-51d6-49a4-a947-2beb9d26a1c7
19,Depto 4 Esquinas Playa /Pubs/WIFI / TV 6 Personas,Vivienda rentada entero,La Serena,Región de Coquimbo,5,5,2, Habitación,2,privado,49.157,-29.93202,-71.27764,"https://maps.google.com/maps?ll=-29.93202,-71.27764&z=14&t=m&hl=es&gl=CL&mapclient=apiv3",,"El departamento esta en el sector 4 esquinas entre el faro y el casino Enjoy y ofrece alojamiento con terraza, wifi gratis y recepción 24 horas, dispone de piscina privada, quincho, jardín y estacionamiento privado gratuito. Tiene 2 dormitorios, 2TV de pantalla plana , cocina equipada con microondas y heladera, lavarropas,  2 baños con ducha  y parque infantil. Esta a 5 minutos caminado de la playa peñuelas y playa 4 esquinas. En el sector hay pubs y restaurant como también una feria artesanal.


40m2","['Acceso a la playa', 'Frente a la playa']",4.72,71,Rodrigo,04-2016,https://www.airbnb.cl/rooms/38601504?adults=1&children=0&infants=0&pets=0&check_in=2023-03-01&check_out=2023-03-07&previous_page_section_name=1000&federated_search_id=02edc087-51d6-49a4-a947-2beb9d26a1c7
