,Titulo1,Titulo2,Comuna,Region,Capacidad,Camas,N_Habitaciones,Habitaciones,Baños,Tipo_Baños,Precio,lat,lon,Ubicacion,Ubides,Descripcion,Servicios,Nota,Nnota,Anfitrion,Registro,Link
96,Casa de diseño a pasos de la playa WIFI,Alojamiento entero,Los Molles,Valparaíso,8,7,3, Habitación,2,privado,118.0,-32.24044,-71.51468,"https://maps.google.com/maps?ll=-32.24044,-71.51468&z=14&t=m&hl=es&gl=CL&mapclient=apiv3",,"Vista panorámica a la playa y el mar, 3 dormitorios, 2 baños, para 8 personas. Gran arquitectura, destacada en publicaciones del ramo. 3 balcones con vista al mar y playa, incluyendo uno donde se pueden hacer asados o cenar. Columpio infantil , hamaca, parrilla. A pasos de la playa y de la Reserva el Puquén. Wifi banda ancha fibra óptica (zoom, teams).  Dos habitaciones con escritorio para teletrabajo. Tv satelital, Android TV y Blu Ray colección de películas. Equipo de audio para películas.


Hermosa casa vista al mar y la playa, 3 dormitorios, 2 baños, capacidad para 8 personas. Dos pisos, en el primero living comedor, terraza, cocina, dos dormitorios y baño. En el segundo, dormitorio con cama doble, terraza, baño en suite y espectacular vista al mar. También en el segundo piso, una terraza principal con vista al mar y a la playa, donde se pueden hacer asados, almorzar o cenar. Casa de gran arquitectura, destacada en libros del ramo y publicaciones de diseño Siete camas, una de dos plazas y seis de una plaza. Adicionalmente hay una cama nido que se puede usar para un niño 
• Columpio infantil en el patio 
• Hamaca en balcón 
• Parrilla 
• Estacionamientos 
• A pasos de la playa y de la Reserva Natural Puquén 
• TV satelital, Android TV y Blu-Ray con colección de películas. Equipo de audio para películas. Con el Android TV se pueden ver servicios de streaming como Netflix o Amazon Prime (el pasajero debe proveer la cuenta de alguna de estas plataformas) 

Wifi banda ancha fibra óptica, ideal para teletrabajar con zoom, meets o teams. Escritorio de trabajo

Hay descuentos por estadías largas 

No fumar dentro de la casa.

Hay dos habitaciones con escritorio y silla para trabajo o estudio remoto. 

Internet wifi fibra óptica.

La mesa fija del comedor es pequeña, apta para cuatro o cinco personas máximo. Adicionalmente hay una mesa armable, con bancas armables, para seis u ocho personas, que se puede disponer en el balcón del primer piso, al interior del living-comedor o en la terraza principal. 

Por protocolos COVID-19, no se proveen tollas ni sábanas, los pasajeros deben traer las propias. 

Se admiten mascotas pero bajo completa responsabilidad de sus dueños. Se debe dar aviso y dejar un depósito de 50 mil pesos por posibles daños.

La casa está justo en la zona segura para tsunamis. Si hay alarma, hay que quedarse en la casa.

Síguenos en nuestra cuenta de IG @casanave_losmolles",['Acceso la playa Público o compartido'],4.91,35,Carmen Gloria,02-2021,https://www.airbnb.cl/rooms/48315175?adults=1&children=0&infants=0&pets=0&check_in=2023-04-10&check_out=2023-04-15&previous_page_section_name=1000&federated_search_id=3c63c959-42ad-41e0-9fda-d20cfbf83bb6
97,Casa adecuada para descansar frente a Pichidangui.,Habitación privada en alojamiento,Región de Coquimbo,Chile,4,4,2, Habitación,2,privado,44.8,-32.11821,-71.5026,"https://maps.google.com/maps?ll=-32.11821,-71.5026&z=14&t=m&hl=es&gl=CL&mapclient=apiv3",,"Cabaña de dos pisos con linda vista al mar y ubicada en un condominio cercano al km 200 de la Ruta 5 Norte y a 6 min del mar, posee:
- 2° piso con dormitorio con cama matrimonial, baño con tina  y techo de vidrio, además, living -comedor-cocina americana.
- 3° piso independiente con dormitorio, cama matrimonial, techo de vidrio, baño, salita de estar,  terraza panorámica con cama de cuarzo.
-  quincho y parrilla,  estacionamiento,  jardín.
-  agua potable.
 Es atendida por su propio dueño.


Alojamiento muy acogedor y con linda vista al mar","['Acceso a playa Público o compartido', 'Frente a la playa']",4.86,50,Patricio,11-2018,https://www.airbnb.cl/rooms/36571749?adults=1&children=0&infants=0&pets=0&check_in=2023-03-01&check_out=2023-03-06&previous_page_section_name=1000&federated_search_id=3c63c959-42ad-41e0-9fda-d20cfbf83bb6
98,"Illapel, Regia cabaña C/ Tina de aguas calientes.",Cabaña entero,Illapel,Coquimbo,3,3,3, Habitación,1,privado,60.0,-31.67918,-71.25154,"https://maps.google.com/maps?ll=-31.67918,-71.25154&z=14&t=m&hl=es&gl=CL&mapclient=apiv3",,Desconecta de la rutina en este alojamiento único y relajante.,['Cocina'],4.60,5,Ary,03-2018,https://www.airbnb.cl/rooms/554891792137500505?adults=1&children=0&infants=0&pets=0&check_in=2023-03-13&check_out=2023-03-19&previous_page_section_name=1000&federated_search_id=3c63c959-42ad-41e0-9fda-d20cfbf83bb6
99,GUANAQUEROS,Alojamiento entero,Coquimbo,Chile,8,9,3, Habitación,1,privado,70.0,-30.1998,-71.416,"https://maps.google.com/maps?ll=-30.1998,-71.416&z=14&t=m&hl=es&gl=CL&mapclient=apiv3",,"Cabaña ubicada en mejor sector de Guanaqueros . Villa Villamar , condominio con acceso único , cercano a plaza juegos, a una cuadra , playa a 15 minutos caminando. 3 Piezas con un total de 7 camas distribuidas en pieza matrimonial  y piezas  con camarotes. 
Estacionamiento para 3 vehículos
 WIFI , Lavadora . 2 refrigeradores , microonda .Horno electrico  
100% Recomendable.  Columpio nuevo en el patio de la casa  ideal para niños . 
Fumigación contra arañas realizada  en septiembre.  Sin TV.",['Cocina'],4.0,5,Pablo,08-2016,https://www.airbnb.cl/rooms/40743699?adults=1&children=0&infants=0&pets=0&check_in=2023-03-02&check_out=2023-03-09&previous_page_section_name=1000&federated_search_id=3c63c959-42ad-41e0-9fda-d20cfbf83bb6
100,"Casa en La Serena, tranqulidad y cercania de todo",Alojamiento entero,La Serena,Coquimbo,4,1,2, Habitación,1,privado,25.2,-29.92984,-71.24849,"https://maps.google.com/maps?ll=-29.92984,-71.24849&z=14&t=m&hl=es&gl=CL&mapclient=apiv3",,"WiFi, antejardin, patio trasero, comedor al aire libre ,entrada para vehículo pequeño o si es más grande puedes estacionar fuera de la casa, un barrio muy tranquilo y seguro.

El espacio
2 habitaciones, 3 camas, 1 futón, living comedor, cocina, baño , patio con comesor, parrilla, huerta natural, calefont, Wifi",['Cocina'],4.79,57,Gudelia,05-2019,https://www.airbnb.cl/rooms/48380189?adults=1&children=0&infants=0&pets=0&check_in=2023-03-06&check_out=2023-03-11&previous_page_section_name=1000&federated_search_id=3c63c959-42ad-41e0-9fda-d20cfbf83bb6
101,Arriendo Casa Duplex La Serena,Alojamiento entero,La Serena,Coquimbo,4,3,2, Habitación,1,privado,35.0,-29.8896,-71.2409,"https://maps.google.com/maps?ll=-29.8896,-71.2409&z=14&t=m&hl=es&gl=CL&mapclient=apiv3",,"Relájate con toda la familia en este tranquilo lugar para quedarse. Cuenta con habitaciones comodas y equipadas. Cocina y logia amobladas y con utensilios de cocina y electricos. Para divertirse cuentan en casa con WIFI y  con SmartTV con acceso a Netflix y Prime Amazon gratis. El duplex es una casa en un segundo piso, pero con acceso a amplio patio para jugar o hacer algun asado. Se admiten mascotas. Estacionamiento privado gratis. Condominio con seguridad 24 horas, control acceso e ingreso.",['Cocina'],,,Eduardo,04-2019,https://www.airbnb.cl/rooms/824935695134006220?adults=1&children=0&infants=0&pets=0&check_in=2023-03-01&check_out=2023-03-06&previous_page_section_name=1000&federated_search_id=3c63c959-42ad-41e0-9fda-d20cfbf83bb6
102,Condominio Agua Dulce 12 personas,Alojamiento entero,Angostura,Coquimbo,12,10,4, Habitación,3,privado,230.0,-31.52133,-71.55717,"https://maps.google.com/maps?ll=-31.52133,-71.55717&z=14&t=m&hl=es&gl=CL&mapclient=apiv3",,"Disfruta tus vacaciones en una casa muy cómoda ubicada en un ambiente natural, tranquilo y con excelente vista.",['Vista a la playa'],,,Juan,04-2017,https://www.airbnb.cl/rooms/721643077798227841?adults=1&children=0&infants=0&pets=0&check_in=2023-03-01&check_out=2023-03-08&previous_page_section_name=1000&federated_search_id=3c63c959-42ad-41e0-9fda-d20cfbf83bb6
103,Casa Pisco Elqui,Habitación privada en cabaña,Paihuano,Región de Coquimbo,4,4,3, Habitación,1compartido,compartido,55.0,-30.13233,-70.49862,"https://maps.google.com/maps?ll=-30.13233,-70.49862&z=14&t=m&hl=es&gl=CL&mapclient=apiv3",,"Hermosa cabaña en sector La Aurora, en Pisco Elqui, iluminada, entorno verde, acogedora, ideal para relajarse. Sector de asado y piscina opcional. Cocina equipada.",['Cocina'],4.57,8,Camila,01-2019,https://www.airbnb.cl/rooms/31461124?adults=1&children=0&infants=0&pets=0&check_in=2023-03-06&check_out=2023-03-11&previous_page_section_name=1000&federated_search_id=3c63c959-42ad-41e0-9fda-d20cfbf83bb6
104,Cabaña N°3 excelente ubicacion en Punta de Choros,Chalé entero,Punta de Choros,Coquimbo Region,6,5,2, Habitación,1,privado,70.0,-29.24852,-71.46307,"https://maps.google.com/maps?ll=-29.24852,-71.46307&z=14&t=m&hl=es&gl=CL&mapclient=apiv3",,"Cabañas sencillas con excelente ubicación y vista al atardecer entre islas. A pasos de la playa principal, caleta y restaurantes con convenio. 
Somos nuevos anfitriones. Recibimos huéspedes con amabilidad y que nos sugieran cambios o servicios con respeto para ir mejorando cada día nuestras cabañas y dependencias. Cuentan con lo básico y los servicios extras que necesiten o equipacion estamos a disposición de ustedes. Además los orientamos en el tour a la reserva para sacar provecho a la zona.


Recuerden que contamos con 2 camarotes y una cama matrimonial. No incluimos toallas pero esto puede ser posible previa coordinación ya que comprendemos que es mejor viajar con poco equipaje. Sea respetuoso y amable. Cada cabaña cuenta con su parrilla y terraza",['Cocina'],4.53,17,Macarena,05-2018,https://www.airbnb.cl/rooms/35520468?adults=1&children=0&infants=0&pets=0&check_in=2023-03-01&check_out=2023-03-06&previous_page_section_name=1000&federated_search_id=3c63c959-42ad-41e0-9fda-d20cfbf83bb6
105,"Casa Algamar, Tongoy, Playa Blanca y Guanaqueros",Alojamiento entero,Coquimbo,Región de Coquimbo,Más de 16,22,9, Habitación,5,privado,450.0,-30.2088,-71.4788,"https://maps.google.com/maps?ll=-30.2088,-71.4788&z=14&t=m&hl=es&gl=CL&mapclient=apiv3",,"La ubicación aislada de nuestra casa la convierte en un lugar muy especial para los tiempos de verano. Se encuentra justo en una playa en una pequeña bahía, protegida del viento. La mayoría de las habitaciones dan al mar y hay varias  terrazas para el entretenimiento. Cada terraza tiene una mesa de comedor con capacidad para 24 personas y está equipada con sombrillas. También hay una zona de barbacoa con una fogata para disfrutar de las noches estrelladas del hemisferio sur. La casa tiene 20 camas y 4 aseos. Hay una sala de servicio adicional (2 camas) y aseo privado.


Nuestra casa ha sido remodelada con mucho cuidado y realmente se siente como un hogar. Con sus nueve dormitorios y alojamiento para 22 personas, es grande pero aún así se siente acogedor. Tiene una terraza increíble que ofrece vistas a un entorno prístino donde la fauna y la flora te sorprenderán. Su cocina de planta abierta y su sala de estar son ideales para entretenerse y compartir buenos momentos.
Los propietarios de la casa y del condominio se preocupan por el medio ambiente y esperan que sus huéspedes hagan lo mismo en todo momento. Es por eso que no se permiten motocicletas ni motores de ningún tipo en el condominio.","['Acceso a la playa', 'Frente a la playa']",,,Gino,04-2019,https://www.airbnb.cl/rooms/33711635?adults=1&children=0&infants=0&pets=0&check_in=2023-03-01&check_out=2023-03-08&previous_page_section_name=1000&federated_search_id=3c63c959-42ad-41e0-9fda-d20cfbf83bb6
106,Valle de Elqui. Cabañas Jardín de Estrellas. 1,Cabaña entero,Paihuano,Región de Coquimbo,6,5,2, Habitación,1,privado,110.0,-30.23374,-70.4967,"https://maps.google.com/maps?ll=-30.23374,-70.4967&z=14&t=m&hl=es&gl=CL&mapclient=apiv3",,"Hermoso entorno natural, rodeado de montañas y cielos estrellados, ideal para un buen descanso.
Cabañas totalmente equipadas.

El espacio
Espacios amplios de relajo, terraza con bellas vistas al valle y montañas.
Privacidad.
Tranquilidad.

Piscina con vistas.",['Cocina'],5.0,13,Patricia Bibiana,06-2019,https://www.airbnb.cl/rooms/38331507?adults=1&children=0&infants=0&pets=0&check_in=2023-03-01&check_out=2023-03-06&previous_page_section_name=1000&federated_search_id=3c63c959-42ad-41e0-9fda-d20cfbf83bb6
107,"PUNTA DE CHOROS Estupenda casa, maravillosa vista",Alojamiento entero,Punta de Choros,La Higuera,8,7,3, Habitación,3,privado,350.0,-29.2559,-71.4556,"https://maps.google.com/maps?ll=-29.2559,-71.4556&z=14&t=m&hl=es&gl=CL&mapclient=apiv3",,Crea recuerdos inolvidables en este alojamiento único y familiar. Tendras una experiencia unica en este lugar localizado en la reserva natural de Humboldt,"['Acceso a la playa', 'Frente a la playa']",5.0,6,Isabel,09-2017,https://www.airbnb.cl/rooms/562982356188294762?adults=1&children=0&infants=0&pets=0&check_in=2023-05-01&check_out=2023-05-06&previous_page_section_name=1000&federated_search_id=3c63c959-42ad-41e0-9fda-d20cfbf83bb6
108,Cabaña familiar de relajo,Cabaña entero,Tulahuen,Región de Coquimbo,4,3,2, Habitación,1,privado,45.0,-31.01566,-70.73249,"https://maps.google.com/maps?ll=-31.01566,-70.73249&z=14&t=m&hl=es&gl=CL&mapclient=apiv3",,Normal,['Vista a las montañas'],,,Ana Beatriz,03-2018,https://www.airbnb.cl/rooms/25785572?adults=1&children=0&infants=0&pets=0&check_in=2023-03-01&check_out=2023-03-06&previous_page_section_name=1000&federated_search_id=3c63c959-42ad-41e0-9fda-d20cfbf83bb6
109,Agradable casa a metros de playa,Alojamiento entero,Coquimbo,Chile,7,5,4, Habitación,2,privado,79.0,-29.9654,-71.305,"https://maps.google.com/maps?ll=-29.9654,-71.305&z=14&t=m&hl=es&gl=CL&mapclient=apiv3",,"Lleva a toda la familia a este fantástico lugar con muchas zonas para
divertirse a metros de la playa. Son 138 mts  de construcción con patio y estacionamiento, 4 habitaciones

El espacio
La casa esta ubicada en un condominio tranquilo a 800 mtrs de la playa, cuenta con estacionamiento para dos autos, y su living comedor es muy espacioso, en el hay piano. La cocina es amplia y bien equipada, tiene lavadero que cuenta con lavadora- secadora nueva. El patio cuenta con terraza de asados y barra de ejercicio, caja de arena para niños. La pieza matrimonial es grande, y las demás piezas son muy cómodas para una estadía placentera. El barrio es muy tranquilo y se puede compartir tranquilamente. Los esperamos",['Acceso la playa Público o compartido'],,,Marcela,04-2018,https://www.airbnb.cl/rooms/732815677547456933?adults=1&children=0&infants=0&pets=0&check_in=2023-03-01&check_out=2023-03-06&previous_page_section_name=1000&federated_search_id=3c63c959-42ad-41e0-9fda-d20cfbf83bb6
110,Casa en la península de Tongoy linda vista,Alojamiento entero,Coquimbo,Chile,14,12,5, Habitación,2,privado,150.0,-30.2554,-71.5064,"https://maps.google.com/maps?ll=-30.2554,-71.5064&z=14&t=m&hl=es&gl=CL&mapclient=apiv3",,"Arriendo hermosa casa tipo cabaña , en el hermoso balneario de Tongoy, IV región, en tranquilo sector de la isla  La casa cuenta con:  

▪ cinco habitaciones 🛏 

▪ capacidad para 14 personas 

▪ Dos baños 

▪ Agua caliente 

▪Cocina completamente equipada 

▪Tv Cable 

▪Parrilla 

▪Estacionamiento para cinco vehículos
 
▪Vista preferencial a la hermosa bahía de Tongoy",['Vista a la bahía'],,,Gabriel,10-2022,https://www.airbnb.cl/rooms/729798048075531966?adults=1&children=0&infants=0&pets=0&check_in=2023-03-01&check_out=2023-03-06&previous_page_section_name=1000&federated_search_id=3c63c959-42ad-41e0-9fda-d20cfbf83bb6
111,Casa a pocos minutos de playa La Herradura,Alojamiento entero,Coquimbo,Chile,6,5,3, Habitación,2,privado,55.0,-29.99477,-71.33696,"https://maps.google.com/maps?ll=-29.99477,-71.33696&z=14&t=m&hl=es&gl=CL&mapclient=apiv3",,"Lugar tranquilo y de amplio estacionamiento. A 5 minutos de playa La Herradura y Ruta 5. Cercano a lugares de comidas, supermercados, policlínico y camping. La casa cuenta con Wifi fibra óptica y cable TV.",['Acceso a la playa'],,,Luis,01-2022,https://www.airbnb.cl/rooms/777563721808913991?adults=1&children=0&infants=0&pets=0&check_in=2023-03-01&check_out=2023-03-06&previous_page_section_name=1000&federated_search_id=3c63c959-42ad-41e0-9fda-d20cfbf83bb6
112,Casa familiar en Tongoy,Alojamiento entero,Coquimbo,Chile,10,8,5, Habitación,2,privado,115.0,-30.2658,-71.491,"https://maps.google.com/maps?ll=-30.2658,-71.491&z=14&t=m&hl=es&gl=CL&mapclient=apiv3",,"COMODA CASA EN TONGOY ,EN EL QUE SE UBICAN LAS 6 MEJORES PLAYAS DE CHILE, UBICADA A MENOS DE 1 KILOMETRO DE SUS 3 PLAYAS PRINCIPALES Y DELOS MEJORES ATRACTIVOS TURISTICOS COMO SON LOS HUMEDALES CON AVISTAMIENTOS DE DIFERENTES TIPOS DE AVES MIGRATORIAS Y ENDEMICAS, CASA CERCANA A LOS LOCALES COMERCIALES DE GASTRONOMIA-MINIMARKET Y DE LA CALETA DONDE SE ENCUENTRAN LOS PESCADOS Y MARISCOS, SE PUEDE LLEGAR EN LOCOMOCION PUBLICA (BUS-MICROBUS -TAXI) NO INCLUYE TOALLAS.


Toda la casa a disposición  del huésped",['Vista al horizonte de la ciudad'],4.38,16,Yuliet Liana,01-2020,https://www.airbnb.cl/rooms/47002840?adults=1&children=0&infants=0&pets=0&check_in=2023-03-01&check_out=2023-03-06&previous_page_section_name=1000&federated_search_id=3c63c959-42ad-41e0-9fda-d20cfbf83bb6
113,Cabaña con Vista al Mar,Cabaña entero,La Serena,Coquimbo,7,6,3, Habitación,2,privado,80.0,-29.75611,-71.34028,"https://maps.google.com/maps?ll=-29.75611,-71.34028&z=14&t=m&hl=es&gl=CL&mapclient=apiv3",,"Ven a relajarte en bahía whale, junto con tu pareja ,amigos ,familia  y mascotas de esta increíble experiencia.
Pensado por dos médicos buceadores (PADI) , amantes del mar, podrás relajarte y lograr la desconexión total .

Recogimos muchas ideas de nuestros viajes y las quisimos compartir contigo , además de poder transmite nuestra pasión por el mar ya que la casa está ambientada en detalles rústicos y marinos . 

Por eso te invito a que disfrute de esta experiencia.


Si te gusta el contacto con el mar y la naturaleza este es Tú lugar. 

La cabaña está a aprox 15-20 minutos desde el centro de La Serena , por la Ruta 5 norte .

Nuestra cabaña lleva el nombre de Bahia Whale ya que durante los meses de Noviembre a Diciembre , comienza los avistamientos de ballenas . Por lo que perfectamente puedes estar bebiendo una cerveza , mirando el sunset y verás los ""soplos"" de las ballenas muy cerca (Te dejaremos unos binoculares para que disfrutes de su belleza) 

El espacio está conformado por :

1. Dormitorio principal con baño privado , cama de 2 plazas y una impresionante vista al mar.

2. Segundo dormitorio con camarote y dos camas de 1 plaza.

3. Tercer dormitorio con dos camas de plaza y media.

4.Baño de visita

5.Cocina amoblada y living .

TODAS las piezas tienen vista al mar , se entrega ropa de cama y toallas. 

La terraza es amplia y se conecta directamente con las rocas del lugar  , existe una hamaca para más comodidad y sillas para que puedas tomas mucho sol.",['Vista a la playa'],4.79,14,Javier,04-2016,https://www.airbnb.cl/rooms/53250224?adults=1&children=0&infants=0&pets=0&check_in=2023-06-01&check_out=2023-06-06&previous_page_section_name=1000&federated_search_id=5bb894fd-531d-4cce-90b3-77dd2b9f89b6
114,CASA BAHÍA AZUL PRIMERA LÍNEA PISCINA VISTA AL MAR,Alojamiento entero,Los Vilos,Coquimbo,8,6,4, Habitación,3,privado,265.0,-32.00202,-71.51756,"https://maps.google.com/maps?ll=-32.00202,-71.51756&z=14&t=m&hl=es&gl=CL&mapclient=apiv3",,"Para disfrutar en familia, casa remodelada en 2021 con nobles maderas, construcción 200 mt., terreno de 7.000 mt. con más de 100 mt. de terrazas.
Tiene una capacidad para 8 personas con: 1 dorm. ppal. en suite, 2 dorm. con 2 camas habilitadas c/u, 1 dorm. en suite en 2do piso y 3 baños completos.
Living en doble altura y chimenea (Bosca). Comedor con gran cocina (inducción y gas) integrada.
Piscina de 18 mt. de largo, amplio quincho en obra, fogón, mirador en acantilado y bajada al mar.","['Acceso a playa Público o compartido', 'Frente a la playa']",4.94,16,Constanza,01-2022,https://www.airbnb.cl/rooms/54159064?adults=1&children=0&infants=0&pets=0&check_in=2023-03-01&check_out=2023-03-07&previous_page_section_name=1000&federated_search_id=5bb894fd-531d-4cce-90b3-77dd2b9f89b6
115,Hermosa casa a 100 m de playa y 5 min de Enjoy,Alojamiento entero,La Serena,Coquimbo Region,10,7,4, Habitación,2,privado,145.0,-29.94297,-71.28735,"https://maps.google.com/maps?ll=-29.94297,-71.28735&z=14&t=m&hl=es&gl=CL&mapclient=apiv3",,"Cornely 2 es una propiedad Pet Friendly que se encuentra ubicada en un sector privilegiado, tranquilo y su cercano a la playa. En tan solo 2 minutos caminando podrás llegar a la playa, donde podrás disfrutar un hermoso entorno. En Cornely 2 podrás disfrutar del sol en el amplio jardín trasero que cuenta con quincho y todo tener una linda tarde. 
Cercano a nuestra propiedad podrás encontrar arriendo de bicicletas, ferias con food truck, ferias estivales y a pocos metros el casino Enjoy.


La casa cuenta con 4 dormitorios con closet.

2 dormitorios con cama matrimonial y amplio closet.

El tercer dormitorio cuenta con 1 cama de una plaza  y un camarote con 2 camas de 1 plaza.  

El cuarto dormitorio consta con 2 camas de una plaza. 

La casa cuenta con 2 baños, ambos con tina y duchas. 

Las camas cuentas con almohadas, frazadas y cobertores (las sabanas tienen un costo adicional). La cocina esta equipada con refrigerador, hervidor, microondas, tostadora, horno y cocina, ollas, sartenes, vasos, vajillas, platos, tazas.

La propiedad cuenta con un hermoso y amplio patio trasero, el cual cuenta con un quincho para asados y un comedor para disfrutar con los seres queridos. Además de un amplio espacio con plantas y pasto para poder jugar y disfrutar del sol.",['Costa'],5.0,3,Alejandra,01-2018,https://www.airbnb.cl/rooms/36674730?adults=1&children=0&infants=0&pets=0&check_in=2023-03-01&check_out=2023-03-06&previous_page_section_name=1000&federated_search_id=5bb894fd-531d-4cce-90b3-77dd2b9f89b6
116,Depto Laguna Del Mar La Serena 3 Dorm Amplio,Alojamiento entero,La Serena,Coquimbo,6,5,3, Habitación,2,privado,105.0,-29.8994,-71.2705,"https://maps.google.com/maps?ll=-29.8994,-71.2705&z=14&t=m&hl=es&gl=CL&mapclient=apiv3",,"Departamento ubicado en resort Laguna del Mar 
ideal para viajes en familia habilitado para 6 personas cómodamente.
El Dpto cuenta con 3 dorm. 2 baño, ropa de cama y sábanas 2 TV de pantalla plana, equipo de música, comedor y cocina totalmente equipada, balcón con vista a la laguna y mar, quinchos al aire libre, lavandería, 2 estacionamientos gratuitos.
Salida directa al Mar. 
 Maravilloso entorno,  jardines 3 piscinas habilitadas y laguna navegable


Cómodamente equipado",['Acceso a la playa'],4.80,5,Lissette,05-2018,https://www.airbnb.cl/rooms/671848940158414029?adults=1&children=0&infants=0&pets=0&check_in=2023-03-01&check_out=2023-03-06&previous_page_section_name=1000&federated_search_id=5bb894fd-531d-4cce-90b3-77dd2b9f89b6
117,Casa de piedra los Molles,Alojamiento entero,Los Molles,Región de Valparaíso,4,2,2, Habitación,2,privado,70.0,-32.23643,-71.51801,"https://maps.google.com/maps?ll=-32.23643,-71.51801&z=14&t=m&hl=es&gl=CL&mapclient=apiv3",,"La casa se ubica en un barrio privilegiado de los Molles, tranquilo y seguro.

Acceso de los huéspedes
La propiedad tiene dos casa que son independientes pero tienen una misma entrada.",['Costa'],4.67,3,Silvana,03-2016,https://www.airbnb.cl/rooms/31265736?adults=1&children=0&infants=0&pets=0&check_in=2023-03-03&check_out=2023-03-09&previous_page_section_name=1000&federated_search_id=5bb894fd-531d-4cce-90b3-77dd2b9f89b6
118,Casa en condominio en La Serena,Alojamiento entero,La Serena,Coquimbo,6,3,3, Habitación,"2,5",privado,77.6,-29.9436,-71.2688,"https://maps.google.com/maps?ll=-29.9436,-71.2688&z=14&t=m&hl=es&gl=CL&mapclient=apiv3",,"Hermosa casa en condominio tranquilo y seguro para la familia en La Serena. Excelente ubicación a dos cuadras de supermercado, bomba de bencina, farmacia y acceso a Regimiento Arica con bajada a la Avenida del Mar (10 minutos en auto). El condominio cuenta con seguridad las 24 horas, estacionamiento con capacidad para 3 vehículos y plaza con juegos infantiles.",['Cocina'],,,Camila,12-2018,https://www.airbnb.cl/rooms/791997433490685643?adults=1&children=0&infants=0&pets=0&check_in=2023-03-01&check_out=2023-03-08&previous_page_section_name=1000&federated_search_id=5bb894fd-531d-4cce-90b3-77dd2b9f89b6
119,Casa granero en Playa Grande Tongoy,Cabaña entero,Tongoy,Coquimbo,6,5,3, Habitación,"1,5",privado,150.0,-30.2946,-71.5367,"https://maps.google.com/maps?ll=-30.2946,-71.5367&z=14&t=m&hl=es&gl=CL&mapclient=apiv3",,"Esta casa, ha sido especialmente diseñada  para disfrutar del entorno natural. Para experimentar la puesta de sol desde su terraza en la azotea. Un lugar que evoca las antiguas casas de campo, combinadas con productos contemporáneos.

Acceso de los huéspedes
Los huéspedes podrán acceder al espacio completo de la casa, al gran jardín y a las instalaciones exteriores. Los huéspedes también pueden llegar al humedal en un par de minutos o caminar a la hermosa playa a solo 15 minutos de la casa","['Acceso a playa Público o compartido', 'Frente a la playa']",5.0,3,Jorge,05-2015,https://www.airbnb.cl/rooms/665518914328051294?adults=1&children=0&infants=0&pets=0&check_in=2023-03-01&check_out=2023-03-06&previous_page_section_name=1000&federated_search_id=5bb894fd-531d-4cce-90b3-77dd2b9f89b6
