,Titulo1,Titulo2,Comuna,Region,Capacidad,Camas,N_Habitaciones,Habitaciones,Ba침os,Tipo_Ba침os,Precio,lat,lon,Ubicacion,Ubides,Descripcion,Servicios,Nota,Nnota,Anfitrion,Registro,Link
0,"Elqui Valley Blue, Hot Tub, Cama Cuarzo, Conexi칩n.",Caba침a entero,Vicu침a,Coquimbo,4,3,2, Habitaci칩n,1,privado,51.84,-30.02421,-70.62389,"https://maps.google.com/maps?ll=-30.02421,-70.62389&z=14&t=m&hl=es&gl=CL&mapclient=apiv3",,"Rel치jate con toda la familia en este tranquilo lugar para quedarse.
Conecta con la magia del Valle del Elqui, su naturaleza, 칠l sonido del viento, junto a un Hot Tub y dos camas de cuarzo, para una maravillosa terapia. 
Con todas las comodidades de un hogar,  agua potable, caliente, c칩modas camas, cocina, refrigerador, horno, Smart TV, en medio de un bello paisaje y desconexi칩n de la gran Ciudad. 
""F치cil de llegar por la Ruta D-41 hasta el KM 71, desde La Serena, aprox. 75 minutos en Auto""


Es una caba침a muy c칩moda con tres camas , dos habitaciones , con todas las comodidades de la ciudad pero en medio de la Naturaleza , el silencio es absoluto, lo 칰nico que escuchas son los p치jaros y el viento. 
Parte de la experiencia es el HOT TUB y las Camas de Cuarzo",['Vista al patio'],,,Maritza,01-2021,https://www.airbnb.cl/rooms/830605571242426748?adults=1&children=0&infants=0&pets=0&check_in=2023-03-01&check_out=2023-03-06&previous_page_section_name=1000&federated_search_id=0c5d96fc-f90d-41af-9cea-54ddf6016ff1
1,Casa de campo en Diaguitas,Casa de campo entero,Diaguitas,Coquimbo,8,4,4, Habitaci칩n,1,privado,150.0,-30.02537,-70.63792,"https://maps.google.com/maps?ll=-30.02537,-70.63792&z=14&t=m&hl=es&gl=CL&mapclient=apiv3",,"El pueblo de Diaguitas esta localizado a 7 Km de Vicu침a donde pondr치s encontrar artesan칤a de la zona y la Cervecer칤a Guayac치n.

El espacio
La casa rodeada de 치rboles frutales, lugar tranquilo en d칩nde se podr치 apreciar las estrellas por la noche. Cuenta con 치reas comunes amplias al igual que la cocina, que est치 completamente equipada.
Para capear el calor se cuenta con una amplia piscina, con reposeras.",['Vista al jard칤n'],5.0,17,Gabriel,08-2022,https://www.airbnb.cl/rooms/687543448268664985?adults=1&children=0&infants=0&pets=0&check_in=2023-03-01&check_out=2023-03-06&previous_page_section_name=1000&federated_search_id=0c5d96fc-f90d-41af-9cea-54ddf6016ff1
2,Caba침a Valle del Elqui,Alojamiento entero,La Serena,Regi칩n de Coquimbo,5,4,3, Habitaci칩n,2,privado,98.0,-30.0126,-71.0358,"https://maps.google.com/maps?ll=-30.0126,-71.0358&z=14&t=m&hl=es&gl=CL&mapclient=apiv3",,"Est치 ubicado en El Valle de Elqui a 25 Kil칩metros de La Serena ciudad que cuenta  con playa, bares restaurante, casino, Mall. El aeropuerto se encuentra a 20 kil칩metros de distancia. Desde este lugar se pueden visitar observatorios Mayu, Tololo y Mamalluca ( reservas con anticipaci칩n)
Tambi칠n se pueden visitar las vi침as y pisqueras de la localidad.
Piscina con vista panor치mica al Valle.


La caba침a cuenta con hermosa terraza con vista al Valle, 2 dormitorios con cama de 2 plazas. Uno en la planta baja totalmente independiente con entrada independiente y el otro en el piso superior donde adem치s se encuentra la cocina.Cuenta adem치s con 2 camas de 1 plaza ubicadas en el segundo piso . Ba침o en ambos pisos. Caba침a full equipada para que tu estad칤a sea confortable.",['Cocina'],5.0,34,Ana Mar칤a,07-2017,https://www.airbnb.cl/rooms/20154848?adults=1&children=0&infants=0&pets=0&check_in=2023-03-06&check_out=2023-03-11&previous_page_section_name=1000&federated_search_id=0c5d96fc-f90d-41af-9cea-54ddf6016ff1
3,Casa Playa frente Puerto Velero,Alojamiento entero,Coquimbo,Chile,8,6,3, Habitaci칩n,3,privado,150.0,-30.24943,-71.45986,"https://maps.google.com/maps?ll=-30.24943,-71.45986&z=14&t=m&hl=es&gl=CL&mapclient=apiv3",,"Hermosa Casa de Playa nueva con linda piscina y Terraza emplazada en condominio privado cerca del mar, grandes vistas, especial para conectarse con tus seres queridos en un ambiente familiar, tranquilo y acogedor",['Acceso la playa P칰blico o compartido'],,,Juan Luis,04-2019,https://www.airbnb.cl/rooms/821984450971999152?adults=1&children=0&infants=0&pets=0&check_in=2023-03-04&check_out=2023-03-09&previous_page_section_name=1000&federated_search_id=0c5d96fc-f90d-41af-9cea-54ddf6016ff1
4,"CASA VICU칌A, VALLE DEL ELQUI . PISCINA Y QUINCHO",Bungalow entero,Vicu침a,Regi칩n de Coquimbo,9,7,4, Habitaci칩n,3,privado,100.0,-29.98247,-70.98673,"https://maps.google.com/maps?ll=-29.98247,-70.98673&z=14&t=m&hl=es&gl=CL&mapclient=apiv3",,"Hermosa casa en parcela de agrado, con piscina, tinaja y quincho. Decoraci칩n moderna, 4 Dormitorios, 3 ba침os, habilitada para 9 personas. Cuenta con cocina, refrigerador, tina con hidromasaje, agua caliente, tv cable, mesa ping pong, sendero inclusivo.
Km 30, Ruta 41, Vicu침a ( frente a cervecer칤a Cactus), Valle del Elqui.

Valor incluye uso de tinaja agua caliente  para 1 vez durante la estad칤a. D칤a uso adicional  tiene un costo diario de $70.000, costo adicional de   invitados $10.000 diarios


Casa que cuenta con todas las comodidades del hogar, rodeada de naturaleza y diversos atractivos tur칤sticos. Especial para el descanso y compartir en familia.",['Vista al valle'],4.70,11,Cristian,12-2018,https://www.airbnb.cl/rooms/31074328?adults=1&children=0&infants=0&pets=0&check_in=2023-03-01&check_out=2023-03-06&previous_page_section_name=1000&federated_search_id=0c5d96fc-f90d-41af-9cea-54ddf6016ff1
5,CASA EL ENCANTO PISCO ELQUI,Alojamiento entero,Paihuano,Regi칩n de Coquimbo,6,6,3, Habitaci칩n,2,privado,162.0,-30.15589,-70.49629,"https://maps.google.com/maps?ll=-30.15589,-70.49629&z=14&t=m&hl=es&gl=CL&mapclient=apiv3",,"Es una casa  estilo moderno muy acogedora amoblada completamente, ubicada en el mejor sector de Pisco Elqui, con vista privilegiada, est치 cerca del R칤o Claro es un lugar tranquilo que invita al relajo y la desconexi칩n.
A 4km de la plaza de Pisco Elqui, cercana de restaurantes , almacenes y lugares tur칤sticos (cabalgatas,treking, masajes, yoga).
Es importante se침alar que los espacios est치n dise침ados para familias o grupo de amigos


Tiene varias Terrazas , parrilla, piscina , lugares de descanso, hamaca y hot  tub de madera con costo adicional de $ 23.000 por uso","['Acceso a la playa', 'Frente a la playa']",4.96,54,M칩nica,02-2019,https://www.airbnb.cl/rooms/32664151?adults=1&children=0&infants=0&pets=0&check_in=2023-03-20&check_out=2023-03-25&previous_page_section_name=1000&federated_search_id=0c5d96fc-f90d-41af-9cea-54ddf6016ff1
6,"Bungalow/caba침a en la Herradura, Coquimbo.",Caba침a entero,Coquimbo,Regi칩n de Coquimbo,4,3,2, Habitaci칩n,1,privado,35.0,-29.99769,-71.39269,"https://maps.google.com/maps?ll=-29.99769,-71.39269&z=14&t=m&hl=es&gl=CL&mapclient=apiv3",,"Acogedora caba침a con gran vista al mar, inserta 치reas silvestres protegidas. Espacios iluminados y terraza, que permitir치n hacer de tu descanso una experiencia 칤ntima bajo uno de los cielos m치s limpios del mundo. Se encuentra en condominio ecol칩gico privado, sector rural ""El Panul"" localidad de la Herradura (NO ES ZONA DE BALNEARIO), a minutos de playas y ciudades, pero separado  de la ruta 5 norte  por 4 km de camino de tierra (NECESARIO AUTOM칍VIL para ingresar o salir de la comunidad).


La tranquilidad del lugar, lejos de turistas, pero a la vez a pocos minutos en autom칩vil de las principales playas y centros comerciales. La vista, y el entrono silvestre que se puede recorrer a pie hasta llegar al mar (no apto para ba침o) durante el d칤a, y el silencio del que se puede disfrutar bajo las estrellas durante la noche.",['Cocina'],4.72,69,Denisse Daniela,03-2017,https://www.airbnb.cl/rooms/18139777?adults=1&children=0&infants=0&pets=0&check_in=2023-03-13&check_out=2023-03-18&previous_page_section_name=1000&federated_search_id=0c5d96fc-f90d-41af-9cea-54ddf6016ff1
7,Casa valle La serena/valle del elqui,Alojamiento entero,La Serena,Coquimbo,6,4,3, Habitaci칩n,2,privado,95.0,-29.93906,-71.1474,"https://maps.google.com/maps?ll=-29.93906,-71.1474&z=14&t=m&hl=es&gl=CL&mapclient=apiv3",,"Casavalle, es una casa aislada para una sola familia, ubicada en La serena camino al valle del elqui, a 15 minutos en auto de la avenida del mar, 5 del aeropuerto y 40 de Vicu침a.
Dentro de un condominio, con port칩n el칠ctrico, y en un lugar privilegiado, a la mano de la ciudad pero con la desconexi칩n y el relajo Del Valle del elqui.

Un ambiente de descanso, conexi칩n con la naturaleza, ideal para familias.
Disfruta  de las instalaciones de casavalle, piscina natural, Hot tub, parrilla y fog칩n.


A mano de la ciudad pero con la desconexi칩n y relajo Del Valle del Elqui, tendr치s relajo, descanso y diversi칩n en un lugar dise침ado y pensando solo para tu familia. 
Cada

Casa aislada, con decoraci칩n limpia y moderna, cocina completamente equipada,
Ropa de cama y toallas de ba침o incluidos.
Wifi, Tv satelital, 치reas de descanso 
A orillas del R칤o Elqui",['Vista al patio'],4.88,41,Diana,12-2020,https://www.airbnb.cl/rooms/47421114?adults=1&children=0&infants=0&pets=0&check_in=2023-03-01&check_out=2023-03-06&previous_page_section_name=1000&federated_search_id=0c5d96fc-f90d-41af-9cea-54ddf6016ff1
8,Casa con Piscina privada Alma Del Elqui,Casa de campo entero,La Serena,Regi칩n de Coquimbo,8,6,3, Habitaci칩n,2,privado,132.0,-30.0203,-70.5248,"https://maps.google.com/maps?ll=-30.0203,-70.5248&z=14&t=m&hl=es&gl=CL&mapclient=apiv3",,"Casa Alma del Elqui, Est치 ubicado antes de llegar a Paihuano Pueblo, inserto en medio del Valle, en ambiente r칰stico con maderas nobles y muros de piedras natural del mismo valle de Elqui, las sentir치s cargadas de pura energ칤a positiva, para que te encuentres contigo mismo, es un para칤so inspirador, especial para compartir en familia, seres queridos y ense침arles a tus hijos sobre las constelaciones en las noches estrelladas.


Es una casa con piscina de uso exclusivo para los hu칠spedes, 
Es un espacio verde en contraste con el marr칩n de los cerros y el azul del cielo. una imagen perfecta para guardar en su memoria.",['Cocina'],4.73,86,Claudio Contreras,12-2015,https://www.airbnb.cl/rooms/21867642?adults=1&children=0&infants=0&pets=0&check_in=2023-03-03&check_out=2023-03-08&previous_page_section_name=1000&federated_search_id=0c5d96fc-f90d-41af-9cea-54ddf6016ff1
9,Linda casa con piscina y entorno campestre,Caba침a entero,Vicu침a,Regi칩n de Coquimbo,6,5,3, Habitaci칩n,1,privado,100.0,-30.00054,-70.991,"https://maps.google.com/maps?ll=-30.00054,-70.991&z=14&t=m&hl=es&gl=CL&mapclient=apiv3",,"Linda casa con piscina y juegos infantiles, posee 3 dormitorios habilitados para 6 personas, ba침o completo, cocina americana equipada con encimera, horno el칠ctrico, horno microondas, vajilla y lavadora.
La zona exterior cuenta con un quincho, el cual tiene asadera y horno a le침a, arboles frutales, piscina y juegos infantiles.
Paisaje hermoso, entorno tranquilo
Ver descripci칩n completa",['Cocina'],4.94,17,Ximena,04-2018,https://www.airbnb.cl/rooms/31650345?adults=1&children=0&infants=0&pets=0&check_in=2023-03-01&check_out=2023-03-06&previous_page_section_name=1000&federated_search_id=0c5d96fc-f90d-41af-9cea-54ddf6016ff1
10,Casa Condominio en Tongoy,Alojamiento entero,Tongoy,Coquimbo,6,5,3, Habitaci칩n,2,privado,70.0,-30.2574,-71.4751,"https://maps.google.com/maps?ll=-30.2574,-71.4751&z=14&t=m&hl=es&gl=CL&mapclient=apiv3",,"Casa en Condominio Prados del Mar . Localidad de Tongoy.
Casa amplia con tres habitaciones y dos ba침os.",['Acceso a la playa'],5.0,4,Paulina,06-2015,https://www.airbnb.cl/rooms/795537401833974868?adults=1&children=0&infants=0&pets=0&check_in=2023-03-03&check_out=2023-03-08&previous_page_section_name=1000&federated_search_id=0c5d96fc-f90d-41af-9cea-54ddf6016ff1
11,"Casa de Playa, Ensenada (Totoralillo), amplia vista al mar, playa privada condominio",Caba침a entero,Los Vilos,Coquimbo,6,4,3, Habitaci칩n,2,privado,175.0,-32.00269,-71.51799,"https://maps.google.com/maps?ll=-32.00269,-71.51799&z=14&t=m&hl=es&gl=CL&mapclient=apiv3",,"Amplia casa de playa, ubicada en Ensenada, en la bah칤a de Totoralillo.
Emplazada en altura, posee vista panor치mica al mar desde todas sus habitaciones, living, comedor y terraza. Adem치s, cuenta con piscina propia.
Es parte de un condominio con acceso remoto, un entorno muy tranquilo y una linda playa privada.
A 213km de Santiago, por la ruta 5, cerca de Pichidangui, Valle Quilimar칤, Los Vilos, Chigualoco y Huentelauqu칠n. Gastronom칤a criolla del mar, paseos, deportes n치uticos... Imperdible!


Habitaciones con techos de 3 metros de altura, otorgan una c칩moda sensaci칩n de amplitud. Revestidas en madera, con un suave albayalde en tono claro.
Todas sus ventanas son termopanel y permiten un ambiente seco dentro de la casa.","['Acceso a playa P칰blico o compartido', 'Frente a la playa']",4.75,12,Nicol치s,12-2015,https://www.airbnb.cl/rooms/51729708?adults=1&children=0&infants=0&pets=0&check_in=2023-03-01&check_out=2023-03-06&previous_page_section_name=1000&federated_search_id=0c5d96fc-f90d-41af-9cea-54ddf6016ff1
12,"Casa Luz. EN LA PLAYA. Las Mostazas, Guanaqueros",Alojamiento entero,Coquimbo,Chile,8,7,3, Habitaci칩n,"3,5",privado,275.0,-30.18138,-71.39205,"https://maps.google.com/maps?ll=-30.18138,-71.39205&z=14&t=m&hl=es&gl=CL&mapclient=apiv3",,"Una casa preciosa,  hecha con mucho amor, en la playa misma, patitas en la arena. A 50 pasos del mar. Un lugar tranquilo, maravilloso, de conexi칩n con la naturaleza. Dan ganas de quedarse para siempre :)

Ecol칩gica, bien aislada, full el칠ctrica, con paneles solares y reutilizaci칩n de aguas para el jard칤n. 

Esta dentro del condominio Las Mostazas. En una playa incre칤ble. A 10 mins en auto de Guanaqueros, 20 de Tongoy y 45 de la serena. Llegan las compras del Jumbo a la puerta de la casa.


La casa tiene 3 piezas ricas, cada una con su ba침o. M치s un ba침o de servicio o de playa y parrilla. Tiene un espacio com칰n grande con una barra y un comedor grande tambi칠n. Una rica y amplia terraza con parrilla, fog칩n, estar reposeras y comedor exteriores. 

Hay en la parte de abajo del jard칤n una zona de fogata, tambi칠n con parrilla y mes칩n para hacer un asado mas acampado. 

Dejamos siempre 2 stand up paddle y salvavidas de distintos tama침os para salir a remar por el mar. Una experiencia preciosa.

Hay tambi칠n para el fin del d칤a, y con la
idea de cuidar el agua, una ducha playera, justo antes de la subida a la casa, para ba침arse r치pido y sacarse la sal y arena antes de subir.","['Acceso a playa P칰blico o compartido', 'Frente a la playa']",5.0,15,Camila,05-2014,https://www.airbnb.cl/rooms/53001224?adults=1&children=0&infants=0&pets=0&check_in=2023-03-08&check_out=2023-03-13&previous_page_section_name=1000&federated_search_id=0c5d96fc-f90d-41af-9cea-54ddf6016ff1
13,Tranquila caba침a cercana a playa grande Tongoy,Caba침a entero,Tongoy,Coquimbo,5,4,2, Habitaci칩n,1,privado,80.0,-30.27957,-71.48896,"https://maps.google.com/maps?ll=-30.27957,-71.48896&z=14&t=m&hl=es&gl=CL&mapclient=apiv3",,"Te esperamos en ""La Galerna"" un espacio pensado para quienes disfrutan de la desconexi칩n, la tranquilidad y las noches estrelladas, a solo minutos de las exquisitas playas y el centro de Tongoy.

Nuestra vista hacia los humedales te permite contemplar y ser parte de la naturaleza de la zona. 

Son 4 caba침as equipadas con todo lo necesario para una agradable estadia para 5 personas con estacionamiento privado, seguridad de un condominio de parcelas y acceso directo a Playa Grande.",['Acceso la playa P칰blico o compartido'],5.0,12,Concepcion,06-2019,https://www.airbnb.cl/rooms/688420756410187676?adults=1&children=0&infants=0&pets=0&check_in=2023-03-01&check_out=2023-03-06&previous_page_section_name=1000&federated_search_id=0c5d96fc-f90d-41af-9cea-54ddf6016ff1
14,La Tortuguita: casita in Quilimari para 2-5,Bungalow entero,Quilimari,Regi칩n de Coquimbo,4,2,2, Habitaci칩n,1,privado,32.0,-32.12461,-71.4981,"https://maps.google.com/maps?ll=-32.12461,-71.4981&z=14&t=m&hl=es&gl=CL&mapclient=apiv3",,"La Tortuguita, nuestra casita en Quilimari: 2 dormitorios con dos camas Queen, con un Futon en el living, 2-5 personas, un ba침o con ducha, agua caliente, Cable, WiFi. La casa se encuentra en un recinto cerrado con rejas, seguro con cuidador, tranquilo. El precio incluye toallas y sabanas limpias, gas propano, luz, agua, cocina completa, un peque침o asador, y lavadora.
Quilimari: clima bueno todo el a침o, minutos de la playa, al lado de Pichidangui; est치 a 2 horas y media desde Santiago.


Este lugar de veraneo tiene temperatura estable todo el a침o. En enero y febrero las tardes son mas calurosas y refresca al anochecer.
A la playa de Quilimari-Pichidangui se puede llevar a pie, a trav칠s de la pasarela de la carretera, via las dunas en unos 10-15 minutos. En auto se llega por el lado de Pichidangui en 5 minutos.
En Quilimari se encuentra comestibles b치sicos, verduras y frutas en la calle principal y a unos 5 minutos al interior por la calle principal.",['Cocina'],4.68,37,Luis,04-2015,https://www.airbnb.cl/rooms/16143414?adults=1&children=0&infants=0&pets=0&check_in=2023-03-24&check_out=2023-03-29&previous_page_section_name=1000&federated_search_id=0c5d96fc-f90d-41af-9cea-54ddf6016ff1
15,La Joyita de Guanaqueros,Alojamiento entero,Guanaquero,Coquimbo,4,3,3, Habitaci칩n,2,privado,60.0,-30.19589,-71.4325,"https://maps.google.com/maps?ll=-30.19589,-71.4325&z=14&t=m&hl=es&gl=CL&mapclient=apiv3",,"칔nico y acogedor lugar para disfrutar de tus vacaciones, inmejorable ubicaci칩n, cercano a restaurantes, todo tipo de comercio y a menos  de 3 minutos  caminando de la playa. 
La casa cuenta con tres niveles con espectaculares vistas a la bah칤a. El patio interior en doble altura es fresco y sombreado especial para pasar el verano. Los dormitorios se ubican en segundo y tercer piso.  
Totalmente equipada, vas a encontrar en cada rinc칩n hermosos detalles que har치n muy grata tu estad칤a


Al ingresar a la casa llegar치s primero al patio interior, donde se encuentra el sector de parrilla y el ficus que da sombra al lugar. A un costado podr치s entrar al living y cocina, el ba침o del primer piso tiene salida directo al pasillo exterior. Al fondo de la casa encontrar치s un peque침o jard칤n donde podr치s colgar tus toallas, adem치s tenemos lavadora de uso gratuito para los hu칠spedes. La escalera para subir al segundo piso est치 en el exterior tal como lo muestran las fotos. Al llegar al segundo piso te encontrar치s con el acceso a los dormitorios y con un gran balc칩n con vista a la playa. Al interior del segundo piso podr치s encontrar el primer dormitorio, m치s un espacio tipo sala de estar con un rinconcito para tomar caf칠 y t칠, adem치s del segundo ba침o y un walk in closet peque침o.
Desde la sala de estar se. Sube al tercer piso donde se ubica el otro dormitorio con una hermosa vista a la bah칤a.",['Acceso la playa P칰blico o compartido'],4.63,16,Claudia,08-2016,https://www.airbnb.cl/rooms/53129981?adults=1&children=0&infants=0&pets=0&check_in=2023-03-03&check_out=2023-03-10&previous_page_section_name=1000&federated_search_id=3a05f3c6-4f65-499c-9de8-a85f539d6826
16,Oasis de tres habitaciones con piscina,Alojamiento entero,Vicu침a,Regi칩n de Coquimbo,8,6,3, Habitaci칩n,1,privado,99.0,-29.9757,-70.5608,"https://maps.google.com/maps?ll=-29.9757,-70.5608&z=14&t=m&hl=es&gl=CL&mapclient=apiv3",,"Casa de campo en el Pueblo de Rivadavia en El Valle del Elqui.
- 3 habitaciones 
- Cama para 8 personas
- Living comedor
- Cocina
- Un ba침o
- Piscina
- Amplio Quincho
- Arboles frutales
- Estacionamiento para 3 veh칤culos
- A 5 minutos de la Carretera

El lugar es tranquilo, en la noche se pueden apreciar las estrellas ya que la luz de alumbrado es m칤nima. Ven a conocer nuestra casa, nuestro pueblo y nuestro valle !

Importante: La casa por completo es de uso exclusivo


Garantizamos una estad칤a placentera, nuestro espacio es acogedor y hogare침o, se disfruta del sol que siempre esta presente en el Valle y la sombra que otorgan nuestro arboles. Queremos compartir lo que nos hace feliz.",['Cocina'],4.86,49,Elias Ignacio,01-2019,https://www.airbnb.cl/rooms/31307746?adults=1&children=0&infants=0&pets=0&check_in=2023-03-20&check_out=2023-03-26&previous_page_section_name=1000&federated_search_id=3a05f3c6-4f65-499c-9de8-a85f539d6826
17,"Casa frente al mar Ensenada km 213, Pichidangui",Alojamiento entero,Pichidangui,Coquimbo Region,9,7,4, Habitaci칩n,4,privado,245.0,-32.08817,-71.52767,"https://maps.google.com/maps?ll=-32.08817,-71.52767&z=14&t=m&hl=es&gl=CL&mapclient=apiv3",,"Mi alojamiento es bueno para parejas, familias (con hijos) y grupos grandes.

Otros aspectos a destacar
El consumo de agua se cobra por separado, dada la escasez de la zona","['Acceso a la playa', 'Frente a la playa']",4.86,35,Trinidad,04-2016,https://www.airbnb.cl/rooms/12454880?adults=1&children=0&infants=0&pets=0&check_in=2023-03-03&check_out=2023-03-10&previous_page_section_name=1000&federated_search_id=3a05f3c6-4f65-499c-9de8-a85f539d6826
18,Casa para descansar. Extraordinaria vista al mar,Casa de campo entero,Los Vilos,Coquimbo,6,4,3, Habitaci칩n,2,privado,140.0,-31.95634,-71.49631,"https://maps.google.com/maps?ll=-31.95634,-71.49631&z=14&t=m&hl=es&gl=CL&mapclient=apiv3",,"Desconecta de tus preocupaciones en este espacio tan amplio y sereno.

Otros aspectos a destacar
El lugar invita a caminar y recorrer la costa rocosa y acantilados. Tambi칠n hay peque침as playas. Si te interesa la arquitectura, encontrar치s casas de arquitectos famosos.",['Costa'],5.0,16,Clemente,03-2014,https://www.airbnb.cl/rooms/52627860?adults=1&children=0&infants=0&pets=0&check_in=2023-03-08&check_out=2023-03-13&previous_page_section_name=1000&federated_search_id=3a05f3c6-4f65-499c-9de8-a85f539d6826
19,Casa campo con piscina y tinaja,Alojamiento entero,Coquimbo,Chile,10,8,4, Habitaci칩n,"2,5",privado,94.5,-30.06,-71.2537,"https://maps.google.com/maps?ll=-30.06,-71.2537&z=14&t=m&hl=es&gl=CL&mapclient=apiv3",,Lleva a toda la familia a este fant치stico lugar con muchas zonas para disfrutar de unos d칤as de relajo .,['Vista a las monta침as'],4.83,6,Enrique,11-2020,https://www.airbnb.cl/rooms/792865932033552118?adults=1&children=0&infants=0&pets=0&check_in=2023-03-02&check_out=2023-03-08&previous_page_section_name=1000&federated_search_id=3a05f3c6-4f65-499c-9de8-a85f539d6826
20,Linda casa de campo con piscina y hermosa vista,Casa de campo entero,Pisco Elqui,Coquimbo,6,5,2, Habitaci칩n,2,privado,160.0,-30.14846,-70.49629,"https://maps.google.com/maps?ll=-30.14846,-70.49629&z=14&t=m&hl=es&gl=CL&mapclient=apiv3",,"Ideal para descansar en familia disfrutar de la tranquilidad y sol del valle de Elqui, c칩moda y espacioso lugar, de arquitectura moderna, piscina, fog칩n, terrazas y quincho

El espacio
La casa est치 en sector Miraflores, desde la plaza de pisco a mi casa hay 1,8 km en el mapa se ve bien la ubicaci칩n antes del restaurante Miraflores, tiene 2 Dormitorios con camas de king (la segunda pieza tiene 2 de una plaza que se unen para dejarla matrimonial)
En el living hay 2 sof치s cama de 1 plaza para saco de dormir",['Vista al valle'],4.79,19,Daniella,12-2021,https://www.airbnb.cl/rooms/54257159?adults=1&children=0&infants=0&pets=0&check_in=2023-03-06&check_out=2023-03-12&previous_page_section_name=1000&federated_search_id=3a05f3c6-4f65-499c-9de8-a85f539d6826
21,Casa en la playa (entre Pichidangui y los Vilos),Alojamiento entero,Los Vilos,Coquimbo,5,4,2, Habitaci칩n,2,privado,155.0,-32.00883,-71.51633,"https://maps.google.com/maps?ll=-32.00883,-71.51633&z=14&t=m&hl=es&gl=CL&mapclient=apiv3",,,"['Acceso a la playa', 'Frente a la playa']",4.74,34,Francisco,11-2016,https://www.airbnb.cl/rooms/47373666?adults=1&children=0&infants=0&pets=0&check_in=2023-03-13&check_out=2023-03-18&previous_page_section_name=1000&federated_search_id=3a05f3c6-4f65-499c-9de8-a85f539d6826
22,Excelente casa de verano a 2 cuadras de la playa,Alojamiento entero,Coquimbo,Chile,9,8,4, Habitaci칩n,3,privado,72.5,-30.1968,-71.416,"https://maps.google.com/maps?ll=-30.1968,-71.416&z=14&t=m&hl=es&gl=CL&mapclient=apiv3",,"C칩moda, y agradable casa con vista al mar游깱 en todas sus habitaciones, cercano a la playa游끴. Cuenta con WiFi,游닜 tv cable, cocina equipada, lavadora, estacionamientos, quincho para asados 游꽇y amplia terraza. Pet friendly游냠游냤, juegos infantiles 游

El espacio
Lugar cercano a la playa y ambiente tranquilo, c칩modoy seguro",['Acceso a la playa'],4.33,6,Ricardo,09-2021,https://www.airbnb.cl/rooms/728341067110721505?adults=1&children=0&infants=0&pets=0&check_in=2023-03-05&check_out=2023-03-11&previous_page_section_name=1000&federated_search_id=3a05f3c6-4f65-499c-9de8-a85f539d6826
