,Titulo1,Titulo2,Comuna,Region,Capacidad,Camas,N_Habitaciones,Habitaciones,Ba침os,Tipo_Ba침os,Precio,lat,lon,Ubicacion,Ubides,Descripcion,Servicios,Nota,Nnota,Anfitrion,Registro,Link
171,"""El Atardecer"", casa frente a Pichidangui",Habitaci칩n privada en alojamiento,Regi칩n de Coquimbo,Chile,6,6,3, Habitaci칩n,3,privado,53.1,-32.11583,-71.50389,"https://maps.google.com/maps?ll=-32.11583,-71.50389&z=14&t=m&hl=es&gl=CL&mapclient=apiv3",,"Casa acogedora ubicada en un condominio exclusivo a 5 min de Pichidangui,  posee linda vista al mar y agua potable permanente,  ba침os con ducha de agua caliente; hay espacios independientes y dependientes; en el sector hay  supermercados y una excelente peluquera (Marcela) as칤 como masajistas.
Cerca existen ba침os calientes de agua de mar, la ruta 5 y la linda ruta del cuarzo.
Caminando se llega al mar.
El propietario recibe y atiende personalmente a sus hu칠spedes debido a que vive en el lugar


Lugar ideal para descansar, se llega caminando al mar, al medio de la bah칤a de Pichidangui.",['Acceso la playa P칰blico o compartido'],4.43,49,Patricio,11-2018,https://www.airbnb.cl/rooms/32025533?adults=1&children=0&infants=0&pets=0&check_in=2023-03-20&check_out=2023-03-27&previous_page_section_name=1000&federated_search_id=a070a534-511d-4325-854b-25aff23bee81
172,Casa del Cactus,Alojamiento entero,Guanaquero,Coquimbo,10,7,3, Habitaci칩n,2,privado,152.0,-30.1969,-71.4221,"https://maps.google.com/maps?ll=-30.1969,-71.4221&z=14&t=m&hl=es&gl=CL&mapclient=apiv3",,"Amplia casa a solo 180 metros de una de las mejores playas de Chile, por el sector encontraras gastronom칤a y panoramas t칤picos de la zona. Adem치s, esta full equipada para que te sientas acogido en estas vacaciones.
Casa cuenta con sector fogata, parrilla, lavadora, internet, TV (Netflix, Disney+, Cable y otros), juegos de mesas y estacionamiento para 4 autos entre otras de sus cualidades.

N칰mero de permiso
56932750165",['Acceso a la playa'],,,Rodrigo,01-2018,https://www.airbnb.cl/rooms/775594083882844941?adults=1&children=0&infants=0&pets=0&check_in=2023-03-01&check_out=2023-03-06&previous_page_section_name=1000&federated_search_id=a070a534-511d-4325-854b-25aff23bee81
173,Caba침a con Vista al Mar,Caba침a entero,La Serena,Coquimbo,7,6,3, Habitaci칩n,2,privado,80.0,-29.75611,-71.34028,"https://maps.google.com/maps?ll=-29.75611,-71.34028&z=14&t=m&hl=es&gl=CL&mapclient=apiv3",,"Ven a relajarte en bah칤a whale, junto con tu pareja ,amigos ,familia  y mascotas de esta incre칤ble experiencia.
Pensado por dos m칠dicos buceadores (PADI) , amantes del mar, podr치s relajarte y lograr la desconexi칩n total .

Recogimos muchas ideas de nuestros viajes y las quisimos compartir contigo , adem치s de poder transmite nuestra pasi칩n por el mar ya que la casa est치 ambientada en detalles r칰sticos y marinos . 

Por eso te invito a que disfrute de esta experiencia.


Si te gusta el contacto con el mar y la naturaleza este es T칰 lugar. 

La caba침a est치 a aprox 15-20 minutos desde el centro de La Serena , por la Ruta 5 norte .

Nuestra caba침a lleva el nombre de Bahia Whale ya que durante los meses de Noviembre a Diciembre , comienza los avistamientos de ballenas . Por lo que perfectamente puedes estar bebiendo una cerveza , mirando el sunset y ver치s los ""soplos"" de las ballenas muy cerca (Te dejaremos unos binoculares para que disfrutes de su belleza) 

El espacio est치 conformado por :

1. Dormitorio principal con ba침o privado , cama de 2 plazas y una impresionante vista al mar.

2. Segundo dormitorio con camarote y dos camas de 1 plaza.

3. Tercer dormitorio con dos camas de plaza y media.

4.Ba침o de visita

5.Cocina amoblada y living .

TODAS las piezas tienen vista al mar , se entrega ropa de cama y toallas. 

La terraza es amplia y se conecta directamente con las rocas del lugar  , existe una hamaca para m치s comodidad y sillas para que puedas tomas mucho sol.",['Vista a la playa'],4.79,14,Javier,04-2016,https://www.airbnb.cl/rooms/53250224?adults=1&children=0&infants=0&pets=0&check_in=2023-06-01&check_out=2023-06-06&previous_page_section_name=1000&federated_search_id=a070a534-511d-4325-854b-25aff23bee81
174,"Casa estilo Mediterr치neo, 140 mt2.",Alojamiento entero,Tongoy,Coquimbo Region,6,3,2, Habitaci칩n,"1,5",privado,190.0,-30.25652,-71.47182,"https://maps.google.com/maps?ll=-30.25652,-71.47182&z=14&t=m&hl=es&gl=CL&mapclient=apiv3",,"Hermosa Casa Blanca, amplia, luminosa y c칩moda 
100 mt2 m치s Terraza de 40 mt2
Lindos y confortables espacios interiores
Piscina
Vista al Mar de Playa Socos, Cielos de intensos Azules, preciosas Puestas de Sol todo el a침o, Silencio Nocturno y Miles de Estrellas
El Cuarzo Blanco y Rosado, y los Rayitos de Sol, buscan rendirle tributo a la Belleza del Lugar
Excelente para descansar.
2 kms. de Tongoy, rest y comercio.
Ideal para 4/5 personas. Hasta 6 hu칠spedes (dos parejas; familia con ni침os, etc.)


Tongoy en una de las playas m치s lindas del Norte de Chile, su caleta de pescadores, el pueblito, sus playas, lo hacen un lugar acogedor para el turista; sencillo, pero con todo lo necesario para tener una estad칤a confortable. 
Tiene restaurantes, productos del mar frescos todos los d칤as y cuenta con un buen comercio de market y almacenes donde se encuentra todo lo necesario para surtir la despensa y el refri.

La Casa Blanca, est치 ubicada a 2 kms del Pueblo de Tongoy, en un lindo terreno de 5006 mts2 dentro de un Condominio, frente a la Playa Socos, detr치s de la ruta que va desde Tongoy a Puerto Velero y a Guanaqueros. Est치 a 57 Kms. de la preciosa ciudad de La Serena. 

Se escucha el sonido del Mar, y se ven los cielos del Norte Chileno despejados, de intensos Azules en el d칤a y estrellados por la noche, as칤 tambi칠n la Luna Llena brillante cuando toca su fase.
El lugar es especial, m치gico, terap칠utico; no necesitas nada m치s que estar ah칤 escuchando el Mar y contemplar las puestas de Sol hermosas.
Por la noche o칤r el silencio nocturno, y ver las Estrellas junto al Fuego del Brasero, reconforta el Alma y el Esp칤ritu.
Un lugar hermoso y tranquilo, ideal para descansar y entrar en contacto con la Naturaleza. Las fotos hablan por si solas.",['Vista a la playa'],4.86,7,Aleluz,03-2016,https://www.airbnb.cl/rooms/11650453?adults=1&children=0&infants=0&pets=0&check_in=2023-03-01&check_out=2023-03-08&previous_page_section_name=1000&federated_search_id=a070a534-511d-4325-854b-25aff23bee81
175,Casa interior parcela,Alojamiento entero,Vicu침a,Coquimbo Region,5,3,2, Habitaci칩n,1,privado,120.329,-30.03373,-70.65995,"https://maps.google.com/maps?ll=-30.03373,-70.65995&z=14&t=m&hl=es&gl=CL&mapclient=apiv3",,"2 dormitorios , living comedor cocina y lavadero. Acceso a piscina. Estacionamiento para 2 veh칤culos . TV satelital. Se encuentra a 100 mts de la Ruta 41  que va hacia Argentina y a 300 mts del Rio Elqui.En las cercanias hay 2 pueblos a menos de 1 km ( Peralillo y Diaguitas) Pueblos ancestrales y un observatorio astronomico ( Mamalluca) en que se pueden efectuar observaciones en las noches


Es una moderna casita de ladrillos tipo georgian completamente amoblada para 4 personas y una adicional en un sofacama en el living. 
Tengo 2 teklescopio para observaciones nocturnas y charlas sin costo con apoyo de videos del cielo nocturno del hemisferio sur.",['Vista al canal'],5.0,4,Alejandro,06-2016,https://www.airbnb.cl/rooms/17078337?adults=1&children=0&infants=0&pets=0&check_in=2023-03-01&check_out=2023-03-06&previous_page_section_name=1000&federated_search_id=a070a534-511d-4325-854b-25aff23bee81
176,"Amplia Casa en Villa Talinay, Guanaqueros",Caba침a entero,Coquimbo,Regi칩n de Coquimbo,8,6,3, Habitaci칩n,1,privado,95.0,-30.20172,-71.41854,"https://maps.google.com/maps?ll=-30.20172,-71.41854&z=14&t=m&hl=es&gl=CL&mapclient=apiv3",,"C칩mo casa en barrio 100% residencial y alejado del ruido y ajetreo de la ciudad. Especial para descansar. Amplio patio y terraza para compartir actividades y comidas al aire libre. Con estacionamiento para 3 autos.
A 7 minutos caminando de la playa y a 20 minutos caminando de restaurantes, muelle y centro del pueblo.
Te va a encantar por las vistas al mar y pueblo y el espacio acogedor. Ideal para parejas, aventureros, viajeros de negocios, familias (con hijos), grupos grandes y mascotas.


Puedes tener acceso a todos los servicios de la casa, especialmente a la terraza y quincho para hacer asados, ideal para aprovechar las gratas temperaturas , tanto de d칤a como de noche.",['Vista al jard칤n'],4.79,43,Adriana,01-2017,https://www.airbnb.cl/rooms/16683932?adults=1&children=0&infants=0&pets=0&check_in=2023-03-01&check_out=2023-03-06&previous_page_section_name=1000&federated_search_id=a070a534-511d-4325-854b-25aff23bee81
177,La herradura,Alojamiento entero,Coquimbo,Chile,5,4,3, Habitaci칩n,"2,5",privado,65.0,-29.99438,-71.35835,"https://maps.google.com/maps?ll=-29.99438,-71.35835&z=14&t=m&hl=es&gl=CL&mapclient=apiv3",,"Desde este alojamiento c칠ntrico todo el grupo podr치 disfrutar del f치cil acceso a todo. Se encuentra a pasos 3 min de la playa la herradura , supermercado . 
Cuenta con un hermoso quincho para compartir en familia. 
Amplio estacionamiento con cama saltarina para disfrutar.",['Cocina'],,,Rodrigo,01-2023,https://www.airbnb.cl/rooms/806618661687584183?adults=1&children=0&infants=0&pets=0&check_in=2023-03-01&check_out=2023-03-06&previous_page_section_name=1000&federated_search_id=a070a534-511d-4325-854b-25aff23bee81
178,"Elqui Sol, casa patrimonial",Casa de campo entero,Diaguitas,Regi칩n de Coquimbo,10,8,4, Habitaci칩n,2,privado,150.0,-30.0226,-70.63614,"https://maps.google.com/maps?ll=-30.0226,-70.63614&z=14&t=m&hl=es&gl=CL&mapclient=apiv3",,"Elqui Sol,  Casona de campo, ubicada en zona rural de car치cter patrimonial, cuenta con excelente ubicaci칩n donde podr치s realizar distintas actividades recreativas y servicios tur칤sticos como; trekking a cerro Mamalluca, La Nariz y Peralillo, Renta Bike, Cervecer칤a artesanal, restauran, Almac칠n, tienda de artesan칤as, plaza, comidas t칤picas entre otros. La casa esta a 200 mts. del r칤o Elqui y a 15 minutos de la ciudad de Vicu침a en veh칤culo. Existe locomoci칩n colectiva.",['Cocina'],4.83,6,Francisca,01-2019,https://www.airbnb.cl/rooms/31611012?adults=1&children=0&infants=0&pets=0&check_in=2023-03-01&check_out=2023-03-06&previous_page_section_name=1000&federated_search_id=a070a534-511d-4325-854b-25aff23bee81
179,La casa para sus d칤as de descanso en Coquimbo,Alojamiento entero,Coquimbo,Regi칩n de Coquimbo,12,10,5, Habitaci칩n,3,privado,100.0,-29.99066,-71.36078,"https://maps.google.com/maps?ll=-29.99066,-71.36078&z=14&t=m&hl=es&gl=CL&mapclient=apiv3",,"Hola, es una casa de construcci칩n s칩lida, amplios espacios, buena iluminaci칩n, patio y barbacoa, estacionamiento para dos veh칤culos, linda vista a playa La Herradura, lugar tranquilo, buenos vecinos, cercano a supermercados, hospital, ciudad de la serena, vicu침a, valle del Elqui, acceso directo desde la ruta 5, la casa cuenta con todo lo que una familia necesita tener en su hogar para vivir.

El espacio
no es tan solo una casa sino que es un hogar",['Cocina'],4.89,19,Jos칠,01-2019,https://www.airbnb.cl/rooms/31635738?adults=1&children=0&infants=0&pets=0&check_in=2023-03-01&check_out=2023-03-06&previous_page_section_name=1000&federated_search_id=a070a534-511d-4325-854b-25aff23bee81
180,Linda casa en arriendo La Serena,Alojamiento entero,La Serena,Coquimbo,5,4,2, Habitaci칩n,1,privado,40.0,-29.94369,-71.26921,"https://maps.google.com/maps?ll=-29.94369,-71.26921&z=14&t=m&hl=es&gl=CL&mapclient=apiv3",,,['Cocina'],5.0,3,Soledad,02-2020,https://www.airbnb.cl/rooms/48185722?adults=1&children=0&infants=0&pets=0&check_in=2023-03-01&check_out=2023-03-06&previous_page_section_name=1000&federated_search_id=a070a534-511d-4325-854b-25aff23bee81
181,CASA CONDOMINIO PUERTO VELERO,Alojamiento entero,Puerto Velero,Regi칩n de Coquimbo,8,7,4, Habitaci칩n,3,privado,260.0,-30.24302,-71.47869,"https://maps.google.com/maps?ll=-30.24302,-71.47869&z=14&t=m&hl=es&gl=CL&mapclient=apiv3",,"Casa en Condominio de Puerto Velero, incre칤ble vistas y lugar de descanso familiar. Te va a encantar mi lugar debido la Vista privilegiada a la bahia de Tongoy y Playa de puerto Velero. Casa y terraza amplia y comoda.
.",['Cocina'],4.86,8,Sebastian,06-2016,https://www.airbnb.cl/rooms/13477459?adults=1&children=0&infants=0&pets=0&check_in=2023-03-01&check_out=2023-03-08&previous_page_section_name=1000&federated_search_id=a070a534-511d-4325-854b-25aff23bee81
182,"Horcon, Valle de Elqui, caba침a entera r칰stica",Habitaci칩n privada en caba침a,Paihuano,Regi칩n de Coquimbo,4,3,2, Habitaci칩n,"1,5",privado,85.0,-30.18253,-70.48336,"https://maps.google.com/maps?ll=-30.18253,-70.48336&z=14&t=m&hl=es&gl=CL&mapclient=apiv3",,"Lugares de inter칠s: incre칤bles vistas. Te va a encantar mi espacio por las  hermosas noches estrelladas, el silencio, las claras ma침anas, en el valle del elqui se encuentran los cielos mas limpios del mundo, la amabilidad de las personas, un r칤o con aguas claras y mucha naturaleza..
A 7 km pueden encontrar agencias donde ofrecen servicios de treking, descenso en bicicletas, tour astron칩micos, tour en las pisqueras, cabalgatas, restaurants, pub, etc.


Es un espacio comodo, muy limpio y confortable con unas hermosas vistas a las monta침as.",['Cocina'],4.55,11,Marcela,11-2016,https://www.airbnb.cl/rooms/16068532?adults=1&children=0&infants=0&pets=0&check_in=2023-03-07&check_out=2023-03-12&previous_page_section_name=1000&federated_search_id=a070a534-511d-4325-854b-25aff23bee81
183,Amplia Casa Cercana a Playa La Herradura,Alojamiento entero,Coquimbo,Chile,6,6,3, Habitaci칩n,1,privado,50.0,-29.9838,-71.337,"https://maps.google.com/maps?ll=-29.9838,-71.337&z=14&t=m&hl=es&gl=CL&mapclient=apiv3",,"Lleva a toda la familia a este fant치stico lugar muy tranquilo, cercano a la playa y supermercados.",['Cocina'],4.33,3,Nicole,06-2022,https://www.airbnb.cl/rooms/786363840321494040?adults=1&children=0&infants=0&pets=0&check_in=2023-03-01&check_out=2023-03-06&previous_page_section_name=1000&federated_search_id=a070a534-511d-4325-854b-25aff23bee81
184,Casa en condominio en La Serena,Alojamiento entero,La Serena,Coquimbo,6,3,3, Habitaci칩n,"2,5",privado,77.6,-29.9436,-71.2688,"https://maps.google.com/maps?ll=-29.9436,-71.2688&z=14&t=m&hl=es&gl=CL&mapclient=apiv3",,"Hermosa casa en condominio tranquilo y seguro para la familia en La Serena. Excelente ubicaci칩n a dos cuadras de supermercado, bomba de bencina, farmacia y acceso a Regimiento Arica con bajada a la Avenida del Mar (10 minutos en auto). El condominio cuenta con seguridad las 24 horas, estacionamiento con capacidad para 3 veh칤culos y plaza con juegos infantiles.",['Cocina'],,,Camila,12-2018,https://www.airbnb.cl/rooms/791997433490685643?adults=1&children=0&infants=0&pets=0&check_in=2023-03-01&check_out=2023-03-08&previous_page_section_name=1000&federated_search_id=a070a534-511d-4325-854b-25aff23bee81
185,Casa en Pichidangui vista al mar,Alojamiento entero,Pichidangui,Coquimbo Region,6,5,3, Habitaci칩n,"2,5",privado,62.0,-32.14127,-71.52116,"https://maps.google.com/maps?ll=-32.14127,-71.52116&z=14&t=m&hl=es&gl=CL&mapclient=apiv3",,"Agradable casa con vista al mar y al bosque, frente al humedal, varias habitaciones, apta familias o grupo de amigos. Cuenta con cocina equipada, terraza con vista y peque침o jard칤n.",['Cocina'],4.64,11,Claudia,12-2013,https://www.airbnb.cl/rooms/10206205?adults=1&children=0&infants=0&pets=0&check_in=2023-04-01&check_out=2023-04-07&previous_page_section_name=1000&federated_search_id=a070a534-511d-4325-854b-25aff23bee81
186,Agradable casa a metros de playa,Alojamiento entero,Coquimbo,Chile,7,5,4, Habitaci칩n,2,privado,79.0,-29.9654,-71.305,"https://maps.google.com/maps?ll=-29.9654,-71.305&z=14&t=m&hl=es&gl=CL&mapclient=apiv3",,"Lleva a toda la familia a este fant치stico lugar con muchas zonas para
divertirse a metros de la playa. Son 138 mts  de construcci칩n con patio y estacionamiento, 4 habitaciones

El espacio
La casa esta ubicada en un condominio tranquilo a 800 mtrs de la playa, cuenta con estacionamiento para dos autos, y su living comedor es muy espacioso, en el hay piano. La cocina es amplia y bien equipada, tiene lavadero que cuenta con lavadora- secadora nueva. El patio cuenta con terraza de asados y barra de ejercicio, caja de arena para ni침os. La pieza matrimonial es grande, y las dem치s piezas son muy c칩modas para una estad칤a placentera. El barrio es muy tranquilo y se puede compartir tranquilamente. Los esperamos",['Acceso la playa P칰blico o compartido'],,,Marcela,04-2018,https://www.airbnb.cl/rooms/732815677547456933?adults=1&children=0&infants=0&pets=0&check_in=2023-03-01&check_out=2023-03-06&previous_page_section_name=1000&federated_search_id=a070a534-511d-4325-854b-25aff23bee81
187,Casa Top en Puerto Velero,Alojamiento entero,Puerto Velero,Regi칩n de Coquimbo,10,12,5, Habitaci칩n,6,privado,350.0,-30.244,-71.47888,"https://maps.google.com/maps?ll=-30.244,-71.47888&z=14&t=m&hl=es&gl=CL&mapclient=apiv3",,"Vista privilegiada a la bah칤a, 1200 metros de jard칤n,accesos controlados con guardias privados, 4 dormitorios para 10 personas, mas servicio,estacionamiento 5 autos, full equipada, 2 kayacs, resort con cancha golf par 3 de 18 hoyos, piscinas, canchas tenis, futbol, marina para lanchas y veleros, mini market,restoranes, gimnasio

El espacio
Casa de alt칤simo est치ndar, excelentemente equipada y decorada, extraordinario jard칤n y privilegiada vista a la bah칤a y playa. Casa 2 pisos con 2 dormitorios con ba침o en suit, mas 2 dormitorios con 3 camas cada uno, pieza ni침os y ni침itas. Dormitorio adicional de servicio o para j칩venes, con camarote y ba침o en suit. Mejor alternativa en el Resort",['Vista al jard칤n'],4.82,11,Juan Pablo,08-2014,https://www.airbnb.cl/rooms/13585395?adults=1&children=0&infants=0&pets=0&check_in=2023-03-01&check_out=2023-03-08&previous_page_section_name=1000&federated_search_id=ce92c4a5-c79a-45bf-b2f7-57a2e6bbbe8e
188,Casa con piscina y quincho,Alojamiento entero,Villa El Array치n,Coquimbo,8,3,4, Habitaci칩n,3,privado,200.0,-30.0057,-71.014,"https://maps.google.com/maps?ll=-30.0057,-71.014&z=14&t=m&hl=es&gl=CL&mapclient=apiv3",,"Casa ubicada a 27 kil칩metros de La Serena y 29 kilometro de Vicu침a, restaurantes, cafeter칤as cerca ,cuenta con piscina con cerco, quincho,3 habitaciones y 3 ba침os. Amplia cocina full equipada,cama saltarina para ni침os,mesa de pingpong,columpio,internet, Netflix y Disney plus. un ambiente relajante ideal para vacaciones en familia.",['Cocina'],,,Nisel,11-2021,https://www.airbnb.cl/rooms/799167496448451018?adults=1&children=0&infants=0&pets=0&check_in=2023-12-01&check_out=2023-12-08&previous_page_section_name=1000&federated_search_id=ce92c4a5-c79a-45bf-b2f7-57a2e6bbbe8e
189,Casa entera a 15 minutos de playa,Alojamiento entero,Coquimbo,Chile,4,4,2, Habitaci칩n,1,privado,31.68,-29.9881,-71.31827,"https://maps.google.com/maps?ll=-29.9881,-71.31827&z=14&t=m&hl=es&gl=CL&mapclient=apiv3",,"Rel치jate con toda la familia en este alojamiento donde la tranquilidad se respira. A 10-15 minutos de la playa herradura en vehiculo. Cercano a 5 minutos  de supermercado en vehiculo, o 15 minutos caminando. Locomoci칩n colectiva o bus a centro la serena o coquimbo, a 5 cuadras.

El espacio
Nuestro hogar esta cerano a cerros. A menos de una cuadra de una peque침a plaza. Ideal para familias. Sector tranquilo.",['Vista a las monta침as'],4.83,6,Pamela,05-2018,https://www.airbnb.cl/rooms/784888200486947212?adults=1&children=0&infants=0&pets=0&check_in=2024-01-06&check_out=2024-01-13&previous_page_section_name=1000&federated_search_id=ce92c4a5-c79a-45bf-b2f7-57a2e6bbbe8e
190,hermosa casa cerca de la playa,Alojamiento entero,Coquimbo,Chile,7,5,3, Habitaci칩n,"3,5",privado,89.62,-29.99739,-71.3325,"https://maps.google.com/maps?ll=-29.99739,-71.3325&z=14&t=m&hl=es&gl=CL&mapclient=apiv3",,Este alojamiento 칰nico tiene mucho espacio para que disfrutes con los tuyos.,['Acceso la playa P칰blico o compartido'],,,Gregory,03-2022,https://www.airbnb.cl/rooms/802069527830084345?adults=1&children=0&infants=0&pets=0&check_in=2023-03-01&check_out=2023-03-06&previous_page_section_name=1000&federated_search_id=ce92c4a5-c79a-45bf-b2f7-57a2e6bbbe8e
191,Casa Guanaqueros,Bungalow entero,Guanaqueros,Coquimbo Region,8,6,3, Habitaci칩n,2,privado,89.0,-30.19915,-71.43247,"https://maps.google.com/maps?ll=-30.19915,-71.43247&z=14&t=m&hl=es&gl=CL&mapclient=apiv3",,Casa equipada con horno el칠ctrico microondas tv clave amplio estacionamiento restaurante y feria s칰per mercado cerca playa a 30 minutos de La Serena,"['Acceso a la playa', 'Frente a la playa']",4.86,7,Cecilia,12-2018,https://www.airbnb.cl/rooms/30676009?adults=1&children=0&infants=0&pets=0&check_in=2023-03-01&check_out=2023-03-06&previous_page_section_name=1000&federated_search_id=ce92c4a5-c79a-45bf-b2f7-57a2e6bbbe8e
192,Casa 11 personas los Vilos turismo norte,Alojamiento entero,Los Vilos,Coquimbo,11,9,5, Habitaci칩n,"2,5",privado,90.0,-31.90842,-71.49727,"https://maps.google.com/maps?ll=-31.90842,-71.49727&z=14&t=m&hl=es&gl=CL&mapclient=apiv3",,"Desconecta de tus preocupaciones en este espacio tan amplio y sereno.
Casa en los Vilos ..sector tur칤smo norte.
amplia,grandes espacios , para compartir dos familias,dos piezas con camas de dos plazas y otras dobles con camas de una plaza .
Total de 11 personas en camas,ampliable a m치s a칰n si se requiere.
Estaci칩namiento hasta 3 veh칤culos .cercana a avenida principal ..bajada a la playa 8 minutos.
Comparte con caba침a interior hasta 5 personas m치s .ideal para grupo familiar o amigos TV x pieza",['Acceso la playa P칰blico o compartido'],,,Jorge,01-2019,https://www.airbnb.cl/rooms/788596981548041845?adults=1&children=0&infants=0&pets=0&check_in=2023-03-01&check_out=2023-03-06&previous_page_section_name=1000&federated_search_id=ce92c4a5-c79a-45bf-b2f7-57a2e6bbbe8e
193,Guanaqueros Hermosa casa veraneo $95.000/noche,Habitaci칩n privada en chal칠,Guanaqueros,Regi칩n de Coquimbo,6,3,3, Habitaci칩n,2,privado,95.0,-30.20131,-71.42058,"https://maps.google.com/maps?ll=-30.20131,-71.42058&z=14&t=m&hl=es&gl=CL&mapclient=apiv3",,"Arriendo Caba침a en Guanaqueros , IV REG. Maravilloso chalet , enorme terraza panor치mica , sito privado , para tu desconexi칩n total $110.000/noche empotrada en pilotes, amplia terraza panor치mica con vista al mar ,muy acogedora, estacionamiento interior en barrio tranquilo con excelente conectividad , smart tv(disp para app net, internet satelital c/wifi , ubicada en zona seguridad de tsunami a 3 cuadras de la playa ,30 minutos de Coquimbo y La Serena , a 90 minutos del m칤stico  Valle del Elqui.


Dormitorios individuales absoluta privacidad, c칩modas dependencias, solo sentir치s el encantador sonido de las olas, el canto de las aves marinas.
Para 4-6 personas , cuenta con un dormitorio matrimonial , 2 dormitorios individuales con una cama de 1 plaza cada uno. En el living 2 Futones  sof치 - cama de 1 plaza y 1/2 cada uno. Cocina con cocina a gas, refrigerador, horno microondas y horno .
el칠ctrico . Televisi칩n 50""satelital en 치rea com칰n living comedor, un segundo tv con dvd y pel칤culas en dormitorio matrimonial.
Dos ba침os; 1 en la planta alta  con agua caliente dentro sector dormitorios. Un segundo ba침o en la planta baja de la casa  donde tambi칠n  est치 instalada la lavander칤a . Este segundo ba침o cuenta con agua fr칤a solamente.
El terreno en el cual se encuentra emplazada la edificaci칩n de la casa es de 400 m2 con amplia 치rea de estacionamiento .
La amplia terraza panor치mica  techada ,equipada con mesas , sillas y c칩modo sof치 , un segundo refrigerador amplio permite disfrutar de desayunos , almuerzos y veladas  en el exterior al aire libre",['Costa'],5.0,3,Vilma Marcela,10-2016,https://www.airbnb.cl/rooms/15955489?adults=1&children=0&infants=0&pets=0&check_in=2023-03-01&check_out=2023-03-06&previous_page_section_name=1000&federated_search_id=ce92c4a5-c79a-45bf-b2f7-57a2e6bbbe8e
194,Playa y campo,Caba침a entero,La Ligua,Valpara칤so,4,5,2, Habitaci칩n,1,privado,60.0,-32.27637,-71.47082,"https://maps.google.com/maps?ll=-32.27637,-71.47082&z=14&t=m&hl=es&gl=CL&mapclient=apiv3",,"Crea recuerdos inolvidables en este alojamiento 칰nico y familiar, todo  para pasar unas minivaCaciones, TV cable, parrilla, juegos  mesa de pin-pon,cama el치stica, taca-taca, etc

El espacio
El lugar es tranquilo mezcla de playa y campo, rural, amigable con el medio ambiente",['Acceso la playa P칰blico o compartido'],5.0,3,Maria Isabel,09-2021,https://www.airbnb.cl/rooms/52165161?adults=1&children=0&infants=0&pets=0&check_in=2023-03-01&check_out=2023-03-06&previous_page_section_name=1000&federated_search_id=ce92c4a5-c79a-45bf-b2f7-57a2e6bbbe8e
