,Titulo1,Titulo2,Comuna,Region,Capacidad,Camas,N_Habitaciones,Habitaciones,Baños,Tipo_Baños,Precio,lat,lon,Ubicacion,Ubides,Descripcion,Servicios,Nota,Nnota,Anfitrion,Registro,Link
173,parcela casa acogedora y agradable para descansar,Alojamiento entero,Coquimbo,Chile,4,3,3, Habitación,1,privado,63.0,-30.0196,-71.2141,"https://maps.google.com/maps?ll=-30.0196,-71.2141&z=14&t=m&hl=es&gl=CL&mapclient=apiv3",,"Desconecta de tus preocupaciones en este espacio tan amplio y sereno.

El espacio
Parcela Campestre, amplia casa y terreno, cuenta hasta con Canil por si quiere viajar con su mascota.",['Cocina'],,,Valeska Nikkol,01-2023,https://www.airbnb.cl/rooms/809009123855454822?adults=1&children=0&infants=0&pets=0&check_in=2023-03-01&check_out=2023-03-06&previous_page_section_name=1000&federated_search_id=3a61f76c-7778-474b-b92a-97e62c31c28c
174,Bella Casa en Bahía Azul,Alojamiento entero,Los Vilos,Coquimbo Region,6,3,3, Habitación,2,privado,110.0,-32.00308,-71.51818,"https://maps.google.com/maps?ll=-32.00308,-71.51818&z=14&t=m&hl=es&gl=CL&mapclient=apiv3",,"La casa tiene 3 habitaciones que pueden acomodar 6 personas máximo. Cocina americana, dos baños, living comedor amplio, ideal para parejas, familias grandes o grupos de amigos o amigas que quieran pasar un tiempo agradable alejados del ruido de la ciudad. La casa está emplazada dentro del condominio de Bahía Azul y acceso exclusivo a los roquerios

Acceso de los huéspedes
Tienes derecho a usar toda la casa, excepto  el segundo piso ya que no  esta  habilitado .",['Acceso la playa Público o compartido'],4.64,11,Catalina,03-2018,https://www.airbnb.cl/rooms/33881492?adults=1&children=0&infants=0&pets=0&check_in=2023-03-01&check_out=2023-03-06&previous_page_section_name=1000&federated_search_id=3a61f76c-7778-474b-b92a-97e62c31c28c
175,Casa en Pichidangui: kites y winds,Chalé entero,Pichidangui,Coquimbo Region,6,5,3, Habitación,"1,5",privado,90.0,-32.13701,-71.51716,"https://maps.google.com/maps?ll=-32.13701,-71.51716&z=14&t=m&hl=es&gl=CL&mapclient=apiv3",,"Linda casa en Pichidangui. Muy bien ubicada entre el bosque y la playa, protegido del viento, silencioso y tranquilo. 7 minutos caminando a la playa. Pichidangui es ideal para practicar kitesurf y windsurf. Lindo lugar!
Para vacaciones de invierno, verano y septiembre se arrienda mínimo 1 semana.

El espacio
Cabañita bien mantenida. Capacidad para 6 personas: 3 piezas, 1 baño, cocina, comedor y living con TV y antena Directv si se quiere tener cable (prepago). Agradable y amplia terraza con parrilla y lugar para hacer fogón.",['Acceso a la playa'],4.61,37,Olivia,04-2016,https://www.airbnb.cl/rooms/12268241?adults=1&children=0&infants=0&pets=0&check_in=2023-03-01&check_out=2023-03-07&previous_page_section_name=1000&federated_search_id=3a61f76c-7778-474b-b92a-97e62c31c28c
176,Casa Coquimbo a Menos de 10 Minutos de la playa,Alojamiento entero,Coquimbo,Chile,6,5,3, Habitación,1,privado,60.0,-29.97463,-71.31201,"https://maps.google.com/maps?ll=-29.97463,-71.31201&z=14&t=m&hl=es&gl=CL&mapclient=apiv3",,"Cómoda casa habilitada para 6 personas y con todas las comodidades para llegar y disfrutar, a menos 10 minutos de la playa y frente al hermoso valle de la cantera. 
En el sector encontrarás áreas verdes, Mirador, Plazas, Bencineras, Supermercados, mini mercados, etc. 
Y lo mejor es la tranquilidad y seguridad del sector. 
A 15 minutos del puerto de Coquimbo, 30 minutos de La Serena, 1 hora de Ovalle, 1 hora 1/2 Del Valle de Elqui y Punta de choros


Living comedor con 3 dormitorios, baño, cocina y patio con estacionamiento personal","['Acceso a la playa', 'Frente a la playa']",5.0,4,Christian,12-2019,https://www.airbnb.cl/rooms/41034725?adults=1&children=0&infants=0&pets=0&check_in=2023-05-15&check_out=2023-05-22&previous_page_section_name=1000&federated_search_id=3a61f76c-7778-474b-b92a-97e62c31c28c
177,casa acogedora,Alojamiento entero,Coquimbo,Chile,5,4,3, Habitación,1,privado,40.498,-29.99507,-71.31827,"https://maps.google.com/maps?ll=-29.99507,-71.31827&z=14&t=m&hl=es&gl=CL&mapclient=apiv3",,Relájate con toda la familia en este alojamiento donde la tranquilidad se respira.,['Tina'],,,Yolanda,11-2022,https://www.airbnb.cl/rooms/811710124349551072?adults=1&children=0&infants=0&pets=0&check_in=2023-03-01&check_out=2023-03-06&previous_page_section_name=1000&federated_search_id=3a61f76c-7778-474b-b92a-97e62c31c28c
178,Casa amplia y cómoda,Alojamiento entero,Los Vilos,Coquimbo,5,6,3, Habitación,1,privado,35.0,-31.91083,-71.49787,"https://maps.google.com/maps?ll=-31.91083,-71.49787&z=14&t=m&hl=es&gl=CL&mapclient=apiv3",,"Casa cómoda,  privacidad completa, no se comparte espacios, sector tranquilo a 2 cuadras de policía (PDI), a 6 cuadras de la playa, fuera de zona de riesgo de tsunami, locomoción colectiva a la puerta. No hay otros huéspedes,  contacto con propietario cada 1-3 días (dependiendo temporada) para poder regar plantas y árboles del lugar que no se muestran en las fotos, se avisa del acceso y se ingresa por un pasillo lateral. Lavadora de ropa de 9 Kg",['Costa'],,,César,03-2020,https://www.airbnb.cl/rooms/42841941?adults=1&children=0&infants=0&pets=0&check_in=2023-03-01&check_out=2023-03-06&previous_page_section_name=1000&federated_search_id=3a61f76c-7778-474b-b92a-97e62c31c28c
179,Los Molles Loft frete al mar,Alojamiento entero,Los Molles,Región de Valparaíso,5,3,2, Habitación,"1,5",privado,55.0,-32.23855,-71.51234,"https://maps.google.com/maps?ll=-32.23855,-71.51234&z=14&t=m&hl=es&gl=CL&mapclient=apiv3",,"Hermoso Loft con ubicación privilegiada frente al mar, cuenta con 2 Dormitorios, 2 baños, Cocina, Living y comedor, y terraza con hermosa vista frente al mar. Ideal para tomar unas vacaciones en pareja o en familia.

Otros aspectos a destacar
Los Molles es el ultimo balneario de la región de Valparaiso, a parte de su hermosa playa, cuenta con  una reserva ecológica que por su valor botánico ocupa el IV lugar a  nivel mundial de la biodiversidad, encontrando en el especies endémicas.  A esta riqueza del suelo se suma el valor arqueológico que en ella existe. A nivel oceánico  posee una riqueza inconmensurable, llena de arrecifes y una variedad de especies marinas, casi comparable a los paisajes del caribe y de Isla de Pascua.
Como posibles panoramas tenemos:  visitar la reserva, esta puede ser a pie o en Bicicleta, en donde podrás visualizar lo antes descrito encontrando particularidades tales como el Puquen (caverna  natural que encajona la fuerza del mar sonidos y vapor similar a un volcán en erupción, formaciones rocosas que forman piscinas naturales, con una gran cantidad de sal que permite flotar. Paseo en bote, que desde el mar tiene la vista al continente en donde podrás ver lo mismo pero desde otra perspectiva, visitando la isla de los Lobos y pingüinos de Humboldt. Anexo al sector playa cruzando la carretera se encuentra Villa Huaquen, asentamiento que proviene de la época de la reforma agraria de 1965.  En esta podrán encontrar artesanías en cuero, tejidos y flores, también encontraras una empresa de turismo aventura, estos ofrecen servicios de cabalgata y canopi entre otros",['Cocina'],4.65,51,Nancy,12-2016,https://www.airbnb.cl/rooms/27019356?adults=1&children=0&infants=0&pets=0&check_in=2023-03-06&check_out=2023-03-11&previous_page_section_name=1000&federated_search_id=3a61f76c-7778-474b-b92a-97e62c31c28c
180,Casa en la serena,Alojamiento entero,La Serena,Coquimbo,6,3,3, Habitación,"4,5",privado,300.0,-29.94558,-71.24231,"https://maps.google.com/maps?ll=-29.94558,-71.24231&z=14&t=m&hl=es&gl=CL&mapclient=apiv3",,"Espectacular casa ubicada en cerro grande sector más exclusivo de La Serena con vista privilegiada la costa del litoral, un lugar perfecto para pasar momentos en familia.

El espacio
Casa Chepa está situado en la punta de una colina, tranquilidad inigualable, seguridad 24 hrs .","['Acceso a la playa', 'Frente a la playa']",,,Nicole,05-2016,https://www.airbnb.cl/rooms/39768507?adults=1&children=0&infants=0&pets=0&check_in=2023-03-03&check_out=2023-03-08&previous_page_section_name=1000&federated_search_id=3a61f76c-7778-474b-b92a-97e62c31c28c
181,Casa para 7 personas,Alojamiento entero,Elqui,Coquimbo,7,5,3, Habitación,2,privado,68.0,-29.9839,-71.3365,"https://maps.google.com/maps?ll=-29.9839,-71.3365&z=14&t=m&hl=es&gl=CL&mapclient=apiv3",,"Casa independiente en Región de Coquimbo, sector Sindempart, a minutos de Playa La Herradura, sector tranquilo y familiar.

*Capacidad para 7 personas
*3 habitaciones  
*2 baños (1 suite )
*Se aceptan mascotas con padres responsable ♡


Lugar tranquilo, acogedor y familiar.
Cerca de :
*Supermercado
*Farmacia
*Almacén 
*Pastelería 
*Botilleria
*Locales de comida
*Locomoción",['Cocina'],,,Constanza,12-2017,https://www.airbnb.cl/rooms/803210220755181579?adults=1&children=0&infants=0&pets=0&check_in=2023-03-01&check_out=2023-03-06&previous_page_section_name=1000&federated_search_id=3a61f76c-7778-474b-b92a-97e62c31c28c
182,Vista Los Molles,Alojamiento entero,Los Molles,Valparaíso,6,3,3, Habitación,2,privado,119.6,-32.23405,-71.49993,"https://maps.google.com/maps?ll=-32.23405,-71.49993&z=14&t=m&hl=es&gl=CL&mapclient=apiv3",,"Preciosa casa en condominio, Los Molles con accesos controlados, en hermoso entorno natural.
Casa moderna nueva con vista privilegiada al mar, totalmente equipada para 6 personas, 3 Habitaciones, 2 baños y cocina.
La casa cuenta con bomba de agua hidropack, por lo que no hay problemas de presión de agua.

* NO SE ACEPTAN MASCOTAS.
* *   mínimo  4 noches 
* **  Periodo verano, Se arrienda mínimo 7 noches


Los Molles es un lugar tranquilo y seguro para disfrutar, ambiente ideal para el descanso familiar. Tiene un hermoso balneario, también cuenta con restaurantes y locales con variedad de gastronomía. Para entretención ofrece distintas actividades  buceo deportivo y recreativo, surf , turismo aventura entre otras.",['Costa'],4.95,19,Evelin,09-2017,https://www.airbnb.cl/rooms/20915669?adults=1&children=0&infants=0&pets=0&check_in=2023-03-01&check_out=2023-03-08&previous_page_section_name=1000&federated_search_id=3a61f76c-7778-474b-b92a-97e62c31c28c
183,Casa Valle de Elqui,Alojamiento entero,La Serena,Coquimbo,8,8,4, Habitación,2,privado,129.0,-29.9813,-71.0987,"https://maps.google.com/maps?ll=-29.9813,-71.0987&z=14&t=m&hl=es&gl=CL&mapclient=apiv3",,"Disfruta en familia de un espacio tranquilo y acogedor bajo el cielo estrellado del Valle de Elqui.

El espacio
Cómoda casa de campo ubicada camino al Valle de Elqui, cuenta con piscina, sector para asados, sector de juegos para niños y niñas, muy segura y tranquila al interior de un condominio. Te permite descansar y contemplar el cielo estrellado.",['Vista al valle'],,,Angélica,02-2023,https://www.airbnb.cl/rooms/825399778129402925?adults=1&children=0&infants=0&pets=0&check_in=2023-03-01&check_out=2023-03-06&previous_page_section_name=1000&federated_search_id=3a61f76c-7778-474b-b92a-97e62c31c28c
184,Hermosa casa guanaqueros a 5 min de la playa a pie,Alojamiento entero,Guanaqueros,Coquimbo,10,8,4, Habitación,2,privado,150.0,-30.19799,-71.42103,"https://maps.google.com/maps?ll=-30.19799,-71.42103&z=14&t=m&hl=es&gl=CL&mapclient=apiv3",,"Hermosa casa en guanaqueros, a 10
Minutos del centro y a 5 de la playa caminando.
Tiene una gran terraza para disfrutar del gran clima de la IV region. 
Cuenta con lavadora y un patio interior con lavadero.

El espacio
Toda la casa y sus beneficios",['Cocina'],,,Roberto,09-2018,https://www.airbnb.cl/rooms/31308891?adults=1&children=0&infants=0&pets=0&check_in=2023-03-09&check_out=2023-03-14&previous_page_section_name=1000&federated_search_id=3a61f76c-7778-474b-b92a-97e62c31c28c
185,Casa entera en playa de Totoralillo,Cabaña entero,Coquimbo,Chile,6,4,3, Habitación,"1,5",privado,100.0,-30.06467,-71.36593,"https://maps.google.com/maps?ll=-30.06467,-71.36593&z=14&t=m&hl=es&gl=CL&mapclient=apiv3",,"Vuelve a conectarte con tus seres queridos en este alojamiento ideal para familias y amantes del los deportes al aire libre como es surf, treking, bicicleta, escalada. 

Hermosa cabaña ubicado en el principado de Totoralillo, Coquimbo. Chile

El espacio
Se encuentra en pueblo de totoralillo, a 50 mts cuentas con un Minimarket donde puedes encontrar de todo para el uso diario como compras de pan, bebidas, etc. Además de contar con una caleta de pescadores donde puedes encontrar marisco y pescados frescos, si te apasiona el deporte outdoor, este spot es ideal ya que cuentas con caminos de treking, zona de escaladas, lugares para recorrer en bicicleta como el desafío cerró Vietnam 🇻🇳, y por último el Océano Pacífico a Totoralillo lo premió con olas espectaculares para realizar surf o body. Además de buceo y otros deportes acuáticos.",['Acceso a la playa'],3.71,7,Francisco,12-2017,https://www.airbnb.cl/rooms/563020843178577185?adults=1&children=0&infants=0&pets=0&check_in=2023-03-01&check_out=2023-03-06&previous_page_section_name=1000&federated_search_id=3a61f76c-7778-474b-b92a-97e62c31c28c
186,CASA CONDOMINIO PUERTO VELERO,Alojamiento entero,Puerto Velero,Región de Coquimbo,8,7,4, Habitación,3,privado,260.0,-30.24302,-71.47869,"https://maps.google.com/maps?ll=-30.24302,-71.47869&z=14&t=m&hl=es&gl=CL&mapclient=apiv3",,"Casa en Condominio de Puerto Velero, increíble vistas y lugar de descanso familiar. Te va a encantar mi lugar debido la Vista privilegiada a la bahia de Tongoy y Playa de puerto Velero. Casa y terraza amplia y comoda.
.",['Cocina'],4.86,8,Sebastian,06-2016,https://www.airbnb.cl/rooms/13477459?adults=1&children=0&infants=0&pets=0&check_in=2023-03-01&check_out=2023-03-08&previous_page_section_name=1000&federated_search_id=21bf470c-d433-4dfb-9d23-5c59db95d915
187,Enamórate de Tongoy,Cabaña entero,Tongoy,Coquimbo Region,6,4,3, Habitación,2,privado,130.0,-30.25292,-71.49924,"https://maps.google.com/maps?ll=-30.25292,-71.49924&z=14&t=m&hl=es&gl=CL&mapclient=apiv3",,"Cabaña acogedora y funcional con orientación sur y vista al mar. Tiene una gran terraza soleada en verano, bonito quincho y estacionamiento interior para dos autos.
Living, comedor y cocina están integrados, lo que produce un grato ambiente.
La casa se encuentra en la parte alta de la península, sector tranquilo con hermosa vegetación que atrae distintos tipos de aves silvestres, picaflores, mirlos , tordos, chunchos  y a veces lechuzas.

(Fianza será evaluada según el daño hecho a la propiedad)","['Acceso a la playa', 'Frente a la playa']",4.83,23,Lorena,01-2019,https://www.airbnb.cl/rooms/33370093?adults=1&children=0&infants=0&pets=0&check_in=2023-03-01&check_out=2023-03-06&previous_page_section_name=1000&federated_search_id=21bf470c-d433-4dfb-9d23-5c59db95d915
188,Casa grande de Verano en Coquimbo,Alojamiento entero,Coquimbo,Chile,6,4,3, Habitación,2,privado,85.0,-29.9941,-71.3484,"https://maps.google.com/maps?ll=-29.9941,-71.3484&z=14&t=m&hl=es&gl=CL&mapclient=apiv3",,Lleva a tu gente a este fantástico hogar ideal para familias de 6 integrantes. Casa veraniega ubicada cerca de muchas zonas divertidas para este verano. 🏝☀️,['Acceso la playa Público o compartido'],,,Caul,12-2022,https://www.airbnb.cl/rooms/792851785147768671?adults=1&children=0&infants=0&pets=0&check_in=2023-03-01&check_out=2023-03-06&previous_page_section_name=1000&federated_search_id=21bf470c-d433-4dfb-9d23-5c59db95d915
189,Casa en la Florida,Alojamiento entero,La Serena,Coquimbo,5,4,3, Habitación,"1,5",privado,40.11,-29.92259,-71.20229,"https://maps.google.com/maps?ll=-29.92259,-71.20229&z=14&t=m&hl=es&gl=CL&mapclient=apiv3",,"Se ofrece casa ubicada en La Florida para alojamiento temporal a familias, trabajadores, amigos, parejas...
cercano a supermercados, canchas de fútbol, a pasos del aeropuerto, camino al valle del Elqui...
la casa queda a completa disposición, se pueden realizar asados a carbón, cocina completamente equipada, cuenta con lavadora, además estacionamiento dentro de casa con capacidad para dos vehículos...
la casa esta afecta a reglamento de condominio por lo que estan prohibidas fiestas y eventos.",['Cocina'],5.0,3,Rodrigo,12-2020,https://www.airbnb.cl/rooms/47095632?adults=1&children=0&infants=0&pets=0&check_in=2023-03-12&check_out=2023-03-17&previous_page_section_name=1000&federated_search_id=21bf470c-d433-4dfb-9d23-5c59db95d915
190,Casa full equipada 6 personas,Alojamiento entero,Coquimbo,Chile,6,4,3, Habitación,2,privado,112.2,-29.9718,-71.2904,"https://maps.google.com/maps?ll=-29.9718,-71.2904&z=14&t=m&hl=es&gl=CL&mapclient=apiv3",,"Relájate con toda la familia en este tranquilo lugar para quedarse, cerca de todo; mall, centros comerciales, playa, carretera, mcdonald, bencineras y mucho mas .",['Cocina'],,,Luz Andrea,01-2023,https://www.airbnb.cl/rooms/807151448015873633?adults=1&children=0&infants=0&pets=0&check_in=2023-03-01&check_out=2023-03-06&previous_page_section_name=1000&federated_search_id=21bf470c-d433-4dfb-9d23-5c59db95d915
191,Casa Guanaqueros,Bungalow entero,Guanaqueros,Coquimbo Region,8,6,3, Habitación,2,privado,89.0,-30.19915,-71.43247,"https://maps.google.com/maps?ll=-30.19915,-71.43247&z=14&t=m&hl=es&gl=CL&mapclient=apiv3",,Casa equipada con horno eléctrico microondas tv clave amplio estacionamiento restaurante y feria súper mercado cerca playa a 30 minutos de La Serena,"['Acceso a la playa', 'Frente a la playa']",4.86,7,Cecilia,12-2018,https://www.airbnb.cl/rooms/30676009?adults=1&children=0&infants=0&pets=0&check_in=2023-03-01&check_out=2023-03-06&previous_page_section_name=1000&federated_search_id=21bf470c-d433-4dfb-9d23-5c59db95d915
192,LAGAR ANITA 2 minutos Playa los Choros sol y mar,Habitación privada en casa de campo,Los Choros,Coquimbo,4,4,2, Habitación,1compartido,compartido,35.1,-29.2603,-71.0279,"https://maps.google.com/maps?ll=-29.2603,-71.0279&z=14&t=m&hl=es&gl=CL&mapclient=apiv3",,"LAGAR ANITA ubicado en el pueblo de LOS CHOROS  espacioso, buen  equipamiento y ubicaciòn, comodo ,buena iluminación, soleado, dormitorio matrimonial y otro  para hasta 2personas, baño con shower door, agua caliente y ducha turca ,comedor y una kitchenette full equipada ,refrigerador con freezer, una amplia terraza y estacionamiento privado. full equipo.

El espacio
amplios espacios ,independiente, tranquilo y amigable.",['Acceso la playa Público o compartido'],,,Diego,02-2019,https://www.airbnb.cl/rooms/37497138?adults=1&children=0&infants=0&pets=0&check_in=2023-03-01&check_out=2023-03-06&previous_page_section_name=1000&federated_search_id=21bf470c-d433-4dfb-9d23-5c59db95d915
193,Casa con piscina y quincho,Alojamiento entero,Villa El Arrayán,Coquimbo,8,3,4, Habitación,3,privado,200.0,-30.0057,-71.014,"https://maps.google.com/maps?ll=-30.0057,-71.014&z=14&t=m&hl=es&gl=CL&mapclient=apiv3",,"Casa ubicada a 27 kilómetros de La Serena y 29 kilometro de Vicuña, restaurantes, cafeterías cerca ,cuenta con piscina con cerco, quincho,3 habitaciones y 3 baños. Amplia cocina full equipada,cama saltarina para niños,mesa de pingpong,columpio,internet, Netflix y Disney plus. un ambiente relajante ideal para vacaciones en familia.",['Cocina'],,,Nisel,11-2021,https://www.airbnb.cl/rooms/799167496448451018?adults=1&children=0&infants=0&pets=0&check_in=2023-12-01&check_out=2023-12-07&previous_page_section_name=1000&federated_search_id=21bf470c-d433-4dfb-9d23-5c59db95d915
194,Casa familiar en Guanaqueros cercana a la playa,Alojamiento entero,Guanaqueros,Coquimbo,10,8,5, Habitación,2,privado,118.0,-30.19683,-71.42306,"https://maps.google.com/maps?ll=-30.19683,-71.42306&z=14&t=m&hl=es&gl=CL&mapclient=apiv3",,"Excelente casa familiar a 3 cuadras de centro de Guanaqueros y el acceso de playa completamente equipada para 10 personas se permiten mascotas bien portadas , además cerca de la entrada a sector de treking o bicicletas de montaña

El espacio
lugar tranquilo cercano al comercio de guanaqueros , en zona segura a 1 cuadra de la feria de los miércoles y sabado",['Acceso la playa Público o compartido'],4.33,3,Andrea,11-2018,https://www.airbnb.cl/rooms/53532276?adults=1&children=0&infants=0&pets=0&check_in=2023-03-01&check_out=2023-03-06&previous_page_section_name=1000&federated_search_id=21bf470c-d433-4dfb-9d23-5c59db95d915
195,"Casa Residencial Coquimbo, Chile",Alojamiento entero,Coquimbo,Chile,4,3,2, Habitación,2,privado,67.5,-29.96666,-71.30195,"https://maps.google.com/maps?ll=-29.96666,-71.30195&z=14&t=m&hl=es&gl=CL&mapclient=apiv3",,"¡Disfruta tu verano en nuestra hermosa casa de arriendo! Acogedora y espaciosa, cerca de las playas de Coquimbo. Con cocina, camas cómodas y sala de estar. Vecindario seguro, tranquilo, cerca de supermercados, restaurantes. A pocos pasos del mar y cerca de atracciones turísticas. ¡No pierdas esta oportunidad! ¡Te esperamos! Además, está cerca de la ciudad, para que puedas disfrutar de todo lo que ofrece. Un lugar perfecto para descansar y disfrutar de la naturaleza.


Experimenta una estancia acogedora en nuestra amplia y espectacular casa. Con espacios amplios y elegantes, nuestra casa es el lugar perfecto para relajarse y disfrutar. Las habitaciones están bien iluminadas y con cómodas camas.  Con un patio y una terraza privada, podrás disfrutar de una vista impresionante mientras disfrutas del sol y de la brisa del mar. Además, la casa cuenta con una decoración acogedora y todas las comodidades necesarias para una estancia cómoda. ¡No pierdas la oportunidad de experimentar la vida acogedora en nuestra hermosa casa! ¡Te esperamos!","['Acceso a playa Público o compartido', 'Frente a la playa']",,,Rodrigo,02-2019,https://www.airbnb.cl/rooms/32293241?adults=1&children=0&infants=0&pets=0&check_in=2023-03-01&check_out=2023-03-06&previous_page_section_name=1000&federated_search_id=21bf470c-d433-4dfb-9d23-5c59db95d915
196,lugar tranquilo,Cabaña entero,Coquimbo,Chile,4,3,2, Habitación,1,privado,35.555,-29.986,-71.3551,"https://maps.google.com/maps?ll=-29.986,-71.3551&z=14&t=m&hl=es&gl=CL&mapclient=apiv3",,"seguro, cerca de la playa , lugar tranquilo

El espacio
lugar comodo espacioso  para estar tranquilo en familia cerca de la playa estacionamiento y rustico",['Acceso a la playa'],,,Roberto,02-2023,https://www.airbnb.cl/rooms/824795835711622734?adults=1&children=0&infants=0&pets=0&check_in=2023-03-01&check_out=2023-03-06&previous_page_section_name=1000&federated_search_id=21bf470c-d433-4dfb-9d23-5c59db95d915
197,Acogedora casa en sector residencial,Alojamiento entero,La Serena,Coquimbo,6,4,3, Habitación,1,privado,60.0,-29.93885,-71.26082,"https://maps.google.com/maps?ll=-29.93885,-71.26082&z=14&t=m&hl=es&gl=CL&mapclient=apiv3",,"Disfruta como si estuvieras en tu casa,
Acogedor y comodo  espacio consta de living, comedor, cocina full equipada, lavadora, bicicleta spinning,wifi, smart tv, estacionamiento, patio con terraza y parrilla a carbon. Encontraras todo lo escencial para que puedas disfrutar tu estadia.

El espacio
La casa esta ubicada en un sector residencial de la ciudad, alta conectividd y plusvalia. 
Encontraras distintos tipos de restaurantes, cafés,  supermercados, almacenes, stripcenters 
Playa a pocos minutos 

Puedes encontrar locomocion a media cuadra",['Cocina'],4.20,5,Daniela,12-2019,https://www.airbnb.cl/rooms/54206215?adults=1&children=0&infants=0&pets=0&check_in=2023-03-01&check_out=2023-03-07&previous_page_section_name=1000&federated_search_id=21bf470c-d433-4dfb-9d23-5c59db95d915
198,Casa interior parcela,Alojamiento entero,Vicuña,Coquimbo Region,5,3,2, Habitación,1,privado,120.329,-30.03373,-70.65995,"https://maps.google.com/maps?ll=-30.03373,-70.65995&z=14&t=m&hl=es&gl=CL&mapclient=apiv3",,"2 dormitorios , living comedor cocina y lavadero. Acceso a piscina. Estacionamiento para 2 vehículos . TV satelital. Se encuentra a 100 mts de la Ruta 41  que va hacia Argentina y a 300 mts del Rio Elqui.En las cercanias hay 2 pueblos a menos de 1 km ( Peralillo y Diaguitas) Pueblos ancestrales y un observatorio astronomico ( Mamalluca) en que se pueden efectuar observaciones en las noches


Es una moderna casita de ladrillos tipo georgian completamente amoblada para 4 personas y una adicional en un sofacama en el living. 
Tengo 2 teklescopio para observaciones nocturnas y charlas sin costo con apoyo de videos del cielo nocturno del hemisferio sur.",['Vista al canal'],5.0,4,Alejandro,06-2016,https://www.airbnb.cl/rooms/17078337?adults=1&children=0&infants=0&pets=0&check_in=2023-03-01&check_out=2023-03-06&previous_page_section_name=1000&federated_search_id=21bf470c-d433-4dfb-9d23-5c59db95d915
199,"Amplia Casa en Villa Talinay, Guanaqueros",Cabaña entero,Coquimbo,Región de Coquimbo,8,6,3, Habitación,1,privado,95.0,-30.20172,-71.41854,"https://maps.google.com/maps?ll=-30.20172,-71.41854&z=14&t=m&hl=es&gl=CL&mapclient=apiv3",,"Cómo casa en barrio 100% residencial y alejado del ruido y ajetreo de la ciudad. Especial para descansar. Amplio patio y terraza para compartir actividades y comidas al aire libre. Con estacionamiento para 3 autos.
A 7 minutos caminando de la playa y a 20 minutos caminando de restaurantes, muelle y centro del pueblo.
Te va a encantar por las vistas al mar y pueblo y el espacio acogedor. Ideal para parejas, aventureros, viajeros de negocios, familias (con hijos), grupos grandes y mascotas.


Puedes tener acceso a todos los servicios de la casa, especialmente a la terraza y quincho para hacer asados, ideal para aprovechar las gratas temperaturas , tanto de día como de noche.",['Vista al jardín'],4.79,43,Adriana,01-2017,https://www.airbnb.cl/rooms/16683932?adults=1&children=0&infants=0&pets=0&check_in=2023-03-01&check_out=2023-03-06&previous_page_section_name=1000&federated_search_id=21bf470c-d433-4dfb-9d23-5c59db95d915
