,Titulo1,Titulo2,Comuna,Region,Capacidad,Camas,N_Habitaciones,Habitaciones,Baños,Tipo_Baños,Precio,lat,lon,Ubicacion,Ubides,Descripcion,Servicios,Nota,Nnota,Anfitrion,Registro,Link
21,Cómodo departamento en La Serena,Alojamiento entero,La Serena,Coquimbo,4,3,3, Habitación,1,privado,40.5,-29.92389,-71.19893,"https://maps.google.com/maps?ll=-29.92389,-71.19893&z=14&t=m&hl=es&gl=CL&mapclient=apiv3",,"Acogedor departamento en 4° piso (sin ascensor) de 3 dormitorios, cada uno con su respectiva cama. Ubicado en tranquilo y seguro condominio con seguridad 24/7 el cual cuenta con con cancha de entretención, juegos y máquinas de ejercicio. A pocas cuadras hay distintos supermercados. Locomoción en la puerta del condominio. 
Gracias a su ubicación estás a 10 minutos de El Faro y a 15 minutos del Valle de Elqui. Muy cercano a aeródromo


La ubicación de mi hogar es maravillosa, además de tener cerca supermercados, hay muchos almacenes y panaderias.",['Cocina'],,,Javiera,01-2019,https://www.airbnb.cl/rooms/31258680?adults=1&children=0&infants=0&pets=0&check_in=2023-04-17&check_out=2023-04-24&previous_page_section_name=1000&federated_search_id=149dfbb9-27c2-4648-b320-0ff5781bf201
22,Un lugar cerca de todo,Habitación privada en alojamiento,La Serena,Región de Coquimbo,1,1,4, Habitación,2,privado,35.0,-29.90168,-71.26156,"https://maps.google.com/maps?ll=-29.90168,-71.26156&z=14&t=m&hl=es&gl=CL&mapclient=apiv3",,,['Costa'],5.0,7,Viviana,09-2017,https://www.airbnb.cl/rooms/34511535?adults=1&children=0&infants=0&pets=0&check_in=2023-03-01&check_out=2023-03-06&previous_page_section_name=1000&federated_search_id=149dfbb9-27c2-4648-b320-0ff5781bf201
23,CASA COMPLETA PARA 6 PERSONAS,Alojamiento entero,La Serena,Región de Coquimbo,8,7,3, Habitación,2,privado,79.0,-29.92846,-71.25014,"https://maps.google.com/maps?ll=-29.92846,-71.25014&z=14&t=m&hl=es&gl=CL&mapclient=apiv3",,"Amplia casa para hasta 8 personas ubicada en el prestigioso barrio de San Joaquín en La Serena. 2 dormitorios y 1 baño, terraza y parrilla para disfrutar en familia. Cocina completamente equipada y cómodos espacios comunes.

El espacio
Ubicada en Avenida Juan Cisternas, esta cómoda casa cuenta con todas las amenidades necesarias para disfrutar vacaciones de calidad. Las opiniones de nuestros huéspedes avalan nuestro compromiso.",['Vista al horizonte de la ciudad'],4.71,21,Juan,11-2016,https://www.airbnb.cl/rooms/21912931?adults=1&children=0&infants=0&pets=0&check_in=2023-03-01&check_out=2023-03-06&previous_page_section_name=1000&federated_search_id=149dfbb9-27c2-4648-b320-0ff5781bf201
24,"Playa, Valle y turismo",Habitación privada en alojamiento,La Serena,Región de Coquimbo,1,1,7, Habitación,"4,5",privado,32.0,-29.90199,-71.26198,"https://maps.google.com/maps?ll=-29.90199,-71.26198&z=14&t=m&hl=es&gl=CL&mapclient=apiv3",,"Empapate de una cobinacion , rustica y contemporanea donde podras encontrar un espacio relajado , armonico y un grato ambiente

Acceso de los huéspedes
En nuestro hospedaje encontraras areas compartidas dala de estar comedor terraza , cosina , lavanderia.",['Costa'],5.0,3,Viviana,09-2017,https://www.airbnb.cl/rooms/35737563?adults=1&children=0&infants=0&pets=0&check_in=2023-03-01&check_out=2023-03-06&previous_page_section_name=1000&federated_search_id=149dfbb9-27c2-4648-b320-0ff5781bf201
25,Comoda y amplia casa en La Serena.,Alojamiento entero,La Serena,Región de Coquimbo,8,7,4, Habitación,3,privado,120.0,-29.9156,-71.2448,"https://maps.google.com/maps?ll=-29.9156,-71.2448&z=14&t=m&hl=es&gl=CL&mapclient=apiv3",,"Casa amplia, muy cómoda y segura, 160 metros cuadrados. Luminosa , cuenta con  living comedor, 4 dormitorios , principal en suite, dos baños. Cocina equipada, grande con comedor de diario, lavandería, amplio jardín posterior con terraza, ideal para asados y familias numerosas. Estacionamiento para 2 autos. 
Parrilla.


La casa es amplia y fresca, ideal para descansar o como base para ir a conocer los alrededores de la ciudad de La Serena como las playas cercanas como Totoralillo, Guanaqueros y Tongoy. O para ir a recorrer el Valle del Elqui.",['Cocina'],5.0,6,Familia,11-2018,https://www.airbnb.cl/rooms/31292494?adults=1&children=0&infants=0&pets=0&check_in=2023-03-01&check_out=2023-03-06&previous_page_section_name=1000&federated_search_id=149dfbb9-27c2-4648-b320-0ff5781bf201
