,Titulo1,Titulo2,Comuna,Region,Capacidad,Camas,N_Habitaciones,Habitaciones,Ba침os,Tipo_Ba침os,Precio,lat,lon,Ubicacion,Ubides,Descripcion,Servicios,Nota,Nnota,Anfitrion,Registro,Link
92,Bella Casa en Bah칤a Azul,Alojamiento entero,Los Vilos,Coquimbo Region,6,3,3, Habitaci칩n,2,privado,110.0,-32.00308,-71.51818,"https://maps.google.com/maps?ll=-32.00308,-71.51818&z=14&t=m&hl=es&gl=CL&mapclient=apiv3",,"La casa tiene 3 habitaciones que pueden acomodar 6 personas m치ximo. Cocina americana, dos ba침os, living comedor amplio, ideal para parejas, familias grandes o grupos de amigos o amigas que quieran pasar un tiempo agradable alejados del ruido de la ciudad. La casa est치 emplazada dentro del condominio de Bah칤a Azul y acceso exclusivo a los roquerios

Acceso de los hu칠spedes
Tienes derecho a usar toda la casa, excepto  el segundo piso ya que no  esta  habilitado .",['Acceso la playa P칰blico o compartido'],4.64,11,Catalina,03-2018,https://www.airbnb.cl/rooms/33881492?adults=1&children=0&infants=0&pets=0&check_in=2023-03-01&check_out=2023-03-06&previous_page_section_name=1000&federated_search_id=f8deed0a-e93e-4465-bd20-4440543e0830
93,Casa full equipada en Rocas de San Andres .,Alojamiento entero,Los Vilos,Regi칩n de Coquimbo,6,5,3, Habitaci칩n,2,privado,120.0,-32.031,-71.5144,"https://maps.google.com/maps?ll=-32.031,-71.5144&z=14&t=m&hl=es&gl=CL&mapclient=apiv3",,"Bonita , y  casa , con vista al mar y la posibilidad de ver una espectacular puesta de sol. En condominio cerrado , lugar muy tranquilo , sitios de 5000 metros, excelente para caminar y trotar, ideal para familia con ni침os. La casa est치 full equipada y cuenta con una exquisita chimenea.
En el lugar se cuidan mucho los recursos naturales como el agua y el entorno.


El sitio es de 5000 y cuenta con un peque침o Otero desde donde pueden tener vista de 360 grados y lugar para que los ni침os tengan un "" club"".
La casa tiene una espectacular vista al mar .
No hay playa pero desde la casa a 200 mts.se encuentran 2 pozones naturales especiales para ba침arse.",['Cocina'],5.0,25,Daniela,10-2016,https://www.airbnb.cl/rooms/38216384?adults=1&children=0&infants=0&pets=0&check_in=2023-03-01&check_out=2023-03-06&previous_page_section_name=1000&federated_search_id=f8deed0a-e93e-4465-bd20-4440543e0830
94,Espectacular Casa en Puerto Velero,Alojamiento entero,Puerto Velero,Regi칩n de Coquimbo,12,10,5, Habitaci칩n,5,privado,250.0,-30.24535,-71.47798,"https://maps.google.com/maps?ll=-30.24535,-71.47798&z=14&t=m&hl=es&gl=CL&mapclient=apiv3",,"Lugares de inter칠s: arte y cultura, incre칤bles vistas, restaurantes, actividades en familia.
Muy buena seguridad del Condominio. Mi alojamiento es bueno para familias (con hijos) y grupos grandes.
Es un resort muy exclusivo, con una playa de arenas blancas y aguas con agradable temperatura, piscinas de agua dulce y salada, marina, cancha de futbol, canchas de tenis, canchas de padel, cancha de Golf y Supermercado, esta ubicado en el Norte de Chile.


Los arriendos en el Verano son por quincena.","['Acceso a la playa', 'Frente a la playa']",4.88,8,Maria Luisa,11-2016,https://www.airbnb.cl/rooms/16041593?adults=1&children=0&infants=0&pets=0&check_in=2023-03-01&check_out=2023-03-08&previous_page_section_name=1000&federated_search_id=f8deed0a-e93e-4465-bd20-4440543e0830
95,"Illapel, Regia caba침a C/ Tina de aguas calientes.",Caba침a entero,Illapel,Coquimbo,3,3,3, Habitaci칩n,1,privado,60.0,-31.67918,-71.25154,"https://maps.google.com/maps?ll=-31.67918,-71.25154&z=14&t=m&hl=es&gl=CL&mapclient=apiv3",,Desconecta de la rutina en este alojamiento 칰nico y relajante.,['Cocina'],4.60,5,Ary,03-2018,https://www.airbnb.cl/rooms/554891792137500505?adults=1&children=0&infants=0&pets=0&check_in=2023-03-13&check_out=2023-03-19&previous_page_section_name=1000&federated_search_id=f8deed0a-e93e-4465-bd20-4440543e0830
96,Valle de Elqui. Caba침as Jard칤n de Estrellas. 1,Caba침a entero,Paihuano,Regi칩n de Coquimbo,6,5,2, Habitaci칩n,1,privado,110.0,-30.23374,-70.4967,"https://maps.google.com/maps?ll=-30.23374,-70.4967&z=14&t=m&hl=es&gl=CL&mapclient=apiv3",,"Hermoso entorno natural, rodeado de monta침as y cielos estrellados, ideal para un buen descanso.
Caba침as totalmente equipadas.

El espacio
Espacios amplios de relajo, terraza con bellas vistas al valle y monta침as.
Privacidad.
Tranquilidad.

Piscina con vistas.",['Cocina'],5.0,13,Patricia Bibiana,06-2019,https://www.airbnb.cl/rooms/38331507?adults=1&children=0&infants=0&pets=0&check_in=2023-03-01&check_out=2023-03-06&previous_page_section_name=1000&federated_search_id=f8deed0a-e93e-4465-bd20-4440543e0830
97,Casa amplia y c칩moda,Alojamiento entero,Los Vilos,Coquimbo,5,6,3, Habitaci칩n,1,privado,35.0,-31.91083,-71.49787,"https://maps.google.com/maps?ll=-31.91083,-71.49787&z=14&t=m&hl=es&gl=CL&mapclient=apiv3",,"Casa c칩moda,  privacidad completa, no se comparte espacios, sector tranquilo a 2 cuadras de polic칤a (PDI), a 6 cuadras de la playa, fuera de zona de riesgo de tsunami, locomoci칩n colectiva a la puerta. No hay otros hu칠spedes,  contacto con propietario cada 1-3 d칤as (dependiendo temporada) para poder regar plantas y 치rboles del lugar que no se muestran en las fotos, se avisa del acceso y se ingresa por un pasillo lateral. Lavadora de ropa de 9 Kg",['Costa'],,,C칠sar,03-2020,https://www.airbnb.cl/rooms/42841941?adults=1&children=0&infants=0&pets=0&check_in=2023-03-01&check_out=2023-03-06&previous_page_section_name=1000&federated_search_id=f8deed0a-e93e-4465-bd20-4440543e0830
98,Casa en la pen칤nsula de Tongoy linda vista,Alojamiento entero,Coquimbo,Chile,14,12,5, Habitaci칩n,2,privado,150.0,-30.2554,-71.5064,"https://maps.google.com/maps?ll=-30.2554,-71.5064&z=14&t=m&hl=es&gl=CL&mapclient=apiv3",,"Arriendo hermosa casa tipo caba침a , en el hermoso balneario de Tongoy, IV regi칩n, en tranquilo sector de la isla  La casa cuenta con:  

郊 cinco habitaciones 游띒 

郊 capacidad para 14 personas 

郊 Dos ba침os 

郊 Agua caliente 

郊뾖ocina completamente equipada 

郊뾦v Cable 

郊뾣arrilla 

郊뾘stacionamiento para cinco veh칤culos
 
郊뾨ista preferencial a la hermosa bah칤a de Tongoy",['Vista a la bah칤a'],,,Gabriel,10-2022,https://www.airbnb.cl/rooms/729798048075531966?adults=1&children=0&infants=0&pets=0&check_in=2023-03-01&check_out=2023-03-06&previous_page_section_name=1000&federated_search_id=f8deed0a-e93e-4465-bd20-4440543e0830
99,Descanso en la naturaleza cerca de Los Molles,Casa de campo entero,Ligua ,Valpara칤so,8,5,3, Habitaci칩n,"2,5",privado,140.0,-32.21024,-71.50797,"https://maps.google.com/maps?ll=-32.21024,-71.50797&z=14&t=m&hl=es&gl=CL&mapclient=apiv3",,"Rel치jate con toda la familia en este tranquilo lugar, a pasos de la playa de los Molles, maravillosa parcela dentro del condominio Rocas del Mar

El espacio
3 grandes habitaciones, una en suite con cama king y las otras dos con camas dobles (matrimoniales) y una cama de 1 1/2 pza cada una",['Cocina'],5.0,20,David,03-2015,https://www.airbnb.cl/rooms/51849039?adults=1&children=0&infants=0&pets=0&check_in=2023-03-01&check_out=2023-03-06&previous_page_section_name=1000&federated_search_id=f8deed0a-e93e-4465-bd20-4440543e0830
100,"Casa de veraneo en Huentelauqu칠n, Cond. Agua Dulce",Alojamiento entero,Canela,Coquimbo,10,10,3, Habitaci칩n,2,privado,250.0,-31.51928,-71.55705,"https://maps.google.com/maps?ll=-31.51928,-71.55705&z=14&t=m&hl=es&gl=CL&mapclient=apiv3",,"Un lugar para relajarte junto a tu familia. 

Preciosa casa, a pasos de una excelente playa, en un entorno tranquilo, condominio seguro, bien equipado, rodeado de vegetaci칩n natural, para quedarse y enamorarse.

El espacio
La casa cuenta con:
- Terraza con vista al mar
- Hall de entrada
- Living, comedor y cocina
- Pieza matrimonial (2 personas)
- Pieza con 2 camarotes (4 personas)
- Pieza con 2 camarotes (4 personas)
- 2 ba침os",['Acceso la playa Privado'],5.0,5,Camila,02-2020,https://www.airbnb.cl/rooms/53829301?adults=1&children=0&infants=0&pets=0&check_in=2023-03-01&check_out=2023-03-08&previous_page_section_name=1000&federated_search_id=f8deed0a-e93e-4465-bd20-4440543e0830
101,Lagar Anita sol mar estrellas y el mejor clima,Habitaci칩n privada en casa de campo,Los Choros,Regi칩n de Atacama,4,4,2, Habitaci칩n,1privado,privado,39.0,-29.26035,-71.02892,"https://maps.google.com/maps?ll=-29.26035,-71.02892&z=14&t=m&hl=es&gl=CL&mapclient=apiv3",,"Cocina equipada, ba침o con ducha turca, dormitorios y estar full equipo, AMPLIA TERRAZA, estacionamiento, VISITAS GUIADAS a islas Dama, Choros y Gaviota. Avistamientos de ballenas, delfines nariz de botella, cormoranes ping칲inos de Humboldt, lobos marinos , excelente pesca deportiva, buceo, kayak, visitas a Caleta Punta Choros y Cha침aral de Aceituno. Guanacos, zorros chilla y otros. Cafeter칤a, minimercados , producci칩n de aceitunas y aceite virgen. A 2 minutos extensa PLAYA LOS CHOROS


El mejor lugar por su clima durante todo el a침o para disfrutar y relajarse.",['Cocina'],4.64,14,Diego,02-2019,https://www.airbnb.cl/rooms/32662867?adults=1&children=0&infants=0&pets=0&check_in=2023-03-01&check_out=2023-03-06&previous_page_section_name=1000&federated_search_id=f8deed0a-e93e-4465-bd20-4440543e0830
102,Casa en Pichidangui: kites y winds,Chal칠 entero,Pichidangui,Coquimbo Region,6,5,3, Habitaci칩n,"1,5",privado,90.0,-32.13701,-71.51716,"https://maps.google.com/maps?ll=-32.13701,-71.51716&z=14&t=m&hl=es&gl=CL&mapclient=apiv3",,"Linda casa en Pichidangui. Muy bien ubicada entre el bosque y la playa, protegido del viento, silencioso y tranquilo. 7 minutos caminando a la playa. Pichidangui es ideal para practicar kitesurf y windsurf. Lindo lugar!
Para vacaciones de invierno, verano y septiembre se arrienda m칤nimo 1 semana.

El espacio
Caba침ita bien mantenida. Capacidad para 6 personas: 3 piezas, 1 ba침o, cocina, comedor y living con TV y antena Directv si se quiere tener cable (prepago). Agradable y amplia terraza con parrilla y lugar para hacer fog칩n.",['Acceso a la playa'],4.61,37,Olivia,04-2016,https://www.airbnb.cl/rooms/12268241?adults=1&children=0&infants=0&pets=0&check_in=2023-03-01&check_out=2023-03-08&previous_page_section_name=1000&federated_search_id=f8deed0a-e93e-4465-bd20-4440543e0830
103,Linda casa cercana a la playa y hermoso entorno,Alojamiento entero,Tongoy,Coquimbo,4,4,3, Habitaci칩n,1,privado,95.0,-30.26409,-71.496,"https://maps.google.com/maps?ll=-30.26409,-71.496&z=14&t=m&hl=es&gl=CL&mapclient=apiv3",,"Lugar para disfrutar en contexto familiar y en entorno natural.

El espacio
espacio lindo y acogedor.","['Acceso a playa P칰blico o compartido', 'Frente a la playa']",4.83,6,Marcela,01-2022,https://www.airbnb.cl/rooms/54143958?adults=1&children=0&infants=0&pets=0&check_in=2023-03-20&check_out=2023-03-25&previous_page_section_name=1000&federated_search_id=f8deed0a-e93e-4465-bd20-4440543e0830
104,Casa en Paihuano Valle de Elqui,Caba침a entero,Paihuano,Coquimbo,6,3,3, Habitaci칩n,2,privado,155.0,-30.0222,-70.5189,"https://maps.google.com/maps?ll=-30.0222,-70.5189&z=14&t=m&hl=es&gl=CL&mapclient=apiv3",,"Tu familia estar치 cerca de todo cuando te quedes en este alojamiento c칠ntrico. Estamos a 20 minutos de Vicu침a y Pisco Elqui, Disfrutaras de una estupenda piscina privada bajo las estrellas y una experiencia unica en el Valle de Elqui

El espacio
Espaciosa casa en el coraz칩n de Paihuano. Cercana a servicios principales y movilizaci칩n. Piscina privada.",['Vista al horizonte de la ciudad'],,,Carola,02-2015,https://www.airbnb.cl/rooms/819431612368963289?adults=1&children=0&infants=0&pets=0&check_in=2023-03-01&check_out=2023-03-06&previous_page_section_name=1000&federated_search_id=f8deed0a-e93e-4465-bd20-4440543e0830
105,Condominio Agua Dulce 12 personas,Alojamiento entero,Angostura,Coquimbo,12,10,4, Habitaci칩n,3,privado,230.0,-31.52133,-71.55717,"https://maps.google.com/maps?ll=-31.52133,-71.55717&z=14&t=m&hl=es&gl=CL&mapclient=apiv3",,"Disfruta tus vacaciones en una casa muy c칩moda ubicada en un ambiente natural, tranquilo y con excelente vista.",['Vista a la playa'],,,Juan,04-2017,https://www.airbnb.cl/rooms/721643077798227841?adults=1&children=0&infants=0&pets=0&check_in=2023-03-01&check_out=2023-03-08&previous_page_section_name=1000&federated_search_id=f8deed0a-e93e-4465-bd20-4440543e0830
106,Gran casa en Totoralillo con vista al mar y m치s!,Casa de campo entero,Totoralillo,Coquimbo,12,10,4, Habitaci칩n,"4,5",privado,264.723,-30.06154,-71.36812,"https://maps.google.com/maps?ll=-30.06154,-71.36812&z=14&t=m&hl=es&gl=CL&mapclient=apiv3",,"730 m de entretenci칩n!  Cuenta con piscina, cama saltarina, quincho, taca-taca, mesa de pool y mucho espacio para jugar!

4 habitaciones, cada una con ba침o privado:
-3 con una cama de dos plazas y una cama nido.
-1 con una cama de dos plazas. 

Luminoso living (bellas puestas de sol), mesas grandes para comer, 4 estacionamientos, y a solo 5 minutos en auto de la playa.

*Desayuno opcional por $7500
-Pan ciabatta aliado/palta jam칩n/huevo
-Trozo de pastel
- te/caf칠/leche
- Fruta/yogurt con cereal",['Acceso la playa P칰blico o compartido'],,,Macarena,08-2021,https://www.airbnb.cl/rooms/758653560599739892?adults=1&children=0&infants=0&pets=0&check_in=2023-03-21&check_out=2023-03-26&previous_page_section_name=1000&federated_search_id=f8deed0a-e93e-4465-bd20-4440543e0830
107,Hermosa y acogedora caba침a familiar,Caba침a entero,Guanaqueros,Coquimbo Region,6,5,3, Habitaci칩n,1,privado,90.0,-30.20279,-71.41551,"https://maps.google.com/maps?ll=-30.20279,-71.41551&z=14&t=m&hl=es&gl=CL&mapclient=apiv3",,"Preciosa caba침a familiar, muy segura dentro de condominio privado con seguridad las 24 horas. Muy cerca de la playa incluso para ir a pi칠. Estacionamiento privado para 2 autos, terraza y quincho para asados en la parte trasera. 
Cuenta con 3 habitaciones, sala de estar, ba침o y cocina.

El espacio
El condominio Villamar cuenta con una plaza de juegos para los ni침os y una multicancha. En veh칤culo uno demora 5 minutos a la playa m치s cercana y 15 minutos a pi칠.",['Cocina'],4.94,17,Veronica,12-2018,https://www.airbnb.cl/rooms/30793992?adults=1&children=0&infants=0&pets=0&check_in=2023-03-01&check_out=2023-03-06&previous_page_section_name=1000&federated_search_id=f8deed0a-e93e-4465-bd20-4440543e0830
108,Espectacular casa en la Magia del Valle del Elqui,Casa de campo entero,Rivadavia,Regi칩n de Coquimbo,10,10,4, Habitaci칩n,3,privado,300.0,-29.97638,-70.55228,"https://maps.google.com/maps?ll=-29.97638,-70.55228&z=14&t=m&hl=es&gl=CL&mapclient=apiv3",,"Hermosa y r칰stica casa de campo ubicada en un lugar privilegiado del Valle del Elqui , cercana a lugares tur칤sticos como Vicu침a (15 Kms , Pisco Elqui (30 Kms.) y distante a unos 80 kms. de La Serena .
Mi casa es  muy acogedora, c칩moda, luminosa y amplia, rodeada de cerros Impresionantes. Cuenta con una terraza ideal para asados y aperitivos. 
Amplio jard칤n , una gran piscina , todo en un lindo entorno que invita al descanso, a  conectarse con la naturaleza y a vivir una experiencia inolvidable.


Es un lugar rodeado de 치rboles a침osos, vistas impresionantes de cerros de colores, noches estrelladas y de una paz y tranquilidad incomparables",['Vista al valle'],5.0,14,Claudia,07-2017,https://www.airbnb.cl/rooms/39442465?adults=1&children=0&infants=0&pets=0&check_in=2023-03-01&check_out=2023-03-06&previous_page_section_name=1000&federated_search_id=f8deed0a-e93e-4465-bd20-4440543e0830
109,"Casa Turin, c칩moda, tranquila y bien ubicada.",Alojamiento entero,La Serena,Coquimbo,6,4,3, Habitaci칩n,2,privado,60.0,-29.8979,-71.2659,"https://maps.google.com/maps?ll=-29.8979,-71.2659&z=14&t=m&hl=es&gl=CL&mapclient=apiv3",,"Rel치jate con tu familia en un espacio agradable. La casa incluye estacionamiento privado, amplio patio trasero con mucho verde y ubicaci칩n privilegiada, cerca de la playa, supermercados, mall y terminal de buses. A 30 minutos del Aeropuerto tambi칠n tendras f치cil acceso a calles o rutas principales. Lugar seguro para toda la familia.",['Acceso la playa P칰blico o compartido'],4.84,19,Mariela,12-2021,https://www.airbnb.cl/rooms/54051248?adults=1&children=0&infants=0&pets=0&check_in=2023-03-01&check_out=2023-03-06&previous_page_section_name=1000&federated_search_id=d4b173f2-b622-48b6-8287-0c9a27b997a2
110,Gran casa en Totoralillo con vista al mar y m치s!,Casa de campo entero,Totoralillo,Coquimbo,12,10,4, Habitaci칩n,"4,5",privado,264.723,-30.06154,-71.36812,"https://maps.google.com/maps?ll=-30.06154,-71.36812&z=14&t=m&hl=es&gl=CL&mapclient=apiv3",,"730 m de entretenci칩n!  Cuenta con piscina, cama saltarina, quincho, taca-taca, mesa de pool y mucho espacio para jugar!

4 habitaciones, cada una con ba침o privado:
-3 con una cama de dos plazas y una cama nido.
-1 con una cama de dos plazas. 

Luminoso living (bellas puestas de sol), mesas grandes para comer, 4 estacionamientos, y a solo 5 minutos en auto de la playa.

*Desayuno opcional por $7500
-Pan ciabatta aliado/palta jam칩n/huevo
-Trozo de pastel
- te/caf칠/leche
- Fruta/yogurt con cereal",['Acceso la playa P칰blico o compartido'],,,Macarena,08-2021,https://www.airbnb.cl/rooms/758653560599739892?adults=1&children=0&infants=0&pets=0&check_in=2023-03-21&check_out=2023-03-26&previous_page_section_name=1000&federated_search_id=d4b173f2-b622-48b6-8287-0c9a27b997a2
111,Disfruta este Verano en mi casa en Los Vilos,Alojamiento entero,Los Vilos,Coquimbo,8,7,4, Habitaci칩n,"2,5",privado,78.0,-31.90763,-71.49578,"https://maps.google.com/maps?ll=-31.90763,-71.49578&z=14&t=m&hl=es&gl=CL&mapclient=apiv3",,"Te va a encantar esta casa de veraneo familiar, ubicada en grato sector residencial de Los Vilos, cercana al centro y playa.
Los hu칠spedes dispondr치n de un amplio living-comedor, quincho,  balc칩n con hermosa vista, tres ba침os, cocina muy bien equipada con comedor de diario, 4 dormitorios con closet con 7 camas, termo y calefont. Estacionamiento para 4 veh칤culos, lavadero interior con lavadora y secadora. Casa grande de 2 pisos y 150 m2. Consulta las tarifas para grupos desde 4 hasta 8 personas.


Casa amplia de dos pisos con amplio patio , balc칩n y estacionamiento para 4 veh칤culos .
En el primer piso, hay una habitaci칩n con cama matrimonial con ba침o en suite.
Adem치s, un ba침o en zona de servicios.
En el segundo piso, en total 3 habitaciones, una con una cama 1 plaza 1/2, la segunda habitaci칩n con 2 camas de 1 plaza 1/2 y la tercera con 3 camas de 1 plaza 1/2
1 ba침o completo en el 2do piso",['Vista al mar'],4.79,57,Perla,01-2020,https://www.airbnb.cl/rooms/41319744?adults=1&children=0&infants=0&pets=0&check_in=2023-03-01&check_out=2023-03-06&previous_page_section_name=1000&federated_search_id=d4b173f2-b622-48b6-8287-0c9a27b997a2
112,Espectacular casa en la Magia del Valle del Elqui,Casa de campo entero,Rivadavia,Regi칩n de Coquimbo,10,10,4, Habitaci칩n,3,privado,300.0,-29.97638,-70.55228,"https://maps.google.com/maps?ll=-29.97638,-70.55228&z=14&t=m&hl=es&gl=CL&mapclient=apiv3",,"Hermosa y r칰stica casa de campo ubicada en un lugar privilegiado del Valle del Elqui , cercana a lugares tur칤sticos como Vicu침a (15 Kms , Pisco Elqui (30 Kms.) y distante a unos 80 kms. de La Serena .
Mi casa es  muy acogedora, c칩moda, luminosa y amplia, rodeada de cerros Impresionantes. Cuenta con una terraza ideal para asados y aperitivos. 
Amplio jard칤n , una gran piscina , todo en un lindo entorno que invita al descanso, a  conectarse con la naturaleza y a vivir una experiencia inolvidable.


Es un lugar rodeado de 치rboles a침osos, vistas impresionantes de cerros de colores, noches estrelladas y de una paz y tranquilidad incomparables",['Vista al valle'],5.0,14,Claudia,07-2017,https://www.airbnb.cl/rooms/39442465?adults=1&children=0&infants=0&pets=0&check_in=2023-03-01&check_out=2023-03-06&previous_page_section_name=1000&federated_search_id=d4b173f2-b622-48b6-8287-0c9a27b997a2
113,Casa 2 pisos en condominio privado,Alojamiento entero,Coquimbo,Regi칩n de Coquimbo,6,4,3, Habitaci칩n,2,privado,50.0,-29.98472,-71.34761,"https://maps.google.com/maps?ll=-29.98472,-71.34761&z=14&t=m&hl=es&gl=CL&mapclient=apiv3",,"Casa moderna de 2 pisos, en condominio privado con piscina, posee estacionamiento particular, muy buena ubicaci칩n cercana a la playa, sector seguro y residencial.

Acceso de los hu칠spedes
Zonas verdes y piscina disponible exclusivamente para residentes en condominio. Seguridad 24/7 con conserjer칤a","['Acceso a la playa', 'Frente a la playa']",4.36,14,Tyare,04-2019,https://www.airbnb.cl/rooms/33991713?adults=1&children=0&infants=0&pets=0&check_in=2023-03-11&check_out=2023-03-17&previous_page_section_name=1000&federated_search_id=d4b173f2-b622-48b6-8287-0c9a27b997a2
114,Condominio Agua Dulce 12 personas,Alojamiento entero,Angostura,Coquimbo,12,10,4, Habitaci칩n,3,privado,230.0,-31.52133,-71.55717,"https://maps.google.com/maps?ll=-31.52133,-71.55717&z=14&t=m&hl=es&gl=CL&mapclient=apiv3",,"Disfruta tus vacaciones en una casa muy c칩moda ubicada en un ambiente natural, tranquilo y con excelente vista.",['Vista a la playa'],,,Juan,04-2017,https://www.airbnb.cl/rooms/721643077798227841?adults=1&children=0&infants=0&pets=0&check_in=2023-03-01&check_out=2023-03-08&previous_page_section_name=1000&federated_search_id=d4b173f2-b622-48b6-8287-0c9a27b997a2
115,"GRAN CASA DE VERANEO FRENTE AL MAR, Guanaqueros",Alojamiento entero,Coquimbo,Regi칩n de Coquimbo,14,12,8, Habitaci칩n,5,privado,235.0,-30.19315,-71.40479,"https://maps.google.com/maps?ll=-30.19315,-71.40479&z=14&t=m&hl=es&gl=CL&mapclient=apiv3",,"En GUANAQUEROS. 
C칩moda casa para 14 personas. Acceso directo a playa privada.
Gran living y comedor. Sala de estar, sector de asados, terraza.

Se encuentra dentro de condominio privado con acceso controlado. La casa es exclusiva para los hu칠spedes. No se comparte con nadie.

Ba침os con ducha.
Sector de lavander칤a.
Tiene todo tipo de elementos de cocina (platos, vasos, ollas, etc).
Incluye implementos b치sicos de aseo.

Se requiere llevar s치banas y toallas. Solo tiene crubrecamas y cojines.


Son 4 habitaciones matrimoniales.
Hay 1 dormitorio de servicio con ba침o.
Hay 2 piezas con 2 camas y otra pieza con 3 camas.

Total 16 personas.

4 ba침os adem치s del de servicio.","['Acceso a la playa', 'Frente a la playa']",5.0,6,Valentina,02-2017,https://www.airbnb.cl/rooms/35420560?adults=1&children=0&infants=0&pets=0&check_in=2023-03-01&check_out=2023-03-06&previous_page_section_name=1000&federated_search_id=d4b173f2-b622-48b6-8287-0c9a27b997a2
116,"Cumbre en El Valle, km 67, Valle del Elqui",Casa de campo entero,Vicu침a,Chile,6,4,4, Habitaci칩n,"2,5",privado,150.0,-30.03173,-70.66421,"https://maps.google.com/maps?ll=-30.03173,-70.66421&z=14&t=m&hl=es&gl=CL&mapclient=apiv3",,"Casa de campo familiar, de f치cil acceso a 5 minutos de Vicu침a, Diaguitas, Peralillo, Calingasta y otros atractivos tur칤sticos.
La casa est치 equipada con sala de TV (direct TV), quincho con horno de barro, piscina, electrodom칠sticos, juegos de sal칩n y amplios espacios para compartir con la familia.
Posee todo lo que se requiere para vivir una estad칤a agradable y placentera.
El lugar es ideal para descansar y desconectarse del trabajo.


La casa cuenta con tres dormitorios y una sala de estar.

Dormitorio principal con ba침o en suit: tiene una cama matrimonial que incluye s치banas y frazadas, TV, veladores con l치mpara, closet, c칩moda y ventanal hacia El Valle para tener un despertar placentero. 
El ba침o tiene 2 lavamanos, ducha amplia con vidrio templado y un jard칤n interior con ventana hacia El Valle, cuenta con secador de pelo, toallas y papel higi칠nico. 

Pieza 2: tiene cama de dos plazas con s치banas y frazadas, velador con l치mpara, closet y ventana con vista al valle.

Pieza 3: Tiene dos camas de una plaza y media con s치banas y frazada, velador central entre las dos camas, closet y ventana con vista al Valle.

Ambas piezas (2 y 3) comparten un ba침o con ducha y toallas, lavamanos y servicio higi칠nico.

Sala de estar: tiene un sill칩n (Berger) reclinable, TV con direct TV. Esta sala tiene un ba침o donde se encuentra la lavander칤a con colgadores de ropa y lavadora de 11 kls. Adem치s de un lavamanos y servicio higi칠nico.",['Vista a las monta침as'],4.84,37,Ricardo,10-2017,https://www.airbnb.cl/rooms/31879319?adults=1&children=0&infants=0&pets=0&check_in=2023-03-01&check_out=2023-03-06&previous_page_section_name=1000&federated_search_id=d4b173f2-b622-48b6-8287-0c9a27b997a2
117,Casa a pocos minutos de playa La Herradura,Alojamiento entero,Coquimbo,Chile,6,5,3, Habitaci칩n,2,privado,55.0,-29.99477,-71.33696,"https://maps.google.com/maps?ll=-29.99477,-71.33696&z=14&t=m&hl=es&gl=CL&mapclient=apiv3",,"Lugar tranquilo y de amplio estacionamiento. A 5 minutos de playa La Herradura y Ruta 5. Cercano a lugares de comidas, supermercados, policl칤nico y camping. La casa cuenta con Wifi fibra 칩ptica y cable TV.",['Acceso a la playa'],,,Luis,01-2022,https://www.airbnb.cl/rooms/777563721808913991?adults=1&children=0&infants=0&pets=0&check_in=2023-03-01&check_out=2023-03-06&previous_page_section_name=1000&federated_search_id=d4b173f2-b622-48b6-8287-0c9a27b997a2
