,Titulo1,Titulo2,Comuna,Region,Capacidad,Camas,N_Habitaciones,Habitaciones,Baños,Tipo_Baños,Precio,lat,lon,Ubicacion,Ubides,Descripcion,Servicios,Nota,Nnota,Anfitrion,Registro,Link
27,Arriendo de amplia casa a Turistas en La Serena,Casa particular,La Serena,Región de Coquimbo,8,7,5, Habitación,2,privado,50.0,-29.88614,-71.23168,"https://maps.google.com/maps?ll=-29.88614,-71.23168&z=14&t=m&hl=es&gl=CL&mapclient=apiv3",,"Se arrienda amplia y cómoda casa en sector tranquilo de la ciudad de La Serena, ubicado en Psj. Bernardo Ossandon #1901, Las compañías. La que cuenta con 5 habitaciones, 2 baños, cocina, comedor y amplio living, estacionamiento para 2 vehículos y patio para distensión familiar. 
Con capacidad para entre 8 a 10 personas, ubicado a pasos del centro de la ciudad y a 15 minutos de las mejores playas de la zona, pubs y excelentes restaurantes.",['Cocina'],,,Isabel,12-2018,https://www.airbnb.cl/rooms/31076384?adults=1&children=0&infants=0&pets=0&check_in=2023-03-01&check_out=2023-03-07&previous_page_section_name=1000&federated_search_id=59a483b1-9d3e-473d-beb4-46c5e60199fd
28,Cómodo y amplio departamento para descanso,Apartamento con servicios incluidos entero,La Serena,Coquimbo,6,5,3, Habitación,2,privado,55.0,-29.90124,-71.26232,"https://maps.google.com/maps?ll=-29.90124,-71.26232&z=14&t=m&hl=es&gl=CL&mapclient=apiv3",,"Tu familia lo tendrá todo a un paso en este alojamiento situado cercano a sector céntrico de la ciudad de La Serena, a pocos minutos de la playa(Avenida del Mar) y a pocas cuadras de centros comerciales y supermercados. Este departamento brinda comodidad y seguridad a las familias, ubicado en quinto piso cuenta con 3 dormitorios y 2 baños todo full equipado, el condominio cuenta con conserjería las 24 horas y tiene asignado un estacionamiento gratis.",['Cocina'],,,Elena,01-2019,https://www.airbnb.cl/rooms/655607245310499883?adults=1&children=0&infants=0&pets=0&check_in=2024-02-01&check_out=2024-02-07&previous_page_section_name=1000&federated_search_id=59a483b1-9d3e-473d-beb4-46c5e60199fd
29,Hermoso departamento a pasos de la Playa y Casino.,Apartamento con servicios incluidos entero,La Serena,Coquimbo,6,4,3, Habitación,2,privado,100.0,-29.9448,-71.2877,"https://maps.google.com/maps?ll=-29.9448,-71.2877&z=14&t=m&hl=es&gl=CL&mapclient=apiv3",,"Departamento en piso 2  de 75M2 con Terraza , Habilitado para 6 personas , cuenta con 2 Baños completos ,Cocina Full Equipada para 6 Personas, Living con 2  Sofá Cama   y TV de 55"" ; a  100 metros de la Playa y 100 metros del casino Enjoy.
Servicios de TV Cable y Wifi.  Lavandería en el Hall del Edificio, quincho para hacer Asados, sector de deportes al aire libre y juegos para niños. Piscina para adultos y niños y estacionamiento para 1 vehículo  permanente y estacionamiento de visita. Estufa.",['Cocina'],,,Solange,03-2022,https://www.airbnb.cl/rooms/594740949137015514?adults=1&children=0&infants=0&pets=0&check_in=2023-03-01&check_out=2023-03-06&previous_page_section_name=1000&federated_search_id=59a483b1-9d3e-473d-beb4-46c5e60199fd
30,Hostal Milán,Habitación privada en hostal,La Serena,Coquimbo,Más de 16,16,8, Habitación,8,privado,40.0,-29.90848,-71.25328,"https://maps.google.com/maps?ll=-29.90848,-71.25328&z=14&t=m&hl=es&gl=CL&mapclient=apiv3",,Disfrutarás cada momento en esta alegre escapada.,['Wifi'],,,Hostal,12-2021,https://www.airbnb.cl/rooms/548014363372208914?adults=1&children=0&infants=0&pets=0&check_in=2023-03-01&check_out=2023-03-07&previous_page_section_name=1000&federated_search_id=59a483b1-9d3e-473d-beb4-46c5e60199fd
31,HERMOSO DPTO 6 PERSONAS DETRAS DEL CASINO ENJOY,Apartamento con servicios incluidos entero,Coquimbo,Chile,6,5,3, Habitación,2,privado,125.0,-29.94699,-71.28849,"https://maps.google.com/maps?ll=-29.94699,-71.28849&z=14&t=m&hl=es&gl=CL&mapclient=apiv3",,"HERMOSO DEPARTAMENTO PISO 16 CON INMEJORABLE VISTA HACIA EL MAR DETRAS DEL CASINO ENJOY A PASOS DE AVENIDA DEL MAR, CONDOMINIO MARINA COSTA, 3 DORMITORIOS, 2 BAÑOS PRINCIPAL EN SUITE, INCLUYE,LAVADORA DENTRO DEL DPTO,TV CABLE.WIFI, PISCINA, AMPLIAS AREAS VERDES, ZONA DE JUEGOS PARA NIÑOS, ESTACIONAMIENTO PROPIO, CERCANO A LOCALES COMERCIALES MINIMARKET PANADERIAS, SUPERMECADOS, OUTLET VIVO DE PEÑUELA, LOCOMOCIÓN A MEDIA CUADRA, CERCANO A RESTAURANTES PUB Y DISCOTEQUE 
CONSERJERIA LAS 24HRS.


DEPARTAMENTO IDEAL PARA VACACIONES CON UNA VISTA HERMOSA HACIA EL MAR CON TODAS LAS COMODIDADES QUE NECESITAN IDEAL PARA DESCANZAR",['Vista a la bahía'],,,Joselyn,02-2019,https://www.airbnb.cl/rooms/658497233189981461?adults=1&children=0&infants=0&pets=0&check_in=2023-03-03&check_out=2023-03-08&previous_page_section_name=1000&federated_search_id=59a483b1-9d3e-473d-beb4-46c5e60199fd
32,Suites Marittimo 's Los Vilos,Habitación privada en apartamento con servicios incluidos,Los Vilos,Coquimbo,4,4,4, Habitación,4,privado,40.0,-31.90978,-71.49736,"https://maps.google.com/maps?ll=-31.90978,-71.49736&z=14&t=m&hl=es&gl=CL&mapclient=apiv3",,"Estamos ubicados en el acceso principal del balneario de Los Vilos a pasos de negocios, locales comerciales y trasporte público",['Televisor de alta definición con cable estándar'],,,Paolo,08-2022,https://www.airbnb.cl/rooms/691896465246792271?adults=1&children=0&infants=0&pets=0&check_in=2023-07-01&check_out=2023-07-07&previous_page_section_name=1000&federated_search_id=59a483b1-9d3e-473d-beb4-46c5e60199fd
33,Casa Preciosa para Eclipse Solar Elqui- Chile,Habitación privada en bed and breakfast,La Serena,Coquimbo Region,10,10,4, Habitación,4,privado,35.0,-29.84137,-71.27746,"https://maps.google.com/maps?ll=-29.84137,-71.27746&z=14&t=m&hl=es&gl=CL&mapclient=apiv3",,"Serena Golf es un Barrio exclusivo de La Serena, a 800 mt de la playa, sus casas proyectan sus patios a la cancha de Golf.  La cancha tiene tres lagunas artificiales. Con canchas de tenis, football, club ecuestre y tiro al arco.  Cuenta con Minimarket, Restaurant, y cafeteria  que funciona en horario de golf. Posee sistema privado de seguridad
Esta ubicada a 20 min de la hora cero del Eclipse Solar, eso en caso que este nublado. Se entregara gratis lentes para ver el eclipse


La casa funciona como Hoster, permitiendo la convivencia en espacios comunes. La piscina de corte tropical, posee hamacas en varios sectores entre palmeras, quincho amplio, terraza con potronas, chimenea en quincho , parilla, horno de barro y un jacuzzi  exterior tipo tineta de madera que funciona a leña",['Cocina'],,,Fabian,12-2017,https://www.airbnb.cl/rooms/35689840?adults=1&children=0&infants=0&pets=0&check_in=2023-11-01&check_out=2023-11-06&previous_page_section_name=1000&federated_search_id=59a483b1-9d3e-473d-beb4-46c5e60199fd
34,Refugio Altovalsol,Habitación privada en complejo turístico,Altovalsol,Coquimbo,6,5,3, Habitación,2,privado,200.0,-29.9272,-71.1202,"https://maps.google.com/maps?ll=-29.9272,-71.1202&z=14&t=m&hl=es&gl=CL&mapclient=apiv3",,"Este encantador y exclusivo lugar para quedarte no pasa por alto ningún detalle.
Casa y Cabañas totalmente equipadas, quincho, parrillas,tinaja madera aguas calientes, saunas, piscina de Quarzo Jacuzzi, hermoso entorno, paseos en bicicleta",['Piscina'],,,Anuar,04-2022,https://www.airbnb.cl/rooms/609924231340918779?adults=1&children=0&infants=0&pets=0&check_in=2023-03-01&check_out=2023-03-06&previous_page_section_name=1000&federated_search_id=59a483b1-9d3e-473d-beb4-46c5e60199fd
35,"Amplia Casa a pasos del Mar, iglesia ,Playa.",Casa particular,Pichidangui,Coquimbo,9,7,5, Habitación,3,privado,145.0,-32.13732,-71.52902,"https://maps.google.com/maps?ll=-32.13732,-71.52902&z=14&t=m&hl=es&gl=CL&mapclient=apiv3",,"Alojamiento a pasos del mar(1.5 minutos) e Iglesia,  a 10 minutos playa caminando de feria.",['Cocina'],,,Andres Edinson,11-2018,https://www.airbnb.cl/rooms/744512907611852578?adults=1&children=0&infants=0&pets=0&check_in=2023-03-01&check_out=2023-03-08&previous_page_section_name=1000&federated_search_id=59a483b1-9d3e-473d-beb4-46c5e60199fd
36,"Amplia casa cómoda, lugar tranquilo y seguro",Casa particular,La Serena,Región de Coquimbo,3,3,3, Habitación,2,privado,65.0,-29.94914,-71.24399,"https://maps.google.com/maps?ll=-29.94914,-71.24399&z=14&t=m&hl=es&gl=CL&mapclient=apiv3",,"Amplia casa ubicada en sector el milagro 2, completamente equipada, tiene estacionamiento el inmueble, supermercado cerca, banco, restaurant, etc",['Cocina'],,,Gloria,05-2019,https://www.airbnb.cl/rooms/35494023?adults=1&children=0&infants=0&pets=0&check_in=2023-03-01&check_out=2023-03-06&previous_page_section_name=1000&federated_search_id=195c3aaa-507b-474c-932a-fb648299ad1a
37,Confortable casa familiar a15 minutos de la playa,Casa particular,Coquimbo,Chile,4,4,3, Habitación,"2,5",privado,75.0,-29.98717,-71.31426,"https://maps.google.com/maps?ll=-29.98717,-71.31426&z=14&t=m&hl=es&gl=CL&mapclient=apiv3",,"Relájate con toda la familia en este tranquilo lugar para quedarse, cuenta con 3 habitaciones y 3 baños , patio grande , se admiten mascotas , estacionamiento y acceso controlado a solo 15 minutos de la playa y parque de senderismo ideal para familia . Zona tranquila y segura para disfrutar de unas agradables vacaciones.",['Cocina'],,,Dario,10-2022,https://www.airbnb.cl/rooms/729060158974735664?adults=1&children=0&infants=0&pets=0&check_in=2023-03-01&check_out=2023-03-06&previous_page_section_name=1000&federated_search_id=195c3aaa-507b-474c-932a-fb648299ad1a
38,VALLE ELQUI CASA PARCELA FAMILIAR,Habitación en hotel boutique,La Serena,Región de Coquimbo,15,13,8, Habitación,"4,5",privado,115.0,-29.92917,-71.13227,"https://maps.google.com/maps?ll=-29.92917,-71.13227&z=14&t=m&hl=es&gl=CL&mapclient=apiv3",,"Parcela a 15 minutos de la serena ,Amplia , comoda y confortable casa familiar , te sentirás a gusto en nuestro hogar, somos una familia numerosa por ello tenemos una amplia casa comoda con una hermosa vista al Valle Elqui. Tenemos un amplio Living, Comedor cocina americana todo muy bien iluminado, Tres suit,   cabalgatas , paseo bicicleta, flora , fauna, disfruta huerto orgánico , papayas, durazno otros vista y entorno , naturaleza en pleno


Disfrutar de la naturaleza, flora , fauna vista tranquilidad ,valle de ensueño, noches mágicas un aura especial puesta de sol todo en un solo lugar acogedor amplio y único .magnetismo místico.
SE RECOMIENDA NO FUMAR EN LA CASA
MANTER PUERTAS Y VENTANAS CERRADAS CUANDO SALGAN
AÑO CORRIDO","['Acceso a la playa', 'Frente a la playa']",,,Maria Teresa,12-2015,https://www.airbnb.cl/rooms/10017098?adults=1&children=0&infants=0&pets=0&check_in=2023-03-01&check_out=2023-03-06&previous_page_section_name=1000&federated_search_id=195c3aaa-507b-474c-932a-fb648299ad1a
