,Titulo1,Titulo2,Comuna,Region,Capacidad,Camas,N_Habitaciones,Habitaciones,Baños,Tipo_Baños,Precio,lat,lon,Ubicacion,Ubides,Descripcion,Servicios,Nota,Nnota,Anfitrion,Registro,Link
46,Linda CASA a pasos de la playa de Morrillos!,Alojamiento entero,Coquimbo,Región de Coquimbo,11,9,5, Habitación,3,privado,320.0,-30.12626,-71.36985,"https://maps.google.com/maps?ll=-30.12626,-71.36985&z=14&t=m&hl=es&gl=CL&mapclient=apiv3",,"Condominio privado. La casa está totalmente equipada para 11 personas. Muy acogedora, luminosa y bien distribuida, dos piezas matrimoniales en suite con TV. Cocina americana integrada al living, terraza techada, parrilla, columpios y juegos para niños. Está a 4 min. caminando de la playa (morrillos) y a 15 minutos en auto de Coquimbo  y a 5 minutos de Guanaqueros. Cerca de la casa hay un Humedal con aves de la zona, puedes ir caminando.


El lugar es muy tranquilo, ideal para descansar, hacer deportes al aire libre y gozar de los beneficios del mar, la playa y la naturaleza.
Los niños tienen un espacio ideal para juegos en el patio, con resbalín, columpios, foso de arena etc.",['Cocina'],5.0,31,Magdalena,11-2019,https://www.airbnb.cl/rooms/39948875?adults=1&children=0&infants=0&pets=0&check_in=2023-03-06&check_out=2023-03-11&previous_page_section_name=1000&federated_search_id=023a63d5-89d4-40c1-aff1-17e8a0d55435
47,Preciosa casa en los Molles,Alojamiento entero,La Ligua,Valparaíso,10,7,4, Habitación,3,privado,265.0,-32.22479,-71.5012,"https://maps.google.com/maps?ll=-32.22479,-71.5012&z=14&t=m&hl=es&gl=CL&mapclient=apiv3",,"Excepcional casa en los Molles con quincho, piscina, hot tub y fogón. En condominio privado con cancha de pádel, volley y fútbolito todo de uso gratis. Cuenta con una casa principal con 2 dormitorios y 2 baños y una casa anexada con 2 dormitorios y un baño. En el interior tiene un gran living comedor con cocina integrada, especial para compartir en grupos grandes o en familia. El condominio tiene una salida sur que llega al pueblo de los Molles y su exquisita playa a tan solo 1 km de distancia.",['Acceso la playa Público o compartido'],5.0,4,Paola,09-2014,https://www.airbnb.cl/rooms/778982605341667564?adults=1&children=0&infants=0&pets=0&check_in=2023-03-05&check_out=2023-03-10&previous_page_section_name=1000&federated_search_id=023a63d5-89d4-40c1-aff1-17e8a0d55435
48,Preciosa casa con espectacular vista al mar.,Cabaña entero,Tongoy,Coquimbo Region,7,6,3, Habitación,2,privado,140.0,-30.255,-71.5039,"https://maps.google.com/maps?ll=-30.255,-71.5039&z=14&t=m&hl=es&gl=CL&mapclient=apiv3",,"Apacible lugar,mirando la bellisíma bahía de Tongoy, con sus botes y veleros.
A 3 minutos de la playa de los Bañitos, a 5 minutos de la caleta donde se comen mariscos frescos a excelente precio.Mi lugar esta cerca de todo,no necesita auto para ir la playa ni al pueblo. No hay ruidos molestos. Te va a encantar mi lugar debido a el espacio acogedor.
La terraza maravillosa, una excelente cocina para cocinar, piezas agradables, mis cuadros en los muros.La casa es fresca y cómoda",['Vista a la bahía'],,,Paula,10-2016,https://www.airbnb.cl/rooms/15375304?adults=1&children=0&infants=0&pets=0&check_in=2023-03-01&check_out=2023-03-08&previous_page_section_name=1000&federated_search_id=023a63d5-89d4-40c1-aff1-17e8a0d55435
49,"GRAN CASA DE VERANEO FRENTE AL MAR, Guanaqueros",Alojamiento entero,Coquimbo,Región de Coquimbo,14,12,8, Habitación,5,privado,232.65,-30.19315,-71.40479,"https://maps.google.com/maps?ll=-30.19315,-71.40479&z=14&t=m&hl=es&gl=CL&mapclient=apiv3",,"En GUANAQUEROS. 
Cómoda casa para 14 personas. Acceso directo a playa privada.
Gran living y comedor. Sala de estar, sector de asados, terraza.

Se encuentra dentro de condominio privado con acceso controlado. La casa es exclusiva para los huéspedes. No se comparte con nadie.

Baños con ducha.
Sector de lavandería.
Tiene todo tipo de elementos de cocina (platos, vasos, ollas, etc).
Incluye implementos básicos de aseo.

Se requiere llevar sábanas y toallas. Solo tiene crubrecamas y cojines.


Son 4 habitaciones matrimoniales.
Hay 1 dormitorio de servicio con baño.
Hay 2 piezas con 2 camas y otra pieza con 3 camas.

Total 16 personas.

4 baños además del de servicio.","['Acceso a la playa', 'Frente a la playa']",5.0,6,Valentina,02-2017,https://www.airbnb.cl/rooms/35420560?adults=1&children=0&infants=0&pets=0&check_in=2023-03-01&check_out=2023-03-08&previous_page_section_name=1000&federated_search_id=023a63d5-89d4-40c1-aff1-17e8a0d55435
50,Casa en parcela de agrado en Tongoy,Casa de campo entero,Coquimbo,Región de Coquimbo,10,6,4, Habitación,3,privado,210.0,-30.25658,-71.46803,"https://maps.google.com/maps?ll=-30.25658,-71.46803&z=14&t=m&hl=es&gl=CL&mapclient=apiv3",,"Casa nueva, a 5 minutos de la playa Socos, y a 5 minutos de Tongoy,  2 baños en suite con ducha y 1 baño  con tina .  Cocina con refrigerador nuevo de 2 puertas y cocina Bosch nueva. Cada Suite con TV cable independiente. Casa completamente equipada.  Condominio privado.  Vista insuperable. 
Ingreso:  17:00hrs -  Salida a las 11:00hrs.

No se permiten mascotas en el interior de la casa
Llevar solo  toallas.
Se debe considerar un  monto de $ 35.000 por limpieza al término de la estadía.


La casa es amplia y muy cómoda, ideal para descansar.",['Vista a la bahía'],4.96,24,Carmen Gloria,01-2019,https://www.airbnb.cl/rooms/31873220?adults=1&children=0&infants=0&pets=0&check_in=2023-03-01&check_out=2023-03-06&previous_page_section_name=1000&federated_search_id=023a63d5-89d4-40c1-aff1-17e8a0d55435
51,CASA EN PLAYA LA HERRADURA COQUIMBO,Alojamiento entero,Coquimbo,IV Región,9,8,3, Habitación,1,privado,70.0,-29.98134,-71.35144,"https://maps.google.com/maps?ll=-29.98134,-71.35144&z=14&t=m&hl=es&gl=CL&mapclient=apiv3",,"Vista incomparable, a 42 pasos de la playa.100 mt. CONSTRUÍDOS.
COCINA AMERICANA,CON BAR.
REFRIGERADOR,COCINA,
MICROONDAS,LAVADORA.
TV CABLE.
LIVING CON 2 SOFA CAMA 2 PLAZAS.
3 DORMITORIOS
TERRAZA (TECHO),DE 100 MT.2
ESTACIONAMIENTO (2 vehículos)
ALARMA


LIVING CON 2 SOFA CAMA DE 2 PLAZAS,
3 DORMITORIOS:
     -Principal con cama de 2 pz.
     -2º Cama de 1 pz. y camarote de 1 1/2 abajo y 1 pz. arriba.
     -3º Camarote de 1 1/2 abajo y 1 pz. arriba.
TERRAZA(TECHO),DE 100 MT.
ESTACIONAMIENTO (2 vehículos)
ALARMA.
PRIMERA LÌNEA FRENTE AL MAR","['Acceso a la playa', 'Frente a la playa']",,,Gema,05-2015,https://www.airbnb.cl/rooms/6498425?adults=1&children=0&infants=0&pets=0&check_in=2023-03-06&check_out=2023-03-11&previous_page_section_name=1000&federated_search_id=023a63d5-89d4-40c1-aff1-17e8a0d55435
52,"Casa del Valle, Lugar soñado.",Casa de campo entero,La Serena,Coquimbo,12,9,4, Habitación,4,privado,263.333,-29.92458,-71.21694,"https://maps.google.com/maps?ll=-29.92458,-71.21694&z=14&t=m&hl=es&gl=CL&mapclient=apiv3",,"Lugar de relajación, donde el Sol brillará desde la mañana. Está preparada para un grupo de 12 a 14 personas, completamente equipada, con hermosas y amplias áreas verdes, gran Piscina, Gimnasio, Quincho y horno de barro, mesa de ping pong, Taca Taca, tina de madera de agua caliente a leña, 4 dormitorios, 4baños, Wi-Fi, hermosas y acogedores espacios,  ideal para venir en familias  a relajarse y llenarse de energía del Valle del Elqui. Ubicada en dirección a Vicuña a 15 min del centro de Serena.",['Cocina'],5.0,6,Víctor,12-2022,https://www.airbnb.cl/rooms/787658634284634599?adults=1&children=0&infants=0&pets=0&check_in=2023-03-01&check_out=2023-03-07&previous_page_section_name=1000&federated_search_id=023a63d5-89d4-40c1-aff1-17e8a0d55435
53,Casa en Condominio Agua Dulce Huentelauquen,Villa entero,Angostura,Coquimbo,6,4,3, Habitación,3,privado,220.0,-31.52223,-71.55345,"https://maps.google.com/maps?ll=-31.52223,-71.55345&z=14&t=m&hl=es&gl=CL&mapclient=apiv3",,"CASA QUEBRADA. Nature and reconnection!
A special place to spend time with love ones, relax, chill and explore. Our Villa combines a stunning spot at the edge of a cliff with full sea view. The deco is stylish and charming with art on every single room!

El espacio
A house at the edge of a cliff with perfect sea view and amazing nature surrounding the house. Our place is nicely decorated with art in every room. A large terrace with an outdoor jacuzzi plus a bbq area make it perfect for a family holiday","['Acceso a playa Privado', 'Frente a la playa']",4.78,18,Maria,02-2014,https://www.airbnb.cl/rooms/50591250?adults=1&children=0&infants=0&pets=0&check_in=2023-03-13&check_out=2023-03-20&previous_page_section_name=1000&federated_search_id=023a63d5-89d4-40c1-aff1-17e8a0d55435
54,Casa en Tongoy frente al mar maravillosa vista,Alojamiento entero,Tongoy,Coquimbo,6,6,3, Habitación,2,privado,110.0,-30.25472,-71.50059,"https://maps.google.com/maps?ll=-30.25472,-71.50059&z=14&t=m&hl=es&gl=CL&mapclient=apiv3",,"Arriendo casa en Tongoy ideal para disfrutar del mar en todo momento.
Es una casa independiente, con una vista maravillosa de 180º al mar, ubicada en la península a pasos de playa Grande, playa Los Baños, del muelle y  centro gastronómico.
Se encuentra recientemente remodelada.
Tiene 3 dormitorios, 2 baños, cocina americana, logia, living comedor y amplia terraza.
Se arrienda con kayac, parrilla y juegos de mesa.
Se arrienda con 2 estacionamientos sin cargo, fuera del recinto a 200 mt aprox.","['Acceso a la playa', 'Frente a la playa']",4.93,14,María Fernanda,12-2019,https://www.airbnb.cl/rooms/41175014?adults=1&children=0&infants=0&pets=0&check_in=2023-03-01&check_out=2023-03-07&previous_page_section_name=1000&federated_search_id=023a63d5-89d4-40c1-aff1-17e8a0d55435
55,Casa con vista al mar a pasos de la playa,Alojamiento entero,Coquimbo,Chile,8,7,3, Habitación,3,privado,230.0,-30.12522,-71.37006,"https://maps.google.com/maps?ll=-30.12522,-71.37006&z=14&t=m&hl=es&gl=CL&mapclient=apiv3",,"Increíble casa con espectacular vista al mar ubicada en segunda linea en condominio privado, a pasos de la playa ( 150 mts, 2 minutos caminando).

La casa tiene 3D  y 3B (1 en suit) cocina americana full equipada , living, comedor, terraza, logia con lavadora y secadora y patio de servicio. Con una capacidad de 8 personas.

Condominio cuenta con seguridad las 24 hrs con nochero y portero permanente.

Ubicado a  15 minutos de Guanaqueros y Coquimbo.


Casa nueva de hormigón, un piso (120m2 cubiertos) en parcela 5000 m2 . La propiedad tiene 3D, 3B (1 en suit) , cocina americana, living comedor, logia, patio de servicio, terraza de 50 m2 semi sombra, estacionamiento para 2 vehículos.
Actividades recreativas; playa, pesca, buceo, paseos en playa y laguna, naturaleza,  descanso, avistamiento de aves
Condominio cuenta con seguridad las 24 hrs  con portero y nochero permanentes","['Acceso a la playa', 'Frente a la playa']",4.77,13,Paula,02-2018,https://www.airbnb.cl/rooms/47011248?adults=1&children=0&infants=0&pets=0&check_in=2023-03-01&check_out=2023-03-06&previous_page_section_name=1000&federated_search_id=023a63d5-89d4-40c1-aff1-17e8a0d55435
56,Casa Vista Hermosa en Rosario de Peñuelas,Alojamiento entero,Coquimbo,Chile,8,6,4, Habitación,"3,5",privado,96.667,-29.96265,-71.30631,"https://maps.google.com/maps?ll=-29.96265,-71.30631&z=14&t=m&hl=es&gl=CL&mapclient=apiv3",,"Linda casa en barrio exclusivo, piscina, quincho, 4 habitaciones 4 baños,  hermosa vista",['Vista a la bahía'],4.65,37,Luis,11-2020,https://www.airbnb.cl/rooms/47411331?adults=1&children=0&infants=0&pets=0&check_in=2023-03-04&check_out=2023-03-10&previous_page_section_name=1000&federated_search_id=023a63d5-89d4-40c1-aff1-17e8a0d55435
57,Casa playa,Alojamiento entero,Coquimbo,Chile,7,3,4, Habitación,2,privado,176.0,-30.19051,-71.38138,"https://maps.google.com/maps?ll=-30.19051,-71.38138&z=14&t=m&hl=es&gl=CL&mapclient=apiv3",,"Descanso, playa, naturaleza y desconexión asegurados.
Luminosa casa con vista al mar en un entorno natural.
Panorama ideal para grandes y chicos.

El espacio
Casa de madera de 150 mts.2 con 4 habitaciones y 2 baños.
El dormitorio principal cuenta con una cama súper king y las 2 restantes con una cama de 2 plazas cada una.
Además hay una habitación con vista al mar habilitada como oficina para quienes deseen hacer teletrabajo o bien, pueden instalar un colchón inflable de 2 plazas que les dejamos por si lo requieren.
También cuenta con un quincho completamente habilitado con parrilla a gas, mesa y lavaplatos exterior.
Todo dispuesto para que disfruten de la terraza con vista al mar, hamaca  y cama elástica.",['Acceso a la playa'],,,Madelyn,02-2023,https://www.airbnb.cl/rooms/826570414279341474?adults=1&children=0&infants=0&pets=0&check_in=2023-03-03&check_out=2023-03-08&previous_page_section_name=1000&federated_search_id=023a63d5-89d4-40c1-aff1-17e8a0d55435
58,Casa nueva full equipada,Alojamiento entero,La Serena,Región de Coquimbo,5,4,3, Habitación,1,privado,50.0,-29.89031,-71.23827,"https://maps.google.com/maps?ll=-29.89031,-71.23827&z=14&t=m&hl=es&gl=CL&mapclient=apiv3",,"Es una casa que está en condominio muy tranquilo, con camas muy cómodas tv en los dormitorios servicio de wifi y tv, cocina equipada con encimera, horno eléctrico y todo lo necesario para pasar los días que necesites, frente a la casa se la plaza con juegos infantiles, está cercano a supermercado, gasolinera, farmacia. A 15 minutos del centro

Acceso de los huéspedes
Frente a la casa está la plaza del condominio donde puedes andar en bicicleta y hay juegos para niños",['Vista al patio'],4.96,53,Aguss,12-2016,https://www.airbnb.cl/rooms/35649776?adults=1&children=0&infants=0&pets=0&check_in=2023-03-01&check_out=2023-03-07&previous_page_section_name=1000&federated_search_id=023a63d5-89d4-40c1-aff1-17e8a0d55435
59,"Nueva e increíble casa en Morrillos, pasos del mar",Casa de campo entero,La Hacienda,Coquimbo,11,9,4, Habitación,4,privado,350.0,-30.12608,-71.36676,"https://maps.google.com/maps?ll=-30.12608,-71.36676&z=14&t=m&hl=es&gl=CL&mapclient=apiv3",,"Increíble casa ubicada en condominio privado en una de las mejores playas de Chile (Morrillos). 

Muy espaciosa y moderna, se encuentra a pasos de la playa (350 mts, 5 min caminando) y de humedal.

200 mts2: 4D y 4B (3 en suit), cocina full equipada, living, comedor, gran terraza, salita con TV, logia con lavadora y secadora, patio de servicio y escritorio para teletrabajo.

Capacidad: 11 personas.

Condominio con seguridad las 24 hrs, con nochero y portero permanente.

A 15 minutos de Coquimbo.","['Acceso a playa Privado', 'Frente a la playa']",5.0,6,Rodrigo,05-2014,https://www.airbnb.cl/rooms/541458323912047277?adults=1&children=0&infants=0&pets=0&check_in=2023-03-01&check_out=2023-03-06&previous_page_section_name=1000&federated_search_id=023a63d5-89d4-40c1-aff1-17e8a0d55435
60,"Vacaciones , teletrabajo y Piscina en Los Mollles",Alojamiento entero,La Ligua,Región de Valparaíso,6,4,3, Habitación,2,privado,75.833,-32.238,-71.5158,"https://maps.google.com/maps?ll=-32.238,-71.5158&z=14&t=m&hl=es&gl=CL&mapclient=apiv3",,"Disfruta de la tranquilidad de Los Molles,  mi casa está situada en un tranquilo sector de Los Molles, si buscas descansar y disfrutar de la naturaleza este es el lugar indicado. 
Ideal para recargar energías!!!

El espacio
La casa está totalmente equipada.  Tres dormitorios con tv cable, Sábanas y toallas incluidos. 2 baños. 
Tenemos estacionamiento para 2 vehículos dentro de la propiedad.
En el exterior puedes disfrutar de la terraza con quincho. 
A partir de mayo frazadas eléctricas en todas las camas; estufa a gas. Ideal para disfrutar Los Molles en el invierno.
Wifi ideal para el teletrabajo.",['Acceso a la playa'],4.77,47,Paulina,06-2018,https://www.airbnb.cl/rooms/27329830?adults=1&children=0&infants=0&pets=0&check_in=2023-03-05&check_out=2023-03-11&previous_page_section_name=1000&federated_search_id=26eed288-8cda-4bdd-beae-ee0735233299
61,Casa playa,Alojamiento entero,Coquimbo,Chile,7,3,4, Habitación,2,privado,176.0,-30.19051,-71.38138,"https://maps.google.com/maps?ll=-30.19051,-71.38138&z=14&t=m&hl=es&gl=CL&mapclient=apiv3",,"Descanso, playa, naturaleza y desconexión asegurados.
Luminosa casa con vista al mar en un entorno natural.
Panorama ideal para grandes y chicos.

El espacio
Casa de madera de 150 mts.2 con 4 habitaciones y 2 baños.
El dormitorio principal cuenta con una cama súper king y las 2 restantes con una cama de 2 plazas cada una.
Además hay una habitación con vista al mar habilitada como oficina para quienes deseen hacer teletrabajo o bien, pueden instalar un colchón inflable de 2 plazas que les dejamos por si lo requieren.
También cuenta con un quincho completamente habilitado con parrilla a gas, mesa y lavaplatos exterior.
Todo dispuesto para que disfruten de la terraza con vista al mar, hamaca  y cama elástica.",['Acceso a la playa'],,,Madelyn,02-2023,https://www.airbnb.cl/rooms/826570414279341474?adults=1&children=0&infants=0&pets=0&check_in=2023-03-03&check_out=2023-03-08&previous_page_section_name=1000&federated_search_id=26eed288-8cda-4bdd-beae-ee0735233299
62,Cabaña full equipada con piscina en Coquimbo.,Cabaña entero,Coquimbo,Chile,3,2,2, Habitación,1,privado,44.0,-30.00023,-71.38369,"https://maps.google.com/maps?ll=-30.00023,-71.38369&z=14&t=m&hl=es&gl=CL&mapclient=apiv3",,"Hermosa, limpia y cómoda cabaña para 3 personas, ubicada en la Reserva Ecológica Ensenada El Panul, a solo 10 minutos (en auto) del centro de Coquimbo, situada a continuación de La Herradura.

La cabaña cuenta con todos los servicios básicos como agua caliente, electricidad, cocina a gas, TV cable y piscina. 

Hay dos dormitorios, con 1 cama matrimonial y una de 1 plaza y media, es decir, capacidad para hasta 3 personas en total. 

*SE DEBE TRAER SÁBANAS


La cabaña completa, con sus dos dormitorios, baño, living, comedor y cocina.  
Además de una excelente terraza y espacio para estacionar hasta 2 vehículos. 
La piscina es bastante cómoda y se comparte con la segunda cabaña que está en la parcela.
*SE DEBE TRAER SÁBANAS",['Vista al patio'],4.92,13,María-José,08-2015,https://www.airbnb.cl/rooms/41266545?adults=1&children=0&infants=0&pets=0&check_in=2023-03-07&check_out=2023-03-12&previous_page_section_name=1000&federated_search_id=26eed288-8cda-4bdd-beae-ee0735233299
63,Hermosa cabaña totalmente equipada en Coquimbo,Cabaña entero,La Herradura,Región de Coquimbo,5,3,3, Habitación,1,privado,54.0,-30.00356,-71.394,"https://maps.google.com/maps?ll=-30.00356,-71.394&z=14&t=m&hl=es&gl=CL&mapclient=apiv3",,"Hermosa y cómoda cabaña, ubicada en la Reserva Ecológica Ensenada El Panul, a 10 minutos (en auto)  de Coquimbo, a continuación de La Herradura.  A tan solo 10 minutos de la Playa Totoralillo.

La cabaña está totalmente equipada y cuenta con todos los servicios básicos como agua caliente, electricidad, y cocina a gas; además de antena de televisión digital, y piscina.  

Los tres dormitorios, poseen 2 camas matrimoniales y una cama de plaza y media; es decir capacidad para 5 (SIN SÁBANAS)


La Ensenada El Panul es un oasis de tranquilidad para aquellos que buscan la cercanía a la naturaleza y la desconexión del estrés de las grandes ciudades, pero al mismo tiempo, muy cerca de supermercados (Santa Isabel, Líder y Unimarc) y de puntos importantes como playas de la cuarta región, centro de Coquimbo y Avenida del Mar en La Serena (15 minutos).

Se aceptan niños de todas las edades, solamente se pide tener extremo cuidado ya que la piscina no tiene reja de protección.
Se prohíbe hacer fiestas. 
Se prohibe invitar personas a la propiedad. 
Se arrienda como minimo 3 noches. 
Check in a las 15h. 
Check out a las 12h.",['Vista al jardín'],4.57,15,Jacques,12-2016,https://www.airbnb.cl/rooms/30810835?adults=1&children=0&infants=0&pets=0&check_in=2023-03-08&check_out=2023-03-13&previous_page_section_name=1000&federated_search_id=26eed288-8cda-4bdd-beae-ee0735233299
64,excelente casa 10 personas,Alojamiento entero,Coquimbo,Chile,10,8,4, Habitación,3,privado,144.0,-30.2546,-71.5017,"https://maps.google.com/maps?ll=-30.2546,-71.5017&z=14&t=m&hl=es&gl=CL&mapclient=apiv3",,"Tu familia estará cerca de todo si te hospedas en este alojamiento céntrico en la península , terraza vista al mar , habilitado para 10 personas, 4 dormitorios 3 baños , terraza amoblada , lavadora tv cable , estacionamiento 3 vehículos

El espacio
gran casa 2 pisos , estacionamiento con vista al mar , terraza amoblada , 4 dormitorios 3 baños , lavadora , patio interior",['Acceso a la playa'],,,Jose Miguel,02-2020,https://www.airbnb.cl/rooms/770478497320889557?adults=1&children=0&infants=0&pets=0&check_in=2023-03-01&check_out=2023-03-08&previous_page_section_name=1000&federated_search_id=26eed288-8cda-4bdd-beae-ee0735233299
65,Luminosa cabaña con piscina,Cabaña entero,Horcón,Coquimbo,4,3,2, Habitación,"1,5",privado,120.0,-30.20201,-70.48645,"https://maps.google.com/maps?ll=-30.20201,-70.48645&z=14&t=m&hl=es&gl=CL&mapclient=apiv3",,"Desconecta de tus preocupaciones y descansa en esta acogedora cabaña con capacidad para 4 personas. Mucha luz, hermosa vista en balcón- corredor o terraza, con privacidad y al mismo tiempo la conectividad que necesites.

El espacio
Nuestra ubicación en pleno corazón de Horcon Bajo, Valle del Elqui, te permite salir a pasear caminando o en bicicleta. A pocos pasos puedes encontrar un almacén de provisiones básicas con un rico pan amasado,  almorzar en un excelente restaurante a orilla del río,  acceder a otras orillas de río y tomar un delicioso café de grano disfrutando de artesanos locales en el pueblo de artesanos de Horcon.",['Vista al jardín'],5.0,9,Pabla,05-2019,https://www.airbnb.cl/rooms/596231619224103081?adults=1&children=0&infants=0&pets=0&check_in=2023-03-16&check_out=2023-03-21&previous_page_section_name=1000&federated_search_id=26eed288-8cda-4bdd-beae-ee0735233299
66,Moderna casa nueva en hermosa y soleada parcela,Casa de campo entero,La Serena,Coquimbo,8,6,4, Habitación,3,privado,152.0,-29.9224,-71.1794,"https://maps.google.com/maps?ll=-29.9224,-71.1794&z=14&t=m&hl=es&gl=CL&mapclient=apiv3",,"Casa recién construida dentro de terreno de 3000m2, a la salida hacia valle de Elqui. A 3 minutos del aeropuerto, 12 del centro y 20 de la playa, esta moderna casa cuenta con 4 dormitorios, 3 baños, cocina comedor, living, terraza, piscina de 8·8·1,5 mts, con amplio deck de madera, juegos para niños en amplio jardín. El quincho esta bajo la sombra de un gran sauce frente a estanque de peces, amplio mesón de mosaico, mesa de ping pong. 3 Smart tv, wifi, alarma, cámaras de seguridad en exterior.",['Vista al patio'],,,Susana,07-2015,https://www.airbnb.cl/rooms/721068344825775980?adults=1&children=0&infants=0&pets=0&check_in=2023-03-01&check_out=2023-03-06&previous_page_section_name=1000&federated_search_id=26eed288-8cda-4bdd-beae-ee0735233299
67,"Casa grande campestre en Vicuña, Valle de Elqui",Casa de campo entero,Vicuña,Coquimbo,11,9,5, Habitación,3,privado,83.6,-30.03048,-70.70079,"https://maps.google.com/maps?ll=-30.03048,-70.70079&z=14&t=m&hl=es&gl=CL&mapclient=apiv3",,"Casa rústica y acogedora, ideal para familias grandes, ya que cuenta con capacidad para 11 personas. Posee amplios espacios, 5 habitaciones, 2 baños, equipada y lista para disfrutar. Cuenta con un quincho ideal para disfrutar de asados y picoteos, pensado para compartir en familia o con amigos, deleitándose de  una linda y cálida vista tanto de día como de noche.
Es un lugar muy tranquilo, ideal para desconectarse y renovar energías",['Cocina'],5.0,19,Melany,04-2017,https://www.airbnb.cl/rooms/51024287?adults=1&children=0&infants=0&pets=0&check_in=2023-03-01&check_out=2023-03-06&previous_page_section_name=1000&federated_search_id=26eed288-8cda-4bdd-beae-ee0735233299
68,Moderna y acogedora casa con vista al mar,Alojamiento entero,La Ligua,Región de Valparaíso,10,8,4, Habitación,3,privado,220.0,-32.20521,-71.51504,"https://maps.google.com/maps?ll=-32.20521,-71.51504&z=14&t=m&hl=es&gl=CL&mapclient=apiv3",,"Preciosa casa en condominio Rocas del Mar, Los Molles, con accesos controlados y seguridad 24/7, en hermoso entorno natural.
Casa moderna y nueva con vista privilegiada al mar, totalmente equipada para 10 personas.  Cuenta con 4 Habitaciones, 3 baños, cocina totalmente equipada, sala de estar y terraza panorámica.
Chimenea en estar/comedor/cocina, bosca en pasillo, y estufa parafina, láser.",['Cocina'],4.84,38,Patricia,08-2018,https://www.airbnb.cl/rooms/35913372?adults=1&children=0&infants=0&pets=0&check_in=2023-03-01&check_out=2023-03-06&previous_page_section_name=1000&federated_search_id=26eed288-8cda-4bdd-beae-ee0735233299
69,Linda casa en arriendo La Serena,Alojamiento entero,La Serena,Coquimbo,5,4,2, Habitación,1,privado,40.0,-29.94369,-71.26921,"https://maps.google.com/maps?ll=-29.94369,-71.26921&z=14&t=m&hl=es&gl=CL&mapclient=apiv3",,,['Cocina'],5.0,3,Soledad,02-2020,https://www.airbnb.cl/rooms/48185722?adults=1&children=0&infants=0&pets=0&check_in=2023-03-01&check_out=2023-03-06&previous_page_section_name=1000&federated_search_id=26eed288-8cda-4bdd-beae-ee0735233299
