,Titulo1,Titulo2,Comuna,Region,Capacidad,Camas,N_Habitaciones,Habitaciones,Baños,Tipo_Baños,Precio,lat,lon,Ubicacion,Ubides,Descripcion,Servicios,Nota,Nnota,Anfitrion,Registro,Link
0,Cabaña Valle del Elqui,Alojamiento entero,La Serena,Región de Coquimbo,5,4,3, Habitación,2,privado,98.0,-30.0126,-71.0358,"https://maps.google.com/maps?ll=-30.0126,-71.0358&z=14&t=m&hl=es&gl=CL&mapclient=apiv3",,"Está ubicado en El Valle de Elqui a 25 Kilómetros de La Serena ciudad que cuenta  con playa, bares restaurante, casino, Mall. El aeropuerto se encuentra a 20 kilómetros de distancia. Desde este lugar se pueden visitar observatorios Mayu, Tololo y Mamalluca ( reservas con anticipación)
También se pueden visitar las viñas y pisqueras de la localidad.
Piscina con vista panorámica al Valle.


La cabaña cuenta con hermosa terraza con vista al Valle, 2 dormitorios con cama de 2 plazas. Uno en la planta baja totalmente independiente con entrada independiente y el otro en el piso superior donde además se encuentra la cocina.Cuenta además con 2 camas de 1 plaza ubicadas en el segundo piso . Baño en ambos pisos. Cabaña full equipada para que tu estadía sea confortable.",['Cocina'],5.0,34,Ana María,07-2017,https://www.airbnb.cl/rooms/20154848?adults=1&children=0&infants=0&pets=0&check_in=2023-03-06&check_out=2023-03-11&previous_page_section_name=1000&federated_search_id=67f159fc-b383-451f-81fb-7447c879c942
1,Espectacular casa con una vista inolvidable,Alojamiento entero,Los Vilos,Coquimbo,9,10,3, Habitación,"2,5",privado,170.0,-31.97075,-71.49128,"https://maps.google.com/maps?ll=-31.97075,-71.49128&z=14&t=m&hl=es&gl=CL&mapclient=apiv3",,"La casa tiene una vista espectacular, con bajada a la playa donde se encuentra una piscina de agua de mar.

El espacio
La casa tiene tv con directv, wifi, y en el
Patio trasero tiene una zona de juego para los niños y un columpio con la mejor vista al
Mar de la zona.",['Acceso a la playa'],4.88,25,Maria Jose,08-2016,https://www.airbnb.cl/rooms/48262071?adults=1&children=0&infants=0&pets=0&check_in=2023-03-01&check_out=2023-03-06&previous_page_section_name=1000&federated_search_id=67f159fc-b383-451f-81fb-7447c879c942
2,Linda casa con piscina y entorno campestre,Cabaña entero,Vicuña,Región de Coquimbo,6,5,3, Habitación,1,privado,100.0,-30.00054,-70.991,"https://maps.google.com/maps?ll=-30.00054,-70.991&z=14&t=m&hl=es&gl=CL&mapclient=apiv3",,"Linda casa con piscina y juegos infantiles, posee 3 dormitorios habilitados para 6 personas, baño completo, cocina americana equipada con encimera, horno eléctrico, horno microondas, vajilla y lavadora.
La zona exterior cuenta con un quincho, el cual tiene asadera y horno a leña, arboles frutales, piscina y juegos infantiles.
Paisaje hermoso, entorno tranquilo
Ver descripción completa",['Cocina'],4.94,17,Ximena,04-2018,https://www.airbnb.cl/rooms/31650345?adults=1&children=0&infants=0&pets=0&check_in=2023-03-01&check_out=2023-03-06&previous_page_section_name=1000&federated_search_id=67f159fc-b383-451f-81fb-7447c879c942
3,Casa en Condominio Agua Dulce Huentelauquen,Villa entero,Angostura,Coquimbo,6,4,3, Habitación,3,privado,220.0,-31.52223,-71.55345,"https://maps.google.com/maps?ll=-31.52223,-71.55345&z=14&t=m&hl=es&gl=CL&mapclient=apiv3",,"CASA QUEBRADA. Nature and reconnection!
A special place to spend time with love ones, relax, chill and explore. Our Villa combines a stunning spot at the edge of a cliff with full sea view. The deco is stylish and charming with art on every single room!

El espacio
A house at the edge of a cliff with perfect sea view and amazing nature surrounding the house. Our place is nicely decorated with art in every room. A large terrace with an outdoor jacuzzi plus a bbq area make it perfect for a family holiday",['Vista a la bahía'],4.78,18,Maria,02-2014,https://www.airbnb.cl/rooms/50591250?adults=1&children=0&infants=0&pets=0&check_in=2023-03-13&check_out=2023-03-20&previous_page_section_name=1000&federated_search_id=67f159fc-b383-451f-81fb-7447c879c942
4,Linda CASA a pasos de la playa de Morrillos!,Alojamiento entero,Coquimbo,Región de Coquimbo,11,9,5, Habitación,3,privado,320.0,-30.12626,-71.36985,"https://maps.google.com/maps?ll=-30.12626,-71.36985&z=14&t=m&hl=es&gl=CL&mapclient=apiv3",,"Condominio privado. La casa está totalmente equipada para 11 personas. Muy acogedora, luminosa y bien distribuida, dos piezas matrimoniales en suite con TV. Cocina americana integrada al living, terraza techada, parrilla, columpios y juegos para niños. Está a 4 min. caminando de la playa (morrillos) y a 15 minutos en auto de Coquimbo  y a 5 minutos de Guanaqueros. Cerca de la casa hay un Humedal con aves de la zona, puedes ir caminando.


El lugar es muy tranquilo, ideal para descansar, hacer deportes al aire libre y gozar de los beneficios del mar, la playa y la naturaleza.
Los niños tienen un espacio ideal para juegos en el patio, con resbalín, columpios, foso de arena etc.",['Cocina'],5.0,31,Magdalena,11-2019,https://www.airbnb.cl/rooms/39948875?adults=1&children=0&infants=0&pets=0&check_in=2023-03-06&check_out=2023-03-11&previous_page_section_name=1000&federated_search_id=67f159fc-b383-451f-81fb-7447c879c942
5,Casa Privada con Piscina,Alojamiento entero,Paiguano,Coquimbo,8,7,3, Habitación,2,privado,151.697,-30.02795,-70.5199,"https://maps.google.com/maps?ll=-30.02795,-70.5199&z=14&t=m&hl=es&gl=CL&mapclient=apiv3",,"Desde este alojamiento céntrico todo el grupo podrá disfrutar del fácil acceso a la plaza de Paihuano, (negocios), Pisco Elqui, Montegrande, Horcon, Vicuña, etc, muy buena ubicacion.
En el corazon del Valle del Elqui, se encuentra el pueblo de Paihuano.
Lugar tranquilo, seguro y con un clima privilegiado con los cielos mas claros del mundo.
Casa privada con piscina, para disfrutar solo con tu familia, sin compartir las instalaciones con personas extrañas a tu grupo, seguro y tranquilo.


Casa Privada con Piscina, NO es una cabaña, por lo tanto, no se comparten los espacios ni piscina.
Rodeada de árboles frutales y parras, que podrás disfrutar junto a tu familia, cielo estrellado y se ubica en el corazón del Pueblo de Paihuano, cerca de la Plaza y negocios.
Casa equipada con todo lo necesario para descansar solo con tu grupo familiar, sin preocuparte por compartir espacios con extraños.",['Cocina'],,,Susana,11-2016,https://www.airbnb.cl/rooms/804259524431202960?adults=1&children=0&infants=0&pets=0&check_in=2023-03-01&check_out=2023-03-06&previous_page_section_name=1000&federated_search_id=67f159fc-b383-451f-81fb-7447c879c942
6,"Parcela totalmente equipada. Tongoy, Coquimbo.Chile.",Alojamiento entero,Tongoy,Coquimbo Region,Más de 16,13,7, Habitación,3,privado,250.0,-30.2878,-71.51068,"https://maps.google.com/maps?ll=-30.2878,-71.51068&z=14&t=m&hl=es&gl=CL&mapclient=apiv3",,"Maravillosa casa ubicada en parcelas de Pachingo a dos cuadras de Playa Grande,Tongoy.
Casa equipada cuenta con cocina amoblada full,horno eléctrico, microondas,2 refrigeradores,1 freezer, lavadora,parrilla a carbón y parrilla a gas,wok a gas.
Planta baja cuenta con 3 dormitorios y baño completo,cocina,comedor con estancia.Dormitorio con un baño completo independiente.
Piscina privada y 2 kayaks con sus chalecos salvavidas.
Planta alta cuenta con 3 dormitorios,uno en suite y terraza.


Los huéspedes pueden hacer uso de todas las instalaciones, la piscina privada y 2 kayaks.",['Acceso la playa Público o compartido'],4.87,16,Luis,11-2017,https://www.airbnb.cl/rooms/27652742?adults=1&children=0&infants=0&pets=0&check_in=2023-03-01&check_out=2023-03-06&previous_page_section_name=1000&federated_search_id=67f159fc-b383-451f-81fb-7447c879c942
7,Casa en Huentelauquén a pasos de dos playas.,Alojamiento entero,Huentaleuquen,Coquimbo,9,9,4, Habitación,3,privado,240.0,-31.5356,-71.568,"https://maps.google.com/maps?ll=-31.5356,-71.568&z=14&t=m&hl=es&gl=CL&mapclient=apiv3",,"Increíble casa a pasos de las 2 mejores playas del sector. 
Cuatro Dormitorios, tres baños. 
Patio Cerrado con Parrilla Uruguaya de Acero Inox que sirve también como fogón y Terraza interior techada con Mesa Pingpong.
Kanka para la parrilla. 
Cocina con Lavavajilla, Microondas, Basureros, todo integrado
Refrigerador Side by Side Dispensador de Agua y Hielo
Bose SoundTouch
Calefacción Central por Radiadores y Bosca en Living.
Terraza panorámica en 2° piso donde están las piezas.


Dormitorio 1: Cama Super King en suite con walking closets y escritorio.
Dormitorio 2: Cama King con closets, ubicado frente a baño. 
Dormitorio 3: Camarote con 3 camas 1,5 plazas y closet.
Dormitorio 4:  Camarote con 2 camas de 1,5 plazas, 2 mts largo y closet.
Mosquiteros en todas las piezas y en zonas clave.
Arriendo Incluye sábanas, no toallas.

IMPORTANTE: esta casa no cuenta con energía eléctrica de matriz, tiene paneles solares que funcionan muy bien para luces, cargar celulares, refrigerador, computador, parlante, etc, pero NO se puede usar nada que tenga resistencia eléctrica como secador de pelo, hervidor eléctrico, etc.

Por lo mismo el lavavajillas y microondas se deben utilizar de acuerdo a los protocolos que encontrarás en la misma casa.
Bodega ubicada en 1º piso no está incluida en el arriendo.
Hay una persona que hace aseo y trae algunas compras que nos puedan hacer falta y que está disponible en caso se necesite, ella cobra $30.000 por visita para aseo, se debe coordinar con tiempo pues en ciertas épocas puede tener alt demanda.
También se lleva y lava ropa en caso se necesite.
Si se necesita leña también hay una persona que la trae. 
La casa está a 150 metros de la bajada a playa Maitencillo y a 300 de Playa del Peñón, hay varias otras en la zona, también se pueden hacer paseos, a las playas, roqueríos, a las dunas (especial para los niños), y calas para practicar buceo o simplemente para nadar.
El lugar es muy agradable, con poca gente que lo hace único para descansar y pasarlo bien en familia.",['Vista al desierto'],4.75,4,Javiera,01-2017,https://www.airbnb.cl/rooms/53704633?adults=1&children=0&infants=0&pets=0&check_in=2023-03-01&check_out=2023-03-06&previous_page_section_name=1000&federated_search_id=67f159fc-b383-451f-81fb-7447c879c942
8,Descansa Frente al mar,Alojamiento entero,Coquimbo,Chile,5,4,3, Habitación,2,privado,76.559,-29.9574,-71.3084,"https://maps.google.com/maps?ll=-29.9574,-71.3084&z=14&t=m&hl=es&gl=CL&mapclient=apiv3",,"Relájate con toda la familia en este tranquilo lugar y disfruta de su inigualable vista.
A orillas del mar se ubica este hermoso departamento, a pasos de restoranes y casino, y a minutos de los centros urbanos de La Serena y Coquimbo.
Punto ideal para conocer el Valle del Elqui o conocer el Valle del Encanto o el Parque Fray Jorge.

El espacio
Espacioso y luminoso departamento frente al mar.",['Vista al mar'],4.71,7,Lilian,12-2017,https://www.airbnb.cl/rooms/788447440844761022?adults=1&children=0&infants=0&pets=0&check_in=2023-03-01&check_out=2023-03-06&previous_page_section_name=1000&federated_search_id=67f159fc-b383-451f-81fb-7447c879c942
9,"Casa Algamar, Tongoy, Playa Blanca y Guanaqueros",Alojamiento entero,Coquimbo,Región de Coquimbo,Más de 16,22,9, Habitación,5,privado,450.0,-30.2088,-71.4788,"https://maps.google.com/maps?ll=-30.2088,-71.4788&z=14&t=m&hl=es&gl=CL&mapclient=apiv3",,"La ubicación aislada de nuestra casa la convierte en un lugar muy especial para los tiempos de verano. Se encuentra justo en una playa en una pequeña bahía, protegida del viento. La mayoría de las habitaciones dan al mar y hay varias  terrazas para el entretenimiento. Cada terraza tiene una mesa de comedor con capacidad para 24 personas y está equipada con sombrillas. También hay una zona de barbacoa con una fogata para disfrutar de las noches estrelladas del hemisferio sur. La casa tiene 20 camas y 4 aseos. Hay una sala de servicio adicional (2 camas) y aseo privado.


Nuestra casa ha sido remodelada con mucho cuidado y realmente se siente como un hogar. Con sus nueve dormitorios y alojamiento para 22 personas, es grande pero aún así se siente acogedor. Tiene una terraza increíble que ofrece vistas a un entorno prístino donde la fauna y la flora te sorprenderán. Su cocina de planta abierta y su sala de estar son ideales para entretenerse y compartir buenos momentos.
Los propietarios de la casa y del condominio se preocupan por el medio ambiente y esperan que sus huéspedes hagan lo mismo en todo momento. Es por eso que no se permiten motocicletas ni motores de ningún tipo en el condominio.",['Vista a la bahía'],,,Gino,04-2019,https://www.airbnb.cl/rooms/33711635?adults=1&children=0&infants=0&pets=0&check_in=2023-03-01&check_out=2023-03-08&previous_page_section_name=1000&federated_search_id=67f159fc-b383-451f-81fb-7447c879c942
10,Casa de diseño a pasos de la playa WIFI,Alojamiento entero,Los Molles,Valparaíso,8,7,3, Habitación,2,privado,118.0,-32.24044,-71.51468,"https://maps.google.com/maps?ll=-32.24044,-71.51468&z=14&t=m&hl=es&gl=CL&mapclient=apiv3",,"Vista panorámica a la playa y el mar, 3 dormitorios, 2 baños, para 8 personas. Gran arquitectura, destacada en publicaciones del ramo. 3 balcones con vista al mar y playa, incluyendo uno donde se pueden hacer asados o cenar. Columpio infantil , hamaca, parrilla. A pasos de la playa y de la Reserva el Puquén. Wifi banda ancha fibra óptica (zoom, teams).  Dos habitaciones con escritorio para teletrabajo. Tv satelital, Android TV y Blu Ray colección de películas. Equipo de audio para películas.


Hermosa casa vista al mar y la playa, 3 dormitorios, 2 baños, capacidad para 8 personas. Dos pisos, en el primero living comedor, terraza, cocina, dos dormitorios y baño. En el segundo, dormitorio con cama doble, terraza, baño en suite y espectacular vista al mar. También en el segundo piso, una terraza principal con vista al mar y a la playa, donde se pueden hacer asados, almorzar o cenar. Casa de gran arquitectura, destacada en libros del ramo y publicaciones de diseño Siete camas, una de dos plazas y seis de una plaza. Adicionalmente hay una cama nido que se puede usar para un niño 
• Columpio infantil en el patio 
• Hamaca en balcón 
• Parrilla 
• Estacionamientos 
• A pasos de la playa y de la Reserva Natural Puquén 
• TV satelital, Android TV y Blu-Ray con colección de películas. Equipo de audio para películas. Con el Android TV se pueden ver servicios de streaming como Netflix o Amazon Prime (el pasajero debe proveer la cuenta de alguna de estas plataformas) 

Wifi banda ancha fibra óptica, ideal para teletrabajar con zoom, meets o teams. Escritorio de trabajo

Hay descuentos por estadías largas 

No fumar dentro de la casa.

Hay dos habitaciones con escritorio y silla para trabajo o estudio remoto. 

Internet wifi fibra óptica.

La mesa fija del comedor es pequeña, apta para cuatro o cinco personas máximo. Adicionalmente hay una mesa armable, con bancas armables, para seis u ocho personas, que se puede disponer en el balcón del primer piso, al interior del living-comedor o en la terraza principal. 

Por protocolos COVID-19, no se proveen tollas ni sábanas, los pasajeros deben traer las propias. 

Se admiten mascotas pero bajo completa responsabilidad de sus dueños. Se debe dar aviso y dejar un depósito de 50 mil pesos por posibles daños.

La casa está justo en la zona segura para tsunamis. Si hay alarma, hay que quedarse en la casa.

Síguenos en nuestra cuenta de IG @casanave_losmolles",['Acceso la playa Público o compartido'],4.91,35,Carmen Gloria,02-2021,https://www.airbnb.cl/rooms/48315175?adults=1&children=0&infants=0&pets=0&check_in=2023-04-10&check_out=2023-04-15&previous_page_section_name=1000&federated_search_id=67f159fc-b383-451f-81fb-7447c879c942
11,"Glamping descanso y vacación Familiar, La Serena",Alojamiento entero,La Serena,Región de Coquimbo,Más de 16,13,5, Habitación,4,privado,108.877,-29.89005,-71.21986,"https://maps.google.com/maps?ll=-29.89005,-71.21986&z=14&t=m&hl=es&gl=CL&mapclient=apiv3",,"""Ven a vivir la experiencia Glamping con nosotros"" Glamping es un nuevo concepto de vacaciones, le brindamos comodidades para que los huéspedes puedan vivir bellos momentos familiares. Pueden compartir Piscina solo para ellos, Tinaja termal familiar, Sala de Cine, área de juegos, biblioteca además de todo lo necesario para compartir juntos y relajarse. Se Arrienda Casa amplia además de cabaña Tiny House, pudiendo ofrecer 5 dormitorios, 4 baños, cocina equipada, área para asados, entre otros.


Tiene amplios espacios, unos 120 metros cuadrados habitables, un patio con parrilla para asados, amplio estacionamiento hasta 5 vehículos.
Casa con sistema de seguridad y portón de acceso electrónico.
Ubicada a 8 kilometros de la playa el Faro y a 4 kilometros del Centro de La Serena. Cuenta con Wifi 200 Mb/seg de bajada y subida.
Piscina Privada para uso Familiar, con área de niños y de adultos.
Tinaja Termal Familiar temperada, para disfrutar en las tarde y Noches.
Sala de Cine equipada con butacas, Audio y Video de ultima generación.
Área de Juegos como Taca taca, cama saltarina, Mini Tenis de mesa, entre otros.",['Vista al patio'],4.67,27,Edu,04-2016,https://www.airbnb.cl/rooms/16410192?adults=1&children=0&infants=0&pets=0&check_in=2023-03-01&check_out=2023-03-08&previous_page_section_name=1000&federated_search_id=67f159fc-b383-451f-81fb-7447c879c942
12,Casa con vista al mar y a 3 min a pie de la playa.,Alojamiento entero,Huentaleuquen,Región de Coquimbo,11,9,4, Habitación,3,privado,250.0,-31.53339,-71.56986,"https://maps.google.com/maps?ll=-31.53339,-71.56986&z=14&t=m&hl=es&gl=CL&mapclient=apiv3",,"Casa con preciosa vista y a menos de 3 minutos caminando de la playa.
Tiene 4 dormitorios y 3 baños. Dos de las piezas son matrimoniales con baño.
El arriendo incluye sábanas, plumones, cubreplumones en todas las camas, un estanque de agua.
Cuenta con arenero con juguetes para niños.


- Se incluyen 5.000 litros de agua, debería durar 1 semana, se puede comprar más agua de ser necesario. 
- Se incluye 1 bidón de 20 litros de agua, se puede comprar más agua de ser necesario.
- No incluye toallas","['Acceso a la playa', 'Frente a la playa']",4.75,12,Tomas,08-2016,https://www.airbnb.cl/rooms/29946283?adults=1&children=0&infants=0&pets=0&check_in=2023-06-01&check_out=2023-06-08&previous_page_section_name=1000&federated_search_id=67f159fc-b383-451f-81fb-7447c879c942
13,Cabaña a orilla de la playa,Cabaña entero,La Higuera,Coquimbo Region,7,8,3, Habitación,1,privado,185.0,-29.20807,-71.48149,"https://maps.google.com/maps?ll=-29.20807,-71.48149&z=14&t=m&hl=es&gl=CL&mapclient=apiv3",,"La cabaña esta ubicada a la orilla de la Playa La Ventana junto a otras 4 cabañas en una tranquila playa de arena blanca y mar calipso.Una de las grandes ventajas de este lugar es apto para hacer surf y sandboard, y se pueden alquilan trajes de agua y tablas, y también dan clases. Se recomiendan otras actividades en pequeños pueblos cercanos, como avistamiento de pinguinos, delfines y ballenas.


Es una cabaña muy acojedora, comoda, con todo lo necesario para disfrutar de un lindo y tranquilo paisaje nortino en vacaciones.","['Acceso a la playa', 'Frente a la playa']",5.0,13,Chabela,09-2017,https://www.airbnb.cl/rooms/20759316?adults=1&children=0&infants=0&pets=0&check_in=2023-03-01&check_out=2023-03-06&previous_page_section_name=1000&federated_search_id=67f159fc-b383-451f-81fb-7447c879c942
14,Cabaña familiar para 8 personas,Cabaña entero,Monte Patria,Coquimbo,8,7,4, Habitación,3,privado,150.0,-30.8814,-70.7733,"https://maps.google.com/maps?ll=-30.8814,-70.7733&z=14&t=m&hl=es&gl=CL&mapclient=apiv3",,Relájate con toda la familia en este tranquilo lugar para quedarse.,['Vista al complejo turístico'],,,Carlos,01-2022,https://www.airbnb.cl/rooms/721011734361929966?adults=1&children=0&infants=0&pets=0&check_in=2023-03-01&check_out=2023-03-06&previous_page_section_name=1000&federated_search_id=67f159fc-b383-451f-81fb-7447c879c942
15,Hermoso departamento. Avda. peñuelas a pasos enjoy,Alojamiento entero,Coquimbo,Chile,5,6,3, Habitación,1,privado,40.411,-29.94843,-71.2883,"https://maps.google.com/maps?ll=-29.94843,-71.2883&z=14&t=m&hl=es&gl=CL&mapclient=apiv3",,"Hermoso departamento a minutos de la playa y con una excelente conectividad para unas merecidas vacaciones! 

Departamento posicionado en el piso 6, con malla de protección. Completamente equipado para 5 personas en avda. Peñuelas, a pasos de la playa y Enjoy Coquimbo. Cuenta con estacionamiento exclusivo del departamento. El edificio cuenta con piscina, quincho y sala de lavado.

Se aceptan mascotas pequeñas.


El departamento está completamente equipado, con todo lo principal para su estadía.",['Acceso la playa Público o compartido'],4.75,4,Nattia,05-2022,https://www.airbnb.cl/rooms/734034954354310299?adults=1&children=0&infants=0&pets=0&check_in=2023-03-20&check_out=2023-03-25&previous_page_section_name=1000&federated_search_id=67f159fc-b383-451f-81fb-7447c879c942
16,"Linda casa equipada, cerca de todo. Puerta del mar",Alojamiento entero,La Serena,Región de Coquimbo,8,7,3, Habitación,2,privado,62.0,-29.90098,-71.26527,"https://maps.google.com/maps?ll=-29.90098,-71.26527&z=14&t=m&hl=es&gl=CL&mapclient=apiv3",,"Acogedora y confortable casa, la mejor ubicación, a pasos del Faro monumental, playa y centro de la ciudad.
Cuenta con todo lo necesario para una gran estadía. 
Amplio patio con quincho y  terraza. Entrada de auto para 1 vehículo, también es posible estacionar fuera de la casa.
*No está permitido hacer fiestas ni ruidos molestos durante la noche, se trata de un barrio residencial muy tranquilo en donde los vecinos resguardan su descanso y sana convivencia.
*No se permiten mascotas.


Linda y cómoda casa equipada para familia o grupo de amigos.
7 camas y 2 baños. Lindo patio y terraza con quincho.
Invita al descanso y a recorrer nuestra hermosa región. 
Ubicada en barrio seguro  y tranquilo muy cerca de la playa, servicios y todos los atractivos de la ciudad.",['Vista al patio'],4.87,70,Verena,01-2018,https://www.airbnb.cl/rooms/22716470?adults=1&children=0&infants=0&pets=0&check_in=2023-03-06&check_out=2023-03-12&previous_page_section_name=1000&federated_search_id=67f159fc-b383-451f-81fb-7447c879c942
17,"Arena y mar, descansa sereno!",Alojamiento entero,Elqui,Coquimbo,8,4,3, Habitación,2,privado,76.166,-29.88252,-71.27285,"https://maps.google.com/maps?ll=-29.88252,-71.27285&z=14&t=m&hl=es&gl=CL&mapclient=apiv3",,"Relájate en esta escapada única y tranquila. A pasos de la playa, con extensas áreas para disfrutar y caminar por la arena mientras el mar moja tus pies. Contamos con todas las comodidades para un excelente descanso, área de comedor al aire libre, escuchar los cantos de los canarios y otras aves. Piscina para los hij@s, area de juegos para ellos. Mini granja educativa para los hijos si quieren aprender más de conejos, gallinas, patos, entre otros. Y muchas más experiencias para ti y tu familia.",['Vista al patio'],,,Edu,04-2016,https://www.airbnb.cl/rooms/792166177114481279?adults=1&children=0&infants=0&pets=0&check_in=2023-03-01&check_out=2023-03-06&previous_page_section_name=1000&federated_search_id=67f159fc-b383-451f-81fb-7447c879c942
18,Acogedora casa en Guanaqueros para 8 personas,Alojamiento entero,Guanaqueros,Región de Coquimbo,8,8,5, Habitación,2,privado,100.0,-30.19924,-71.42095,"https://maps.google.com/maps?ll=-30.19924,-71.42095&z=14&t=m&hl=es&gl=CL&mapclient=apiv3",,"Completamente amoblada, televisión satelital disponible, a pasos de la playa y del centro comercial de guanaqueros",['Cocina'],4.88,9,Orlando,04-2015,https://www.airbnb.cl/rooms/23269344?adults=1&children=0&infants=0&pets=0&check_in=2023-03-04&check_out=2023-03-09&previous_page_section_name=1000&federated_search_id=149dfbb9-27c2-4648-b320-0ff5781bf201
19,Linda casa sector Don Guillermo,Alojamiento entero,La Serena,Coquimbo,5,3,3, Habitación,"2,5",privado,45.0,-29.93412,-71.2372,"https://maps.google.com/maps?ll=-29.93412,-71.2372&z=14&t=m&hl=es&gl=CL&mapclient=apiv3",,"Linda casa ubicada en sector San Joaquín villa Don Guillermo en La Serena.  Cuenta con estacionamiento, tres dormitorios una sala de estar con futón 2.5 baños cocina equipada, terraza.  Cercana a supermercados, restaurantes, banco, gimnasio, bar, pastelería. cercana a estación de buses y aeropuerto solo a 15 minutos en vehículo.",['Cocina'],,,Paula,01-2022,https://www.airbnb.cl/rooms/594838015002955806?adults=1&children=0&infants=0&pets=0&check_in=2023-03-09&check_out=2023-03-14&previous_page_section_name=1000&federated_search_id=149dfbb9-27c2-4648-b320-0ff5781bf201
20,Cabaña playera en Tongoy,Alojamiento entero,Tongoy,Coquimbo,10,7,4, Habitación,"2,5",privado,135.0,-30.26255,-71.48599,"https://maps.google.com/maps?ll=-30.26255,-71.48599&z=14&t=m&hl=es&gl=CL&mapclient=apiv3",,"Crea recuerdos inolvidables en este alojamiento único ideal para familias. Espacios amplios donde podrán disfrutar en pérgolas para almorzar al aire libre, también los niños podrán jugar en el sector de juegos, además cuenta con áreas verdes  con hamacas que son ideales para descansar, también cuenta con fogones donde podrán pasar noches inolvidables bajo mil estrellas y con una preciosa vista a la península de Tongoy donde podrán apreciar los mejores atardecer que allan visto.


Es una cabaña amplia, acogedora con distintos espacios sectorizados tanto para niños como para adultos, podrán disfrutar de la tranquilidad de Tongoy",['Vista a la playa'],,,Nathaly,12-2022,https://www.airbnb.cl/rooms/788753507091002307?adults=1&children=0&infants=0&pets=0&check_in=2023-03-01&check_out=2023-03-08&previous_page_section_name=1000&federated_search_id=149dfbb9-27c2-4648-b320-0ff5781bf201
