,Titulo1,Titulo2,Comuna,Region,Capacidad,Camas,N_Habitaciones,Habitaciones,Baños,Tipo_Baños,Precio,lat,lon,Ubicacion,Ubides,Descripcion,Servicios,Nota,Nnota,Anfitrion,Registro,Link
0,Casa con piscina en Cond Agua Dulce Huentelauquén,Alojamiento entero,Angostura,Coquimbo,8,5,3, Habitación,2,privado,180.0,-31.5149,-71.5605,"https://maps.google.com/maps?ll=-31.5149,-71.5605&z=14&t=m&hl=es&gl=CL&mapclient=apiv3",,"Casa Nueva, recién construida en Condominio Agua Dulce. El condominio tiene acceso controlado, seguridad permanente y acceso directo a la playa, cuenta con 5 canchas de tenis , 3 canchas de futbolito, caleta de pescadores, juegos para niños y senderos para trekking sin costo extra. 

La casa tiene una hermosa vista a toda la bahía y una piscina de 8 x 4 mts, muy amplia para toda la familia.


La vista al mar es increible, todo el frente de la casa es vidreado, por ende la vista es completa y despejada al mar. El condominio cuenta con caminos con maicillo compactado, ideal para salir a correr, andar en bicicleta o caminar.",['Cocina'],5.0,5,Rodrigo,06-2016,https://www.airbnb.cl/rooms/804957401975945423?adults=1&children=0&infants=0&pets=0&check_in=2023-03-05&check_out=2023-03-12&previous_page_section_name=1000&federated_search_id=eb768f31-41de-4c67-94ac-1494ae4199db
1,Casa en Condominio Agua Dulce Huentelauquen,Villa entero,Angostura,Coquimbo,6,4,3, Habitación,3,privado,220.0,-31.52223,-71.55345,"https://maps.google.com/maps?ll=-31.52223,-71.55345&z=14&t=m&hl=es&gl=CL&mapclient=apiv3",,"CASA QUEBRADA. Nature and reconnection!
A special place to spend time with love ones, relax, chill and explore. Our Villa combines a stunning spot at the edge of a cliff with full sea view. The deco is stylish and charming with art on every single room!

El espacio
A house at the edge of a cliff with perfect sea view and amazing nature surrounding the house. Our place is nicely decorated with art in every room. A large terrace with an outdoor jacuzzi plus a bbq area make it perfect for a family holiday","['Acceso a playa Privado', 'Frente a la playa']",4.78,18,Maria,02-2014,https://www.airbnb.cl/rooms/50591250?adults=1&children=0&infants=0&pets=0&check_in=2023-03-13&check_out=2023-03-20&previous_page_section_name=1000&federated_search_id=eb768f31-41de-4c67-94ac-1494ae4199db
2,Refugio totoralillo,Cabaña entero,Coquimbo,Región de Coquimbo,4,3,2, Habitación,1,privado,45.0,-30.04439,-71.37747,"https://maps.google.com/maps?ll=-30.04439,-71.37747&z=14&t=m&hl=es&gl=CL&mapclient=apiv3",,"El espacio
Es una cabaña

Acceso de los huéspedes
Fácil acceso kilometro 450.5 , a 10 minutos de supermercados y el centro de coquimbo a 5 minutos en auto a la playa totoralillo caminando 30 minutos, locomoción a una cuadra de la cabaña, la cual esta emplazada en un terreno de 1000 mts cuadrados totalmente cerrado, al costado una casa independiente y otra cábaña .","['Acceso a la playa', 'Frente a la playa']",4.82,24,Elizabeth,01-2018,https://www.airbnb.cl/rooms/31073555?adults=1&children=0&infants=0&pets=0&check_in=2023-03-01&check_out=2023-03-06&previous_page_section_name=1000&federated_search_id=eb768f31-41de-4c67-94ac-1494ae4199db
3,"Cabaña con gran Patio, cerca de la Iglesia.",Cabaña entero,Pichidangui,Coquimbo Region,6,5,3, Habitación,"1,5",privado,65.0,-32.14137,-71.53083,"https://maps.google.com/maps?ll=-32.14137,-71.53083&z=14&t=m&hl=es&gl=CL&mapclient=apiv3",,"Lugares de interés: A 600 m de la Playa, la cual cuenta con 4,5 Km, Ruta del Cuarzo, Buenos Restaurantes, en Zona Segura de Tsunami. Muy familiar y tranquilo, ideal parejas, deportistas de mar y viento, buceo, Windsurf, Body Board, Trekking, natación y Bike.

El espacio
Cabaña muy acogedora para disfrutar un balneario muy tranquilo. El patio es de maicillo y tiene un sector con arena para que disfruten los niños. También cuenta con columpio y balancín y un amplio Quincho con baño y Frigobar.","['Acceso a playa Público o compartido', 'Frente a la playa']",4.56,41,Cristián,08-2016,https://www.airbnb.cl/rooms/17071960?adults=1&children=0&infants=0&pets=0&check_in=2023-03-05&check_out=2023-03-10&previous_page_section_name=1000&federated_search_id=eb768f31-41de-4c67-94ac-1494ae4199db
4,Lodge Roca Tongoy,Villa entero,Tongoy,Coquimbo Region,5,4,2, Habitación,"2,5",privado,108.0,-30.24943,-71.50175,"https://maps.google.com/maps?ll=-30.24943,-71.50175&z=14&t=m&hl=es&gl=CL&mapclient=apiv3",,"Una casa de playa super cómoda y de estilo único, ideal para relajarse y desconectarse de todo. Espectacularvista al mar, jardines y espacios para descansar y mirar el mar. Mobiliario sencillo y confortable. A cuatro cuadras de la playa Socos.

El espacio
Casa principal equipada para 5 personas cómodamente. Dormitorio en suite, dormitorio secundario y estar en segundo piso, cocina comedor y living pequeño, grandes terrazas.",['Acceso la playa Público o compartido'],4.44,16,Carmina,02-2018,https://www.airbnb.cl/rooms/39665418?adults=1&children=0&infants=0&pets=0&check_in=2023-03-01&check_out=2023-03-06&previous_page_section_name=1000&federated_search_id=eb768f31-41de-4c67-94ac-1494ae4199db
5,Linda CASA a pasos de la playa de Morrillos!,Alojamiento entero,Coquimbo,Región de Coquimbo,11,9,5, Habitación,3,privado,320.0,-30.12626,-71.36985,"https://maps.google.com/maps?ll=-30.12626,-71.36985&z=14&t=m&hl=es&gl=CL&mapclient=apiv3",,"Condominio privado. La casa está totalmente equipada para 11 personas. Muy acogedora, luminosa y bien distribuida, dos piezas matrimoniales en suite con TV. Cocina americana integrada al living, terraza techada, parrilla, columpios y juegos para niños. Está a 4 min. caminando de la playa (morrillos) y a 15 minutos en auto de Coquimbo  y a 5 minutos de Guanaqueros. Cerca de la casa hay un Humedal con aves de la zona, puedes ir caminando.


El lugar es muy tranquilo, ideal para descansar, hacer deportes al aire libre y gozar de los beneficios del mar, la playa y la naturaleza.
Los niños tienen un espacio ideal para juegos en el patio, con resbalín, columpios, foso de arena etc.",['Cocina'],5.0,31,Magdalena,11-2019,https://www.airbnb.cl/rooms/39948875?adults=1&children=0&infants=0&pets=0&check_in=2023-03-06&check_out=2023-03-11&previous_page_section_name=1000&federated_search_id=eb768f31-41de-4c67-94ac-1494ae4199db
6,Pichidangui Comoda Casa Vista al Mar Full Equipada,Casa de campo entero,Pichidangui,Coquimbo,10,8,4, Habitación,"2,5",privado,150.0,-32.1426,-71.53186,"https://maps.google.com/maps?ll=-32.1426,-71.53186&z=14&t=m&hl=es&gl=CL&mapclient=apiv3",,"Ven a relajarte y disfrutar de Pichidangui, a solo dos horas de Santiago, bellas postales, excelente vistas, playas tranquilas ideales para niños, rica gastronomia, todo lo que necesitas para compartir y disfrutar de momentos especiales",['Acceso a la playa'],5.0,14,Boris,01-2017,https://www.airbnb.cl/rooms/53997733?adults=1&children=0&infants=0&pets=0&check_in=2023-03-01&check_out=2023-03-06&previous_page_section_name=1000&federated_search_id=eb768f31-41de-4c67-94ac-1494ae4199db
7,arriendo cabaña cerca de playa en cuarta región,Cabaña entero,Coquimbo,Chile,4,3,2, Habitación,1,privado,45.0,-30.22089,-71.40419,"https://maps.google.com/maps?ll=-30.22089,-71.40419&z=14&t=m&hl=es&gl=CL&mapclient=apiv3",,"CABAÑA🏠NUEVA EN GUANAQUEROS! Relájate con toda la familia en este alojamiento donde la tranquilidad se respira.
a minutos de la playa de guanaqueros. 
Cabaña segura con protecciones en sus ventanas y puertas.
se aceptan mascotas.
cuenta con sofá cama para otro integrante, si así lo requiere.",['Acceso a la playa'],,,Jocelyn,01-2023,https://www.airbnb.cl/rooms/806728567905802608?adults=1&children=0&infants=0&pets=0&check_in=2023-03-01&check_out=2023-03-06&previous_page_section_name=1000&federated_search_id=eb768f31-41de-4c67-94ac-1494ae4199db
8,"Increíble casa con vista al mar, pasos de la playa",Alojamiento entero,Coquimbo,Chile,8,7,3, Habitación,3,privado,230.0,-30.12514,-71.36978,"https://maps.google.com/maps?ll=-30.12514,-71.36978&z=14&t=m&hl=es&gl=CL&mapclient=apiv3",,"Increíble casa con espectacular vista al mar ubicada en segunda linea en condominio privado, a pasos de la playa ( 150 mts, 2 minutos caminando).

La casa tiene 3D y 3B (1 en suit) cocina americana full equipada , living, comedor, terraza, logia con lavadora y secadora y patio de servicio. Con una capacidad de 8 personas.

Condominio cuenta con seguridad las 24 hrs con nochero y portero permanente.

Ubicado a 15 minutos de Guanaqueros y Coquimbo


Casa nueva de hormigón, un piso (120m2 cubiertos) en parcela 5000 m2 . La propiedad tiene 3D, 3B (1 en suit) , cocina americana, living comedor, logia, patio de servicio, terraza de 50 m2 semi sombra, estacionamiento para 2 vehículos.
Actividades recreativas; playa, pesca, buceo, paseos en playa y laguna, naturaleza, descanso, avistamiento de aves
Condominio cuenta con seguridad las 24 hrs con portero y nochero permanentes","['Acceso a la playa', 'Frente a la playa']",5.0,10,Paula,02-2018,https://www.airbnb.cl/rooms/47451687?adults=1&children=0&infants=0&pets=0&check_in=2023-03-01&check_out=2023-03-06&previous_page_section_name=1000&federated_search_id=eb768f31-41de-4c67-94ac-1494ae4199db
9,tongoy cabaña para 5 personas frente al mar,Casa adosada entero,La Serena,Región de Coquimbo,5,4,2, Habitación,2,privado,60.0,-30.25065,-71.50568,"https://maps.google.com/maps?ll=-30.25065,-71.50568&z=14&t=m&hl=es&gl=CL&mapclient=apiv3",,"Lugares de interés: restaurantes y comida, la playa y actividades en familia. Te va a encantar mi lugar debido a las vistas, la ubicación y el ambiente. Mi alojamiento es bueno para parejas, aventureros, familias (con hijos), grupos grandes y mascotas.",['Cocina'],4.38,65,Nils,06-2016,https://www.airbnb.cl/rooms/13376313?adults=1&children=0&infants=0&pets=0&check_in=2023-03-13&check_out=2023-03-18&previous_page_section_name=1000&federated_search_id=eb768f31-41de-4c67-94ac-1494ae4199db
10,Casa Pura Vida,Alojamiento entero,Coquimbo,Chile,8,7,4, Habitación,2,privado,250.0,-30.11964,-71.37076,"https://maps.google.com/maps?ll=-30.11964,-71.37076&z=14&t=m&hl=es&gl=CL&mapclient=apiv3",,"Increíble casa a pasos de la playa, a 5 minutos caminando, en condominio con seguridad las 24 hrs .
La casa está equipada para 8 personas. Con cuatro habitaciones (principal en suite), cocina americana , terraza techada, parrilla, fogón, piscina , lavadora y secadora. Estacionamiento para 3 autos.
Posee hermosa vista al humedal de Lagunillas.
Desde la casa se accede a pie a la playa de Morrillos, ideal para disfrutar en familia.
La casa se encuentra a 15 min. de Coquimbo, 5 de Guanaqueros","['Acceso a playa Privado', 'Frente a la playa']",,,Alejandro,10-2015,https://www.airbnb.cl/rooms/654463460682826141?adults=1&children=0&infants=0&pets=0&check_in=2023-03-01&check_out=2023-03-06&previous_page_section_name=1000&federated_search_id=eb768f31-41de-4c67-94ac-1494ae4199db
11,Casa amplia y cómoda en Pichidangui Wifi,Alojamiento entero,Pichidangui,Coquimbo Region,8,7,3, Habitación,2,privado,75.0,-32.14103,-71.52076,"https://maps.google.com/maps?ll=-32.14103,-71.52076&z=14&t=m&hl=es&gl=CL&mapclient=apiv3",,"Alojamiento es bueno para aventureros, viajeros de negocios, y familias (con hijos). Cuenta con internet Wi-Fi permanente y televisión por cable.
Además de las tres habitaciones, cuenta con una altillo con colchón de plaza y media, ideal para niños. Closets  pintados de color blanco para tener claridad sobre limpieza. Cuenta con lavadora, secadora y agradable terraza con un mini muro de escalda con colchoneton.
En fiestas patrias el arriendo es solo para familias, por mala experiencia anterior.


Amplio espacio, cerca de la playa y de comercio...","['Acceso a la playa', 'Frente a la playa']",4.62,29,Rodrigo,02-2017,https://www.airbnb.cl/rooms/17545782?adults=1&children=0&infants=0&pets=0&check_in=2023-03-01&check_out=2023-03-06&previous_page_section_name=1000&federated_search_id=eb768f31-41de-4c67-94ac-1494ae4199db
12,"Nueva e increíble casa en Morrillos, pasos del mar",Casa de campo entero,La Hacienda,Coquimbo,11,9,4, Habitación,4,privado,350.0,-30.12608,-71.36676,"https://maps.google.com/maps?ll=-30.12608,-71.36676&z=14&t=m&hl=es&gl=CL&mapclient=apiv3",,"Increíble casa ubicada en condominio privado en una de las mejores playas de Chile (Morrillos). 

Muy espaciosa y moderna, se encuentra a pasos de la playa (350 mts, 5 min caminando) y de humedal.

200 mts2: 4D y 4B (3 en suit), cocina full equipada, living, comedor, gran terraza, salita con TV, logia con lavadora y secadora, patio de servicio y escritorio para teletrabajo.

Capacidad: 11 personas.

Condominio con seguridad las 24 hrs, con nochero y portero permanente.

A 15 minutos de Coquimbo.","['Acceso a playa Privado', 'Frente a la playa']",5.0,6,Rodrigo,05-2014,https://www.airbnb.cl/rooms/541458323912047277?adults=1&children=0&infants=0&pets=0&check_in=2023-03-01&check_out=2023-03-06&previous_page_section_name=1000&federated_search_id=eb768f31-41de-4c67-94ac-1494ae4199db
13,Agradable cabaña para descansar en Guanaqueros,Cabaña entero,Guanaquero,Coquimbo,6,5,2, Habitación,"1,5",privado,75.0,-30.20131,-71.41641,"https://maps.google.com/maps?ll=-30.20131,-71.41641&z=14&t=m&hl=es&gl=CL&mapclient=apiv3",,"Espacio de relajo para disfrutar con toda la familia de unas lindas vacaciones, fines de semanas u ocasiones especiales. A 3 minutos de la playa 🏖

Acceso de los huéspedes
La cabaña cuenta con estacionamiento privado.",['Acceso la playa Público o compartido'],4.33,3,Catalina Antonia,01-2022,https://www.airbnb.cl/rooms/729910417724580308?adults=1&children=0&infants=0&pets=0&check_in=2023-03-01&check_out=2023-03-08&previous_page_section_name=1000&federated_search_id=eb768f31-41de-4c67-94ac-1494ae4199db
14,"Glamping descanso y vacación Familiar, La Serena",Alojamiento entero,La Serena,Región de Coquimbo,Más de 16,13,5, Habitación,4,privado,108.877,-29.89005,-71.21986,"https://maps.google.com/maps?ll=-29.89005,-71.21986&z=14&t=m&hl=es&gl=CL&mapclient=apiv3",,"""Ven a vivir la experiencia Glamping con nosotros"" Glamping es un nuevo concepto de vacaciones, le brindamos comodidades para que los huéspedes puedan vivir bellos momentos familiares. Pueden compartir Piscina solo para ellos, Tinaja termal familiar, Sala de Cine, área de juegos, biblioteca además de todo lo necesario para compartir juntos y relajarse. Se Arrienda Casa amplia además de cabaña Tiny House, pudiendo ofrecer 5 dormitorios, 4 baños, cocina equipada, área para asados, entre otros.


Tiene amplios espacios, unos 120 metros cuadrados habitables, un patio con parrilla para asados, amplio estacionamiento hasta 5 vehículos.
Casa con sistema de seguridad y portón de acceso electrónico.
Ubicada a 8 kilometros de la playa el Faro y a 4 kilometros del Centro de La Serena. Cuenta con Wifi 200 Mb/seg de bajada y subida.
Piscina Privada para uso Familiar, con área de niños y de adultos.
Tinaja Termal Familiar temperada, para disfrutar en las tarde y Noches.
Sala de Cine equipada con butacas, Audio y Video de ultima generación.
Área de Juegos como Taca taca, cama saltarina, Mini Tenis de mesa, entre otros.",['Accesos de entrada y salida a pistas de esquí'],4.67,27,Edu,04-2016,https://www.airbnb.cl/rooms/16410192?adults=1&children=0&infants=0&pets=0&check_in=2023-03-01&check_out=2023-03-08&previous_page_section_name=1000&federated_search_id=eb768f31-41de-4c67-94ac-1494ae4199db
15,Hermosa Casa en los Guayacanes de Guanaqueros,Alojamiento entero,Coquimbo,Chile,6,4,3, Habitación,1,privado,60.0,-30.22662,-71.40393,"https://maps.google.com/maps?ll=-30.22662,-71.40393&z=14&t=m&hl=es&gl=CL&mapclient=apiv3",,"Relájate con toda la familia en este tranquilo lugar y sus playas cercanas.
La ubicación es en los guayacanes de guanaqueros.
Tongoy y guanaqueros tienen hermosos atardeceres, gastronomía, playas tranquilas, paseos por las bahías, etc. especial para desconectarse. Contamos con amplios espacios, cámaras de seguridad exterior, quincho, portón eléctrico, 1 televisor c/cable, TNT Prem, wifi, panderetas para privacidad, a 5 min. en auto a playa de guanaqueros 10 minutos de tongoy y puerto velero.


Casa de 65 mts2 app grandes habitaciones para el mejor descanso, amplio baño",['Cocina'],5.0,4,Mario,09-2019,https://www.airbnb.cl/rooms/786704805920166398?adults=1&children=0&infants=0&pets=0&check_in=2023-03-01&check_out=2023-03-06&previous_page_section_name=1000&federated_search_id=eb768f31-41de-4c67-94ac-1494ae4199db
16,Arriendo casa La Serena,Alojamiento entero,La Serena,Coquimbo,5,4,2, Habitación,1,privado,42.0,-29.9253,-71.20003,"https://maps.google.com/maps?ll=-29.9253,-71.20003&z=14&t=m&hl=es&gl=CL&mapclient=apiv3",,"Relájate con toda la familia en este tranquilo lugar para quedarse.

A pasos del aeropuerto y conexión con la ruta D-41 (Valle de Elqui) 
A 15 minutos de la playa 
A 10 minutos del centro de la serena 
Cercano a supermercados 
Condominio con seguridad las 24 horas del día 
Estacionamiento 
Se admiten mascotas 
Wifi 
De 4 - 6 huéspedes",['Cocina'],4.88,8,Andrea,08-2021,https://www.airbnb.cl/rooms/800562692632385338?adults=1&children=0&infants=0&pets=0&check_in=2023-03-01&check_out=2023-03-06&previous_page_section_name=1000&federated_search_id=eb768f31-41de-4c67-94ac-1494ae4199db
17,"Casa del Valle, Lugar soñado.",Casa de campo entero,La Serena,Coquimbo,12,9,4, Habitación,4,privado,263.333,-29.92458,-71.21694,"https://maps.google.com/maps?ll=-29.92458,-71.21694&z=14&t=m&hl=es&gl=CL&mapclient=apiv3",,"Lugar de relajación, donde el Sol brillará desde la mañana. Está preparada para un grupo de 12 a 14 personas, completamente equipada, con hermosas y amplias áreas verdes, gran Piscina, Gimnasio, Quincho y horno de barro, mesa de ping pong, Taca Taca, tina de madera de agua caliente a leña, 4 dormitorios, 4baños, Wi-Fi, hermosas y acogedores espacios,  ideal para venir en familias  a relajarse y llenarse de energía del Valle del Elqui. Ubicada en dirección a Vicuña a 15 min del centro de Serena.",['Cocina'],5.0,6,Víctor,12-2022,https://www.airbnb.cl/rooms/787658634284634599?adults=1&children=0&infants=0&pets=0&check_in=2023-03-01&check_out=2023-03-07&previous_page_section_name=1000&federated_search_id=eb768f31-41de-4c67-94ac-1494ae4199db
18,"cabañas Kuruflafken, Los Vilos",Cabaña entero,Los Vilos,Coquimbo,4,4,2, Habitación,2,privado,60.0,-31.9139,-71.5012,"https://maps.google.com/maps?ll=-31.9139,-71.5012&z=14&t=m&hl=es&gl=CL&mapclient=apiv3",,"nos encontramos ubicados en turismo norte, barrio tranquilo y considerado casco histórico de la ciudad de los vilos, zona totalmente segura ante tsunami, a 4 cuadras de la playa principal, a 2 cuadras de supermercados, centros médicos, terminal de buses, locomoción colectiva, complejo deportivo , nuestras cabañas son totalmente equipadas, con quincho, estacionamiento seguro y piscina, contamos con medidas de seguridad   y para que estés tranquilo ACEPTAMOS TU MASCOTA ya que amamos los animales.",['Acceso la playa Público o compartido'],5.0,6,Ignacio,12-2022,https://www.airbnb.cl/rooms/774020203252849354?adults=1&children=0&infants=0&pets=0&check_in=2023-03-01&check_out=2023-03-06&previous_page_section_name=1000&federated_search_id=a9fd0f85-f2e5-4c84-851b-e056feeeabe9
19,"Ensenada km 213, Sector Pichidangui",Alojamiento entero,Pichidangui,Coquimbo Region,10,7,4, Habitación,3,privado,170.0,-32.11055,-71.52166,"https://maps.google.com/maps?ll=-32.11055,-71.52166&z=14&t=m&hl=es&gl=CL&mapclient=apiv3",,"Casa amplia, cómoda,  estilo mediterráneo, sólida, bien mantenida y decorada, full equipada. Ubicada en Condominio Ensenada, en el Km 213, el cual tiene playa privada de arenas blancas, quitasoles de totora y juegos para niños.

El espacio
Tiene 4 dormitorios, 2 de estos con cama Matrimonial, un tercero individual , y el cuarto con acceso independiente el cual tiene 2 camas individuales. Además hay un sofá cama en el living y una cama pequeña de niños en la habitación 2.
Está muy cerca de la playa, para ir caminando. 
Condominio muy tranquilo, seguro y de buen nivel.",['Vista al océano'],,,Francisco,08-2015,https://www.airbnb.cl/rooms/10474743?adults=1&children=0&infants=0&pets=0&check_in=2023-03-01&check_out=2023-03-06&previous_page_section_name=1000&federated_search_id=a9fd0f85-f2e5-4c84-851b-e056feeeabe9
20,Casa granero en Playa Grande Tongoy,Cabaña entero,Tongoy,Coquimbo,6,5,3, Habitación,"1,5",privado,150.0,-30.2946,-71.5367,"https://maps.google.com/maps?ll=-30.2946,-71.5367&z=14&t=m&hl=es&gl=CL&mapclient=apiv3",,"Esta casa, ha sido especialmente diseñada  para disfrutar del entorno natural. Para experimentar la puesta de sol desde su terraza en la azotea. Un lugar que evoca las antiguas casas de campo, combinadas con productos contemporáneos.

Acceso de los huéspedes
Los huéspedes podrán acceder al espacio completo de la casa, al gran jardín y a las instalaciones exteriores. Los huéspedes también pueden llegar al humedal en un par de minutos o caminar a la hermosa playa a solo 15 minutos de la casa","['Acceso a playa Público o compartido', 'Frente a la playa']",5.0,3,Jorge,05-2015,https://www.airbnb.cl/rooms/665518914328051294?adults=1&children=0&infants=0&pets=0&check_in=2023-03-01&check_out=2023-03-06&previous_page_section_name=1000&federated_search_id=a9fd0f85-f2e5-4c84-851b-e056feeeabe9
21,Casa con vista al mar a pasos de la playa,Alojamiento entero,Coquimbo,Chile,8,7,3, Habitación,3,privado,230.0,-30.12522,-71.37006,"https://maps.google.com/maps?ll=-30.12522,-71.37006&z=14&t=m&hl=es&gl=CL&mapclient=apiv3",,"Increíble casa con espectacular vista al mar ubicada en segunda linea en condominio privado, a pasos de la playa ( 150 mts, 2 minutos caminando).

La casa tiene 3D  y 3B (1 en suit) cocina americana full equipada , living, comedor, terraza, logia con lavadora y secadora y patio de servicio. Con una capacidad de 8 personas.

Condominio cuenta con seguridad las 24 hrs con nochero y portero permanente.

Ubicado a  15 minutos de Guanaqueros y Coquimbo.


Casa nueva de hormigón, un piso (120m2 cubiertos) en parcela 5000 m2 . La propiedad tiene 3D, 3B (1 en suit) , cocina americana, living comedor, logia, patio de servicio, terraza de 50 m2 semi sombra, estacionamiento para 2 vehículos.
Actividades recreativas; playa, pesca, buceo, paseos en playa y laguna, naturaleza,  descanso, avistamiento de aves
Condominio cuenta con seguridad las 24 hrs  con portero y nochero permanentes","['Acceso a la playa', 'Frente a la playa']",4.77,13,Paula,02-2018,https://www.airbnb.cl/rooms/47011248?adults=1&children=0&infants=0&pets=0&check_in=2023-03-01&check_out=2023-03-06&previous_page_section_name=1000&federated_search_id=a9fd0f85-f2e5-4c84-851b-e056feeeabe9
22,Cerca de avenida del mar y casino de coquimbo.,Alojamiento entero,Coquimbo,Chile,8,5,3, Habitación,2,privado,75.0,-29.9592,-71.296,"https://maps.google.com/maps?ll=-29.9592,-71.296&z=14&t=m&hl=es&gl=CL&mapclient=apiv3",,"Disfruta de la sencillez de este alojamiento tranquilo y céntrico hermosa casa muy cerca de la avenida del mar y casino  sector residencial peñuelas coquimbo consta con tres dormitorios, dos baños, patio, living, cocina, comedor, lavandería, estacionamiento, cable y wifi restaurante, y supermercado cerca.",['Cocina'],4.44,9,Johannie,10-2022,https://www.airbnb.cl/rooms/730332657090650902?adults=1&children=0&infants=0&pets=0&check_in=2023-03-01&check_out=2023-03-06&previous_page_section_name=1000&federated_search_id=a9fd0f85-f2e5-4c84-851b-e056feeeabe9
23,"Casa en La Serena, a 5 minutos de la Playa",Alojamiento entero,Coquimbo,Región de Coquimbo,7,5,4, Habitación,2,privado,55.0,-29.95962,-71.27181,"https://maps.google.com/maps?ll=-29.95962,-71.27181&z=14&t=m&hl=es&gl=CL&mapclient=apiv3",,"ubicación en calle principal  con acceso:  supermercados, centros  comerciales,  restaurantes, bencineras  y   vía estructurantes a la avenida del mar,  playas a 5 minutos . Te va a encantar mi espacio por ser un barrio muy  tranquilo, gran espacio de la vivienda, estacionamiento para 2 vehículos, ser  un espacio acogedor y muy iluminado . Mi alojamiento es bueno para parejas, aventureros, viajeros de negocios, y familias (con hijos).


Grato ambiente familiar, ubicado en barrio residencial consolidado con calles estructurales que dirigen directo a playas, casino y supermercados, almacén barrial.",['Cocina'],5.0,18,Eduardo,12-2016,https://www.airbnb.cl/rooms/18387323?adults=1&children=0&infants=0&pets=0&check_in=2023-03-01&check_out=2023-03-06&previous_page_section_name=1000&federated_search_id=a9fd0f85-f2e5-4c84-851b-e056feeeabe9
24,"PUNTA DE CHOROS Estupenda casa, maravillosa vista",Alojamiento entero,Punta de Choros,La Higuera,8,7,3, Habitación,3,privado,350.0,-29.2559,-71.4556,"https://maps.google.com/maps?ll=-29.2559,-71.4556&z=14&t=m&hl=es&gl=CL&mapclient=apiv3",,Crea recuerdos inolvidables en este alojamiento único y familiar. Tendras una experiencia unica en este lugar localizado en la reserva natural de Humboldt,"['Acceso a la playa', 'Frente a la playa']",5.0,6,Isabel,09-2017,https://www.airbnb.cl/rooms/562982356188294762?adults=1&children=0&infants=0&pets=0&check_in=2023-05-01&check_out=2023-05-07&previous_page_section_name=1000&federated_search_id=a9fd0f85-f2e5-4c84-851b-e056feeeabe9
