,Titulo1,Titulo2,Comuna,Region,Capacidad,Camas,N_Habitaciones,Habitaciones,Baños,Tipo_Baños,Precio,lat,lon,Ubicacion,Ubides,Descripcion,Servicios,Nota,Nnota,Anfitrion,Registro,Link
0,"Puerto Velero, 2 dorm, 2 baños, para 5 personas",Apartamento con servicios incluidos entero,Puerto Velero,Coquimbo,5,5,2, Habitación,2,privado,210.0,-30.24444,-71.47837,"https://maps.google.com/maps?ll=-30.24444,-71.47837&z=14&t=m&hl=es&gl=CL&mapclient=apiv3",,"Departamento full equipado para una increíble estadía. Muy bello y tranquilo Resort. Preciosa vista al mar.

Acceso a mas de 7 piscinas de agua dulce y 3 piscinas de mar. Senderos para caminata por la orilla de la playa, trekking o bicicleta. Hermosos jardines. Spa y gimnasio a 2 minutos, Canchas de tenis, Golf, Futbol, Quinchos para hacer asado. Cajero Automático del banco BCI, Restaurantes en la orilla de la playa, actividades semanalmente, dunas, etc.

Contactarme vía Celular o Whatsapp


Hermosa vista a la plata a 2 minutos del spa y gimnasio, son los nuevos departamentos que se construyeron en el corazón de puerto velero Incluye 2 estacionamientos. Palos de Gold incluidos, juegos de estrategia.",['Costa'],4.53,15,Lucas,12-2019,https://www.airbnb.cl/rooms/41060930?adults=1&children=0&infants=0&pets=0&check_in=2023-03-01&check_out=2023-03-07&previous_page_section_name=1000&federated_search_id=9893ab24-1566-4c73-8443-e4c2a41c86ed
1,Departamento La Serena frente a la playa y Enjoy,Apartamento con servicios incluidos entero,Coquimbo,Chile,6,5,3, Habitación,2,privado,100.0,-29.94517,-71.29044,"https://maps.google.com/maps?ll=-29.94517,-71.29044&z=14&t=m&hl=es&gl=CL&mapclient=apiv3",,"Frente al mar,  primera línea de la playa,  al lado del casino Enjoy. Vista directa al mar.
Edificio con todas las comodidades,  piscinas, gimnasio, lavandería, portería 24 horas, estacionamiento cubierto. A pocos pasos de los mejores restaurantes, minimarkets, ciclovía y a 20 minutos del aeropuerto de Coquimbo.
Departamento completamente equipado,  con 3 habitaciones,  para 6 personas. Cuenta con tv por cable, internet, cocina equipada, jacuzzi en alcoba principal, ropa de cama y toallas.


El departamento tiene 100m2, cuenta con 3 habitaciones, la alcoba principal es de gran tamaño, con jacuzzi. La segunda y tercera habitación cada una tiene dos camas plaza y media.  La terraza tiene vista directa al mar, con mesa y silla de comedor.","['Acceso a la playa', 'Frente a la playa']",4.74,46,Nohelia,09-2018,https://www.airbnb.cl/rooms/53121256?adults=1&children=0&infants=0&pets=0&check_in=2023-03-12&check_out=2023-03-17&previous_page_section_name=1000&federated_search_id=9893ab24-1566-4c73-8443-e4c2a41c86ed
2,"Casa mediterránea, piscina y vista a la cordillera",Casa particular,Diaguitas,Coquimbo,6,8,6, Habitación,2,privado,138.624,-30.01957,-70.83293,"https://maps.google.com/maps?ll=-30.01957,-70.83293&z=14&t=m&hl=es&gl=CL&mapclient=apiv3",,"Ven a vivir la tranquilidad insuperable Del Valle del Elqui. Terraza con vista a la cordillera, full open sky, de 200 m2 con piscina. 
Incluye sector de fogata. 
Emplazada en Puclaro, km 48, Valle del Elqui. 
Hermosa vista a las montañas. Cielos muy despejados. Terraza decorada con guirnalda aérea de ampolletas. Piscina.

Casa en montaña, venir en 4x4.

Máximo 10 pers. con pago adicional.

Se paga aseo.

Zona de desconexión:
No T.v
No wifi
(Aunque llega señal de todas las compañias celulares).


Acceso en 4x4",['Vista a las montañas'],,,Juanita,02-2022,https://www.airbnb.cl/rooms/640354966680192637?adults=1&children=0&infants=0&pets=0&check_in=2023-03-01&check_out=2023-03-06&previous_page_section_name=1000&federated_search_id=9893ab24-1566-4c73-8443-e4c2a41c86ed
3,"""Relax Indoors"" La Herradura - Team The Sunsets",Apartamento con servicios incluidos entero,Coquimbo,Chile,7,4,2, Habitación,2,privado,40.328,-29.97995,-71.35099,"https://maps.google.com/maps?ll=-29.97995,-71.35099&z=14&t=m&hl=es&gl=CL&mapclient=apiv3",,"Nos llamamos ¡The Sunsets!, Y te ofrecemos este departamento llamado ""Relax Indoors La Herradura"". 

Fue condicionado por nosotros para que te  desconectes de las banalidades diarias, aislado del bullicio cotidiano, con un espacio elegante y perfectamente ubicado para disfrutar de un amanecer con  el sonido de las olas, un sunset pintado de colores que solo la Región Estrella puede ofrecer o una meditación en la misma playa, ya que el condominio cuenta con acceso directo a la playa, ¡Tú decides!


Este es uno de los 02 departamentos con los que contamos para el deleite de nuestros huéspedes. 

El condominio cuenta con la piscina más grande La Herradura, donde podrán disfrutar niños y adultos, además de quinchos, área de juegos, a pasos de supermercados, estación de servicios, pueblito La Herradura,  y salida directa a la carretera.

Locomoción colectiva a la salida del edificio y en auto llegarás en pocos minutos al centro de Coquimbo y a La Serena.

Qué ofrecemos:

Acceso con cerradura electrónica de tarjeta y/o clave numérica. Olvídate de las llaves cuando vayas a la playa!!

*Red WiFi y acceso GRATUITO a cuentas:
1.- Netflix 
2.- Prime Video
3.- Disney Plus
5.- HBO+

-Dormitorios-
Habitación principal con cama king,  cobertor, almohada y una frazada. Closet espacioso con caja fuerte, TV de 50"", baño privado y salida directa al balcón.
Segunda Habitación con 03 camas, 01 de dos plazas, 01 de Plaza y media y 01 de plaza, además cuenta con cobertor y frazada.

* Se incluyen en el servicio, toallas y sábanas.

-Comedor y sala de estar-
Comedor para cuatro personas, sofá cama, dos pouf, dos taburetes y Televisión Smart Tv de 50"" de última generación junto a un Sistema de Audio 5.1 Surround.

-Cocina-
Cuenta con refrigerador, cafetera, tostadora, microondas, horno y cocina eléctricos, hervidor, ollas, vajilla, vasos, copas, etc. Además de una lavadora con secadora.

-Baño-
Cuenta con dos baños, ambos con ducha y lavamanos.
Papel higiénico y una reposición.

* Se solicita favor respectar el reglamento interno del condominio, el que regula el correcto uso de las áreas comunes y piscina.

* No fumar en el interior del departamento.

* Evitar actividades ruidosas como fiestas en el interior del departamento. Por favor sea respetuoso con los demás residentes.

* El departamento esta pensado y equipado para 4 personas, no obstante, previo aviso,  no hay problema con admitir a más personas.

-Registro de entrada / salida-
*Check-in desde 15:00 hrs a 18:00 hrs (sujeto a mutuo acuerdo)
*Check-out 12:00 hrs.","['Acceso a playa Público o compartido', 'Frente a la playa']",4.97,29,Paula,09-2021,https://www.airbnb.cl/rooms/52276740?adults=1&children=0&infants=0&pets=0&check_in=2023-03-07&check_out=2023-03-12&previous_page_section_name=1000&federated_search_id=9893ab24-1566-4c73-8443-e4c2a41c86ed
4,Big SOTO HAUS,Casa particular,Coquimbo,Chile,12,9,3, Habitación,2,privado,184.401,-29.97582,-71.32435,"https://maps.google.com/maps?ll=-29.97582,-71.32435&z=14&t=m&hl=es&gl=CL&mapclient=apiv3",,"Casa grande en primera línea con vista al mar en Totoralillo. El lugar perfecto para familias o grupos grandes que quieran descansar y relajarse a pocos minutos de la playa. Equipada con todo lo que puedas necesitar para una escapada ideal. Cocina grande con mesón amplio, espacios grandes y tres habitaciones con camas king. Quincho, arenero y piscina. Ideal para quedarse disfrutando de la vista y la casa o salir a hacer caminatas.


Esta es nuestra casa familiar que está equipada para alojar hasta a 12 personas. Tiene una gran cocina abierta con mesón central que cuenta con todo lo necesario para preparar y disfrutar ricas comidas. Tendrás disponible para usar toallas y ropa de cama.
En el patio hay un arenero, quincho, piscina y duchas exteriores para quitarse la arena después de volver de la playa.",['Acceso la playa Público o compartido'],4.80,10,Carmen Luz,06-2016,https://www.airbnb.cl/rooms/51423601?adults=1&children=0&infants=0&pets=0&check_in=2023-03-12&check_out=2023-03-18&previous_page_section_name=1000&federated_search_id=9893ab24-1566-4c73-8443-e4c2a41c86ed
5,Acogedor bed and breakfast con piscina,Habitación privada en bed and breakfast,Vicuña,Coquimbo,7,6,3, Habitación,2,privado,18.5,-30.0322,-70.7094,"https://maps.google.com/maps?ll=-30.0322,-70.7094&z=14&t=m&hl=es&gl=CL&mapclient=apiv3",,Disfruta del fácil acceso a tiendas y restaurantes populares desde este encantador espacio para quedarte.,['Cocina'],5.0,6,Héctor,03-2018,https://www.airbnb.cl/rooms/720055197591525393?adults=1&children=0&infants=0&pets=0&check_in=2023-03-05&check_out=2023-03-10&previous_page_section_name=1000&federated_search_id=9893ab24-1566-4c73-8443-e4c2a41c86ed
6,Depto con vista al mar / la serena/ Laguna del mar,Apartamento con servicios incluidos entero,La Serena,Región de Coquimbo,5,3,2, Habitación,2,privado,58.0,-29.89871,-71.27171,"https://maps.google.com/maps?ll=-29.89871,-71.27171&z=14&t=m&hl=es&gl=CL&mapclient=apiv3",,"Excelente departamento, hermosa vista al mar, grandes piscinas y Laguna. Ideal para descansar, relajarse y disfrutar en familia. Ubicado en el corazón de la serena a pasos del faro.

El espacio
Excelente departamento a pasos de la playa y vista al mar.",['Vista a la playa'],4.72,32,Sergio Fabian,01-2019,https://www.airbnb.cl/rooms/32012699?adults=1&children=0&infants=0&pets=0&check_in=2023-04-07&check_out=2023-04-12&previous_page_section_name=1000&federated_search_id=9893ab24-1566-4c73-8443-e4c2a41c86ed
7,Departamento en Av. Pacifico 2D 2B,Apartamento con servicios incluidos entero,La Serena,Coquimbo,6,4,2, Habitación,2,privado,55.0,-29.92147,-71.27381,"https://maps.google.com/maps?ll=-29.92147,-71.27381&z=14&t=m&hl=es&gl=CL&mapclient=apiv3",,"Cómodo departamento equipado completamente para 5 o 6 personas, consta  de 2 habitaciones y 2 baños.

Departamento en segunda línea, ubicando en avenida pacifico a pasos de de la playa (una cuadra). Muy cerca de variados restaurantes de la Av. Del mar.
Departamento cuenta con cama de 2 plazas en habitación matrimonial.
En segunda habitación cuenta con cama de 1 plaza y 1 camarote, ademas cuenta con un futón cama en living.


Los huéspedes podrán hacer uso de la piscina sin ningún cargo
Uso de quincho  tiene un cargo de $10.000",['Acceso a la playa'],4.90,39,Geraldine,01-2020,https://www.airbnb.cl/rooms/47471717?adults=1&children=0&infants=0&pets=0&check_in=2023-04-03&check_out=2023-04-09&previous_page_section_name=1000&federated_search_id=9893ab24-1566-4c73-8443-e4c2a41c86ed
8,La mejor vista del océano ...,Apartamento con servicios incluidos entero,Coquimbo,Región de Coquimbo,4,3,2, Habitación,2,privado,72.157,-29.97813,-71.34769,"https://maps.google.com/maps?ll=-29.97813,-71.34769&z=14&t=m&hl=es&gl=CL&mapclient=apiv3",,"Nuestro departamento se destaca por su amplios espacios , ubicado en un condominio de fácil acceso y seguridad , frente a la bahía de la herradura en Coquimbo . Inigualable vista al océano , debido a ubicarse en un piso 19. Full equipado. Tranquilidad y confort para sus vacaciones . Le esperamos !!!

El espacio
La comodidad de sus instalaciones . Tranquilidad en la estadía . Preocupación de cada detalle ...","['Acceso a playa Público o compartido', 'Frente a la playa']",4.98,52,Julio,07-2014,https://www.airbnb.cl/rooms/3521093?adults=1&children=0&infants=0&pets=0&check_in=2023-03-03&check_out=2023-03-08&previous_page_section_name=1000&federated_search_id=9893ab24-1566-4c73-8443-e4c2a41c86ed
9,"Casa familiar, nueva, amplia y aislada.",Casa particular,Coquimbo,Chile,9,9,3, Habitación,2,privado,80.0,-29.97434,-71.29141,"https://maps.google.com/maps?ll=-29.97434,-71.29141&z=14&t=m&hl=es&gl=CL&mapclient=apiv3",,"Relájate junto a la familia y amigos en este alojamiento seguro donde la tranquilidad se respira. Cercano a playa, supermercados, farmacias, restaurantes, otros. Cuenta con amplias habitaciones equipadas con muebles nuevos, cocina full equipada y artículos de limpieza, lavadora, 3 estacionamientos , terraza, TV y WiFi, juegos de mesa y lectura para niños y adultos. Contacto siempre con el anfitrion, limpieza y desinfección a full. Te sentiras como si estuvieras en tu hogar.


Lugar residencial super tranquilo cerca de la playa, supermercados, farmacias, gimnasios gasolineras, colegios, outlet, otros.",['Acceso la playa Público o compartido'],5.0,3,Juan,07-2019,https://www.airbnb.cl/rooms/564733079219163035?adults=1&children=0&infants=0&pets=0&check_in=2023-03-08&check_out=2023-03-13&previous_page_section_name=1000&federated_search_id=9893ab24-1566-4c73-8443-e4c2a41c86ed
10,Departamento en la Avenida del Mar,Apartamento con servicios incluidos entero,La Serena,Coquimbo,5,4,3, Habitación,2,privado,75.0,-29.91729,-71.27634,"https://maps.google.com/maps?ll=-29.91729,-71.27634&z=14&t=m&hl=es&gl=CL&mapclient=apiv3",,"Excelente departamento para 5 personas ubicado en la Avenida del Mar, a pasos de Avenida Cuatro Esquina y del Faro. El edificio cuenta con piscina privada, quincho y un estacionamiento privado. En sus alrededores hay varios restaurantes en que es posible ir caminando.",['Acceso a la playa'],4.85,13,Diego,02-2018,https://www.airbnb.cl/rooms/46288932?adults=1&children=0&infants=0&pets=0&check_in=2023-03-01&check_out=2023-03-06&previous_page_section_name=1000&federated_search_id=9893ab24-1566-4c73-8443-e4c2a41c86ed
11,"Departamento frente al mar, estacionamiento gratis",Apartamento con servicios incluidos entero,La Serena,Coquimbo,6,6,2, Habitación,2,privado,70.0,-29.91545,-71.27556,"https://maps.google.com/maps?ll=-29.91545,-71.27556&z=14&t=m&hl=es&gl=CL&mapclient=apiv3",,"Condominio único con piscinas con olas en la cuarta región . 

El departamento cuenta con 2 Dormitorios  1 suit con baño y otra con baño afuera de la pieza. Ambas camas de 2 pozas con ropa de cama de hotel muy cómodas, un colchón inflable que se llena en 2 min de manera automática. Un sofá cama en el living (2P)

Contarás con una limpieza excepcional ( sanitizamos con cloro cuaternario y lysofol , aspiramos y eliminamos polvo ), ropa de cama y toallas incluidas 

Todos los servicios incluidos !","['Acceso a playa Público o compartido', 'Frente a la playa']",4.64,70,Diego,07-2021,https://www.airbnb.cl/rooms/52619673?adults=1&children=0&infants=0&pets=0&check_in=2023-03-22&check_out=2023-03-27&previous_page_section_name=1000&federated_search_id=9893ab24-1566-4c73-8443-e4c2a41c86ed
12,Maravilloso departamento en la playa Los Molles,Casa particular,Los Molles,Valparaíso,5,4,3, Habitación,2,privado,75.0,-32.23637,-71.51211,"https://maps.google.com/maps?ll=-32.23637,-71.51211&z=14&t=m&hl=es&gl=CL&mapclient=apiv3",,"Descanso y desconexión a un paso de la playa y del comercio local, restaurantes, un par de minutos de autopista 5 norte,  a media hora promedio de otros lugares turísticos como Parque Puquen, Pichidangui, Las dunas de longotoma, Papudo, La Ligua y su dulzura.

El espacio
Departamento amoblado, tiene 3 dormitorios y 2 baños, living-comedor, con estacionamiento, capacidad 5-6 personas. Ubicado a 1 cuadra de la playa, vista despejada al humedal y al fondo la playa. Tiene 1 cama de 2 plazas, 1 camarote (1 plaza) y 1 cama (1 plaza), todos con cubre colchón impermeable y hay cobertores. Agua caliente de termo y tiene cable.","['Acceso a playa Público o compartido', 'Frente a la playa']",4.67,21,Fresia,06-2018,https://www.airbnb.cl/rooms/33161943?adults=1&children=0&infants=0&pets=0&check_in=2023-03-01&check_out=2023-03-07&previous_page_section_name=1000&federated_search_id=9893ab24-1566-4c73-8443-e4c2a41c86ed
13,Increíbles vacaciones en la serena con Laguna,Apartamento con servicios incluidos entero,La Serena,Región de Coquimbo,6,5,3, Habitación,2,privado,120.0,-29.8999,-71.2727,"https://maps.google.com/maps?ll=-29.8999,-71.2727&z=14&t=m&hl=es&gl=CL&mapclient=apiv3",,"Este lugar es realmente especial con todo cerca a distancia caminable en primera línea frente al mar, atardeceres en el balcón maravilloso","['Acceso a la playa', 'Frente a la playa']",4.87,23,Paola,11-2021,https://www.airbnb.cl/rooms/30093457?adults=1&children=0&infants=0&pets=0&check_in=2023-03-01&check_out=2023-03-06&previous_page_section_name=1000&federated_search_id=9893ab24-1566-4c73-8443-e4c2a41c86ed
14,"Departamento, Hermosas vistas al océano. La Serena",Apartamento con servicios incluidos entero,La Serena,Coquimbo,6,4,3, Habitación,2,privado,140.0,-29.92054,-71.27603,"https://maps.google.com/maps?ll=-29.92054,-71.27603&z=14&t=m&hl=es&gl=CL&mapclient=apiv3",,"Departamento en primera línea de playa con hermosas vistas panorámicas al océano. 3 habitaciones, todas con vistas al mar + 2 baños completos + 2 espaciosas terrazas abiertas. Cocina full equipada, abierta e integrada al living- comedor +1 sofa cama Futón. El condominio cuenta con sector de BBQ grill al aire libre + 3 piscinas + lavandería + 1 estacionamiento privado techado y estacionamiento para visitas. Estamos en Av. del mar. Cercano a puntos turísticos regional.


Amplio departamento de 110mts incluye 2 espaciosas terrazas abiertas panorámicas con vistas al océano. 3 habitaciones full equipadas en total son 4 camas + 1 Futón en el Iiving comedor de 1plaza y 1/2.","['Acceso a playa Público o compartido', 'Frente a la playa']",5.0,3,Maria Jose,09-2017,https://www.airbnb.cl/rooms/739706516651047475?adults=1&children=0&infants=0&pets=0&check_in=2023-03-01&check_out=2023-03-06&previous_page_section_name=1000&federated_search_id=9893ab24-1566-4c73-8443-e4c2a41c86ed
15,Dpto 2D 2B con espectacular terraza vista al mar.,Apartamento con servicios incluidos entero,Coquimbo,Chile,5,4,2, Habitación,2,privado,65.0,-29.94723,-71.28977,"https://maps.google.com/maps?ll=-29.94723,-71.28977&z=14&t=m&hl=es&gl=CL&mapclient=apiv3",,"Este lugar cuenta con todas las medidas necesarias de COVID-19, con una espectacular terraza con vista al mar, full equipada y con una ubicación privilegiada desde el piso 23. con acceso a la mejor gastronomía de La Serena y frente al Casino Enjoy.",['Acceso a la playa'],4.85,39,Fabian,07-2018,https://www.airbnb.cl/rooms/51786863?adults=1&children=0&infants=0&pets=0&check_in=2023-03-02&check_out=2023-03-07&previous_page_section_name=1000&federated_search_id=9893ab24-1566-4c73-8443-e4c2a41c86ed
16,Residencial Casa Blanca,Habitación privada en hostal,Salamanca,Región de Coquimbo,Más de 16,29,10, Habitación,4compartidos,compartido,28.0,-31.77927,-70.96279,"https://maps.google.com/maps?ll=-31.77927,-70.96279&z=14&t=m&hl=es&gl=CL&mapclient=apiv3",,"Residencial acogedora y patrimonial, permite familias, turistas y trabajadores, se sitúa a 150m del centro y el comercio como también las bellezas de la localidad.

El espacio
Espacios privados y comunes con televisión y muy buena limpieza.",['Cocina'],4.08,12,Mario,07-2019,https://www.airbnb.cl/rooms/36491625?adults=1&children=0&infants=0&pets=0&check_in=2023-03-01&check_out=2023-03-06&previous_page_section_name=1000&federated_search_id=9893ab24-1566-4c73-8443-e4c2a41c86ed
17,Aqua III La Serena,Apartamento con servicios incluidos entero,La Serena,Coquimbo,6,5,3, Habitación,2,privado,120.0,-29.91665,-71.2761,"https://maps.google.com/maps?ll=-29.91665,-71.2761&z=14&t=m&hl=es&gl=CL&mapclient=apiv3",,"Disfruta de un lugar muy amplio y cómodo para descansar y disfrutar solo o con familia, ideal para ir de vacaciones y aprovechar las bondades del mar, su comida, sus vinos y la magía y energía de los valles.

El espacio
Departamento amplio, con gran terraza y vista a la bahía, ubicado frente al mar, cercano al faro de la Serena, cercano a restaurantes y bares.",['Acceso a la playa'],4.93,28,Mario Espoz,07-2017,https://www.airbnb.cl/rooms/49294085?adults=1&children=0&infants=0&pets=0&check_in=2023-03-01&check_out=2023-03-06&previous_page_section_name=1000&federated_search_id=ef2c8636-ef98-486d-aca9-ab9152ca66e4
18,Hostal portal del viajero,Habitación en hotel boutique,Vicuña,Región de Coquimbo,8,8,5, Habitación,3compartidos,compartido,21.0,-30.03191,-70.71629,"https://maps.google.com/maps?ll=-30.03191,-70.71629&z=14&t=m&hl=es&gl=CL&mapclient=apiv3",,"Hostal ubicado en el corazón Del Valle del elqui, en la comuna de Vicuña ofrece a sus huéspedes seguridad y confianza en sus cómodas habitaciones con la mejor atención de sus propios dueños.

El espacio
Es un hostal familiar, atendido por sus propios dueños, ambiente relajado y de tranquilidad",['Cocina'],4.59,27,Portal Del Viajero,03-2019,https://www.airbnb.cl/rooms/33474002?adults=1&children=0&infants=0&pets=0&check_in=2023-03-01&check_out=2023-03-06&previous_page_section_name=1000&federated_search_id=ef2c8636-ef98-486d-aca9-ab9152ca66e4
19,"La serena, depto frente al mar estacionamiento",Apartamento con servicios incluidos entero,Coquimbo,Región de Coquimbo,5,4,2, Habitación,2,privado,76.5,-29.957,-71.3068,"https://maps.google.com/maps?ll=-29.957,-71.3068&z=14&t=m&hl=es&gl=CL&mapclient=apiv3",,"Depto.Frente al mar. 2H 2B principal en suite.Cercano a supermercados, casino de juegos, restaurantes. Amplia terraza equipada con cortinas roller, ventanales deslizables,mesa, sillas y malla de seguridad. Cocina  equipada, horno eléctrico.  Tv cable. El edificio cuenta con ascensor,acceso discapacitados, piscina pintada,lavandería, seguridad 24 horas, áreas comunes con juegos para niños, 4 quinchos, sala de eventos, estacionamiento techado. Ingreso directo a playa . Ubicado en el piso 10.


Posee todas las comodidades para que su estancia sea lo mas agradable posible. Vista privilegiada primera linea,acceso directo a playa . Aceso a una gran piscina ,Quinchos y sala de eventos.
Estacionamiento privado incluido.Televisión por cable.","['Acceso a la playa', 'Frente a la playa']",4.83,19,Pablo,12-2017,https://www.airbnb.cl/rooms/24756756?adults=1&children=0&infants=0&pets=0&check_in=2023-07-31&check_out=2023-08-07&previous_page_section_name=1000&federated_search_id=ef2c8636-ef98-486d-aca9-ab9152ca66e4
20,Lindo departamento en Club Océano La Serena,Apartamento con servicios incluidos entero,Coquimbo,Chile,6,5,3, Habitación,2,privado,127.0,-29.9441,-71.2881,"https://maps.google.com/maps?ll=-29.9441,-71.2881&z=14&t=m&hl=es&gl=CL&mapclient=apiv3",,"Departamento a pasos de la playa, con espectacular vista de la avenida del mar, VISTA LIBRE ,es un sistema de paneles que cierran la terraza y lo trasforma en un ambiente adicional y seguro. Cercano a diferentes restaurantes y casino enjoy. 
Un lugar perfecto y totalmente tranquilo para disfrutar con la familia en vacaciones, acogedor y cálido. 
Totalmente equipado con todo lo necesario, cuenta con Wifi, tv cable, sabanas y toallas, piscina, cocina con todos los implementos, calefacción.


El departamento cuenta con vista libre , que son paneles de vidrio que cierran la terraza y la trasforma en un ambiente adicional , mas seguro y aprovechable",['Cocina'],4.78,9,Luciano,04-2017,https://www.airbnb.cl/rooms/681392603954621090?adults=1&children=0&infants=0&pets=0&check_in=2023-03-01&check_out=2023-03-06&previous_page_section_name=1000&federated_search_id=ef2c8636-ef98-486d-aca9-ab9152ca66e4
21,Depto. full equipado en Aqua La Serena,Apartamento con servicios incluidos entero,La Serena,Coquimbo,5,4,2, Habitación,2,privado,85.0,-29.91514,-71.27369,"https://maps.google.com/maps?ll=-29.91514,-71.27369&z=14&t=m&hl=es&gl=CL&mapclient=apiv3",,"Departamento ubicado en Avenida del Mar a pocos metros del faro y con vista al mar. Totalmente equipado para 5 personas. Cuenta con servicios adicionales los cuales deben ser reservados con anticipación, tales como: piscinas al aire libre, piscina temperada, sauna y jacuzzi. Cuenta con estacionamiento propio. único edificio en la serena que cuenta con una piscina con olas.


Departamento ubicado en un cuarto piso del edificio aqua la serena, con todas las comodidades necesarias para un descanso reparador. Cuenta con 2 dormitorios, 2 baños, tv cable, wifi, cocina, living, comedor y terraza para disfrutar.","['Acceso a playa Público o compartido', 'Frente a la playa']",4.44,16,Lesley,10-2016,https://www.airbnb.cl/rooms/53351380?adults=1&children=0&infants=0&pets=0&check_in=2023-03-01&check_out=2023-03-06&previous_page_section_name=1000&federated_search_id=ef2c8636-ef98-486d-aca9-ab9152ca66e4
22,"Avenida del Mar, Full Equipado 6 personas",Apartamento con servicios incluidos entero,La Serena,Coquimbo,6,5,3, Habitación,2,privado,65.0,-29.9181,-71.2753,"https://maps.google.com/maps?ll=-29.9181,-71.2753&z=14&t=m&hl=es&gl=CL&mapclient=apiv3",,"Hermoso Departamento avenida del mar ""primera línea""  full equipado. Hermosos atardeceres y vista al mar

Dormitorio principal con baño en suite
baño adicional
Cocina full equipada
Terraza con vista al mar
piscina en el edificio
TV cable + Wifi
1 estacionamiento
No se proporcionan sábanas ni toallas
Agua caliente funcionando al 100% con Calefont 

Depto se encuentra ubicado entre cuatro esquinas y el faro, a pasos de restaurantes, pastelería y otros.


Cómodo dpto con increible vista al mar","['Acceso a playa Público o compartido', 'Frente a la playa']",4.72,18,Katherine,07-2020,https://www.airbnb.cl/rooms/53219412?adults=1&children=0&infants=0&pets=0&check_in=2023-03-01&check_out=2023-03-06&previous_page_section_name=1000&federated_search_id=ef2c8636-ef98-486d-aca9-ab9152ca66e4
