,Titulo1,Titulo2,Comuna,Region,Capacidad,Camas,N_Habitaciones,Habitaciones,Baños,Tipo_Baños,Precio,lat,lon,Ubicacion,Ubides,Descripcion,Servicios,Nota,Nnota,Anfitrion,Registro,Link
0,Departamento La Serena frente a la playa y Enjoy,Apartamento con servicios incluidos entero,Coquimbo,Chile,6,5,3, Habitación,2,privado,100.0,-29.94517,-71.29044,"https://maps.google.com/maps?ll=-29.94517,-71.29044&z=14&t=m&hl=es&gl=CL&mapclient=apiv3",,"Frente al mar,  primera línea de la playa,  al lado del casino Enjoy. Vista directa al mar.
Edificio con todas las comodidades,  piscinas, gimnasio, lavandería, portería 24 horas, estacionamiento cubierto. A pocos pasos de los mejores restaurantes, minimarkets, ciclovía y a 20 minutos del aeropuerto de Coquimbo.
Departamento completamente equipado,  con 3 habitaciones,  para 6 personas. Cuenta con tv por cable, internet, cocina equipada, jacuzzi en alcoba principal, ropa de cama y toallas.


El departamento tiene 100m2, cuenta con 3 habitaciones, la alcoba principal es de gran tamaño, con jacuzzi. La segunda y tercera habitación cada una tiene dos camas plaza y media.  La terraza tiene vista directa al mar, con mesa y silla de comedor.","['Acceso a la playa', 'Frente a la playa']",4.74,46,Nohelia,09-2018,https://www.airbnb.cl/rooms/53121256?adults=1&children=0&infants=0&pets=0&check_in=2023-03-12&check_out=2023-03-17&previous_page_section_name=1000&federated_search_id=5157eb1c-cf99-46ea-8751-01d76aa1a620
1,"Casa mediterránea, piscina y vista a la cordillera",Casa particular,Diaguitas,Coquimbo,6,8,6, Habitación,2,privado,138.624,-30.01957,-70.83293,"https://maps.google.com/maps?ll=-30.01957,-70.83293&z=14&t=m&hl=es&gl=CL&mapclient=apiv3",,"Ven a vivir la tranquilidad insuperable Del Valle del Elqui. Terraza con vista a la cordillera, full open sky, de 200 m2 con piscina. 
Incluye sector de fogata. 
Emplazada en Puclaro, km 48, Valle del Elqui. 
Hermosa vista a las montañas. Cielos muy despejados. Terraza decorada con guirnalda aérea de ampolletas. Piscina.

Casa en montaña, venir en 4x4.

Máximo 10 pers. con pago adicional.

Se paga aseo.

Zona de desconexión:
No T.v
No wifi
(Aunque llega señal de todas las compañias celulares).


Acceso en 4x4",['Vista a las montañas'],,,Juanita,02-2022,https://www.airbnb.cl/rooms/640354966680192637?adults=1&children=0&infants=0&pets=0&check_in=2023-03-01&check_out=2023-03-06&previous_page_section_name=1000&federated_search_id=5157eb1c-cf99-46ea-8751-01d76aa1a620
2,Big SOTO HAUS,Casa particular,Coquimbo,Chile,12,9,3, Habitación,2,privado,184.401,-29.97582,-71.32435,"https://maps.google.com/maps?ll=-29.97582,-71.32435&z=14&t=m&hl=es&gl=CL&mapclient=apiv3",,"Casa grande en primera línea con vista al mar en Totoralillo. El lugar perfecto para familias o grupos grandes que quieran descansar y relajarse a pocos minutos de la playa. Equipada con todo lo que puedas necesitar para una escapada ideal. Cocina grande con mesón amplio, espacios grandes y tres habitaciones con camas king. Quincho, arenero y piscina. Ideal para quedarse disfrutando de la vista y la casa o salir a hacer caminatas.


Esta es nuestra casa familiar que está equipada para alojar hasta a 12 personas. Tiene una gran cocina abierta con mesón central que cuenta con todo lo necesario para preparar y disfrutar ricas comidas. Tendrás disponible para usar toallas y ropa de cama.
En el patio hay un arenero, quincho, piscina y duchas exteriores para quitarse la arena después de volver de la playa.",['Acceso la playa Público o compartido'],4.80,10,Carmen Luz,06-2016,https://www.airbnb.cl/rooms/51423601?adults=1&children=0&infants=0&pets=0&check_in=2023-03-12&check_out=2023-03-18&previous_page_section_name=1000&federated_search_id=5157eb1c-cf99-46ea-8751-01d76aa1a620
3,Acogedor bed and breakfast con piscina,Habitación privada en bed and breakfast,Vicuña,Coquimbo,7,6,3, Habitación,2,privado,18.5,-30.0322,-70.7094,"https://maps.google.com/maps?ll=-30.0322,-70.7094&z=14&t=m&hl=es&gl=CL&mapclient=apiv3",,Disfruta del fácil acceso a tiendas y restaurantes populares desde este encantador espacio para quedarte.,['Cocina'],5.0,6,Héctor,03-2018,https://www.airbnb.cl/rooms/720055197591525393?adults=1&children=0&infants=0&pets=0&check_in=2023-03-05&check_out=2023-03-10&previous_page_section_name=1000&federated_search_id=5157eb1c-cf99-46ea-8751-01d76aa1a620
4,"Casa familiar, nueva, amplia y aislada.",Casa particular,Coquimbo,Chile,9,9,3, Habitación,2,privado,80.0,-29.97434,-71.29141,"https://maps.google.com/maps?ll=-29.97434,-71.29141&z=14&t=m&hl=es&gl=CL&mapclient=apiv3",,"Relájate junto a la familia y amigos en este alojamiento seguro donde la tranquilidad se respira. Cercano a playa, supermercados, farmacias, restaurantes, otros. Cuenta con amplias habitaciones equipadas con muebles nuevos, cocina full equipada y artículos de limpieza, lavadora, 3 estacionamientos , terraza, TV y WiFi, juegos de mesa y lectura para niños y adultos. Contacto siempre con el anfitrion, limpieza y desinfección a full. Te sentiras como si estuvieras en tu hogar.


Lugar residencial super tranquilo cerca de la playa, supermercados, farmacias, gimnasios gasolineras, colegios, outlet, otros.",['Vista a la bahía'],5.0,3,Juan,07-2019,https://www.airbnb.cl/rooms/564733079219163035?adults=1&children=0&infants=0&pets=0&check_in=2023-03-08&check_out=2023-03-13&previous_page_section_name=1000&federated_search_id=5157eb1c-cf99-46ea-8751-01d76aa1a620
5,Departamento en la Avenida del Mar,Apartamento con servicios incluidos entero,La Serena,Coquimbo,5,4,3, Habitación,2,privado,75.0,-29.91729,-71.27634,"https://maps.google.com/maps?ll=-29.91729,-71.27634&z=14&t=m&hl=es&gl=CL&mapclient=apiv3",,"Excelente departamento para 5 personas ubicado en la Avenida del Mar, a pasos de Avenida Cuatro Esquina y del Faro. El edificio cuenta con piscina privada, quincho y un estacionamiento privado. En sus alrededores hay varios restaurantes en que es posible ir caminando.",['Acceso a la playa'],4.85,13,Diego,02-2018,https://www.airbnb.cl/rooms/46288932?adults=1&children=0&infants=0&pets=0&check_in=2023-03-01&check_out=2023-03-06&previous_page_section_name=1000&federated_search_id=5157eb1c-cf99-46ea-8751-01d76aa1a620
6,Maravilloso departamento en la playa Los Molles,Casa particular,Los Molles,Valparaíso,5,4,3, Habitación,2,privado,75.0,-32.23637,-71.51211,"https://maps.google.com/maps?ll=-32.23637,-71.51211&z=14&t=m&hl=es&gl=CL&mapclient=apiv3",,"Descanso y desconexión a un paso de la playa y del comercio local, restaurantes, un par de minutos de autopista 5 norte,  a media hora promedio de otros lugares turísticos como Parque Puquen, Pichidangui, Las dunas de longotoma, Papudo, La Ligua y su dulzura.

El espacio
Departamento amoblado, tiene 3 dormitorios y 2 baños, living-comedor, con estacionamiento, capacidad 5-6 personas. Ubicado a 1 cuadra de la playa, vista despejada al humedal y al fondo la playa. Tiene 1 cama de 2 plazas, 1 camarote (1 plaza) y 1 cama (1 plaza), todos con cubre colchón impermeable y hay cobertores. Agua caliente de termo y tiene cable.","['Acceso a playa Público o compartido', 'Frente a la playa']",4.67,21,Fresia,06-2018,https://www.airbnb.cl/rooms/33161943?adults=1&children=0&infants=0&pets=0&check_in=2023-03-01&check_out=2023-03-07&previous_page_section_name=1000&federated_search_id=5157eb1c-cf99-46ea-8751-01d76aa1a620
7,Increíbles vacaciones en la serena con Laguna,Apartamento con servicios incluidos entero,La Serena,Región de Coquimbo,6,5,3, Habitación,2,privado,120.0,-29.8999,-71.2727,"https://maps.google.com/maps?ll=-29.8999,-71.2727&z=14&t=m&hl=es&gl=CL&mapclient=apiv3",,"Este lugar es realmente especial con todo cerca a distancia caminable en primera línea frente al mar, atardeceres en el balcón maravilloso",['Vista a la bahía'],4.87,23,Paola,11-2021,https://www.airbnb.cl/rooms/30093457?adults=1&children=0&infants=0&pets=0&check_in=2023-03-01&check_out=2023-03-06&previous_page_section_name=1000&federated_search_id=5157eb1c-cf99-46ea-8751-01d76aa1a620
8,"Departamento, Hermosas vistas al océano. La Serena",Apartamento con servicios incluidos entero,La Serena,Coquimbo,6,4,3, Habitación,2,privado,145.0,-29.92054,-71.27603,"https://maps.google.com/maps?ll=-29.92054,-71.27603&z=14&t=m&hl=es&gl=CL&mapclient=apiv3",,"Departamento en primera línea de playa con hermosas vistas panorámicas al océano. 3 habitaciones, todas con vistas al mar + 2 baños completos + 2 espaciosas terrazas abiertas. Cocina full equipada, abierta e integrada al living- comedor +1 sofa cama Futón. El condominio cuenta con sector de BBQ grill al aire libre + 3 piscinas + lavandería + 1 estacionamiento privado techado y estacionamiento para visitas. Estamos en Av. del mar. Cercano a puntos turísticos regional.


Amplio departamento de 110mts incluye 2 espaciosas terrazas abiertas panorámicas con vistas al océano. 3 habitaciones full equipadas en total son 4 camas + 1 Futón en el Iiving comedor de 1plaza y 1/2.",['Vista a las montañas'],5.0,3,Maria Jose,09-2017,https://www.airbnb.cl/rooms/739706516651047475?adults=1&children=0&infants=0&pets=0&check_in=2023-03-01&check_out=2023-03-06&previous_page_section_name=1000&federated_search_id=5157eb1c-cf99-46ea-8751-01d76aa1a620
9,Residencial Casa Blanca,Habitación privada en hostal,Salamanca,Región de Coquimbo,Más de 16,29,10, Habitación,4compartidos,compartido,28.0,-31.77927,-70.96279,"https://maps.google.com/maps?ll=-31.77927,-70.96279&z=14&t=m&hl=es&gl=CL&mapclient=apiv3",,"Residencial acogedora y patrimonial, permite familias, turistas y trabajadores, se sitúa a 150m del centro y el comercio como también las bellezas de la localidad.

El espacio
Espacios privados y comunes con televisión y muy buena limpieza.",['Cocina'],4.08,12,Mario,07-2019,https://www.airbnb.cl/rooms/36491625?adults=1&children=0&infants=0&pets=0&check_in=2023-03-01&check_out=2023-03-06&previous_page_section_name=1000&federated_search_id=5157eb1c-cf99-46ea-8751-01d76aa1a620
10,Aqua III La Serena,Apartamento con servicios incluidos entero,La Serena,Coquimbo,6,5,3, Habitación,2,privado,120.0,-29.91665,-71.2761,"https://maps.google.com/maps?ll=-29.91665,-71.2761&z=14&t=m&hl=es&gl=CL&mapclient=apiv3",,"Disfruta de un lugar muy amplio y cómodo para descansar y disfrutar solo o con familia, ideal para ir de vacaciones y aprovechar las bondades del mar, su comida, sus vinos y la magía y energía de los valles.

El espacio
Departamento amplio, con gran terraza y vista a la bahía, ubicado frente al mar, cercano al faro de la Serena, cercano a restaurantes y bares.",['Vista a la bahía'],4.93,28,Mario Espoz,07-2017,https://www.airbnb.cl/rooms/49294085?adults=1&children=0&infants=0&pets=0&check_in=2023-03-01&check_out=2023-03-06&previous_page_section_name=1000&federated_search_id=5157eb1c-cf99-46ea-8751-01d76aa1a620
11,Hostal portal del viajero,Habitación en hotel boutique,Vicuña,Región de Coquimbo,8,8,5, Habitación,3compartidos,compartido,21.0,-30.03191,-70.71629,"https://maps.google.com/maps?ll=-30.03191,-70.71629&z=14&t=m&hl=es&gl=CL&mapclient=apiv3",,"Hostal ubicado en el corazón Del Valle del elqui, en la comuna de Vicuña ofrece a sus huéspedes seguridad y confianza en sus cómodas habitaciones con la mejor atención de sus propios dueños.

El espacio
Es un hostal familiar, atendido por sus propios dueños, ambiente relajado y de tranquilidad",['Cocina'],4.59,27,Portal Del Viajero,03-2019,https://www.airbnb.cl/rooms/33474002?adults=1&children=0&infants=0&pets=0&check_in=2023-03-01&check_out=2023-03-06&previous_page_section_name=1000&federated_search_id=5157eb1c-cf99-46ea-8751-01d76aa1a620
12,Lindo departamento en Club Océano La Serena,Apartamento con servicios incluidos entero,Coquimbo,Chile,6,5,3, Habitación,2,privado,127.0,-29.9441,-71.2881,"https://maps.google.com/maps?ll=-29.9441,-71.2881&z=14&t=m&hl=es&gl=CL&mapclient=apiv3",,"Departamento a pasos de la playa, con espectacular vista de la avenida del mar, VISTA LIBRE ,es un sistema de paneles que cierran la terraza y lo trasforma en un ambiente adicional y seguro. Cercano a diferentes restaurantes y casino enjoy. 
Un lugar perfecto y totalmente tranquilo para disfrutar con la familia en vacaciones, acogedor y cálido. 
Totalmente equipado con todo lo necesario, cuenta con Wifi, tv cable, sabanas y toallas, piscina, cocina con todos los implementos, calefacción.


El departamento cuenta con vista libre , que son paneles de vidrio que cierran la terraza y la trasforma en un ambiente adicional , mas seguro y aprovechable",['Cocina'],4.78,9,Luciano,04-2017,https://www.airbnb.cl/rooms/681392603954621090?adults=1&children=0&infants=0&pets=0&check_in=2023-03-01&check_out=2023-03-06&previous_page_section_name=1000&federated_search_id=5157eb1c-cf99-46ea-8751-01d76aa1a620
13,"Avenida del Mar, Full Equipado 6 personas",Apartamento con servicios incluidos entero,La Serena,Coquimbo,6,5,3, Habitación,2,privado,65.0,-29.9181,-71.2753,"https://maps.google.com/maps?ll=-29.9181,-71.2753&z=14&t=m&hl=es&gl=CL&mapclient=apiv3",,"Hermoso Departamento avenida del mar ""primera línea""  full equipado. Hermosos atardeceres y vista al mar

Dormitorio principal con baño en suite
baño adicional
Cocina full equipada
Terraza con vista al mar
piscina en el edificio
TV cable + Wifi
1 estacionamiento
No se proporcionan sábanas ni toallas
Agua caliente funcionando al 100% con Calefont 

Depto se encuentra ubicado entre cuatro esquinas y el faro, a pasos de restaurantes, pastelería y otros.


Cómodo dpto con increible vista al mar",['Vista al océano'],4.72,18,Katherine,07-2020,https://www.airbnb.cl/rooms/53219412?adults=1&children=0&infants=0&pets=0&check_in=2023-03-01&check_out=2023-03-06&previous_page_section_name=1000&federated_search_id=5157eb1c-cf99-46ea-8751-01d76aa1a620
14,"Avenida del Mar, amplio y equipado",Apartamento con servicios incluidos entero,La Serena,Coquimbo,8,5,3, Habitación,2,privado,132.0,-29.927,-71.2785,"https://maps.google.com/maps?ll=-29.927,-71.2785&z=14&t=m&hl=es&gl=CL&mapclient=apiv3",,"Este lugar tiene la mejor ubicación de la serena, en avenida del mar con cuatro esquinas, 

Acogedor departamento, amplios espacios, terraza espectacular con la mejor vista de la Serena, 1 estacionamiento 

full equipado. No se proporcionan sábanas ni toallas.

-Conserjería 24/7
Depto 509, hermosa vista orientación norte
No se aceptan mascotas


departamento espacioso, con terraza orientación norte",['Vista a la marina'],4.50,12,Katherine,07-2020,https://www.airbnb.cl/rooms/53460176?adults=1&children=0&infants=0&pets=0&check_in=2023-03-01&check_out=2023-03-06&previous_page_section_name=1000&federated_search_id=5157eb1c-cf99-46ea-8751-01d76aa1a620
15,LA SERENA ¡Fabuloso Dpto! Av del Mar 3D2B 2estac.,Apartamento con servicios incluidos entero,La Serena,Coquimbo,6,6,3, Habitación,2,privado,90.0,-29.91927,-71.27649,"https://maps.google.com/maps?ll=-29.91927,-71.27649&z=14&t=m&hl=es&gl=CL&mapclient=apiv3",,"Lujoso dpto en proyecto exclusivo Aqua Resort La Serena.

Dpto para 6 personas son 3D2B con 2 estacionamientos. Orilla de Playa. Wifi-tv cable

Amplio y seguro dpto con elegante mobiliario y diseño contemporáneo.

Piscina con olas
Piscina temperada
Jacussi / Sauna 
Sala Juegos 
Gym 
Sala cine 
Sala multiuso 
Parrilla, otros. 

Seguridad 24/7 

Sector restaurantes, panadería, pastelería, farmacia, etc. 

Contacto arriendo fono +56 9 8 768 5054

¡DISFRUTA EN FAMILIA! 
¡NO TE LO PUEDES PERDER!",['Vista a la bahía'],,,Juan Carlos,06-2021,https://www.airbnb.cl/rooms/50350143?adults=1&children=0&infants=0&pets=0&check_in=2023-03-01&check_out=2023-03-06&previous_page_section_name=1000&federated_search_id=5157eb1c-cf99-46ea-8751-01d76aa1a620
16,Departamento Arcos de Pinamar,Casa particular,La Serena,Región de Coquimbo,8,5,3, Habitación,2,privado,45.0,-29.88668,-71.25038,"https://maps.google.com/maps?ll=-29.88668,-71.25038&z=14&t=m&hl=es&gl=CL&mapclient=apiv3",,El departamento tiene un estilo en madera bastante luminoso y colores claros. Se encuentra en una zona residencial muy tranquila y acogedora a 3 minutos del centro y 5 minutos de la avenida del mar en auto. Ruta 5 norte a 1 minuto.  Totalmente equipada para 1 persona. Baño compartido con otra persona. Internet  y directTV.,['Cocina'],,,Luis,12-2017,https://www.airbnb.cl/rooms/22515683?adults=1&children=0&infants=0&pets=0&check_in=2023-03-01&check_out=2023-03-06&previous_page_section_name=1000&federated_search_id=5157eb1c-cf99-46ea-8751-01d76aa1a620
17,Cruce del Hotel Piuquenes,Habitación en hotel,Almendrillo,Coquimbo,10,8,8, Habitación,"13,5",privado,40.0,-32.03958,-70.60232,"https://maps.google.com/maps?ll=-32.03958,-70.60232&z=14&t=m&hl=es&gl=CL&mapclient=apiv3",,"Este encantador y exclusivo lugar para quedarte no pasa por alto ningún detalle. Te entregamos una comodidad única con una instalación en plena cordillera de Salamanca desconectado de todo, para conectar con lo Natural. Ademas contamos con servicios turísticos entregados por La Agencia de turismo  Aventura Mallacun vertical",['Acceso al lago'],,,Piuquenes,01-2023,https://www.airbnb.cl/rooms/805899287733471962?adults=1&children=0&infants=0&pets=0&check_in=2023-05-04&check_out=2023-05-09&previous_page_section_name=1000&federated_search_id=5157eb1c-cf99-46ea-8751-01d76aa1a620
18,Casa Colonial Centrica con desayuno baño en suite,Habitación privada en bed and breakfast,Vicuña,Coquimbo,2,7,10, Habitación,10compartidos,compartido,45.0,-30.03414,-70.71575,"https://maps.google.com/maps?ll=-30.03414,-70.71575&z=14&t=m&hl=es&gl=CL&mapclient=apiv3",,"Nustra Hostal es acogedora y central, una casa colonial con bellos jardines, pileta con una cascada artificial para su  relajación, las habitaciones cuentan con ropa de cama y el baño, en suite,esta equipado con jabón, papel higiénico, toallas individuales y el agua caliente funciona 24 hrs, el desayuno esta incluido con el alojamiento. Contamos con una cocina común equipada, quinchos y fogones de libre uso en el jardín.
Los servicios adicionales sauna, muro de escalada, jacuzzi y lavandería.


Habitación matrimonial o doble $45.000.-

Habitación triple Matrimonial+ single $55.000.-

 Habitación Cuádruple Matrimonial+ 2 single $65.000.-",['Cocina'],,,Aldea,09-2022,https://www.airbnb.cl/rooms/727456008069384140?adults=1&children=0&infants=0&pets=0&check_in=2023-03-01&check_out=2023-03-06&previous_page_section_name=1000&federated_search_id=59a483b1-9d3e-473d-beb4-46c5e60199fd
19,Precioso departamento en Playa Peñuelas Coquimbo,Apartamento con servicios incluidos entero,La Serena,Coquimbo,5,4,3, Habitación,2,privado,120.0,-29.94736,-71.28877,"https://maps.google.com/maps?ll=-29.94736,-71.28877&z=14&t=m&hl=es&gl=CL&mapclient=apiv3",,"Departamento de 3 dormitorios y 2 baños con hermosa vista al mar y terraza, en Condominio cerrado con vigilancia 24 hrs y acceso controlado, amplias áreas verdes, piscina, sala de eventos, lavandería. Con acceso directo y a pocos pasos de  la playa, casino Enjoy Coquimbo, Avenida del Mar con variada gastronomía, entretención para niños y adultos, vida nocturna. Se encuentra decorado y con todas las comodidades para unas vacaciones de lujo, incluye ropa de cama , toallas.
Tv cable y Wi-fi.",['Vista a la bahía'],,,Ana Karina,10-2021,https://www.airbnb.cl/rooms/566893368687186449?adults=1&children=0&infants=0&pets=0&check_in=2023-03-01&check_out=2023-03-06&previous_page_section_name=1000&federated_search_id=59a483b1-9d3e-473d-beb4-46c5e60199fd
20,"Bello Departamento La Serena , Avda Del Mar",Apartamento con servicios incluidos entero,La Serena,Coquimbo,5,4,3, Habitación,2,privado,75.0,-29.91398,-71.27242,"https://maps.google.com/maps?ll=-29.91398,-71.27242&z=14&t=m&hl=es&gl=CL&mapclient=apiv3",,"Cómodo Dpto , vista al mar , piscina , todo cerca seguro y muy tranquilo , especial para descansar y disfrutar en familia , pareja o solo !!",['Vista al jardín'],,,Jocelyn,03-2016,https://www.airbnb.cl/rooms/810751775662120679?adults=1&children=0&infants=0&pets=0&check_in=2023-03-01&check_out=2023-03-06&previous_page_section_name=1000&federated_search_id=59a483b1-9d3e-473d-beb4-46c5e60199fd
21,Departamento a minutos Playa La Herradura (Zócalo),Apartamento con servicios incluidos entero,Coquimbo,Chile,6,6,3, Habitación,2,privado,70.0,-29.993,-71.3404,"https://maps.google.com/maps?ll=-29.993,-71.3404&z=14&t=m&hl=es&gl=CL&mapclient=apiv3",,"Departamento en Condominio tranquilo, Equipado completamente, 3 Dormitorios, 2 Baños, Wifi, Quincho, Piscina, zona de juegos infantiles, Estacionamiento, Sala de Eventos.

Playa La Herradura a 7 minutos en auto, cercano a supermercados, transporte público, consultorio, carabineros.

El espacio
Departamento en zócalo, muy tranquilo y seguro.",['Cocina'],5.0,4,Nancy,01-2019,https://www.airbnb.cl/rooms/54274622?adults=1&children=0&infants=0&pets=0&check_in=2023-03-01&check_out=2023-03-06&previous_page_section_name=1000&federated_search_id=59a483b1-9d3e-473d-beb4-46c5e60199fd
22,hotel Cabañas Caribe .,Habitación en hotel,Choapa,Coquimbo,2,14,7, Habitación,8,privado,57.0,-31.9105,-71.5106,"https://maps.google.com/maps?ll=-31.9105,-71.5106&z=14&t=m&hl=es&gl=CL&mapclient=apiv3",,"a 2 cuadras de la playa , ubicado en pleno centro , con estacionamiento privado  , cerca del Banco y comercio .Descubre los tesoros locales desde este moderno alojamiento.",['Cocina'],,,Sonia Alexandra,02-2023,https://www.airbnb.cl/rooms/818755362024826612?adults=1&children=0&infants=0&pets=0&check_in=2023-03-01&check_out=2023-03-06&previous_page_section_name=1000&federated_search_id=59a483b1-9d3e-473d-beb4-46c5e60199fd
23,Hermoso y precioso Dpto. en Serena full amoblado,Apartamento con servicios incluidos entero,La Serena,Región de Coquimbo,8,6,3, Habitación,2,privado,75.0,-29.93169,-71.27833,"https://maps.google.com/maps?ll=-29.93169,-71.27833&z=14&t=m&hl=es&gl=CL&mapclient=apiv3",,"Hermoso departamento con Vista al mar desde la terraza, con 3 dormitorios:
-1 Dormitorio principal matrimonial baño en Suite
-2do. Dormitorio matrimonial
-3er.  Dormitorio de 4 camas de (1 plaza c/u)
-2do. Baño visita al costado del 3er. dormitorio 
-Sala Oficina-Escritorio
-Cocina amoblada completa incluye lavavajillas
-Horno Eléctrico
-Microondas
-Refrigerador 
-Lavadora con lavadero
-Sala de Estar Linving Comedor 
-Direct-TV prepago por el cliente
-Internet Wifi

Habilitado hasta 8 personas.


Cercano al Casino Enjoy,  una gran costanera de 16 kms. , Centros Comerciales, Cafeterías, Pub, Juegos Infantiles, espacios para el deporte, Ciclovias,  Supermercados , entre otros.","['Acceso a la playa', 'Frente a la playa']",,,Gladys,01-2018,https://www.airbnb.cl/rooms/39869274?adults=1&children=0&infants=0&pets=0&check_in=2023-04-01&check_out=2023-04-06&previous_page_section_name=1000&federated_search_id=59a483b1-9d3e-473d-beb4-46c5e60199fd
24,Hostal Oasis,Habitación privada en hostal,Coquimbo,Chile,9,9,6, Habitación,6,privado,32.0,-29.9556,-71.3394,"https://maps.google.com/maps?ll=-29.9556,-71.3394&z=14&t=m&hl=es&gl=CL&mapclient=apiv3",,"ubicado en pleno centro de la ciudad, cerca de locales comerciales, mall vivo, termina de buses, plaza, bancos, farmacias y supermercados",['Wifi'],,,Hostal,12-2022,https://www.airbnb.cl/rooms/788457802961926960?adults=1&children=0&infants=0&pets=0&check_in=2023-03-04&check_out=2023-03-10&previous_page_section_name=1000&federated_search_id=59a483b1-9d3e-473d-beb4-46c5e60199fd
25,Primer piso frente al mar acceso directo jardines,Casa particular,La Serena,Coquimbo,6,6,3, Habitación,2,privado,70.0,-29.9382,-71.2848,"https://maps.google.com/maps?ll=-29.9382,-71.2848&z=14&t=m&hl=es&gl=CL&mapclient=apiv3",,"Departamento en primer piso  frente al mar, con acceso directo a los jardines, únicos en La Serena, ideal para disfrutar con familia, totalmente equipado.",['Cocina'],4.67,3,Juan,10-2014,https://www.airbnb.cl/rooms/48050780?adults=1&children=0&infants=0&pets=0&check_in=2023-03-01&check_out=2023-03-06&previous_page_section_name=1000&federated_search_id=59a483b1-9d3e-473d-beb4-46c5e60199fd
26,Amplia casa Puertas del mar ( 7 pers ).,Casa particular,La Serena,Región de Coquimbo,7,6,3, Habitación,3,privado,85.0,-29.89536,-71.26847,"https://maps.google.com/maps?ll=-29.89536,-71.26847&z=14&t=m&hl=es&gl=CL&mapclient=apiv3",,"Casa Amplia sector Puertas del Mar totalmente equipada para 7 personas, con 3 habitaciones y 3 baños, wifi, patio amplio con juego de terraza y parrilla, espacio para 2 estacionamientos. 
1-Pieza matrimonial con baño en suite
2-Pieza con 1 camarote ( 2 camas ) + silloncama.
3-Pieza con cama nido (2 camas)
Sector tranquilo, cercano a playa (acceso al costado de lagunas del mar, caminando a 12 min) y Faro monumental (en auto 6 min).
Personas adicionales y el ingreso de mascotas es conversable.


Casa de dos pisos con escalera (ver en las fotos)",['Acceso la playa Público o compartido'],4.80,5,Gabriela,12-2016,https://www.airbnb.cl/rooms/30130451?adults=1&children=0&infants=0&pets=0&check_in=2023-03-01&check_out=2023-03-06&previous_page_section_name=1000&federated_search_id=59a483b1-9d3e-473d-beb4-46c5e60199fd
