,Titulo1,Titulo2,Comuna,Capacidad,Camas,N_Habitaciones,Habitaciones,Baños,Tipo_Baños,Precio,lat,lon,Ubicacion,Ubides,Descripcion,Servicios,Nota,Nnota,Anfitrion,Registro,Link
128,Departamento Coquimbo La Serena Peñuelas Casino,Condo entero,Coquimbo,5,4,2, Habitación,2,privado,55.0,-29.94523,-71.28663,"https://maps.google.com/maps?ll=-29.94523,-71.28663&z=14&t=m&hl=es&gl=CL&mapclient=apiv3","Sector acomodado y muy tranquilo, donde podrá encontrar todos los espacios y servicios que necesite para recreación, turismo, descanso y compras. Esta a pasos de playa Peñuelas, Casino Enjoy, ferias de artesanía, juegos para niños, supermercados, malls, paseo Avda Del Mar, Restaurants, etc.","Hermoso y cómodo departamento con una inigualable vista al mar. Ubicado en el límite de Coquimbo y La Serena, a pasos de playa Peñuelas, casino Enjoy, Restaurants, Bares, ferias artesanales, malls, supermercados, etc. El condominio cuenta con circuito de seguridad 24hrs, piscina, áreas verdes, lavandería, wifi comunitaria, gimnasio, entre otros. Es un lugar muy seguro, residencial y muy tranquilo, especial para familias y pasajeros que buscan pasar momentos de paz y felicidad.


Nuestro departamento cuenta con todas las comodidades que necesita, cuenta con un estacionamiento, una cocina completamente equipada, con horno eléctrico, microondas, ollas, vajilla, vasos, copas, refrigerador, lavalozas y papel. Tiene 2 baños, uno en suite, incluye toallas, shampoo, secador de pelo, jabón líquido y papel higiénico. Además, incluye 2 TV HD ambas con TV Cable, juegos de mesa, wifi y una terraza con una vista al mar increíble.",['Vista a la bahía'],4.91,34,Isaac Sebastián,11-2018,https://www.airbnb.cl/rooms/39088134?adults=1&children=0&infants=0&pets=0&check_in=2023-03-08&check_out=2023-03-13&previous_page_section_name=1000&federated_search_id=7e6e9c40-c8c2-4937-b7e3-c53af200b0c2
129,Excelente La Serena con vista frente al mar,Condo entero,La Serena,4,3,2, Habitación,2,privado,75.0,-29.92113,-71.27671,"https://maps.google.com/maps?ll=-29.92113,-71.27671&z=14&t=m&hl=es&gl=CL&mapclient=apiv3",Excelentes cafeterías y restaurantes en el sector.,"Excelentes vacaciones. La Serena. Dpto. con la mejor vista frente al mar, condominio OCEANIC II. Ultimo piso (11), 2 dormitorios, 2 baños, TV por cable premium, (2 LCD, 49"" y 32"") y WiFi.

Excelentes vacaciones en La Serena. Apartamento ático para 4 personas ubicado frente a la playa de La Serena con la mejor vista al océano Pacífico, condominio OCEÁNICO II, 2 dormitorios, 2 baños, TV por cable premium (2 LCD 49 ""y 32"") y WiFi.


Estacionamiento techado, 3 piscinas, sala de eventos, gimnasio, quinchos para asados, servicios de lavandería y conserjería y seguridad las 24 horas. Ubicado a pasos de los mejores restaurantes de la región, casino y entretenciones.

Parking place with roof, 3 swimming pools, wide room for events, gym, barbecue place, services of laundry and vigilance over 24 hrs. Usted puede disfrutar en el barrio de los mejores restaurantes de la región, casino y entretenimiento.",['Vista al mar'],4.88,42,Leandro,01-2019,https://www.airbnb.cl/rooms/32443276?adults=1&children=0&infants=0&pets=0&check_in=2023-03-05&check_out=2023-03-10&previous_page_section_name=1000&federated_search_id=7e6e9c40-c8c2-4937-b7e3-c53af200b0c2
130,Depto. Condominio Aqua La Serena,Vivienda rentada entero,La Serena,4,5,2, Habitación,2,privado,94.0,-29.91624,-71.27453,"https://maps.google.com/maps?ll=-29.91624,-71.27453&z=14&t=m&hl=es&gl=CL&mapclient=apiv3","Entorno tranquilo y privilegiado con cafeterías, restaurantes, y servicio de delivery sumamente variado en la zona.","Este lugar tiene una ubicación estratégica: Se encuentra en avenida del mar, lo que te permitirá poder caminar relajadamente frente al mar y disfrutar de restaurantes variados por el sector. Además, el condominio cuenta con 3 piscinas al aire libre y 1 temperada, adicionalmente con sauna y jacuzzi. Único edificio en La Serena que cuenta con una piscina con olas. Depto ubicado en un piso 11, full equipado para 4 personas máximo 5 (4 camas: 1 queen, 1 camarote y 1 individual).


Depto con 2 dormitorios y 2 baños. Cocina full equipada. Terraza amplia y con una vista panorámica del entorno.",['Vista al complejo turístico'],,,Lesley,10-2016,https://www.airbnb.cl/rooms/800543133104053718?adults=1&children=0&infants=0&pets=0&check_in=2023-02-23&check_out=2023-02-28&previous_page_section_name=1000&federated_search_id=7e6e9c40-c8c2-4937-b7e3-c53af200b0c2
131,Departamento Full Equipado - Puerto Velero,Vivienda rentada entero,Puerto Velero,5,5,2, Habitación,2,privado,170.0,-30.24459,-71.47954,"https://maps.google.com/maps?ll=-30.24459,-71.47954&z=14&t=m&hl=es&gl=CL&mapclient=apiv3","Puerto velero cuenta con minimarket, dos restaurant ( molokai y cannoli) canchas de fútbol, golf, padel, spa, zona de quinchos, en la estación estival existen actividades organizadas por semanas para la recreación principalmente de niños. Además Los estacionamientos cuentan con una zona para aparcar las bicicletas.","El departamento se ubica en un 3er  piso ( ingreso por 4to piso edificio 22) excelente vista, bien equipado para una grata estadía, cable, y WIFI,  2 estacionamientos,Amplia vista al mar, El acceso al Dpto puede ser autónomo gracias a una caja de seguridad para llaves. Puerto Velero cuenta con acceso restringido, amplia seguridad, piscinas, playa, jardines; restaurant a pocos metros para su comodidad. El precio del arriendo por noche, varia según fechas. Quedo atenta a cualquier otra inquietud.


En el primer piso del edificio junto a la piscina hay un Spa, el cual cuenta con sesiones de masajes, jacuzzi,  gimnasio y piscina temperada. El costo de los servicios se cobran  por separado, pero invito a mis huéspedes a traer su gorra de baño por si se les antoja ir al spa. ( y así evitar el costo del gorro en el interior del recinto)","['Acceso a la playa', 'Frente a la playa']",4.92,24,Daniela Belén,08-2017,https://www.airbnb.cl/rooms/38899917?adults=1&children=0&infants=0&pets=0&check_in=2023-02-28&check_out=2023-03-05&previous_page_section_name=1000&federated_search_id=7e6e9c40-c8c2-4937-b7e3-c53af200b0c2
132,Perfecto depto a pasos del mar,Vivienda rentada entero,La Serena,4,3,2, Habitación,2,privado,77.0,-29.9135,-71.2735,"https://maps.google.com/maps?ll=-29.9135,-71.2735&z=14&t=m&hl=es&gl=CL&mapclient=apiv3","Apartamento en condominio a pocos pasos de la Avenida del Mar, un paseo marítimo frente al mar, ubicado en el sector turístico más importante de La Serena, y a 15 minutos del centro cívico de la ciudad. Este departamento está ubicado donde la tranquilidad y la conectividad se unen en un solo lugar para darte todo lo que necesitas.","Departamento con espacios diseñados para que disfrutes cada momento, cocina integrada para que compartir, un amplio living comedor que se conecta a una gran terraza con baranda vidriada. Tiene dos dormitorios y dos baños, lo que hace ideal para disfrutar en familia o amigos. 
Además, la mejor ubicación para darle a tu vida acceso a todo lo que necesitas: playa, restaurantes y las principales vías de acceso a los atractivos turísticos de la zona, para que disfrutes de los mejores panoramas.",['Acceso a la playa'],,,Francisca,01-2023,https://www.airbnb.cl/rooms/805952478183993638?adults=1&children=0&infants=0&pets=0&check_in=2023-02-23&check_out=2023-03-02&previous_page_section_name=1000&federated_search_id=7e6e9c40-c8c2-4937-b7e3-c53af200b0c2
133,Hermoso Depto Jardín del Mar Frente a la Playa,Vivienda rentada entero,Coquimbo,4,3,2, Habitación,2,privado,65.0,-29.94556,-71.29095,"https://maps.google.com/maps?ll=-29.94556,-71.29095&z=14&t=m&hl=es&gl=CL&mapclient=apiv3",,"Departamento frente a la playa de Peñuelas en Avenida Costanera.

Totalmente equipado cuenta con estacionamiento interior y seguridad las 24 horas.

Apto para mascotas de tamaño pequeño.",['Cocina'],,,Mauricio,08-2018,https://www.airbnb.cl/rooms/599891707443229149?adults=1&children=0&infants=0&pets=0&check_in=2023-03-03&check_out=2023-03-08&previous_page_section_name=1000&federated_search_id=7e6e9c40-c8c2-4937-b7e3-c53af200b0c2
134,Jardin del Mar Departamento Av. del mar La Serena,Condo entero,Coquimbo,5,4,2, Habitación,2,privado,88.0,-29.9466,-71.292,"https://maps.google.com/maps?ll=-29.9466,-71.292&z=14&t=m&hl=es&gl=CL&mapclient=apiv3","Frente a la playa.
Barrio tranquilo.
A pasos de casino Enjoy de Coquimbo.
Cercano a restaurantes y pubs.
12 km de playa con calle y ciclovía.","- 2 dormitorios (ambos con closet).
- 2 baños.
- Dormitorio principal con cama queen.
- Segundo dormitorio con camarote y cama nido. 
- Cocina americana totalmente equipada, superficie de granito.
- Living y comedor.
- TV cable.
- Calefacción.
- Balcón con vista al mar.
- Malla de protección en el balcón.
- Internet.


Ubicado en el edificio Jardín del Mar.
Frente a la playa, ideal para caminar, restaurantes cercanos.",['Vista al océano'],4.84,19,Paola,08-2017,https://www.airbnb.cl/rooms/20192856?adults=1&children=0&infants=0&pets=0&check_in=2023-02-25&check_out=2023-03-02&previous_page_section_name=1000&federated_search_id=7e6e9c40-c8c2-4937-b7e3-c53af200b0c2
135,Dpto. Dúplex Full 1ra línea Pto. Velero (11 p.),Vivienda rentada entero,Tongoy,11,9,4, Habitación,"3,5",privado,262.0,-30.24376,-71.47842,"https://maps.google.com/maps?ll=-30.24376,-71.47842&z=14&t=m&hl=es&gl=CL&mapclient=apiv3","Lugar seguro y tranquilo, de clima templado y soleado.","Dpto. dúplex (120 m2) frente al mar. Equipado full para 11 personas, con 4 dormitorios y 4 baños, 2 terrazas (35 m2)

Sólo necesitas llevar tus sábanas y toallas.

El espacio
El Condominio PV cuenta con:
- Control acceso y guardias 24 hrs.
- Funicular a la playa
- Duchas en la playa
- Restaurantes (2)
- Playa semiprivada apta para bañarse.
- Piscinas agua dulce (8) y de mar (2)
- Canchas fútbol, baby, basket y tenis (10) 
- Cancha Golf Pitch & Putt (18 hoyos)
-Quinchos con agua y luz en Parque Nativo

Y en temporada alta:
- Gimnasio equipado
- Club Ecuestre
- Marina
- Recreación infantil",['Vista al océano'],4.43,40,Henry H O,05-2017,https://www.airbnb.cl/rooms/26598929?adults=1&children=0&infants=0&pets=0&check_in=2023-02-27&check_out=2023-03-04&previous_page_section_name=1000&federated_search_id=7e6e9c40-c8c2-4937-b7e3-c53af200b0c2
136,Departamento a metros de la Playa y Casino ENJOY,Vivienda rentada entero,Coquimbo,4,3,2, Habitación,2,privado,55.0,-29.9478,-71.29015,"https://maps.google.com/maps?ll=-29.9478,-71.29015&z=14&t=m&hl=es&gl=CL&mapclient=apiv3","Sector turístico de la cuarta región, tranquilo y con acceso controlado al condominio.","Increíble departamento nuevo con acceso controlado, ubicado a solo metros de la playa, bares, restaurantes y casino en sector Peñuelas. Totalmente equipado para días de relajo o  trabajo si prefieres. Incluye wifi, estacionamiento para vehículo y bicicletas,  uso de piscina, quincho, sala de juegos, lavandería, salón cerrado con cocina y comedor para su uso.","['Acceso a la playa', 'Frente a la playa']",4.67,6,Eric,04-2021,https://www.airbnb.cl/rooms/49270259?adults=1&children=0&infants=0&pets=0&check_in=2023-02-26&check_out=2023-03-03&previous_page_section_name=1000&federated_search_id=7e6e9c40-c8c2-4937-b7e3-c53af200b0c2
137,Hermoso departamento avenida del mar primera linea,Condo entero,Coquimbo,4,3,2, Habitación,2,privado,80.0,-29.95857,-71.30808,"https://maps.google.com/maps?ll=-29.95857,-71.30808&z=14&t=m&hl=es&gl=CL&mapclient=apiv3",,"Arriendo hermoso departamento  piso 18 con bella vista al mar completamente amueblado para 4 personas en primera linea de la avenida del mar, 2 dormitorios, 2 baños uno en suite, cocina americana, terraza, cable, wifi, estacionamiento, piscina, gimnasio, quincho, salón de eventos",['Cocina'],5.0,4,Gisella,01-2018,https://www.airbnb.cl/rooms/53956409?adults=1&children=0&infants=0&pets=0&check_in=2023-02-26&check_out=2023-03-05&previous_page_section_name=1000&federated_search_id=7e6e9c40-c8c2-4937-b7e3-c53af200b0c2
138,Departamento espectacular vista al mar,Condo entero,Coquimbo,6,4,3, Habitación,2,privado,51.864,-29.97871,-71.34666,"https://maps.google.com/maps?ll=-29.97871,-71.34666&z=14&t=m&hl=es&gl=CL&mapclient=apiv3",,"Departamento 3D/2B, 2 balcones con vista al mar, estacionamiento, piscina, juegos de niños.
Condominio cerrado con salida directa a playa la Herradura. Piso 8 de 10, con 2 ascensores y 3 departamentos por piso.
Frente a supermercado y con salida directa a la ruta 5 Panamericana.
Internet, Directv, cocina completamente equipada (cocina eléctrica, parrilla eléctrica, refrigerador, hervidor y utensilillos de cocina)

Por protocolo Covid los huéspedes tendrán que traer sus propias sábanas y toallas.","['Acceso a playa Privado', 'Frente a la playa']",5.0,24,Rosa,10-2021,https://www.airbnb.cl/rooms/52990997?adults=1&children=0&infants=0&pets=0&check_in=2023-03-12&check_out=2023-03-19&previous_page_section_name=1000&federated_search_id=7e6e9c40-c8c2-4937-b7e3-c53af200b0c2
139,Nuevo departamento en la Av. del mar en La Serena,Condo entero,La Serena,4,3,2, Habitación,2,privado,75.332,-29.91603,-71.27405,"https://maps.google.com/maps?ll=-29.91603,-71.27405&z=14&t=m&hl=es&gl=CL&mapclient=apiv3",,"Nuevo y hermoso departamento decorado con piezas únicas traídas desde Turquía, el departamento cuenta con 2 dormitorios y 2 baños, y una amplia terraza orientación norte con vista al mar. Existe lavandería de pago en el edificio junto con las siguientes áreas comunes: gimnasio, sala de juegos, jacuzzi, sauna, sala multiuso, sala de cine, piscinas temperada, normal y con olas. (Debido a la pandemia existen restricciones sanitarias para el uso de zonas comunes)",['Vista al horizonte de la ciudad'],5.0,18,Erika,10-2018,https://www.airbnb.cl/rooms/50707008?adults=1&children=0&infants=0&pets=0&check_in=2023-02-27&check_out=2023-03-04&previous_page_section_name=1000&federated_search_id=7e6e9c40-c8c2-4937-b7e3-c53af200b0c2
140,"Departamento de lujo, salida directa al mar, Nuevo",Vivienda rentada entero,Coquimbo,6,4,2, Habitación,2,privado,100.0,-29.98216,-71.35186,"https://maps.google.com/maps?ll=-29.98216,-71.35186&z=14&t=m&hl=es&gl=CL&mapclient=apiv3","Alrededor del edificio es residencial y tranquilo. A cuatro cuadras del edificio encontraras un completo minimarquet y tres restorant suchi, sandwich y de gastronomía en general.
Todo esto caminado desde tu departamento.
Si quieres una mayor variedad puedes dirigirte a la costanera que une Coquimbo y Serena con una gran variedad de restorant y entretencion.","Departamento Nuevo, vista al mar y panorámica soñada de la herradura de Coquimbo.
Luminoso, ambos dormitorios frente al mar. Ideal para descanso, vacaciones, familia y amigos.
Muebles cómodos, cocina full equipada. Dos baños con tina.
Puedes dar largas caminatas por la orilla de la playa, clima siempre agradable. Puedes hacer deportes en la playa y el mar.
También opción de dos grandes piscinas en el edificio, también sauna o jacuzzi.
Quinchos prente al mar y sercanos a la piscina.


Increible vista, comodo,luminoso.
 Ubicación estratégica para visitar las playas más hermosas de la región totoralillo, guanaquenos entre otros.
A minutos del casino enjoy y Puerto.","['Acceso a la playa', 'Frente a la playa']",4.82,28,Vale,02-2018,https://www.airbnb.cl/rooms/33244542?adults=1&children=0&infants=0&pets=0&check_in=2023-02-25&check_out=2023-03-03&previous_page_section_name=1000&federated_search_id=7e6e9c40-c8c2-4937-b7e3-c53af200b0c2
141,"Puerto Velero, Departamento frente al océano.",Condo entero,Coquimbo,6,5,3, Habitación,3,privado,160.0,-30.24542,-71.47066,"https://maps.google.com/maps?ll=-30.24542,-71.47066&z=14&t=m&hl=es&gl=CL&mapclient=apiv3","Puerto Velero es un Hermoso complejo turístico, ubicado a 45 km de la Serena, 3 km de Tongoy, con un agradable clima templado, que lo hace un buen lugar todo el año.","Amplio departamento en 1° linea frente al mar,  de  un completo condominio de los mas hermosos de la bahia de Tongoy; Jardines, piscinas de agua dulce y de mar, centro comercial,  actividades deportivas y artísticas para niños y adultos (meses de verano), restaurantes en la playa de reconocida calidad, estacionamiento náutico, canchas de golf, tenis y futboll, zona barbeque acogido por la naturaleza. Jacuzzi y piscina temperada con previa reserva (costo adicional), acceso privado a la playa.","['Acceso a la playa', 'Frente a la playa']",4.60,15,Karime,04-2011,https://www.airbnb.cl/rooms/35842325?adults=1&children=0&infants=0&pets=0&check_in=2023-03-01&check_out=2023-03-08&previous_page_section_name=1000&federated_search_id=7e6e9c40-c8c2-4937-b7e3-c53af200b0c2
142,"Hermoso depto., en primera línea con vista al mar.",Vivienda rentada entero,Coquimbo,6,5,2, Habitación,2,privado,70.0,-29.97922,-71.35082,"https://maps.google.com/maps?ll=-29.97922,-71.35082&z=14&t=m&hl=es&gl=CL&mapclient=apiv3","Condominio Playa Herradura es un lugar ideal para disfrutar solo o en familia, pensado para aquellos que desean escapar de lo ajetreado de la ciudad.
Salir al balcón, mirar la Bahía, disfrutar del aire marino, y el sonido de la playa es un momento único e inmejorable.","Hermoso departamento ubicado en  playa Herradura. Encontrarás todo lo necesario para desconectarte y pasar un agradable descanso. Cuenta con con acceso privado a la playa, piscina y acceso a Gym.

El espacio
Nuestro espacio está totalmente equipado como para hacerte sentir en casa, pero en un entorno exclusivo de descanso.",['Vista a la bahía'],4.95,43,Alejandro,01-2020,https://www.airbnb.cl/rooms/47213508?adults=1&children=0&infants=0&pets=0&check_in=2023-03-03&check_out=2023-03-09&previous_page_section_name=1000&federated_search_id=7e6e9c40-c8c2-4937-b7e3-c53af200b0c2
143,"Hermoso dpto, full a 1 cuadra de playa 4 esquinas.",Vivienda rentada entero,La Serena,4,3,2, Habitación,2,privado,60.0,-29.92398,-71.27431,"https://maps.google.com/maps?ll=-29.92398,-71.27431&z=14&t=m&hl=es&gl=CL&mapclient=apiv3","Excelente sector residencial, muy tranquilo y a pasos de la playa.","Departamento nuevo en sector 4 esquinas, a una cuadra de la playa. Está full equipado con todas las comodidades para hacer de tu estadía en La Serena un verdadero momento de relajo y placer! A pasos de la playa y de diversos bares y restaurantes, entre el casino Enjoy y el faro. Además, el edificio cuenta con piscina, quincho para asados, salón de eventos, sala de juegos y gimnasio.
El edificio está ubicado en una calle sin salida, por lo que la tranquilidad está asegurada.


Departamento nuevo, full equipado para 4 personas (2 habitaciones, 2 baños, con 1 en suite, cama matrimonial y cama nido), con tv por cable, una amplia terraza, a una cuadra de la playa 4 esquinas. El edificio cuenta con piscina, quinchos, gimnasio, sala de juegos y plaza para niños. Además hay lavandería.",['Costa'],4.75,17,Joceline,01-2016,https://www.airbnb.cl/rooms/24451684?adults=1&children=0&infants=0&pets=0&check_in=2023-02-24&check_out=2023-03-01&previous_page_section_name=1000&federated_search_id=7e6e9c40-c8c2-4937-b7e3-c53af200b0c2
144,EXCELENTE DEPARTAMENTO EQUIPADO EN PRIMERA LÍNEA,Vivienda rentada entero,La Serena,5,3,2, Habitación,2,privado,90.0,-29.9151,-71.2752,"https://maps.google.com/maps?ll=-29.9151,-71.2752&z=14&t=m&hl=es&gl=CL&mapclient=apiv3",,"Hermoso departamento nuevo, full equipado y frente al mar. Cuenta con 2 habitaciones y 2 baños, capacidad para 5 personas. Cuenta con TV, TV cable, e internet. Para mayor comodidad incluye ropa de cama y toallas de baño, además de productos para la limpieza. Cocina full equipada.

Ubicado en el mejor sector de Av. Del Mar, con restaurantes, pub, almacenes, farmacias, ciclovía, surf, entre muchos otros.
El edificio cuanta con 5 piscinas, las que incluyen: con olas, otra con barra y temperada.","['Acceso a la playa', 'Frente a la playa']",4.50,12,Matias,05-2018,https://www.airbnb.cl/rooms/47916140?adults=1&children=0&infants=0&pets=0&check_in=2023-02-26&check_out=2023-03-04&previous_page_section_name=1000&federated_search_id=8188c77a-7a7d-4f78-ab66-2006e3fd0578
145,"Puerto Velero, Departamento frente al océano.",Condo entero,Coquimbo,6,5,3, Habitación,3,privado,160.0,-30.24542,-71.47066,"https://maps.google.com/maps?ll=-30.24542,-71.47066&z=14&t=m&hl=es&gl=CL&mapclient=apiv3","Puerto Velero es un Hermoso complejo turístico, ubicado a 45 km de la Serena, 3 km de Tongoy, con un agradable clima templado, que lo hace un buen lugar todo el año.","Amplio departamento en 1° linea frente al mar,  de  un completo condominio de los mas hermosos de la bahia de Tongoy; Jardines, piscinas de agua dulce y de mar, centro comercial,  actividades deportivas y artísticas para niños y adultos (meses de verano), restaurantes en la playa de reconocida calidad, estacionamiento náutico, canchas de golf, tenis y futboll, zona barbeque acogido por la naturaleza. Jacuzzi y piscina temperada con previa reserva (costo adicional), acceso privado a la playa.","['Acceso a la playa', 'Frente a la playa']",4.60,15,Karime,04-2011,https://www.airbnb.cl/rooms/35842325?adults=1&children=0&infants=0&pets=0&check_in=2023-03-01&check_out=2023-03-08&previous_page_section_name=1000&federated_search_id=8188c77a-7a7d-4f78-ab66-2006e3fd0578
146,Despéjate en La Herradura con hermosa vista al mar,Condo entero,Coquimbo,5,2,2, Habitación,2,privado,90.0,-29.98346,-71.35302,"https://maps.google.com/maps?ll=-29.98346,-71.35302&z=14&t=m&hl=es&gl=CL&mapclient=apiv3","Supermercados, farmacias, tiendas, delivery, todo cerca pero en vehiculo por Sindempart.","Excelente vista al mar desde todo el departamento, en especial desde la terraza que incorpora una mesa de mármol. Departamento full equipado para 5 personas con: habitación principal con baño independiente y cama 2p, habitación secundaria cama 1/5p (nido 1p) + sofá cama en living. Incluye estacionamiento cubierto. Espacios de uso común como piscinas, gimnasio, lavandería y acceso directo a la playa con duchas exteriores. Cuenta con agua caliente, Wifi, conserjería, juegos infantiles y quinchos.


Agradable lugar con hermosa vista al mar, terraza con espacios para compartir. 2 dormitorios 2 baños (1 en suite) equipado para 5 personas. Llegar e instalarse a disfrutar.",['Vista a la bahía'],4.93,14,José Manuel,07-2021,https://www.airbnb.cl/rooms/50756574?adults=1&children=0&infants=0&pets=0&check_in=2023-02-24&check_out=2023-03-01&previous_page_section_name=1000&federated_search_id=8188c77a-7a7d-4f78-ab66-2006e3fd0578
147,"Edificio Oceanic, vista frontal al mar",Vivienda rentada entero,La Serena,5,4,2, Habitación,2,privado,80.0,-29.92043,-71.27491,"https://maps.google.com/maps?ll=-29.92043,-71.27491&z=14&t=m&hl=es&gl=CL&mapclient=apiv3",La zona es residencial y tranquila. Al sur de cuatro esquinas hay mas restaurantes y bares/pubs a los que puedes visitar y caminar a casa en forma segura.,"El depto está ubicado en Avda del Mar (La Serena) cerca de cuatro esquinas y tiene dos dormitorios, dos baños, living comedor, cocina y terraza de mas de 5mts con cierre plegable con una amplia vista al mar. Incluye un estacionamiento y TV satelital. 3 camas (1 x dormitorio principal & 2 x dormitorio secundario) , un sofá cama, TV LCD47 y escritorio.

El espacio
El departamento està  ubicado en una zona tranquila y cerca de cuatro esquinas que conecta el departamento rápidamente con la carretera. Muy cerca hay minisupermercado, tiendas de abarrotes, diarios etc.",['Vista a la bahía'],4.80,16,Eduardo Arturo,02-2016,https://www.airbnb.cl/rooms/11006744?adults=1&children=0&infants=0&pets=0&check_in=2023-03-01&check_out=2023-03-06&previous_page_section_name=1000&federated_search_id=8188c77a-7a7d-4f78-ab66-2006e3fd0578
148,Departamento Playa La Herradura,Vivienda rentada entero,Coquimbo,4,3,2, Habitación,2,privado,75.0,-29.9812,-71.35073,"https://maps.google.com/maps?ll=-29.9812,-71.35073&z=14&t=m&hl=es&gl=CL&mapclient=apiv3",Sector muy tranquilo. Todo cercano.,"Departamento con excelente ubicación, salida directa a la playa la herradura, cerca del supermercado, carretera, hospital, centro la herradura. Bien equipado, con todo lo necesario para tener una cómoda y la mejor estadía.

El espacio
Lugar acogedor, muy bien decorado para sentirse en casa.","['Acceso a la playa', 'Frente a la playa']",5.0,6,Barbara,10-2015,https://www.airbnb.cl/rooms/40142520?adults=1&children=0&infants=0&pets=0&check_in=2023-02-24&check_out=2023-03-01&previous_page_section_name=1000&federated_search_id=8188c77a-7a7d-4f78-ab66-2006e3fd0578
149,"Avenida del Mar, La Serena, espectacular depto.",Vivienda rentada entero,Coquimbo,5,4,2, Habitación,2,privado,89.667,-29.94397,-71.29067,"https://maps.google.com/maps?ll=-29.94397,-71.29067&z=14&t=m&hl=es&gl=CL&mapclient=apiv3",,"Departamento cómo nuevo con una espectacular vista a la Bahía desde el piso 15. Cuenta con dos dormitorios y dos baños, cocina full equipada y amplia terraza, posee calefacción y ventanas de termopanel. Condominio con acceso controlado, ascensor panorámico, cuenta con amplias piscinas, quinchos en azotea con vista panorámica, sauna, piscina temperada, tinas de hidromasaje y baños de vapor, sin dudas un edificio con las más altas prestaciones.",['Cocina'],4.36,12,Urbi,11-2015,https://www.airbnb.cl/rooms/35276260?adults=1&children=0&infants=0&pets=0&check_in=2023-03-01&check_out=2023-03-07&previous_page_section_name=1000&federated_search_id=8188c77a-7a7d-4f78-ab66-2006e3fd0578
