,Titulo1,Titulo2,Comuna,Capacidad,Camas,N_Habitaciones,Habitaciones,Baños,Tipo_Baños,Precio,lat,lon,Ubicacion,Ubides,Descripcion,Servicios,Nota,Nnota,Anfitrion,Registro,Link
72,Hermosa Casa Guanaqueros frente al mar con piscina,Chalé entero,Guanaqueros,8,5,3, Habitación,2,privado,327.143,-30.19638,-71.41802,"https://maps.google.com/maps?ll=-30.19638,-71.41802&z=14&t=m&hl=es&gl=CL&mapclient=apiv3","La casa esta en un sector muy tranquilo, en un barrio residencial.","Hermosa Casa frente al mar, con excelente vista, inmejorable ubicación y en el mejor sector de la bahía. Se encuentra recién remodelada, totalmente amoblada y equipada, con todo lo necesario para que tengas una estadía espectacular. 

Posee un precioso jardín, piscina, jacuzzi, parrilla para asados, juegos infantiles y estacionamiento para 4 autos


La playa está enfrente a menos de 2 minutos caminando.","['Acceso a la playa', 'Frente a la playa']",4.0,4,Anita,07-2014,https://www.airbnb.cl/rooms/18360166?adults=1&children=0&infants=0&pets=0&check_in=2023-02-26&check_out=2023-03-05&previous_page_section_name=1000
73,Casa totalmente equipada para 16 personas,Casa de campo entero,Guanaqueros,Más de 16,16,6, Habitación,4,privado,144.0,-30.21148,-71.41828,"https://maps.google.com/maps?ll=-30.21148,-71.41828&z=14&t=m&hl=es&gl=CL&mapclient=apiv3",,"Casa en parcela a 2 minutos de la playa en auto, con todas las comodidades, necesarias para unas vacaciones inolvidables en familia. posee Parrilla, dos terrazas exteriores, lavadora, secadora de ropa,. dos refrigeradores y una gran isla en la cocina para cocinar cómodamente. Sus 6 dormitorios y 4 baños, con uno exterior harán de tu estadía un momento de disfrute

El espacio
Casa en parcela, con  6 dormitorios, 4 baños (uno exterior) y dos terrazas exteriores",['Acceso la playa Público o compartido'],,,Hernán,12-2018,https://www.airbnb.cl/rooms/31086077?adults=1&children=0&infants=0&pets=0&check_in=2023-02-20&check_out=2023-02-26&previous_page_section_name=1000
74,Arriendo mi casa en Puerto Velero,Alojamiento entero,Puerto Velero,12,12,4, Habitación,4,privado,251.429,-30.24523,-71.47922,"https://maps.google.com/maps?ll=-30.24523,-71.47922&z=14&t=m&hl=es&gl=CL&mapclient=apiv3",,La decoración es moderna.Comedor y lámparas de finas maderas.Baños modernos.Camas principales muy cómodas Todo impecable para 12 personas,['Cocina'],,,Maria,08-2019,https://www.airbnb.cl/rooms/38950854?adults=1&children=0&infants=0&pets=0&check_in=2023-02-26&check_out=2023-03-05&previous_page_section_name=1000
75,Casa amplia playa la herradura,Alojamiento entero,Coquimbo,6,5,3, Habitación,2,privado,100.0,-29.97647,-71.34325,"https://maps.google.com/maps?ll=-29.97647,-71.34325&z=14&t=m&hl=es&gl=CL&mapclient=apiv3",Casa cercana a supermecados y bencineras,"Casa amplia y cómoda para 6  personas, a pasos de playa la herradura, supermercados y ruta 5 norte. Barrio residencial y tranquilo, 3 dormitorios, dos baños, terraza con vista al mar, 2 estacionamientos

El espacio
Casa amplia y cómoda a pasos de playa la Herradura",['Acceso la playa Público o compartido'],,,Ignacio,01-2018,https://www.airbnb.cl/rooms/40366167?adults=1&children=0&infants=0&pets=0&check_in=2023-03-01&check_out=2023-03-06&previous_page_section_name=1000
76,Habitacion con cama nido para eclipse total 2019,Habitación privada en alojamiento,La Serena,2,4,2, Habitación,"2,5",privado,25.0,-29.93428,-71.2412,"https://maps.google.com/maps?ll=-29.93428,-71.2412&z=14&t=m&hl=es&gl=CL&mapclient=apiv3",,,['Cocina'],,,Paula,01-2017,https://www.airbnb.cl/rooms/33494924?adults=1&children=0&infants=0&pets=0&check_in=2023-02-14&check_out=2023-02-19&previous_page_section_name=1000
77,Bahía Pichidangui,Alojamiento entero,Los Vilos,7,6,3, Habitación,2,privado,105.0,-32.14033,-71.51928,"https://maps.google.com/maps?ll=-32.14033,-71.51928&z=14&t=m&hl=es&gl=CL&mapclient=apiv3",,"Cómoda casa con vista al mar, equipada para 9 personas, tv cable, parrilla para asados,2 terrazas, hamacas
Ubicada en la bahía de Pichidangui",['Cocina'],4.80,5,Lorena,10-2018,https://www.airbnb.cl/rooms/41349380?adults=1&children=0&infants=0&pets=0&check_in=2023-02-27&check_out=2023-03-05&previous_page_section_name=1000
78,Casa amplia cerca de la Universidad de La Serena,Alojamiento entero,La Serena,4,2,2, Habitación,1,privado,42.0,-29.91478,-71.24673,"https://maps.google.com/maps?ll=-29.91478,-71.24673&z=14&t=m&hl=es&gl=CL&mapclient=apiv3",El vecindario es tranquilo y seguro. Hay varios negocios al rededor. La locomoción pública pasa frente a la casa.,"Casa grande recién remodelada, en un barrio tranquilo y seguro de La Serena.Tiene 2 dormitorios amplios y un baño en el segundo piso. Cocina nueva full equipada (refrigerador, microondas,cocina c/horno,hervidor,etc),living-comedor,sofá,mesa y sillas para 6 personas, terraza y patio grande.Frente a la casa pasa el transporte público.Hay varios negocios pequeños en la misma cuadra,supermercados a 10 minutos caminando, 2 farmacias a un par de cuadras, gasolinera y restaurantes muy cerca de la casa.


El living comedor y terraza tienen piso de madera recién restaurado. Está recién pintado. Puertas y ventanas son de madera. Los dormitorios y baño están en el segundo piso, también recién remodelados. Cada dormitorio tiene una cama de 2 plazas y 2 veladores con lámparas cada uno. Los cobertores, almohadas y sábanas son nuevas.",['Vista al jardín'],,,Carla,02-2018,https://www.airbnb.cl/rooms/693261271048677782?adults=1&children=0&infants=0&pets=0&check_in=2023-04-09&check_out=2023-04-14&previous_page_section_name=1000
79,Casa Top en Puerto Velero,Alojamiento entero,Puerto Velero,10,12,5, Habitación,6,privado,350.0,-30.244,-71.47888,"https://maps.google.com/maps?ll=-30.244,-71.47888&z=14&t=m&hl=es&gl=CL&mapclient=apiv3",,"Vista privilegiada a la bahía, 1200 metros de jardín,accesos controlados con guardias privados, 4 dormitorios para 10 personas, mas servicio,estacionamiento 5 autos, full equipada, 2 kayacs, resort con cancha golf par 3 de 18 hoyos, piscinas, canchas tenis, futbol, marina para lanchas y veleros, mini market,restoranes, gimnasio

El espacio
Casa de altísimo estándar, excelentemente equipada y decorada, extraordinario jardín y privilegiada vista a la bahía y playa. Casa 2 pisos con 2 dormitorios con baño en suit, mas 2 dormitorios con 3 camas cada uno, pieza niños y niñitas. Dormitorio adicional de servicio o para jóvenes, con camarote y baño en suit. Mejor alternativa en el Resort",['Vista al jardín'],4.82,11,Juan Pablo,08-2014,https://www.airbnb.cl/rooms/13585395?adults=1&children=0&infants=0&pets=0&check_in=2023-03-01&check_out=2023-03-08&previous_page_section_name=1000
80,"Amplia Casa a 10 minutos de la playa, en zona alta",Alojamiento entero,La Serena,6,4,3, Habitación,"2,5",privado,89.25,-29.93694,-71.2478,"https://maps.google.com/maps?ll=-29.93694,-71.2478&z=14&t=m&hl=es&gl=CL&mapclient=apiv3","La casa está en una villa de pocas casas, consolidada, que dispone de una plaza pequeña, muy bonita, con juegos para niños y máquinas de ejercicios.
Desde la plaza y desde la casa se puede ver el mar en toda su extensión.","Lugares de interés: Avenda del Mar, La Recova, Valle de Elqui, Tranque Puclaro, Ferias artesanales, visitas a pisqueras, restaurantes y comida, increíbles vistas, actividades en familia, la playa, arte y cultura. 
Te va a encantar mi lugar debido a el espacio acogedor, los colores, lo iluminado, la ubicación, la tranquilidad, las vistas y la comodidad en general. Mi alojamiento es bueno para familias (con hijos), grupos grandes y mascotas. Plaza propia de la villa, ideal para niños.


La casa es de 2 pisos, de unos 130 M2 aproximadamente
Dispone de tres habitaciones:
1 Habitación en primer piso con Cama Matrimonial
1 Habitación en segundo piso con Cama Matrimonial
1 Habitación en segundo piso con 2 camas de 1 1/2 plaza.
2 baños completos en primer piso
1 medio baño en segundo piso
En total es para 6 huéspedes.
Dispone de un estacionamiento interior.
Living, comedor y cocinas separados.
terraza en primer piso con mesa y sillas para 6 personas.
1 quincho pequeño en obra en la terraza auxiliar.
Utensilios de cocina.
Lavadora
Wifi Movistar",['Acceso la playa Público o compartido'],5.0,6,Erik,08-2016,https://www.airbnb.cl/rooms/14586263?adults=1&children=0&infants=0&pets=0&check_in=2023-02-17&check_out=2023-02-22&previous_page_section_name=1000
81,Hospedaje Aros Beltrán alojamiento partido,Alojamiento entero,Ovalle,9,5,6, Habitación,"2,5",privado,38.0,-30.61343,-71.21155,"https://maps.google.com/maps?ll=-30.61343,-71.21155&z=14&t=m&hl=es&gl=CL&mapclient=apiv3",,,['Cocina'],,,Claudia,01-2019,https://www.airbnb.cl/rooms/36211293?adults=1&children=0&infants=0&pets=0&check_in=2023-03-01&check_out=2023-03-07&previous_page_section_name=1000
82,"Espectacular casa con vista al mar, los Molles.",Alojamiento entero,La Ligua,11,10,4, Habitación,3,privado,270.0,-32.20462,-71.51374,"https://maps.google.com/maps?ll=-32.20462,-71.51374&z=14&t=m&hl=es&gl=CL&mapclient=apiv3","La casa se encuentra en un condominio, ""Rocas del Mar"". Las casas están en terrenos de 5.000 m2. El lugar es muy tranquilo y las casas bastante aisladas unas de otras. Existe seguridad por parte del condominio.","Espectacular casa de Playa en Condominio Rocas del Mar a 188 km de Santiago. La casa cuenta con una gran vista al mar, muy espaciosa y tiene capacidad para 11 personas. Cuenta con piscina, jacuzzi eléctrico, quincho, disco a gas, cama elástica, casa de juego y cajón de arena para niños, fogón, ducha exterior para cuando llegas de la playa.
Condominio cuenta con plaza de juegos, seguridad, cancha de padel, fútbol y volei playa sin costo, además de circuitos de treking, bicicleta y enduro.


Casa de 215 m2 útiles en terreno de 5.000 m2. Cuenta con logia y patio de servicio separada de la casa. La casa tiene 4 piezas todas de muy buen tamaño siendo la pieza principal muy amplia con baño dentro de ella. Todas las piezas tienen vista al mar. La casa esta separada en 2 ambientes, en el primero hay 2 piezas con 2 baños y en el segundo 2 piezas con 1 baño, entre medio de estos espacios esta el living/salita, comedor y cocina, estos últimos espacios se calientan con bosca a leña. El comedor se une a la terraza donde hay un gran quincho con spiedo incluido y el quincho esta dentro de un espacio en donde comparte con una terraza, un fogón y una ducha exterior que es de agua caliente.",['Acceso la playa Público o compartido'],,,Jaime,04-2016,https://www.airbnb.cl/rooms/751460282901558360?adults=1&children=0&infants=0&pets=0&check_in=2023-04-01&check_out=2023-04-06&previous_page_section_name=1000
83,Morrillos Casa nueva en condominio 6 camas C4Norte,Alojamiento entero,Coquimbo,7,5,2, Habitación,2,privado,230.0,-30.12524,-71.36907,"https://maps.google.com/maps?ll=-30.12524,-71.36907&z=14&t=m&hl=es&gl=CL&mapclient=apiv3","Casa frente al mar - Playa Morrillos.
Condominio privado con seguridad y portón eléctrico.
A 10 minutos a pie se encuentra reserva ecología Humedal Adelaida, lugar de avistamiento de aves","Casa en condominio privado con grato ambiente familiar de descanso, playa y desconexión de la ciudad. Portón eléctrico y cuidador 24hrs. A pasos de la playa!

15 minutos de Guanaqueros y Coquimbo (Supermercados, Casino, tiendas y aeropuerto). 

Casa full equipada para 6 personas. 2 habitaciones, 2 baños (principal en suit), cocina americana integrada y terraza.  105m2 de construcción solida, terraza de 50 m2 con semi sombra, 2 estacionamientos.


2 casas nuevas contiguas, ventanas de termopanel y cortinas roller para máximo confort. Cada casa tiene 2 piezas, 2 baños, logia, cocina americana integrada y 2 estacionamientos.

Lugar full equipado con ropa de cama, toallas, enseres de cocina, horno eléctrico y a gas, lavavajillas, parrilla, con logia particular y lavandería compartida.

Agua de la llave no apta para consumo, dispensadores de bidones de agua en el lugar.

Para grupos familiares grandes, se pueden arrendar las 2 casas al mismo tiempo y hacer uso de del complejo completo (para uso de 12-14personas). Cada casa tiene 4 camas + matrimonial + sofá cama = 7

VISTAS AL MAR DESDE TODO EL LUGAR",['Acceso a la playa'],5.0,3,Jose Tomas,06-2017,https://www.airbnb.cl/rooms/47370921?adults=1&children=0&infants=0&pets=0&check_in=2023-02-27&check_out=2023-03-06&previous_page_section_name=1000
84,"Casa Playa , La Puntilla de las Mostazas",Alojamiento entero,Coquimbo,8,4,4, Habitación,"3,5",privado,490.0,-30.1555,-71.3729,"https://maps.google.com/maps?ll=-30.1555,-71.3729&z=14&t=m&hl=es&gl=CL&mapclient=apiv3",CONDOMINIO EXCLUSIVO EN LA PLAYA,"CASA NUEVA EN CONDOMINIO EXCLUSIVO ,  ""LA PUNTILLA DE LAS MOSTAZAS "" SECTOR EXCLUSIVO , CON PLAYA A 100 MTS , VISTA PANORÁMICA , EXTREMADAMENTE  FUNCIONAL Y CÓMODA. CUENTA CON DOS COCINAS , UNA INCORPORADA EN LIVING COMEDOR . WIFI , NETFLIX .  MUY ILUMINADA Y ASOLEADA . TIENE UN HERMOSO QUINCHO ,PISCINA, Y UN EXQUISITO FOGÓN CON VISTA AL MAR .

El espacio
LA VISTA ,  LA UBICACIÓN , LO EQUIPADA DE LA CASA PARA DISFRUTAR .",['Acceso a la playa'],,,Galie,05-2019,https://www.airbnb.cl/rooms/34679853?adults=1&children=0&infants=0&pets=0&check_in=2023-02-26&check_out=2023-03-04&previous_page_section_name=1000
85,Casa segundo piso 120milpesoscap.12personas,Habitación privada en alojamiento,La Serena,15,12,6, Habitación,"1,5compartidos",compartido,170.0,-29.8984,-71.264,"https://maps.google.com/maps?ll=-29.8984,-71.264&z=14&t=m&hl=es&gl=CL&mapclient=apiv3",,"La casa está equipada completa con una cama nido en cada dormitorio ,escaldesono ,velador,closet , escritorio,silla 
, ropa de cama cubre colchón impermeable
La casa también equipada completa
También cuenta con juegos de mesa ,una consola de arcade y mesa de Poolina 
  Cuenta con un balcón trasero con parrilla a carbon y a gas",['Cocina'],,,Rodrigo,12-2017,https://www.airbnb.cl/rooms/754526152065122704?adults=1&children=0&infants=0&pets=0&check_in=2023-02-21&check_out=2023-02-26&previous_page_section_name=1000
86,"Casa en La Herradura, Coquimbo",Alojamiento entero,Coquimbo,4,2,2, Habitación,2,privado,89.5,-29.98997,-71.36284,"https://maps.google.com/maps?ll=-29.98997,-71.36284&z=14&t=m&hl=es&gl=CL&mapclient=apiv3","Barrio residencial, seguro, cercano a carabineros, bomberos, plaza, almacenes, restaurant, fácil acceso a la playa","Tiene una vista espectacular a la bahía, una terraza increíble, fogón zona de asado, cercana a carabineros, bomberos, almacenes, locomoción, restaurantes, se puede ir caminando a la playa, la casa es comodisima y con muy buena aislacionista térmica, todas las piezas y living tienen vista, la cocina y living son grandes, la pieza principal es en suite y lo demás lo descubren ustedes.
Es un barrio residencial muy seguro, tranquilo y se vive una vida muy grata, todo el entorno es bonito.


a 600 metros de la playa",['Cocina'],,,Rafael,06-2019,https://www.airbnb.cl/rooms/36001377?adults=1&children=0&infants=0&pets=0&check_in=2023-02-26&check_out=2023-03-03&previous_page_section_name=1000
87,Mirador del Valle,Casa de campo entero,Coquimbo,8,4,3, Habitación,2,privado,192.714,-29.90398,-71.17515,"https://maps.google.com/maps?ll=-29.90398,-71.17515&z=14&t=m&hl=es&gl=CL&mapclient=apiv3","Hermoso sector, natural","Recinto familiar vacacional ‘’Mirador del Valle’’
Hermoso lugar, muy tranquilo.
Ideal para venir a descansar y disfrutar en familia
En la cabaña maximo 8 personas.
En caso de ser más personas existe la posibilidad de utilizar una habitación independiente, se cobra  $25.000 diarios por persona, con tope de 4 personas extras.


Rodeado de naturaleza, sector muy tranquilo, cercano a negocios (5 min en auto)",['Cocina'],3.67,3,Luz,06-2019,https://www.airbnb.cl/rooms/35317103?adults=1&children=0&infants=0&pets=0&check_in=2023-02-14&check_out=2023-02-21&previous_page_section_name=1000
88,"Eclipse Solar 2019 Chile - La Serena, alojamiento",Habitación privada en cabaña,La Serena,4,3,2, Habitación,2,privado,30.0,-29.99293,-71.0574,"https://maps.google.com/maps?ll=-29.99293,-71.0574&z=14&t=m&hl=es&gl=CL&mapclient=apiv3","entorno completamente agricola y recidencial, observatorios cerca,","Cabaña de familia ubicada a 15KM de la serena chile y a 5 minutos del aeropuerto nacional.
amplio panorama para visualizar los cielos mas limpios del mundo.  y tener una experiencia con el eclipse solar 2019
en este espacio a demas de alojarte existe un programa para el dia del eclipse que constara de recreacion dirigida desayunos chilenos  campestres , almuerzo buffet, coktailes.
La cabaña es calida, facil acceso.


Nuestros espacios cuentan con amplias zonas verdes, zona de descanso para disfrutar del maravilloso entorno que ofrece la naturaleza, dando así una tranquilidad acogedora para hacer de su viaje una experiencia inolvidable.",['Cocina'],,,Andrea,05-2019,https://www.airbnb.cl/rooms/34601999?adults=1&children=0&infants=0&pets=0&check_in=2023-02-14&check_out=2023-02-19&previous_page_section_name=1000
89,Danivis S.P.A,Habitación privada en alojamiento,La Serena,1,9,7, Habitación,3compartidos,compartido,32.514,-29.90087,-71.26071,"https://maps.google.com/maps?ll=-29.90087,-71.26071&z=14&t=m&hl=es&gl=CL&mapclient=apiv3","imagina, vivir rodeado de parques y plazas, en una ubicación excepcional, a pasos de los principales atractivos de la ciudad, como universidades , centros comerciales , playas y todo con una conectividad inmejorable .tu estadía en La Serena comienza en alojamiento Danivis SPA Reserva","Porque hemos pensado en ustedes, hemos preparado cuidadosamente esta casa , justo lo que necesitas para una estadía inolvidable entretenida y muy acogedora.
Tenemos una tranquila y placentero hostel que cuentan con baños privados y compartidos, limpios y desinfectados toallas y desayuno incluido.
nos ubicamos en un Barrio cerca de todo lo que desees conocer a 5 minutos de la histórica ciudad  ""La Serena"", a 10 minutos de la playa, donde te espera nuestro eficiente personal bilingüe de la ciudad.


 

""El corazón de la casa ¡su gran salón! es un espacio abierto para los turistas con vista a un gran patio , donde se encuentra la asadera para disfrutar con amigos , o con tu desees perfecto para pasar tiempo en familia. Siéntate en el sofá y deja que el sol entre por los grandes ventanales mientras lees un libro de nuestra pequeña biblioteca y los niños juegan a los divertidos juegos de mesa que proporcionamos. Si el tiempo no acompaña, podréis estar en casa viendo una película en la tele de la sala ¡lo tenéis todo! El salón se encuentra en la planta principal, separado de la cocina . ","['Acceso a la playa', 'Frente a la playa']",4.50,12,Viviana,09-2017,https://www.airbnb.cl/rooms/20947910?adults=1&children=0&infants=0&pets=0&check_in=2023-02-14&check_out=2023-02-21&previous_page_section_name=1000
90,Arriendo Casa en Puerto Velero,Habitación privada en alojamiento,Puerto Velero,8,8,4, Habitación,3,privado,0.0,-30.24187,-71.47483,"https://maps.google.com/maps?ll=-30.24187,-71.47483&z=14&t=m&hl=es&gl=CL&mapclient=apiv3","Spa, golf, juegos niños, supermercado, cafe, piscinas, playa, restaurant, quinchos y canchas de futbol y tenis.","Casa muy comoda y funcional. Gran terraza con vista espectacular a bahia Tongoy . Quincho y zona de juegos de niños en hermoso Jardin, emplazado en las dunas de Pto. Velero. Acceso a  todos los servicios y actividades de condominio, piscinas, golf, futbol, tenis, y otros.

Acceso de los huéspedes
Juego de ñiños y jardin",['Cocina'],4.33,4,Victor,12-2017,https://www.airbnb.cl/rooms/22087426?adults=1&children=0&infants=0&pets=0&check_in=2023-03-01&check_out=2023-03-08&previous_page_section_name=1000
91,Casa llanos,Habitación privada en alojamiento,Ovalle,4,3,3, Habitación,1compartido,compartido,20.0,-30.58719,-71.19921,"https://maps.google.com/maps?ll=-30.58719,-71.19921&z=14&t=m&hl=es&gl=CL&mapclient=apiv3",,"Casa particular con cómodos espacios, tres habitaciones disponibles con baño compartido, servicio de lavandería, estacionamiento, sala común, televisión en habitaciones, si se desea se puede ofrecer servicio de alimentación o las personas pueden cocinas si lo desean",['Cocina'],,,Carlos,09-2018,https://www.airbnb.cl/rooms/28832131?adults=1&children=0&infants=0&pets=0&check_in=2023-02-14&check_out=2023-02-21&previous_page_section_name=1000
92,Casa en Pichidangui vista al mar,Alojamiento entero,Pichidangui,6,5,3, Habitación,"2,5",privado,62.0,-32.14127,-71.52116,"https://maps.google.com/maps?ll=-32.14127,-71.52116&z=14&t=m&hl=es&gl=CL&mapclient=apiv3",,"Agradable casa con vista al mar y al bosque, frente al humedal, varias habitaciones, apta familias o grupo de amigos. Cuenta con cocina equipada, terraza con vista y pequeño jardín.",['Cocina'],4.64,11,Claudia,12-2013,https://www.airbnb.cl/rooms/10206205?adults=1&children=0&infants=0&pets=0&check_in=2023-04-01&check_out=2023-04-06&previous_page_section_name=1000
93,HABITACIONES para cuatro personas,Habitación privada en alojamiento,La Serena,4,3,2, Habitación,1compartido,compartido,80.0,-29.9284,-71.2469,"https://maps.google.com/maps?ll=-29.9284,-71.2469&z=14&t=m&hl=es&gl=CL&mapclient=apiv3","Barrio residencial, tranquilo y bello. Ubicado en sector residencial de La Serena, cercano al mall y la playa, hay muy buena conectividad. Comercio cercano. Buena locomocion. (Ver foto).
Consta con dos mini plazas o areas verdes para esparcimiento. (Cancha de baby foot.ball","LA SERENA: Dos habitaciones en amplia casa, para cuatro personas con niños desde 3 años. Baño independiente con agua caliente. Con Wi-Fi. Quincho con refrigerador, asador a gas y con Máquinas de ejercicios: Trotadora eléctrica y Maquina Home Gym multigimnasia.

El espacio
Comparte nuestra casa, somos un matrimonio de Odontólogos con un hijo de 10 años y nana. Dos habitaciones en amplia casa, para cuatro personas con niños desde 3 años. Baño independiente con agua caliente. Con Wi-Fi. Quincho con refrigerador, asador a gas y con Máquinas de ejercicios: Trotadora eléctrica y Maquina Home Gym multigimnasia.",['Cocina'],,,Juanhoracio,02-2017,https://www.airbnb.cl/rooms/22206335?adults=1&children=0&infants=0&pets=0&check_in=2023-03-01&check_out=2023-03-08&previous_page_section_name=1000
94,Hermosa casa con espectacular vista al mar.,Casa de campo entero,Tongoy,9,9,4, Habitación,2,privado,150.0,-30.2513,-71.50096,"https://maps.google.com/maps?ll=-30.2513,-71.50096&z=14&t=m&hl=es&gl=CL&mapclient=apiv3","Parte alta de Tongoy, con pocos vecinos, se puede recorrer caminando todo el sector para disfrutar del paisaje.","Desconecta de tus preocupaciones y descansa en este hermoso lugar con vista panorámica hacia la playa grande de Tongoy, en una casa amplia, cómoda, rodeada de hermosos jardines y una amplia terraza  que invita a  disfrutar de la vista, el descanso y el relajo.

El espacio
Casa grande, de madera, con vigas a la vista, habitaciones espaciosas cada una con sus closets, habitación principal en suite y walking closet.  Baños completos, lavandería independiente, gran terraza, patio, todo con vista al mar.  Alarma de seguridad.",['Acceso la playa Público o compartido'],,,Katrina,06-2019,https://www.airbnb.cl/rooms/53571192?adults=1&children=0&infants=0&pets=0&check_in=2023-06-01&check_out=2023-06-06&previous_page_section_name=1000
95,"Morrillos, La Serena",Alojamiento entero,La Serena,6,4,3, Habitación,3,privado,530.644,-30.14309,-71.36983,"https://maps.google.com/maps?ll=-30.14309,-71.36983&z=14&t=m&hl=es&gl=CL&mapclient=apiv3",,"Para contemplar y disfrutar el Pacífico. Aislada sobre la duna entre Las Tacas y Morrillos,  vista 360 grados, 3 suites con patios interiores privados. La playa  con acceso directo, construida 2016.  Todas las comodidades necesarias. WIFI, barbecue, DirectTV, alarma, reposeras, sombrillas.

Acceso de los huéspedes
Acceso controlado con portero y vigilancia.","['Acceso a la playa', 'Frente a la playa']",,,Eugenio,06-2014,https://www.airbnb.cl/rooms/8684750?adults=1&children=0&infants=0&pets=0&check_in=2023-03-01&check_out=2023-03-07&previous_page_section_name=1000
96,"Casa en La Serena, Sector tranquilo y central.",Alojamiento entero,La Serena,6,5,3, Habitación,2,privado,35.0,-29.94491,-71.26722,"https://maps.google.com/maps?ll=-29.94491,-71.26722&z=14&t=m&hl=es&gl=CL&mapclient=apiv3",,"Casa ubicada en condominio, cuidad de La Serena, Chile. Cuenta con conserje y espacios comunes. Dos estacionamientos privados, supermercado a 1 minuto en vehículo, bencinera al lado del condominio, restaurant Peruano frente al condominio, playa y casino de juegos, discotecas y bares a 7 minutos en vehículo, a 15 minutos del centro y casco histórico de la cuidad, a 15 minutos de la cuidad de Coquimbo. Locomoción colectiva y pública en frente del condominio. Acogedora, sector residencial, Wifi.",['Cocina'],4.80,5,Nicole Valy,11-2018,https://www.airbnb.cl/rooms/29965609?adults=1&children=0&infants=0&pets=0&check_in=2023-04-01&check_out=2023-04-06&previous_page_section_name=1000
