,Titulo1,Titulo2,Comuna,Capacidad,Camas,N_Habitaciones,Habitaciones,Ba침os,Tipo_Ba침os,Precio,lat,lon,Ubicacion,Ubides,Descripcion,Servicios,Nota,Nnota,Anfitrion,Registro,Link
158,Casa Puertas del mar La Serena.,Alojamiento entero,La Serena,6,3,3, Habitaci칩n,2,privado,55.0,-29.9017,-71.2693,"https://maps.google.com/maps?ll=-29.9017,-71.2693&z=14&t=m&hl=es&gl=CL&mapclient=apiv3",,"Tu familia estar치 cerca de todo si te hospedas en este alojamiento c칠ntrico.
Casa acogedora en un sector residencial con excelente conectividad.
Lugar sencillo y tranquilo.
Equipada para una familia con grato ambiente.
Se aceptan mascotas.",['Cocina'],,,Carolina,01-2022,https://www.airbnb.cl/rooms/808168552581200247?adults=1&children=0&infants=0&pets=0&check_in=2023-02-25&check_out=2023-03-02&previous_page_section_name=1000
159,Arriendo amplia y c칩moda casa por d칤as,Alojamiento entero,Elqui,8,6,3, Habitaci칩n,1,privado,80.991,-29.98225,-71.34386,"https://maps.google.com/maps?ll=-29.98225,-71.34386&z=14&t=m&hl=es&gl=CL&mapclient=apiv3",,"Lleva a toda la familia a este fant치stico lugar c칠ntrico a pasos de playa la herradura, supermercados, locales y locomoci칩n. Sector seguro. 
Consta de 2 smartv, internet, cable, lavadora, microondas y todo lo comodo de estar en casa

El espacio
Casa principal en terreno compartido con otra propiedad (primer nivel correspondiente al arriendo)",['Acceso a la playa'],,,Valeria,02-2020,https://www.airbnb.cl/rooms/797797485946805488?adults=1&children=0&infants=0&pets=0&check_in=2023-02-17&check_out=2023-02-22&previous_page_section_name=1000
160,Casa entera a 15 minutos de playa,Alojamiento entero,Coquimbo,4,4,2, Habitaci칩n,1,privado,36.0,-29.9881,-71.31827,"https://maps.google.com/maps?ll=-29.9881,-71.31827&z=14&t=m&hl=es&gl=CL&mapclient=apiv3",Cercano a cerros. Villa tranquila. Peque침a Plaza cercana.,"Rel치jate con toda la familia en este alojamiento donde la tranquilidad se respira. A 10-15 minutos de la playa herradura en vehiculo. Cercano a 5 minutos  de supermercado en vehiculo, o 15 minutos caminando. Locomoci칩n colectiva o bus a centro la serena o coquimbo, a 5 cuadras.

El espacio
Nuestro hogar esta cerano a cerros. A menos de una cuadra de una peque침a plaza. Ideal para familias. Sector tranquilo.",['Vista a las monta침as'],4.80,5,Pamela,05-2018,https://www.airbnb.cl/rooms/784888200486947212?adults=1&children=0&infants=0&pets=0&check_in=2023-12-01&check_out=2023-12-07&previous_page_section_name=1000
161,"Totoralillo Coquimbo, Casa para 12 a 15 personas",Alojamiento entero,Totoralillo,12,11,5, Habitaci칩n,"2,5",privado,160.0,-30.0663,-71.3687,"https://maps.google.com/maps?ll=-30.0663,-71.3687&z=14&t=m&hl=es&gl=CL&mapclient=apiv3","zona o pueblo muy tranquilo y seguro,noches estrelladas y con puestas de sol hermosas y justo al frente de la casa, la mejor ubicacion de Totoralillo 游끴勇游똂九","amplio e independiente ,mejor ubicaci칩n y vista, terrazas y balcon con hermosa vista, comodo en 3 sub-departamentos con ba침o, de 6,4 y 3personas, asignaci칩n depende de la cantidad de gente, hasta 10 fos apart, mas de 10personas 3 apart, negocio de abarrotes en frente, tranquilo, seguro y amplio, salida directa a calle principal de bajada a la playa,  ;) mas detalle en turismo totoralillo  gracias.


Caracteristicas:

-Casa de 2 pisos, capacidad desde 6 personas (+ 3 personas adicional max)hasta 15 personas maximo.

      Subdividida en 3 apartamentos,( 6, 4 y 2 personas + 1 adicional en cada apart. max.) hasta 10 personas se asigna 2 apart, mas de 10 personas se asigna 3 apart.

 * Habitaciones: full personas  6 (3 matrimoniales, 2 con literas,1 camas bajas)

* Ba침os:   3 con ducha y agua caliente (1 en casa piso)

* Cocina full implementada primer piso, y segundo piso (2 apart.) implementaci칩n para  desayunos y recalentados (frigobar, microondas, hervidor, losa y utensilios) 

*Living comedor ambos pisos con TV.

*Patio amplio y Terraza pavimentada con sombra amplia y asadera,  balc칩n con hermosa vista al mar y a la peninsula de totoralillo en 2do piso.

*Servicios b치sicos, agua, luz, gas, internet b치sico rrss, Agua caliente, Tv Directv b치sico, equipo audio, 3 estacionamientos

*Nuestras ventajas: acogedor, comodo, bonito, amplio, la mejor vista, mejor acceso, primera linea, la independencia sin m치s caba침as, estamos en primera l칤nea poniente mirando el mar y la pen칤nsula, las hermosas puestas de sol en el mar en frente a la casa, amplio terreno, negocio de abarrotes en frente a 10mts, trekking, surf, boulder, silencio, calma, buen clima, salida directa camino a la playa, distancia de bajada 800mts a la playa.
*turismototoralillo cl",['Acceso a la playa'],,,Jorge,12-2022,https://www.airbnb.cl/rooms/791398508217946785?adults=1&children=0&infants=0&pets=0&check_in=2023-02-16&check_out=2023-02-23&previous_page_section_name=1000
162,Caba침a CielodePeralillo Valle de Elqui 3 drmtorios,Alojamiento entero,Vicu침a,6,4,3, Habitaci칩n,2,privado,140.0,-30.02961,-70.65411,"https://maps.google.com/maps?ll=-30.02961,-70.65411&z=14&t=m&hl=es&gl=CL&mapclient=apiv3",,Rel치jate con toda la familia en este tranquilo lugar para quedarse con tinaja privada y full equipada,['Cocina'],,,Maria Fernanda,12-2021,https://www.airbnb.cl/rooms/731379898272759974?adults=1&children=0&infants=0&pets=0&check_in=2023-02-19&check_out=2023-02-24&previous_page_section_name=1000
163,casa cercana playa la herradura,Alojamiento entero,Coquimbo,6,4,3, Habitaci칩n,2,privado,55.0,-29.9884,-71.3404,"https://maps.google.com/maps?ll=-29.9884,-71.3404&z=14&t=m&hl=es&gl=CL&mapclient=apiv3",Barrio seguro. Casa ubicada en avenida principal.,"Rel치jate con toda la familia en este tranquilo lugar para quedarse. En un lugar seguro, espacioso, y con todas las comodidades que necesitas para disfrutar tus vacaciones.

Cocina equipada
Quincho
Wifi
Netflix y Amazon Prime
Locomoci칩n a la puerta
Estacionamiento privado
Bodega
츼reas verdes
Zona de lavado


Supermercado a 100 metros. A 7 minutos caminando a playa la herradura. 3 minutos en auto. Frente a un ret칠n de carabineros. Barrio seguro.",['Cocina'],,,Gabriel,01-2023,https://www.airbnb.cl/rooms/798440169544324333?adults=1&children=0&infants=0&pets=0&check_in=2023-02-21&check_out=2023-02-27&previous_page_section_name=1000
164,Arriendo Casa Verano 130.000 d칤a,Alojamiento entero,Coquimbo,10,5,8, Habitaci칩n,2,privado,117.0,-29.9589,-71.2703,"https://maps.google.com/maps?ll=-29.9589,-71.2703&z=14&t=m&hl=es&gl=CL&mapclient=apiv3",,"Este alojamiento 칰nico tiene mucho espacio para que disfrutes con los tuyos. Cocina equipada, parrilla, tv cable, Internet, 8 habitaciones, 2 Ba침os a 5 minutos playa pe침uelas y casino Enjoy, 3 estacionamientos interior y 5 exterior.",['Cocina'],,,David,06-2019,https://www.airbnb.cl/rooms/811580503093282661?adults=1&children=0&infants=0&pets=0&check_in=2023-02-21&check_out=2023-02-26&previous_page_section_name=1000
165,Mi Refugio,Alojamiento entero,La Ligua,10,6,4, Habitaci칩n,2,privado,170.0,-32.2051,-71.51616,"https://maps.google.com/maps?ll=-32.2051,-71.51616&z=14&t=m&hl=es&gl=CL&mapclient=apiv3","Condominio Tranquilo, con vista maravillosa, puesta de sol hermosa.....seguridad las 24 horas del dia.","Casa en terreno de 5.000 m2, ubicada en condominio ""Rocas del Mar"" se encuentra entre Los Molles y Pichidangui. La ubicaci칩n exacta es el kilometro 189 de la ruta 5 Norte. Condominio con vigilancia las 24 horas del d칤a al igual que la conserjer칤a, funciona las 24 horas.

El espacio
Espacio amplio con una vista maravillosa, piscina de 12 x4 metros.",['Costa'],4.83,19,Veronica,02-2016,https://www.airbnb.cl/rooms/35824356?adults=1&children=0&infants=0&pets=0&check_in=2023-03-12&check_out=2023-03-17&previous_page_section_name=1000
166,Cercano a la playa,Alojamiento entero,Coquimbo,4,3,2, Habitaci칩n,1,privado,50.0,-29.9864,-71.3438,"https://maps.google.com/maps?ll=-29.9864,-71.3438&z=14&t=m&hl=es&gl=CL&mapclient=apiv3","Sector muy tranquilo a 1 cuadra de Carabineros, a 1 cuadra de comercios con Supermercados, peluquer칤as, almacenes, verdurer칤as, restaurantes, pescader칤as, helader칤as, farmacias, Petshop. Agencia de turismo.
Cercano a la playa La Herradura caminando. A 5 min de playa Totoralillo y Pe침uelas.","Casa en tranquilo sector, cercano a playa La Herradura (5 cuadras) a una cuadra de comercios con supermercado, farmacias etc. 
A cinco min. de Totoralillo hermosa playa Turquesa y cinco min. de playa Pe침uelas, que consta de Casino Enjoy, restaurantes,  comercios, ferias artesanales etc. Compartida por los due침os con un depto interior. Con accesos directos a c치maras de seguridad y alarmas conectadas a Carabineros otorgando mayor seguridad a su familia.


Casa para 4 personas.
Living comedor, cocina equipada, 2 dormitorios con grandes cl칩set, amplio ba침o en suite, c칩moda 치rea de trabajo con escritorio libreros y armarios. 
Antejard칤n. Sin patio. 
Compartida por los due침os en forma totalmente independiente. Con acceso a c치maras de vigilancia la 24 horas y alarmas con conexi칩n directa a Carabineros, otorgando mayor seguridad a su estad칤a.",['Acceso la playa P칰blico o compartido'],,,Rodrigo,01-2023,https://www.airbnb.cl/rooms/816538049456125721?adults=1&children=0&infants=0&pets=0&check_in=2023-02-26&check_out=2023-03-05&previous_page_section_name=1000
167,Casa Gallardo Zanetta,Alojamiento entero,Coquimbo,6,5,3, Habitaci칩n,"3,5",privado,80.0,-29.9638,-71.3366,"https://maps.google.com/maps?ll=-29.9638,-71.3366&z=14&t=m&hl=es&gl=CL&mapclient=apiv3","Sector de El Llano, residencial y tranquilo.","Casa amplia con excelente iluminaci칩n, amplio patio bien cuidado, vista a la bah칤a de Coquimbo. Ideal para familias. Est치 ubicada en el sector el Llano, a una cuadra del Estadio Mundialista Francisco S치nchez Rumoroso y a una distancia caminable del Terminal de Buses. A dos cuadras est치 el paradero de micros en direcci칩n a la Playa la Herradura, a la Serena, o al centro de Coquimbo y a su Barrio Ingl칠s .

El espacio
El patio es amplio, verde y bien cuidado. La vista sobre la bah칤a es hermosa.",['Cocina'],4.81,36,Jorge,08-2018,https://www.airbnb.cl/rooms/27552109?adults=1&children=0&infants=0&pets=0&check_in=2023-02-18&check_out=2023-02-23&previous_page_section_name=1000
168,acogedora caba침a Coquimbo centro,Alojamiento entero,Coquimbo,5,4,2, Habitaci칩n,1,privado,32.0,-29.94631,-71.33906,"https://maps.google.com/maps?ll=-29.94631,-71.33906&z=14&t=m&hl=es&gl=CL&mapclient=apiv3",,"Disfruta del f치cil acceso a todo desde este alojamiento perfectamente ubicado. Con transporte p칰blico en la puerta de la casa.
la caba침a cuenta con dos habitaciones; una con cama matrimonial y otra con tres camas individuales, un ba침o y linving comoder cocina todo en uno , tiene televisiones con Netflix, wifi y agua caliente , estacionamiento gratuito, no dude en contactarme, la caba침a es para aprox 5 personas",['Wifi'],,,Francisca,11-2022,https://www.airbnb.cl/rooms/813786363767683322?adults=1&children=0&infants=0&pets=0&check_in=2023-02-16&check_out=2023-02-21&previous_page_section_name=1000
169,Acogedora casa en sector residencial,Alojamiento entero,La Serena,6,4,3, Habitaci칩n,1,privado,60.0,-29.93885,-71.26082,"https://maps.google.com/maps?ll=-29.93885,-71.26082&z=14&t=m&hl=es&gl=CL&mapclient=apiv3",,"Disfruta como si estuvieras en tu casa,
Acogedor y comodo  espacio consta de living, comedor, cocina full equipada, lavadora, bicicleta spinning,wifi, smart tv, estacionamiento, patio con terraza y parrilla a carbon. Encontraras todo lo escencial para que puedas disfrutar tu estadia.

El espacio
La casa esta ubicada en un sector residencial de la ciudad, alta conectividd y plusvalia. 
Encontraras distintos tipos de restaurantes, caf칠s,  supermercados, almacenes, stripcenters 
Playa a pocos minutos 

Puedes encontrar locomocion a media cuadra",['Cocina'],4.25,4,Daniela,12-2019,https://www.airbnb.cl/rooms/54206215?adults=1&children=0&infants=0&pets=0&check_in=2023-02-28&check_out=2023-03-07&previous_page_section_name=1000
170,Linda casa a 5 min del Faro,Alojamiento entero,La Serena,5,5,2, Habitaci칩n,1,privado,61.4,-29.89562,-71.26514,"https://maps.google.com/maps?ll=-29.89562,-71.26514&z=14&t=m&hl=es&gl=CL&mapclient=apiv3","Barrio residencial, emergente, muy tranquilo, ideal para la familia. Cercano a centro de la ciudad, playa, y ruta principal que conecta el norte y sur de nuestro pa칤s.","Linda casa, excelente ubicaci칩n. 
Casa aislada,  residencial, ideal para ir en familia. 
Bienvenidas mascotas 游 

C칩moda, acogedora, de tama침o justo,  5 min de Faro y playa, a 10 minutos del Mall, y terminal de buses, 20 min del aeropuerto de La Serena.
A pasos de supermercado Lider, 

Habilitada para 5 personas.

Cocina equipada, living comedor, Estacionamiento privado. 
Patio con c칠sped, terraza, fo y parrilla. 1

Acceso r치pido a ruta 5 norte y direcci칩n a ruta valle del Elqui.


C칩moda y acogedora casa, cuenta con parrilla para asado y terraza para compartir al aire libre .",['Cocina'],4.64,15,Camila,12-2016,https://www.airbnb.cl/rooms/16525567?adults=1&children=0&infants=0&pets=0&check_in=2023-03-01&check_out=2023-03-06&previous_page_section_name=1000
171,Caba침a depto. Boutique Los Molles1,Caba침a entero,La Ligua,4,3,2, Habitaci칩n,1,privado,80.0,-32.23696,-71.51728,"https://maps.google.com/maps?ll=-32.23696,-71.51728&z=14&t=m&hl=es&gl=CL&mapclient=apiv3",es un lugar muy tranquilo y familiar. caminando podras conocer esta localidad,"Departamentos Boutique Los Molles 
Full equipado, wifi, cable , quincho , terraza con pasto sintetico. Capacidad 5 personas y mascota.
Estan ubicados caminando:
8 minutos de la playa y 4 minutos de minimarket.
Puedes realizar: trekking, bicicleta, running , buceo y visitar la reserva natural Puquen 
Ideal para disfrutar unas vacaciones inolvidables en familia.


las caba침as estan equipadas para todo lo necesario para disfrutar de unos dias inolvidables en Los Molles",['Acceso la playa P칰blico o compartido'],4.69,48,Karen,07-2017,https://www.airbnb.cl/rooms/22862790?adults=1&children=0&infants=0&pets=0&check_in=2023-02-27&check_out=2023-03-04&previous_page_section_name=1000
172,Arriendo de Verano,Alojamiento entero,La Serena,6,5,3, Habitaci칩n,2,privado,70.513,-29.90116,-71.26533,"https://maps.google.com/maps?ll=-29.90116,-71.26533&z=14&t=m&hl=es&gl=CL&mapclient=apiv3","Sector Puertas del Mar , es un sector tranquilo , cercano a la playa , centro de La Serena y de centros Comerciales . Posee f치cil acceso desde la carretera Ruta 5.","Tu familia estar치 cerca de todo si te hospedas en este alojamiento c칠ntrico.A pasos de la playa, supermercado y centros comerciales.",['Cocina'],,,Carolina,12-2021,https://www.airbnb.cl/rooms/775581283926244327?adults=1&children=0&infants=0&pets=0&check_in=2023-02-24&check_out=2023-03-01&previous_page_section_name=1000
173,Morrillos Casa nueva en condominio 6 camas C4Norte,Alojamiento entero,Coquimbo,7,5,2, Habitaci칩n,2,privado,230.0,-30.12524,-71.36907,"https://maps.google.com/maps?ll=-30.12524,-71.36907&z=14&t=m&hl=es&gl=CL&mapclient=apiv3","Casa frente al mar - Playa Morrillos.
Condominio privado con seguridad y port칩n el칠ctrico.
A 10 minutos a pie se encuentra reserva ecolog칤a Humedal Adelaida, lugar de avistamiento de aves","Casa en condominio privado con grato ambiente familiar de descanso, playa y desconexi칩n de la ciudad. Port칩n el칠ctrico y cuidador 24hrs. A pasos de la playa!

15 minutos de Guanaqueros y Coquimbo (Supermercados, Casino, tiendas y aeropuerto). 

Casa full equipada para 6 personas. 2 habitaciones, 2 ba침os (principal en suit), cocina americana integrada y terraza.  105m2 de construcci칩n solida, terraza de 50 m2 con semi sombra, 2 estacionamientos.


2 casas nuevas contiguas, ventanas de termopanel y cortinas roller para m치ximo confort. Cada casa tiene 2 piezas, 2 ba침os, logia, cocina americana integrada y 2 estacionamientos.

Lugar full equipado con ropa de cama, toallas, enseres de cocina, horno el칠ctrico y a gas, lavavajillas, parrilla, con logia particular y lavander칤a compartida.

Agua de la llave no apta para consumo, dispensadores de bidones de agua en el lugar.

Para grupos familiares grandes, se pueden arrendar las 2 casas al mismo tiempo y hacer uso de del complejo completo (para uso de 12-14personas). Cada casa tiene 4 camas + matrimonial + sof치 cama = 7

VISTAS AL MAR DESDE TODO EL LUGAR",['Acceso a la playa'],5.0,3,Jose Tomas,06-2017,https://www.airbnb.cl/rooms/47370921?adults=1&children=0&infants=0&pets=0&check_in=2023-02-27&check_out=2023-03-06&previous_page_section_name=1000
174,Refugio Alta Cordillera Tulahu칠n,Caba침a entero,Tulahuen,8,6,4, Habitaci칩n,2,privado,150.0,-30.94521,-70.77388,"https://maps.google.com/maps?ll=-30.94521,-70.77388&z=14&t=m&hl=es&gl=CL&mapclient=apiv3",,Caba침a tulahu칠n Rel치jate con toda la familia en este tranquilo lugar para quedarse.,['Cocina'],,,Tatiana,06-2022,https://www.airbnb.cl/rooms/799869148124125614?adults=1&children=0&infants=0&pets=0&check_in=2023-02-14&check_out=2023-02-20&previous_page_section_name=1000
175,Casa Gallardo Zanetta,Alojamiento entero,Coquimbo,6,5,3, Habitaci칩n,"3,5",privado,80.0,-29.9638,-71.3366,"https://maps.google.com/maps?ll=-29.9638,-71.3366&z=14&t=m&hl=es&gl=CL&mapclient=apiv3","Sector de El Llano, residencial y tranquilo.","Casa amplia con excelente iluminaci칩n, amplio patio bien cuidado, vista a la bah칤a de Coquimbo. Ideal para familias. Est치 ubicada en el sector el Llano, a una cuadra del Estadio Mundialista Francisco S치nchez Rumoroso y a una distancia caminable del Terminal de Buses. A dos cuadras est치 el paradero de micros en direcci칩n a la Playa la Herradura, a la Serena, o al centro de Coquimbo y a su Barrio Ingl칠s .

El espacio
El patio es amplio, verde y bien cuidado. La vista sobre la bah칤a es hermosa.",['Cocina'],4.81,36,Jorge,08-2018,https://www.airbnb.cl/rooms/27552109?adults=1&children=0&infants=0&pets=0&check_in=2023-02-18&check_out=2023-02-23&previous_page_section_name=1000
176,Arriendo de Verano,Alojamiento entero,La Serena,6,5,3, Habitaci칩n,2,privado,70.513,-29.90116,-71.26533,"https://maps.google.com/maps?ll=-29.90116,-71.26533&z=14&t=m&hl=es&gl=CL&mapclient=apiv3","Sector Puertas del Mar , es un sector tranquilo , cercano a la playa , centro de La Serena y de centros Comerciales . Posee f치cil acceso desde la carretera Ruta 5.","Tu familia estar치 cerca de todo si te hospedas en este alojamiento c칠ntrico.A pasos de la playa, supermercado y centros comerciales.",['Cocina'],,,Carolina,12-2021,https://www.airbnb.cl/rooms/775581283926244327?adults=1&children=0&infants=0&pets=0&check_in=2023-02-24&check_out=2023-03-01&previous_page_section_name=1000
177,Acogedora casa en sector residencial,Alojamiento entero,La Serena,6,4,3, Habitaci칩n,1,privado,60.0,-29.93885,-71.26082,"https://maps.google.com/maps?ll=-29.93885,-71.26082&z=14&t=m&hl=es&gl=CL&mapclient=apiv3",,"Disfruta como si estuvieras en tu casa,
Acogedor y comodo  espacio consta de living, comedor, cocina full equipada, lavadora, bicicleta spinning,wifi, smart tv, estacionamiento, patio con terraza y parrilla a carbon. Encontraras todo lo escencial para que puedas disfrutar tu estadia.

El espacio
La casa esta ubicada en un sector residencial de la ciudad, alta conectividd y plusvalia. 
Encontraras distintos tipos de restaurantes, caf칠s,  supermercados, almacenes, stripcenters 
Playa a pocos minutos 

Puedes encontrar locomocion a media cuadra",['Cocina'],4.25,4,Daniela,12-2019,https://www.airbnb.cl/rooms/54206215?adults=1&children=0&infants=0&pets=0&check_in=2023-02-28&check_out=2023-03-07&previous_page_section_name=1000
178,Linda casa a 5 min del Faro,Alojamiento entero,La Serena,5,5,2, Habitaci칩n,1,privado,61.4,-29.89562,-71.26514,"https://maps.google.com/maps?ll=-29.89562,-71.26514&z=14&t=m&hl=es&gl=CL&mapclient=apiv3","Barrio residencial, emergente, muy tranquilo, ideal para la familia. Cercano a centro de la ciudad, playa, y ruta principal que conecta el norte y sur de nuestro pa칤s.","Linda casa, excelente ubicaci칩n. 
Casa aislada,  residencial, ideal para ir en familia. 
Bienvenidas mascotas 游 

C칩moda, acogedora, de tama침o justo,  5 min de Faro y playa, a 10 minutos del Mall, y terminal de buses, 20 min del aeropuerto de La Serena.
A pasos de supermercado Lider, 

Habilitada para 5 personas.

Cocina equipada, living comedor, Estacionamiento privado. 
Patio con c칠sped, terraza, fo y parrilla. 1

Acceso r치pido a ruta 5 norte y direcci칩n a ruta valle del Elqui.


C칩moda y acogedora casa, cuenta con parrilla para asado y terraza para compartir al aire libre .",['Cocina'],4.64,15,Camila,12-2016,https://www.airbnb.cl/rooms/16525567?adults=1&children=0&infants=0&pets=0&check_in=2023-03-01&check_out=2023-03-06&previous_page_section_name=1000
179,"Piscina, bar, playa,alojamiento",Alojamiento entero,Coquimbo,8,4,4, Habitaci칩n,3,privado,166.0,-29.9653,-71.2897,"https://maps.google.com/maps?ll=-29.9653,-71.2897&z=14&t=m&hl=es&gl=CL&mapclient=apiv3",,"Esta hermosa casa se encuentra a 1km de la playa Pe침uelas,casino, los mejores pub de la serena y Pe침uelas coquimbo.
posee quincho, piscina, bar, estacionamiento, wifi, sistema alarma, se encuentra en un lugar muy tranquilo en rosario de Pe침uelas.
Posee 4 dormitorios, 3 ba침os, living, comedor, sala de star y amplio patio.
Casa habilitado para 8 personas expandible para 10 personas es ideal para unas vacaciones en familia",['Cocina'],,,Gori,12-2022,https://www.airbnb.cl/rooms/779889805439992926?adults=1&children=0&infants=0&pets=0&check_in=2023-02-22&check_out=2023-02-27&previous_page_section_name=1000
180,Ind칩mitoElqui/Natural e Inolvidable,Caba침a entero,Vicu침a,4,3,2, Habitaci칩n,1,privado,138.549,-30.2326,-70.4949,"https://maps.google.com/maps?ll=-30.2326,-70.4949&z=14&t=m&hl=es&gl=CL&mapclient=apiv3",Monta침a con r칤o,"Enam칩rate del magn칤fico paisaje que rodea este alojamiento.

El espacio
Caba침a para cuatro personas. Un dormitorio con cama matrimonial y en el estar dos camas de plaza y media",['Acceso al lago'],,,Maria Paulina,06-2016,https://www.airbnb.cl/rooms/779502795867041931?adults=1&children=0&infants=0&pets=0&check_in=2023-02-25&check_out=2023-03-02&previous_page_section_name=1000
181,Casa familiar en Guanaqueros cercana a la playa,Alojamiento entero,Guanaqueros,10,8,5, Habitaci칩n,2,privado,115.714,-30.19683,-71.42306,"https://maps.google.com/maps?ll=-30.19683,-71.42306&z=14&t=m&hl=es&gl=CL&mapclient=apiv3",,"Excelente casa familiar a 3 cuadras de centro de Guanaqueros y el acceso de playa completamente equipada para 10 personas se permiten mascotas bien portadas , adem치s cerca de la entrada a sector de treking o bicicletas de monta침a

El espacio
lugar tranquilo cercano al comercio de guanaqueros , en zona segura a 1 cuadra de la feria de los mi칠rcoles y sabado",['Acceso la playa P칰blico o compartido'],4.33,3,Andrea,11-2018,https://www.airbnb.cl/rooms/53532276?adults=1&children=0&infants=0&pets=0&check_in=2023-03-01&check_out=2023-03-08&previous_page_section_name=1000
182,"Arriendo de Caba침a N춿2 en Los Vilos, IV Reg",Caba침a entero,Los Vilos,5,4,3, Habitaci칩n,2,privado,60.0,-31.9099,-71.4976,"https://maps.google.com/maps?ll=-31.9099,-71.4976&z=14&t=m&hl=es&gl=CL&mapclient=apiv3",,"Arriendo de Caba침a en Los Vilos para empresas y/o visitantes/turistas.

Caba침a cuenta con 3 dormitorios, 2 ba침os, living comedor y TV Cable.
Ubicada en calle 1 sur con esquina 3 oriente, sector ideal para visitantes que vengan por proyectos y/o trabajos de largo plazo.

Cuenta con 4 camas individuales y una matrimonial.
El precio incluye gastos comunes de agua, luz, TV cable, Wifi y servicio de aseo.

Ven a disfrutar un espacio tranquilo, relajante y 칰nico.",['Cocina'],4.89,9,Julio,07-2022,https://www.airbnb.cl/rooms/725421132521523961?adults=1&children=0&infants=0&pets=0&check_in=2023-07-01&check_out=2023-07-07&previous_page_section_name=1000
183,Casa de Playa familiar en Punta de Choros,Casa de campo entero,La Serena,8,6,4, Habitaci칩n,2,privado,238.79,-29.98053,-71.29033,"https://maps.google.com/maps?ll=-29.98053,-71.29033&z=14&t=m&hl=es&gl=CL&mapclient=apiv3",,"Casa familiar  (abastecida por energ칤a solar)en primera l칤nea frente al Mar en el archipi칠lago de Humboldt .
3 km al sur de Punta de Choros , ofrecemos grandes vistas ,paisajes ,tranquilidad ,distanciamiento social y billones de  estrellas , para que te conectes  con el cosmos y el infinito 鮫 solo sentir el silencio 뵱o tiene TV 游닠 

Acceso directo a la playa Las Conchitas  , conectado a una playa de 20 km de longitud apta para pesca ,deportes ,fotograf칤a entre otros

Estamos en Inst  ekosdemar


La casa tiene 4 Dormitorios 
SOLO DEBEN DE TRAER SUS S츼BANAS TOALLAS POR NORMATIVA
2Camas matrimoniales 2 plazas cl치sicas 
4Camas chicas todas de 1 plaza
Con una capacidad para 8 personas c칩modamente 
Para hu칠spedes extras tiene un valor de $25 d칩lares por noche y MAXIMO 2 hu칠sped (total hu칠spedes 10 con los extras 
POSEE UNA TINAJA DE MADERA GRANDE 1,80x1,80llenada con agua 游눦 de mar 游깱 (sin cloros ag칲ita pura de mar ) que se tempera con el sol 游 del d칤a ,queda ideal para REFRESCARSE en los d칤as de verano
Se sabe que el agua de Mar contiene muchas propiedades beneficiosas;con la concentraci칩n de sales FLOTARAS ! en la tinaja ,haciendo tu experiencia m치s ENTRETENIDA !",['Acceso a la playa'],,,Carolina Andrea,01-2018,https://www.airbnb.cl/rooms/53539145?adults=1&children=0&infants=0&pets=0&check_in=2023-02-15&check_out=2023-02-20&previous_page_section_name=1000
