,Titulo1,Titulo2,Comuna,Capacidad,Camas,N_Habitaciones,Habitaciones,Baños,Tipo_Baños,Precio,lat,lon,Ubicacion,Ubides,Descripcion,Servicios,Nota,Nnota,Anfitrion,Registro,Link
0,Maravilloso depto Puerto Velero 3D 3B,Vivienda rentada entero,Puerto Velero,8,6,3, Habitación,3,privado,140.0,-30.2368,-71.4774,"https://maps.google.com/maps?ll=-30.2368,-71.4774&z=14&t=m&hl=es&gl=CL&mapclient=apiv3",,"Sorprendente y relájate como nunca en este hermoso y exclusivo lugar, ubicado en un quinto piso, con doble terraza, donde tendrás unos amaneceres inolvidables y unas puestas de sol soñadas. 
Disfruta tu estadía con playas privadas paradisíacas, piscinas de agua dulce y salada. Supermercados  en el interior del resort, como también restoranes y diversas actividades para grandes y pequeños.
Como si fuera poco, tienes lugares cercanos como tongoy, guanaquero donde encontrarás ostiones y ostras.


Tranquilidad y belleza en el entorno.",['Acceso a la playa'],,,Andres,01-2017,https://www.airbnb.cl/rooms/806689333270005138?adults=1&children=0&infants=0&pets=0&check_in=2023-02-26&check_out=2023-03-03&previous_page_section_name=1000
1,"Condominio Amankay , Dunas de Morrillos. Resort",Vivienda rentada entero,Coquimbo,9,8,4, Habitación,3,privado,150.0,-30.15126,-71.37219,"https://maps.google.com/maps?ll=-30.15126,-71.37219&z=14&t=m&hl=es&gl=CL&mapclient=apiv3",Lugar muy tranquilo y hermoso para la familia. Especialmente si.no se quiere mover dado que camina a la playa.,"Condominio Las Dunas de Morrillos:
Hermoso Depto . Vista al mar 180º, primera línea. Ubicado en Amankay piso 82, Edificio Aterrazado con 02 estacionamientos. Gran terraza de 70m2.
4 Dormitorios;  En total 3 Baños (1 dentro de la pieza matrimonial). Incluye sabanas y toallas.
Equipado: para 8 personas, TVs, Cable, lavadora, lavavajillas, microondas,horno electrico, terraza con comedor y living, toldos, parrilla a gas y normal. 
Playa apta para el baño.


D1Cama matrimonial con baño privado con vista al mar, D2 pieza con dos camas individuales con vista al mar, D3 camarote, cama nido y cama individual con vista al mar, D4 cama individual. Living grande y cocina americana. Terraza de 70 m2.","['Acceso a la playa', 'Frente a la playa']",4.86,14,Rodrigo,05-2018,https://www.airbnb.cl/rooms/25285853?adults=1&children=0&infants=0&pets=0&check_in=2023-03-05&check_out=2023-03-11&previous_page_section_name=1000
2,Las Tacas Excelente Vista y Primera Linea,Vivienda rentada entero,Coquimbo,7,5,3, Habitación,2,privado,120.0,-30.08486,-71.37193,"https://maps.google.com/maps?ll=-30.08486,-71.37193&z=14&t=m&hl=es&gl=CL&mapclient=apiv3",El resort de Las Tacas es un lugar muy seguro con un espacio muy acogedor y familiar. Está a 30 minutos de la Serena hacia el norte y a pocos minutos de Tongoy y Guanaqueros hacia el Sur.,"Resort de Las Tacas es uno de los más importantes que existen en Chile.
Un lugar para disfrutar del relajo y las bondades de la cuarta región.
Una Playa increíble y exclusiva.

El espacio
Resort Las Tacas, cuya playa es un paraíso, podrás disfrutar de una experiencia increíble.","['Acceso a playa Privado', 'Frente a la playa']",4.79,14,Javier,02-2015,https://www.airbnb.cl/rooms/10336321?adults=1&children=0&infants=0&pets=0&check_in=2023-03-08&check_out=2023-03-13&previous_page_section_name=1000
3,Departamento 3er piso Primera Línea La Herradura,Vivienda rentada entero,Coquimbo,7,6,3, Habitación,2,privado,50.0,-29.98279,-71.35332,"https://maps.google.com/maps?ll=-29.98279,-71.35332&z=14&t=m&hl=es&gl=CL&mapclient=apiv3",,"Lindo y nuevo departamento ubicado en la primera línea de la playa de La Herradura con acceso directo a la playa, piscina y gimanasio disponibles. Ubicado en el tercer piso con vista a toda la bahía de La Herradura.","['Acceso a la playa', 'Frente a la playa']",4.71,51,Federico,03-2014,https://www.airbnb.cl/rooms/47720891?adults=1&children=0&infants=0&pets=0&check_in=2023-03-13&check_out=2023-03-18&previous_page_section_name=1000
4,Amplio depto 120m2 c/ terraza frente Av. del Mar,Vivienda rentada entero,La Serena,8,7,3, Habitación,"2,5",privado,119.997,-29.92694,-71.27927,"https://maps.google.com/maps?ll=-29.92694,-71.27927&z=14&t=m&hl=es&gl=CL&mapclient=apiv3",A pasos de la feria que funciona en verano con juegos de todo tipo para que los niños puedan disfrutar.,"Amplio departamento de 120 m2 con ubicación y vista inigualable del océano pacifico. Cruzando la calle estas en la playa. Tiene 3 Habitaciones, 2 baños, cocina bien equipada (lavadora y secadora), pieza de servicio y estacionamiento.

El espacio
Amplio departamento frente al mar, incluye 1 estacionamiento. Amplio Jardín y Piscina para los niños.","['Acceso a la playa', 'Frente a la playa']",4.99,74,Anthony,04-2016,https://www.airbnb.cl/rooms/16428300?adults=1&children=0&infants=0&pets=0&check_in=2023-03-01&check_out=2023-03-07&previous_page_section_name=1000
5,Departamento La Serena frente a la playa y Enjoy,Apartamento con servicios incluidos entero,Coquimbo,6,5,3, Habitación,2,privado,100.0,-29.94517,-71.29044,"https://maps.google.com/maps?ll=-29.94517,-71.29044&z=14&t=m&hl=es&gl=CL&mapclient=apiv3",,"Frente al mar,  primera línea de la playa,  al lado del casino Enjoy. Vista directa al mar.
Edificio con todas las comodidades,  piscinas, gimnasio, lavandería, portería 24 horas, estacionamiento cubierto. A pocos pasos de los mejores restaurantes, minimarkets, ciclovía y a 20 minutos del aeropuerto de Coquimbo.
Departamento completamente equipado,  con 3 habitaciones,  para 6 personas. Cuenta con tv por cable, internet, cocina equipada, jacuzzi en alcoba principal, ropa de cama y toallas.


El departamento tiene 100m2, cuenta con 3 habitaciones, la alcoba principal es de gran tamaño, con jacuzzi. La segunda y tercera habitación cada una tiene dos camas plaza y media.  La terraza tiene vista directa al mar, con mesa y silla de comedor.","['Acceso a la playa', 'Frente a la playa']",4.73,45,Nohelia,09-2018,https://www.airbnb.cl/rooms/53121256?adults=1&children=0&infants=0&pets=0&check_in=2023-03-12&check_out=2023-03-17&previous_page_section_name=1000
6,"Espectacular Duplex en Laguna del Mar, La Serena.",Condo entero,La Serena,6,5,3, Habitación,3,privado,108.0,-29.89874,-71.27007,"https://maps.google.com/maps?ll=-29.89874,-71.27007&z=14&t=m&hl=es&gl=CL&mapclient=apiv3","Proyecto turístico maravilloso y sin comparación en La Serena. A cuadras de la Avenida del Mar, se abre espacio a partir del Faro, toda la oferta gastronómica y entretención de la ciudad.

En las cercanías -a menos de 4 minutos en vehículo- se encuentra un supermercado (Lider) donde encontraran además otros comercios para realizar compras.","Espectacular duplex en el proyecto más emblemático de la ciudad de La Serena. Su gran laguna navegable y de aguas cristalinas, está rodeada de playas interiores de arenas blancas en donde podrás realizar un sin fin de actividades recreativas que harán de tu estadía una una experiencia inolvidable. Nuestro departamento duplex de 3 dormitorios –más de 110 m2 totales– cuenta con una espectacular vista al mar,  con un diseño pensado cuidadosamente para el turista tanto nacional como extranjero.


El duplex cuenta con los utensilios necesarios para cocinar. También se conecta con una terraza de gran extension (área de BBQ) mediante una escalera interior, por lo que no se necesita salir del apartamento para subir y aprovechar el espacio descrito.","['Acceso a la playa', 'Frente a la playa']",4.85,55,Roberto,01-2018,https://www.airbnb.cl/rooms/26808191?adults=1&children=0&infants=0&pets=0&check_in=2023-03-21&check_out=2023-03-28&previous_page_section_name=1000
7,Las Tacas - Arriendo depto. Vista al Mar- Coquimbo,Vivienda rentada entero,Coquimbo,8,7,3, Habitación,2,privado,168.0,-30.08489,-71.37271,"https://maps.google.com/maps?ll=-30.08489,-71.37271&z=14&t=m&hl=es&gl=CL&mapclient=apiv3","El condominio cuenta con Restaurantes, mini market, pescadería, y todo lo necesario para el día a dia","Departamento en Las Tacas para 8 personas a 150 mts de la playa , con una vista privilegiada al mar y la bahía. Totalmente equipado. 3 dormitorios, principal en suite, 2 baños, Terraza.

Accesos controlados, piscina, áreas verdes, estupenda playa, minimarket, pescaderia, restaurant, canchas de Tenis y Paddle, Quincho para asados, escuela de surf y buceo, etc.
Senderos para pasear, trotar, andar en bicicleta


Las Tacas esta ubicado a 15 km al sur de Coquimbo. Es un balneario que permite muchas alternativas diferentes tanto en la playa como deportivas, además de su cercanía a diferentes puntos atractivos de la IV Region, como La Serena, El valle de Elqui, Punta de Choros, Parque Fray Jorge, etc. 
Cuenta con un completo equipamiento, servicios y  seguridad que dan tranquilidad y entretención a toda la familia.","['Acceso a la playa', 'Frente a la playa']",5.0,38,Manuel,12-2015,https://www.airbnb.cl/rooms/21726892?adults=1&children=0&infants=0&pets=0&check_in=2023-03-02&check_out=2023-03-07&previous_page_section_name=1000
8,★ Primer Piso Primera Línea al lado de la Playa! ★,Condo entero,Puerto Velero,8,7,3, Habitación,2,privado,108.043,-30.2408,-71.4765,"https://maps.google.com/maps?ll=-30.2408,-71.4765&z=14&t=m&hl=es&gl=CL&mapclient=apiv3","Puerto Velero es un condominio en una localidad turística exclusiva ubicada frente a la bahía de Barnes, entre los balnearios de Tongoy y Guanaqueros, en la comuna de Coquimbo, Chile. Se encuentra situada a 45 kms de La Serena y a 430 kms de Santiago. Posee 700 departamentos distribuidos en 23 edificios.

Goza de un muy buen clima, lindos paisajes y jardines, una playa apta para el baño.","Probablemente el mejor (o uno de los mejores) departamento en todo Puerto Velero. La mejor ubicación, Primera Línea y Primer Piso! A menos de 50 metros de la playa con bajada directa, la mejor vista,  amplio jardín privado, terraza, hamaca, reposeras. Departamento amplio y equipado para disfrutar de unas vacaciones inolvidables. Sencillamente un estándar superior a otros departamentos de Puerto Velero!


✓Exclusivo departamento ✓ Primer piso ✓Primera Línea ✓La mejor vista despejada ✓Jardín privado amplio ✓Acceso directo a la playa a pasos de distancia ✓Completamente remodelado y equipado ✓ Espacioso living comedor, cocina, terraza ✓Todas las habitaciones incluyendo cocina con vista al mar, la playa Socos y la península de Tongoy ✓Cuenta con 3 dormitorios y 2 baños ✓No hay camas en comedor, living ni sofá-camas ✓Estacionamiento privado con toldo incluido ✓Disfrutarás del departamento completo.

✓Reposeras ✓Hamaca ✓Mesa de terraza ✓Wifi gratuito ✓2 Smart TV's LED con TV-Cable ✓Máquina Nespresso ✓3 Estufas Eléctricas ✓Ventanas Termopanel ✓Cocina amplia y equipada ✓Lava Vajillas ✓Horno eléctrico ✓Microondas ✓Lavadora/Secadora  ✓Plancha ✓Secador de pelo.

SIN CARGO ""TARIFA POR SERVICIO"": A diferencia de otras publicaciones nosotros no cobramos ""Tarifa por servicio"". Te invitamos a comparar el costo total.","['Acceso a playa Público o compartido', 'Frente a la playa']",4.82,17,Daniel,11-2017,https://www.airbnb.cl/rooms/48301966?adults=1&children=0&infants=0&pets=0&check_in=2023-04-09&check_out=2023-04-14&previous_page_section_name=1000
9,Morrillos acogedor Depto a metros de la playa,Vivienda rentada entero,Coquimbo,8,7,4, Habitación,3,privado,160.0,-30.10345,-71.36493,"https://maps.google.com/maps?ll=-30.10345,-71.36493&z=14&t=m&hl=es&gl=CL&mapclient=apiv3",Dunas de Morrillos queda ubicado entre el cruce a Tongoy y el cruce a las Tacas,"Depto. a metros de una maravillosa y extensa playa como pocas en nuestro país.
A pocos kilometros de Tongoy donde se pueden comprar los mejores pescados y mariscos de la zona, y de Coquimbo y la Serena, las cuidades más grandes de la región. 
 Te va a encantar  la decoración, el ambiente, las zonas exteriores y la gente. 
Hay una gran piscina, juegos para niños, canchas de tenis, Club House. Bueno para parejas, familias  y grupos grandes.


Mi departamento está recién arreglado y decorado. Es muy luminoso y a con una gran vista a la playa que está a solo metros del inmueble lo que lo hace muy atractivo. 
Está en un 2do. piso con pocas escalas por lo que no requiere de tomar ascensor y cercano a los estacionamientos.","['Acceso a playa Público o compartido', 'Frente a la playa']",4.91,34,María Catalina,04-2012,https://www.airbnb.cl/rooms/13770634?adults=1&children=0&infants=0&pets=0&check_in=2023-03-08&check_out=2023-03-13&previous_page_section_name=1000
10,"Las Tacas, amplio departamento, primera línea.",Condo entero,Coquimbo,12,11,6, Habitación,4,privado,350.0,-30.09091,-71.36265,"https://maps.google.com/maps?ll=-30.09091,-71.36265&z=14&t=m&hl=es&gl=CL&mapclient=apiv3",,"El departamento está ubicado en un exclusivo balneario, es duplex, muy iluminado, con vistas espectaculares y cuenta con todo para pasar unas lindas vacaciones.","['Acceso a la playa', 'Frente a la playa']",5.0,12,Ana María,10-2015,https://www.airbnb.cl/rooms/35916512?adults=1&children=0&infants=0&pets=0&check_in=2023-03-05&check_out=2023-03-10&previous_page_section_name=1000
11,LAS TACAS DEPARTAMENTO DE LUJO EN PRIMERA LÍNEA,Vivienda rentada entero,Coquimbo,8,6,3, Habitación,3,privado,250.0,-30.08635,-71.37261,"https://maps.google.com/maps?ll=-30.08635,-71.37261&z=14&t=m&hl=es&gl=CL&mapclient=apiv3",,"Hermoso departamento para 9 personas en exclusivo condominio en el norte de Chile. Cuenta con playa privada (a 100 metros del departamento), múltiples piscinas, gimnasio, canchas de tenis, moto cross, treking,  marina, restaurant, minimarket, emporio la rosa, pescadería, feria artesanal,  entre otros. Para los niños todos los días hay diversas actividades dirigidas , para que los padres puedan descansar. A 10 minutos de Coquimbo y 25 de La Serena.


Espectacular departamento en primera linea con piso de mármol total en living y comedor, las habitaciones en piso flotante de madera blanca, tonos blancos, iluminación cálida, pulcro. El departamento esta decorado por diseñador. y al ser ultimo piso tiene una vista e iluminación inigualable.","['Acceso a la playa', 'Frente a la playa']",4.64,13,Antonia,09-2016,https://www.airbnb.cl/rooms/41009849?adults=1&children=0&infants=0&pets=0&check_in=2023-02-27&check_out=2023-03-04&previous_page_section_name=1000
12,"Hermosa Vista al MAR, ideal 2 familias con niños!",Vivienda rentada entero,La Serena,8,5,3, Habitación,"2,5",privado,66.0,-29.93754,-71.28191,"https://maps.google.com/maps?ll=-29.93754,-71.28191&z=14&t=m&hl=es&gl=CL&mapclient=apiv3",Frente a la playa y cercano a restaurantes,"Amplia terraza con vista privilegiada al mar, seguridad para niños en la terraza y ventanas. Cuenta con 3D y 2B. Dormitorio principal cama matrimonial y Baño en suite, 2do. dormitorio cama matrimonial, 3er dormitorio con camarote y cama de 1 1/2 plaza, sofa cama en living y segundo baño en pasillo. Estacionamiento gratis a un paso del ascensor.
Excelente ubicación y ambiente. Edificio con seguridad las 24hrs. piscina sala de reuniones y juegos para niños.


La capacidad cómoda para 8 personas y excelente ubicación, con una amplia y cómoda terraza con vista frontal al mar.","['Acceso a la playa', 'Frente a la playa']",4.53,60,Hernan,08-2016,https://www.airbnb.cl/rooms/15286615?adults=1&children=0&infants=0&pets=0&check_in=2023-05-01&check_out=2023-05-06&previous_page_section_name=1000
13,"Amplio, acogedor y muy cómodo departamento",Vivienda rentada entero,La Serena,6,5,3, Habitación,2,privado,96.0,-29.92764,-71.27846,"https://maps.google.com/maps?ll=-29.92764,-71.27846&z=14&t=m&hl=es&gl=CL&mapclient=apiv3",,"Te invito a disfrutar de un amplio, acogedor y muy cómodo departamento, cruzarás la calle y estarás disfrutando de la playa. 
Trae tu bici y recorre la renovada ciclovia, si prefieres caminar al atardecer o hacer ejercicio, trote o caminata... hay espacio para eso¡¡

El espacio
Departamento ubicado en un primer piso con sobre altura frente a la playa,  100 metros al sur de 4 esquinas. Ambientado en un estilo clásico familiar cuenta con amplios espacios lo que otorga alta  privacidad.
Es muy  funcional en su ambientación y distribución,  lo que hará que te sientas cómodo y acogido, encontrarás todo lo que necesitas para hacer de tu estadía en la avenida del mar un agradable tiempo de descanso.
Si necesitas orientación, información o te falta algo,  antes o durante tu estadía  , cuenta con nosotros para ayudarte.","['Acceso a la playa', 'Frente a la playa']",4.75,21,Guillermo,11-2016,https://www.airbnb.cl/rooms/37629526?adults=1&children=0&infants=0&pets=0&check_in=2023-02-26&check_out=2023-03-03&previous_page_section_name=1000
14,Luminoso Duplex de 4 Dormitorios en Primera Línea,Condo entero,Coquimbo,10,10,4, Habitación,3,privado,250.0,-30.24366,-71.47558,"https://maps.google.com/maps?ll=-30.24366,-71.47558&z=14&t=m&hl=es&gl=CL&mapclient=apiv3",,"Luminoso Duplex de 4 dormitorios en primera línea en Puerto Velero. Recién reacondicionado con equipamiento de alto estándar. Configuración:
- Piso 1: cocina integrada al living y comedor, logia, dormitorio 1 con 4 camas y baño, dormitorio 2 con cama matrimonial y baño.
- Piso 2: dormitorio 3 con 4 camas, dormitorio 4 con cama matrimonial y baño, terraza panorámica.
2 estacionamientos, lavavajillas y lavadora. Escritorio para trabajar en dormitorio matrimonial piso 2.


Es un duplex muy cómodo y luminoso en primera línea  Funciona muy bien para dos familias con niños, ya que se pueden ubicar una en el primer piso y la otra en el segundo. La vista a la playa y la bahía de Tongoy es espectacula!",['Acceso a la playa'],4.89,9,Sergio,11-2017,https://www.airbnb.cl/rooms/54117846?adults=1&children=0&infants=0&pets=0&check_in=2023-03-13&check_out=2023-03-18&previous_page_section_name=1000
15,LAS TACAS. 1a línea. Muy equipado. WiFi.,Condo entero,Coquimbo,8,7,3, Habitación,3,privado,195.0,-30.08241,-71.37063,"https://maps.google.com/maps?ll=-30.08241,-71.37063&z=14&t=m&hl=es&gl=CL&mapclient=apiv3",Las Tacas es quizás la mejor playa de Chile. La seguridad del complejo es increíble. Hay gran tranquilidad y es precioso.,"Espectacular dpto, 1a linea, 1er piso (terraza de mayor tamaño y seguridad). Vista preciosa de la playa. Muy bien equipado para 8 personas.
WiFi y TV cable.

El espacio
Departamento en 1a línea de playa, en excelente estado, vista maravillosa de la playa. Terraza de mayor tamaño por ser 1er piso. Muy bien equipado para 8 personas.
Hay cafetera Nespresso, lavadora/secadora, lavavajillas, parrilla a gas. toallas de baño, sábanas, Wi-Fi, TV cable, termopaneles.

PARA RESERVAS DE PERIODOS DE VACACIONES ESCOLARES, CONSULTAR","['Acceso a la playa', 'Frente a la playa']",4.83,23,Rodrigo,12-2015,https://www.airbnb.cl/rooms/34155544?adults=1&children=0&infants=0&pets=0&check_in=2023-03-01&check_out=2023-03-06&previous_page_section_name=1000
16,depto en primera línea.av del mar edifici oceanic,Condo entero,La Serena,8,6,5, Habitación,3,privado,218.0,-29.92042,-71.27743,"https://maps.google.com/maps?ll=-29.92042,-71.27743&z=14&t=m&hl=es&gl=CL&mapclient=apiv3","Lugar muy tranquilo a pasos de la playa ,restaurantes y pub .
Amplias instalaciones y áreas verdes","Hermoso departamento  completo en primera linea, amplia terraza con vista panoramica al mar. 
Departamento 140m2
Acceso al recinto con tarjeta electrónica.
Piscina para adultos y niños en parte posterior con juegos , maquinas de ejercicios y quincho.
 
2 estacionamientos

4 habitaciones, más un hall habitable .
1 cama king 
1 cama de 2 plazas 
2 cama de 1 plaza 
2 cama de 1 1/2 plazas
Sábanas incluidas 
Servicio adicional de 8 toallas  valor 10.000 
Calefacción toyotomi
Wii fi

3 baños completos


Capacidad 8 personas. cuatro habitaciones mas un hall habitable 

1er dormitorio:   1 cama king con baño en suite
2do dormitorio: 1 cama de 2 plazas 
3er dormitorio:  2 camas de 1 plaza y media
4to dormitorio:  1 cama de 1 plaza, con baño privado
Hall  habitable:   1 cama de 1 plaza","['Acceso a la playa', 'Frente a la playa']",4.95,21,Yohana,12-2018,https://www.airbnb.cl/rooms/30724739?adults=1&children=0&infants=0&pets=0&check_in=2023-02-24&check_out=2023-03-01&previous_page_section_name=1000
17,Increible casa de playa en Huentelauquen !!,Vivienda rentada entero,Huentaleuquen,10,8,4, Habitación,2,privado,200.0,-31.5343,-71.5663,"https://maps.google.com/maps?ll=-31.5343,-71.5663&z=14&t=m&hl=es&gl=CL&mapclient=apiv3",Zona muy tranquila con acceso caminando a 2 playas.,"Linda casa en Huentelauquén a solo 300 mts de la playa y con vista al mar. 2 familias pueden ir comodamente sin problema. 
Suite matrimonial en altura, terraza delantera y trasera, hot tub empotrado en la terraza, bosca en el living y pieza principal, bodega, ducha exterior para despues de la playa, cortinas roller black out en piezas, arenero para niños, entre muchos otros detalles. 
Lugar increible para disfrutar de la playa, el mar, las dunas, roqueríos, y paseos a los alrededores.


Suite matrimonial, pieza matrimonial y dos piezas con un camarote y una cama nido bajo la cama posterior. Margarita los recibe y los despide. Ella estará atenta a dudas que puedan tener, y yo atento desde Santiago.","['Acceso a la playa', 'Frente a la playa']",4.67,18,Andrés,02-2016,https://www.airbnb.cl/rooms/48082536?adults=1&children=0&infants=0&pets=0&check_in=2023-02-24&check_out=2023-03-01&previous_page_section_name=1000
18,Espectacular departamento increíble vista al mar,Condo entero,Coquimbo,12,10,5, Habitación,"4,5",privado,320.0,-30.08814,-71.37353,"https://maps.google.com/maps?ll=-30.08814,-71.37353&z=14&t=m&hl=es&gl=CL&mapclient=apiv3",,"Espectacular y amplio departamento, con inmejorable vista al mar. Perfecto para descansar y relajarte con amigos o en familia.

El espacio
Departamento amplio y comodo.
Vista maravillosa!!

Habitaciones
-Dos habitaciones en suite ambas con  cama matrimonial , con salida a terraza y vista al mar
Baño principal con jacuzzi
Ambas con tv con cable

-Hab. con camarote y cama abajo 
-Hab. con dos camas  de 11/2plaza y otra cama ,abajo de una de ellas
Estas 2 hab comparten baño
- Hab de servicio o adicional con dos camas de 11/2 plaza y baño
- baño de visita

-Sabanas y toallas incluidas
Todas las camas con plumones

Living y comedor grande

Salida a una gran terraza con -muebles de terraza
- parlante bluethoot
-mesa con sus sillas-8
-Parilla 
-2 tumbonas para tomar sol

Cocina

Completamente equipada
Refrigerador
Horno
Cocina
Parrilla eléctrica etc
Lavavajilla
Lavadora
Secadora
Plancha/ tabla de planchar/ colgador de ropa 
2 secadores de pelo",['Acceso a la playa'],5.0,12,Ximena,08-2019,https://www.airbnb.cl/rooms/588983879886663589?adults=1&children=0&infants=0&pets=0&check_in=2023-03-01&check_out=2023-03-06&previous_page_section_name=1000
19,Se arrienda durante todo el año...,Vivienda rentada entero,Puerto Velero,8,8,3, Habitación,2,privado,150.0,-30.2417,-71.47675,"https://maps.google.com/maps?ll=-30.2417,-71.47675&z=14&t=m&hl=es&gl=CL&mapclient=apiv3","Puerto velero es un complejo de departamentos ubicados en la Playa Socos, cuenta con un clima privilegiado y una hermosa playa de 3,7 kilómetros de arenas blancas y mar cálido donde grandes y chicos disfrutan de una experiencia total de relajo y entretención. El complejo dispone de un completo equipamiento comercial y deportivo, además se encuentra cercano a los pueblos de Tongoy y Guanaquero que cuentan con una amplio oferta gastronómica.","Espectacular departamento en Condominio de Puerto Velero con vista al mar en primera línea y jardín. Todo lo que necesitas para descansar y pasarlo bien. En la Playa de Socos, cercano a los pueblos de Tongoy y Guanaqueros, que cuentan con una amplia oferta gastronómica y de servicios.

El espacio
Departamento NUEVO full equipado de dos pisos con 3 dormitorios dentro de un condominio con pisicinas, quinchos, canchas de tenis y fútbol. El departamento incluye lavavajillas, lavadora, secadora, cocina full equipada y un estacionamiento.","['Acceso a la playa', 'Frente a la playa']",4.85,26,Gonzalo,12-2018,https://www.airbnb.cl/rooms/31164614?adults=1&children=0&infants=0&pets=0&check_in=2023-03-06&check_out=2023-03-11&previous_page_section_name=1000
20,duplex con terraza y mejor vista de puerto velero,Vivienda rentada entero,Puerto Velero,9,7,4, Habitación,3,privado,108.0,-30.23821,-71.47812,"https://maps.google.com/maps?ll=-30.23821,-71.47812&z=14&t=m&hl=es&gl=CL&mapclient=apiv3",,"El departamento queda al lado del funicular para llegar a la playa, a 5 minutos caminando hacia la playa 

Cuenta con todo lo necesario para 9 personas. 
La distribución es 
Piso de acceso está living comedor 

El piso de Abajo 3 habitaciones. La habitación 1 tiene 3 camas (1 camarote y 1 cama), la hab. 2 tiene 2 camas (1 camarote), la hab 3 tiene una cama matrimonial de 2 plazas 

El tercer piso tiene 1 cama King

La cocina está habilitada con platos, cubiertos y todo para 9 personas


Pueden usar todas las instalaciones de puerto velero 
Piscinas, canchas de tenis, canchas de fútbol, piscina temperada

Las piscinas se usan libremente 

Las canchas y Quinchos se reservan con la administración del condominio",['Vista al desierto'],4.81,60,Claudia,09-2017,https://www.airbnb.cl/rooms/39766257?adults=1&children=0&infants=0&pets=0&check_in=2023-03-19&check_out=2023-03-24&previous_page_section_name=1000
