,Titulo1,Titulo2,Comuna,Capacidad,Camas,N_Habitaciones,Habitaciones,Ba침os,Tipo_Ba침os,Precio,lat,lon,Ubicacion,Ubides,Descripcion,Servicios,Nota,Nnota,Anfitrion,Registro,Link
39,Casa para vacaciones,Villa entero,La Serena,4,3,2, Habitaci칩n,1,privado,30.96,-29.87058,-71.27038,"https://maps.google.com/maps?ll=-29.87058,-71.27038&z=14&t=m&hl=es&gl=CL&mapclient=apiv3","Ubicada Sector Caleta San Pedro, calle Maria Elena Aguilera Rubina 556, La casa queda a 800 metros del mar, cerca del centro Gastron칩mico del lugar, 8 min del centro, 13 minutos de 4 esquinas, adem치s pueden ir caminando por el borde costero a Serena Golf y llegar hasta la reserva de Punta Teatinos, en YouTube encontrar치 un video de Caleta San Pedro","Casa ubicada en el Sector de Caleta San Pedro de La Serena calle Maria Elena Aguilera,  cerca de la playa 游깬, del centro Gastron칩mico游꽇, a 
8 minutos en veh칤culo llegar치 al centro Colonial de la ciudad de La Serena, tambi칠n a 10 min del Faro monumental, a  13 min de 4 esquinas y a 20 min de la ciudad de Coquimbo
amplio estacionamiento ( acceso port칩n el칠ctrico)
2 habitaciones con piso flotante
1 游띏de 2 plazas 
1 游띏 nido (1.5 游띏y 1 游띏)
wifi
Quincho R칰stico
2游닠
cafetera
九勇游


La casa fue refacccionada por el due침o para que los hu칠spedes se sientan como si fuese en su hogar, es un sector tranquilo tiene acceso al mar pueden disfrutar caminando del sector Caleta San Pedro hasta Serena Golf y por 칰ltimo llegar a Punta de Teatinos.
https://youtu.be/ufwDoidNJ_k",['Acceso a la playa'],5.0,7,Roberto,09-2019,https://www.airbnb.cl/rooms/54110452?adults=1&children=0&infants=0&pets=0&check_in=2023-02-26&check_out=2023-03-03&previous_page_section_name=1000
40,"Casa de Playa, Ensenada (Totoralillo), amplia vista al mar, playa privada condominio",Caba침a entero,Los Vilos,6,4,3, Habitaci칩n,2,privado,175.0,-32.00269,-71.51799,"https://maps.google.com/maps?ll=-32.00269,-71.51799&z=14&t=m&hl=es&gl=CL&mapclient=apiv3","Condominio cerrado, muy tranquilo, con playa privada.","Amplia casa de playa, ubicada en Ensenada, en la bah칤a de Totoralillo.
Emplazada en altura, posee vista panor치mica al mar desde todas sus habitaciones, living, comedor y terraza. Adem치s, cuenta con piscina propia.
Es parte de un condominio con acceso remoto, un entorno muy tranquilo y una linda playa privada.
A 213km de Santiago, por la ruta 5, cerca de Pichidangui, Valle Quilimar칤, Los Vilos, Chigualoco y Huentelauqu칠n. Gastronom칤a criolla del mar, paseos, deportes n치uticos... Imperdible!


Habitaciones con techos de 3 metros de altura, otorgan una c칩moda sensaci칩n de amplitud. Revestidas en madera, con un suave albayalde en tono claro.
Todas sus ventanas son termopanel y permiten un ambiente seco dentro de la casa.","['Acceso a playa P칰blico o compartido', 'Frente a la playa']",4.75,12,Nicol치s,12-2015,https://www.airbnb.cl/rooms/51729708?adults=1&children=0&infants=0&pets=0&check_in=2023-02-26&check_out=2023-03-03&previous_page_section_name=1000
41,Jard칤n de Hadas Vista Panor치mica,Alojamiento entero,Pisco Elqui,5,4,2, Habitaci칩n,1,privado,90.0,-30.1242,-70.4956,"https://maps.google.com/maps?ll=-30.1242,-70.4956&z=14&t=m&hl=es&gl=CL&mapclient=apiv3",,"Nuestra casa Jard칤n de Hadas cuenta con una decoraci칩n muy propia del Valle, se encuentra completamente equipada y dispone tambi칠n de espacios como fogata, p칠rgola y un refrescante ""Ojo de Agua"", todo rodeado de una maravillosa vista panor치mica que realmente conmueve, le encantar치. Estamos ubicado a s칩lo 1,5 kms de Pisco Elqui, lindo pueblito tipico del Valle que ofrece tambi칠n mucha gastronom칤a y actividades. Esta misma distancia permite disfrutar de tranquilidad, relajaci칩n y privacidad.",['Vista a las monta침as'],,,Jazmina,02-2021,https://www.airbnb.cl/rooms/797732041973396375?adults=1&children=0&infants=0&pets=0&check_in=2023-02-24&check_out=2023-03-01&previous_page_section_name=1000
42,"Caba침a con Piscina Privada, Valle de Elqui.",Casa de campo entero,La Serena,10,9,4, Habitaci칩n,1,privado,100.0,-29.97156,-71.11965,"https://maps.google.com/maps?ll=-29.97156,-71.11965&z=14&t=m&hl=es&gl=CL&mapclient=apiv3","Sector Rural, muy tranquilo, ideal para caminatas y andar en bicicleta.","Caba침a equipada para 5 personas y pagando valor adicional pueden alojar hasta 10 personas (deben ingresar cantidad exacta de hu칠spedes)  parcela RUSTICA, Sector Quilacan a 20 km del centro de La Serena, camino a Vicu침a, PISCINA PRIVADA Peque침a ideal para ni침os, cama el치stica, quincho, Horno de barro, fogatera, cancha de baby, comedor amplio, cama de cuarzo, hamacas, reposeras. Desde ruta 41, la caba침a est치 a 2 km por camino de tierra, 

POR SEGURIDAD COVID DEBEN TRAER SABANAS.. 
NO PARA FIESTAS


Piscina Privada peque침a ideal para ni침os.

Destaca su gran comedor para 10 personas, caba침a dentro de parcela de 5.000 MT2 

La caba침a cuenta con un ba침o completo y adem치s una ducha al exterior de la caba침a. 

NO se arrienda para fiestas.

Caba침a ideal para descansar, sector muy tranquilo y silencioso.

Se cuenta con una zona de descanso con amacas, reposeras y cama de cuarzo.",['Vista al valle'],4.73,22,Rodrigo,05-2016,https://www.airbnb.cl/rooms/27808278?adults=1&children=0&infants=0&pets=0&check_in=2023-02-23&check_out=2023-02-28&previous_page_section_name=1000
43,Casa a 2 cuadras de la Playa,Alojamiento entero,Pichidangui,8,7,4, Habitaci칩n,2,privado,71.869,-32.1399,-71.5286,"https://maps.google.com/maps?ll=-32.1399,-71.5286&z=14&t=m&hl=es&gl=CL&mapclient=apiv3","Localizada en calle tranquila con poco flujo vehicular a 5 minutos caminando de la Playa y 10 a roquer칤os para ver la puesta del
Sol.","Lleva a toda la familia a este fant치stico lugar con muchas zonas para divertirse.

No pierda la oportunidad de conocer esta casa de 4 dormitorios y 2 ba침os de 800 metros de terreno y 120 metros construidos con cocina, living y comedor separados a doble altura de dormitorios. 

Ideal familias y personas que les gusta un verano relajado y familiar. 

A dos cuadras de bajada de playa con dos estacionamientos techados, amplio jard칤n. 

Se arrienda al menos por 2 noches  consecutivos.


Tres dormitorios con camas de una y media plaza, m치s pieza con cama matrimonial con dos ba침os. 
Living, comedor y cocina separados por peque침a escala que hace que la casa presente dos niveles construidos.",['Acceso la playa P칰blico o compartido'],4.67,6,Patricio,07-2016,https://www.airbnb.cl/rooms/763631284552242083?adults=1&children=0&infants=0&pets=0&check_in=2023-03-06&check_out=2023-03-11&previous_page_section_name=1000
44,"Casa Residencial Coquimbo, Chile",Alojamiento entero,Coquimbo,4,3,2, Habitaci칩n,2,privado,75.0,-29.96666,-71.30195,"https://maps.google.com/maps?ll=-29.96666,-71.30195&z=14&t=m&hl=es&gl=CL&mapclient=apiv3","Nuestra casa se encuentra en un vecindario tranquilo y seguro, rodeado de hermosos parques y jardines. Puedes disfrutar de paseos relajantes por las calles arboladas mientras admiras la belleza natural del vecindario. Los parques cercanos ofrecen una amplia variedad de actividades al aire libre, desde senderismo y ciclismo, hasta juegos para ni침os y 치reas de picnic. Es un lugar perfecto para relajarse y desconectar del estr칠s de la vida cotidiana, mientras disfrutas de la naturaleza y del aire fresco.","춰Disfruta tu verano en nuestra hermosa casa de arriendo! Acogedora y espaciosa, cerca de las playas de Coquimbo. Con cocina, camas c칩modas y sala de estar. Vecindario seguro, tranquilo, cerca de supermercados, restaurantes. A pocos pasos del mar y cerca de atracciones tur칤sticas. 춰No pierdas esta oportunidad! 춰Te esperamos! Adem치s, est치 cerca de la ciudad, para que puedas disfrutar de todo lo que ofrece. Un lugar perfecto para descansar y disfrutar de la naturaleza.


Experimenta una estancia acogedora en nuestra amplia y espectacular casa. Con espacios amplios y elegantes, nuestra casa es el lugar perfecto para relajarse y disfrutar. Las habitaciones est치n bien iluminadas y con c칩modas camas.  Con un patio y una terraza privada, podr치s disfrutar de una vista impresionante mientras disfrutas del sol y de la brisa del mar. Adem치s, la casa cuenta con una decoraci칩n acogedora y todas las comodidades necesarias para una estancia c칩moda. 춰No pierdas la oportunidad de experimentar la vida acogedora en nuestra hermosa casa! 춰Te esperamos!","['Acceso a playa P칰blico o compartido', 'Frente a la playa']",,,Rodrigo,02-2019,https://www.airbnb.cl/rooms/32293241?adults=1&children=0&infants=0&pets=0&check_in=2023-02-17&check_out=2023-02-22&previous_page_section_name=1000
45,Casa de Playa Huentelauqu칠n,Alojamiento entero,Huentaleuquen,12,11,4, Habitaci칩n,3,privado,220.0,-31.529,-71.5714,"https://maps.google.com/maps?ll=-31.529,-71.5714&z=14&t=m&hl=es&gl=CL&mapclient=apiv3","Comunidad Agr칤cola Huentelauquen, Sector B","Casa de 160 m2 con 4 dormitorio y 3 ba침os, con 160 m2 de amplias terrazas con una vista incre칤ble.

Ubicada en el sector B de la Comunidad Agr칤cola Huentelauquen, zona de alto inter칠s ecol칩gico y uno de los 16 sitios Ramsar existentes en Chile.

La casa se encuentra 500 mts al norte de la playa el Pe침on, y con vista y bajada directa a quebrada los Parados.

Arquitectura de Dumay Arquitectos, nominada a Building of the Year 2021 (Archdaily.com)


Los dormitorios se encuentras distribuidos en 2 zonas, separados por el espacio com칰n de living/comedor/cocina. Cada zona cuenta con un dormitorio principal con cama king y ba침os, lo que permite comodamente acoger a 2 familias.
 
La casa esta habilitada para teletrabajo con escritorios en 2 de sus dormitorios y buena se침al 4G de varias compa침칤as (funciona bien Entel, Wom y Movistar)","['Acceso a la playa', 'Frente a la playa']",5.0,16,Felipe,01-2016,https://www.airbnb.cl/rooms/29832434?adults=1&children=0&infants=0&pets=0&check_in=2023-02-27&check_out=2023-03-05&previous_page_section_name=1000
46,"Agradable Casa Condominio Aguadulce, Huentelauqu칠n",Alojamiento entero,Angostura,8,6,3, Habitaci칩n,2,privado,206.6,-31.52279,-71.55178,"https://maps.google.com/maps?ll=-31.52279,-71.55178&z=14&t=m&hl=es&gl=CL&mapclient=apiv3",,"Rel치jate con toda la familia en este tranquilo lugar para quedarse. La casa est치 cerca de la playa, accesible caminando. El condominio tiene lindos senderos, rambla costera, dunas y una caleta (Puerto Manso). Cuenta, adem치s con juegos infantiles, 2 canchas de f칰tbol y 5 de tenis, que est치n a dos minutos caminando desde la casa. Es un lugar ideal para realizar caminatas, andar en bicicleta y disfrutar de la naturaleza.


La casa cuenta con living, comedor, cocina integrados con salida a una terraza amplia con vista al mar y a un espacio trasero ideal para hacer asados y fogatas, relajarse y mirar las estrellas. En este espacio hay una mesa amplia, parrilla, sillas de playa, banquetas y fog칩n. 

El dormitorio principal tiene una cama king, ba침o privado y salida a terraza con sillas adirondack y una peque침a mesa. 

En el otro extremo de la casa hay dos dormitorios que comparten un ba침o. Uno tiene un camarote con dos camas y el otro, m치s amplio, cuenta con una cama matrimonial, un camarote con dos camas y un escritorio. 

Todos los dormitorios poseen amplios closets. 

Adem치s, la casa cuenta con una bodega donde se encuentra la lavadora.",['Acceso a la playa'],4.92,13,Macarena,07-2016,https://www.airbnb.cl/rooms/53480974?adults=1&children=0&infants=0&pets=0&check_in=2023-02-27&check_out=2023-03-04&previous_page_section_name=1000
47,"Hermosa Caba침a Rapanui 3387, Guanaqueros, Coquimbo",Caba침a entero,Coquimbo,15,14,3, Habitaci칩n,4,privado,150.0,-30.19291,-71.41666,"https://maps.google.com/maps?ll=-30.19291,-71.41666&z=14&t=m&hl=es&gl=CL&mapclient=apiv3",,"Hermosa y amplia caba침a ubicada en Rapa Nui 3387, Guanaqueros, con vista al mar y a tan solo pasos de la Playa.
Cuenta con un amplio estacionamiento, y capacidad para 15 personas.
Wifii y cable incluido.",['Acceso a la playa'],,,Maritza,01-2023,https://www.airbnb.cl/rooms/802903495158979995?adults=1&children=0&infants=0&pets=0&check_in=2023-03-01&check_out=2023-03-06&previous_page_section_name=1000
48,Vistas de un mill칩n de d칩lares al Pac칤fico,Caba침a entero,Los Molles,5,2,2, Habitaci칩n,2,privado,131.206,-32.28186,-71.46992,"https://maps.google.com/maps?ll=-32.28186,-71.46992&z=14&t=m&hl=es&gl=CL&mapclient=apiv3","Esta es una comunidad cerrada (el acceso al veh칤culo est치 restringido). Hay muchos senderos de tierra hasta el oc칠ano o hacia los bosques. La orilla en la parte inferior de esta propiedad es rocosa con piscinas de marea. Las playas de arena est치n a menos de un kil칩metro de distancia. A veces se puede ver gente recogiendo algas en la orilla o peque침os barcos en el mar. Si tienes suerte ver치s delfines, leones marinos, ballenas, 치guilas, serpientes y escorpiones. Hay peque침as tiendas a cuatro cuadras de distancia. El restaurante m치s cercano est치 a seis kil칩metros de distancia en Los Molles.","Caba침a junto al mar. Para los hu칠spedes que buscan NATURALEZA. 춰Se admiten perros! 
Lugar oculto a 2 horas al norte de Santiago. 춰Surf a pocos kil칩metros de distancia!
춰NO ES para hu칠spedes que quieren hormig칩n limpio en la ciudad! La caba침a es de madera y tiene 25 a침os. 
춰No hay vecinos!
2500 metros cuadrados.
Senderismo alrededor
de 2 camas de dos plazas.
Para las evaluaciones de Airbnb de la b칰squeda de Ocean Escape on de la planta baja 
PROPIEDAD EN PRIMERA L칈NEA
NADA entre t칰 y el oc칠ano.
A 2 horas al norte de Santiago entre Pichicuy y Los Molles
No se permiten ni침os de la comunidad cerrada.


Decorada por los propietarios viaja por 츼frica, Oriente Medio e India, esta caba침a rezuma ambiente. Arriba hay sala de estar, dormitorio, cocina y un peque침o ba침o. En la planta baja tiene dormitorio, cocina peque침a y ba침o grande. Tanto en la planta superior como en la inferior tiene camas dobles, agua caliente, cocinas y duchas. En la planta baja se accede por una escalera exterior. 

Al igual que muchas 치reas costeras, el clima es variable. El sol algunos d칤as y las nubes, otros. El invierno es de mayo a septiembre. Tanto en la planta superior como en la inferior tienen fant치sticas vistas al mar y camas dobles. 

Puede hacer fr칤o por la noche, 춰trae un su칠ter! Esto es semi desierto con cielos nocturnos muy despejados. El agua de manantial se trae con un cami칩n, por lo que se agradece la conservaci칩n. Toda el agua de la cocina, el ba침o y la ducha alimenta las muchas plantas del jard칤n. 

Te invitamos a traer a tu perro, 춰pero lo siento, no hay ni침os!","['Acceso a playa P칰blico o compartido', 'Frente a la playa']",,,Lorraine,06-2014,https://www.airbnb.cl/rooms/3219000?adults=1&children=0&infants=0&pets=0&check_in=2023-02-20&check_out=2023-02-25&previous_page_section_name=1000
49,Hermosa caba침a r칰stica con acceso a r칤o,Caba침a entero,Paihuano,5,4,2, Habitaci칩n,"1,5",privado,75.0,-30.02537,-70.52641,"https://maps.google.com/maps?ll=-30.02537,-70.52641&z=14&t=m&hl=es&gl=CL&mapclient=apiv3","El vecindario es tranquilo, con grandes 치rboles, en frente de la parcela hay un algarrobo centenario, 치rboles frutales como higueras, olivos, paltos, las otras parcelas son privadas y mantienen un trato cordial y respeto mutuo.","Caba침a r칰stica, a pasos de r칤o (exclusiva de la comunidad). Para una familia con 3 ni침os. Estacionamiento privado para un auto grande (se pueden estacionar m치s autos afuera). Cobertura tel칠fonos m칩viles. Sitio con 치rboles frutales (membrillo, manzano, lim칩n, mandarinas, palto, almendro), vista al valle hacia Pisco, a pasos del centro de Montegrande y la escuela de GABRIELA MISTRAL, donde se encuentran restaurantes, lugares de turismo y pisqueras.


Caba침a con 2 habitaciones (una pieza matrimonial abierta con cama King  y cl칩set, y una pieza abierta con un camarote y cama de plaza y media y repisas para guardar ropa), 1 ba침o con tina, cocina completa abierta (refrigerador frigobar, cocina, bater칤a, cuchiller칤a y utensilios) con comedor (se puede trasladar el comedor a la entrada techada de la caba침a).",['Cocina'],4.71,15,Sebastian,08-2013,https://www.airbnb.cl/rooms/31242334?adults=1&children=0&infants=0&pets=0&check_in=2023-03-01&check_out=2023-03-07&previous_page_section_name=1000
50,"Casa de campo, con vista al mar",Casa de campo entero,Tongoy,6,5,3, Habitaci칩n,2,privado,101.667,-30.25635,-71.46995,"https://maps.google.com/maps?ll=-30.25635,-71.46995&z=14&t=m&hl=es&gl=CL&mapclient=apiv3",,"Rel치jate con toda la familia en este tranquilo lugar para quedarse.

El espacio
Casa en una parcela muy c칩moda y bien equipada",['Vista a la playa'],4.71,7,Anita Maria,04-2019,https://www.airbnb.cl/rooms/40800270?adults=1&children=0&infants=0&pets=0&check_in=2023-02-25&check_out=2023-03-03&previous_page_section_name=1000
51,caba침a con vista al puerto,Alojamiento entero,Coquimbo,4,3,2, Habitaci칩n,1,privado,35.0,-29.9454,-71.3392,"https://maps.google.com/maps?ll=-29.9454,-71.3392&z=14&t=m&hl=es&gl=CL&mapclient=apiv3",,"Disfruta del f치cil acceso a todo desde nuestro alojamiento perfectamente ubicado. con locomoci칩n a la puerta y f치cil acceso. A 5 min del puerto de coquimbo y 20min de la playa y la avenida del mar, que recorre coquimbo y serena.
La instalaci칩n cuenta con dos habitaciones, una matrimonial y una con dos camas individuales, living comedor y cocina equipada , un televisor normal en 치reas comunes y un televisor en la habitaci칩n principal .
tienen variadas opciones de estacionamiento.",['Vista a la bah칤a'],,,Francisca,11-2022,https://www.airbnb.cl/rooms/789036880638403914?adults=1&children=0&infants=0&pets=0&check_in=2023-02-16&check_out=2023-02-22&previous_page_section_name=1000
52,Caba침as do침a Isabel Caba침as de alojamiento.,Caba침a entero,Horc칩n,4,4,2, Habitaci칩n,"1,5",privado,42.66,-30.203,-70.4865,"https://maps.google.com/maps?ll=-30.203,-70.4865&z=14&t=m&hl=es&gl=CL&mapclient=apiv3",,Disfruta de la sencillez de este alojamiento tranquilo y c칠ntrico. Con tina de hidromasaje. Con el mejor paisaje del Valle de Elqui.,['Vista al horizonte de la ciudad'],,,Mario,06-2022,https://www.airbnb.cl/rooms/659622781682787693?adults=1&children=0&infants=0&pets=0&check_in=2023-02-19&check_out=2023-02-26&previous_page_section_name=1000
53,"Casa en Tongoy, 6 personas, condominio privado",Alojamiento entero,Tongoy,6,5,3, Habitaci칩n,1,privado,90.0,-30.25686,-71.47612,"https://maps.google.com/maps?ll=-30.25686,-71.47612&z=14&t=m&hl=es&gl=CL&mapclient=apiv3",,"Nuestra casa esta ubicada en un condominio privado con amplias 치reas verdes, 2 piscinas, quinchos, cancha de tenis, cancha de futbolito.
La casa posee una linda terraza vista al mar donde podr치s descansar y disfrutar con plena tranquilidad, acceso a la playa de socos y a 5 minutos de Tongoy en auto.",['Vista a la bah칤a'],4.78,9,Ricardo,01-2016,https://www.airbnb.cl/rooms/54070122?adults=1&children=0&infants=0&pets=0&check_in=2023-03-02&check_out=2023-03-07&previous_page_section_name=1000
54,Casa en Condominio Agua Dulce Huentelauquen,Villa entero,Angostura,6,4,3, Habitaci칩n,3,privado,220.0,-31.52223,-71.55345,"https://maps.google.com/maps?ll=-31.52223,-71.55345&z=14&t=m&hl=es&gl=CL&mapclient=apiv3","The house is located inside Agua Dulce condominium, which features direct beach access, football pit, tennis court and several trekking and walking trails.
Supermarket and shops can be found at Huentelauquen, the closest town, which is about 10 minutes from the Villa","CASA QUEBRADA. Nature and reconnection!
A special place to spend time with love ones, relax, chill and explore. Our Villa combines a stunning spot at the edge of a cliff with full sea view. The deco is stylish and charming with art on every single room!

El espacio
A house at the edge of a cliff with perfect sea view and amazing nature surrounding the house. Our place is nicely decorated with art in every room. A large terrace with an outdoor jacuzzi plus a bbq area make it perfect for a family holiday","['Acceso a playa Privado', 'Frente a la playa']",4.78,18,Maria,02-2014,https://www.airbnb.cl/rooms/50591250?adults=1&children=0&infants=0&pets=0&check_in=2023-03-13&check_out=2023-03-18&previous_page_section_name=1000
55,Casa Playa Huentelauqu칠n,Caba침a entero,Huentelauqu칠n,12,10,4, Habitaci칩n,3,privado,250.0,-31.51953,-71.55771,"https://maps.google.com/maps?ll=-31.51953,-71.55771&z=14&t=m&hl=es&gl=CL&mapclient=apiv3",,"Amplia y c칩moda casa de playa dentro del condominio Agua Dulce. El lugar es espectacular, donde uno logra desconectarse y disfrutar en familia y amigos de un ambiente playero. Existen caletas para comprar pescado y marisco. Muy buen lugar para practicar deportes. El condominio cuenta con excelentes accesos, seguridad, senderos preciosos, multicanchas (tenis y futbol) y juegos infantiles.",['Acceso a la playa'],4.88,8,Nicolas,08-2018,https://www.airbnb.cl/rooms/578437329934799417?adults=1&children=0&infants=0&pets=0&check_in=2023-03-01&check_out=2023-03-07&previous_page_section_name=1000
56,De Tongoy a las estrellas,Alojamiento entero,Tongoy ,8,7,3, Habitaci칩n,"2,5",privado,145.0,-30.25865,-71.47327,"https://maps.google.com/maps?ll=-30.25865,-71.47327&z=14&t=m&hl=es&gl=CL&mapclient=apiv3","Disfruta de la tranquilidad del sector,
por la noches podr치s observar las estrellas.
La casa est치 cercana a otros balnearios, como Puerto Velero, Guanaqueros. tambi칠n a la Ciudades de La Serena y Coquimbo para disfrutar de la gastronom칤a y aprovechar una escapada al valle de Elqui para conocer y degustar el Pisco famoso de la zona","Disfruta de la tranquilidad de una parcela y la cercan칤a de la playa.
una casa con grandes espacios para compartir con la familia y los amigos .
terraza techada y otro espacio al aire libre. una salamandra para disfrutar del calorcito de hogar.
Amplios espacios para estacionaiento, parrilla para hacer un asado.


Los hu칠spedes tienen acceso a la casa completa, al patio y terreno de la parcela, donde hay variedad de 치rboles, espacios de terrazas interior, balc칩n, tinaja de agua caliente. terraza al aire libre.",['Acceso a la playa'],5.0,9,Nelly,11-2019,https://www.airbnb.cl/rooms/39837823?adults=1&children=0&infants=0&pets=0&check_in=2023-03-14&check_out=2023-03-21&previous_page_section_name=1000
57,"Caba침a Toscana, 3D2B, El Balc칩n de Illapel.",Alojamiento entero,Illapel,5,4,3, Habitaci칩n,2,privado,73.971,-31.6518,-71.1762,"https://maps.google.com/maps?ll=-31.6518,-71.1762&z=14&t=m&hl=es&gl=CL&mapclient=apiv3",,"Hola, Somos J칩se y Patty, Arrendamos nuestra caba침a Toscana. 
Ubicada en parcela de 5.000 metros, en sector muy tranquilo. Tiene acceso a amplia terraza, a Quincho de 50 m2 con asadera y horno. 

Lugar tranquilo, amplio estacionamiento, a 7 minutos de Illapel en veh칤culo.

Estamos desarrollando un sistema de reciclaje de aguas para regar nuestros 치rboles nativos.


- Nuestra Caba침a  Toscana tiene tres dormitorios, dos ba침os, balc칩n, totalmente equipada con cocina, refrigerador, baterias de cocina, loza y lo necesario para preparar. 

Capacidad para 5 pasajeros. 
-habitaci칩n 1 con cama 2 plazas.
-habitaci칩n 2, con cama King 칩 2 twin (plaza y media).
- habitaci칩n 3, con una cama twin (plaza y media).",['Cocina'],,,Jos칠 Manuel,06-2015,https://www.airbnb.cl/rooms/784293882107021069?adults=1&children=0&infants=0&pets=0&check_in=2023-02-17&check_out=2023-02-23&previous_page_section_name=1000
58,Casa playa orilla de mar,Alojamiento entero,La Hacienda,8,8,3, Habitaci칩n,2,privado,380.0,-30.12873,-71.37089,"https://maps.google.com/maps?ll=-30.12873,-71.37089&z=14&t=m&hl=es&gl=CL&mapclient=apiv3","La casa est치 en 1 l칤nea con acceso propio a la playa que se encuentra a 35 m치s
La playa es de arena ocres y tiene 6 km aproximadamente. de longuitud","Espectacular casa en primera linea en playa morrillos. Tiene 3D y 2B, con piscina de 20m de largo

El espacio
Amplia casa de 1 piso  de construccion s칩lida en 1 l칤nea al mar...con terraza y piscina...sobre las dunas.",['Acceso a la playa'],,,Jose,07-2022,https://www.airbnb.cl/rooms/805134209681196232?adults=1&children=0&infants=0&pets=0&check_in=2023-02-25&check_out=2023-03-02&previous_page_section_name=1000
59,Parcela con Gran Piscina y Quincho,Alojamiento entero,La Serena,12,8,4, Habitaci칩n,3,privado,240.0,-29.9579,-71.224,"https://maps.google.com/maps?ll=-29.9579,-71.224&z=14&t=m&hl=es&gl=CL&mapclient=apiv3","Es un condominio cerrado de 40 parcelas, en donde la gran caracter칤stica es su tranquilidad, seguridad y comodidad, sin lugar a dudas un lugar que tiene todo lo necesario para que tu estad칤a sea espectacular.","Si buscas disfrutar c칩modamente del aire puro de la cuarta regi칩n, en un ambiente privilegiado y seguro para ti y tu familia, te invitamos a conocer nuestra casa en Condominio en La Serena, una parcela con amplios espacios, en un entorno rodeado de tranquilidad y vegetaci칩n, la casa est치 equipada para 10 personas o 12 previa coordinaci칩n, cuenta con gran quincho y piscina, acceso controlado a minutos de Centros comerciales, supermercados, avda del mar y ruta para valle del Elqui.


La propiedad est치 totalmente remodelada en su interior, todas sus camas son nuevas y todo el equipamiento en excelentes condiciones.",['Vista al jard칤n'],5.0,4,Carlos,02-2019,https://www.airbnb.cl/rooms/800050725631027951?adults=1&children=0&infants=0&pets=0&check_in=2023-02-25&check_out=2023-03-02&previous_page_section_name=1000
