,Titulo1,Titulo2,Comuna,Capacidad,Camas,N_Habitaciones,Habitaciones,Baños,Tipo_Baños,Precio,lat,lon,Ubicacion,Ubides,Descripcion,Servicios,Nota,Nnota,Anfitrion,Registro,Link
0,"Glamping descanso y vacación Familiar, La Serena",Alojamiento entero,La Serena,Más de 16,13,5, Habitación,4,privado,135.667,-29.89005,-71.21986,"https://maps.google.com/maps?ll=-29.89005,-71.21986&z=14&t=m&hl=es&gl=CL&mapclient=apiv3","La propiedad no queda al lado de la playa ni el centro, pero si camino hacia el Valle. La casa se encuentra a solo unos metros de la Avda. Islon, desde donde se puede acceder hacia el centro de la serena ( 4 km y unos 8 minutos en auto), a la playa ( 8 km a la playa el faro, unos 15 minutos en auto ), o hacia el valle del Elqui( unos 50km de Vicuña, alrededor de 1 hora en auto )
A solo 20 metros de la casa hay un pequeño local Minimarket, donde se puede comprar todo lo habitualmente necesario.
Nos ha pasado en muchas ocasiones que nuestros huespedes permanecen mucho tiempo de sus vacaciones en la propiedad, disfrutando la piscina privada, tinaja temperada, sala de cine y otros.","""Ven a vivir la experiencia Glamping con nosotros"" Glamping es un nuevo concepto de vacaciones, le brindamos comodidades para que los huéspedes puedan vivir bellos momentos familiares. Pueden compartir Piscina solo para ellos, Tinaja termal familiar, Sala de Cine, área de juegos, biblioteca además de todo lo necesario para compartir juntos y relajarse. Se Arrienda Casa amplia además de cabaña Tiny House, pudiendo ofrecer 5 dormitorios, 4 baños, cocina equipada, área para asados, entre otros.


Tiene amplios espacios, unos 120 metros cuadrados habitables, un patio con parrilla para asados, amplio estacionamiento hasta 5 vehículos.
Casa con sistema de seguridad y portón de acceso electrónico.
Ubicada a 8 kilometros de la playa el Faro y a 4 kilometros del Centro de La Serena. Cuenta con Wifi 200 Mb/seg de bajada y subida.
Piscina Privada para uso Familiar, con área de niños y de adultos.
Tinaja Termal Familiar temperada, para disfrutar en las tarde y Noches.
Sala de Cine equipada con butacas, Audio y Video de ultima generación.
Área de Juegos como Taca taca, cama saltarina, Mini Tenis de mesa, entre otros.",['Vista al patio'],4.67,27,Edu,04-2016,https://www.airbnb.cl/rooms/16410192?adults=1&children=0&infants=0&pets=0&check_in=2023-02-24&check_out=2023-03-03&previous_page_section_name=1000
1,Vacaciones en La Serena Valle del Elqui Cabaña,Alojamiento entero,La Serena,8,7,3, Habitación,2,privado,90.0,-29.89672,-71.25471,"https://maps.google.com/maps?ll=-29.89672,-71.25471&z=14&t=m&hl=es&gl=CL&mapclient=apiv3",,"Hermosa cabaña con quincho y piscina, todo totalmente equipado exclusivo para ustedes y familia. ubicado a 20 minutos de centro de La Serena, camino al valle del elqui parcela 24.
Mayores detalles enviar a mi correo hugo_aracenagallardo@yahoo.com",['Accesos de entrada y salida a pistas de esquí'],,,Hugo,12-2014,https://www.airbnb.cl/rooms/22476561?adults=1&children=0&infants=0&pets=0&check_in=2023-05-01&check_out=2023-05-08&previous_page_section_name=1000
