,Titulo1,Titulo2,Comuna,Capacidad,Camas,N_Habitaciones,Habitaciones,Baños,Tipo_Baños,Precio,lat,lon,Ubicacion,Ubides,Descripcion,Servicios,Nota,Nnota,Anfitrion,Registro,Link
195,"Departamento frente al mar, estacionamiento gratis",Apartamento con servicios incluidos entero,La Serena,6,6,2, Habitación,2,privado,70.0,-29.91545,-71.27556,"https://maps.google.com/maps?ll=-29.91545,-71.27556&z=14&t=m&hl=es&gl=CL&mapclient=apiv3",,"Condominio único con piscinas con olas en la cuarta región . 

El departamento cuenta con 2 Dormitorios  1 suit con baño y otra con baño afuera de la pieza. Ambas camas de 2 pozas con ropa de cama de hotel muy cómodas, un colchón inflable que se llena en 2 min de manera automática. Un sofá cama en el living (2P)

Contarás con una limpieza excepcional ( sanitizamos con cloro cuaternario y lysofol , aspiramos y eliminamos polvo ), ropa de cama y toallas incluidas 

Todos los servicios incluidos !",['Vista al mar'],4.65,66,Diego,07-2021,https://www.airbnb.cl/rooms/52619673?adults=1&children=0&infants=0&pets=0&check_in=2023-03-12&check_out=2023-03-18&previous_page_section_name=1000&federated_search_id=1f297b53-8ed1-46a3-8a45-253b58201cb7
196,Depto Las Tacas,Condo entero,Coquimbo,6,7,3, Habitación,3,privado,180.0,-30.09138,-71.36392,"https://maps.google.com/maps?ll=-30.09138,-71.36392&z=14&t=m&hl=es&gl=CL&mapclient=apiv3",,"Hermoso departamento para 8 personas en exclusivo condominio en el norte de Chile. Mejor ubicacion dentro del complejo: primer piso frente al mar.
El departamento tiene tres cómodas habitaciones, la principal en suite, un total de 3 baños, living con chimenea, cocina recien remodelada y una amplia terraza con vista al mar, cuenta con un estacionamiento privado y estacionamientos de visitas. Se acceder a la playa caminando.


Las Tacas es un hermoso condominio, lleno de áreas verdes y piscinas, muy tranquilo e ideal para practicar deportes y pasar un grato momento en familia.
Cuenta con playa privada, múltiples piscinas, gimnasio, canchas de tenis y Padle, marina, restaurant, minimarket, entre otros. A 10 minutos de Coquimbo y 25 de La Serena.",['Vista a la bahía'],4.60,5,Jorge,06-2016,https://www.airbnb.cl/rooms/28435986?adults=1&children=0&infants=0&pets=0&check_in=2023-03-06&check_out=2023-03-11&previous_page_section_name=1000&federated_search_id=1f297b53-8ed1-46a3-8a45-253b58201cb7
197,Departamento en La Herradura,Vivienda rentada entero,Coquimbo,4,3,2, Habitación,2,privado,95.0,-29.9803,-71.35,"https://maps.google.com/maps?ll=-29.9803,-71.35&z=14&t=m&hl=es&gl=CL&mapclient=apiv3",,"Hermoso departamento en la misma Playa de La Herradura, acceso directo a la Bahía. Perfectamente amoblado y equipado, en piso 14 con una vista espectacular y privilegiada.",['Vista a la bahía'],,,Fabiola,12-2020,https://www.airbnb.cl/rooms/788617795804540614?adults=1&children=0&infants=0&pets=0&check_in=2023-02-22&check_out=2023-02-28&previous_page_section_name=1000&federated_search_id=1f297b53-8ed1-46a3-8a45-253b58201cb7
198,Hermoso departamento en altura con vista magnifica,Vivienda rentada entero,La Serena,8,7,3, Habitación,2,privado,135.056,-29.92575,-71.27727,"https://maps.google.com/maps?ll=-29.92575,-71.27727&z=14&t=m&hl=es&gl=CL&mapclient=apiv3","Balneario playero muy tranquilo con muchas actividades para niños y jóvenes tanto en la playa durante el día, como por la noche en pubs, Restaurantes y Discotecas.
Sector tranquilo durante las noches , por lo que no hay ruidos molestos.
A 3 cuadras caminando encontraras todo tipo de diversion nocturna para niños jovenes y adultos.","Este es un hermoso departamento ubicado en la Av. del Mar, la mas importante de La Serena. Frente al Mar y con una hermosa vista . Solo debes atravesar la calle y estarás en la Playa. Una extensa franja de arena blanca con sol casi todo el año . Muchos restaurantes que llegaras soló caminando. Para 8 personas cómodamente instaladas. Mesa grande y cocina espaciosa.


Este Departamento tiene una ubicación privilegiada, pues se encuentra en un edificio que esta justo al frente de la Playa, ideal para relajarse y no andar en vehículo, con ciclovia para andar en bicicleta o patines, y muchos ricos restaurantes solo caminando.","['Acceso a la playa', 'Frente a la playa']",4.63,8,Cristian,11-2013,https://www.airbnb.cl/rooms/21962147?adults=1&children=0&infants=0&pets=0&check_in=2023-02-18&check_out=2023-02-25&previous_page_section_name=1000&federated_search_id=79d7ad01-ca84-4b51-a474-efe0b82177b2
199,"Departamento Frente al Mar, La Serena.",Vivienda rentada entero,La Serena,5,4,2, Habitación,2,privado,90.0,-29.91522,-71.27627,"https://maps.google.com/maps?ll=-29.91522,-71.27627&z=14&t=m&hl=es&gl=CL&mapclient=apiv3","Cercano a cafeterías, heladerías y restaurantes","Departamento con  Hermosa Vista al Mar, en Av. del Mar.

El espacio
Departamento de 2 dormitorios, 2 baños, cocina completamente equipada, logia con lavadora, living, comedor y una agradable terraza con cortinas de vidrios, que permite ver maravillosos atardeceres",['Vista al horizonte de la ciudad'],4.71,34,Solange,11-2018,https://www.airbnb.cl/rooms/30002104?adults=1&children=0&infants=0&pets=0&check_in=2023-02-25&check_out=2023-03-03&previous_page_section_name=1000&federated_search_id=79d7ad01-ca84-4b51-a474-efe0b82177b2
200,Departamento La Soñada Herradura,Vivienda rentada entero,Coquimbo,4,4,2, Habitación,2,privado,106.0,-29.98359,-71.3518,"https://maps.google.com/maps?ll=-29.98359,-71.3518&z=14&t=m&hl=es&gl=CL&mapclient=apiv3","Pueblo de la Herradura lugar turístico, tranquilo. Pueden acceder al muelle donde comprar pescados frescos.

No dejes de visitar el Pase Cocodrillo, un lugar familiar donde encontrarás restaurantes, cafetería, farmacia, supermercados, pescaderia y mucho más, a sólo 5 minutos caminando.","¿Estas planificando viajar a la IV Región?  yo te ayudo 🤳

Contamos con redes sociales donde además encontraras información sobre lugares que no te puedes perder y sugerencias para hagas de tu viaje unas vacaciones soñadas.

El departamento esta ubicado en la ""Playa La Herradura"" en Coquimbo. 
en primera línea y con salida directa a la playa para que puedas recorrer sin preocupaciones.

 El condominio cuenta con piscina, Quincho, estacionamiento, Spa, Gimnasio, Jacuzzi con vista al atardecer.


Departamento 100% electrico, 76 mts cuadrados. 

Cocina totalmente equipada, hervidor eléctrico, microondas, licuadora, tostador, sándwichera, loza, Insumos básicos para cocinar. Podrás disfrutar un te, café o jugo a tu llegada.

Ropa de camas, toallas, aspiradora, calefactor y ventilador eléctrico. 

Televisor smart TV con Cuenta Netflix y cable HDMI para conectar tus equipos.


Estacionamiento techado, seguridad 24 horas, acceso restringido con control en portería.

Piso 22, la torre cuenta con 2 asesores y escaleras de emergencia.",['Vista al mar'],4.85,13,Soraya,01-2017,https://www.airbnb.cl/rooms/28273645?adults=1&children=0&infants=0&pets=0&check_in=2023-02-25&check_out=2023-03-02&previous_page_section_name=1000&federated_search_id=79d7ad01-ca84-4b51-a474-efe0b82177b2
201,Depto Las Tacas,Condo entero,Coquimbo,6,7,3, Habitación,3,privado,180.0,-30.09138,-71.36392,"https://maps.google.com/maps?ll=-30.09138,-71.36392&z=14&t=m&hl=es&gl=CL&mapclient=apiv3",,"Hermoso departamento para 8 personas en exclusivo condominio en el norte de Chile. Mejor ubicacion dentro del complejo: primer piso frente al mar.
El departamento tiene tres cómodas habitaciones, la principal en suite, un total de 3 baños, living con chimenea, cocina recien remodelada y una amplia terraza con vista al mar, cuenta con un estacionamiento privado y estacionamientos de visitas. Se acceder a la playa caminando.


Las Tacas es un hermoso condominio, lleno de áreas verdes y piscinas, muy tranquilo e ideal para practicar deportes y pasar un grato momento en familia.
Cuenta con playa privada, múltiples piscinas, gimnasio, canchas de tenis y Padle, marina, restaurant, minimarket, entre otros. A 10 minutos de Coquimbo y 25 de La Serena.",['Vista a la bahía'],4.60,5,Jorge,06-2016,https://www.airbnb.cl/rooms/28435986?adults=1&children=0&infants=0&pets=0&check_in=2023-03-06&check_out=2023-03-11&previous_page_section_name=1000&federated_search_id=79d7ad01-ca84-4b51-a474-efe0b82177b2
202,"Condominio Jardin del Mar, primera línea",Condo entero,Coquimbo,4,4,2, Habitación,2,privado,111.429,-29.94517,-71.29014,"https://maps.google.com/maps?ll=-29.94517,-71.29014&z=14&t=m&hl=es&gl=CL&mapclient=apiv3","Comodidad, relajo, diversión,","Hola! Buscas un lugar para disfrutar, relajarte y descansar? Te invito a pasar unos días en mi departamento de la playa,  podrás disfrutar  el mar, las puestas de sol,  la gastronomía y los atractivos turísticos de la zona.

El espacio
Moderno departamento, ubicado frente al mar, primera línea, piso 14,  2 dormitorios, estacionamiento privado, hermoso jardín, acceso controlado, a tan solo metros del Casino Enjoy, cercano a los mejores restaurantes, pubs y cafeterías.
Salida  directa a ruta 5 norte.
El departamento cuenta con Wifi y cable;  smartv 49 pulgadas en living , en dormitorio principal cama boxspring tamaño King marca Rossen y tv de 30”;  2 camas de 1 plaza en segundo dormitorio y sofá cama en living.   Cocina con todo lo necesario(bien equipada), microhondas, horno, encimera, refrigerador, hervidor eléctrico, etc, se entrega ropa blanca( sábanas y toallas) , balcón vista directa a la playa para disfrutar el sonido del mar y apreciar las puestas de sol. 
Hay ciclovías que permiten hacer recorridos La Serena-Coquimbo, hay lugares que arriendan bicicletas , así podrás disfrutar el mar en tus paseos.",['Vista al horizonte de la ciudad'],4.90,21,Mireya,11-2017,https://www.airbnb.cl/rooms/41861751?adults=1&children=0&infants=0&pets=0&check_in=2023-02-24&check_out=2023-03-03&previous_page_section_name=1000&federated_search_id=79d7ad01-ca84-4b51-a474-efe0b82177b2
203,Depto a Estrenar 2D2B PuertoHerradura Parking Ser,Vivienda rentada entero,Coquimbo,5,3,2, Habitación,2,privado,99.76,-29.97584,-71.34288,"https://maps.google.com/maps?ll=-29.97584,-71.34288&z=14&t=m&hl=es&gl=CL&mapclient=apiv3","El condominio es privado, ideal para parejas y familias que deseen un escape de la rutina y descansar. Se encuentra en uno de los balnearios más importantes de la IV Región, a pasos de la playa La Herradura, que se caracteriza por sus aguas tranquilas ideal para bañarse y practicar deportes náuticos.

El proyecto goza de una excelente conectividad con el centro de Coquimbo y La Serena. El condominio está situado en uno de los sectores con mayor plusvalía y en uno de los balnearios más importantes con acceso directo a la playa y excelente conectividad por su cercanía a las principales vías de comunicación, además de tener cercanía con servicios como lo son supermercados, hospital, farmacias, bencinera, bares, restaurantes, transporte y turismo

Dirección: Ambrosio O'higgins 759, La Serena, Coquimbo, Chile","Espectacular departamento de 2 dormitorios y 2 baños ubicado en el mejor sector de Coquimbo. Pensado para viajeros corporativos en grupo y aquellos que desean un escape en familia. Este departamento se encuentra completamente equipado para  garantizar una estadía tranquila y cómoda. ¡Simplemente lo Mejor PuertoHerradura!

El espacio
Ubicado a escasos metros de la playa ""la Herradura"" (Cruzando la avenida).
Cuenta con Sabanas y toallas para su uso.
Tiene estacionamiento.
Edificio nuevo cuenta con piscina, y gimnasio (24/7)
Pensado para viajeros corporativos en grupo y aquellos que desean un escape en familia. 
Este departamento se encuentra completamente equipado para  garantizar una estadía tranquila y cómoda. 
¡Simplemente lo Mejor PuertoHerradura!.

Su pequeña terraza te invitará a relajarte y a disfrutar del atardecer",['Cocina'],,,HomChile,08-2019,https://www.airbnb.cl/rooms/817977392683558721?adults=1&children=0&infants=0&pets=0&check_in=2023-02-20&check_out=2023-02-25&previous_page_section_name=1000&federated_search_id=79d7ad01-ca84-4b51-a474-efe0b82177b2
204,Departamento vista al mar- Departamento-Aqua,Vivienda rentada entero,La Serena,4,3,2, Habitación,2,privado,70.0,-29.9157,-71.2748,"https://maps.google.com/maps?ll=-29.9157,-71.2748&z=14&t=m&hl=es&gl=CL&mapclient=apiv3",,"En uno de los edificios mas solicitados y nuevos de Avenida del Mar, entre cuatro esquinas y El Faro, se ubica este departamento en un 5to piso con una hermosa vista frontal al mar. A sólo minutos del centro, restaurants, pubs y supermercados.
 
Alojamiento ideal para vacaciones en familia o viajes de trabajo.

Cuenta con un estacionamiento (1), Banda Ancha (wifi) y Tv  exclusivos para el departamento.


Primera Línea (Edificio frente al mar).
Capacidad: 4 personas
2 dormitorios : 1 dormitorio con cama matrimonial y 2 dormitorio con 2 camas de 1 plaza en un camarote.
2 baños ambos con tina
Living – Comedor con vista al mar
1 LCD smart tv 47″ en living
TV 
Wifi en departamento
Cocina completamente equipada (hervidor, tostador eléctrico, juguera, etc.)
Balcón con juego de terraza
Ubicación: Frontal
NO se aceptan mascotas.
NO se aceptan fumadores.
Piso: 5to piso con ascensor.
Incluye 1 juego de sabanas por cama más un juego de toallas por persona.",['Vista al océano'],5.0,21,Paola,01-2019,https://www.airbnb.cl/rooms/31258301?adults=1&children=0&infants=0&pets=0&check_in=2023-03-05&check_out=2023-03-10&previous_page_section_name=1000&federated_search_id=79d7ad01-ca84-4b51-a474-efe0b82177b2
205,Departamento Terrazas del sol 3. La Serena.,Vivienda rentada entero,La Serena,4,3,2, Habitación,2,privado,81.8,-29.9255,-71.2753,"https://maps.google.com/maps?ll=-29.9255,-71.2753&z=14&t=m&hl=es&gl=CL&mapclient=apiv3",,"Departamento 4 personas. A una cuadra de la playa. Estacionamiento incluido. 
Incluye WiFi",['Acceso la playa Público o compartido'],,,Daniel,01-2020,https://www.airbnb.cl/rooms/661518055800363456?adults=1&children=0&infants=0&pets=0&check_in=2023-02-19&check_out=2023-02-24&previous_page_section_name=1000&federated_search_id=79d7ad01-ca84-4b51-a474-efe0b82177b2
206,Departmento Playa Herradura,Vivienda rentada entero,Coquimbo,5,5,2, Habitación,2,privado,75.0,-29.98132,-71.34896,"https://maps.google.com/maps?ll=-29.98132,-71.34896&z=14&t=m&hl=es&gl=CL&mapclient=apiv3",,"Excelente departamento con una vista espectacular, frente a la playa, comodo y tranquilo para pasar unas lindas vacaciones. Equipado con todo lo necesario para 6 personas. Dos dormitoriosy dos banos, cocina, TV de pantalla plana, cable, wi-fi gratis, piscina y estacionamiento. Ubicado cerca del centro de la ciudad y supermercados.",['Vista al mar'],4.69,17,Marcela,05-2017,https://www.airbnb.cl/rooms/18635718?adults=1&children=0&infants=0&pets=0&check_in=2023-03-03&check_out=2023-03-08&previous_page_section_name=1000&federated_search_id=79d7ad01-ca84-4b51-a474-efe0b82177b2
207,"Cómodo Dpto, Piscina de Olas y Vista al Mar",Condo entero,La Serena,6,4,2, Habitación,2,privado,109.0,-29.9157,-71.2749,"https://maps.google.com/maps?ll=-29.9157,-71.2749&z=14&t=m&hl=es&gl=CL&mapclient=apiv3","Los alrededores son muy bonitos, los encontrarás agradables para dar paseos a la orilla del mar o hacer ejercio también es muy buena opción, es movido en el día por los que estan de vacaciones y más traqnuilo en las noches.","En el departamento te sentirás tan cómodo que no querrás irte, ideal para vacaciones con familia o amigos, a solo 2 minutos caminando de la playa. Con WiFi, Tv con internet, cocina completamente equipada. El conjunto residencial cuenta con 4 piscinas, una para adultos y niños, una con agua temperada* y una de olas*. Sala de juegos, sala multiusos, sala de cine, sauna y jacuzzi*, quinchos* y 1 puesto de estacionamiento gratis. El hogar ideal para tus vacaciones soñadas.
*Costos adicionales


El departamento cuenta con 2 hab y 2 baños. La hab principal con 1 cama matrimonial, tv y baño, la 2da hab con 1 camarote y un sofá cama de plaza y media.",['Vista al patio'],5.0,13,Irama,01-2022,https://www.airbnb.cl/rooms/54146204?adults=1&children=0&infants=0&pets=0&check_in=2023-02-23&check_out=2023-02-28&previous_page_section_name=1000&federated_search_id=79d7ad01-ca84-4b51-a474-efe0b82177b2
208,Piso 11 departamento con una vista Mágica,Condo entero,Coquimbo,5,4,2, Habitación,2,privado,90.0,-29.9825,-71.3522,"https://maps.google.com/maps?ll=-29.9825,-71.3522&z=14&t=m&hl=es&gl=CL&mapclient=apiv3","Entorno tranquilo,supermercado santa Isabel a 500 metros,bomba de bencina, cerca del centro de Coquimbo, a 5 km de Serena.
Minimarket,streap Center.","Disfruta de una experiencia con estilo en este alojamiento ubicado en Playa La Herradura primera línea, puedes estar en la piscina o en el mar ya que cuenta con acceso directo a la playa, acceso controlado.

El espacio
Todo nuevo, Tv 55"" en la pieza principal, Tv 65"" el living, seccional cómodo, para disfrutar cómodamente el paisaje, una vista sensacional,debes llevar sábanas, solo hay ropa de cama para abrigar.",['Vista a la bahía'],,,Patricia,12-2018,https://www.airbnb.cl/rooms/641433011661306071?adults=1&children=0&infants=0&pets=0&check_in=2023-02-25&check_out=2023-03-02&previous_page_section_name=1000&federated_search_id=79d7ad01-ca84-4b51-a474-efe0b82177b2
209,"Depto. excelente vista , cercano casino Enjoy.",Habitación privada en vivienda rentada,Coquimbo,5,3,2, Habitación,2compartidos,compartido,79.0,-29.94959,-71.2935,"https://maps.google.com/maps?ll=-29.94959,-71.2935&z=14&t=m&hl=es&gl=CL&mapclient=apiv3",La zona está llena de restaurantes y entretención cercana para niños. Playa al cruzar la calle del departamento.,"Departamento con excelente vista en primera línea frente al mar, ubicado a 8 cuadras el casino Enjoy de Coquimbo. 2 habitaciones, 2 baños, muy Cómodo, acogedor y muy bien ubicado.

El espacio
Tiene una vista única, todas las habitaciones, cocina y terraza tienen vista al mar en primera línea. Cuenta con una piscina increíble, jardines, reposeras y quitasoles.
Disfruta tu estadía!",['Vista a la playa'],4.75,5,Macarena,07-2018,https://www.airbnb.cl/rooms/29117818?adults=1&children=0&infants=0&pets=0&check_in=2023-02-25&check_out=2023-03-02&previous_page_section_name=1000&federated_search_id=79d7ad01-ca84-4b51-a474-efe0b82177b2
210,Amplio Dpto frente al mar 7-8 pax Oceanic La Seren,Vivienda rentada entero,La Serena,7,6,3, Habitación,2,privado,165.0,-29.9207,-71.2763,"https://maps.google.com/maps?ll=-29.9207,-71.2763&z=14&t=m&hl=es&gl=CL&mapclient=apiv3","El sector es tranquilo y seguro. Se encuentra cerca de todas las cafeterías y restaurantes de la Avenida del Mar, Centros Comerciales y Supermercados, no está de más mencionar que tiene a su disposición 4 kilómetros continuados de costa, para una perfecta caminata en el atardecer, o un saludable trote mañanero, también el sector cuenta con ciclovías.","Hermoso departamento con increíble ubicación y directamente en primera línea frente al mar. Dentro del conocido Condominio Oceanic, el depto cuenta con, 2 baños y 3 dormitorios (max 8), posee terraza privada con ventanales y gran vista panorámica. 
A pasos de restaurantes, bars, gimnasio al aire libre, ferias artesanales, minimarkets y juegos; no necesitarás tu auto ! Incluye WIFI, sábanas y toallas, cocina full equipada, piscina, quinchos. estacionamiento y lavandería con secadora.


El departamento es perfecto para familias que desean disfrutar de una estadía tranquila y relajada en La Serena, el sector se encuentra a 5 minutos de Casinos y Discotecas. En el sector no se presentan ruidos molestos por las noches, solo el suave romper de las olas.","['Acceso a la playa', 'Frente a la playa']",4.75,25,Yassef,08-2017,https://www.airbnb.cl/rooms/20698692?adults=1&children=0&infants=0&pets=0&check_in=2023-02-22&check_out=2023-02-28&previous_page_section_name=1000&federated_search_id=79d7ad01-ca84-4b51-a474-efe0b82177b2
211,DEPARTAMENTO LA SERENA,Vivienda rentada entero,La Serena,4,3,2, Habitación,2,privado,76.0,-29.92437,-71.27554,"https://maps.google.com/maps?ll=-29.92437,-71.27554&z=14&t=m&hl=es&gl=CL&mapclient=apiv3","Tranquilo, silencioso, acceso expedito a las principales atracciones de la ciudad.","Disfruta de tu visita a La Serena, en la comodidad de nuestras instalaciones totalmente equipadas, pensadas para darte la mejor experiencia y comodidad a ti y los tuyos.

El espacio
Departamento en lindo condominio, nuevo y moderno a pocos pasos del mar, negocios, minimarket. Fácil acceso",['Vista al horizonte de la ciudad'],4.87,30,Andrea,02-2021,https://www.airbnb.cl/rooms/48170579?adults=1&children=0&infants=0&pets=0&check_in=2023-02-26&check_out=2023-03-03&previous_page_section_name=1000&federated_search_id=79d7ad01-ca84-4b51-a474-efe0b82177b2
212,Exclusivo Departamento en Jardín del Mar La Serena,Condo entero,Coquimbo,6,4,2, Habitación,2,privado,95.0,-29.94734,-71.29145,"https://maps.google.com/maps?ll=-29.94734,-71.29145&z=14&t=m&hl=es&gl=CL&mapclient=apiv3",,"Exclusivo y confortable departamento con hermosa vista al mar, situado a un costado del Casino Enjoy y con variada oferta gastronómica y de entretención.  El sector es ideal para realizar actividades en familia y al aire libre aprovechando la bahía que una La Serena y Coquimbo. El condominio te va a encantar por su spa, gimnasio, piscinas al aire libre y piscina temperada. Un lugar ideal para disfrutar en familia, pareja o por viaje de negocios.",['Vista a la bahía'],4.94,18,Gustavo,10-2016,https://www.airbnb.cl/rooms/15589542?adults=1&children=0&infants=0&pets=0&check_in=2023-03-01&check_out=2023-03-07&previous_page_section_name=1000&federated_search_id=79d7ad01-ca84-4b51-a474-efe0b82177b2
213,Hermoso A media cuadra del mar,Vivienda rentada entero,La Serena,8,5,3, Habitación,2,privado,146.667,-29.9133,-71.2744,"https://maps.google.com/maps?ll=-29.9133,-71.2744&z=14&t=m&hl=es&gl=CL&mapclient=apiv3",,"Lleva a toda la familia a este fantástico lugar con muchas zonas para divertirse. Esta ubicado a media cuadra de la avenida del Mar, podrás disfrutar de la tranquilidad de la Serena. Departamento muy amplio y cómodo en excelente estado totalmente nuevo. Con piscina, áreas verdes y una bella vista que te llevará a lugares mágicos. Ven y disfruta de una hermosa estadía junto a nosotros 💜",['Cocina'],,,Soledad,04-2019,https://www.airbnb.cl/rooms/815755013732234888?adults=1&children=0&infants=0&pets=0&check_in=2023-02-21&check_out=2023-02-27&previous_page_section_name=1000&federated_search_id=79d7ad01-ca84-4b51-a474-efe0b82177b2
214,Exclusivo departamento en puerto velero,Vivienda rentada entero,Coquimbo,7,6,3, Habitación,2,privado,210.0,-30.23619,-71.47554,"https://maps.google.com/maps?ll=-30.23619,-71.47554&z=14&t=m&hl=es&gl=CL&mapclient=apiv3",Tranquilo,"Departamento duplex ,primer piso ,primera línea edificio 26 mirador del mar, el primero entrando a la izquierda a 4 minutos caminando del ascensor que lleva a la playa y restaurantes. 3 dormitorios 2 baños valor. 220.000 por noche más 50.000 por aseo.(aseo se cancela una sola vez)Se reserva con el 50% ,la diferencia se cancela al llegar al departamento,se debe llevar toallas.llegada 15:00 salida 12:00 del día . El departamento será totalmente sanitizado antes de la llegada de los huéspedes


La vista y la tranquilidad",['Cocina'],4.79,15,Carol,05-2019,https://www.airbnb.cl/rooms/35097052?adults=1&children=0&infants=0&pets=0&check_in=2023-02-26&check_out=2023-03-05&previous_page_section_name=1000&federated_search_id=79d7ad01-ca84-4b51-a474-efe0b82177b2
215,Departamento completo de lujo 2d 2b,Condo entero,La Serena,6,4,2, Habitación,2,privado,73.0,-29.92513,-71.27668,"https://maps.google.com/maps?ll=-29.92513,-71.27668&z=14&t=m&hl=es&gl=CL&mapclient=apiv3","El vecindario es un barrio tranquilo aunque en verano se transforma, llegan los veraneantes y llega la vida!
En el periodo de invierno se puede disfrutar de la tranquilidad y relajo a pasos del mar, lo mejor es beber un café en la terraza en la mañana mirando las olas del mar.
En el verano llega la fiesta y la vida, todas las noches en ferias cercanas hay distintos eventos y ferias artesanales de las que se puede disfrutar","Bienvenidos al velero de tierra! Los invitamos a hospedar con nosotros a pasos del mar, tenemos en nuestro apartamento dos habitaciones, una gran habitación con cama matrimonial, baño en suite y salida a la terraza y una habitación que cuenta con una litera desmontable y una cama nido. Si eres nuestro invitado podrás utilizar responsablemente todo el apartamento y los espacios comunes en el condominio. Nuestra promesa es hacer de su visita una experiencia única e inolvidable, los esperamos!


Hay panoramas para todas las edades y gustos, si son deportistas existen 10 kilómetros de ciclovia en donde se puede patinar, andar en bicicleta o correr, para después de pasear hay restaurants en todo el borde costero en donde pueden encontrar desde pizza hasta sushi, los mejores en la zona. Estamos muy cercanos al faro, el camino es vistoso y es un paseo muy entretenido. Para los más pequeños y para toda la familia existen arriendos de carros para pasear todos por la costa. Vengan a disfrutar!!",['Acceso la playa Público o compartido'],4.88,8,Francisca,09-2018,https://www.airbnb.cl/rooms/29007192?adults=1&children=0&infants=0&pets=0&check_in=2023-02-26&check_out=2023-03-03&previous_page_section_name=1000&federated_search_id=79d7ad01-ca84-4b51-a474-efe0b82177b2
