,Titulo1,Titulo2,Comuna,Capacidad,Camas,N_Habitaciones,Habitaciones,Ba침os,Tipo_Ba침os,Precio,lat,lon,Ubicacion,Ubides,Descripcion,Servicios,Nota,Nnota,Anfitrion,Registro,Link
0,"caba침a ,grandiosa vista al mar,fog칩n,tranquilidad.",Caba침a entero,La Serena,4,2,2, Habitaci칩n,1,privado,30.0,-29.72279,-71.32457,"https://maps.google.com/maps?ll=-29.72279,-71.32457&z=14&t=m&hl=es&gl=CL&mapclient=apiv3","En el lugar existen negocios,servicio de almuerzo s y teter칤a con delivery ,est치 en un sector privado,f치cil acceso al mar ,mucha tranquilidad,se pueden ver ballenas y delfines,la flora en primavera cuando llueve es hermosa , ac치 la llamamos desierto florido.","La caba침a esta ubicada en el borde costero ,el Arrayan costero a 20 min al norte de La Serena,con energ칤a solar ,lugar m치gico donde puedes ver ballenas y delfines,muy tranquilo,excelente vista  y acceso directo al mar,muy seguro ,el sector cuenta con negocio,ideal para desconectarse,descansar,disfrutar el borde costero,desde la caba침a puedes llegar en poco tiempo a los centros tur칤sticos mas importantes de la cuarta regi칩n, como el valle del Elqui,Punta de Choros .,Cha침aral de aceituno.


La caba침a es un lugar maravilloso  para descansar y desconectarse ,hermosos atardeceres,bella vista al mar,fogata para compartir momentos inolvidables.",['Acceso la playa Privado'],4.79,42,Jessica,11-2018,https://www.airbnb.cl/rooms/34479498?adults=1&children=0&infants=0&pets=0&check_in=2023-03-11&check_out=2023-03-16&previous_page_section_name=1000&federated_search_id=23415c6f-3d33-4326-838c-8bcf405f07bd
1,"Casa Luz. EN LA PLAYA. Las Mostazas, Guanaqueros",Alojamiento entero,Coquimbo,8,7,3, Habitaci칩n,"3,5",privado,275.0,-30.18138,-71.39205,"https://maps.google.com/maps?ll=-30.18138,-71.39205&z=14&t=m&hl=es&gl=CL&mapclient=apiv3","El condominio esta a 10 minutos en auto del pueblo de Guanaqueros, 20 de Tongoy donde hay almacenes, ferias 2 d칤as a la semana donde comprar frutas verduras y varias cosas m치s, adem치s de caletas para abastecerse de mariscos y pescado.","Una casa preciosa,  hecha con mucho amor, en la playa misma, patitas en la arena. A 50 pasos del mar. Un lugar tranquilo, maravilloso, de conexi칩n con la naturaleza. Dan ganas de quedarse para siempre :)

Ecol칩gica, bien aislada, full el칠ctrica, con paneles solares y reutilizaci칩n de aguas para el jard칤n. 

Esta dentro del condominio Las Mostazas. En una playa incre칤ble. A 10 mins en auto de Guanaqueros, 20 de Tongoy y 45 de la serena. Llegan las compras del Jumbo a la puerta de la casa.


La casa tiene 3 piezas ricas, cada una con su ba침o. M치s un ba침o de servicio o de playa y parrilla. Tiene un espacio com칰n grande con una barra y un comedor grande tambi칠n. Una rica y amplia terraza con parrilla, fog칩n, estar reposeras y comedor exteriores. 

Hay en la parte de abajo del jard칤n una zona de fogata, tambi칠n con parrilla y mes칩n para hacer un asado mas acampado. 

Dejamos siempre 2 stand up paddle y salvavidas de distintos tama침os para salir a remar por el mar. Una experiencia preciosa.

Hay tambi칠n para el fin del d칤a, y con la
idea de cuidar el agua, una ducha playera, justo antes de la subida a la casa, para ba침arse r치pido y sacarse la sal y arena antes de subir.",['Vista al oc칠ano'],5.0,15,Camila,05-2014,https://www.airbnb.cl/rooms/53001224?adults=1&children=0&infants=0&pets=0&check_in=2023-03-08&check_out=2023-03-14&previous_page_section_name=1000&federated_search_id=23415c6f-3d33-4326-838c-8bcf405f07bd
2,Caba침as 4 personas Los Molles (1er piso),Alojamiento entero,Los Molles,4,3,2, Habitaci칩n,1,privado,58.0,-32.23844,-71.51404,"https://maps.google.com/maps?ll=-32.23844,-71.51404&z=14&t=m&hl=es&gl=CL&mapclient=apiv3","El vecindario es tranquilo, ideal para descansar en vacaciones en un lugar seguro.","Caba침a para 4 personas (en el primer piso) ubicada a pasos de la Playa, en sector tranquilo y seguro. 

Accesos privados,  2 dormitorios, ba침os de primer nivel, cocina equipada y calefacci칩n. 
Es el lugar perfecto para descansar y disfrutar en familia. Cercano a restaurantes, parque nacional, locales comerciales y turismo 

La ciudad al ser caleta de pescadores, tiene una oferta gastron칩mica espectacular. Sus restaurantes son de primer nivel en sabor y atenci칩n.


Nuestras caba침as est치n pensadas para el descanso en familia de las vacaciones. Se proporcionan todas las comodidades para pasar un tiempo de calidad junto a sus seres queridos en un ambiente seguro, familiar y rodeado de naturaleza.

La caba침a no cuenta con sabanas ni toallas.",['Costa'],4.78,58,Nicolas,08-2016,https://www.airbnb.cl/rooms/21500904?adults=1&children=0&infants=0&pets=0&check_in=2023-03-01&check_out=2023-03-07&previous_page_section_name=1000&federated_search_id=23415c6f-3d33-4326-838c-8bcf405f07bd
3,Huentelauquen. Condominio Agua Dulce,Alojamiento entero,Chile,10,8,5, Habitaci칩n,3,privado,195.0,-31.58382,-71.53547,"https://maps.google.com/maps?ll=-31.58382,-71.53547&z=14&t=m&hl=es&gl=CL&mapclient=apiv3",Es una zona tranquila. Ideal para descansar y hacer vida familiar,"Casa en Agua Dulce. El condominio tiene acceso directo a la playa, 2 canchas de futbol, 5 de tenis, juegos infantiles, 1 caleta, senderos caminatas.
La casa tiene vista al mar, se puede ir caminando a la playa y hay un sector de fog칩n muy c칩modo.
Para 10 personas (m치ximo 4 adultos) 
1er Piso:
- Living, comedor y cocina
- Pieza matrimonial
- Pieza con dos camas de 1 plaza
- Pieza peque침a con 1 camarote 
- 2 ba침os
2do Piso:
- Pieza matrimonial
- Pieza con dos camas 
- 1 ba침o peque침o


La vista al mar es preciosa y desde toda la casa. El condominio es muy lindo y equipado. Ideal para paseos caminando, en bicicleta, la playa es excelente y la fauna es much",['Vista al patio'],4.73,50,Francisca,05-2015,https://www.airbnb.cl/rooms/23730857?adults=1&children=0&infants=0&pets=0&check_in=2023-03-01&check_out=2023-03-06&previous_page_section_name=1000&federated_search_id=23415c6f-3d33-4326-838c-8bcf405f07bd
4,Refugio totoralillo,Caba침a entero,Coquimbo,4,3,2, Habitaci칩n,1,privado,45.0,-30.04439,-71.37747,"https://maps.google.com/maps?ll=-30.04439,-71.37747&z=14&t=m&hl=es&gl=CL&mapclient=apiv3","Lugar rural tranquilo , funciona con fosa .","El espacio
Es una caba침a

Acceso de los hu칠spedes
F치cil acceso kilometro 450.5 , a 10 minutos de supermercados y el centro de coquimbo a 5 minutos en auto a la playa totoralillo caminando 30 minutos, locomoci칩n a una cuadra de la caba침a, la cual esta emplazada en un terreno de 1000 mts cuadrados totalmente cerrado, al costado una casa independiente y otra c치ba침a .",['Vista al oc칠ano'],4.82,24,Elizabeth,01-2018,https://www.airbnb.cl/rooms/31073555?adults=1&children=0&infants=0&pets=0&check_in=2023-03-01&check_out=2023-03-06&previous_page_section_name=1000&federated_search_id=23415c6f-3d33-4326-838c-8bcf405f07bd
5,Espectacular casa con una vista inolvidable,Alojamiento entero,Los Vilos,9,10,3, Habitaci칩n,"2,5",privado,170.0,-31.97075,-71.49128,"https://maps.google.com/maps?ll=-31.97075,-71.49128&z=14&t=m&hl=es&gl=CL&mapclient=apiv3","La casa se encuentra a minutos del pueblo de los vilos donde pueden encontrar todos los servicios como cajeros autom치ticos, supermercados, farmacia y una feria libre fascinante los fines de semana.","La casa tiene una vista espectacular, con bajada a la playa donde se encuentra una piscina de agua de mar.

El espacio
La casa tiene tv con directv, wifi, y en el
Patio trasero tiene una zona de juego para los ni침os y un columpio con la mejor vista al
Mar de la zona.",['Acceso a la playa'],4.88,25,Maria Jose,08-2016,https://www.airbnb.cl/rooms/48262071?adults=1&children=0&infants=0&pets=0&check_in=2023-03-01&check_out=2023-03-08&previous_page_section_name=1000&federated_search_id=23415c6f-3d33-4326-838c-8bcf405f07bd
6,"Estupenda caba침a, maravillosa vista acceso playa",Caba침a entero,Punta de Choros,6,5,2, Habitaci칩n,1,privado,180.0,-29.24761,-71.46107,"https://maps.google.com/maps?ll=-29.24761,-71.46107&z=14&t=m&hl=es&gl=CL&mapclient=apiv3",,"Casa full equipada, impecable, borde del mar, dentro de la reserva de humboldt;Crea recuerdos inolvidables en este alojamiento 칰nico y familiar.","['Acceso a la playa', 'Frente a la playa']",5.0,15,Isabel,09-2017,https://www.airbnb.cl/rooms/550454874724487125?adults=1&children=0&infants=0&pets=0&check_in=2023-03-01&check_out=2023-03-07&previous_page_section_name=1000&federated_search_id=23415c6f-3d33-4326-838c-8bcf405f07bd
7,Caba침a rustica moderna frente al mar.,Caba침a entero,La Ligua,7,6,3, Habitaci칩n,1,privado,76.0,-32.28273,-71.47133,"https://maps.google.com/maps?ll=-32.28273,-71.47133&z=14&t=m&hl=es&gl=CL&mapclient=apiv3",,"Maravillosa caba침a rustica frente al mar. Ideal para familias que buscan tranquilidad. En un espacio totalmente seguro, ideal para descansar.

Otros aspectos a destacar
Por protocolos covid la caba침a no cuenta con toallas, como medida preventiva te recomendamos traer las tuyas. Adem치s tiene un suministro 1.000 litros de agua, en caso de necesitar la recarga extra, tiene un valor de $10.000.
La tinaja ( hot tub) es un servicio adicional, no est치 incluida dentro del valor de la caba침a.",['Vista al mar'],4.81,63,Jazmin,07-2021,https://www.airbnb.cl/rooms/51299856?adults=1&children=0&infants=0&pets=0&check_in=2023-03-12&check_out=2023-03-17&previous_page_section_name=1000&federated_search_id=23415c6f-3d33-4326-838c-8bcf405f07bd
8,Caba침a de Playa Huentelauqu칠n,Caba침a entero,Huentaleuquen,4,3,2, Habitaci칩n,1,privado,90.0,-31.53795,-71.56845,"https://maps.google.com/maps?ll=-31.53795,-71.56845&z=14&t=m&hl=es&gl=CL&mapclient=apiv3",,"Caba침a de dos dormitorios con gran quincho a pasos de la playa, ideal para desconectarse, estar en familia y la naturaleza, la Caba침a se encuentra a un costado de otra propiedad pero con total independencia y accesos independientes entre ambas, estacionamiento privado y juegos para ni침os, el espacio com칰n es la parte delantera del terreno y el camino que lleva a la playa


La casa es de 70 mts 2 en total considerando un quincho espectacular frente al mar, dispone de energ칤a solar por lo que no se pueden usar artefactos el칠ctricos de alto consumo (secador de pelo, hervidores, etc),  se recomienda solo carga de celulares y similares","['Acceso a la playa', 'Frente a la playa']",4.79,56,Rodrigo,07-2016,https://www.airbnb.cl/rooms/37178270?adults=1&children=0&infants=0&pets=0&check_in=2023-03-06&check_out=2023-03-13&previous_page_section_name=1000&federated_search_id=23415c6f-3d33-4326-838c-8bcf405f07bd
9,Casa en la playa (entre Pichidangui y los Vilos),Alojamiento entero,Los Vilos,5,4,2, Habitaci칩n,2,privado,155.0,-32.00883,-71.51633,"https://maps.google.com/maps?ll=-32.00883,-71.51633&z=14&t=m&hl=es&gl=CL&mapclient=apiv3",,,"['Acceso a la playa', 'Frente a la playa']",4.72,32,Francisco,11-2016,https://www.airbnb.cl/rooms/47373666?adults=1&children=0&infants=0&pets=0&check_in=2023-03-13&check_out=2023-03-18&previous_page_section_name=1000&federated_search_id=23415c6f-3d33-4326-838c-8bcf405f07bd
10,Caba침a en Punta de Choros,Caba침a entero,La Higuera,6,6,2, Habitaci칩n,1,privado,80.0,-29.27452,-71.40066,"https://maps.google.com/maps?ll=-29.27452,-71.40066&z=14&t=m&hl=es&gl=CL&mapclient=apiv3","C칩mo dijo una vez un pasajero amigo, es un para칤so que parece estar en otra dimensi칩n. vivir al lado del mar y sentir su energ칤a desbordante que todos los d칤as son distintos, es un privilegio, son 18 kil칩metros de playa solitaria, llenas de aves y muchas lagartijas, lagartos, zorros, y liebrones que son nuestros vecinos, ver c칩mo la monta침a se unde en el mar, siempre so침칠 con eso. vivo donde est치n los cielos m치s puros, noches maravillosas de millones de estrellas,. ac치 se siente la libertad, la paz, la desconexi칩n total. vivimos al ritmo de la naturaleza. es un privilegio y quiero compartir 칠ste para칤so.","Hermosa y c칩moda caba침a la cual te permitir치 disfrutar de la playa de Los Choros.
Equipada completa hasta 6 personas, ven a disfrutar con tu familia o amigos de este maravilloso paisaje frente al mar
La caba침a tiene 2 habitaciones con 4 camas, un ba침o, un comedor interior y un comedor exterior en la terraza con vista al mar.
Una hect치rea para disfrutar, hacer un fog칩n, recorrer las dunas y deleitarse con el paisaje.


La caba침a es sustentable cuenta con un sistema de energ칤a y agua auto sustentable donde nos preocupamos de cuidar el medio ambiente de la zona. tiene parrilla con horno al aire libre para asados m치s zona para hacer fogatas, abundante flora y fauna Silvestre ( zorros chilla, lagartos, lagartijas,, burros, liebres, etc) que pueden recorrer libremente. Estamos a 6 minutos en veh칤culo de la caleta en Punta de Choros con salidas diarias a las islas con avistamientos de delfines nariz de botella, ballenas, ping칲inos, chungungos. adem치s hay tour alternativos al humedal, pueblo hist칩rico y en 1 hora puedes recorrer en veh칤culo la ruta costera pavimentada ( lados asfaltados) con hermosas playas que une la tercera con la cuarta regi칩n. Se puede almorzar en varios lugares como Los Choros, Punta de Choros, Cha침ar de Aceituno, y en la ruta Serena Punta de Choros.","['Acceso a playa Privado', 'Frente a la playa']",4.86,7,Cecilia,02-2019,https://www.airbnb.cl/rooms/661503180281283215?adults=1&children=0&infants=0&pets=0&check_in=2023-03-06&check_out=2023-03-12&previous_page_section_name=1000&federated_search_id=23415c6f-3d33-4326-838c-8bcf405f07bd
11,Dunas del Itata Punta de Choros,Alojamiento entero,Punta de Choros,6,5,2, Habitaci칩n,2,privado,220.0,-29.26853,-71.40055,"https://maps.google.com/maps?ll=-29.26853,-71.40055&z=14&t=m&hl=es&gl=CL&mapclient=apiv3",,"Rel치jate en esta escapada 칰nica y tranquila.
*El ingres칩 es solamente en veh칤culo 4x4
2 dormitorios + 2B - toda la casa tiene vista al mar
Dormitorio principal: cama de 2 plz
Dormitorio 2: 1 cama de 1 plz
1 cama nido de 1 1/2 plz
Fut칩n de 2 plz
walking closet y ba침os con shower door
Cocina integrada al living-comedor, equipada para 8p
C칩modo comedor para 8p
Terraza de 24 M2 con parrilla y living para 6p + quitasol
*Cada arrendatario debe llevar sus s치banas y toallas",['Vista al mar'],,,Daniela,02-2017,https://www.airbnb.cl/rooms/798395122538823486?adults=1&children=0&infants=0&pets=0&check_in=2023-03-01&check_out=2023-03-06&previous_page_section_name=1000&federated_search_id=23415c6f-3d33-4326-838c-8bcf405f07bd
12,Casa para descansar. Extraordinaria vista al mar,Casa de campo entero,Los Vilos,6,4,3, Habitaci칩n,2,privado,140.0,-31.95634,-71.49631,"https://maps.google.com/maps?ll=-31.95634,-71.49631&z=14&t=m&hl=es&gl=CL&mapclient=apiv3",,"Desconecta de tus preocupaciones en este espacio tan amplio y sereno.

Otros aspectos a destacar
El lugar invita a caminar y recorrer la costa rocosa y acantilados. Tambi칠n hay peque침as playas. Si te interesa la arquitectura, encontrar치s casas de arquitectos famosos.",['Vista al oc칠ano'],5.0,16,Clemente,03-2014,https://www.airbnb.cl/rooms/52627860?adults=1&children=0&infants=0&pets=0&check_in=2023-03-08&check_out=2023-03-13&previous_page_section_name=1000&federated_search_id=23415c6f-3d33-4326-838c-8bcf405f07bd
13,"Casa en Tongoy, frente a Playa Socos. Gran vista.",Alojamiento entero,Coquimbo,9,7,4, Habitaci칩n,2,privado,81.0,-30.2543,-71.4942,"https://maps.google.com/maps?ll=-30.2543,-71.4942&z=14&t=m&hl=es&gl=CL&mapclient=apiv3","Es un pueblo pesquero peque침o, donde todo queda a mano. Tendr치 la oportunidad de disfrutar de 2 playas hermosas Socos y Grande.
El muelle consta de locales de venta de mariscos y pescados, para disfrutar de una grata gastronom칤a.
El borde costero con una gran variedad de restaurantes, para probar los productos del mar.","Casa con terraza ubicada frente al mar, con vista hacia playa Socos.
Cercana a la playa, lo cual el sonido del mar y sus olas se oyen a toda hora.
Quienes deciden quedarse, relatan que se sienten como en casa. La mayor칤a desea volver.
Bienvenidos a vivir en nuestro hogar
Amor, paz, alegr칤a.


Su ubicaci칩n a 50 metros de la playa la hace un lugar perfecto para relajarse y sentir el mar.
Ideal para familias con ni침os, ya que cumple con un entorno seguro.",['Vista al mar'],4.81,63,Esteban,07-2019,https://www.airbnb.cl/rooms/18473526?adults=1&children=0&infants=0&pets=0&check_in=2023-03-01&check_out=2023-03-08&previous_page_section_name=1000&federated_search_id=23415c6f-3d33-4326-838c-8bcf405f07bd
14,Espectacular Caba침a con Vista al mar,Alojamiento entero,Tongoy,5,6,3, Habitaci칩n,1,privado,70.0,-30.25275,-71.50042,"https://maps.google.com/maps?ll=-30.25275,-71.50042&z=14&t=m&hl=es&gl=CL&mapclient=apiv3","Tongoy es una caleta tranquila, al lado de guanaqueros, a 25 minutos de coquimbo y 35 de la serena
Se destaca por sus mariscos y pescados de la zona como son los ostiones y la palometa.
Cuenta con un paseo costero ,muelle con mercados y una vasta gastronom칤a.
La casa se encuentra en un barrio residencial ubicada en la Pen칤nsula de tongoy muy tranquilo, a 3 cuadras de la playa.","Espectacular Caba침a con linda vista al mar,.
sitio familiar muy tranquilo ideal para descansar .
Consta de una peque침a salita TV cable 3 dormitorios, 1 ba침o,peque침a cocina totalmente equipada (refrigerador, microondas, juguera.batidora y enceres
cama matrimonial en el primer piso y 2 de una plaza en el segundo piso.
Camas totalmente equipadas.
NO INCLUYE S츼BANAS NI TOALLAS, si necesita debe solicitarlas
tiene parrilla y un Juego de terraza m치s reposera.
Ideal para descanso en familia


Alojamiento de casa familiar, c칩moda con tres dormitorios, un matrimonial y en el segundo piso dos dormitorios con una camas de una plaza
Estacionamiento compartido 
1 estacionamiento x caba침a",['Vista a la bah칤a'],4.75,14,M.Cristina,03-2018,https://www.airbnb.cl/rooms/23776686?adults=1&children=0&infants=0&pets=0&check_in=2023-03-01&check_out=2023-03-06&previous_page_section_name=1000&federated_search_id=23415c6f-3d33-4326-838c-8bcf405f07bd
15,"PUNTA DE CHOROS Estupenda casa, maravillosa vista",Alojamiento entero,Punta de Choros,8,7,3, Habitaci칩n,3,privado,325.0,-29.2559,-71.4556,"https://maps.google.com/maps?ll=-29.2559,-71.4556&z=14&t=m&hl=es&gl=CL&mapclient=apiv3",,Crea recuerdos inolvidables en este alojamiento 칰nico y familiar. Tendras una experiencia unica en este lugar localizado en la reserva natural de Humboldt,"['Acceso a la playa', 'Frente a la playa']",5.0,6,Isabel,09-2017,https://www.airbnb.cl/rooms/562982356188294762?adults=1&children=0&infants=0&pets=0&check_in=2023-03-01&check_out=2023-03-07&previous_page_section_name=1000&federated_search_id=23415c6f-3d33-4326-838c-8bcf405f07bd
16,Hermosa Casa Frente al Mar,Alojamiento entero,Los Vilos,8,7,5, Habitaci칩n,3,privado,185.0,-31.97269,-71.49579,"https://maps.google.com/maps?ll=-31.97269,-71.49579&z=14&t=m&hl=es&gl=CL&mapclient=apiv3",,"Maravillosa casa con amplia terraza sobre acantilado con vista directa al mar. Playa privada y dos hermosos miradores en diferentes niveles. La casa de dos pisos tiene estufa a le침a, estufas electricas y parrilla para asados. Se encuentra en Cascabeles Sur entre la hermosa playa de Pichidangui y Los Vilos. La casa esta rodeada de naturaleza aut칩ctona y un ambiente r칰stico.

Wonderful house on a cliff with a terrace in front of the pacific ocean (breathtaking view). Private pebble beach.


POR FAVOR ANTES DE RESERVAR LES QUEREMOS AVISAR QUE DEBIDO A LA ESCASES DE AGUA EN EL SECTOR NO NOS ES IMPOSIBLE PROVEER EL SERVICIO DE S츼BANAS YA QUE ESTAS NO SE PUEDEN LAVAR. EL AGUA ES PARA EL USO DE LOS HU칄SPEDES SOLAMENTE. 

MIL DISCULPAS POR EL INCONVENIENTE, ESTO ES MOMENTANEO HASTA QUE MEJORE LA SITUACI칍N.

LOS TAMA칌OS DE LAS CAMAS PARA LLEVAR SUS S츼BANAS SON LOS SIGUIENTES:

- 2 camas tama침o King
- 1 camas tama침o Queen
- 1 cama de dos plazas
- 3 camas de una plaza",['Acceso la playa Privado'],4.83,86,Erica,04-2017,https://www.airbnb.cl/rooms/18286353?adults=1&children=0&infants=0&pets=0&check_in=2023-03-02&check_out=2023-03-07&previous_page_section_name=1000&federated_search_id=23415c6f-3d33-4326-838c-8bcf405f07bd
17,Casa primera l칤nea frente al mar,Alojamiento entero,Los Vilos,7,5,3, Habitaci칩n,3,privado,184.0,-32.0119,-71.5118,"https://maps.google.com/maps?ll=-32.0119,-71.5118&z=14&t=m&hl=es&gl=CL&mapclient=apiv3",Condominio ubicado entre Pichidangui y Los Vilos. Cuenta con una exclusiva playa a tan solo 1.5km desde la casa.,"Casa ubicada en Condominio Ensenada. Primera l칤nea frente al mar, con acceso directo al mar, desde roquer칤o frente a la casa. Las vistas desde la casa hacia el mar son inmejorables. La casa cuenta con 3 habitaciones y 3 ba침os, un amplio living comedor reci칠n remodelado y una cocina con todo su equipamiento. Tiene una gran piscina protegida del viento con preciosa vista al mar y un hot tub instalado en medio de una terraza muy especial ""El Barco"", ambos de uso exclusivo de la casa.",['Vista al oc칠ano'],5.0,4,Roberto,12-2016,https://www.airbnb.cl/rooms/758523720123421580?adults=1&children=0&infants=0&pets=0&check_in=2023-03-06&check_out=2023-03-11&previous_page_section_name=1000&federated_search_id=23415c6f-3d33-4326-838c-8bcf405f07bd
18,Casa en Condominio Agua Dulce Huentelauquen,Villa entero,Angostura,6,4,3, Habitaci칩n,3,privado,220.0,-31.52223,-71.55345,"https://maps.google.com/maps?ll=-31.52223,-71.55345&z=14&t=m&hl=es&gl=CL&mapclient=apiv3","The house is located inside Agua Dulce condominium, which features direct beach access, football pit, tennis court and several trekking and walking trails.
Supermarket and shops can be found at Huentelauquen, the closest town, which is about 10 minutes from the Villa","CASA QUEBRADA. Nature and reconnection!
A special place to spend time with love ones, relax, chill and explore. Our Villa combines a stunning spot at the edge of a cliff with full sea view. The deco is stylish and charming with art on every single room!

El espacio
A house at the edge of a cliff with perfect sea view and amazing nature surrounding the house. Our place is nicely decorated with art in every room. A large terrace with an outdoor jacuzzi plus a bbq area make it perfect for a family holiday",['Vista a la bah칤a'],4.78,18,Maria,02-2014,https://www.airbnb.cl/rooms/50591250?adults=1&children=0&infants=0&pets=0&check_in=2023-03-13&check_out=2023-03-18&previous_page_section_name=1000&federated_search_id=3a1b8eb1-25c5-4e77-b472-0fd14a205aa9
19,Casa La Perla,Alojamiento entero,La Higuera,5,3,2, Habitaci칩n,2,privado,100.0,-29.2731,-71.4014,"https://maps.google.com/maps?ll=-29.2731,-71.4014&z=14&t=m&hl=es&gl=CL&mapclient=apiv3","Respecto a la geograf칤a y biodiversidad, tanto desde Punta Choros como desde Cha침aral de Aceituno, se ofrecen paseos a la reserva Ping칲ino de Humboldt con avistamiento de delfines y ballenas.
En tanto que en el pueblo colonial de Los Choros, se puede visitar una localidad entra침able con construcciones muy antiguas, donde es posible probar dos productos locales muy apetecidos: aceitunas y aceite de oliva artesanal.","Casa hecha con paciencia y entusiasmo de pioneros. Tiene todas las comodidades de una casa en la ciudad pero ubicada en un lugar 칰nico por su tranquilidad, belleza del paisaje y riqueza en biodiversidad. A 10 minutos de la reserva Ping칲ino de Humboldt, podr치n hacer paseos y avistamiento de especies marinas de incre칤ble belleza.
Casa de l칤neas contempor치neas, con vista al entorno, frente al oc칠ano. Sala, comedor y cocina integrados  con amplio espacio. Playa pr치cticamente privada.


El acceso a la casa en autom칩vil es s칩lo para veh칤culos con tracci칩n 4 x 4. Quienes vayan en veh칤culo sin tracci칩n, lo tendr칤an que estacionar a unos 50 metros, junto a la parcela vecina. Este tramo es caminable sin dificultad.
La casa permite alojamiento para seis personas o parejas adultas (dos en futones) con inter칠s en la naturaleza y paisajes privilegiados. Playa exclusiva, tranquilidad y silencio, ideal para desconectarse.
No hay TV. Si les gusta mucho la tele, no es el lugar apropiado para Uds.",['Vista al desierto'],4.78,28,Tamara,08-2017,https://www.airbnb.cl/rooms/20284298?adults=1&children=0&infants=0&pets=0&check_in=2023-03-07&check_out=2023-03-12&previous_page_section_name=1000&federated_search_id=3a1b8eb1-25c5-4e77-b472-0fd14a205aa9
20,Casa en Tongoy frente al mar maravillosa vista,Alojamiento entero,Tongoy,6,6,3, Habitaci칩n,2,privado,110.0,-30.25472,-71.50059,"https://maps.google.com/maps?ll=-30.25472,-71.50059&z=14&t=m&hl=es&gl=CL&mapclient=apiv3",,"Arriendo casa en Tongoy ideal para disfrutar del mar en todo momento.
Es una casa independiente, con una vista maravillosa de 180췈 al mar, ubicada en la pen칤nsula a pasos de playa Grande, playa Los Ba침os, del muelle y  centro gastron칩mico.
Se encuentra recientemente remodelada.
Tiene 3 dormitorios, 2 ba침os, cocina americana, logia, living comedor y amplia terraza.
Se arrienda con kayac, parrilla y juegos de mesa.
Se arrienda con 2 estacionamientos sin cargo, fuera del recinto a 200 mt aprox.","['Acceso a la playa', 'Frente a la playa']",4.92,13,Mar칤a Fernanda,12-2019,https://www.airbnb.cl/rooms/41175014?adults=1&children=0&infants=0&pets=0&check_in=2023-03-01&check_out=2023-03-07&previous_page_section_name=1000&federated_search_id=3a1b8eb1-25c5-4e77-b472-0fd14a205aa9
