,Titulo1,Titulo2,Comuna,Capacidad,Camas,N_Habitaciones,Habitaciones,Ba침os,Tipo_Ba침os,Precio,lat,lon,Ubicacion,Ubides,Descripcion,Servicios,Nota,Nnota,Anfitrion,Registro,Link
79,Playa Pichidangui. Acogedora casa,Alojamiento entero,Los Vilos,6,7,3, Habitaci칩n,1,privado,76.6,-32.13504,-71.5314,"https://maps.google.com/maps?ll=-32.13504,-71.5314&z=14&t=m&hl=es&gl=CL&mapclient=apiv3","Me gusta el restaurant Nautilus al lado de la caleta.
caminar, trekking, mountabike, bucear o funboard playa (lado Norte) o por la costa (lado sur). O ir al valle de Quilimari que ingresa a la Cordillera.","Acogedora casa de Playa PICHIDANGUI, primer piso de piedra, segundo piso de madera. Tiene parrilla. Se encuentra al lado de la playa en segunda l칤nea, y a metros  de las escuelas de buceo, negocios y restaurant. No usas el veh칤culo.
Feriados largos, 18 de sept,  vacaciones   de verano, etc  se

El espacio
Tiene estacionamiento privado.  Cocina equipada.Tiene luz, agua potable.
 hayq cancelar $15.000 de  limpieza al salir al cuidador  y anfitrion local don Mauricio",['Vista al patio'],3.73,11,Ignacio,01-2019,https://www.airbnb.cl/rooms/31947579?adults=1&children=0&infants=0&pets=0&check_in=2023-03-01&check_out=2023-03-06&previous_page_section_name=1000&federated_search_id=e2516cb1-a0c0-49fe-82b1-880acddd83e3
80,Caba침a frente al mar,Caba침a entero,Tongoy,6,4,2, Habitaci칩n,1,privado,80.0,-30.24992,-71.49774,"https://maps.google.com/maps?ll=-30.24992,-71.49774&z=14&t=m&hl=es&gl=CL&mapclient=apiv3","Est치s en el mejor sector de Tongoy
Sin embargo debes saber que las calles son de tierra as칤 es que se levanta harto polvo","Caba침a para seis personas vista al mar a pasos de la playa principal de Tongoy

El espacio
La caba침a tiene una pieza matrimonial 
Otra pieza con dos camas plaza y media 
Y pegado a esa hay un camarote 

Tienes living comedor donde puedes mirar el mar 
Y una cocina americana",['Vista al mar'],4.20,15,Patricio,03-2016,https://www.airbnb.cl/rooms/14819637?adults=1&children=0&infants=0&pets=0&check_in=2023-03-08&check_out=2023-03-13&previous_page_section_name=1000&federated_search_id=e2516cb1-a0c0-49fe-82b1-880acddd83e3
81,Caba침a de retiro El Arrebol,Caba침a entero,La Serena,4,3,2, Habitaci칩n,1,privado,45.0,-29.7125,-71.3101,"https://maps.google.com/maps?ll=-29.7125,-71.3101&z=14&t=m&hl=es&gl=CL&mapclient=apiv3","Tranquilo ideal para compartir en pareja.
El hermoso entorno con naturaleza nativa de la zona se caracteriza principalmente por los Copaos, y por los distintos tipos de cactus ,flores y hierbas silvestres entre ella la hermosa a침a침uca.
Hermosas vistas de atardeceres,치rboles y estrellas. Playas cercanas como caleta San Pedro,punta de teatinos,caleta de hornos,punta de choros,playa el faro la serena.","Disfruta de la sencillez de este alojamiento tranquilo y r칰stico.

El espacio
Caba침a el 치rrebol te invita a disfrutar de la tranquilidad de   Bah칤a array치n.  Un hermoso lugar  con vista al mar.  Arreboles,noches estrelladas el canto maravilloso de los p치jaros , el aire puro del lugar.
ven a descansar y a conectar en este hermoso lugar  ubicado en la cuarta regi칩n de Chile  La serena, Coquimbo.",['Vista a la bah칤a'],,,Ana Karina,12-2022,https://www.airbnb.cl/rooms/785571918776190574?adults=1&children=0&infants=0&pets=0&check_in=2023-03-01&check_out=2023-03-08&previous_page_section_name=1000&federated_search_id=e2516cb1-a0c0-49fe-82b1-880acddd83e3
82,"Caba침a I Guanaqueros, arriendo solo a familias.",Caba침a entero,Coquimbo,5,4,2, Habitaci칩n,1,privado,95.0,-30.19243,-71.4044,"https://maps.google.com/maps?ll=-30.19243,-71.4044&z=14&t=m&hl=es&gl=CL&mapclient=apiv3",,"Caba침as  equipadas para 5 personas  en exclusivo condominio  Guanaqueros, el mejor lugar para disfrutar , a 5 min caminado a la playa  . Con acceso controlado al condominio y la playa solo para residentes o propietarios.

El espacio
Unos de los mejores lugares por su ubicaci칩n cercan칤a a la playa las caba침as est치n distanciadas unas de otras y el auto queda a la puerta de la caba침a . Todo esto en un terreno de 2500 mts2 cercados y con un port칩n de acceso a las caba침as y al de condominio se ocupa un control remoto , cada caba침a esta equipada con cobertores y polar m치s almohadas para cada cama",['Costa'],4.40,10,Ivan,10-2018,https://www.airbnb.cl/rooms/29059965?adults=1&children=0&infants=0&pets=0&check_in=2023-03-01&check_out=2023-03-06&previous_page_section_name=1000&federated_search_id=e2516cb1-a0c0-49fe-82b1-880acddd83e3
83,caba침a 13 personas guanaqueros,Caba침a entero,Coquimbo,13,9,6, Habitaci칩n,"6,5",privado,260.0,-30.19636,-71.42664,"https://maps.google.com/maps?ll=-30.19636,-71.42664&z=14&t=m&hl=es&gl=CL&mapclient=apiv3",Hermoso alojamiento a 5 minutos caminando de la famosa playa guanaqueros y del centro gastron칩mico el Suizo (empanadas y mariscos),"Lleva a toda la familia a este fant치stico lugar con muchas zonas para divertirse.

Gran caba침a para 13 personas estacionamiento privado zona de Quincho y piscina dentro de la propiedad con hermosa vista al mar  en av. Guanaqueros, Coquimbo.
por favor leer ""otras notas"" para concepto de Sabanas y pagos asociados.


La caba침a esta equipada para 13 personas.

Cuenta con 6 habitaciones en suite (ba침o privado) m치s un medio ba침o en el pasillo.

4 habitaciones con cama Queen
1 habitacion con dos camas single
1 habitacion con una cama nido + una single. 

Entregamos solo ropa de cama ya sea cubrecama y manta de polar o similar.


S치banas son de cobro adicional.

Cama 2 plazas $5000
Cama single $2500
Toallas $3000


La cocina est치 totalmente equipada.

Adem치s afuera de la gran caba침a contamos con un quincho cerrado frente a la piscina.",['Vista al jard칤n'],,,MurphyGroup,11-2015,https://www.airbnb.cl/rooms/765083059317287321?adults=1&children=0&infants=0&pets=0&check_in=2023-03-03&check_out=2023-03-08&previous_page_section_name=1000&federated_search_id=e2516cb1-a0c0-49fe-82b1-880acddd83e3
84,La casa del 치rbol de Guanaqueros,Alojamiento entero,Coquimbo,6,5,3, Habitaci칩n,2,privado,80.0,-30.1968,-71.4144,"https://maps.google.com/maps?ll=-30.1968,-71.4144&z=14&t=m&hl=es&gl=CL&mapclient=apiv3","En lo general el sector es muy tranquilo y familiar por lo que se pide mantener la m칰sica a volumen moderado y respetar a los vecinos residentes. Existe un almac칠n cercano el cual es habilitado durante las temporadas altas, para realizar otras compras o disfrutar de la gastronom칤a local deben hacerlo en el ""poblado de Guanaqueros"". Se recomienda viajar con efectivo ya que que s칩lo hay 2 cajeros autom치ticos en la zona (1 en Guanaqueros y otro en Tongoy), los que se quedan sin dinero r치pidamente. Algunos negocios locales cuentan con Redbanc. La playa se encuentra a aproximadamente 5 min. caminando desde la casa.","La casa est치 ubicada en el mejor lugar residencial de Guanaqueros, a menos de 5 min. caminando de la playa. Cuenta con todos los servicios b치sicos, estacionamiento para 2 autos y quincho para asados. Existe un peque침o almac칠n cercano que es habilitado durante temporadas altas.  Quienes conocen Guanaqueros saben que es un lugar bastante tranquilo para pasar las vacaciones y a quienes no lo hacen los invito a recorrer sus lindas y tranquilas playas.


Cuenta con 3 habitaciones y 2 ba침os, quincho, balc칩n con vista al mar y estacionamiento techado, adem치s de per칤metro cercado para mayor seguridad de quienes nos visitan.",['Vista al mar'],4.60,10,Maira,05-2015,https://www.airbnb.cl/rooms/29048004?adults=1&children=0&infants=0&pets=0&check_in=2023-03-01&check_out=2023-03-06&previous_page_section_name=1000&federated_search_id=e2516cb1-a0c0-49fe-82b1-880acddd83e3
85,M치gico lugar a pasos del mar,Habitaci칩n privada en caba침a,La Ligua,5,5,3, Habitaci칩n,2,privado,140.0,-32.2426,-71.5153,"https://maps.google.com/maps?ll=-32.2426,-71.5153&z=14&t=m&hl=es&gl=CL&mapclient=apiv3","Caminable hacia almacenes y supermercados, restaurantes, atractivos naturales, playa, y m치s.","Excelente lugar para trabajo online con buena conectividad y un entorno privilegiado en primera l칤nea frente al mar. 
Acogedora casa de madera de un piso en primera l칤nea frente al mar en sector residencial de baja densidad en Los Molles. La caba침a tiene 3 dormitorios y dos ba침os mas un amplio estar con cocina abierta. Tiene una gran terraza.
Acceso a caminatas, y parques  para disfrutar de la naturaleza.
Convenio con escuela de buceo y trekking por los alrededores. Restaurantes y mucho m치s.


La casa es muy c칩moda, entorno silencioso y privilegiada vista al mar y al rompeolas de Los Molles. A 5 minutos caminando de la playa, caleta de pescadores y restaurantes, y a 10 minutos caminando del Parque Puqu칠n.",['Vista al oc칠ano'],5.0,3,Alejandra,10-2018,https://www.airbnb.cl/rooms/31316465?adults=1&children=0&infants=0&pets=0&check_in=2023-03-01&check_out=2023-03-06&previous_page_section_name=1000&federated_search_id=e2516cb1-a0c0-49fe-82b1-880acddd83e3
86,Bella Casa en Bah칤a Azul,Alojamiento entero,Los Vilos,6,3,3, Habitaci칩n,2,privado,110.0,-32.00308,-71.51818,"https://maps.google.com/maps?ll=-32.00308,-71.51818&z=14&t=m&hl=es&gl=CL&mapclient=apiv3","Es un lugar alejado del ruido y muy tranquilo ,especial para el descanso.","La casa tiene 3 habitaciones que pueden acomodar 6 personas m치ximo. Cocina americana, dos ba침os, living comedor amplio, ideal para parejas, familias grandes o grupos de amigos o amigas que quieran pasar un tiempo agradable alejados del ruido de la ciudad. La casa est치 emplazada dentro del condominio de Bah칤a Azul y acceso exclusivo a los roquerios

Acceso de los hu칠spedes
Tienes derecho a usar toda la casa, excepto  el segundo piso ya que no  esta  habilitado .",['Vista al patio'],4.70,10,Catalina,03-2018,https://www.airbnb.cl/rooms/33881492?adults=1&children=0&infants=0&pets=0&check_in=2023-03-01&check_out=2023-03-06&previous_page_section_name=1000&federated_search_id=e2516cb1-a0c0-49fe-82b1-880acddd83e3
87,"Casa el lugar tranquilo, agradable a pasos del mar",Alojamiento entero,La Serena,8,6,3, Habitaci칩n,1,privado,67.0,-29.87229,-71.27069,"https://maps.google.com/maps?ll=-29.87229,-71.27069&z=14&t=m&hl=es&gl=CL&mapclient=apiv3",Casa nueva y vecindario tranquilo,"Rel치jate en esta escapada 칰nica y tranquila. Casa ubicada a 300 metros de la playa, 300 metros de centro gastron칩mico, con negocios cercanos y v칤as despejadas.

El espacio
Construcci칩n s칩lida",['Acceso la playa P칰blico o compartido'],5.0,12,Henry,01-2022,https://www.airbnb.cl/rooms/556707130321751940?adults=1&children=0&infants=0&pets=0&check_in=2023-03-01&check_out=2023-03-06&previous_page_section_name=1000&federated_search_id=e2516cb1-a0c0-49fe-82b1-880acddd83e3
88,"""El Atardecer"", casa frente a Pichidangui",Habitaci칩n privada en alojamiento,Regi칩n de Coquimbo,6,6,3, Habitaci칩n,3,privado,53.1,-32.11583,-71.50389,"https://maps.google.com/maps?ll=-32.11583,-71.50389&z=14&t=m&hl=es&gl=CL&mapclient=apiv3","En el sector hay tanto restaurantes lujosos como de comidas t칤picas chilenas (picadas).
Lugar ideal para descansar en familia y/o con amigos, por su amplio quincho, asaderas y sillas de playa.","Casa acogedora ubicada en un condominio exclusivo a 5 min de Pichidangui,  posee linda vista al mar y agua potable permanente,  ba침os con ducha de agua caliente; hay espacios independientes y dependientes; en el sector hay  supermercados y una excelente peluquera (Marcela) as칤 como masajistas.
Cerca existen ba침os calientes de agua de mar, la ruta 5 y la linda ruta del cuarzo.
Caminando se llega al mar.
El propietario recibe y atiende personalmente a sus hu칠spedes debido a que vive en el lugar


Lugar ideal para descansar, se llega caminando al mar, al medio de la bah칤a de Pichidangui.",['Acceso la playa P칰blico o compartido'],4.43,49,Patricio,11-2018,https://www.airbnb.cl/rooms/32025533?adults=1&children=0&infants=0&pets=0&check_in=2023-03-20&check_out=2023-03-26&previous_page_section_name=1000&federated_search_id=e2516cb1-a0c0-49fe-82b1-880acddd83e3
89,Caba침a amplia en Pichidangui para 9 personas.,Caba침a entero,Pichidangui,8,7,4, Habitaci칩n,2,privado,54.0,-32.15285,-71.51013,"https://maps.google.com/maps?ll=-32.15285,-71.51013&z=14&t=m&hl=es&gl=CL&mapclient=apiv3","lugar muy tranquilo, con una linda vista, acogedor, amplio.","C칩moda caba침a en Pichidangui Oriente, de 4 dormitorios, 2 ba침os, amplia terraza con hermosa vista, cocina full equipada, TV cable. Ubicada en sector tranquilo y familiar, con posibilidad de hacer deportes acu치ticos en la playa, trecking, caminatas y motocross, cabalgata. A 5 minutos de la playa (en auto).

El espacio
caba침a de 4 dormitorios
1er cama matrimonial con ba침o privado
2do cama matrimonial
3ro 2 camarotes (4 camas)
4to cama 1 1/2 media
ba침o amplio

living, comedor y cocina totalmente equipada

amplio balcon cerrado  en altura seguro para ni침os",['Vista a la bah칤a'],4.33,7,Silvana,01-2017,https://www.airbnb.cl/rooms/16602413?adults=1&children=0&infants=0&pets=0&check_in=2023-03-01&check_out=2023-03-06&previous_page_section_name=1000&federated_search_id=e2516cb1-a0c0-49fe-82b1-880acddd83e3
90,Caba침a amplia en Pichidangui para 9 personas.,Caba침a entero,Pichidangui,8,7,4, Habitaci칩n,2,privado,54.0,-32.15285,-71.51013,"https://maps.google.com/maps?ll=-32.15285,-71.51013&z=14&t=m&hl=es&gl=CL&mapclient=apiv3","lugar muy tranquilo, con una linda vista, acogedor, amplio.","C칩moda caba침a en Pichidangui Oriente, de 4 dormitorios, 2 ba침os, amplia terraza con hermosa vista, cocina full equipada, TV cable. Ubicada en sector tranquilo y familiar, con posibilidad de hacer deportes acu치ticos en la playa, trecking, caminatas y motocross, cabalgata. A 5 minutos de la playa (en auto).

El espacio
caba침a de 4 dormitorios
1er cama matrimonial con ba침o privado
2do cama matrimonial
3ro 2 camarotes (4 camas)
4to cama 1 1/2 media
ba침o amplio

living, comedor y cocina totalmente equipada

amplio balcon cerrado  en altura seguro para ni침os",['Vista a la bah칤a'],4.33,7,Silvana,01-2017,https://www.airbnb.cl/rooms/16602413?adults=1&children=0&infants=0&pets=0&check_in=2023-03-01&check_out=2023-03-06&previous_page_section_name=1000&federated_search_id=011f5b69-8b85-47c1-bd62-7292de9e3c8f
91,Caba침a familiar- palafito2D y 1B con vista al mar.,Caba침a entero,Pichidangui,5,4,2, Habitaci칩n,1,privado,73.0,-32.13938,-71.53015,"https://maps.google.com/maps?ll=-32.13938,-71.53015&z=14&t=m&hl=es&gl=CL&mapclient=apiv3","Iglesia, playa y roquerios","Acogedora caba침a Familiar en palafitos, dos habitaciones y un ba침o (matrimonial con peque침o balc칩n con vista al mar),cocina americana equipada con comedor de diario, estacionamiento privado y entrada independiente.Peque침o patio para hacer asados.
A 5 minutos caminando (350 metros) de la playa y 2 minutos de la iglesia y roquerios, cercano a comercio y centros de buceo.
Televisi칩n con cable.
Balneario caracterizado por su playa de 5 km, aguas tranquilas 2 horas de Stgo.


Alojamiento cercano a comercio y a 5 minutos de la playa.
Vista al mar y sector tranquilo. 
No se aceptan perros.",['Vista al mar'],4.79,14,Claudio,11-2017,https://www.airbnb.cl/rooms/21738708?adults=1&children=0&infants=0&pets=0&check_in=2023-03-01&check_out=2023-03-06&previous_page_section_name=1000&federated_search_id=011f5b69-8b85-47c1-bd62-7292de9e3c8f
92,Casa amplia y c칩moda,Alojamiento entero,Los Vilos,5,6,3, Habitaci칩n,1,privado,35.0,-31.91083,-71.49787,"https://maps.google.com/maps?ll=-31.91083,-71.49787&z=14&t=m&hl=es&gl=CL&mapclient=apiv3","Supermercado, carnicer칤as y panader칤a a menos de 3 cuadras","Casa c칩moda,  privacidad completa, no se comparte espacios, sector tranquilo a 2 cuadras de polic칤a (PDI), a 6 cuadras de la playa, fuera de zona de riesgo de tsunami, locomoci칩n colectiva a la puerta. No hay otros hu칠spedes,  contacto con propietario cada 1-3 d칤as (dependiendo temporada) para poder regar plantas y 치rboles del lugar que no se muestran en las fotos, se avisa del acceso y se ingresa por un pasillo lateral. Lavadora de ropa de 9 Kg",['Costa'],,,C칠sar,03-2020,https://www.airbnb.cl/rooms/42841941?adults=1&children=0&infants=0&pets=0&check_in=2023-03-01&check_out=2023-03-06&previous_page_section_name=1000&federated_search_id=011f5b69-8b85-47c1-bd62-7292de9e3c8f
93,Guanaqueros lugar ideal para la familia,Alojamiento entero,Coquimbo,8,8,4, Habitaci칩n,3,privado,135.0,-30.196,-71.42153,"https://maps.google.com/maps?ll=-30.196,-71.42153&z=14&t=m&hl=es&gl=CL&mapclient=apiv3",sector residencial,"Comoda casa a pasos de la playa

El espacio
amplios dormitorios y patio con quincho para asados",['Vista al oc칠ano'],,,Patricia,06-2017,https://www.airbnb.cl/rooms/47029998?adults=1&children=0&infants=0&pets=0&check_in=2023-03-01&check_out=2023-03-06&previous_page_section_name=1000&federated_search_id=011f5b69-8b85-47c1-bd62-7292de9e3c8f
94,Caba침a alquilar Puertas Abiertas Valle de Elqui,Caba침a entero,Coquimbo,6,8,4, Habitaci칩n,1,privado,89.179,-29.92172,-71.19038,"https://maps.google.com/maps?ll=-29.92172,-71.19038&z=14&t=m&hl=es&gl=CL&mapclient=apiv3",,"Mi alojamiento es bueno para parejas, aventureros, viajeros de negocios, y mascotas.
Cerca de todo. Valle del Elqui, tambi칠n aceptamos mochileros en carpa",['Vista a las monta침as'],4.89,9,Lizabeth,11-2016,https://www.airbnb.cl/rooms/16931805?adults=1&children=0&infants=0&pets=0&check_in=2023-03-01&check_out=2023-03-06&previous_page_section_name=1000&federated_search_id=011f5b69-8b85-47c1-bd62-7292de9e3c8f
95,Caba침a depto. Boutique Los Molles1,Caba침a entero,La Ligua,4,3,2, Habitaci칩n,1,privado,80.0,-32.23696,-71.51728,"https://maps.google.com/maps?ll=-32.23696,-71.51728&z=14&t=m&hl=es&gl=CL&mapclient=apiv3",es un lugar muy tranquilo y familiar. caminando podras conocer esta localidad,"Departamentos Boutique Los Molles 
Full equipado, wifi, cable , quincho , terraza con pasto sintetico. Capacidad 5 personas y mascota.
Estan ubicados caminando:
8 minutos de la playa y 4 minutos de minimarket.
Puedes realizar: trekking, bicicleta, running , buceo y visitar la reserva natural Puquen 
Ideal para disfrutar unas vacaciones inolvidables en familia.


las caba침as estan equipadas para todo lo necesario para disfrutar de unos dias inolvidables en Los Molles",['Acceso la playa P칰blico o compartido'],4.69,48,Karen,07-2017,https://www.airbnb.cl/rooms/22862790?adults=1&children=0&infants=0&pets=0&check_in=2023-03-01&check_out=2023-03-06&previous_page_section_name=1000&federated_search_id=011f5b69-8b85-47c1-bd62-7292de9e3c8f
96,"Caba침as Armandi침os 3, Pichidangui, Casa Patronal",Alojamiento entero,Pichidangui,15,14,4, Habitaci칩n,"1,5",privado,160.0,-32.1368,-71.5302,"https://maps.google.com/maps?ll=-32.1368,-71.5302&z=14&t=m&hl=es&gl=CL&mapclient=apiv3","Al estar a pocos metros de la playa y la caleta, cuenta con servicios tur칤sticos, de abastecimientos y gastron칩micos.","A pasos de la playa encontrar치s un excelente hogar para ti y tu familia; en el cual podr치n compartir,  descansar y volver a cargarse de energ칤as para recorrer variados y cercanos paisajes de inter칠s tur칤stico y deportivo.

El espacio
Escalera necesaria para subir a los dormitorios, al medio ba침o y la terraza.
Sin embargo, en el primer nivel existen:
- camas de plaza y media en los espacios comunes del living-comedor
- cocina, ba침o completo y terraza a nivel de suelo
Por todo lo anterior, no es necesario subir si tienes dificultades de desplazamiento.",['Costa'],,,Watton Sergio Carlos,08-2016,https://www.airbnb.cl/rooms/14804973?adults=1&children=0&infants=0&pets=0&check_in=2023-03-01&check_out=2023-03-07&previous_page_section_name=1000&federated_search_id=011f5b69-8b85-47c1-bd62-7292de9e3c8f
97,Casa del Cactus,Alojamiento entero,Guanaquero,10,7,3, Habitaci칩n,2,privado,152.0,-30.1969,-71.4221,"https://maps.google.com/maps?ll=-30.1969,-71.4221&z=14&t=m&hl=es&gl=CL&mapclient=apiv3",,"Amplia casa a solo 180 metros de una de las mejores playas de Chile, por el sector encontraras gastronom칤a y panoramas t칤picos de la zona. Adem치s, esta full equipada para que te sientas acogido en estas vacaciones.
Casa cuenta con sector fogata, parrilla, lavadora, internet, TV (Netflix, Disney+, Cable y otros), juegos de mesas y estacionamiento para 4 autos entre otras de sus cualidades.

N칰mero de permiso
56932750165",['Vista al mar'],,,Rodrigo,01-2018,https://www.airbnb.cl/rooms/775594083882844941?adults=1&children=0&infants=0&pets=0&check_in=2023-03-01&check_out=2023-03-06&previous_page_section_name=1000&federated_search_id=011f5b69-8b85-47c1-bd62-7292de9e3c8f
98,Casa en Tongoy,Alojamiento entero,Coquimbo,7,5,3, Habitaci칩n,1,privado,75.0,-30.26474,-71.49084,"https://maps.google.com/maps?ll=-30.26474,-71.49084&z=14&t=m&hl=es&gl=CL&mapclient=apiv3","Vencindario muy tranquilo, cercano a la playa grande y grato para el descanso","Casa en primer piso, solida y acogedora. (Se hace referencia que el segundo piso se encuentra otra casa que NO se arrienda, es de los propietarios y todo es totalmente independiente) 
Cocina equipada, cercano a playa grande de Tongoy (a 5 min caminando). 
Capacidad 7 personas, pasajero adicional paga cargo extra.


Casa muy amplia, comoda y fresquita, idealmemte para capear el calor del verano. Cuenta con un antejardin tipo terraza y un patio trasero. Es un casa de descanso",['Acceso a la playa'],4.74,20,Maria,10-2021,https://www.airbnb.cl/rooms/22646749?adults=1&children=0&infants=0&pets=0&check_in=2023-03-01&check_out=2023-03-06&previous_page_section_name=1000&federated_search_id=011f5b69-8b85-47c1-bd62-7292de9e3c8f
99,Casa en Coquimbo cercana a playa La Herradura,Alojamiento entero,Coquimbo,6,5,4, Habitaci칩n,2,privado,55.0,-29.97093,-71.34135,"https://maps.google.com/maps?ll=-29.97093,-71.34135&z=14&t=m&hl=es&gl=CL&mapclient=apiv3",Sector tranquilo y familiar,"Departamento interior ubicado en sector residencial El Llano, cercano a playa La Herradura, Hospital, Pampilla de Coquimbo y Universidad Cat칩lica del Norte. Adem치s se encuentra a pocos minutos de supermercados, gasolineras, pasteler칤a, pizzer칤a, entre otros.

Construcci칩n s칩lida completamente nueva. Cocina completamente equipada con refrigerador, microondas, hervidor, cubiertos, loza, cocina, juego de ollas, vasos, entre otros.

Camas completamente equipadas, incluso con s치banas.


Casa nueva con 4 habitaciones, 2 ba침os, cocina comedor y patio",['Costa'],4.90,10,Leslie,09-2018,https://www.airbnb.cl/rooms/28524115?adults=1&children=0&infants=0&pets=0&check_in=2023-03-01&check_out=2023-03-06&previous_page_section_name=1000&federated_search_id=011f5b69-8b85-47c1-bd62-7292de9e3c8f
100,Morrillos Casa nueva en condominio 6 camas C4Norte,Alojamiento entero,Coquimbo,7,5,2, Habitaci칩n,2,privado,230.0,-30.12524,-71.36907,"https://maps.google.com/maps?ll=-30.12524,-71.36907&z=14&t=m&hl=es&gl=CL&mapclient=apiv3","Casa frente al mar - Playa Morrillos.
Condominio privado con seguridad y port칩n el칠ctrico.
A 10 minutos a pie se encuentra reserva ecolog칤a Humedal Adelaida, lugar de avistamiento de aves","Casa en condominio privado con grato ambiente familiar de descanso, playa y desconexi칩n de la ciudad. Port칩n el칠ctrico y cuidador 24hrs. A pasos de la playa!

15 minutos de Guanaqueros y Coquimbo (Supermercados, Casino, tiendas y aeropuerto). 

Casa full equipada para 6 personas. 2 habitaciones, 2 ba침os (principal en suit), cocina americana integrada y terraza.  105m2 de construcci칩n solida, terraza de 50 m2 con semi sombra, 2 estacionamientos.


2 casas nuevas contiguas, ventanas de termopanel y cortinas roller para m치ximo confort. Cada casa tiene 2 piezas, 2 ba침os, logia, cocina americana integrada y 2 estacionamientos.

Lugar full equipado con ropa de cama, toallas, enseres de cocina, horno el칠ctrico y a gas, lavavajillas, parrilla, con logia particular y lavander칤a compartida.

Agua de la llave no apta para consumo, dispensadores de bidones de agua en el lugar.

Para grupos familiares grandes, se pueden arrendar las 2 casas al mismo tiempo y hacer uso de del complejo completo (para uso de 12-14personas). Cada casa tiene 4 camas + matrimonial + sof치 cama = 7

VISTAS AL MAR DESDE TODO EL LUGAR",['Vista a la bah칤a'],5.0,4,Jose Tomas,06-2017,https://www.airbnb.cl/rooms/47370921?adults=1&children=0&infants=0&pets=0&check_in=2023-03-01&check_out=2023-03-06&previous_page_section_name=1000&federated_search_id=011f5b69-8b85-47c1-bd62-7292de9e3c8f
101,Gran casa orilla de mar,Casa de campo entero,Totoralillo,15,15,7, Habitaci칩n,5,privado,250.0,-32.03337,-71.51626,"https://maps.google.com/maps?ll=-32.03337,-71.51626&z=14&t=m&hl=es&gl=CL&mapclient=apiv3","Un lugar unico frente al mar con un entorno tranquilo , con lugares muy lindos para ir a caminar , picinas naturales y playas ideales para la pesca .
Para cualquier consulta o pedido la anfitriona vive en la casa vecina, est치 siempre disponible","Crea recuerdos inolvidables en este alojamiento 칰nico y familiar.

El espacio
Casa en frente del mar, estupenda vista , muy privada y tranquila",['Acceso a la playa'],4.50,4,Patricia,12-2020,https://www.airbnb.cl/rooms/53998890?adults=1&children=0&infants=0&pets=0&check_in=2023-03-01&check_out=2023-03-08&previous_page_section_name=1000&federated_search_id=011f5b69-8b85-47c1-bd62-7292de9e3c8f
