,Titulo1,Titulo2,Comuna,Capacidad,Camas,N_Habitaciones,Habitaciones,Baños,Tipo_Baños,Precio,lat,lon,Ubicacion,Ubides,Descripcion,Servicios,Nota,Nnota,Anfitrion,Registro,Link
41,La Joyita de Guanaqueros,Alojamiento entero,Guanaquero,4,3,3, Habitación,2,privado,60.0,-30.19589,-71.4325,"https://maps.google.com/maps?ll=-30.19589,-71.4325&z=14&t=m&hl=es&gl=CL&mapclient=apiv3","La Joyita se ubica a solo metros del centro operacional de Guanaqueros, por ejemplo al
Restaurante “El Pequeño” se puede llegar a pie en menos de 2 minutos, también puedes encontrar dos minimarket a 100m.

Es importante indicar que el estacionamiento es en la calle y al frente de la propiedad, el sector es muy tranquilo, se encuentra muy cerca de la delegación municipal de Coquimbo.","Único y acogedor lugar para disfrutar de tus vacaciones, inmejorable ubicación, cercano a restaurantes, todo tipo de comercio y a menos  de 3 minutos  caminando de la playa. 
La casa cuenta con tres niveles con espectaculares vistas a la bahía. El patio interior en doble altura es fresco y sombreado especial para pasar el verano. Los dormitorios se ubican en segundo y tercer piso.  
Totalmente equipada, vas a encontrar en cada rincón hermosos detalles que harán muy grata tu estadía


Al ingresar a la casa llegarás primero al patio interior, donde se encuentra el sector de parrilla y el ficus que da sombra al lugar. A un costado podrás entrar al living y cocina, el baño del primer piso tiene salida directo al pasillo exterior. Al fondo de la casa encontrarás un pequeño jardín donde podrás colgar tus toallas, además tenemos lavadora de uso gratuito para los huéspedes. La escalera para subir al segundo piso está en el exterior tal como lo muestran las fotos. Al llegar al segundo piso te encontrarás con el acceso a los dormitorios y con un gran balcón con vista a la playa. Al interior del segundo piso podrás encontrar el primer dormitorio, más un espacio tipo sala de estar con un rinconcito para tomar café y té, además del segundo baño y un walk in closet pequeño.
Desde la sala de estar se. Sube al tercer piso donde se ubica el otro dormitorio con una hermosa vista a la bahía.",['Vista a la bahía'],4.63,16,Claudia,08-2016,https://www.airbnb.cl/rooms/53129981?adults=1&children=0&infants=0&pets=0&check_in=2023-03-03&check_out=2023-03-08&previous_page_section_name=1000&federated_search_id=ec6f2179-1ae5-4157-9b51-cd5c97fce078
42,Casa campo con piscina y tinaja,Alojamiento entero,Coquimbo,11,8,4, Habitación,"2,5",privado,88.2,-30.06,-71.2537,"https://maps.google.com/maps?ll=-30.06,-71.2537&z=14&t=m&hl=es&gl=CL&mapclient=apiv3",,Lleva a toda la familia a este fantástico lugar con muchas zonas para disfrutar de unos días de relajo .,['Vista a las montañas'],5.0,5,Enrique,11-2020,https://www.airbnb.cl/rooms/792865932033552118?adults=1&children=0&infants=0&pets=0&check_in=2023-03-02&check_out=2023-03-07&previous_page_section_name=1000&federated_search_id=ec6f2179-1ae5-4157-9b51-cd5c97fce078
43,Casa Refugio Ensenada,Cabaña entero,Los Vilos,6,4,3, Habitación,2,privado,110.0,-31.91588,-71.50181,"https://maps.google.com/maps?ll=-31.91588,-71.50181&z=14&t=m&hl=es&gl=CL&mapclient=apiv3","Condominio Ensenada, ubicado en el km 213 de la Ruta 5 Norte con acceso controlado.","Casa Refugio Ensenada es el lugar ideal para disfrutar de la tranquilidad de la playa en un espacio amplio y familiar con vista panorámica al mar. Inserta en un terreno de 5000m2 de desconexión, acogida con tres bellas terrazas que te invitan a disfrutar de un dedicado jardín, cielos estrellados que hacen una estancia inolvidable. 
La casa es parte de Condominio Ensenada, seguro con acceso controlado y una pequeña playa que los niños pequeños disfrutarán.


Dentro del condominio hay una playita pequeña en la cual pueden disfrutar del mar, sol y tranquilidad. Esta se encuentra a 3 cuadras de la Casa Refugio.",['Vista a la bahía'],,,Loreto,01-2023,https://www.airbnb.cl/rooms/805188901911719531?adults=1&children=0&infants=0&pets=0&check_in=2023-02-26&check_out=2023-03-03&previous_page_section_name=1000&federated_search_id=ec6f2179-1ae5-4157-9b51-cd5c97fce078
44,Casa para descansar. Extraordinaria vista al mar,Casa de campo entero,Los Vilos,6,4,3, Habitación,2,privado,140.0,-31.95634,-71.49631,"https://maps.google.com/maps?ll=-31.95634,-71.49631&z=14&t=m&hl=es&gl=CL&mapclient=apiv3",,"Desconecta de tus preocupaciones en este espacio tan amplio y sereno.

Otros aspectos a destacar
El lugar invita a caminar y recorrer la costa rocosa y acantilados. También hay pequeñas playas. Si te interesa la arquitectura, encontrarás casas de arquitectos famosos.",['Vista al océano'],5.0,16,Clemente,03-2014,https://www.airbnb.cl/rooms/52627860?adults=1&children=0&infants=0&pets=0&check_in=2023-03-08&check_out=2023-03-13&previous_page_section_name=1000&federated_search_id=ec6f2179-1ae5-4157-9b51-cd5c97fce078
45,Acogedora Cabaña en Guanaqueros,Cabaña entero,Guanaqueros,6,5,3, Habitación,2,privado,65.6,-30.20248,-71.41405,"https://maps.google.com/maps?ll=-30.20248,-71.41405&z=14&t=m&hl=es&gl=CL&mapclient=apiv3","Emplazada dentro de condominio con guardias y cámaras de seguridad. Posee areas verdes y juegos infantiles en plaza principal.
Se puede ir caminando a la playa o bien en auto 5 min app. El balneario de Guanaqueros tiene una larga costa con aguas tranquilas ideal para familias.

La distancia del pueblo de Guanaqueros es de 5-10 min en auto, donde encontrara variada oferta gastronómica, minimarket y negocios locales. Dos veces a la semana se instala feria al costado de la iglesia.
Existe locomoción que se puede utilizar para acercamiento al pueblo o bien se puede ir caminando por la playa.

En el muelle se pueden adquirir productos del mar frescos y realizar tours por la bahia para avistamiento de delfines.

Durante la época estival se realizan diversas actividades de entretención ( música en vivo, yoga y ferias gastronómicas)

Existen otros balnearios cerca como: Playa Blanca, Puerto Velero y Tongoy.","Acogedora cabaña en condominio con seguridad y áreas verdes.
La cabaña estilo vintage, cuenta con las comodidades esenciales para recibir a una familia e incluso mascota pequeña.
Cuenta con acceso y estacionamiento de hasta 2 vehiculos.
Posee terraza con vista parcial al mar y parrilla.


Living comedor con cocina integrada. Pieza principal con cama 2 plazas, segundo dormitorio con 2 camas de plaza y media, tercer dormitorio con camarote de 1 plaza.
2 baños, 1 completo, segundo con ducha sin tina.
Terraza frontal con parrilla y muebles de terraza. 
Cuenta con patio posterior con vegetación autóctona.

Posse acceso de autos a través de 2 portones con corredera.
El acceso a la casa tiene una pequeña escalera lateral.

Cuenta con TV satelital con canales básicos. La señal de celular es intermitente en temporada.",['Acceso la playa Público o compartido'],,,Fabiola,08-2015,https://www.airbnb.cl/rooms/822438977607480601?adults=1&children=0&infants=0&pets=0&check_in=2023-02-28&check_out=2023-03-05&previous_page_section_name=1000&federated_search_id=ec6f2179-1ae5-4157-9b51-cd5c97fce078
46,"Retiro a la tranquilidad , espacio minimalista",Alojamiento entero,Tongoy,8,6,3, Habitación,2,privado,190.0,-30.30311,-71.54034,"https://maps.google.com/maps?ll=-30.30311,-71.54034&z=14&t=m&hl=es&gl=CL&mapclient=apiv3",Barrio muy tranquilo con guardia permanente,"Disfruta de una visita memorable cuando te quedes en este lugar único. Tranquilo al lado del humedal Pachingo y a 400mt de la playa en la noche oscuridad absoluta permite ver las estrellas  y disfrutar del silencio, cuenta con 6 camas, tres piezas y dos baños a 10 minutos de Tongoy en auto hacia Puerto Aldea por camino costero apto para todo tipo de auto y para persona discapacitada ya que cuenta con Rampla de acceso se permite mascota pequeña se incluyen sábanas solo traer toallas


Cocina abierta lugar espacioso y tranquilo para disfrutar del silencio y la naturaleza, estacionamiento para varios autos pieza principal con walking closet segunda pieza cama de 2 plazas con gran closet y tercera pieza  con 2 camarotes también cuenta con cajoneras y espacio para guardar terraza con linda vista al condominio y al fondo el mar",['Vista al horizonte de la ciudad'],,,Carolina,07-2019,https://www.airbnb.cl/rooms/800596250703355288?adults=1&children=0&infants=0&pets=0&check_in=2023-02-20&check_out=2023-02-27&previous_page_section_name=1000&federated_search_id=ec6f2179-1ae5-4157-9b51-cd5c97fce078
47,Casa ola,Alojamiento entero,Huentelauquén,14,12,5, Habitación,"4,5",privado,480.247,-31.5159,-71.5674,"https://maps.google.com/maps?ll=-31.5159,-71.5674&z=14&t=m&hl=es&gl=CL&mapclient=apiv3",,"Casa ideal para compartir en familia. 2 habitaciones en suite, 1 habitación con camarotes, 1 habitación con camas nido, una habitación con cama clinica y cama adicional / escritorio para trabajar.
Cocina de autor / amplios espacios para compartir / casa en tercera línea a 100 metros del mar / completamente equipada. Condominio con canchas de tenis,  futbol, juegos circuito de trote y playa.
*La casa esta equipada para una persona con movilidad reducida (baño, cama clinica y rampas)",['Acceso a la playa'],,,Carlo,10-2016,https://www.airbnb.cl/rooms/798642267569127726?adults=1&children=0&infants=0&pets=0&check_in=2023-02-20&check_out=2023-02-26&previous_page_section_name=1000&federated_search_id=ec6f2179-1ae5-4157-9b51-cd5c97fce078
48,"Casa Higuera en Montegrande, valle elqui",Alojamiento entero,Paihuano,5,3,3, Habitación,2,privado,110.0,-30.08151,-70.49548,"https://maps.google.com/maps?ll=-30.08151,-70.49548&z=14&t=m&hl=es&gl=CL&mapclient=apiv3",,"Casa familiar adorable muy bien decorada, bellamente iluminada, bosca con leña para invierno, acceso independiente, estacionamiento techado, la casa esta dentro de una campo, privado y silencio,  piscina y quincho para asados.

El espacio
Extraordinaria vista del valle elqui, excelente lugar para observar la naturaleza y las estrellas, agradable clima todo el año. buenas expediciones en la zona.",['Cocina'],4.91,22,Sergio,04-2018,https://www.airbnb.cl/rooms/24542207?adults=1&children=0&infants=0&pets=0&check_in=2023-03-04&check_out=2023-03-09&previous_page_section_name=1000&federated_search_id=ec6f2179-1ae5-4157-9b51-cd5c97fce078
49,"Casa frente al mar Ensenada km 213, Pichidangui",Alojamiento entero,Pichidangui,9,7,4, Habitación,4,privado,245.0,-32.08817,-71.52767,"https://maps.google.com/maps?ll=-32.08817,-71.52767&z=14&t=m&hl=es&gl=CL&mapclient=apiv3",,"Mi alojamiento es bueno para parejas, familias (con hijos) y grupos grandes.

Otros aspectos a destacar
El consumo de agua se cobra por separado, dada la escasez de la zona","['Acceso a la playa', 'Frente a la playa']",4.86,35,Trinidad,04-2016,https://www.airbnb.cl/rooms/12454880?adults=1&children=0&infants=0&pets=0&check_in=2023-03-02&check_out=2023-03-07&previous_page_section_name=1000&federated_search_id=ec6f2179-1ae5-4157-9b51-cd5c97fce078
50,Casa Los molles vista al mar,Alojamiento entero,Los Molles,9,7,4, Habitación,3,privado,162.0,-32.2047,-71.5149,"https://maps.google.com/maps?ll=-32.2047,-71.5149&z=14&t=m&hl=es&gl=CL&mapclient=apiv3","Parcela en condominio cerrado, rodeado de areas verdes, espacios comunes recreativos, apto para caminatas y vista despejada.","Casa con vista privilegiada en seguro y tranquilo condominio Rocas del Mar/ Los Molles. Amplio terreno de entorno natural, cómodos espacios que permiten descansar, relajarse, desconectarse y disfrutar al aire libre.  
A 5 min de Playa Los Molles con acceso directo al pueblo y comercios. Juegos para niños en espacios comunes, juegos para niños, canchas de Padel y futbolito, conserjería 24 hrs. ( Huesped adicional valor $15.000 clp )


Casa cuenta con ventanas termopanel,  baños con ventana, habitaciones con buena ventilacion, luz natural,  sin alfombras, cómodos colchones en buen estado, frazadas , cobertores y almohadas disponibles.",['Vista al océano'],4.50,4,María José,05-2017,https://www.airbnb.cl/rooms/766459731353894354?adults=1&children=0&infants=0&pets=0&check_in=2023-03-12&check_out=2023-03-17&previous_page_section_name=1000&federated_search_id=ec6f2179-1ae5-4157-9b51-cd5c97fce078
51,"Casa de descanso, Diaguitas",Casa de campo entero,Diaguitas,6,5,3, Habitación,2,privado,114.312,-30.02565,-70.64385,"https://maps.google.com/maps?ll=-30.02565,-70.64385&z=14&t=m&hl=es&gl=CL&mapclient=apiv3",A minutos del río y del centro del pueblo,"Disfruta de este encantador lugar ideal para el descanso en familia
A los pies del cerro y a minutos del centro del pueblo.
 Oportunidad única para disfrutar de la tranquilidad del Valle del Elqui.

El espacio
Un lugar tranquilo con muchas áreas verdes y todas las comodidades del hogar.",['Vista a las montañas'],4.81,37,Nicolas,10-2020,https://www.airbnb.cl/rooms/48153416?adults=1&children=0&infants=0&pets=0&check_in=2023-03-06&check_out=2023-03-11&previous_page_section_name=1000&federated_search_id=ec6f2179-1ae5-4157-9b51-cd5c97fce078
52,Casa primera linea 8 Quebradas vista sobrecogedora,Casa de campo entero,Los Vilos,8,6,3, Habitación,"2,5",privado,180.0,-31.96628,-71.4912,"https://maps.google.com/maps?ll=-31.96628,-71.4912&z=14&t=m&hl=es&gl=CL&mapclient=apiv3",,"Disfruta de un lugar único a solo 2,5 horas de Santiago. Casa moderna recién construida, en primera línea frente al mar. Bajada directa a playa de piedras (no apta para baño). Sobrecogedora vista.
Playas a 15-20 minutos en los alrededores, Pichidangui, Los Vilos,  Chigualoco.
Ideal para desconectarse unos días, paseos, caminatas frente a la costa, playas cercanas, 5 km del pueblo de Los Vilos donde podrá encontrar todo tipo de servicios, restoranes, caleta de pescadores, cafetería.


Tres dormitorios, dos en cama matrimonial, más una tercera pieza con 4 camas (camarote + cama con cama nido).

Terraza trasera y frontal, parrilla para asados.

Cafetera Nespresso.

Cocina full equipada.",['Acceso a la playa'],4.79,24,Felipe,12-2013,https://www.airbnb.cl/rooms/53782493?adults=1&children=0&infants=0&pets=0&check_in=2023-03-01&check_out=2023-03-07&previous_page_section_name=1000&federated_search_id=ec6f2179-1ae5-4157-9b51-cd5c97fce078
53,Luminosa casa valle de Elqui. frente a rio Elqui,Alojamiento entero,El Molle,6,5,3, Habitación,2,privado,70.0,-29.98309,-70.95617,"https://maps.google.com/maps?ll=-29.98309,-70.95617&z=14&t=m&hl=es&gl=CL&mapclient=apiv3","La localidad de El Molle es un pintoresco pueblo, que se encuentra ubicada en el Valle de Elqui, Región de Coquimbo, Chile. Se puede acceder por medio de la ruta 41, Gabriela Mistral, a 34 kms. de La Serena, perteneciendo a la comuna de Vicuña. Acá podrás encontrar muy buenos servicios gastronómicos.
Ideal para pegarse una escapada y sentir el clima del Valle de Elqui. El Molle también es conocido por sus exquisitos dulces artesanales que han sido elaborados por décadas, si visitas el pueblito, no debes perder la oportunidad de probarlos.","Cómoda y amplia casa emplazada en un cerro, terreno en altura con vista impresionante al cerro el Molle y rio Elqui. 
Ideal para relajarse y recargar energía durante el día, y en la noche contemplar el mágico y único cielo estrellado (uno de los mas limpios del mundo).
A 5 minutos a pie del pueblo El Molle y del Rio donde también hay pozones para bañarse (acceso público).
Ubicación central, a 25 min de la Serena y de Vicuña.


Terreno de 1000 metros emplazado en el cerro, construido 78 metros 2.
Cuenta con tres terrazas en altura, dos de ellas están habilitadas.
En una de las terrazas está la casa, y en la otra está el comedor abierto, reposeras y piscina estructural de 3.6 mts de diámetro por 1.20 de alto.
La casa tiene 3 dormitorios, 2 baños, cocina, living y comedor integrado, todo con vista al río con grandes ventanales.
La pieza principal cuenta con cama matrimonial y baño en suite.
Una pieza tiene una cama nido de una plaza y media, y la otra con cama nido de una plaza.",['Vista a las montañas'],,,Paula,10-2017,https://www.airbnb.cl/rooms/788265286134644471?adults=1&children=0&infants=0&pets=0&check_in=2023-02-20&check_out=2023-02-25&previous_page_section_name=1000&federated_search_id=ec6f2179-1ae5-4157-9b51-cd5c97fce078
