,Titulo1,Titulo2,Comuna,Capacidad,Camas,N_Habitaciones,Habitaciones,Baños,Tipo_Baños,Precio,lat,lon,Ubicacion,Ubides,Descripcion,Servicios,Nota,Nnota,Anfitrion,Registro,Link
0,Casa con piscina en Cond Agua Dulce Huentelauquén,Alojamiento entero,Angostura,8,5,3, Habitación,2,privado,200.0,-31.5149,-71.5605,"https://maps.google.com/maps?ll=-31.5149,-71.5605&z=14&t=m&hl=es&gl=CL&mapclient=apiv3",,"Casa Nueva, recién construida en Condominio Agua Dulce. El condominio tiene acceso controlado, seguridad permanente y acceso directo a la playa, cuenta con 5 canchas de tenis , 3 canchas de futbolito, caleta de pescadores, juegos para niños y senderos para trekking sin costo extra. 

La casa tiene una hermosa vista a toda la bahía y una piscina de 8 x 4 mts, muy amplia para toda la familia.


La vista al mar es increible, todo el frente de la casa es vidreado, por ende la vista es completa y despejada al mar. El condominio cuenta con caminos con maicillo compactado, ideal para salir a correr, andar en bicicleta o caminar.",['Cocina'],5.0,3,Rodrigo,06-2016,https://www.airbnb.cl/rooms/804957401975945423?adults=1&children=0&infants=0&pets=0&check_in=2023-02-25&check_out=2023-03-02&previous_page_section_name=1000&federated_search_id=39197920-6924-405c-8531-0261442a1820
1,CASA EL ENCANTO PISCO ELQUI,Alojamiento entero,Paihuano,6,6,3, Habitación,2,privado,186.667,-30.15589,-70.49629,"https://maps.google.com/maps?ll=-30.15589,-70.49629&z=14&t=m&hl=es&gl=CL&mapclient=apiv3","Es un barrio cercano al pueblo y alejado del bullicio, puedes subir cerros , caminar al Río observar la naturaleza","Es una casa  estilo moderno muy acogedora amoblada completamente, ubicada en el mejor sector de Pisco Elqui, con vista privilegiada, está cerca del Río Claro es un lugar tranquilo que invita al relajo y la desconexión.
A 4km de la plaza de Pisco Elqui, cercana de restaurantes , almacenes y lugares turísticos (cabalgatas,treking, masajes, yoga).
Es importante señalar que los espacios están diseñados para familias o grupo de amigos


Tiene varias Terrazas , parrilla, piscina , lugares de descanso, hamaca y hot  tub de madera con costo adicional de $ 23.000 por uso",['Vista al jardín'],4.96,54,Mónica,02-2019,https://www.airbnb.cl/rooms/32664151?adults=1&children=0&infants=0&pets=0&check_in=2023-02-27&check_out=2023-03-05&previous_page_section_name=1000&federated_search_id=39197920-6924-405c-8531-0261442a1820
2,Casa familiar Herradura sur,Alojamiento entero,Coquimbo,5,5,3, Habitación,"1,5",privado,41.0,-29.9942,-71.3597,"https://maps.google.com/maps?ll=-29.9942,-71.3597&z=14&t=m&hl=es&gl=CL&mapclient=apiv3",es un barrio tranquilo y seguro.,"Casa nueva de material sólido en primer piso, con acceso a áreas verdes con máquinas de ejercicio y juegos infantiles, cercana a supermercados y bencineras, con conectividad a la carretera y a las mejores playas de la región ( Totoralillo 6 kilómetros, Guanaqueros 20 kilómetros, Tongoy 34 kilómetros y playa la herradura a 1500 metros.
Casa ubicada en Barrio residencial Brisas de Palermo , un lugar muy tranquilo para descansar y estar cerca del mar.


Es una linda casa en un buen entorno muy cercana al mar",['Vista al patio'],4.88,34,Jesús Alonso,04-2017,https://www.airbnb.cl/rooms/30691233?adults=1&children=0&infants=0&pets=0&check_in=2023-02-20&check_out=2023-02-25&previous_page_section_name=1000&federated_search_id=39197920-6924-405c-8531-0261442a1820
3,Casa con Piscina privada Alma Del Elqui,Casa de campo entero,La Serena,8,6,3, Habitación,2,privado,132.0,-30.0203,-70.5248,"https://maps.google.com/maps?ll=-30.0203,-70.5248&z=14&t=m&hl=es&gl=CL&mapclient=apiv3","Es un barrio muy tranquilo con vecinos muy hospitalarios, el nombre del callejón es de aguirre, debido a la primera familia que llegó al sector en el siglo pasado, esta cercado con muros de piedras (pircas) de al menos 200 años algunos de estos del tiempo de los diaguitas. El pueblo de paihuano está a 1 kilometro aprox, donde encontraras negocios, restaurantes, posta de urgencias, bomberos, carabineros, etc. puedes ir en auto o caminando (30 minutos)","Casa Alma del Elqui, Está ubicado antes de llegar a Paihuano Pueblo, inserto en medio del Valle, en ambiente rústico con maderas nobles y muros de piedras natural del mismo valle de Elqui, las sentirás cargadas de pura energía positiva, para que te encuentres contigo mismo, es un paraíso inspirador, especial para compartir en familia, seres queridos y enseñarles a tus hijos sobre las constelaciones en las noches estrelladas.


Es una casa con piscina de uso exclusivo para los huéspedes, 
Es un espacio verde en contraste con el marrón de los cerros y el azul del cielo. una imagen perfecta para guardar en su memoria.",['Cocina'],4.73,86,Claudio Contreras,12-2015,https://www.airbnb.cl/rooms/21867642?adults=1&children=0&infants=0&pets=0&check_in=2023-03-03&check_out=2023-03-08&previous_page_section_name=1000&federated_search_id=39197920-6924-405c-8531-0261442a1820
4,"CASA VICUÑA, VALLE DEL ELQUI . PISCINA Y QUINCHO",Bungalow entero,Vicuña,9,7,4, Habitación,3,privado,142.857,-29.98247,-70.98673,"https://maps.google.com/maps?ll=-29.98247,-70.98673&z=14&t=m&hl=es&gl=CL&mapclient=apiv3","Ubicada frente cervecería Cactus, en la mitad del camino entre La Serena y Vicuña, Valle del Elqui. Es un sector turístico especial para los amantes de la astronomía, deportes acuáticos (cerca embalse Puclaro), comida típica y hermosos e históricos pueblos de alrededor.","Hermosa casa en parcela de agrado, con piscina, tinaja y quincho. Decoración moderna, 4 Dormitorios, 3 baños, habilitada para 9 personas. Cuenta con cocina, refrigerador, tina con hidromasaje, agua caliente, tv cable, mesa ping pong, sendero inclusivo.
Km 30, Ruta 41, Vicuña ( frente a cervecería Cactus), Valle del Elqui.

Valor incluye uso de tinaja agua caliente  para 1 vez durante la estadía. Día uso adicional  tiene un costo diario de $70.000, costo adicional de   invitados $10.000 diarios


Casa que cuenta con todas las comodidades del hogar, rodeada de naturaleza y diversos atractivos turísticos. Especial para el descanso y compartir en familia.",['Vista al valle'],4.70,11,Cristian,12-2018,https://www.airbnb.cl/rooms/31074328?adults=1&children=0&infants=0&pets=0&check_in=2023-02-23&check_out=2023-03-02&previous_page_section_name=1000&federated_search_id=39197920-6924-405c-8531-0261442a1820
5,Linda casa con piscina y entorno campestre,Cabaña entero,Vicuña,6,5,3, Habitación,1,privado,100.0,-30.00054,-70.991,"https://maps.google.com/maps?ll=-30.00054,-70.991&z=14&t=m&hl=es&gl=CL&mapclient=apiv3",,"Linda casa con piscina y juegos infantiles, posee 3 dormitorios habilitados para 6 personas, baño completo, cocina americana equipada con encimera, horno eléctrico, horno microondas, vajilla y lavadora.
La zona exterior cuenta con un quincho, el cual tiene asadera y horno a leña, arboles frutales, piscina y juegos infantiles.
Paisaje hermoso, entorno tranquilo
Ver descripción completa",['Cocina'],4.94,16,Ximena,04-2018,https://www.airbnb.cl/rooms/31650345?adults=1&children=0&infants=0&pets=0&check_in=2023-02-21&check_out=2023-02-26&previous_page_section_name=1000&federated_search_id=39197920-6924-405c-8531-0261442a1820
6,"Casa en parcela, quincho y piscina uso exclusivo",Alojamiento entero,La Serena,7,4,4, Habitación,2,privado,85.0,-29.90666,-71.14043,"https://maps.google.com/maps?ll=-29.90666,-71.14043&z=14&t=m&hl=es&gl=CL&mapclient=apiv3",Es una casa independiente en un condominio de parcelas de agrado en la loma del cerro San Luis del Fundo Loreto. Es un lugar tranquilo y con linda vista.,"Casa independiente ubicada en Parcela a 20 km de La Serena. Con una gran vista al valle donde encontrarán paz y tranquilidad.
Es un lugar semi aislado y  privado.

El espacio
Se accede a una casa habilitada desde hace menos de un año y medio, con derecho a usar quincho y piscina.",['Vista al valle'],4.97,29,Nevenka,01-2021,https://www.airbnb.cl/rooms/47575766?adults=1&children=0&infants=0&pets=0&check_in=2023-02-24&check_out=2023-03-01&previous_page_section_name=1000&federated_search_id=39197920-6924-405c-8531-0261442a1820
7,Casa de campo en Diaguitas,Casa de campo entero,Diaguitas,8,4,4, Habitación,1,privado,150.0,-30.02537,-70.63792,"https://maps.google.com/maps?ll=-30.02537,-70.63792&z=14&t=m&hl=es&gl=CL&mapclient=apiv3",,"El pueblo de Diaguitas esta localizado a 7 Km de Vicuña donde pondrás encontrar artesanía de la zona y la Cervecería Guayacán.

El espacio
La casa rodeada de árboles frutales, lugar tranquilo en dónde se podrá apreciar las estrellas por la noche. Cuenta con áreas comunes amplias al igual que la cocina, que está completamente equipada.
Para capear el calor se cuenta con una amplia piscina, con reposeras.",['Vista al jardín'],5.0,14,Gabriel,08-2022,https://www.airbnb.cl/rooms/687543448268664985?adults=1&children=0&infants=0&pets=0&check_in=2023-02-27&check_out=2023-03-04&previous_page_section_name=1000&federated_search_id=39197920-6924-405c-8531-0261442a1820
8,Cabaña rustica moderna frente al mar.,Cabaña entero,La Ligua,7,6,3, Habitación,1,privado,76.0,-32.28273,-71.47133,"https://maps.google.com/maps?ll=-32.28273,-71.47133&z=14&t=m&hl=es&gl=CL&mapclient=apiv3",,"Maravillosa cabaña rustica frente al mar. Ideal para familias que buscan tranquilidad. En un espacio totalmente seguro, ideal para descansar.

Otros aspectos a destacar
Por protocolos covid la cabaña no cuenta con toallas, como medida preventiva te recomendamos traer las tuyas. Además tiene un suministro 1.000 litros de agua, en caso de necesitar la recarga extra, tiene un valor de $10.000.
La tinaja ( hot tub) es un servicio adicional, no está incluida dentro del valor de la cabaña.",['Vista al mar'],4.81,63,Jazmin,07-2021,https://www.airbnb.cl/rooms/51299856?adults=1&children=0&infants=0&pets=0&check_in=2023-03-12&check_out=2023-03-17&previous_page_section_name=1000&federated_search_id=39197920-6924-405c-8531-0261442a1820
9,Cabaña Valle del Elqui,Alojamiento entero,La Serena,5,4,3, Habitación,2,privado,98.0,-30.0126,-71.0358,"https://maps.google.com/maps?ll=-30.0126,-71.0358&z=14&t=m&hl=es&gl=CL&mapclient=apiv3",El lugar corresponde a parcelas de agrado de 1/2 hectárea. En la noche se puede observar el cielo muy estrellado característico del lugar. Las caminatas en los alrededores son tranquilas pudiendo observar la flora y cerros del lugar.,"Está ubicado en El Valle de Elqui a 25 Kilómetros de La Serena ciudad que cuenta  con playa, bares restaurante, casino, Mall. El aeropuerto se encuentra a 20 kilómetros de distancia. Desde este lugar se pueden visitar observatorios Mayu, Tololo y Mamalluca ( reservas con anticipación)
También se pueden visitar las viñas y pisqueras de la localidad.
Piscina con vista panorámica al Valle.


La cabaña cuenta con hermosa terraza con vista al Valle, 2 dormitorios con cama de 2 plazas. Uno en la planta baja totalmente independiente con entrada independiente y el otro en el piso superior donde además se encuentra la cocina.Cuenta además con 2 camas de 1 plaza ubicadas en el segundo piso . Baño en ambos pisos. Cabaña full equipada para que tu estadía sea confortable.",['Cocina'],5.0,34,Ana María,07-2017,https://www.airbnb.cl/rooms/20154848?adults=1&children=0&infants=0&pets=0&check_in=2023-02-27&check_out=2023-03-04&previous_page_section_name=1000&federated_search_id=39197920-6924-405c-8531-0261442a1820
10,Casa Condominio en Tongoy,Alojamiento entero,Tongoy,6,5,3, Habitación,2,privado,75.0,-30.2574,-71.4751,"https://maps.google.com/maps?ll=-30.2574,-71.4751&z=14&t=m&hl=es&gl=CL&mapclient=apiv3",,"Casa en Condominio Prados del Mar . Localidad de Tongoy.
Casa amplia con tres habitaciones y dos baños.",['Acceso a la playa'],5.0,3,Paulina,06-2015,https://www.airbnb.cl/rooms/795537401833974868?adults=1&children=0&infants=0&pets=0&check_in=2023-02-26&check_out=2023-03-04&previous_page_section_name=1000&federated_search_id=39197920-6924-405c-8531-0261442a1820
11,Acogedora Casa de Campo con piscina Valle de Elqui,Casa de campo entero,Horcón,11,9,4, Habitación,2,privado,135.0,-30.1837,-70.47906,"https://maps.google.com/maps?ll=-30.1837,-70.47906&z=14&t=m&hl=es&gl=CL&mapclient=apiv3",,"Experimenta recuerdos inolvidables en este alojamiento único y familiar en pleno corazón del Valle de Elqui.
Ubicada en un terreno de 5.000 mts. con amplios espacios, naturaleza y gran comodidad.
Podrás disfrutar de exquisitos días soleados en verano al lado de una piscina privada y durante el invierno podrás apreciar la nieve.
La casa cuenta con una vista hermosa hacia el Valle del Elqui, ya que se ubica en las mismas montañas y durante la noche se observa el cielo despejado y estrellado.",['Vista a las montañas'],5.0,3,Claudia,02-2020,https://www.airbnb.cl/rooms/755996045346840126?adults=1&children=0&infants=0&pets=0&check_in=2023-03-06&check_out=2023-03-11&previous_page_section_name=1000&federated_search_id=39197920-6924-405c-8531-0261442a1820
12,"Chigualoco, Huentelauquen",Alojamiento entero,Los Vilos,6,6,3, Habitación,"4,5",privado,330.0,-30.77251,-71.55833,"https://maps.google.com/maps?ll=-30.77251,-71.55833&z=14&t=m&hl=es&gl=CL&mapclient=apiv3","Entrada directa desde la ruta 5 norte. a 12 km de Los Vilos.
Vencindario con pocas casas y muy seguro.","Una casa única, una vista impresionante, un lugar especial para descansar a solo 245 km de Santiago.

El espacio
La casa está construida sobre el borde costero, con una impresionante vista al  mar desde donde se mire.  
Living comedor con cocina incorporada, 3 habitaciones, todas para dos personas con baños incorporados. 
Terrazas, piscina y grandes espacios.",['Vista a la bahía'],,,Augusta,11-2022,https://www.airbnb.cl/rooms/770362661572093147?adults=1&children=0&infants=0&pets=0&check_in=2023-03-01&check_out=2023-03-06&previous_page_section_name=1000&federated_search_id=39197920-6924-405c-8531-0261442a1820
13,Casa Privada con Piscina,Alojamiento entero,Paiguano,8,7,3, Habitación,2,privado,151.697,-30.02795,-70.5199,"https://maps.google.com/maps?ll=-30.02795,-70.5199&z=14&t=m&hl=es&gl=CL&mapclient=apiv3","Lugar muy tranquilo, ubicado en un callejon de servidumbre, exclusivo para dueños del lugar.
Central, muy cerca de La Plaza del Pueblo.","Desde este alojamiento céntrico todo el grupo podrá disfrutar del fácil acceso a la plaza de Paihuano, (negocios), Pisco Elqui, Montegrande, Horcon, Vicuña, etc, muy buena ubicacion.
En el corazon del Valle del Elqui, se encuentra el pueblo de Paihuano.
Lugar tranquilo, seguro y con un clima privilegiado con los cielos mas claros del mundo.
Casa privada con piscina, para disfrutar solo con tu familia, sin compartir las instalaciones con personas extrañas a tu grupo, seguro y tranquilo.


Casa Privada con Piscina, NO es una cabaña, por lo tanto, no se comparten los espacios ni piscina.
Rodeada de árboles frutales y parras, que podrás disfrutar junto a tu familia, cielo estrellado y se ubica en el corazón del Pueblo de Paihuano, cerca de la Plaza y negocios.
Casa equipada con todo lo necesario para descansar solo con tu grupo familiar, sin preocuparte por compartir espacios con extraños.",['Cocina'],,,Susana,11-2016,https://www.airbnb.cl/rooms/804259524431202960?adults=1&children=0&infants=0&pets=0&check_in=2023-03-01&check_out=2023-03-06&previous_page_section_name=1000&federated_search_id=39197920-6924-405c-8531-0261442a1820
14,"Casa en Valle de Elqui, cerca del Río y Pisqueras",Casa de campo entero,La Serena,5,5,3, Habitación,1,privado,68.0,-30.07028,-70.49333,"https://maps.google.com/maps?ll=-30.07028,-70.49333&z=14&t=m&hl=es&gl=CL&mapclient=apiv3","Sector rural y tranquilo, ambiente familiar.
Puedes ir al río que está muy cerca y disfrutar de la naturaleza o bien en los pueblos cercanos puedes encontrar miradores, Pisquera, iglesias, observatorios, artesanías, restaurant, almacenes, Botilleria, y más","Casa ubicada en Quebrada de Pinto (entre Paihuano y Monte Grande). IV Región.
Está habilitada para un máximo de 7 personas.
2 cuartos con cama de 2 plaz
Y un 3er cuarto con una litera de 1 plaza + una  cama de 1 plaza
✅ Ambiente familiar
🏊‍♀️ Piscina privada
🚘 Estacionamiento
🪑 Cuenta con sillón, comedor, refrigerador y cocina
🚿 Ducha con agua caliente
☀️Sol casi todo el año
🍖 Quincho
♨️ Estufa (de Julio a Agosto)
💧Rio cerca
🤷🏻‍♂️ Tope máximo 7 personas
🔉 Musica moderada
❌ No se permiten fiestas


Casa acogedora en un entorno tranquilo, sin televisión, con señal de teléfono e internet.
Dos habitaciones con cama de dos plaza, una tercera habitación con un camarote y una cama de una plaza, las camas cuentan con sábanas, frazadas, cobertor y almohadas.
El baño cuenta con ducha de agua caliente, jabón y toalla de mano, además de toallas de cuerpo
Cocina equipada para 7 personas con hervidor, refrigerador, platos, vasos, tazas y servicio. Además cuenta con una máquina de agua purificada (caliente/fría).",['Vista al valle'],4.79,43,Juan,12-2018,https://www.airbnb.cl/rooms/32949532?adults=1&children=0&infants=0&pets=0&check_in=2023-02-27&check_out=2023-03-05&previous_page_section_name=1000&federated_search_id=39197920-6924-405c-8531-0261442a1820
15,"Casa del Valle, Lugar soñado.",Casa de campo entero,La Serena,12,9,4, Habitación,4,privado,280.0,-29.92458,-71.21694,"https://maps.google.com/maps?ll=-29.92458,-71.21694&z=14&t=m&hl=es&gl=CL&mapclient=apiv3",,"Esta casa está preparada para un grupo de 12 a 15 personas, completamente equipada, con hermosas y amplias áreas verdes, gran Piscina, Gimnasio, Quincho y horno de barro, mesa de ping pong, mesa de mini ping pong, Taca Taca o futbol de mesa, tina de madera de agua caliente a leña, 4 dormitorios, 4 baños, Wi-Fi, hermosas y acogedoras decoraciones ideal para venir a relajarse y llenarse de energía del valle del Elqui. Está ubicada hacia el valle Km 14, a 15 min del centro y  25 min de la playa.",['Cocina'],5.0,6,Víctor,12-2022,https://www.airbnb.cl/rooms/787658634284634599?adults=1&children=0&infants=0&pets=0&check_in=2023-02-26&check_out=2023-03-03&previous_page_section_name=1000&federated_search_id=39197920-6924-405c-8531-0261442a1820
16,Casa campo con piscina y tinaja,Alojamiento entero,Coquimbo,11,8,4, Habitación,"2,5",privado,88.2,-30.06,-71.2537,"https://maps.google.com/maps?ll=-30.06,-71.2537&z=14&t=m&hl=es&gl=CL&mapclient=apiv3",,Lleva a toda la familia a este fantástico lugar con muchas zonas para disfrutar de unos días de relajo .,['Vista a las montañas'],5.0,5,Enrique,11-2020,https://www.airbnb.cl/rooms/792865932033552118?adults=1&children=0&infants=0&pets=0&check_in=2023-03-02&check_out=2023-03-07&previous_page_section_name=1000&federated_search_id=39197920-6924-405c-8531-0261442a1820
17,"Casa frente al mar Ensenada km 213, Pichidangui",Alojamiento entero,Pichidangui,9,7,4, Habitación,4,privado,245.0,-32.08817,-71.52767,"https://maps.google.com/maps?ll=-32.08817,-71.52767&z=14&t=m&hl=es&gl=CL&mapclient=apiv3",,"Mi alojamiento es bueno para parejas, familias (con hijos) y grupos grandes.

Otros aspectos a destacar
El consumo de agua se cobra por separado, dada la escasez de la zona","['Acceso a la playa', 'Frente a la playa']",4.86,35,Trinidad,04-2016,https://www.airbnb.cl/rooms/12454880?adults=1&children=0&infants=0&pets=0&check_in=2023-03-02&check_out=2023-03-07&previous_page_section_name=1000&federated_search_id=39197920-6924-405c-8531-0261442a1820
18,Cabaña en Pisco Elqui con piscina a pasos de Plaza,Casa de campo entero,Paihuano,8,6,4, Habitación,1,privado,117.0,-30.12283,-70.4921,"https://maps.google.com/maps?ll=-30.12283,-70.4921&z=14&t=m&hl=es&gl=CL&mapclient=apiv3",,"Hermosa cabaña de dos pisos,  ubicada a una cuadra de la plaza de Pisco Elqui,  en el Valle del Elqui, excelente ubicación, amplios y cómodos dormitorios,  hermosa vista al valle desde balcón . 
Piscina privada con terraza y parrilla para disfrutar en familia, amplio estacionamiento privado.


La cabaña cuenta con decoración  acorde al misticismo del Valle del Elqui. Muy buena ubicación, a pasos de la plaza, de locales comerciales,  pubs , actividades esotéricas, agencias de turismos que ofrecen servicios de tour, trekking,  bicicleta, cabalgatas y visitas a observatorios.",['Cocina'],4.71,14,Rafael,01-2019,https://www.airbnb.cl/rooms/35317830?adults=1&children=0&infants=0&pets=0&check_in=2023-02-27&check_out=2023-03-05&previous_page_section_name=1000&federated_search_id=3c9e006f-0fe0-4c29-b7ac-1ab2940b4e74
19,Parcela con Gran Piscina y Quincho,Alojamiento entero,La Serena,12,8,4, Habitación,3,privado,240.0,-29.9579,-71.224,"https://maps.google.com/maps?ll=-29.9579,-71.224&z=14&t=m&hl=es&gl=CL&mapclient=apiv3","Es un condominio cerrado de 40 parcelas, en donde la gran característica es su tranquilidad, seguridad y comodidad, sin lugar a dudas un lugar que tiene todo lo necesario para que tu estadía sea espectacular.","Si buscas disfrutar cómodamente del aire puro de la cuarta región, en un ambiente privilegiado y seguro para ti y tu familia, te invitamos a conocer nuestra casa en Condominio en La Serena, una parcela con amplios espacios, en un entorno rodeado de tranquilidad y vegetación, la casa está equipada para 10 personas o 12 previa coordinación, cuenta con gran quincho y piscina, acceso controlado a minutos de Centros comerciales, supermercados, avda del mar y ruta para valle del Elqui.


La propiedad está totalmente remodelada en su interior, todas sus camas son nuevas y todo el equipamiento en excelentes condiciones.",['Vista al jardín'],5.0,4,Carlos,02-2019,https://www.airbnb.cl/rooms/800050725631027951?adults=1&children=0&infants=0&pets=0&check_in=2023-02-25&check_out=2023-03-03&previous_page_section_name=1000&federated_search_id=3c9e006f-0fe0-4c29-b7ac-1ab2940b4e74
20,"Cabaña frente al Mar, Cond. Ensenada ( Los vilos)",Cabaña entero,Los Vilos,6,4,3, Habitación,2,privado,185.0,-32.00821,-71.51709,"https://maps.google.com/maps?ll=-32.00821,-71.51709&z=14&t=m&hl=es&gl=CL&mapclient=apiv3","Es un lugar muy tranquilo, se puede caminar en todo el condominio sin problemas, viendo plantas autóctonas del sector, además pueden acceder a una playa privada del condominio.","Cabaña frente al Mar, con una vista maravillosa. Ideal para descansar y relajarse, cuenta con todo tipo de comodidades. Cerca de Pichidangui y Los Vilos, aproximadamente 13 km de ambas.
Amoblado al 100%.Calefacción a leña, Todos los dormitorios con TV ( cable), camas con plumones, Piscina,Juegos infantiles,Terraza con Quincho frente al mar, Playa privada a 100 metros.


Lugar para relajarse frente al mar. En una casa con todas las comodidades que imagines. Muy acogedor",['Vista al océano'],4.96,56,Daniela,06-2017,https://www.airbnb.cl/rooms/19196171?adults=1&children=0&infants=0&pets=0&check_in=2023-03-13&check_out=2023-03-18&previous_page_section_name=1000&federated_search_id=3c9e006f-0fe0-4c29-b7ac-1ab2940b4e74
21,Casa primera línea frente al mar,Alojamiento entero,Los Vilos,7,5,3, Habitación,3,privado,184.0,-32.0119,-71.5118,"https://maps.google.com/maps?ll=-32.0119,-71.5118&z=14&t=m&hl=es&gl=CL&mapclient=apiv3",Condominio ubicado entre Pichidangui y Los Vilos. Cuenta con una exclusiva playa a tan solo 1.5km desde la casa.,"Casa ubicada en Condominio Ensenada. Primera línea frente al mar, con acceso directo al mar, desde roquerío frente a la casa. Las vistas desde la casa hacia el mar son inmejorables. La casa cuenta con 3 habitaciones y 3 baños, un amplio living comedor recién remodelado y una cocina con todo su equipamiento. Tiene una gran piscina protegida del viento con preciosa vista al mar y un hot tub instalado en medio de una terraza muy especial ""El Barco"", ambos de uso exclusivo de la casa.",['Vista al océano'],5.0,4,Roberto,12-2016,https://www.airbnb.cl/rooms/758523720123421580?adults=1&children=0&infants=0&pets=0&check_in=2023-03-06&check_out=2023-03-11&previous_page_section_name=1000&federated_search_id=3c9e006f-0fe0-4c29-b7ac-1ab2940b4e74
22,"Embalse puclaro, valle del elqui",Cabaña entero,Vicuña,5,4,3, Habitación,2,privado,85.276,-30.0033,-70.8409,"https://maps.google.com/maps?ll=-30.0033,-70.8409&z=14&t=m&hl=es&gl=CL&mapclient=apiv3","se ubica a unos 400 metros de la carretera (ruta 41) al costado de Villa Puclaro. Con una subida de unos 50 mts. Un poco complicada, pero lo demás es con adocretos.","Un lugar tranquilo para relajarse, amplio terreno, piscina, parrilla. A 10 minutos de vicuña y a 35 minutos de la serena, preciosa vista y días de sol desde temprano.",['Vista al jardín'],,,Macarena,09-2022,https://www.airbnb.cl/rooms/763852230237366836?adults=1&children=0&infants=0&pets=0&check_in=2023-02-19&check_out=2023-02-25&previous_page_section_name=1000&federated_search_id=3c9e006f-0fe0-4c29-b7ac-1ab2940b4e74
