,Titulo1,Titulo2,Comuna,Capacidad,Camas,N_Habitaciones,Habitaciones,Baños,Tipo_Baños,Precio,lat,lon,Ubicacion,Ubides,Descripcion,Servicios,Nota,Nnota,Anfitrion,Registro,Link
0,"♥ Tu Destino, Tu Vista, Tu SPA ☀",Vivienda rentada entero,Coquimbo,4,3,2, Habitación,2,privado,80.0,-29.9825,-71.3522,"https://maps.google.com/maps?ll=-29.9825,-71.3522&z=14&t=m&hl=es&gl=CL&mapclient=apiv3","Área tranquila y exclusiva en playa La Herradura. Minimarket, restaurantes y miradores a pocos pasos de distancia.

En auto: Cine y Mall Vivo Coquimbo a 6 minutos, Supermercado Santa Isabel y Telepizza a 3 minutos, Casino Enjoy Coquimbo a sólo 10 minutos. La Serena a 15 minutos.

Turismo: Puedes llegar en 90 minutos a Pisco Elqui, una experiencia inolvidable. Si contratas alguna agencia turística en la región, puedes llegar a la hermosa Isla Damas.","Nuestros huéspedes lo dicen: Es el lugar perfecto para vacaciones o escapes de la ciudad ☀.
Te ofrecemos un lugar Nuevo e Impecable, con una Vista infinita al mar, Spa,  Acceso directo a la playa, Piscina, ¡y mucho más!
Tendrás 2 habitaciones, 2 baños completos, cocina full-equipada, TV cable, HBO Max, Wifi, Audio bluetooth, Libros y  más. ¡Nuestra hospitalidad hará que te sientas como en casa!. 
Nos encargaremos de que tu experiencia sea increíble y garantizamos que vas a volver a visitarnos ♥.


Completamente equipado (utensilios de cocina, ollas, vajilla, cubiertos, vasos, copas, ... ¡todo lo que imaginas! ).
Incluye sistema de sonido portátil Bose (bluetooth), WiFi de alta velocidad y calidad, HBO Max, TV cable, libros, revistas, 1 silla de playa, sombrilla y mucho más. ¿Necesitas algo adicional? ¡Consúltanos y veremos cómo ayudarte!",['Vista a la marina'],4.98,127,Carlos,06-2017,https://www.airbnb.cl/rooms/19311735?adults=1&children=0&infants=0&pets=0&check_in=2023-03-01&check_out=2023-03-06&previous_page_section_name=1000
1,Promoción descuento 30% y 10% al valor de estadía.,Vivienda rentada entero,Ovalle,5,4,3, Habitación,2,privado,50.0,-30.61497,-71.2079,"https://maps.google.com/maps?ll=-30.61497,-71.2079&z=14&t=m&hl=es&gl=CL&mapclient=apiv3","El departamento está ubicado en un barrio tranquilo rodeado de poblaciones de clase media y alta, Pequeñas plazitas y otros condominios.","Cómodo y amplio departamento, ubicado en un segundo piso, en el condominio Ciudad del Encanto, con seguridad las 24 horas. Cuenta con estacionamiento, servicios de wi fi  fibra óptica y TV cable, además de locomoción a la puerta y cercanía a supermercado Santa Isabel y farmacia cruz verde.

El espacio
El departamento cuenta con 3 dormitorios, 2 baños, lavadora. Internet fibra y tv cable. Está ubicado en segunfo piso, tiene terraza con vista a una plazita.",['Vista al horizonte de la ciudad'],4.70,10,Nilsa Soledad,12-2020,https://www.airbnb.cl/rooms/47508426?adults=1&children=0&infants=0&pets=0&check_in=2023-02-15&check_out=2023-02-21&previous_page_section_name=1000
2,Apartamento espacioso cerca de la playa,Vivienda rentada entero,Coquimbo,5,4,3, Habitación,2,privado,108.0,-29.94875,-71.2914,"https://maps.google.com/maps?ll=-29.94875,-71.2914&z=14&t=m&hl=es&gl=CL&mapclient=apiv3","Barrio seguro a una cuadra de la playa. Puedes encontrar restaurantes, tiendas, camiones de comida y actividades para niños a poca distancia del departamento.","Amplio apartamento a metros de la playa. ¡Camine hasta el Casino y los restaurantes cercanos (Avenida del Mar y Pueblito Peñuelas) en minutos! Apartamento de 3 dormitorios totalmente equipado listo para que te relajes mirando a la hermosa bahía de Coquimbo.

El espacio
Piscina disponible para los huéspedes y seguridad las 24 horas, los 7 días de la semana en el complejo. El apartamento es cómodo y amplio, decoración moderna y totalmente equipado.",['Vista a la bahía'],5.0,11,Andrea,01-2016,https://www.airbnb.cl/rooms/49061128?adults=1&children=0&infants=0&pets=0&check_in=2023-02-23&check_out=2023-03-01&previous_page_section_name=1000
3,Depto. recién renovado - Zona libre Tsunami,Vivienda rentada entero,Coquimbo,6,3,2, Habitación,2,privado,33.0,-29.96006,-71.34082,"https://maps.google.com/maps?ll=-29.96006,-71.34082&z=14&t=m&hl=es&gl=CL&mapclient=apiv3","Este departamento se encuentra en una ubicación privilegiada. Esta a solo dos cuadras del centro y cinco cuadras del nuevo Mall Vivo de Coquimbo. En la primera planta, por afuera se encuentra un negocio. Tambien, detrás del edificio hay un negocio donde puede comprar prácticamente de todo (esta en la esquina de O'Higgins con Montt).
Camino hacia el centro se encuentra el supermercado Santa Isabel que se encuentra en calle Anibal Pïnto 1551.","El departamento (74 metros cuadrados) cuenta con dormitorio matrimonial con baño, pieza de visitas (dos camas), baño de visitas, un  living comedor con sofá cama de plaza y media.   TV Directv Glod.  El edificio  esta ubicado a 5 min. caminando del centro de Coquimbo y a 7  min. en vehículo de la playa la Herradura y playa de coquimbo. El departamento tiene mallas de protección para niños. Vista a toda la bahía de Coquimbo y la Serena desde el mirador que se encuentra arriba del edificio.


Este departamento esta ubicado en un edificio que esta a 5 minutos caminando del Mall Coquimbo  y 7 minutos en vehículo de la Playa de La Herradura y de la Playa de Coquimbo.",['Cocina'],4.78,96,Humberto,05-2013,https://www.airbnb.cl/rooms/16670535?adults=1&children=0&infants=0&pets=0&check_in=2023-02-26&check_out=2023-03-03&previous_page_section_name=1000
4,"☀1era Línea 1er Piso con Piscina, Jardín y Playa!☀",Vivienda rentada entero,Puerto Velero,7,6,2, Habitación,2,privado,108.592,-30.2424,-71.4753,"https://maps.google.com/maps?ll=-30.2424,-71.4753&z=14&t=m&hl=es&gl=CL&mapclient=apiv3","Puerto Velero es un condominio en una localidad turística exclusiva ubicada frente a la bahía de Barnes, entre los balnearios de Tongoy y Guanaqueros, en la comuna de Coquimbo, Chile. Se encuentra situada a 45 kms de La Serena y a 430 kms de Santiago. Posee 700 departamentos distribuidos en 23 edificios.

Goza de un muy buen clima, lindos paisajes y jardines, una playa apta para el baño.","Uno de los mejores departamentos en todo Puerto Velero. La mejor ubicación, Primera Línea y Primer Piso! Recién remodelado con espectacular Piscina a 30 metros y bajada directa a la Playa que está a 120 mts!  la mejor vista,  amplio jardín (ideal niños), terraza, reposeras. Departamento amplio y equipado para disfrutar de unas vacaciones inolvidables. Sencillamente un estándar superior a otros departamentos de Puerto Velero!


✓Exclusivo departamento ✓ Primer piso ✓Primera Línea ✓La mejor vista despejada ✓Jardín amplio ✓Acceso directo a piscina y playa a pasos de distancia ✓Recién remodelado y totalmente equipado ✓ Espacioso living comedor y terraza  ✓Increíble vista al mar, la playa Socos y la península de Tongoy ✓Cuenta con 2 dormitorios y 2 baños ✓No hay camas en comedor, living ni sofá-camas ✓Estacionamiento privado ✓Disfrutarás del departamento completo.

✓Reposeras ✓Mesa de terraza ✓Wifi gratuito ✓2 Smart TV's LED con TV-Cable ✓Máquina Nespresso ✓3 Estufas Eléctricas ✓Ventanas Termopanel PVC nuevas ✓Moderna Cocina equipadísima ✓Lava Vajillas ✓Horno eléctrico ✓Microondas ✓Lavadora/Secadora  ✓Plancha ✓Secador de pelo.


SIN CARGO ""TARIFA POR SERVICIO"": A diferencia de otras publicaciones nosotros no cobramos ""Tarifa por servicio"". Te invitamos a comparar el costo total.",['Vista a la bahía'],5.0,9,Daniel,11-2017,https://www.airbnb.cl/rooms/642412048765613150?adults=1&children=0&infants=0&pets=0&check_in=2023-03-26&check_out=2023-03-31&previous_page_section_name=1000
5,Depto 3matri 12pers Laguna del mar playa privada.,Vivienda rentada entero,La Serena,10,8,4, Habitación,"2,5",privado,98.537,-29.89822,-71.27169,"https://maps.google.com/maps?ll=-29.89822,-71.27169&z=14&t=m&hl=es&gl=CL&mapclient=apiv3","laguna del mar, es un recinto privado que cuenta con comodidades de resort. es tranquilo y tiene zona de cafeteria y minimarket dentro de el.","mi departamento es grande e iluminado , tiene una gran vista hacia el mar y hacia dentro de el establecimiento, incluyendo piscinas y laguna.
cuenta con 2 estacionamiento de vehículos.
es muy cercano a supermercados, shopping y restaurantes, esto es a menos de 14 minutos caminando y 5 minutos en vehículo.
hay muchas actividades dentro del establecimiento, ya sea nadar, jugar tenis, andar en kayak, trecking, etc.
ideal para familias y amigos que quieran disfrutar  tranquilas vacaciones.


Departamento con hermosa vista al mar. Se encuentra en el piso 7. No tiene malla de seguridad para niños, pero tiene una gran baranda 
Distribucion:
-Una cama matrimonial con baño privado y tv con Netflix ( Cuenta personal de  cada uno)
- Una cama matrimonial.
- Una cama matrimonial.
- 2 camarotes (duermen 4.)
- 2 futon duermen 4. (living)

No cuenta con sistema de calefacción central habilitado, pero contamos con una estufa potente a parafina, que es capaz de calentar todo el departamento. ( La parafina no está incluida, y hay un bidón para comprarla)

La parrilla funciona a gas, el cual está incluido.

Sugiero leer la sección ""Otras detallesa destacar o otras notas"" para revisar gastos/cobros adicionales.",['Vista a la bahía'],4.58,39,MurphyGroup,11-2015,https://www.airbnb.cl/rooms/21119436?adults=1&children=0&infants=0&pets=0&check_in=2023-03-10&check_out=2023-03-15&previous_page_section_name=1000
6,Excelente vista,Vivienda rentada entero,Puerto Velero,6,6,2, Habitación,2,privado,92.757,-30.23926,-71.47409,"https://maps.google.com/maps?ll=-30.23926,-71.47409&z=14&t=m&hl=es&gl=CL&mapclient=apiv3",,"Departamento en primer piso, increíble vista a la bahía de Tongoy. A pasos de la piscina del edificio y al estar al centro, puedes caminar a la playa, al mini market o al café. Perfecto para ir con niños, está completamente equipado!

El espacio
Departamento de dos dormitorios amplios, ambos en suit, con el espacio común al centro (cocina-living-comedor-terraza)
Además, puedes disfrutar del pasto que le da mucha amplitud al espacio.",['Vista al océano'],5.0,9,Elisa,06-2016,https://www.airbnb.cl/rooms/41267218?adults=1&children=0&infants=0&pets=0&check_in=2023-03-05&check_out=2023-03-10&previous_page_section_name=1000
7,Acogedor departamento con hermosa vista al mar,Condo entero,La Serena,4,3,2, Habitación,2,privado,72.0,-29.89873,-71.27113,"https://maps.google.com/maps?ll=-29.89873,-71.27113&z=14&t=m&hl=es&gl=CL&mapclient=apiv3",,"El departamento tiene vista directa a la laguna y al mar. Amoblado con todo lo necesario para vivir comodamente, 2 televisores, equipo de musica, horno, microonda, lavadora, juguera, tostador. Ademas de una ubicación estratégica: a pasos de la avenida del mar con acceso directo. En laguna e instalaciones se puede practicar kayak, cuenta con cancha de tenis, cancha multiuso, quincho, piscina y hermosas instalaciones para disfrutar de la laguna y playa.",['Vista a la bahía'],4.48,33,Shannen,03-2016,https://www.airbnb.cl/rooms/52327987?adults=1&children=0&infants=0&pets=0&check_in=2023-03-06&check_out=2023-03-11&previous_page_section_name=1000
8,Dpto increíble vista al mar con terraza amplia ♡,Vivienda rentada entero,Los Molles,8,6,3, Habitación,2,privado,98.1,-32.23656,-71.51059,"https://maps.google.com/maps?ll=-32.23656,-71.51059&z=14&t=m&hl=es&gl=CL&mapclient=apiv3",,,"['Acceso a la playa', 'Frente a la playa']",4.87,45,Sara,02-2018,https://www.airbnb.cl/rooms/46479012?adults=1&children=0&infants=0&pets=0&check_in=2023-02-27&check_out=2023-03-04&previous_page_section_name=1000
9,Moderno departamento con espectacular vista al mar,Condo entero,Puerto Velero,5,3,2, Habitación,2,privado,79.26,-30.2408,-71.4768,"https://maps.google.com/maps?ll=-30.2408,-71.4768&z=14&t=m&hl=es&gl=CL&mapclient=apiv3",,"Departamento primera linea a pasos de la playa  con hermosa vista y al mar  ,en Concominio Puerto Velero donde se puede disfrutar de distintas maneras ya sea de un simple dia de playa en familia , apreciar un atardecer jugando cartas  o utilizar distintas instalaciones del condominio como piscinas , canchas de tennis , padel , futbol  entre otros
Se puede conocer la bahia de tongoy o Guanaqueros ambos sectores turisticos con hermosas playas de baño y opciones gastornomicas",['Acceso la playa Privado'],4.20,5,Hansi,02-2017,https://www.airbnb.cl/rooms/35826423?adults=1&children=0&infants=0&pets=0&check_in=2023-04-01&check_out=2023-04-08&previous_page_section_name=1000
10,"Internet, impresora, lavadora Descuento 30% y 10%",Vivienda rentada entero,Ovalle,5,4,3, Habitación,2,privado,50.0,-30.61305,-71.20922,"https://maps.google.com/maps?ll=-30.61305,-71.20922&z=14&t=m&hl=es&gl=CL&mapclient=apiv3","El ambiente de este sector es un lugar seguro
y tranquilo, dispone de guardia las 24 horas . Tiene locomoción a la puerta, a pocas cuadras hay supermercado y farmacia.","Para su alojamiento usted dispone de un departamento nuevo de tres dormitorios y dos baños, el cual está recién amoblado con implementos para cocinar, estacionamiento gratuito, televisión por cable, internet fibra, lavadora, etc

El espacio
Departamento con locomoción a la puerta, supermercado a pocas cuadras.",['Vista al horizonte de la ciudad'],4.69,65,Georgina,03-2018,https://www.airbnb.cl/rooms/27903389?adults=1&children=0&infants=0&pets=0&check_in=2023-02-21&check_out=2023-02-26&previous_page_section_name=1000
11,Inmejorable ubicación en el mar,Vivienda rentada entero,Los Molles,4,4,2, Habitación,2,privado,68.0,-32.2379,-71.5129,"https://maps.google.com/maps?ll=-32.2379,-71.5129&z=14&t=m&hl=es&gl=CL&mapclient=apiv3",,"Los huéspedes tendrán todo a unos pocos pasos.  Excelente ubicación, frente al mar y cerca de lugares de interés.
Grato ambiente compartido con restaurantes, bares, tiendas de artesanía, excursiones, entre otros.",['Acceso a la playa'],,,Bernardita,08-2018,https://www.airbnb.cl/rooms/826634408084669723?adults=1&children=0&infants=0&pets=0&check_in=2023-02-15&check_out=2023-02-22&previous_page_section_name=1000
12,Depto. 2 dormitorios a pasos del Casino Enjoy,Vivienda rentada entero,Coquimbo,4,3,2, Habitación,2,privado,60.0,-29.94664,-71.29036,"https://maps.google.com/maps?ll=-29.94664,-71.29036&z=14&t=m&hl=es&gl=CL&mapclient=apiv3","A pasos del Casino de Juegos Enjoy, la playa, el pueblito artesanal de Peñuelas y gran oferta de restaurantes, bares y lugares de entretención. El sector de la playa es tranquilo y habilitado para el baño.","Departamento nuevo, en piso 11, completamente equipado para una confortable estadía. Cuenta con dos dormitorios y dos baños, el principal en suite. Vista a la playa y acceso directo a tan solo 50 metros. Edificio con piscina, quinchos, juegos infantiles y salones. Estacionamiento privado.",['Vista al jardín'],5.0,18,Carlos,05-2015,https://www.airbnb.cl/rooms/22999240?adults=1&children=0&infants=0&pets=0&check_in=2023-02-28&check_out=2023-03-07&previous_page_section_name=1000
13,Espectacular Depto con enorme jardín y vista,Vivienda rentada entero,Puerto Velero,6,7,4, Habitación,3,privado,210.714,-30.237,-71.47854,"https://maps.google.com/maps?ll=-30.237,-71.47854&z=14&t=m&hl=es&gl=CL&mapclient=apiv3","El Condominio Puerto Velero cuenta con numerosas piscinas de uso abierto para todos los huéspedes, dos piscinas de mar, restoranes y bares con excelente y variada cocina. Cuenta con vigilancia 24/7 y amplio esparcimiento y diversión para niños, jóvenes y adultos.
Además cuenta con supermercado, canchas deportivas (tenis, fútbol, volleyboll), spa, gimnasio, cancha de golf y marina. La playa Socos, por su parte, es quizás la mejor playa de Chile.
Tongoy se encuentra a solo 10 minutos en auto y cuenta con farmacias, supermercados, verdulerías, feria, caleta de pescadores, excelentes restoranes y lugares para pasear.","Este departamento cuenta con amplio espacio de esparcimiento y privacidad para sus ocupantes. 3 baños equipados con ducha, 4 habitaciones, cocina con full equipamiento, lavavajillas, lavarropas y secadora. 
El departamento cuenta con living cómodo, espacioso y acogedor. El comedor cuenta con amplia y elegante mesa de piedra. 
La terraza da a un enorme jardín y a una asombrosa vista a la Bahía de Tongoy.

Por 35mil extra al día puedes contratar los servicios de cocinera y asesora del hogar.


El departamento está amoblado con motivos marítimos y se encuentra a una distancia equidistante entre la playa y la piscina de mar.",['Vista a la bahía'],4.79,19,Fran,05-2012,https://www.airbnb.cl/rooms/574678466386909984?adults=1&children=0&infants=0&pets=0&check_in=2023-02-27&check_out=2023-03-06&previous_page_section_name=1000
14,Pulcro y luminoso departamento en Avenida Pacífico,Vivienda rentada entero,La Serena,5,4,2, Habitación,2,privado,46.717,-29.9312,-71.2784,"https://maps.google.com/maps?ll=-29.9312,-71.2784&z=14&t=m&hl=es&gl=CL&mapclient=apiv3","Hay un minimarket en la esquina donde encontrarás todo lo que necesites.

A menos de 250 metros se encuentran pubs, restaurantes y discoteques, por lo que puedes ir caminando sin preocuparte de encontrar estacionamiento o pagar un taxi.

Muy cerca hay un complejo deportivo, con canchas de futbolito y padel.","55 metros cuadrados con un lindo balcón. Ubicado a pasos de 4 esquinas y de la avenida del mar. Encontrarás diversión y tranquilidad a la vez.

Departamento full equipado  y pensado para que no te falte nada durante la estadía. Cuenta con mallas de seguridad en balcón y ventanas. Puedo habilitar cuna para bebé. 

Nota: la piscina y quincho están sujetos a disponibilidad según mantenciones y reparaciones.


El edificio tiene 8 pisos y el departamento está en el piso 6. Caminando se encuentra a 4 minutos de la playa (avenida del mar / 4 esquinas). Ideal para familias, parejas o viajes de trabajo. Cuenta con tv con cable, wifi, lavadora, entre otros.",['Acceso a la playa'],4.95,164,Ian,12-2016,https://www.airbnb.cl/rooms/16837837?adults=1&children=0&infants=0&pets=0&check_in=2023-02-28&check_out=2023-03-07&previous_page_section_name=1000
15,Departamento Genial Laguna del Mar Av Pacifico 761,Vivienda rentada entero,La Serena,5,4,2, Habitación,2,privado,100.0,-29.89867,-71.27097,"https://maps.google.com/maps?ll=-29.89867,-71.27097&z=14&t=m&hl=es&gl=CL&mapclient=apiv3","Condominio a orillas del mar, con laguna privada, cerca del centro de la ciudad y del Faro.
Avda Pacífico 761, La Serena","Lugares de interés: la playa y actividades en familia. 
Mi alojamiento es bueno para parejas y familias (con hijos), está recién acondicionado. 
Cuenta con 2 Smart TV, (UHD y FHD), WIFI incluido, cuenta con lavadora y se proporcionan sábanas y toallas para 5 personas. Tiene acceso a la Laguna y privado a la playa, está cerca de los principales centros comerciales de La Serena y muy cerca del centro histórico.


Departamento tiene muebles de Terrazas en el balcón, parrilla a gas, así como lavadora, tabla de planchar, plancha y secador de pelo.","['Acceso a la playa', 'Frente a la playa']",4.91,44,Jaime,11-2016,https://www.airbnb.cl/rooms/16288587?adults=1&children=0&infants=0&pets=0&check_in=2023-02-22&check_out=2023-02-28&previous_page_section_name=1000
16,Arriendo Diario Peñuelas,Vivienda rentada entero,Elqui,4,3,2, Habitación,2,privado,48.2,-29.96224,-71.26341,"https://maps.google.com/maps?ll=-29.96224,-71.26341&z=14&t=m&hl=es&gl=CL&mapclient=apiv3",,"Excelente conectividad, a 7 min de casino Enjoy, Av. del mar.
Lugar muy tranquilo; Condomio con seguridad 24/7. Piscina, quincho, terraza; Y con los atardeceres más bellos de la ciudad!!!",['Vista al horizonte de la ciudad'],5.0,5,Michelle,04-2019,https://www.airbnb.cl/rooms/777699551620436039?adults=1&children=0&infants=0&pets=0&check_in=2023-02-23&check_out=2023-02-28&previous_page_section_name=1000
17,Departamento con vista y acceso al Mar.,Vivienda rentada entero,La Serena,6,4,3, Habitación,2,privado,58.0,-29.89657,-71.26852,"https://maps.google.com/maps?ll=-29.89657,-71.26852&z=14&t=m&hl=es&gl=CL&mapclient=apiv3",Ubicación privilegiada barrio residencial y condominio con seguridad las 24 horas.,"Departamento en primera línea con vista y acceso al mar 
Ubicado en barrio residencial de  La Serena.

Cuenta con:
- Vista y acceso al mar
- 3 dormitorios (uno en suit)
- 2 baños
- Cocina equipada
- Living
- Lavadora y set planchado
- Balcón
- Estacionamiento propio
- Piscina
- Quinchos
- Internet
- Netflix

Se encuentra en quinto sin ascensor.
Ubicado a 5 minutos caminando del mar y cercano a centros comerciales, supermercado y centro de la ciudad.

Equipado para 6 personas + 1 (futon)


Impecable departamento ideal para pareja que busque disfrutar de su estadía con acceso caminando a cualquier lugar playa, centro, terminal de buses y comercios.","['Acceso a la playa', 'Frente a la playa']",4.91,45,Alejandra,02-2017,https://www.airbnb.cl/rooms/31192213?adults=1&children=0&infants=0&pets=0&check_in=2023-02-25&check_out=2023-03-02&previous_page_section_name=1000
18,"Departamento frente al mar, estacionamiento gratis",Apartamento con servicios incluidos entero,La Serena,6,6,2, Habitación,2,privado,70.0,-29.91545,-71.27556,"https://maps.google.com/maps?ll=-29.91545,-71.27556&z=14&t=m&hl=es&gl=CL&mapclient=apiv3",,"Condominio único con piscinas con olas en la cuarta región . 

El departamento cuenta con 2 Dormitorios  1 suit con baño y otra con baño afuera de la pieza. Ambas camas de 2 pozas con ropa de cama de hotel muy cómodas, un colchón inflable que se llena en 2 min de manera automática. Un sofá cama en el living (2P)

Contarás con una limpieza excepcional ( sanitizamos con cloro cuaternario y lysofol , aspiramos y eliminamos polvo ), ropa de cama y toallas incluidas 

Todos los servicios incluidos !",['Vista al mar'],4.65,66,Diego,07-2021,https://www.airbnb.cl/rooms/52619673?adults=1&children=0&infants=0&pets=0&check_in=2023-03-12&check_out=2023-03-17&previous_page_section_name=1000
19,"A pasos de la playa, Acogedor y lindo departmento",Vivienda rentada entero,Coquimbo,4,3,2, Habitación,2,privado,65.0,-29.9468,-71.2897,"https://maps.google.com/maps?ll=-29.9468,-71.2897&z=14&t=m&hl=es&gl=CL&mapclient=apiv3","tranquilo complejo residencial, cercano a casino de juegos, Outlets, Pubs, Restaurantes, Minimarkets a 10 min de La Serena y Coquimbo.","Déjate atrapar por la magia de la IV región; lindo departamento 2D/2B, ubicado en piso 19 con vista panorámica, mallas de seguridad para la tranquilidad de tu familia, full equipado y estacionamiento privado para que tu estadía sea una experiencia inolvidable. Se encuentra a pasos de la playa, casino de juegos, principales pubs y restaurantes de la bahía, incluyendo Outlet Vivo.
*Cuna para bebés de hasta 9 Kg.
*Bicicleteros gratis
*Not Pet friendly
*No Toallas de cuerpo


*Cuna para bebé, peso máximo 9 kg (sin ropa de cama)
*Toallas solo de mano (no tenemos toallas para baño/piscina)
*Camas con sábanas
*Bicicleteros Gratis en las dependencias del edificio, solo debes traer tus bicicletas (y candados) para poder 
disfrutar de paseos por la costanera
*no se cuenta con toallas para el cuerpo
*Calefactor eléctrico para invierno",['Vista a la bahía'],4.95,20,Carolina Alejandra,05-2016,https://www.airbnb.cl/rooms/52586200?adults=1&children=0&infants=0&pets=0&check_in=2023-02-27&check_out=2023-03-04&previous_page_section_name=1000
20,Increíbles vacaciones en la serena con Laguna,Apartamento con servicios incluidos entero,La Serena,6,5,3, Habitación,2,privado,120.0,-29.8999,-71.2727,"https://maps.google.com/maps?ll=-29.8999,-71.2727&z=14&t=m&hl=es&gl=CL&mapclient=apiv3","Barrio muy seguro de alto estart, muy próximo a el faro de la Serena, y la avenida del mar, sitio mas turístico de la ciudad","Este lugar es realmente especial con todo cerca a distancia caminable en primera línea frente al mar, atardeceres en el balcón maravilloso",['Vista a la bahía'],4.87,23,Paola,11-2021,https://www.airbnb.cl/rooms/30093457?adults=1&children=0&infants=0&pets=0&check_in=2023-02-26&check_out=2023-03-03&previous_page_section_name=1000
21,Neohaus - Hermosa Vista frente al mar en La Serena,Condo entero,La Serena,4,3,2, Habitación,2,privado,89.0,-29.91498,-71.27551,"https://maps.google.com/maps?ll=-29.91498,-71.27551&z=14&t=m&hl=es&gl=CL&mapclient=apiv3",,"Relájate y disfruta de esta hermosa vista al mar en un entorno magnífico y en una de las mejores ubicaciones de La Serena. Disfruta de sus hermosas playas y agradable clima en este lindo y confortable departamento. Muy bien ubicado, en primera linea y cercano a restaurantes, panadería y pasteleria. Seguridad las 24 horas.",['Acceso la playa Público o compartido'],5.0,11,Miguel Angel,10-2016,https://www.airbnb.cl/rooms/53957454?adults=1&children=0&infants=0&pets=0&check_in=2023-02-27&check_out=2023-03-04&previous_page_section_name=1000
22,Hermoso departamento frente al mar,Condo entero,Los Molles,4,2,2, Habitación,2,privado,70.0,-32.23411,-71.51347,"https://maps.google.com/maps?ll=-32.23411,-71.51347&z=14&t=m&hl=es&gl=CL&mapclient=apiv3","Un hermoso sector, frente a la playa. Fácil y cómodo para transitar. Cerca de todo lo que necesitas para un merecido descanso.","El mejor lugar frente al mar, en un lugar seguro y cómodo.
Podrás encontrar tranquilidad y a la vez podrás realizar distintas actividades:  buceo, cabalgatas, etc.
Con tiendas y restaurantes muy cerca, para encantarte con un lugar de sol y playa.  
Especial para parejas y también para familias con niños",['Vista a la bahía'],4.83,6,Bernardita,08-2018,https://www.airbnb.cl/rooms/51530295?adults=1&children=0&infants=0&pets=0&check_in=2023-02-20&check_out=2023-02-25&previous_page_section_name=1000
