,Titulo1,Titulo2,Comuna,Capacidad,Camas,N_Habitaciones,Habitaciones,Baños,Tipo_Baños,Precio,lat,lon,Ubicacion,Ubides,Descripcion,Servicios,Nota,Nnota,Anfitrion,Registro,Link
0,Casa con piscina en Cond Agua Dulce Huentelauquén,Alojamiento entero,Angostura,8,5,3, Habitación,2,privado,200.0,-31.5149,-71.5605,"https://maps.google.com/maps?ll=-31.5149,-71.5605&z=14&t=m&hl=es&gl=CL&mapclient=apiv3",,"Casa Nueva, recién construida en Condominio Agua Dulce. El condominio tiene acceso controlado, seguridad permanente y acceso directo a la playa, cuenta con 5 canchas de tenis , 3 canchas de futbolito, caleta de pescadores, juegos para niños y senderos para trekking sin costo extra. 

La casa tiene una hermosa vista a toda la bahía y una piscina de 8 x 4 mts, muy amplia para toda la familia.


La vista al mar es increible, todo el frente de la casa es vidreado, por ende la vista es completa y despejada al mar. El condominio cuenta con caminos con maicillo compactado, ideal para salir a correr, andar en bicicleta o caminar.",['Cocina'],5.0,3,Rodrigo,06-2016,https://www.airbnb.cl/rooms/804957401975945423?adults=1&children=0&infants=0&pets=0&check_in=2023-02-25&check_out=2023-03-02&previous_page_section_name=1000
1,"Cabaña vicuña valle del Elqui, Lunita del cerro",Cabaña entero,Vicuña,6,5,2, Habitación,1,privado,60.0,-30.04956,-70.71994,"https://maps.google.com/maps?ll=-30.04956,-70.71994&z=14&t=m&hl=es&gl=CL&mapclient=apiv3","Es un camino rural, de la antigua hacienda “la compañia” con pirkas, arboles nativos y variedad de aves. Ubicacion en cerro privilegiada para la observacion astronomica,libre de contaminacion luminica.","Lugar rodeado de naturaleza, con linda  vista a la cuidad de vicuña y al cerro Mamalluca, ideal para el descanso.

El espacio
Cabaña totalmente equipada. Cuenta con terraza, hamacas , parrilla y piscina compartida",['Cocina'],4.48,118,Miri,01-2019,https://www.airbnb.cl/rooms/31572028?adults=1&children=0&infants=0&pets=0&check_in=2023-03-02&check_out=2023-03-08&previous_page_section_name=1000
2,Playa y desconexión en un santuario natural,Cabaña entero,Tongoy,6,7,3, Habitación,2,privado,63.0,-30.30053,-71.52138,"https://maps.google.com/maps?ll=-30.30053,-71.52138&z=14&t=m&hl=es&gl=CL&mapclient=apiv3",La casa está situada en un condominio con conserjeria 24/7. El condominio se llama Mirador del Humedal y la entrada principal está proveniendo de la costa.,"Paraiso en el norte de Chile entre playa y humedales naturales

Hermosa casa del reconocido arquitecto chileno Mathias Klotz situada a 8Kms de la caleta de la caleta de Tongoy y a 2kms de puerto aldea, está dentro de un santuario natural, rodeado por 2 humedales naturales y A 500 metros de la playa . Si te encuentras con un día despejado podrás observar los cielos más limpios del planeta para ver las estrellas. 
Rica gastronomía de mar, en una zona segura sobre todo de ambiente familiar.


Las piezas son confortables y pueden habitar la casa 8 personas cómodamente. Hay plumones y almohadas pero se debe llevar ropa de cama personal (sabanas y toallas).",['Vista al patio'],4.88,32,Alvaro,05-2011,https://www.airbnb.cl/rooms/16555619?adults=1&children=0&infants=0&pets=0&check_in=2023-03-27&check_out=2023-04-01&previous_page_section_name=1000
3,"Embalse puclaro, valle del elqui",Cabaña entero,Vicuña,5,4,3, Habitación,2,privado,85.276,-30.0033,-70.8409,"https://maps.google.com/maps?ll=-30.0033,-70.8409&z=14&t=m&hl=es&gl=CL&mapclient=apiv3","se ubica a unos 400 metros de la carretera (ruta 41) al costado de Villa Puclaro. Con una subida de unos 50 mts. Un poco complicada, pero lo demás es con adocretos.","Un lugar tranquilo para relajarse, amplio terreno, piscina, parrilla. A 10 minutos de vicuña y a 35 minutos de la serena, preciosa vista y días de sol desde temprano.",['Vista al jardín'],,,Macarena,09-2022,https://www.airbnb.cl/rooms/763852230237366836?adults=1&children=0&infants=0&pets=0&check_in=2023-02-19&check_out=2023-02-25&previous_page_section_name=1000
4,Valle del Limarí. Tranquilidad y descanso,Cabaña entero,Ovalle,5,4,2, Habitación,1,privado,70.0,-30.754,-70.8434,"https://maps.google.com/maps?ll=-30.754,-70.8434&z=14&t=m&hl=es&gl=CL&mapclient=apiv3","El lugar es muy rural. Solo pequeños almacenes .Está a 38 km de la ciudad de Ovalle. En el Valle del Limarí IV región Coquimbo Siguiendo al interior del valle encontrará la belleza de grandes viñedos, plantaciones de cítricos, paltos duraznos y otros, que cuelgan de los cerros. Podrás visitar Pisqueras, pueblos típicos antiguos y artesanías en especial de Lapilázuli. En kms. cercanos se puede visitar una reserva arqueológica diaguita llamada ""Valle del encanto"" con increíbles petroglifos.","Parcela de agrado donde se adecuó esta cabaña. Es para quienes deseen conocer las bellezas y la paz del Valle del Limarí . Materiales rústicos. Rodeado de árboles frutales y naturaleza nortina  de la que pueden disfrutar incluyendo los cielos estrellados o las noches de Luna llena.

El espacio
Está equipada con todo lo necesario para cocinar.. Posee un hermoso quincho para los asados. También pueden conseguir una persona que pueda colaborar en hacer comida o comprar, como pan amasado etc.",['Vista al canal'],4.90,20,Migdalel,11-2019,https://www.airbnb.cl/rooms/40566558?adults=1&children=0&infants=0&pets=0&check_in=2023-03-03&check_out=2023-03-08&previous_page_section_name=1000
5,Casa de Viento,Casa de campo entero,Diaguitas,8,6,2, Habitación,2,privado,50.4,-30.02323,-70.63417,"https://maps.google.com/maps?ll=-30.02323,-70.63417&z=14&t=m&hl=es&gl=CL&mapclient=apiv3","A menos de una cuadra de la pintoresca plaza de Diaguitas, a pasos de la cervecera Guayacán, cercano a centros de observación astronómica turística y en la ruta de senderos de bicis y trekking.","Un entorno privilegiado a los pies del cerro Mamalluca que rodea una centenaria construcción que sus dueños han habilitado para el descanso y el  goce de quienes disfrutan la magia y tranquilidad del Valle de Elqui.

El espacio
Hermosos jardines, con comedores exteriores y amplia piscina, rodeados de una naturaleza sobrecogedora. Armonía y equilibrio entre campo y modernidad.",['Cocina'],4.93,95,Jimena,06-2019,https://www.airbnb.cl/rooms/35275672?adults=1&children=0&infants=0&pets=0&check_in=2023-02-27&check_out=2023-03-06&previous_page_section_name=1000
6,Linda casa con piscina y entorno campestre,Cabaña entero,Vicuña,6,5,3, Habitación,1,privado,100.0,-30.00054,-70.991,"https://maps.google.com/maps?ll=-30.00054,-70.991&z=14&t=m&hl=es&gl=CL&mapclient=apiv3",,"Linda casa con piscina y juegos infantiles, posee 3 dormitorios habilitados para 6 personas, baño completo, cocina americana equipada con encimera, horno eléctrico, horno microondas, vajilla y lavadora.
La zona exterior cuenta con un quincho, el cual tiene asadera y horno a leña, arboles frutales, piscina y juegos infantiles.
Paisaje hermoso, entorno tranquilo
Ver descripción completa",['Cocina'],4.94,16,Ximena,04-2018,https://www.airbnb.cl/rooms/31650345?adults=1&children=0&infants=0&pets=0&check_in=2023-02-21&check_out=2023-02-26&previous_page_section_name=1000
7,"Bungalow/cabaña en la Herradura, Coquimbo.",Cabaña entero,Coquimbo,4,3,2, Habitación,1,privado,35.0,-29.99769,-71.39269,"https://maps.google.com/maps?ll=-29.99769,-71.39269&z=14&t=m&hl=es&gl=CL&mapclient=apiv3","Comunidad ecológica, condominio privado.","Acogedora cabaña con gran vista al mar, inserta áreas silvestres protegidas. Espacios iluminados y terraza, que permitirán hacer de tu descanso una experiencia íntima bajo uno de los cielos más limpios del mundo. Se encuentra en condominio ecológico privado, sector rural ""El Panul"" localidad de la Herradura (NO ES ZONA DE BALNEARIO), a minutos de playas y ciudades, pero separado  de la ruta 5 norte  por 4 km de camino de tierra (NECESARIO AUTOMÓVIL para ingresar o salir de la comunidad).


La tranquilidad del lugar, lejos de turistas, pero a la vez a pocos minutos en automóvil de las principales playas y centros comerciales. La vista, y el entrono silvestre que se puede recorrer a pie hasta llegar al mar (no apto para baño) durante el día, y el silencio del que se puede disfrutar bajo las estrellas durante la noche.",['Cocina'],4.72,68,Denisse Daniela,03-2017,https://www.airbnb.cl/rooms/18139777?adults=1&children=0&infants=0&pets=0&check_in=2023-03-13&check_out=2023-03-19&previous_page_section_name=1000
8,"Cabaña en la montaña, Cochiguaz.",Cabaña entero,Paiguano,4,3,2, Habitación,1,privado,65.0,-30.138,-70.40535,"https://maps.google.com/maps?ll=-30.138,-70.40535&z=14&t=m&hl=es&gl=CL&mapclient=apiv3","Zona cordillerana, con escasa conectividad, ideal para desconectarse del mundo, no hay cajeros automáticos, bombas de bencina, ni negocios (1).","Cabaña con dos dormitorios, principal cama queen, otro con camarote, cocina integrada, baño completo, calefacción a gas, parrilla para asados, fogón, piscina con agua pura de vertiente, mirador en altura, variedad de árboles frutales, a pasos de observatorio y río.

El espacio
Única cabaña, tranquilidad y silencio, flora y fauna nativa. 
Contemplación de cielos estrellados junto al fuego.",['Cocina'],4.95,43,De Cielo Y Cerros,05-2015,https://www.airbnb.cl/rooms/6603309?adults=1&children=0&infants=0&pets=0&check_in=2023-03-14&check_out=2023-03-19&previous_page_section_name=1000
9,Cabañas Valle del Elqui con tina caliente,Cabaña entero,Vicuña,6,6,2, Habitación,1,privado,110.0,-30.03152,-70.70876,"https://maps.google.com/maps?ll=-30.03152,-70.70876&z=14&t=m&hl=es&gl=CL&mapclient=apiv3","Vista panorámica, tranquilidad, ideal para relajarse y descansar","Cabaña totalmente amoblada hasta 6 personas
Piscina con vista panorámica
Tina caliente, uso exclusivo cabaña ( valor adicional )
Cielos despejados para disfrutar de las noches para mirar las estrellas y sin contaminación lumínica.
Hermosa vista panorámica hacia la ciudad de Vicuña y el Valle de Elqui
Ideal para disfrutar de la tranquilidad del sector",['Cocina'],4.80,71,Rodrigo,07-2019,https://www.airbnb.cl/rooms/38991972?adults=1&children=0&infants=0&pets=0&check_in=2023-03-05&check_out=2023-03-10&previous_page_section_name=1000
10,"Cabaña con Vista Panorámica ""Betelgeuse""",Cabaña entero,Pisco Elqui,4,3,2, Habitación,1,privado,90.0,-30.14278,-70.49942,"https://maps.google.com/maps?ll=-30.14278,-70.49942&z=14&t=m&hl=es&gl=CL&mapclient=apiv3",,"La cabaña ""Betelgeuse"" cuenta con una acogedora decoración, en un ambiente relajado y cómodo que sumado al entorno, piscina, parras y la maravillosa vista dan el sello de armonía que busca, tan clásico del Valle. Estamos ubicados a solo 1.5 kms. de Pisco Elqui, típico pueblito y capital turística, que cuenta con una amplia oferta gastronómica y de entretenimiento. La cabaña esta equipada para 4 personas (ampliable a 5) y está atendida por sus propios dueños.",['Vista a las montañas'],5.0,10,Jazmina,02-2021,https://www.airbnb.cl/rooms/51216386?adults=1&children=0&infants=0&pets=0&check_in=2023-03-05&check_out=2023-03-10&previous_page_section_name=1000
11,Cabaña Cielo Encanto con terraza vista panorámica,Cabaña entero,Horcón,4,3,2, Habitación,1,privado,56.745,-30.20343,-70.48541,"https://maps.google.com/maps?ll=-30.20343,-70.48541&z=14&t=m&hl=es&gl=CL&mapclient=apiv3",,"Relájate con toda la familia en esta cabaña donde la tranquilidad se respira en uno de los cielos más puros del mundo, privacidad y armonía para venir cada vez que quieras...gran terraza y patio jardín para compartir...los esperamos!

El espacio
Una cabaña acogedora especial para venir en pareja, con amigos o familia...a disfrutar de un bello fin de semana...o retirarse unos días entre las montañas de Horcón...",['Vista a las montañas'],4.67,3,Cielo Encanto,12-2017,https://www.airbnb.cl/rooms/739635793080788903?adults=1&children=0&infants=0&pets=0&check_in=2023-02-22&check_out=2023-02-27&previous_page_section_name=1000
12,"Cabaña 2, a minutos de la playa, linda vista.",Cabaña entero,Guanaqueros,5,5,2, Habitación,1,privado,65.16,-30.20086,-71.43417,"https://maps.google.com/maps?ll=-30.20086,-71.43417&z=14&t=m&hl=es&gl=CL&mapclient=apiv3","Vivir en guanaqueros o visitarlo es tener la posibilidad de reconectar con la naturaleza, disfrutando sus paisajes, colores y aromas. El tiempo transcurre de manera diferente, permitiendo descansar y gozar de dias maravillosos.","Disfruta de cabañas en contacto con la naturaleza, linda vista al mar, a pasos de la playa, en un entorno tranquilo, seguro y cercano a diferentes lugares de atraccion de la cuarta region.
Estamos localizados en zona segura, logrando un equilibrio entre seguridad y distancia a la playa, conservando la vista al mar.
Llegarás con tan solo 10 minutos caminando.


Cabaña acogedora, totalmente equipada con dos dormitorios con camas de dos plazas,  y cama nido.
con terrazas individuales, amplios ventanales, wafi, televisión, estacionamiento, quincho y zona de hamacas exclusivos para sus huéspedes.
Ubicadas en zona segura, conservando vista al mar.
Equilibrio entre la seguridad y distancia a la playa, llegando en pocos minutos caminando, tres cuadras aprox.",['Vista al horizonte de la ciudad'],4.91,23,Loreto,12-2019,https://www.airbnb.cl/rooms/41179999?adults=1&children=0&infants=0&pets=0&check_in=2023-02-28&check_out=2023-03-05&previous_page_section_name=1000
13,Refugio totoralillo,Cabaña entero,Coquimbo,4,3,2, Habitación,1,privado,45.0,-30.04439,-71.37747,"https://maps.google.com/maps?ll=-30.04439,-71.37747&z=14&t=m&hl=es&gl=CL&mapclient=apiv3","Lugar rural tranquilo , funciona con fosa .","El espacio
Es una cabaña

Acceso de los huéspedes
Fácil acceso kilometro 450.5 , a 10 minutos de supermercados y el centro de coquimbo a 5 minutos en auto a la playa totoralillo caminando 30 minutos, locomoción a una cuadra de la cabaña, la cual esta emplazada en un terreno de 1000 mts cuadrados totalmente cerrado, al costado una casa independiente y otra cábaña .",['Vista al océano'],4.81,23,Elizabeth,01-2018,https://www.airbnb.cl/rooms/31073555?adults=1&children=0&infants=0&pets=0&check_in=2023-02-27&check_out=2023-03-04&previous_page_section_name=1000
14,Piuquenes Lodge Cabañas en Valle de Elqui,Cabaña entero,Paiguano,4,3,2, Habitación,2,privado,136.667,-30.2134,-70.4923,"https://maps.google.com/maps?ll=-30.2134,-70.4923&z=14&t=m&hl=es&gl=CL&mapclient=apiv3","Estamos ubicados en la localidad de Horcón, Valle de Elqui.","Disfruta en una de nuestras 2 cabañas completamente equipadas para recibirte a ti y tu familia o amigos.
¿Qué tal una fogata en la noche mientras observas las estrellas en el maravilloso cielo del Valle de Elqui?
¿O quizás una tarde en la cama de cuarzo a la orilla del rio? 
Te esperamos",['Vista al patio'],5.0,7,Juan Luis,12-2017,https://www.airbnb.cl/rooms/618298872230517969?adults=1&children=0&infants=0&pets=0&check_in=2023-02-26&check_out=2023-03-04&previous_page_section_name=1000
15,Cabaña Valle del Elqui,Alojamiento entero,La Serena,5,4,3, Habitación,2,privado,98.0,-30.0126,-71.0358,"https://maps.google.com/maps?ll=-30.0126,-71.0358&z=14&t=m&hl=es&gl=CL&mapclient=apiv3",El lugar corresponde a parcelas de agrado de 1/2 hectárea. En la noche se puede observar el cielo muy estrellado característico del lugar. Las caminatas en los alrededores son tranquilas pudiendo observar la flora y cerros del lugar.,"Está ubicado en El Valle de Elqui a 25 Kilómetros de La Serena ciudad que cuenta  con playa, bares restaurante, casino, Mall. El aeropuerto se encuentra a 20 kilómetros de distancia. Desde este lugar se pueden visitar observatorios Mayu, Tololo y Mamalluca ( reservas con anticipación)
También se pueden visitar las viñas y pisqueras de la localidad.
Piscina con vista panorámica al Valle.


La cabaña cuenta con hermosa terraza con vista al Valle, 2 dormitorios con cama de 2 plazas. Uno en la planta baja totalmente independiente con entrada independiente y el otro en el piso superior donde además se encuentra la cocina.Cuenta además con 2 camas de 1 plaza ubicadas en el segundo piso . Baño en ambos pisos. Cabaña full equipada para que tu estadía sea confortable.",['Cocina'],5.0,34,Ana María,07-2017,https://www.airbnb.cl/rooms/20154848?adults=1&children=0&infants=0&pets=0&check_in=2023-02-27&check_out=2023-03-04&previous_page_section_name=1000
16,"Cabaña en Valle de Elqui, Horcon 4 Personas.",Cabaña entero,Horcón,4,3,2, Habitación,1,privado,84.857,-30.18506,-70.48151,"https://maps.google.com/maps?ll=-30.18506,-70.48151&z=14&t=m&hl=es&gl=CL&mapclient=apiv3",,"CABAÑA EXCLUSIVA,  PRIORIZA LA SEGURIDAD SANITARIA DE LOS HUESPEDES, DADO QUE POSEE ESPACIOS AMPLIOS,   GARANTIZANDO LA COMODIDAD Y DESCANSO DEL VISITANTE. FULL EQUIPADA, LIVING/COMEDOR Y COCINA, TV,  WIFI,  QUINCHO PARA HACER ASADO,  CALEFONT IONIZADO, PISCINA, CALEFACCION, AMPLIO ESTACIONAMIENTO, ENTORNO NATURAL, IDEAL PARA CONTEMPLAR LAS ESTRELLAS. MUY BIEN EVALUADA, UBICADA A 700 METROS APROX. DEL CAMINO PRINCIPAL Y 1 KM APROX. DEL RIO.


EL VISITANTE PODRA ALOJARSE COMODAMENTE TENIENDO A DISPOSICION AL INTERIOR O EXTERIOR DE LA CABAÑA LO NECESARIO PARA DISFRUTAR Y DESCANSAR, MESA Y SILLAS BAJO SOMBRA, REPOSERAS EN EL SECTOR PISCINA, CIERRE PERIMETRAL DEL SECTOR PISCINA PARA RESGUARDO DE NIÑOS PEQUEÑOS, VISTA MARAVILLOSA EN TODO EL LUGAR.",['Cocina'],4.94,99,Angela,10-2016,https://www.airbnb.cl/rooms/15327981?adults=1&children=0&infants=0&pets=0&check_in=2023-02-27&check_out=2023-03-06&previous_page_section_name=1000
17,Acogedora Cabaña en Corazón de Valle de Elqui,Cabaña entero,La Serena,4,3,2, Habitación,1,privado,65.0,-29.99621,-70.53524,"https://maps.google.com/maps?ll=-29.99621,-70.53524&z=14&t=m&hl=es&gl=CL&mapclient=apiv3","El lugar es muy tranquilo, estamos entre la cuidad de Vicuña y la pintoresca localidad de Pisco Elqui. Desde acá podrás salir a visitar los observatorios, destilerías de la zona, pisqueras y todo cuanto ofrece este hermoso valle además de los tours astronómico y las incomparables astrofotografias.","Cabaña completamente equipada, cerca del río claro, en la localidad de Tres Cruces zona rural y alejada de bullicio de la cuidad. Ideal para descansar y conectarse con la naturaleza, el canto de las aves, la suave brisa, los cielos mas claros ideal para quienes disfrutan de la astronomía y también de la ufología. El servicio además cuenta con desayuno tipo campestre con pan amasado, mermeladas caseras, huevos de campo, té de remojo con hierbas cordilleranas, etc para degustar el sabor del campo.


Lugar campestre amplio con entorno natural en un terreno de 7.000 metros aproximadamente; son sólo dos cabañas",['Vista a las montañas'],4.93,57,Yasmín Rocio,05-2019,https://www.airbnb.cl/rooms/36284531?adults=1&children=0&infants=0&pets=0&check_in=2023-03-05&check_out=2023-03-10&previous_page_section_name=1000
18,"Cabaña Familiar, embalse Puclaro, valle del Elqui",Cabaña entero,Vicuña,5,3,2, Habitación,2,privado,68.333,-30.00273,-70.83716,"https://maps.google.com/maps?ll=-30.00273,-70.83716&z=14&t=m&hl=es&gl=CL&mapclient=apiv3","La cabaña esta en un camino de acceso privado, permitido solo para los huespedes y propietarios, existen mas cabañas en el lugar, por lo que se recomienda usar los portones de acceso de auto y peatones dejando los candados de seguridad puestos para evitar acceso de personas ajenas al lugar","cabaña orilla sur de embalse PUCLARO, acceso directo desde la carretera la Serena - Vicuña.
la cabaña tiene varios senderos para caminar, y miradores; senderos para bicicleta por costado sur del embalse, se puede llegar caminando (10 mins  aprox) hasta el embalse.
Ideal para personas amantes del kitesurf o windsurf y para familiares que prefieren estar en un lugar cómodo y tranquilo para disfrutar de la naturaleza.
tiene dos terrazas separadas.


La cabaña es muy acogedora, al borde del embalse especial para los cultores del kitesurf y windsurf.
la familia puede aprovechar las playas protegidas del viento para acompañar a los deportistas.
en las tarde se pueden aprovechar las terrazas para ver el final del día, hacer un asado en la terraza externa o bien subir al mirador del cerro y gozar de la vista a las estrellas.

Fotos de embalse al maximo 2020, por sequia se debe considerar que el embalse no esta en la misma condición.","['Acceso a la playa', 'Frente a la playa']",5.0,12,Gabo,01-2017,https://www.airbnb.cl/rooms/16647616?adults=1&children=0&infants=0&pets=0&check_in=2023-02-15&check_out=2023-02-21&previous_page_section_name=1000
19,Habitación una o dos camas,Habitación privada en cabaña,La Serena,2,2,2, Habitación,1compartido,compartido,26.2,-29.91929,-71.26842,"https://maps.google.com/maps?ll=-29.91929,-71.26842&z=14&t=m&hl=es&gl=CL&mapclient=apiv3","Es un terreno con varias personas, las cuales tienen un buen vivir y no molestan.","Si buscas una habitación cercana a la playa, cómoda y amigable.
Esta es una gran opción.

El espacio
- 1 Habitación 
- 1 o 2 camas de una plaza 
- acceso a cocina, living y comedor
- baño compartido 
- lugar seguro y tranquilo 
- a pasos de la playa y centros comerciales
- anfitrión viajero, respetuoso con los huéspedes y el ambiente","['Acceso a playa Público o compartido', 'Frente a la playa']",5.0,4,Juan,10-2020,https://www.airbnb.cl/rooms/803088516400118620?adults=1&children=0&infants=0&pets=0&check_in=2023-02-16&check_out=2023-02-21&previous_page_section_name=1000
20,"Cabaña Mágica en Valle del Elqui, Alcohuaz",Cabaña entero,Paihuano,5,3,2, Habitación,2,privado,100.0,-30.029,-70.5164,"https://maps.google.com/maps?ll=-30.029,-70.5164&z=14&t=m&hl=es&gl=CL&mapclient=apiv3","cerca de lugares para realizar caminatas, cabalgatas etc","Disfruta de esta hermosa  y equipada cabaña, en este magnético y relajador lugar, en medio de las montañas más energéticas del mundo junto a un cielo excepcional.
Nos encontramos en un sector donde puedes disfrutar de actividades al aire libre para niños y adultos. Como escaladas en Bulder (Arawi Lodge) , trekking a los diferentes senderos cercanos,  un hermoso tour a viña Alcohuaz, así  como también emocionantes cabalgatas en medio de las montañas.


cómoda cocina americana equipada, sala de estar con Chimenea Bosca, dos baños con tina, una habitación con 1 cama de 2 plazas , una habitación dos camas  1 1/2  plaza y un sillón cama en living. Parrilla en terraza techada, y una hermosa piscina frente a las montañas bajo un espectacular cielo.",['Vista a las montañas'],5.0,5,Margarita Soledad,04-2021,https://www.airbnb.cl/rooms/554588697359312470?adults=1&children=0&infants=0&pets=0&check_in=2023-02-18&check_out=2023-02-23&previous_page_section_name=1000
21,Cabaña de Playa Huentelauquén,Cabaña entero,Huentaleuquen,4,3,2, Habitación,1,privado,90.0,-31.53795,-71.56845,"https://maps.google.com/maps?ll=-31.53795,-71.56845&z=14&t=m&hl=es&gl=CL&mapclient=apiv3",,"Cabaña de dos dormitorios con gran quincho a pasos de la playa, ideal para desconectarse, estar en familia y la naturaleza, la Cabaña se encuentra a un costado de otra propiedad pero con total independencia y accesos independientes entre ambas, estacionamiento privado y juegos para niños, el espacio común es la parte delantera del terreno y el camino que lleva a la playa


La casa es de 70 mts 2 en total considerando un quincho espectacular frente al mar, dispone de energía solar por lo que no se pueden usar artefactos eléctricos de alto consumo (secador de pelo, hervidores, etc),  se recomienda solo carga de celulares y similares","['Acceso a la playa', 'Frente a la playa']",4.79,56,Rodrigo,07-2016,https://www.airbnb.cl/rooms/37178270?adults=1&children=0&infants=0&pets=0&check_in=2023-03-06&check_out=2023-03-11&previous_page_section_name=1000
22,Alojamiento Rural Sendero La Higuera Wenuleufu,Cabaña entero,Monte Patria,4,3,2, Habitación,"1,5",privado,45.0,-30.71656,-70.79942,"https://maps.google.com/maps?ll=-30.71656,-70.79942&z=14&t=m&hl=es&gl=CL&mapclient=apiv3","Lo especial es que es un lugar autóctono, sin mayor intervención externa, hay muchos atractivos como lo es las contrucciones típicas en adobe y quincha (Rapel), flora y fauna autóctona, sitios arqueológicos (petroglifos), productores frutícolas, de miel, nueces en escabeche, queso de cabra, mermeladas, arropes , dulces y deshidratados y diversidad de productos de identidad local.","Nuestro alojamiento se encuentra en medio de un entorno natural,  paisaje típico de los valles interiores del Limarí: diversidad de frutales, vegetación autóctona, grandes cerros y montañas, riachuelos y canales de aguas cordilleranas, gastronomía con identidad local. Especial para el descanso  y el disfrute de la riqueza de la vida rural, productos de identidad propia. Somos gente de tradiciones arraigadas, donde prima la amabilidad y el buen trato. Es el grupo familiar quién te recibe.


La cabaña se encuentra dentro del huerto familiar, donde desarrollamos actividad principalmente agrícola y de turismo rural, contamos con mas de 30 tipos de frutales de distintas variedades con un senderito para recorrer el predio, lombricultura, huerta orgánica, sectores de descanso con hamacas y reposeras, riachuelo y posadera con agua de cordillera, mirador y rincones comunes como salón de mate, cocina leña, comedores y quincho.",['Cocina'],5.0,6,Claudia,06-2019,https://www.airbnb.cl/rooms/35908420?adults=1&children=0&infants=0&pets=0&check_in=2023-02-26&check_out=2023-03-04&previous_page_section_name=1000
