,Titulo1,Titulo2,Comuna,Capacidad,Camas,N_Habitaciones,Habitaciones,Baños,Tipo_Baños,Precio,lat,lon,Ubicacion,Ubides,Descripcion,Servicios,Nota,Nnota,Anfitrion,Registro,Link
92,Hermosa casa condominio privado Tongoy,Alojamiento entero,Coquimbo,7,7,3, Habitación,1,privado,85.0,-30.25781,-71.4747,"https://maps.google.com/maps?ll=-30.25781,-71.4747&z=14&t=m&hl=es&gl=CL&mapclient=apiv3","-4 minutos la hermosa playa socos
-4 minutos Tongoy
-8 minutos Guanaqueros
-20 minutos totoralillo
-35 minutos la serena y coquimbo
-90 minutos en hermoso valle del elqui","Hermoso condominio privado con amplias áreas verdes, 2 gran piscinas, quinchos con asaderas, cancha de tenis, cancha de futbolito.
Es un condominio plenamente para venir a descansar y desconectarse de la ciudad, para así disfrutar de su hermoso balneario, manjares gastronómicos y playas cercanas como Guanaqueros y totoralillo.


Esta casa consta de 3 habitaciones y un baño 
1era habitación con cama 2 plazas 
2da habitación con 1 camarote 1 plaza
3era habitación con 1 camarote 1 plaza
1 futon
Casa de 67 mts2 y terreno 450 mts2",['Cocina'],4.64,11,Italo,12-2019,https://www.airbnb.cl/rooms/46418662?adults=1&children=0&infants=0&pets=0&check_in=2023-02-26&check_out=2023-03-04&previous_page_section_name=1000&federated_search_id=c897bdfd-9291-487b-b1ff-69ffde9d44c7
93,Casa familiar en Pisco Elqui,Alojamiento entero,Pisco Elqui,12,12,5, Habitación,"3,5",privado,181.972,-30.12452,-70.49465,"https://maps.google.com/maps?ll=-30.12452,-70.49465&z=14&t=m&hl=es&gl=CL&mapclient=apiv3","Casa ubicada en el centro histórico del pueblo de Pisco Elqui, a cuadra y media de la plaza. A pasos de almacenes, tienda de artesanías, astronomía, paseo a caballo, trekking y atractivos turísticos del valle.","Casa rústica, completamente remodelada y equipada. Espacios amplios y capacidad para recibir 2 a 3 familias. Terreno espacioso con piscina privada y terrazas con vistas sensacionales al valle.
Ubicación privilegiada en el centro de Pisco Elqui.

El espacio
Casa muy grata para descansar en familia y con amigos.  Capacidad hasta 14 personas.  Pida descuento para grupos menores.
Piezas amplias equipadas con ropa de cama.
Cocina muy bien equipada para aficionados gourmet. 
TV sin cable (videos). No hay conexión internet. Si hay señal de celular.",['Cocina'],4.82,33,Sylviane,11-2015,https://www.airbnb.cl/rooms/9458663?adults=1&children=0&infants=0&pets=0&check_in=2023-03-01&check_out=2023-03-06&previous_page_section_name=1000&federated_search_id=c897bdfd-9291-487b-b1ff-69ffde9d44c7
94,Valle de Elqui. Cabañas Jardín de Estrellas. 3,Cabaña entero,Paihuano,4,3,2, Habitación,1,privado,85.0,-30.23335,-70.49483,"https://maps.google.com/maps?ll=-30.23335,-70.49483&z=14&t=m&hl=es&gl=CL&mapclient=apiv3","Servicios cercanos al alojamiento de restaurant, cabalgatas, senderismo y otros.","Cabañas ""Jardín de Estrellas"".
Hermoso entorno natural, entre montañas y cielos estrellados, ideal para un buen descanso.
Piscina con vistas.
Cabañas totalmente equipadas.


Espacios amplios de relajo, terraza con bellas vistas al valle y montañas.
Privacidad.
Tranquilidad.
Piscina con vistas.",['Cocina'],4.80,5,Patricia Bibiana,06-2019,https://www.airbnb.cl/rooms/35384550?adults=1&children=0&infants=0&pets=0&check_in=2023-02-28&check_out=2023-03-05&previous_page_section_name=1000&federated_search_id=c897bdfd-9291-487b-b1ff-69ffde9d44c7
95,Valle de Elqui. Cabañas Jardín de Estrellas. 1,Cabaña entero,Paihuano,6,5,2, Habitación,1,privado,110.0,-30.23374,-70.4967,"https://maps.google.com/maps?ll=-30.23374,-70.4967&z=14&t=m&hl=es&gl=CL&mapclient=apiv3","Servicios cercanos al alojamiento de restaurant, cabalgatas, senderismo y otros.
Lugar apacible y seguro.","Hermoso entorno natural, rodeado de montañas y cielos estrellados, ideal para un buen descanso.
Cabañas totalmente equipadas.

El espacio
Espacios amplios de relajo, terraza con bellas vistas al valle y montañas.
Privacidad.
Tranquilidad.

Piscina con vistas.",['Cocina'],5.0,13,Patricia Bibiana,06-2019,https://www.airbnb.cl/rooms/38331507?adults=1&children=0&infants=0&pets=0&check_in=2023-02-22&check_out=2023-02-27&previous_page_section_name=1000&federated_search_id=c897bdfd-9291-487b-b1ff-69ffde9d44c7
96,"Casa del Valle, Lugar soñado.",Casa de campo entero,La Serena,12,9,4, Habitación,4,privado,255.0,-29.92458,-71.21694,"https://maps.google.com/maps?ll=-29.92458,-71.21694&z=14&t=m&hl=es&gl=CL&mapclient=apiv3",,"Lugar de relajación, donde el Sol brillará desde la mañana. Está preparada para un grupo de 12 a 14 personas, completamente equipada, con hermosas y amplias áreas verdes, gran Piscina, Gimnasio, Quincho y horno de barro, mesa de ping pong, Taca Taca, tina de madera de agua caliente a leña, 4 dormitorios, 4baños, Wi-Fi, hermosas y acogedores espacios,  ideal para venir en familias  a relajarse y llenarse de energía del Valle del Elqui. Ubicada en dirección a Vicuña a 15 min del centro de Serena.",['Cocina'],5.0,6,Víctor,12-2022,https://www.airbnb.cl/rooms/787658634284634599?adults=1&children=0&infants=0&pets=0&check_in=2023-02-26&check_out=2023-03-03&previous_page_section_name=1000&federated_search_id=c897bdfd-9291-487b-b1ff-69ffde9d44c7
97,Cabaña familiar para 8 personas,Cabaña entero,Monte Patria,8,7,4, Habitación,3,privado,150.0,-30.8814,-70.7733,"https://maps.google.com/maps?ll=-30.8814,-70.7733&z=14&t=m&hl=es&gl=CL&mapclient=apiv3",,Relájate con toda la familia en este tranquilo lugar para quedarse.,['Vista al complejo turístico'],,,Carlos,01-2022,https://www.airbnb.cl/rooms/721011734361929966?adults=1&children=0&infants=0&pets=0&check_in=2023-02-21&check_out=2023-02-26&previous_page_section_name=1000&federated_search_id=c897bdfd-9291-487b-b1ff-69ffde9d44c7
98,"Casa en el Valle de Elqui, PAihuano",Casa de campo entero,Paiguano,6,5,2, Habitación,1,privado,135.0,-30.02845,-70.52544,"https://maps.google.com/maps?ll=-30.02845,-70.52544&z=14&t=m&hl=es&gl=CL&mapclient=apiv3",,"Relájate con toda la familia en este tranquilo lugar para quedarse., se encuentra en el valle de Elqui, con quincho y pozas naturales del Río Elqui.

Otros aspectos a destacar
Mínimo 2 noches de arriendo",['Vista a las montañas'],,,Helen Paulina,09-2021,https://www.airbnb.cl/rooms/737069334270847579?adults=1&children=0&infants=0&pets=0&check_in=2023-03-01&check_out=2023-03-07&previous_page_section_name=1000&federated_search_id=c897bdfd-9291-487b-b1ff-69ffde9d44c7
99,Moderna casa nueva en hermosa y soleada parcela,Casa de campo entero,La Serena,8,6,4, Habitación,3,privado,175.0,-29.9224,-71.1794,"https://maps.google.com/maps?ll=-29.9224,-71.1794&z=14&t=m&hl=es&gl=CL&mapclient=apiv3",,"Casa recién construida dentro de terreno de 3000m2, a la salida hacia valle de Elqui. A 3 minutos del aeropuerto, 12 del centro y 20 de la playa, esta moderna casa cuenta con 4 dormitorios, 3 baños, cocina comedor, living, terraza, piscina de 8·8·1,5 mts, con amplio deck de madera, juegos para niños en amplio jardín. El quincho esta bajo la sombra de un gran sauce frente a estanque de peces, amplio mesón de mosaico, mesa de ping pong. 3 Smart tv, wifi, alarma, cámaras de seguridad en exterior.",['Vista al patio'],,,Susana,07-2015,https://www.airbnb.cl/rooms/721068344825775980?adults=1&children=0&infants=0&pets=0&check_in=2023-02-26&check_out=2023-03-04&previous_page_section_name=1000&federated_search_id=c897bdfd-9291-487b-b1ff-69ffde9d44c7
100,Casa azul Pisco Elqui,Alojamiento entero,Pisco Elqui,4,3,2, Habitación,1,privado,75.0,-30.12511,-70.49421,"https://maps.google.com/maps?ll=-30.12511,-70.49421&z=14&t=m&hl=es&gl=CL&mapclient=apiv3",Está en pleno centro de Pisco Elqui y todo dentro del pueblo se puede hacer general es muy tranquilo pero los sábado puede haber ruido por los restaurantes cerca. Pero siempre hasta temprano.,"Linda casa de adobe en el pueblo con un patio grande de arboles frutales y piscina.  Esta en el centro de Pisco Elqui a pasos de la   plaza y la iglesia y cerca de restaurantes y bares.

El espacio
Mi casa es un espacio de relajo con hamacas bajo los árboles en una casa de adobe tradicional de Pisco Elqui.",['Cocina'],4.60,35,Carmen Luz,09-2018,https://www.airbnb.cl/rooms/33876912?adults=1&children=0&infants=0&pets=0&check_in=2023-02-27&check_out=2023-03-05&previous_page_section_name=1000&federated_search_id=c897bdfd-9291-487b-b1ff-69ffde9d44c7
101,Casa ola,Alojamiento entero,Huentelauquén,14,12,5, Habitación,"4,5",privado,480.247,-31.5159,-71.5674,"https://maps.google.com/maps?ll=-31.5159,-71.5674&z=14&t=m&hl=es&gl=CL&mapclient=apiv3",,"Casa ideal para compartir en familia. 2 habitaciones en suite, 1 habitación con camarotes, 1 habitación con camas nido, una habitación con cama clinica y cama adicional / escritorio para trabajar.
Cocina de autor / amplios espacios para compartir / casa en tercera línea a 100 metros del mar / completamente equipada. Condominio con canchas de tenis,  futbol, juegos circuito de trote y playa.
*La casa esta equipada para una persona con movilidad reducida (baño, cama clinica y rampas)",['Acceso a la playa'],,,Carlo,10-2016,https://www.airbnb.cl/rooms/798642267569127726?adults=1&children=0&infants=0&pets=0&check_in=2023-02-20&check_out=2023-02-25&previous_page_section_name=1000&federated_search_id=c897bdfd-9291-487b-b1ff-69ffde9d44c7
102,"Excelentes cabañas, Para encontrar tranquilidad",Cabaña entero,Guanaquero,6,5,3, Habitación,1,privado,75.0,-30.20608,-71.39691,"https://maps.google.com/maps?ll=-30.20608,-71.39691&z=14&t=m&hl=es&gl=CL&mapclient=apiv3",,En este alojamiento se respira tranquilidad: ¡relájate con toda la familia!,['Cocina'],4.80,5,Cabañas,05-2018,https://www.airbnb.cl/rooms/714367147674779609?adults=1&children=0&infants=0&pets=0&check_in=2023-02-27&check_out=2023-03-04&previous_page_section_name=1000&federated_search_id=c897bdfd-9291-487b-b1ff-69ffde9d44c7
103,Dominga Lodge valle de Elqui,Cabaña entero,La Serena,4,3,2, Habitación,1,privado,85.5,-29.9851,-71.06561,"https://maps.google.com/maps?ll=-29.9851,-71.06561&z=14&t=m&hl=es&gl=CL&mapclient=apiv3",,,['Cocina'],4.86,7,José,08-2018,https://www.airbnb.cl/rooms/32768011?adults=1&children=0&infants=0&pets=0&check_in=2023-03-01&check_out=2023-03-06&previous_page_section_name=1000&federated_search_id=c897bdfd-9291-487b-b1ff-69ffde9d44c7
104,Casa Guanaqueros I,Alojamiento entero,Coquimbo,10,8,4, Habitación,2,privado,180.0,-30.19544,-71.40706,"https://maps.google.com/maps?ll=-30.19544,-71.40706&z=14&t=m&hl=es&gl=CL&mapclient=apiv3",,"Casa Guanaqueros, se encuentra en sector las Licitas a solo 3 cuadras de la playa, cuenta con piscina de 10 metros y quincho privados. Esta cercano a Tongoy, Totoralillo, Puerto Velero, Coquimbo, La Serena.",['Cocina'],4.83,12,Mitchell,02-2016,https://www.airbnb.cl/rooms/34997724?adults=1&children=0&infants=0&pets=0&check_in=2023-02-26&check_out=2023-03-03&previous_page_section_name=1000&federated_search_id=c897bdfd-9291-487b-b1ff-69ffde9d44c7
105,"Casa con Piscina en Guanaqueros, IV región, Chile.",Cabaña entero,Coquimbo,7,5,3, Habitación,2,privado,72.0,-30.19463,-71.41238,"https://maps.google.com/maps?ll=-30.19463,-71.41238&z=14&t=m&hl=es&gl=CL&mapclient=apiv3","Tranquilo, residencial.","Casa con bella vista al mar en todos los recintos, 
Guanaqueros posee una maravillosa playa, soleado clima y exquisita gastronomía. 
Dos dormitorios con cama matrimonial y uno con camas gemelas, dos baños,  cocina americana, estar comedor, 70m2.
Terraza en altura con vista al mar.
TV cable, lavavajillas, lavadora, microhondas, juguera, colchones de resortes en buen estado.
Amplia Piscina con deck  y gran Quincho de uso exclusivo,  terreno de 1200m2.   Sector el  Oasis, al sur de cabañas Nenita.


En la playa cercana, El Oasis, se ubica un grato restaurante tipo chiringuito ubicado a orillas del mar, frente a la casa hay una plazoleta con juegos infantiles, el barrio es residencial y el poco ruido y tranquilidad permiten un grato descanso.",['Vista a la bahía'],4.50,5,Silvia,12-2013,https://www.airbnb.cl/rooms/31292860?adults=1&children=0&infants=0&pets=0&check_in=2023-03-05&check_out=2023-03-12&previous_page_section_name=1000&federated_search_id=c897bdfd-9291-487b-b1ff-69ffde9d44c7
106,Espectacular casa en la Magia del Valle del Elqui,Casa de campo entero,Rivadavia,10,10,4, Habitación,3,privado,300.0,-29.97638,-70.55228,"https://maps.google.com/maps?ll=-29.97638,-70.55228&z=14&t=m&hl=es&gl=CL&mapclient=apiv3","Es una zona rural, cercana al río, al cual puedes ir como paseo.
También se recomiendan trekking, cabalgatas, visitas a pisqueras, visitas a centros astronómicos, entre otras actividades.","Hermosa y rústica casa de campo ubicada en un lugar privilegiado del Valle del Elqui , cercana a lugares turísticos como Vicuña (15 Kms , Pisco Elqui (30 Kms.) y distante a unos 80 kms. de La Serena .
Mi casa es  muy acogedora, cómoda, luminosa y amplia, rodeada de cerros Impresionantes. Cuenta con una terraza ideal para asados y aperitivos. 
Amplio jardín , una gran piscina , todo en un lindo entorno que invita al descanso, a  conectarse con la naturaleza y a vivir una experiencia inolvidable.


Es un lugar rodeado de árboles añosos, vistas impresionantes de cerros de colores, noches estrelladas y de una paz y tranquilidad incomparables",['Vista al valle'],5.0,14,Claudia,07-2017,https://www.airbnb.cl/rooms/39442465?adults=1&children=0&infants=0&pets=0&check_in=2023-02-19&check_out=2023-02-24&previous_page_section_name=1000&federated_search_id=c897bdfd-9291-487b-b1ff-69ffde9d44c7
107,Hermosa Casa de Campo con piscina temperada,Casa de campo entero,Pisco Elqui,6,6,3, Habitación,3,privado,250.0,-30.12637,-70.4905,"https://maps.google.com/maps?ll=-30.12637,-70.4905&z=14&t=m&hl=es&gl=CL&mapclient=apiv3","Condominio muy tranquilo y acogedor, entorno natural con acceso privado a rio. A pasos de Plaza Pisco Equi y restaurantes","Hermoso lugar conectado con la naturaleza para disfrutar con la familia. Casa en exclusivo condominio cerrado, con piezas climatizadas y piscinas temperada , portón eléctrico con control, espacio suficiente para estacionar autos. A pasos de plaza de Pisco Elqui. con acceso privado a  estero .",['Vista al patio'],5.0,3,Paola,08-2022,https://www.airbnb.cl/rooms/691133749849672712?adults=1&children=0&infants=0&pets=0&check_in=2023-02-27&check_out=2023-03-05&previous_page_section_name=1000&federated_search_id=c897bdfd-9291-487b-b1ff-69ffde9d44c7
108,Cabaña II Guanaqueros arriendo solo a familias,Cabaña entero,Guanaqueros,5,4,2, Habitación,1,privado,95.0,-30.19424,-71.4026,"https://maps.google.com/maps?ll=-30.19424,-71.4026&z=14&t=m&hl=es&gl=CL&mapclient=apiv3",,"Cabañas  equipadas para 5 personas  en exclusivo condominio  Guanaqueros, el mejor lugar para disfrutar , a 5 min caminado a la playa  . Con acceso controlado al condominio y la playa solo para residentes o propietarios.

El espacio
Unos de los mejores lugares por su ubicación cercanía a la playa las cabañas están distanciadas unas de otras y el auto queda a la puerta de la cabaña . Todo esto en un terreno de 2500 mts2 cercados y con un portón de acceso a las cabañas y al de condominio se ocupa un control remoto , cada cabaña esta equipada con cobertores y polar más almohadas para cada cama",['Costa'],5.0,9,Ivan,10-2018,https://www.airbnb.cl/rooms/31065470?adults=1&children=0&infants=0&pets=0&check_in=2023-02-26&check_out=2023-03-03&previous_page_section_name=1000&federated_search_id=8a14fa76-2792-4b4c-9bbb-42cee996f460
109,Hermosa Casa de Campo con piscina temperada,Casa de campo entero,Pisco Elqui,6,6,3, Habitación,3,privado,250.0,-30.12637,-70.4905,"https://maps.google.com/maps?ll=-30.12637,-70.4905&z=14&t=m&hl=es&gl=CL&mapclient=apiv3","Condominio muy tranquilo y acogedor, entorno natural con acceso privado a rio. A pasos de Plaza Pisco Equi y restaurantes","Hermoso lugar conectado con la naturaleza para disfrutar con la familia. Casa en exclusivo condominio cerrado, con piezas climatizadas y piscinas temperada , portón eléctrico con control, espacio suficiente para estacionar autos. A pasos de plaza de Pisco Elqui. con acceso privado a  estero .",['Vista al patio'],5.0,3,Paola,08-2022,https://www.airbnb.cl/rooms/691133749849672712?adults=1&children=0&infants=0&pets=0&check_in=2023-02-27&check_out=2023-03-05&previous_page_section_name=1000&federated_search_id=8a14fa76-2792-4b4c-9bbb-42cee996f460
110,Espectacular casa en la Magia del Valle del Elqui,Casa de campo entero,Rivadavia,10,10,4, Habitación,3,privado,300.0,-29.97638,-70.55228,"https://maps.google.com/maps?ll=-29.97638,-70.55228&z=14&t=m&hl=es&gl=CL&mapclient=apiv3","Es una zona rural, cercana al río, al cual puedes ir como paseo.
También se recomiendan trekking, cabalgatas, visitas a pisqueras, visitas a centros astronómicos, entre otras actividades.","Hermosa y rústica casa de campo ubicada en un lugar privilegiado del Valle del Elqui , cercana a lugares turísticos como Vicuña (15 Kms , Pisco Elqui (30 Kms.) y distante a unos 80 kms. de La Serena .
Mi casa es  muy acogedora, cómoda, luminosa y amplia, rodeada de cerros Impresionantes. Cuenta con una terraza ideal para asados y aperitivos. 
Amplio jardín , una gran piscina , todo en un lindo entorno que invita al descanso, a  conectarse con la naturaleza y a vivir una experiencia inolvidable.


Es un lugar rodeado de árboles añosos, vistas impresionantes de cerros de colores, noches estrelladas y de una paz y tranquilidad incomparables",['Vista al valle'],5.0,14,Claudia,07-2017,https://www.airbnb.cl/rooms/39442465?adults=1&children=0&infants=0&pets=0&check_in=2023-02-19&check_out=2023-02-24&previous_page_section_name=1000&federated_search_id=8a14fa76-2792-4b4c-9bbb-42cee996f460
111,CABAÑA RÚSTICA EN VALLE DE ELQUI,Alojamiento entero,Paihuano ,4,3,2, Habitación,2,privado,134.501,-30.02851,-70.52625,"https://maps.google.com/maps?ll=-30.02851,-70.52625&z=14&t=m&hl=es&gl=CL&mapclient=apiv3","El lugar es muy tranquilo, lleno de árboles frutales y sólo te despiertan los pájaros por la mañana","Nuestro hermoso y tranquilo rincón del Valle de Elqui tiene un estilo rústico cálido rodeado de árboles frutales y ubicado a metros de la piscina y río, con ciudades como Vicuña, Montegrande y Pisco Elqui a algunos minutos. Ideal para descansar y cargar energías.//

El espacio
La tranquilidad, el buen clima todo el año",['Cocina'],4.81,61,Cristián,04-2015,https://www.airbnb.cl/rooms/6806143?adults=1&children=0&infants=0&pets=0&check_in=2023-02-26&check_out=2023-03-03&previous_page_section_name=1000&federated_search_id=8a14fa76-2792-4b4c-9bbb-42cee996f460
112,Cabaña en el Valle del Elqui con hermosa vista.,Cabaña entero,La Serena,5,4,2, Habitación,1,privado,80.0,-29.95715,-71.09784,"https://maps.google.com/maps?ll=-29.95715,-71.09784&z=14&t=m&hl=es&gl=CL&mapclient=apiv3",Zona rural cercana a la Ciudad de La Serena.,"Cabaña con hermosa vista al Valle del Elqui, ubicada en una parcela con abundante vegetación y un privilegiado entorno natural. Ideal para un tiempo de descanso a solo 20 minutos de La Serena.

Cuenta con un quincho privado y acceso a áreas comunes de piscina y senderos para recorrer la belleza del lugar.


Parcela de dos hectáreas con amplias áreas verdes y otras 4 cabañas. Cada una con quincho privado y separadas entre sí con bastante independencia.",['Cocina'],4.25,4,Nicolás,12-2017,https://www.airbnb.cl/rooms/32829146?adults=1&children=0&infants=0&pets=0&check_in=2023-02-22&check_out=2023-02-27&previous_page_section_name=1000&federated_search_id=8a14fa76-2792-4b4c-9bbb-42cee996f460
113,Cabaña Mediterranea Paihuano - Valle del Elqui,Cabaña entero,Paiguano,6,5,2, Habitación,2,privado,145.0,-30.02746,-70.52264,"https://maps.google.com/maps?ll=-30.02746,-70.52264&z=14&t=m&hl=es&gl=CL&mapclient=apiv3",,"Cabaña Mediterranea ubicada en Paihuano, Valle del Elqui. Ideal para pasar en familia, compartir en la piscina o en el rio. Espaciosa e iluminada. Ingreso es por camino de tierra. Tiene terraza con parrilla y estacionamiento.",['Cocina'],,,Fiorella,04-2016,https://www.airbnb.cl/rooms/711061168646382861?adults=1&children=0&infants=0&pets=0&check_in=2023-02-24&check_out=2023-03-01&previous_page_section_name=1000&federated_search_id=8a14fa76-2792-4b4c-9bbb-42cee996f460
114,Acogedora casa en Tongoy para 6 personas,Cabaña entero,Tongoy,6,5,3, Habitación,1,privado,100.0,-30.25777,-71.47452,"https://maps.google.com/maps?ll=-30.25777,-71.47452&z=14&t=m&hl=es&gl=CL&mapclient=apiv3",La casa está ubicada en un condominio con entrada controlada. El condominio tiene piscina y cancha de babyfootball.,Lugares de interés: Playa. Te va a encantar mi lugar debido a las zonas exteriores. Mi alojamiento es bueno para parejas y familias (con hijos).,['Cocina'],4.93,29,Maria Alejandra,11-2016,https://www.airbnb.cl/rooms/15852411?adults=1&children=0&infants=0&pets=0&check_in=2023-03-03&check_out=2023-03-08&previous_page_section_name=1000&federated_search_id=8a14fa76-2792-4b4c-9bbb-42cee996f460
115,"casa con vistas al mar, con piscina. los muelles",Bungalow entero,Los Molles,10,10,6, Habitación,2,privado,65.0,-32.23255,-71.50495,"https://maps.google.com/maps?ll=-32.23255,-71.50495&z=14&t=m&hl=es&gl=CL&mapclient=apiv3",,"Amplia casa vista al mar, 6 dormitorios 2 baños, refrigerador, lavadora, tv cable, piscina. La casa se encuentra ubicada a 3 kilómetros del cruce de los molles.",['Vista a la bahía'],,,Evelyn,12-2019,https://www.airbnb.cl/rooms/53034544?adults=1&children=0&infants=0&pets=0&check_in=2023-03-02&check_out=2023-03-07&previous_page_section_name=1000&federated_search_id=8a14fa76-2792-4b4c-9bbb-42cee996f460
116,Agradable casa en Tongoy con piscina en condominio,Cabaña entero,Coquimbo,6,5,3, Habitación,1,privado,93.0,-30.2578,-71.47591,"https://maps.google.com/maps?ll=-30.2578,-71.47591&z=14&t=m&hl=es&gl=CL&mapclient=apiv3",,"Agradable casa en localidad de Tongoy, a pasos de playa Socos, tranquilo ideal, para familias. Casa con balcón, cocina equipada, comedor, 1 cama matrimonial y 2 camas nido.
Se encuentra a 15 minutos a pie de la playa.
a 43 km. de Coquimbo y 58 km. del aeropuerto La Florida, en La Serena.

El espacio
Living, cocina y comedor en 2° piso. Tres habitaciones y un baño en 1° piso.",['Vista al jardín'],4.67,3,Paulina,01-2022,https://www.airbnb.cl/rooms/549109367429789268?adults=1&children=0&infants=0&pets=0&check_in=2023-02-26&check_out=2023-03-03&previous_page_section_name=1000&federated_search_id=8a14fa76-2792-4b4c-9bbb-42cee996f460
117,Casa en condominio cerrado a pasos de la playa,Alojamiento entero,Coquimbo,6,4,3, Habitación,1,privado,100.0,-30.25854,-71.47443,"https://maps.google.com/maps?ll=-30.25854,-71.47443&z=14&t=m&hl=es&gl=CL&mapclient=apiv3","Condominio cerrado, con amplias áreas verdes. Ubicado en zona residencial.","Casa ideal para tener un merecido descanso y relajo junto a la familia, a pasos de la playa y ubicada en un recinto privado, privilegiando la tranquilidad y exclusividad de un espacio seguro, ideal para vacacionar.

La casa cuenta con tres dormitorios, un baño, una amplia cocina con comedor y terraza, estacionamiento para varios vehículos. Zona de parrilla en terraza.

El condominio cuenta dos piscinas, cancha de tenis y de fútbol, sala de quinchos, amplias áreas verdes y portón a control remoto",['Vista al horizonte de la ciudad'],4.80,5,Matias,01-2021,https://www.airbnb.cl/rooms/53030090?adults=1&children=0&infants=0&pets=0&check_in=2023-02-25&check_out=2023-03-02&previous_page_section_name=1000&federated_search_id=8a14fa76-2792-4b4c-9bbb-42cee996f460
118,La Morada (FAMILIAR),Casa de campo entero,Pisco Elqui,8,6,3, Habitación,2,privado,174.06,-30.12169,-70.4927,"https://maps.google.com/maps?ll=-30.12169,-70.4927&z=14&t=m&hl=es&gl=CL&mapclient=apiv3",,"Hermosa casa para uso familiar 8 personas, gran piscina (agua de rio), vista espectacular. A 1 km. De Pisco Elqui. Ideal para descansar y ver las estrellas

El espacio
Es ideal para observar el cielo.
Su silencio de dia y de noche, solo el sonido de la naturaleza.
Gran piscina con agua de rio.",['Cocina'],4.84,82,Eduardo,11-2014,https://www.airbnb.cl/rooms/12093441?adults=1&children=0&infants=0&pets=0&check_in=2023-03-03&check_out=2023-03-09&previous_page_section_name=1000&federated_search_id=8a14fa76-2792-4b4c-9bbb-42cee996f460
