,Titulo1,Titulo2,Comuna,Capacidad,Camas,N_Habitaciones,Habitaciones,Baños,Tipo_Baños,Precio,lat,lon,Ubicacion,Ubides,Descripcion,Servicios,Nota,Nnota,Anfitrion,Registro,Link
45,Departamento full equipado con vista insuperable.,Condo entero,Coquimbo,4,4,2, Habitación,2,privado,105.0,-29.94371,-71.28882,"https://maps.google.com/maps?ll=-29.94371,-71.28882&z=14&t=m&hl=es&gl=CL&mapclient=apiv3","Aproximadamente a 300 mts del casino ENJOY , muy cerca de restaurantes, resto bar y pubs. También cerca de canchas de paddel y futbolito . Ferias artesanales y boulevards muy cerca. Minimarkets a una cuadra.","Departamento en primera linea, excelente ubicacion , vista insuperable de toda la bahia de Coquimbo y la playa de La Serena. Ideal para descansar, relajar, hacer deportes y entrenerse.

El espacio
El departamento tiene  2 dormitorios con closet, 2 baños , Living y cocina americana con isla para almorzar o desayunar. Tiene una terraza grande  full equipada con vista libre, lo que la aisla del ruido y del frio.",['Vista a la bahía'],5.0,10,Luis Ricardo,02-2017,https://www.airbnb.cl/rooms/663767041505677411?adults=1&children=0&infants=0&pets=0&check_in=2023-02-21&check_out=2023-02-26&previous_page_section_name=1000
46,"Avenida del Mar, La Serena, Vista a Puesta de sol",Vivienda rentada entero,Coquimbo,5,4,2, Habitación,2,privado,89.528,-29.94428,-71.28951,"https://maps.google.com/maps?ll=-29.94428,-71.28951&z=14&t=m&hl=es&gl=CL&mapclient=apiv3",,"Departamento en Jardín del Mar, con una espectacular vista a la Bahía desde el piso 15. Dos dormitorios y dos baños, living comedor, cocina americana y amplia terraza. Condominio con acceso controlado, ascensores panorámicos, grandes piscinas exteriores y piscina temperada, quincho en la azotea con vista panorámica, además spa con sauna, tinas de hidromasaje y baños de vapor. Sin dudas un edificio con las más altas prestaciones.",['Cocina'],3.67,3,Urbi,11-2015,https://www.airbnb.cl/rooms/53537872?adults=1&children=0&infants=0&pets=0&check_in=2023-03-03&check_out=2023-03-08&previous_page_section_name=1000
47,Espacio Verde VIP con wifi en La Serena,Vivienda rentada entero,Coquimbo,6,4,2, Habitación,2,privado,109.844,-29.94334,-71.28967,"https://maps.google.com/maps?ll=-29.94334,-71.28967&z=14&t=m&hl=es&gl=CL&mapclient=apiv3",,"Este departamento se encuentra frente al mar, habilitado para 6 personas con todas las comodidades, gran piscina, wifi, TV Cable, Smart TV, Home Theater, podrás escuchar música incluso desde tu celular conectado vía Bluetooth. De decoración moderna y entretenida. A pasos del casino Enjoy y los mejores restaurantes de la zona. 
Cuenta con microondas, cafetera, hornito, juguera, todo lo necesario para cocinar si deseas!
Tiene 1 estacionamiento propio y una gran terraza para disfrutar en familia


En Club Océano puedes ir a la gran piscina al aire libre, 
Gimnasio.
Sala de Lavandería en el primer piso
Piscina temperada y sauna, son de acceso controlado. Para el sauna se cancela en administración y se pide su uso con anticipación.
Quinchos para asados y salón de eventos en terraza con vistas panorámicas de la playa y ciudad se cancela su uso directamente en la administración y debe cumplirse con ciertas normas que te explicarán al momento de la solicitud.",['Vista a la bahía'],4.61,47,Yanitza,01-2012,https://www.airbnb.cl/rooms/15471290?adults=1&children=0&infants=0&pets=0&check_in=2023-02-25&check_out=2023-03-04&previous_page_section_name=1000
48,Lindo departamento con excelente ubicación,Vivienda rentada entero,La Serena,4,2,2, Habitación,2,privado,40.0,-29.92492,-71.27441,"https://maps.google.com/maps?ll=-29.92492,-71.27441&z=14&t=m&hl=es&gl=CL&mapclient=apiv3",,"Departamento ubicado a una cuadra de la playa, en condominio ""Terrazas del Sol III"", que cuenta con acceso controlado y áreas comunes disponibles para los visitantes, tales como áreas verdes, gimnasio, quinchos, piscina, sala de juegos y sala multiuso. 
Cuenta con dos habitaciones, dos baños, living comedor, cocina americana y amplio balcón con terraza. 
Completamente equipado para estadía cómoda de 4 personas. A 25 minutos a pie del casino Enjoy Coquimbo y cercano a restaurantes.


Los servicios que pueden acceder corresponde a Quinchos, piscina y áreas verdes en el condiminio. Además el edificio cuenta con lavandería del tipo pre-pago.",['Costa'],4.79,81,Juan,08-2017,https://www.airbnb.cl/rooms/29830460?adults=1&children=0&infants=0&pets=0&check_in=2023-03-16&check_out=2023-03-21&previous_page_section_name=1000
49,Departamento Costa herradura,Vivienda rentada entero,Coquimbo,5,4,2, Habitación,2,privado,100.4,-29.9825,-71.3523,"https://maps.google.com/maps?ll=-29.9825,-71.3523&z=14&t=m&hl=es&gl=CL&mapclient=apiv3","cerca al departamento por av la marina se encuentra variedad de restaurantes tales como :Fuente Liverpool, Okasama sushi, El rincón de Jenny, Bucanero Bar-Lounge, Mistral y Club de Yates La Herradura","El departamento se encuentra en primera linea a pasos de la Playa La Herradura, desde su balcón se puede apreciar una hermosa vista a toda la bahía.tiene una acceso directo a la ruta 5 donde se puede llegar en aproximadamente 10 min al centro de Coquimbo. cuenta con supermercado cercanos, street center y estaciones de servicios.

El espacio
es muy acogedor ya que todos sus espacios dan con vista al mar y se puede disfrutar del sonido de las olas, ademas cuenta con gimnasio, sauna y jacuzzi con vista al mar.",['Cocina'],4.88,17,Victor,12-2019,https://www.airbnb.cl/rooms/40834826?adults=1&children=0&infants=0&pets=0&check_in=2023-02-20&check_out=2023-02-25&previous_page_section_name=1000
50,Condominio Dunas De Morrillos,Condo entero,Coquimbo,10,9,4, Habitación,3,privado,200.0,-30.1538,-71.36905,"https://maps.google.com/maps?ll=-30.1538,-71.36905&z=14&t=m&hl=es&gl=CL&mapclient=apiv3",,"Exclusivo Condominio Dunas de Morrillos 
Departamento en 2º piso,  2 estacionamientos, 4 dormitorios, 3 baños,  Cocina equipada, TV e Internet, terraza frente a piscina y acceso directo a la playa . El Condominio posee canchas de tenis, paddle, baby futbol, piscina, restaurante,  gimnasio,  sector de  juegos infantiles, accesos controlados y seguridad 24 hrs.","['Acceso a la playa', 'Frente a la playa']",,,Jorge,06-2020,https://www.airbnb.cl/rooms/43726861?adults=1&children=0&infants=0&pets=0&check_in=2023-03-05&check_out=2023-03-12&previous_page_section_name=1000
51,Amplio departamento La Herradura,Condo entero,Coquimbo,6,3,3, Habitación,2,privado,75.0,-29.9803,-71.35,"https://maps.google.com/maps?ll=-29.9803,-71.35&z=14&t=m&hl=es&gl=CL&mapclient=apiv3","Lugar tranquilo cercano a comercio, mercados y diversos deportes acuáticos","Amplio y cómodo departamento en primera línea, habilitado para un grato descanso en familia, ubicado en segundo piso con acceso controlado, ascensores y estacionamiento subterráneo. Condominio cuenta con áreas comunes (Quincho, gimnasio, salón de eventos y una gran piscina con áreas verdes). Posee un acceso directo desde el condominio a playa La Herradura.",['Vista a la bahía'],5.0,9,Eliana,08-2017,https://www.airbnb.cl/rooms/779842565951735639?adults=1&children=0&infants=0&pets=0&check_in=2023-03-06&check_out=2023-03-11&previous_page_section_name=1000
52,"Primera Línea, La Herradura",Vivienda rentada entero,Coquimbo,4,3,2, Habitación,2,privado,80.0,-29.98071,-71.3528,"https://maps.google.com/maps?ll=-29.98071,-71.3528&z=14&t=m&hl=es&gl=CL&mapclient=apiv3",,"Departamento ubicado en primera línea de la extensa Playa La Herradura. El condominio cuenta con piscinas, quinchos, gimnasio, jacuzzi, sauna y juegos infantiles, acceso directo a la playa, seguridad las 24 horas, estacionamiento subterráneo y de visitas.
Instancia perfecta para disfrutar el mar y de una bella vista a la bahía.
Relájate en esta escapada única y tranquila.",['Vista al océano'],,,Juan Carlos,01-2019,https://www.airbnb.cl/rooms/804507319354312598?adults=1&children=0&infants=0&pets=0&check_in=2023-02-21&check_out=2023-02-26&previous_page_section_name=1000
53,Hermoso departamento con vista al mar.,Condo entero,La Serena,5,4,2, Habitación,2,privado,55.0,-29.9139,-71.2749,"https://maps.google.com/maps?ll=-29.9139,-71.2749&z=14&t=m&hl=es&gl=CL&mapclient=apiv3","excelente ubicación frente al mar, sector seguro y con fácil acceso a restaurantes, lugares turisticos de la zona.","Hermoso departamento en primera linea, con vista panorámica de toda la avenida del mar. Piso 5, estacionamiento. Equipamiento edificio:  gimnasio, cancha de tenis, sala de pool, piscina, quincho, juegos para niños.

El espacio
Acogedor departamento para 5 personas, muy bien equipado.",['Vista al océano'],4.88,16,Gladys,12-2019,https://www.airbnb.cl/rooms/703655994263528550?adults=1&children=0&infants=0&pets=0&check_in=2023-03-13&check_out=2023-03-18&previous_page_section_name=1000
54,LAS TACAS DEPARTAMENTO DE LUJO EN PRIMERA LÍNEA,Vivienda rentada entero,Coquimbo,8,6,3, Habitación,3,privado,250.0,-30.08635,-71.37261,"https://maps.google.com/maps?ll=-30.08635,-71.37261&z=14&t=m&hl=es&gl=CL&mapclient=apiv3",,"Hermoso departamento para 9 personas en exclusivo condominio en el norte de Chile. Cuenta con playa privada (a 100 metros del departamento), múltiples piscinas, gimnasio, canchas de tenis, moto cross, treking,  marina, restaurant, minimarket, emporio la rosa, pescadería, feria artesanal,  entre otros. Para los niños todos los días hay diversas actividades dirigidas , para que los padres puedan descansar. A 10 minutos de Coquimbo y 25 de La Serena.


Espectacular departamento en primera linea con piso de mármol total en living y comedor, las habitaciones en piso flotante de madera blanca, tonos blancos, iluminación cálida, pulcro. El departamento esta decorado por diseñador. y al ser ultimo piso tiene una vista e iluminación inigualable.",['Vista al complejo turístico'],4.64,13,Antonia,09-2016,https://www.airbnb.cl/rooms/41009849?adults=1&children=0&infants=0&pets=0&check_in=2023-02-27&check_out=2023-03-04&previous_page_section_name=1000
55,Amplio departamento frente a la playa,Vivienda rentada entero,Coquimbo,7,5,3, Habitación,2,privado,150.0,-29.94413,-71.29043,"https://maps.google.com/maps?ll=-29.94413,-71.29043&z=14&t=m&hl=es&gl=CL&mapclient=apiv3",,"Al lado del Casino Enjoy , restorante en la puerta, salida directa a la playa. Sector muy seguro y de rápido acceso vehicular.
Departamento nuevo, Parrilla a gas, Wifi, Cable, Jacuzzi en departamento.",['Cocina'],4.62,13,Cary,01-2021,https://www.airbnb.cl/rooms/47990611?adults=1&children=0&infants=0&pets=0&check_in=2023-02-28&check_out=2023-03-06&previous_page_section_name=1000
56,"aire acondicionado, piscina temperada orilla playa",Vivienda rentada entero,La Serena,5,5,2, Habitación,2,privado,110.0,-29.916,-71.275,"https://maps.google.com/maps?ll=-29.916,-71.275&z=14&t=m&hl=es&gl=CL&mapclient=apiv3",,"Aire Acondicionado para las noches frías y noches cálidas.
Todos los espacios comunes habilitado. 
Departamento  nuevo a orilla de la playa. 
Internet Fibra Óptica 300 Megas. (ideal para tele-trabajo)
Piscina temperada, piscina exterior con y sin olas,  jacuzzi, spa, sala multiuso, gimnasio,  sauna, sala de juegos y sala de cine.",['Vista al océano'],4.87,45,Esteban,01-2018,https://www.airbnb.cl/rooms/22831900?adults=1&children=0&infants=0&pets=0&check_in=2023-02-24&check_out=2023-03-01&previous_page_section_name=1000
57,"Condominio Jardin del Mar, primera línea",Condo entero,Coquimbo,4,4,2, Habitación,2,privado,111.429,-29.94517,-71.29014,"https://maps.google.com/maps?ll=-29.94517,-71.29014&z=14&t=m&hl=es&gl=CL&mapclient=apiv3","Comodidad, relajo, diversión,","Hola! Buscas un lugar para disfrutar, relajarte y descansar? Te invito a pasar unos días en mi departamento de la playa,  podrás disfrutar  el mar, las puestas de sol,  la gastronomía y los atractivos turísticos de la zona.

El espacio
Moderno departamento, ubicado frente al mar, primera línea, piso 14,  2 dormitorios, estacionamiento privado, hermoso jardín, acceso controlado, a tan solo metros del Casino Enjoy, cercano a los mejores restaurantes, pubs y cafeterías.
Salida  directa a ruta 5 norte.
El departamento cuenta con Wifi y cable;  smartv 49 pulgadas en living , en dormitorio principal cama boxspring tamaño King marca Rossen y tv de 30”;  2 camas de 1 plaza en segundo dormitorio y sofá cama en living.   Cocina con todo lo necesario(bien equipada), microhondas, horno, encimera, refrigerador, hervidor eléctrico, etc, se entrega ropa blanca( sábanas y toallas) , balcón vista directa a la playa para disfrutar el sonido del mar y apreciar las puestas de sol. 
Hay ciclovías que permiten hacer recorridos La Serena-Coquimbo, hay lugares que arriendan bicicletas , así podrás disfrutar el mar en tus paseos.",['Vista al horizonte de la ciudad'],4.90,21,Mireya,11-2017,https://www.airbnb.cl/rooms/41861751?adults=1&children=0&infants=0&pets=0&check_in=2023-02-24&check_out=2023-03-03&previous_page_section_name=1000
58,Apartamento en Terrazas del Sol,Vivienda rentada entero,La Serena,6,5,3, Habitación,2,privado,100.0,-29.9131,-71.2745,"https://maps.google.com/maps?ll=-29.9131,-71.2745&z=14&t=m&hl=es&gl=CL&mapclient=apiv3","Ubicado en el mejor sector de la Serena a 1 minuto de la playa caminando , cerca de restaurantes, supermercados , El faro, Cacino y centros comerciales.","Tu estadía deber ser una gran experiencia y más aún cuando se trata de un viaje en familia , relájate y disfruta de este bello sector y sus atracciones que las rodea.

El espacio
Espectacular apartamento con amplio living y cocina full equipada con salida a la terraza donde podrás ver la puesta del sol y disfrutar de la vista, dispondrás de dos habitaciones equipadas + una habitación en suit con baño privado.",['Vista al jardín'],,,Emerson,09-2018,https://www.airbnb.cl/rooms/711167149553529791?adults=1&children=0&infants=0&pets=0&check_in=2023-02-20&check_out=2023-02-25&previous_page_section_name=1000
59,Departamento a pasos del mar.,Condo entero,La Serena,6,5,3, Habitación,2,privado,90.0,-29.9135,-71.2731,"https://maps.google.com/maps?ll=-29.9135,-71.2731&z=14&t=m&hl=es&gl=CL&mapclient=apiv3",,"Amplio departamento (90m2) incluye estacionamiento, a metros de la playa. 3 dormitorios (matrimonial en suite,walking closet,baño shower), 5 camas, 2 baños, Wifi fibra óptica, 2 Smart TV, amplia terraza con vista al mar. Piscina. Barrio tranquilo, edificio con acceso controlado. 
Detalles: Cocina y horno eléctrico, full equipamiento, hervidor, microondas, tostador.
Areas comunes del condominio, requieren reserva (quincho, gimnasio, salon de eventos).
Lavandería con tarjeta de pago (disponible).","['Acceso a playa Público o compartido', 'Frente a la playa']",,,Pilar,12-2022,https://www.airbnb.cl/rooms/774805954680274440?adults=1&children=0&infants=0&pets=0&check_in=2023-02-24&check_out=2023-03-01&previous_page_section_name=1000
60,"Hermoso depto en La Serena, a pasos de la playa",Vivienda rentada entero,La Serena,5,4,2, Habitación,2,privado,65.0,-29.9251,-71.27465,"https://maps.google.com/maps?ll=-29.9251,-71.27465&z=14&t=m&hl=es&gl=CL&mapclient=apiv3","Grato ambiente, entorno tranquilo. Muy cerca del comercio de 4 esquinas y a menos de 2 cuadras de la playa.
Debido a la situación de pandemia, el departamento es sanitizado después de cada visita.","Departamento nuevo, full equipado, con excelente ubicación y a pasos de la playa. 
Ubicado en 5to piso, posee 2 dormitorios, 2 baños, sofá cama en el living para un quinto huésped y un amplio balcón.
WIFI, TV con Roku, Youtube y otras apps.
Cuenta con estacionamiento al interior del condominio.
Cercano a comercios, restaurantes, pubs y con varias vías de acceso. 
El edificio tiene piscina, quincho, sala de lavandería, áreas verdes, juegos infantiles y acceso controlado.


Departamento nuevo, amoblado, luminoso y tranquilo.
Cuenta con muebles, artefactos y utensilios para generar una estadía muy cómoda.",['Vista al horizonte de la ciudad'],5.0,19,Patricio,10-2016,https://www.airbnb.cl/rooms/42398209?adults=1&children=0&infants=0&pets=0&check_in=2023-02-27&check_out=2023-03-05&previous_page_section_name=1000
61,Costa Herradura,Vivienda rentada entero,Coquimbo,5,4,2, Habitación,2,privado,70.463,-29.9837,-71.35244,"https://maps.google.com/maps?ll=-29.9837,-71.35244&z=14&t=m&hl=es&gl=CL&mapclient=apiv3",,Relájate con toda la familia en este tranquilo lugar para quedarse.,"['Acceso a la playa', 'Frente a la playa']",4.67,3,Ester,04-2019,https://www.airbnb.cl/rooms/47988924?adults=1&children=0&infants=0&pets=0&check_in=2023-03-06&check_out=2023-03-11&previous_page_section_name=1000
62,Primera Línea Dúplex / 2 Estacionamientos,Vivienda rentada entero,Puerto Velero,8,6,3, Habitación,3,privado,255.0,-30.2365,-71.4779,"https://maps.google.com/maps?ll=-30.2365,-71.4779&z=14&t=m&hl=es&gl=CL&mapclient=apiv3",,"Un lugar perfecto para descansar y vacacionar en un condominio tranquilo , familiar y seguro . 
 En primera línea con hermosas vista al mar y a Tongoy , hermosos jardines , piscinas , canchas de tenis , sector de parrillas , supermercado , SPA, marina , restaurantes , funicular  a la playa, canchas de fútbol, pádel , campo de golf .... y más.

Departamento muy bien equipado y con disponibilidad de dos estacionamientos .",['Vista al océano'],,,Rossana,01-2016,https://www.airbnb.cl/rooms/779926591564831409?adults=1&children=0&infants=0&pets=0&check_in=2023-03-13&check_out=2023-03-19&previous_page_section_name=1000
63,Serena 2023 AvdelMar Dpto 6p Wifi estacionamiento,Vivienda rentada entero,La Serena,6,5,2, Habitación,2,privado,75.0,-29.92304,-71.27689,"https://maps.google.com/maps?ll=-29.92304,-71.27689&z=14&t=m&hl=es&gl=CL&mapclient=apiv3","Sector avenida del mar cercano a cuatro esquinas, seguro y acceso a comercio local y playa caminando","Excelente departamento en privilegiada ubicación de La Serena a pasos del mar.
Con amplia terraza con malla y vista al mar, dormitorio prpal suite, otro para 4 personas, además de sillón cama. 2 Tv /cable. Wifi
Cocina full equipada. Dos baños completos, lavadora.
El condominio cuenta con vigilancia las 24 hrs, estacionamiento interior, quinchos para asado, gimnasio, zona de juego de niños y piscina.
Sector ideal para vacacionar, con playa, vida nocturna y comercio local.
¡No lo pienses más!


Un departamento equipado para pasar vacaciones increíbles malla balcón completo/ sabanas incluidas /No dejamos Toallas. Amigable con bebes disponible cuna armable y silla de comer",['Vista al mar'],4.27,11,Carolina,05-2017,https://www.airbnb.cl/rooms/53560329?adults=1&children=0&infants=0&pets=0&check_in=2023-02-26&check_out=2023-03-04&previous_page_section_name=1000
64,Maravilloso departamento frente a la playa.,Vivienda rentada entero,Coquimbo,6,5,2, Habitación,2,privado,70.0,-29.95685,-71.30993,"https://maps.google.com/maps?ll=-29.95685,-71.30993&z=14&t=m&hl=es&gl=CL&mapclient=apiv3","Costanera, playas, amplías veredas para
Caminar y trotar. Cíclovia de más de 10 km entre La Serena y Coquimbo.","Edificio nuevo frente a la playa, cercano a casino de juegos y restaurantes.

El espacio
Departamento de 2 dormitorios, 2 baños...excelente ubicación y acceso (sin tacos), a pocas cuadras de casino de juegos y principales restaurantes de la zona.
Balcón amplio con hermosa vista a toda la bahía y horizonte.","['Acceso a la playa', 'Frente a la playa']",4.85,34,Cristian,12-2015,https://www.airbnb.cl/rooms/46992150?adults=1&children=0&infants=0&pets=0&check_in=2023-02-28&check_out=2023-03-05&previous_page_section_name=1000
65,Departamento Jardín del Mar,Vivienda rentada entero,Coquimbo,4,3,2, Habitación,2,privado,130.0,-29.94329,-71.28989,"https://maps.google.com/maps?ll=-29.94329,-71.28989&z=14&t=m&hl=es&gl=CL&mapclient=apiv3",,"Crea momentos inolvidables en este alojamiento espectacular, con una vista privilegiada que te encantará. 
Ubicado frente a la playa y a pasos de restaurantes, del Casino Enjoy y comercio.
Áreas comunes con piscinas fría y temperada, hidromasaje, saunas, gimnasio, quincho y lavandería.",['Vista a la bahía'],5.0,3,Fabiola,02-2021,https://www.airbnb.cl/rooms/778113431154712303?adults=1&children=0&infants=0&pets=0&check_in=2023-02-23&check_out=2023-02-28&previous_page_section_name=1000
66,Arriendo departamento top Jardin del Mar La Serena,Condo entero,Coquimbo,6,5,2, Habitación,2,privado,111.435,-29.95454,-71.30024,"https://maps.google.com/maps?ll=-29.95454,-71.30024&z=14&t=m&hl=es&gl=CL&mapclient=apiv3",Av del Mar es la principal avenida de la costa de la region de Coquimbo. En verano se arrrindan bicicletas y patines. Se ofrecen clases de surf. Hay una extensa ciclovia para hacer deportes,"Gran vista frente al mar en el piso 16. Con wifi y 2 TV por cable. Piscina fría y cálida. En el piso 25 jacuzzi , sauna spa, gimnasio y zona de barbacoa. A poca distancia a pie de: Los mejores restaurantes, Casino,  Outlet, Tienda de conveniencia, Mercado de pescado fresco. Depto con hermosa vista a La Serena en primera linea, piso 16. Cuenta con wifi y 2 TV con cable. Area comun con piscinas frias y temperada; en piso 25 jacuzzi e hidromasaje, sauna seco y húmedo, gimnasio y quincho. A pasos del Casino, de restaurantes y  outlet.


Privilegiada vista y cercania a todo: no necesitas mover el auto. Hermosa vista,  no es necesario utilizar su coche, todo a poca distancia a pie","['Acceso a la playa', 'Frente a la playa']",5.0,6,Angelica,01-2015,https://www.airbnb.cl/rooms/9715387?adults=1&children=0&infants=0&pets=0&check_in=2023-02-19&check_out=2023-02-26&previous_page_section_name=1000
67,Edificio Aqua La Serena,Vivienda rentada entero,La Serena,6,5,3, Habitación,2,privado,140.0,-29.9157,-71.2749,"https://maps.google.com/maps?ll=-29.9157,-71.2749&z=14&t=m&hl=es&gl=CL&mapclient=apiv3",,"Departamento equipado para seis personas , este cuenta con;   tres dormitorios , dos baños uno de ellos en suite, terraza con vista al mar y estacionamiento privado, se encuentra inserto  en el exclusivo complejo Aqua de la comuna de La Serena, el edificio cuenta con espacios comunes como; piscina con olas, piscinas medianas y pequeña  , piscina temperada, sala de cine , sala de juegos, jacuzzi , sauna, gimnasio  y quinchos.",['Acceso a la playa'],5.0,4,Jesús,12-2022,https://www.airbnb.cl/rooms/784988875943150494?adults=1&children=0&infants=0&pets=0&check_in=2023-03-06&check_out=2023-03-11&previous_page_section_name=1000
68,Condominio Jardín del Mar de lujo,Vivienda rentada entero,Coquimbo,4,3,2, Habitación,2,privado,81.143,-29.94539,-71.28979,"https://maps.google.com/maps?ll=-29.94539,-71.28979&z=14&t=m&hl=es&gl=CL&mapclient=apiv3","Se ubica en la mejor zona de la comuna de COQUIMBO, sector Peñuelas a solo metros de casino Enjoy donde se puede encontrar restoranes, bar, disco, entretención y su recién inaugurado café frente al mar Ovo Beach.
Por otra parte en el sector de Peñuelas se realizan actividades deportivas durante todo el verano y parte del año.","Departamento de lujo de fácil accesibilidad, a pasos del casino Enjoy de COQUIMBO y mejores restoranes de la Región.

El espacio
Cada detalle en la decoración fue pensado para que nuestros huéspedes tengan unas vacaciones soñadas en un departamento confortable frente al mar, donde podrán disfrutar de todas sus áreas comunes como gym, spa, grandes piscinas, piscina temperada y quincho.

Las instalaciones de áreas comunes como gym, spa, piscina temperada y quinchos, no se encuentran disponibles por causa del coronavirus (COVID-19).","['Acceso a la playa', 'Frente a la playa']",4.98,61,Fhelipe,03-2016,https://www.airbnb.cl/rooms/12125697?adults=1&children=0&infants=0&pets=0&check_in=2023-03-15&check_out=2023-03-22&previous_page_section_name=1000
69,Depto Playa la Herradura acceso directo a playa,Vivienda rentada entero,Coquimbo,5,3,2, Habitación,2,privado,85.0,-29.97965,-71.34971,"https://maps.google.com/maps?ll=-29.97965,-71.34971&z=14&t=m&hl=es&gl=CL&mapclient=apiv3","El Condominio está ubicado en Bahia de la Herradura, donde podremos deleitarnos del maravilloso paisaje y tranquilidad del lugar, caminar por el paseo peatonal o orilla de mar y de exquisitos cafés, para disfrutar en pareja o en familia","Excelente departamento ubicado en tercer piso con vista al mar, donde podrá disfrutar de la comodidad de la vivienda, junto a la vista privilegiada desde la terraza, contemplando los atardeceres gracias a su maravillosa vista.
Cuenta con áreas comunes como gimnasio, juegos, quincho y piscina para adulto y niños, destacando el acceso directo y privado hacia la playa.
Alrededor se puede acceder a supermercados , restaurantes, paseos, cafés entre otros


Actualmente La piscina y espacios comunes se pueden utilizar según normas y horarios establecidos  por el edificio en relación a pandemia","['Acceso a la playa', 'Frente a la playa']",4.86,14,Pia,10-2019,https://www.airbnb.cl/rooms/40431242?adults=1&children=0&infants=0&pets=0&check_in=2023-02-19&check_out=2023-02-24&previous_page_section_name=1000
