,Titulo1,Titulo2,Comuna,Capacidad,Camas,N_Habitaciones,Habitaciones,Baños,Tipo_Baños,Precio,lat,lon,Ubicacion,Ubides,Descripcion,Servicios,Nota,Nnota,Anfitrion,Registro,Link
43,Casa valle La serena/valle del elqui,Alojamiento entero,La Serena,6,4,3, Habitación,2,privado,95.0,-29.93906,-71.1474,"https://maps.google.com/maps?ll=-29.93906,-71.1474&z=14&t=m&hl=es&gl=CL&mapclient=apiv3","Casavalle, está a 15 minutos en auto de la costa, avenida del mar, a 40 de vicuña y 1 hora y 30 minutos de pisco elqui.
En la puerta del condominio pasa locomoción hacia ambos destinos.
Estamos cerca de papayas Yañez, pueblo Algarrobito, en donde hay pequeños negocios.
A 5 minutos en auto hay supermercados, farmacias, verdulerías y estaciones de servicio, así como también el aeropuerto La florida.","Casavalle, es una casa aislada para una sola familia, ubicada en La serena camino al valle del elqui, a 15 minutos en auto de la avenida del mar, 5 del aeropuerto y 40 de Vicuña.
Dentro de un condominio, con portón eléctrico, y en un lugar privilegiado, a la mano de la ciudad pero con la desconexión y el relajo Del Valle del elqui.

Un ambiente de descanso, conexión con la naturaleza, ideal para familias.
Disfruta  de las instalaciones de casavalle, piscina natural, Hot tub, parrilla y fogón.


A mano de la ciudad pero con la desconexión y relajo Del Valle del Elqui, tendrás relajo, descanso y diversión en un lugar diseñado y pensando solo para tu familia. 
Cada

Casa aislada, con decoración limpia y moderna, cocina completamente equipada,
Ropa de cama y toallas de baño incluidos.
Wifi, Tv satelital, áreas de descanso 
A orillas del Río Elqui",['Vista al patio'],4.90,39,Diana,12-2020,https://www.airbnb.cl/rooms/47421114?adults=1&children=0&infants=0&pets=0&check_in=2023-02-26&check_out=2023-03-04&previous_page_section_name=1000&federated_search_id=4fea03a3-f828-4547-ad2d-a62d087bdc64
44,"La casa de Brenda, cabañas Horcón",Cabaña entero,Paihuano,3,2,2, Habitación,1,privado,75.0,-30.2042,-70.48454,"https://maps.google.com/maps?ll=-30.2042,-70.48454&z=14&t=m&hl=es&gl=CL&mapclient=apiv3",,"Desconecta de tus preocupaciones en este espacio tan amplio y sereno.

Acceso de los huéspedes
Estacionamiento",['Cocina'],,,Tania,12-2022,https://www.airbnb.cl/rooms/782010192652837249?adults=1&children=0&infants=0&pets=0&check_in=2023-02-19&check_out=2023-02-24&previous_page_section_name=1000&federated_search_id=4fea03a3-f828-4547-ad2d-a62d087bdc64
45,"Casa de descanso, Diaguitas",Casa de campo entero,Diaguitas,6,5,3, Habitación,2,privado,114.312,-30.02565,-70.64385,"https://maps.google.com/maps?ll=-30.02565,-70.64385&z=14&t=m&hl=es&gl=CL&mapclient=apiv3",A minutos del río y del centro del pueblo,"Disfruta de este encantador lugar ideal para el descanso en familia
A los pies del cerro y a minutos del centro del pueblo.
 Oportunidad única para disfrutar de la tranquilidad del Valle del Elqui.

El espacio
Un lugar tranquilo con muchas áreas verdes y todas las comodidades del hogar.",['Vista a las montañas'],4.81,37,Nicolas,10-2020,https://www.airbnb.cl/rooms/48153416?adults=1&children=0&infants=0&pets=0&check_in=2023-03-06&check_out=2023-03-11&previous_page_section_name=1000&federated_search_id=eff88c85-34e5-45a8-bb07-2be2d59959a5
46,cabañas runas del valle de elqui,Habitación privada en cabaña,San Carlos,12,8,4, Habitación,2,privado,96.0,-30.03451,-70.80808,"https://maps.google.com/maps?ll=-30.03451,-70.80808&z=14&t=m&hl=es&gl=CL&mapclient=apiv3",Lugar tranquilo con acceso con porton automatico,"Nuestro espacio cuenta con dos cabañas tematicas  con capacidad para seis personas cada una, puedes reservar del 24 de dic.2022 hasta 5 de marzo 2023 por un valor de 180.000 diarios las dos cabañas con uso exclusivo para el grupo(piscina ,kincho ,estacionamiento y las dos cabañas)

El espacio
Dos cabañas tematicas con dos habitaciones cada una , un baño, cocina equipada y  living -comedor, ademas cuenta con kincho ,piscina y estacionamiento....lugar tranquilo con un cielo maravilloso",['Vista al viñedo'],5.0,5,Daniella Andrea,11-2022,https://www.airbnb.cl/rooms/761802962975522479?adults=1&children=0&infants=0&pets=0&check_in=2023-03-06&check_out=2023-03-11&previous_page_section_name=1000&federated_search_id=eff88c85-34e5-45a8-bb07-2be2d59959a5
47,"La casa de Brenda, cabañas Horcón",Cabaña entero,Paihuano,3,2,2, Habitación,1,privado,75.0,-30.2042,-70.48454,"https://maps.google.com/maps?ll=-30.2042,-70.48454&z=14&t=m&hl=es&gl=CL&mapclient=apiv3",,"Desconecta de tus preocupaciones en este espacio tan amplio y sereno.

Acceso de los huéspedes
Estacionamiento",['Cocina'],,,Tania,12-2022,https://www.airbnb.cl/rooms/782010192652837249?adults=1&children=0&infants=0&pets=0&check_in=2023-02-19&check_out=2023-02-24&previous_page_section_name=1000&federated_search_id=eff88c85-34e5-45a8-bb07-2be2d59959a5
48,Cabaña full equipada con piscina en Coquimbo.,Cabaña entero,Coquimbo,3,2,2, Habitación,1,privado,49.0,-30.00023,-71.38369,"https://maps.google.com/maps?ll=-30.00023,-71.38369&z=14&t=m&hl=es&gl=CL&mapclient=apiv3","Se sentirán totalmente cómodos como en casa, la entrada es común con otra cabaña de la propiedad, pepro la cabaña es totalmente independientemente.

Existen dos almacenes a una cuadra que proveen de lo necesario en caso de olvidar algo: desde botellones de agua hasta pan amasado y huevos locales.

Estaremos muy felices de recibir a todos quienes quieran disfrutar de este maravilloso lugar y pasar unos días inolvidables en la cuarta región de Chile, con todas las bondades que ésta ofrece.

Siempre estamos dispuestos a proveer de consejos y recomendaciones.

Es esencial poseer un auto para poder moverse con tranquilidad por El Panul y para poder visitar las otras atracciones cercanas al lugar.

La Ensenada El Panul está ubicada a continuación del sector de La Herradura en Coquimbo, apenas estemos comunicados les enviaremos la ubicación por GPS.","Hermosa, limpia y cómoda cabaña para 3 personas, ubicada en la Reserva Ecológica Ensenada El Panul, a solo 10 minutos (en auto) del centro de Coquimbo, situada a continuación de La Herradura.

La cabaña cuenta con todos los servicios básicos como agua caliente, electricidad, cocina a gas, TV cable y piscina. 

Hay dos dormitorios, con 1 cama matrimonial y una de 1 plaza y media, es decir, capacidad para hasta 3 personas en total. 

*SE DEBE TRAER SÁBANAS


La cabaña completa, con sus dos dormitorios, baño, living, comedor y cocina.  
Además de una excelente terraza y espacio para estacionar hasta 2 vehículos. 
La piscina es bastante cómoda y se comparte con la segunda cabaña que está en la parcela.
*SE DEBE TRAER SÁBANAS",['Vista al patio'],4.92,13,María-José,08-2015,https://www.airbnb.cl/rooms/41266545?adults=1&children=0&infants=0&pets=0&check_in=2023-03-07&check_out=2023-03-12&previous_page_section_name=1000&federated_search_id=eff88c85-34e5-45a8-bb07-2be2d59959a5
49,Casa primera línea frente al mar,Alojamiento entero,Los Vilos,7,5,3, Habitación,3,privado,185.0,-32.0119,-71.5118,"https://maps.google.com/maps?ll=-32.0119,-71.5118&z=14&t=m&hl=es&gl=CL&mapclient=apiv3",Condominio ubicado entre Pichidangui y Los Vilos. Cuenta con una exclusiva playa a tan solo 1.5km desde la casa.,"Casa ubicada en Condominio Ensenada. Primera línea frente al mar, con acceso directo al mar, desde roquerío frente a la casa. Las vistas desde la casa hacia el mar son inmejorables. La casa cuenta con 3 habitaciones y 3 baños, un amplio living comedor recién remodelado y una cocina con todo su equipamiento. Tiene una gran piscina protegida del viento con preciosa vista al mar y un hot tub instalado en medio de una terraza muy especial ""El Barco"", ambos de uso exclusivo de la casa.",['Vista al océano'],5.0,4,Roberto,12-2016,https://www.airbnb.cl/rooms/758523720123421580?adults=1&children=0&infants=0&pets=0&check_in=2023-03-06&check_out=2023-03-12&previous_page_section_name=1000&federated_search_id=eff88c85-34e5-45a8-bb07-2be2d59959a5
50,Parcela de ensueño en el Valle del Elqui,Alojamiento entero,Paihuano,6,3,2, Habitación,2,privado,132.0,-30.07391,-70.49276,"https://maps.google.com/maps?ll=-30.07391,-70.49276&z=14&t=m&hl=es&gl=CL&mapclient=apiv3","Ambiente rural, con acceso en camino de tierra de menos de 500m, rodeado de parcelas y de viñas.","Desconecta de tus preocupaciones en este espacio tan amplio y sereno. Disfruta una vista privilegiada de los astros en esta cómoda casa con una piscina grande para refrescarse y una pequeña para los niños. Con una arquitectura moderna, ubicado a minutos de Paihuano y de Pisco Elqui, ven a disfrutar de la magia de este lugar, la artesanía, el pisco, el vino y la naturaleza.


Cuenta con una habitación con una cama matrimonial y baño privado y otra habitación con dos camas matrimoniales",['Vista al patio'],,,Carla,12-2022,https://www.airbnb.cl/rooms/784690699421424634?adults=1&children=0&infants=0&pets=0&check_in=2023-02-23&check_out=2023-02-28&previous_page_section_name=1000&federated_search_id=eff88c85-34e5-45a8-bb07-2be2d59959a5
51,Casa Vista Hermosa en Rosario de Peñuelas,Alojamiento entero,Coquimbo,8,6,4, Habitación,"3,5",privado,97.0,-29.96265,-71.30631,"https://maps.google.com/maps?ll=-29.96265,-71.30631&z=14&t=m&hl=es&gl=CL&mapclient=apiv3",Barrio exclusivo y tranquilo,"Linda casa en barrio exclusivo, piscina, quincho, 4 habitaciones 4 baños,  hermosa vista",['Vista a la bahía'],4.65,37,Luis,11-2020,https://www.airbnb.cl/rooms/47411331?adults=1&children=0&infants=0&pets=0&check_in=2023-03-04&check_out=2023-03-09&previous_page_section_name=1000&federated_search_id=eff88c85-34e5-45a8-bb07-2be2d59959a5
52,Refugio totoralillo,Cabaña entero,Coquimbo,4,3,2, Habitación,1,privado,45.0,-30.04439,-71.37747,"https://maps.google.com/maps?ll=-30.04439,-71.37747&z=14&t=m&hl=es&gl=CL&mapclient=apiv3","Lugar rural tranquilo , funciona con fosa .","El espacio
Es una cabaña

Acceso de los huéspedes
Fácil acceso kilometro 450.5 , a 10 minutos de supermercados y el centro de coquimbo a 5 minutos en auto a la playa totoralillo caminando 30 minutos, locomoción a una cuadra de la cabaña, la cual esta emplazada en un terreno de 1000 mts cuadrados totalmente cerrado, al costado una casa independiente y otra cábaña .",['Vista al océano'],4.82,24,Elizabeth,01-2018,https://www.airbnb.cl/rooms/31073555?adults=1&children=0&infants=0&pets=0&check_in=2023-03-01&check_out=2023-03-07&previous_page_section_name=1000&federated_search_id=eff88c85-34e5-45a8-bb07-2be2d59959a5
53,"Casa de Playa, Ensenada (Totoralillo), amplia vista al mar, playa privada condominio",Cabaña entero,Los Vilos,6,4,3, Habitación,2,privado,175.0,-32.00269,-71.51799,"https://maps.google.com/maps?ll=-32.00269,-71.51799&z=14&t=m&hl=es&gl=CL&mapclient=apiv3","Condominio cerrado, muy tranquilo, con playa privada.","Amplia casa de playa, ubicada en Ensenada, en la bahía de Totoralillo.
Emplazada en altura, posee vista panorámica al mar desde todas sus habitaciones, living, comedor y terraza. Además, cuenta con piscina propia.
Es parte de un condominio con acceso remoto, un entorno muy tranquilo y una linda playa privada.
A 213km de Santiago, por la ruta 5, cerca de Pichidangui, Valle Quilimarí, Los Vilos, Chigualoco y Huentelauquén. Gastronomía criolla del mar, paseos, deportes náuticos... Imperdible!


Habitaciones con techos de 3 metros de altura, otorgan una cómoda sensación de amplitud. Revestidas en madera, con un suave albayalde en tono claro.
Todas sus ventanas son termopanel y permiten un ambiente seco dentro de la casa.",['Vista a la bahía'],4.75,12,Nicolás,12-2015,https://www.airbnb.cl/rooms/51729708?adults=1&children=0&infants=0&pets=0&check_in=2023-02-26&check_out=2023-03-03&previous_page_section_name=1000&federated_search_id=eff88c85-34e5-45a8-bb07-2be2d59959a5
54,Luminosa cabaña con piscina,Cabaña entero,Horcón,4,3,2, Habitación,"1,5",privado,120.0,-30.20201,-70.48645,"https://maps.google.com/maps?ll=-30.20201,-70.48645&z=14&t=m&hl=es&gl=CL&mapclient=apiv3","En este corazón llamado ""Horcon Bajo"" puedes combinar Privacidad sin estar Aislado, ya que puedes permanecer en tu cabaña y piscina o dar cortos paseos por el agradable camino a orilla de río, darte un masaje, meditar, tomar una clase de yoga, visitar artesanos locales en el pueblito de artesanos de Horcon entre otras actividades, todo esto en nuestro pequeño vecindario.","Desconecta de tus preocupaciones y descansa en esta acogedora cabaña con capacidad para 4 personas. Mucha luz, hermosa vista en balcón- corredor o terraza, con privacidad y al mismo tiempo la conectividad que necesites.

El espacio
Nuestra ubicación en pleno corazón de Horcon Bajo, Valle del Elqui, te permite salir a pasear caminando o en bicicleta. A pocos pasos puedes encontrar un almacén de provisiones básicas con un rico pan amasado,  almorzar en un excelente restaurante a orilla del río,  acceder a otras orillas de río y tomar un delicioso café de grano disfrutando de artesanos locales en el pueblo de artesanos de Horcon.",['Vista al jardín'],5.0,9,Pabla,05-2019,https://www.airbnb.cl/rooms/596231619224103081?adults=1&children=0&infants=0&pets=0&check_in=2023-02-25&check_out=2023-03-03&previous_page_section_name=1000&federated_search_id=eff88c85-34e5-45a8-bb07-2be2d59959a5
55,Casa Los molles vista al mar,Alojamiento entero,Los Molles,9,7,4, Habitación,3,privado,162.0,-32.2047,-71.5149,"https://maps.google.com/maps?ll=-32.2047,-71.5149&z=14&t=m&hl=es&gl=CL&mapclient=apiv3","Parcela en condominio cerrado, rodeado de areas verdes, espacios comunes recreativos, apto para caminatas y vista despejada.","Casa con vista privilegiada en seguro y tranquilo condominio Rocas del Mar/ Los Molles. Amplio terreno de entorno natural, cómodos espacios que permiten descansar, relajarse, desconectarse y disfrutar al aire libre.  
A 5 min de Playa Los Molles con acceso directo al pueblo y comercios. Juegos para niños en espacios comunes, juegos para niños, canchas de Padel y futbolito, conserjería 24 hrs. ( Huesped adicional valor $15.000 clp )


Casa cuenta con ventanas termopanel,  baños con ventana, habitaciones con buena ventilacion, luz natural,  sin alfombras, cómodos colchones en buen estado, frazadas , cobertores y almohadas disponibles.",['Vista al océano'],4.50,4,María José,05-2017,https://www.airbnb.cl/rooms/766459731353894354?adults=1&children=0&infants=0&pets=0&check_in=2023-03-12&check_out=2023-03-17&previous_page_section_name=1000&federated_search_id=eff88c85-34e5-45a8-bb07-2be2d59959a5
56,"Casa frente al mar Ensenada km 213, Pichidangui",Alojamiento entero,Pichidangui,9,7,4, Habitación,4,privado,245.0,-32.08817,-71.52767,"https://maps.google.com/maps?ll=-32.08817,-71.52767&z=14&t=m&hl=es&gl=CL&mapclient=apiv3",,"Mi alojamiento es bueno para parejas, familias (con hijos) y grupos grandes.

Otros aspectos a destacar
El consumo de agua se cobra por separado, dada la escasez de la zona","['Acceso a la playa', 'Frente a la playa']",4.86,35,Trinidad,04-2016,https://www.airbnb.cl/rooms/12454880?adults=1&children=0&infants=0&pets=0&check_in=2023-03-02&check_out=2023-03-09&previous_page_section_name=1000&federated_search_id=eff88c85-34e5-45a8-bb07-2be2d59959a5
57,Amplia cabaña c/ piscina exclusiva en V. de Elqui,Cabaña entero,Peralillo,6,3,2, Habitación,1,privado,90.0,-30.03842,-70.66351,"https://maps.google.com/maps?ll=-30.03842,-70.66351&z=14&t=m&hl=es&gl=CL&mapclient=apiv3","VacacionElquina se encuentra en un pequeño pueblo elquino, lo cual la hace ideal para quienes desean tranquilidad.","¡VacacionElquina es todo un complejo turístico sólo para usted! Ubicada en Peralillo, 8 km al interior de Vicuña, la casa tiene 42 metros cuadrados, 2 dormitorios, cocina plenamente equipada, buen baño. Piscina exclusiva, cancha propia de tenis tamaño reglamentario, pérgola, porche, quincho, estacionamiento techado, portón automático. TV satelital, Wi-Fi. Amplia privacidad, es la única cabaña en el predio y mi casa queda a 30 metros, lo cual la hace ideal para quienes desean tranquilidad.",['Cocina'],4.91,47,Patricio,10-2016,https://www.airbnb.cl/rooms/16436644?adults=1&children=0&infants=0&pets=0&check_in=2023-02-21&check_out=2023-02-26&previous_page_section_name=1000&federated_search_id=eff88c85-34e5-45a8-bb07-2be2d59959a5
58,"Casa Higuera en Montegrande, valle elqui",Alojamiento entero,Paihuano,5,3,3, Habitación,2,privado,110.0,-30.08151,-70.49548,"https://maps.google.com/maps?ll=-30.08151,-70.49548&z=14&t=m&hl=es&gl=CL&mapclient=apiv3",,"Casa familiar adorable muy bien decorada, bellamente iluminada, bosca con leña para invierno, acceso independiente, estacionamiento techado, la casa esta dentro de una campo, privado y silencio,  piscina y quincho para asados.

El espacio
Extraordinaria vista del valle elqui, excelente lugar para observar la naturaleza y las estrellas, agradable clima todo el año. buenas expediciones en la zona.",['Cocina'],4.91,22,Sergio,04-2018,https://www.airbnb.cl/rooms/24542207?adults=1&children=0&infants=0&pets=0&check_in=2023-03-04&check_out=2023-03-09&previous_page_section_name=1000&federated_search_id=eff88c85-34e5-45a8-bb07-2be2d59959a5
59,"Cabaña con Vista Panorámica ""Rigel""",Cabaña entero,Pisco Elqui,4,3,2, Habitación,1,privado,90.0,-30.14173,-70.49946,"https://maps.google.com/maps?ll=-30.14173,-70.49946&z=14&t=m&hl=es&gl=CL&mapclient=apiv3",,"La cabaña ""Rigel"" cuenta con una acogedora decoración, en un ambiente relajado y cómodo que sumado al entorno, piscina, parras y la maravillosa vista dan el sello de armonía que busca, tan clásico del Valle. Estamos ubicados a solo 1.5 kms. de Pisco Elqui, típico pueblito y capital turística, que cuenta con una amplia oferta gastronómica y de entretenimiento. La cabaña esta equipada para 4 personas (ampliable a 5) y está atendida por sus propios dueños.",['Vista al valle'],5.0,8,Jazmina,02-2021,https://www.airbnb.cl/rooms/546130154952065986?adults=1&children=0&infants=0&pets=0&check_in=2023-02-26&check_out=2023-03-04&previous_page_section_name=1000&federated_search_id=eff88c85-34e5-45a8-bb07-2be2d59959a5
60,Cabaña Peralillo Valle del Elqui,Cabaña entero,Vicuña,4,4,2, Habitación,1,privado,60.0,-30.03916,-70.65893,"https://maps.google.com/maps?ll=-30.03916,-70.65893&z=14&t=m&hl=es&gl=CL&mapclient=apiv3",El sector es rural y tranquilo,"Cabaña de descanso dentro de nuestra parcela con piscina , árboles frutales,  parrilla, ovejas , gallinas para desconectarse del ruido de la ciudad

El espacio
Espacio amplio con fogón un quincho y lugar donde poder descansar
Tenemos una cama de cuarzo que se paga un pequeño adicional por su
 uso
Cielos limpios",['Vista a las montañas'],5.0,12,Gilda Patricia,05-2018,https://www.airbnb.cl/rooms/31596558?adults=1&children=0&infants=0&pets=0&check_in=2023-02-28&check_out=2023-03-05&previous_page_section_name=1000&federated_search_id=460e9ade-f11c-4cb6-b03a-f30b94c45c47
61,Casa hogareña En un exclusivo condominio,Alojamiento entero,Tongoy,6,3,3, Habitación,1,privado,85.0,-30.25769,-71.47603,"https://maps.google.com/maps?ll=-30.25769,-71.47603&z=14&t=m&hl=es&gl=CL&mapclient=apiv3",,"Relájate con toda la familia en este tranquilo lugar para quedarse. Casa tipo cabaña con una amplia terraza. El condominio cuenta con 2 piscinas, quincho, canchas de tenis y futbolito y muchas áreas verdes. Está ubicada a 5 minutos de tongoy.",['Vista al parque'],4.73,11,Claudio,11-2021,https://www.airbnb.cl/rooms/54015908?adults=1&children=0&infants=0&pets=0&check_in=2023-03-04&check_out=2023-03-09&previous_page_section_name=1000&federated_search_id=460e9ade-f11c-4cb6-b03a-f30b94c45c47
62,Casa Familia Vista 360° Piscina Condom. Ensenada,Cabaña entero,Los Vilos,8,4,4, Habitación,3,privado,150.0,-32.00303,-71.51988,"https://maps.google.com/maps?ll=-32.00303,-71.51988&z=14&t=m&hl=es&gl=CL&mapclient=apiv3",Loteo Ensenada a 14 Km. de Pichidangui Región de Coquimbo,"Relájate con toda la familia en este tranquilo lugar para quedarse. 
Condom. Ensenada
Casa  140 M2.  hermosas vistas panorámicas en 360°.
Se desarrolla en 4 niveles; Nivel Dormit. principal, Nivel casa, Nivel deck piscina, Nivel de Acceso vehicular.  Rodeada de  amplias terrazas con barandas vidriadas.
Habilitada para 8 personas , Cocina integrada, espacios  de gran altura. Piscina incorporada a medio nivel de terraza principal. Acceso a playita interior del condominio a 650 mts. desde la casa .


Casa construida sobre roca, rodeada de terrazas con vista al mar, piscina en deck de madera, medio nivel bajo nivel de la casa.  Estar - Comedor y Cocina integrados en un solo espacio con vista al mar al igual que todos los dormitorios. Ventanas termo panel de PVC. excelente  aislación.",['Acceso a la playa'],,,Victor Hugo,01-2023,https://www.airbnb.cl/rooms/808713835019164326?adults=1&children=0&infants=0&pets=0&check_in=2023-03-01&check_out=2023-03-06&previous_page_section_name=1000&federated_search_id=460e9ade-f11c-4cb6-b03a-f30b94c45c47
63,Casa en Guanaqueros 12 personas,Alojamiento entero,Coquimbo,12,10,4, Habitación,2,privado,120.0,-30.22056,-71.41318,"https://maps.google.com/maps?ll=-30.22056,-71.41318&z=14&t=m&hl=es&gl=CL&mapclient=apiv3",,"Relájate con toda la familia en este tranquilo lugar para quedarse, 4 habitaciones disponibles 2 Baños piscina, parrilla",['Cocina'],,,Danae,01-2023,https://www.airbnb.cl/rooms/810386818347376409?adults=1&children=0&infants=0&pets=0&check_in=2023-02-25&check_out=2023-03-04&previous_page_section_name=1000&federated_search_id=460e9ade-f11c-4cb6-b03a-f30b94c45c47
64,Cabaña 5 Personas en Coquimbo,Cabaña entero,Coquimbo,5,4,2, Habitación,1,privado,64.0,-30.01327,-71.33433,"https://maps.google.com/maps?ll=-30.01327,-71.33433&z=14&t=m&hl=es&gl=CL&mapclient=apiv3",,"Relájate con toda la familia en este alojamiento donde la tranquilidad se respira.
Lugar de amplio estacionamiento. A 15 minutos de playa La Herradura y Ruta 5. Cercano a lugares de comidas, supermercados, policlínico y camping. La casa cuenta con cable TV premium.",['Acceso la playa Público o compartido'],,,Alexis,02-2023,https://www.airbnb.cl/rooms/818399556930543717?adults=1&children=0&infants=0&pets=0&check_in=2023-02-22&check_out=2023-02-27&previous_page_section_name=1000&federated_search_id=460e9ade-f11c-4cb6-b03a-f30b94c45c47
65,"Cabaña frente al Mar, Cond. Ensenada ( Los vilos)",Cabaña entero,Los Vilos,6,4,3, Habitación,2,privado,185.0,-32.00821,-71.51709,"https://maps.google.com/maps?ll=-32.00821,-71.51709&z=14&t=m&hl=es&gl=CL&mapclient=apiv3","Es un lugar muy tranquilo, se puede caminar en todo el condominio sin problemas, viendo plantas autóctonas del sector, además pueden acceder a una playa privada del condominio.","Cabaña frente al Mar, con una vista maravillosa. Ideal para descansar y relajarse, cuenta con todo tipo de comodidades. Cerca de Pichidangui y Los Vilos, aproximadamente 13 km de ambas.
Amoblado al 100%.Calefacción a leña, Todos los dormitorios con TV ( cable), camas con plumones, Piscina,Juegos infantiles,Terraza con Quincho frente al mar, Playa privada a 100 metros.


Lugar para relajarse frente al mar. En una casa con todas las comodidades que imagines. Muy acogedor",['Vista al océano'],4.96,56,Daniela,06-2017,https://www.airbnb.cl/rooms/19196171?adults=1&children=0&infants=0&pets=0&check_in=2023-03-08&check_out=2023-03-13&previous_page_section_name=1000&federated_search_id=460e9ade-f11c-4cb6-b03a-f30b94c45c47
66,Cabaña BordeRio8 - Valle del Elqui (Paihuano),Cabaña entero,La Serena,8,6,3, Habitación,"2,5",privado,153.9,-30.02938,-70.52421,"https://maps.google.com/maps?ll=-30.02938,-70.52421&z=14&t=m&hl=es&gl=CL&mapclient=apiv3","Paihuano cuenta con almacenes que encuetras lo basico, nada muy sofisticado.","Paihuano es una localidad ubicada a 30kms de vicuña en el Valle del Elqui, cercano con Montegrande y Pisco Elqui, para ir de paseo. Cabaña de madera cercana al rio para descansar en la naturaleza, cuenta con 3 habitaciones, 2 baños, cocina amplia, living con tv y comedor en terraza. Piscina compartida con otras cabañas. Hermosa vista y acceso posas de río. Estacionamiento. Se debe llegar en auto adecuado para camino de tierra. Lugar tranquilo con cielos muy limpios.


Piscina y estacionamiento se comparten con otra cabaña.",['Cocina'],4.50,4,Fiorella,04-2016,https://www.airbnb.cl/rooms/16604154?adults=1&children=0&infants=0&pets=0&check_in=2023-02-22&check_out=2023-02-27&previous_page_section_name=1000&federated_search_id=460e9ade-f11c-4cb6-b03a-f30b94c45c47
67,"Acogedora casa en el Valle del Elqui, con piscina",Casa de campo entero,Las Rojas,6,5,3, Habitación,1,privado,80.0,-29.96835,-71.08108,"https://maps.google.com/maps?ll=-29.96835,-71.08108&z=14&t=m&hl=es&gl=CL&mapclient=apiv3",,"Casa para 6 personas, amplia y fresca. Km 18 ruta 41, a 20 minutos de La Serena y 40 minutos de Vicuña. 
Piscina privada con protecciones y quincho. 
El cielo más lindo del valle. Estacionamiento amplio para 2 a 3 vehículos.

Otros aspectos a destacar
La casa está ubicada a 30km de vicuña y 18 de la serena. Cerca encontrará minimarket, restaurant.",['Vista a las montañas'],4.50,6,Filomena,07-2016,https://www.airbnb.cl/rooms/53988952?adults=1&children=0&infants=0&pets=0&check_in=2023-03-01&check_out=2023-03-06&previous_page_section_name=1000&federated_search_id=460e9ade-f11c-4cb6-b03a-f30b94c45c47
