,Titulo1,Titulo2,Comuna,Capacidad,Camas,N_Habitaciones,Habitaciones,Ba침os,Tipo_Ba침os,Precio,lat,lon,Ubicacion,Ubides,Descripcion,Servicios,Nota,Nnota,Anfitrion,Registro,Link
82,4D/2B Casona Girasol - La Serena,Chal칠 entero,La Serena,8,5,4, Habitaci칩n,2,privado,102.493,-29.93981,-71.15557,"https://maps.google.com/maps?ll=-29.93981,-71.15557&z=14&t=m&hl=es&gl=CL&mapclient=apiv3",,"Acogedora Casona familiar con capacidad para 8 personas para disfrutar de las vistas y las noches estrelladas hacia el valle del Elqui.

Se encuentra estrat칠gicamente ubicada a 5 min. del pueblo de Algarrobito, a 5 min. del aeropuerto de La Serena, a 15 min. del centro de La Serena y a 30 min. de Vicu침a. 

Tiene 4 habitaciones con balc칩n, 2 ba침os completos, cocina equipada, comedor, quincho, patio trasero, estacionamiento,  Internet WiFi, acceso a  cancha deportiva  multiuso y piscina.


Casona de campo de estilo europeo, cuenta con 4 habitaciones con balc칩n compartido con vista hacia el valle del Elqui.

Tiene 2 habitaciones con cama doble, 1 habitaci칩n con 2 camas individuales y 1 habitaci칩n con  cama nido,  2 ba침os completos (toallas incluidas),  Internet Wifi, estacionamiento y acceso a la piscina y la cancha deportiva multiuso para disfrute entre amigos o familiares.",['Vista al patio'],4.71,7,BUHO Property,10-2021,https://www.airbnb.cl/rooms/677886356104209511?adults=1&children=0&infants=0&pets=0&check_in=2023-03-01&check_out=2023-03-06&previous_page_section_name=1000
83,Casa familiar Herradura sur,Alojamiento entero,Coquimbo,5,5,3, Habitaci칩n,"1,5",privado,42.5,-29.9942,-71.3597,"https://maps.google.com/maps?ll=-29.9942,-71.3597&z=14&t=m&hl=es&gl=CL&mapclient=apiv3",es un barrio tranquilo y seguro.,"Casa nueva de material s칩lido en primer piso, con acceso a 치reas verdes con m치quinas de ejercicio y juegos infantiles, cercana a supermercados y bencineras, con conectividad a la carretera y a las mejores playas de la regi칩n ( Totoralillo 6 kil칩metros, Guanaqueros 20 kil칩metros, Tongoy 34 kil칩metros y playa la herradura a 1500 metros.
Casa ubicada en Barrio residencial Brisas de Palermo , un lugar muy tranquilo para descansar y estar cerca del mar.


Es una linda casa en un buen entorno muy cercana al mar",['Acceso a la playa'],4.88,34,Jes칰s Alonso,04-2017,https://www.airbnb.cl/rooms/30691233?adults=1&children=0&infants=0&pets=0&check_in=2023-02-26&check_out=2023-03-04&previous_page_section_name=1000
84,Pichidangui/Los Vilos: Vista al Mar en Ensenada,Caba침a entero,Los Vilos,7,5,3, Habitaci칩n,2,privado,76.5,-32.00481,-71.51739,"https://maps.google.com/maps?ll=-32.00481,-71.51739&z=14&t=m&hl=es&gl=CL&mapclient=apiv3","Condominio privado, muy seguro y cuenta con hermosa playa poco concurrida y con caminos para andar en bicicleta o ha er caminatas.","La naturaleza de la Regi칩n de Coquimbo sorprende con la belleza de Ensenada, un hermoso paraje natural a s칩lo 2 horas de Santiago donde podr치s pasar el mejor tiempo de descanso cerca del mar, en un condominio seguro y tranquilo, en especial si vas con ni침os.  
Ubicada entre Pichidangui y Los Vilos la, casa cuenta con una excepcional vista al mar, desde se llega a la playa caminando en pocos minutos. Tiene 3 dormitorios, 2 ba침os, Wi-Fi prepago y estacionamientos.


1er Dormitorio principal en suite
2do Dormitorio con camarote y una cama de 1 1/5 plaza
3er Dormitorio con cama matrimonial",['Acceso la playa P칰blico o compartido'],,,Karen,03-2017,https://www.airbnb.cl/rooms/661103187627068065?adults=1&children=0&infants=0&pets=0&check_in=2023-02-27&check_out=2023-03-04&previous_page_section_name=1000
85,Casa entera en playa de Totoralillo,Caba침a entero,Coquimbo,6,4,3, Habitaci칩n,"1,5",privado,90.0,-30.06467,-71.36593,"https://maps.google.com/maps?ll=-30.06467,-71.36593&z=14&t=m&hl=es&gl=CL&mapclient=apiv3",Todo incre칤ble,"Vuelve a conectarte con tus seres queridos en este alojamiento ideal para familias y amantes del los deportes al aire libre como es surf, treking, bicicleta, escalada. 

Hermosa caba침a ubicado en el principado de Totoralillo, Coquimbo. Chile

El espacio
Se encuentra en pueblo de totoralillo, a 50 mts cuentas con un Minimarket donde puedes encontrar de todo para el uso diario como compras de pan, bebidas, etc. Adem치s de contar con una caleta de pescadores donde puedes encontrar marisco y pescados frescos, si te apasiona el deporte outdoor, este spot es ideal ya que cuentas con caminos de treking, zona de escaladas, lugares para recorrer en bicicleta como el desaf칤o cerr칩 Vietnam 游游, y por 칰ltimo el Oc칠ano Pac칤fico a Totoralillo lo premi칩 con olas espectaculares para realizar surf o body. Adem치s de buceo y otros deportes acu치ticos.",['Acceso a la playa'],3.71,7,Francisco,12-2017,https://www.airbnb.cl/rooms/563020843178577185?adults=1&children=0&infants=0&pets=0&check_in=2023-02-19&check_out=2023-02-24&previous_page_section_name=1000
86,Alojamiento Casa Pisco Elqui,Casa de campo entero,Pisco Elqui,4,6,4, Habitaci칩n,1,privado,72.0,-30.11976,-70.49289,"https://maps.google.com/maps?ll=-30.11976,-70.49289&z=14&t=m&hl=es&gl=CL&mapclient=apiv3","Calle principal de Pisco Elqui, lugar tranquilo, buen acceso a locomoci칩n y cercano a negocios.","En Alojamiento Casa Pisco Elqui, hasta 8 Personas puedes disfrutar tus vacaciones y descanso  en Pareja, familia y Amigos. Un lugar Tranquilo con m치gicas noches con sus cielos despejados y estrellas. 

En una excelente ubicaci칩n en Pisco Elqui, a 200 metros de la Plaza, Iglesia, Centro Artesanal,  Pisqueras, Arte, restaurantes y Agencias Tur칤sticas.  Donde podr치s dejar estacionado tu Autom칩vil, y caminar por este hermoso lugar.


La Casa sola nada compartido, dispone de 4 habitaciones, 2 matrimoniales y 4 camas individuales,  8 personas habilitada (Pago Adicional) Sala Estar, Comedor diario, Cocina Equipada, 1 Ba침o, Parrillas,  2 Estacionamientos Techado y Portero El칠ctrico  y una Cama de Cuarzo para renovar energ칤as y bienestar.

Los negocios est치n cerca y f치cil acceso, tambi칠n se recomienda llevar sus 
A los Visitantes le encanta la ubicaci칩n y acogedor lugar.",['Vista al patio'],,,Rossana Del Carmen,12-2019,https://www.airbnb.cl/rooms/787159305897561985?adults=1&children=0&infants=0&pets=0&check_in=2023-02-21&check_out=2023-02-27&previous_page_section_name=1000
87,Casa en Los Molles cerca de playa principal,Alojamiento entero,Los Molles,7,5,4, Habitaci칩n,2,privado,75.0,-32.2357,-71.5239,"https://maps.google.com/maps?ll=-32.2357,-71.5239&z=14&t=m&hl=es&gl=CL&mapclient=apiv3","En la playa hay juegos acu치ticos y varias escuelas de buceo para todo tipo de edades.
Cerca de la caleta se encuentran restaurantes con rica gastronom칤a de la zona, t칤picas empanadas, helados, terrazas de caf칠, jugos y pasteles
Turismo aventura para canopy, trekking y rutasen bicicleta","La casa es muy amplia y c칩moda, est치 ubicada a 10 minutos caminando de la playa principal. Cuenta con todo lo necesario para disfrutar de unas tranquilas y entretenidas vacaciones (TV cable, estacionamiento, taca taca, quincho y terraza para asados). Los Molles es un lugar familiar con una de las mejores playas de la V regi칩n. La casa est치 a una cuadra del Bioparque El Puquen, paseo imperdible con hermosos paisajes. Otras actividades que puedes hacer en la playa: surf, buceo, trekking, canopy


Se pueden utilizar todos los espacios se침alados en la descripci칩n de la casa","['Acceso a playa P칰blico o compartido', 'Frente a la playa']",4.75,51,Olaya,11-2018,https://www.airbnb.cl/rooms/30309647?adults=1&children=0&infants=0&pets=0&check_in=2023-03-06&check_out=2023-03-12&previous_page_section_name=1000
88,caba침a los trigales,Caba침a entero,Coquimbo,8,5,3, Habitaci칩n,1,privado,50.8,-30.21935,-71.4179,"https://maps.google.com/maps?ll=-30.21935,-71.4179&z=14&t=m&hl=es&gl=CL&mapclient=apiv3",,"Este alojamiento 칰nico tiene mucho espacio para que disfrutes con los tuyos. Tambi칠n cuentas con una superficie de 2000mts y a su vez est치 en una zona aislada que permite relajarse un mont칩n

N칰mero de permiso
528713829",['Acceso a la playa'],,,Enrique,02-2019,https://www.airbnb.cl/rooms/791388584405299141?adults=1&children=0&infants=0&pets=0&check_in=2023-02-15&check_out=2023-02-20&previous_page_section_name=1000
89,LAGAR ANITA 2 minutos Playa los Choros sol y mar,Habitaci칩n privada en casa de campo,Los Choros,4,4,2, Habitaci칩n,1compartido,compartido,35.1,-29.2603,-71.0279,"https://maps.google.com/maps?ll=-29.2603,-71.0279&z=14&t=m&hl=es&gl=CL&mapclient=apiv3","existe en el barrio de este pueblo de LOS CHOROS cafeteria, 4 minimercados con fruteria verduras frescas abarrotes, bebidas , vinos ,cervezas etc, huertos con produccion de aceitunas y aceite virgen de oliva, pescados y mariscos , 2 museos con interesantes muestras de diferentes culturas, es un pueblo con mas de 400 a침os de existencia, se dedican a ganaderia caprina,pesca artesanal,extraccion de mariscos y cultivos basicos.","LAGAR ANITA ubicado en el pueblo de LOS CHOROS  espacioso, buen  equipamiento y ubicaci쑕, comodo ,buena iluminaci칩n, soleado, dormitorio matrimonial y otro  para hasta 2personas, ba침o con shower door, agua caliente y ducha turca ,comedor y una kitchenette full equipada ,refrigerador con freezer, una amplia terraza y estacionamiento privado. full equipo.

El espacio
amplios espacios ,independiente, tranquilo y amigable.",['Acceso la playa P칰blico o compartido'],,,Diego,02-2019,https://www.airbnb.cl/rooms/37497138?adults=1&children=0&infants=0&pets=0&check_in=2023-02-16&check_out=2023-02-21&previous_page_section_name=1000
90,Gran y amplia casa en Guanaqueros.,Alojamiento entero,Guanaqueros ,8,6,4, Habitaci칩n,2,privado,119.0,-30.19946,-71.42063,"https://maps.google.com/maps?ll=-30.19946,-71.42063&z=14&t=m&hl=es&gl=CL&mapclient=apiv3","Muy buenos vecinos! Desde la casa a la playa o centro , tiene un acceso tranquilo caminando a todos los lugares , a lo m치s demora 10 min.","Excelente ubicaci칩n, amplia casa con estacionamiento, cocina, doble terraza en el primer y segundo piso.Completamente satinizada en periodo de pandemia ,por la seguridad de mis hu칠spedes.

El espacio
Grandes espacios que permiten desplazarse con comodidad y seguridad.",['Cocina'],4.86,7,Alejandra,02-2018,https://www.airbnb.cl/rooms/41259799?adults=1&children=0&infants=0&pets=0&check_in=2023-02-26&check_out=2023-03-03&previous_page_section_name=1000
91,Casa en condominio cerrado a pasos de la playa,Alojamiento entero,Coquimbo,6,4,3, Habitaci칩n,1,privado,100.0,-30.25854,-71.47443,"https://maps.google.com/maps?ll=-30.25854,-71.47443&z=14&t=m&hl=es&gl=CL&mapclient=apiv3","Condominio cerrado, con amplias 치reas verdes. Ubicado en zona residencial.","Casa ideal para tener un merecido descanso y relajo junto a la familia, a pasos de la playa y ubicada en un recinto privado, privilegiando la tranquilidad y exclusividad de un espacio seguro, ideal para vacacionar.

La casa cuenta con tres dormitorios, un ba침o, una amplia cocina con comedor y terraza, estacionamiento para varios veh칤culos. Zona de parrilla en terraza.

El condominio cuenta dos piscinas, cancha de tenis y de f칰tbol, sala de quinchos, amplias 치reas verdes y port칩n a control remoto",['Acceso a la playa'],4.80,5,Matias,01-2021,https://www.airbnb.cl/rooms/53030090?adults=1&children=0&infants=0&pets=0&check_in=2023-02-25&check_out=2023-03-02&previous_page_section_name=1000
92,Casa full equipada 6 personas,Alojamiento entero,Coquimbo,6,4,3, Habitaci칩n,2,privado,85.6,-29.9718,-71.2904,"https://maps.google.com/maps?ll=-29.9718,-71.2904&z=14&t=m&hl=es&gl=CL&mapclient=apiv3","Barrio residencial, tranquilo, familiar, plaza de juegos al frente de la casa y otras cerca.","Rel치jate con toda la familia en este tranquilo lugar para quedarse, cerca de todo; mall, centros comerciales, playa, carretera, mcdonald, bencineras y mucho mas .",['Cocina'],,,Luz Andrea,01-2023,https://www.airbnb.cl/rooms/807151448015873633?adults=1&children=0&infants=0&pets=0&check_in=2023-02-26&check_out=2023-03-03&previous_page_section_name=1000
93,Casa familiar Equipada Valle de Elqui (Cochiguaz),Casa de campo entero,Paihuano,8,5,4, Habitaci칩n,2,privado,160.0,-30.13864,-70.41325,"https://maps.google.com/maps?ll=-30.13864,-70.41325&z=14&t=m&hl=es&gl=CL&mapclient=apiv3","El entorno es natural, a 15 minutos est치 Montegrande (lugar del sepulcro de Gabriela Mistral) y 20 minutos Pisco Elqui, lugar donde se pueden visitar los vi침edos y destiler칤a de pisco, a tres minutos se encuentra el observatorio Cancana, lugar donde se realizan tours astron칩micos. En el lugar no existe contaminaci칩n de ning칰n tipo. El vecino m치s cercano se encuentra a m치s de 800 metros. La paz y tranquilidad del lugar es impagable, acompa침ado del misticismo y de los cielos m치s claros del mundo, la mayor parte del a침o","Hermosa y acogedora casa para 8 personas, ubicada en el kil칩metro 8,5 de Cochiguaz, a 15 minutos de Pisco Elqui. Lugar m칤stico y hermoso, ideal para practicar deporte aventura como trekking, cabalgatas, excursiones, paseos, observar las estrellas (cielos estrellados m치s limpios del mundo), o simplemente descansar de una forma diferente en contacto con la naturaleza a los pie del monte Cancana (Piedra de Poder),  en lengua nativa, monte venerado por las antiguas culturas Molles y Diaguitas.


Se pueden alojar hasta 8 personas c칩modamente, la casa consta de 3 cuartos equipados con camas de 2 plazas y 1 individual con cama de una plaza. Todos con ventanales grandes para mirar las estrellas desde la cama. El entorno es m치gico, tranquilo, silencioso y de mucha paz,  enclavado en medio de las monta침as de Cochiguaz, en contacto con la naturaleza, donde s칩lo se escucha el sonido del rio, las aves y el viento. A 15 Minutos en veh칤culo est치 Pisco Elqui. Cercano a importantes Pisqueras como los Nichos y Mistral, a 10 minutos est치 Montegrande donde se puede visitar el  Museo de Gabriela Mistral, la escuela y su tumba. A 3 minutos de la casa por el camino de Cochiguaz, est치 el Observatorio Cancana, donde podr치 disfrutar de observaciones astron칩micas.",['Cocina'],4.18,43,Erwan,05-2015,https://www.airbnb.cl/rooms/6462466?adults=1&children=0&infants=0&pets=0&check_in=2023-02-26&check_out=2023-03-04&previous_page_section_name=1000
94,Casa de dise침o a pasos de la playa WIFI,Alojamiento entero,Los Molles,8,7,3, Habitaci칩n,2,privado,121.0,-32.24044,-71.51468,"https://maps.google.com/maps?ll=-32.24044,-71.51468&z=14&t=m&hl=es&gl=CL&mapclient=apiv3",,"Vista panor치mica a la playa y el mar, 3 dormitorios, 2 ba침os, para 8 personas. Gran arquitectura, destacada en publicaciones del ramo. 3 balcones con vista al mar y playa, incluyendo uno donde se pueden hacer asados o cenar. Columpio infantil , hamaca, parrilla. A pasos de la playa y de la Reserva el Puqu칠n. Wifi banda ancha fibra 칩ptica (zoom, teams).  Dos habitaciones con escritorio para teletrabajo. Tv satelital, Android TV y Blu Ray colecci칩n de pel칤culas. Equipo de audio para pel칤culas.


Hermosa casa vista al mar y la playa, 3 dormitorios, 2 ba침os, capacidad para 8 personas. Dos pisos, en el primero living comedor, terraza, cocina, dos dormitorios y ba침o. En el segundo, dormitorio con cama doble, terraza, ba침o en suite y espectacular vista al mar. Tambi칠n en el segundo piso, una terraza principal con vista al mar y a la playa, donde se pueden hacer asados, almorzar o cenar. Casa de gran arquitectura, destacada en libros del ramo y publicaciones de dise침o Siete camas, una de dos plazas y seis de una plaza. Adicionalmente hay una cama nido que se puede usar para un ni침o 
 Columpio infantil en el patio 
 Hamaca en balc칩n 
 Parrilla 
 Estacionamientos 
 A pasos de la playa y de la Reserva Natural Puqu칠n 
 TV satelital, Android TV y Blu-Ray con colecci칩n de pel칤culas. Equipo de audio para pel칤culas. Con el Android TV se pueden ver servicios de streaming como Netflix o Amazon Prime (el pasajero debe proveer la cuenta de alguna de estas plataformas) 

Wifi banda ancha fibra 칩ptica, ideal para teletrabajar con zoom, meets o teams. Escritorio de trabajo

Hay descuentos por estad칤as largas 

No fumar dentro de la casa.

Hay dos habitaciones con escritorio y silla para trabajo o estudio remoto. 

Internet wifi fibra 칩ptica.

La mesa fija del comedor es peque침a, apta para cuatro o cinco personas m치ximo. Adicionalmente hay una mesa armable, con bancas armables, para seis u ocho personas, que se puede disponer en el balc칩n del primer piso, al interior del living-comedor o en la terraza principal. 

Por protocolos COVID-19, no se proveen tollas ni s치banas, los pasajeros deben traer las propias. 

Se admiten mascotas pero bajo completa responsabilidad de sus due침os. Se debe dar aviso y dejar un dep칩sito de 50 mil pesos por posibles da침os.

La casa est치 justo en la zona segura para tsunamis. Si hay alarma, hay que quedarse en la casa.

S칤guenos en nuestra cuenta de IG @casanave_losmolles",['Acceso la playa P칰blico o compartido'],4.91,35,Carmen Gloria,02-2021,https://www.airbnb.cl/rooms/48315175?adults=1&children=0&infants=0&pets=0&check_in=2023-03-14&check_out=2023-03-19&previous_page_section_name=1000
95,Casa para 7 personas,Alojamiento entero,Elqui,7,5,3, Habitaci칩n,2,privado,67.0,-29.9839,-71.3365,"https://maps.google.com/maps?ll=-29.9839,-71.3365&z=14&t=m&hl=es&gl=CL&mapclient=apiv3",,"Casa independiente en Regi칩n de Coquimbo, sector Sindempart, a minutos de Playa La Herradura, sector tranquilo y familiar.

*Capacidad para 7 personas
*3 habitaciones  
*2 ba침os (1 suite )
*Se aceptan mascotas con padres responsable 鮫


Lugar tranquilo, acogedor y familiar.
Cerca de :
*Supermercado
*Farmacia
*Almac칠n 
*Pasteler칤a 
*Botilleria
*Locales de comida
*Locomoci칩n",['Cocina'],,,Constanza,12-2017,https://www.airbnb.cl/rooms/803210220755181579?adults=1&children=0&infants=0&pets=0&check_in=2023-02-18&check_out=2023-02-23&previous_page_section_name=1000
96,"Casa hermosa, c칩moda y segura.",Alojamiento entero,La Serena,9,8,4, Habitaci칩n,3,privado,108.0,-29.914,-71.2378,"https://maps.google.com/maps?ll=-29.914,-71.2378&z=14&t=m&hl=es&gl=CL&mapclient=apiv3",,"ARRIENDO COMODA Y HERMOSA CASA TEMPORADA VERANO
Amoblada para 7 a 9 personas
4 habitaciones 
3 ba침os
Cocina aquipada 
Lavander칤a 
Piscina 
2 Estacionamientos
Sector colina del pino, la serena .",['Cocina'],5.0,3,Nicolas,12-2018,https://www.airbnb.cl/rooms/805840934492910039?adults=1&children=0&infants=0&pets=0&check_in=2023-02-24&check_out=2023-03-01&previous_page_section_name=1000
97,Casa con piscina y quincho,Alojamiento entero,Villa El Array치n,8,3,4, Habitaci칩n,3,privado,200.0,-30.0057,-71.014,"https://maps.google.com/maps?ll=-30.0057,-71.014&z=14&t=m&hl=es&gl=CL&mapclient=apiv3",,"Casa ubicada a 27 kil칩metros de La Serena y 29 kilometro de Vicu침a, restaurantes, cafeter칤as cerca ,cuenta con piscina con cerco, quincho,3 habitaciones y 3 ba침os. Amplia cocina full equipada,cama saltarina para ni침os,mesa de pingpong,columpio,internet, Netflix y Disney plus. un ambiente relajante ideal para vacaciones en familia.",['Cocina'],,,Nisel,11-2021,https://www.airbnb.cl/rooms/799167496448451018?adults=1&children=0&infants=0&pets=0&check_in=2023-12-01&check_out=2023-12-08&previous_page_section_name=1000
98,Casa La Herradura Oriente Sur,Alojamiento entero,Coquimbo,5,5,3, Habitaci칩n,"1,5",privado,41.0,-29.9935,-71.3599,"https://maps.google.com/maps?ll=-29.9935,-71.3599&z=14&t=m&hl=es&gl=CL&mapclient=apiv3",,Rel치jate con toda la familia en este alojamiento donde la tranquilidad se respira.,['Cocina'],,,Jes칰s Alonso,04-2017,https://www.airbnb.cl/rooms/758143630692496608?adults=1&children=0&infants=0&pets=0&check_in=2023-02-28&check_out=2023-03-05&previous_page_section_name=1000
99,casa 2D 1b 5 playa y calma,Alojamiento entero,La Serena,6,2,2, Habitaci칩n,1,privado,25.28,-29.8967,-71.2629,"https://maps.google.com/maps?ll=-29.8967,-71.2629&z=14&t=m&hl=es&gl=CL&mapclient=apiv3","El sector es totalmente tranquilo, pocas veces se escucha m칰sica fuerte, hay un humedal aleda침o que da vida a muchas aves. pasaje sin salida con plaza en su centro.

en la esquina venden empanadas exquisitas, hay varios minimarket y verduler칤as para lo necesario.","casa aislada en sector residencial, frente a una plaza en pasaje de 칰nica salida.

Ubicacion ideal para conocer y disfrutar de la ciudad. Cuenta con camas amplias (2 plaza y king), y un patio amplio para compartir, poco mas de 40m^2 de pasto sint칠tico.

para pasear, estaran caminando a:
5 minutos humedal rio elqui
10 minutos desembocadura 
10 minutos mall puertas del mar
15 minutos jard칤n japones
20 minutos plaza centro

cualquier consulta, lo atender치 su due침o.

pd:se aceptan mascotas :)


El lugar cuenta con 40m^2 de pasto sint칠tico y un comedor ah칤, para disfrutar al aire libre compartiendo comida o jugando con los m치s peque침os.

La casa se encuentra en un pasaje circular con una 칰nica salida, y en medio una plaza con algunos juegos para ni침os y varios arboles grandes que dan sombra para descansar. 

La cuadra de atr치s es la entrada al humedal rio elqui, por lo que las ma침anas son tan tranquilas que las aves nos despiertan con su cantar",['Acceso a la playa'],,,Claudio,06-2019,https://www.airbnb.cl/rooms/805372034806918476?adults=1&children=0&infants=0&pets=0&check_in=2023-02-25&check_out=2023-03-02&previous_page_section_name=1000
100,Casa 3 dormitorio con vista al mar,Alojamiento entero,Pichidangui,6,6,3, Habitaci칩n,2,privado,110.0,-32.13556,-71.53481,"https://maps.google.com/maps?ll=-32.13556,-71.53481&z=14&t=m&hl=es&gl=CL&mapclient=apiv3",Est치 frente al paseo de la costanera y lo tur칤stico de balneario,"Casa grande con vista panor치mica del mar, muy c칩moda, con chimenea, jacuzzi y todo lo necesario para tener una agradable estad칤a","['Acceso a playa P칰blico o compartido', 'Frente a la playa']",4.61,46,Ruby Sabrina,11-2016,https://www.airbnb.cl/rooms/20267504?adults=1&children=0&infants=0&pets=0&check_in=2023-02-26&check_out=2023-03-03&previous_page_section_name=1000
101,Valle del Elqui. Casa Expectacular!,Alojamiento entero,Vicu침a,5,6,2, Habitaci칩n,1,privado,85.0,-30.03298,-70.70785,"https://maps.google.com/maps?ll=-30.03298,-70.70785&z=14&t=m&hl=es&gl=CL&mapclient=apiv3",El 칰nico negocio del pueblo est치 al frente de la casa,"Expectacular casa en el valle, del Elqui (Montegrande) Casa con piscina y terraza con parrilla!! Jard칤n y estacionamiento privado.
Se acepta mascotas 
Cerca de los observatorios, mejor lugar para ver las estrellas, recorrer vi침edos y producci칩n de pisco.

El espacio
Maravillosas estrellas y excelente ubicaci칩n",['Cocina'],4.62,47,Maria Jose,09-2014,https://www.airbnb.cl/rooms/4202701?adults=1&children=0&infants=0&pets=0&check_in=2023-02-21&check_out=2023-02-27&previous_page_section_name=1000
102,Caba침a Rosas,Caba침a entero,Alcoguaz,5,5,2, Habitaci칩n,1,privado,69.0,-30.23012,-70.49353,"https://maps.google.com/maps?ll=-30.23012,-70.49353&z=14&t=m&hl=es&gl=CL&mapclient=apiv3",,"Ven a disfrutar de este paraiso escondido, en medio de las monta침as,  y a orillas del rio , a la sombra de unos maravillosos sauces ,y amplios jardines ,  en 10 mil mts de terreno ,y disfruta la vista nocturna de miles de estrellas . Busca    ,Calendario de lluvia de estrellas , hay todo el a침o ,y ven a disfrutar de estas maravillas de  la naturaleza, los esperamos",['Acceso a la playa'],,,Domos,11-2022,https://www.airbnb.cl/rooms/773576463949373237?adults=1&children=0&infants=0&pets=0&check_in=2023-03-02&check_out=2023-03-08&previous_page_section_name=1000
103,Hermosa Casa Tongoy,Alojamiento entero,Coquimbo,8,14,3, Habitaci칩n,1,privado,90.0,-30.25824,-71.47477,"https://maps.google.com/maps?ll=-30.25824,-71.47477&z=14&t=m&hl=es&gl=CL&mapclient=apiv3",cercano al estero del pueblo y rodeado de Flora y fauna,"Casa c칩moda en condominio,  con 3 habitaciones,  2 TV con cable, 2 piscinas grandes,  estacionamiento para 3 habitaciones. 
Hermoso entorno natural. ( Flora y fauna)

El espacio
lugar tranquilo , c칩modo,  limpio, agua caliente 2 tv con cable.","['Acceso a playa P칰blico o compartido', 'Frente a la playa']",4.67,9,Elianira,11-2018,https://www.airbnb.cl/rooms/46571997?adults=1&children=0&infants=0&pets=0&check_in=2023-02-27&check_out=2023-03-06&previous_page_section_name=1000
104,hermosa casa cerca de la playa,Alojamiento entero,Coquimbo,7,5,3, Habitaci칩n,"3,5",privado,89.62,-29.99739,-71.3325,"https://maps.google.com/maps?ll=-29.99739,-71.3325&z=14&t=m&hl=es&gl=CL&mapclient=apiv3",,Este alojamiento 칰nico tiene mucho espacio para que disfrutes con los tuyos.,['Acceso la playa P칰blico o compartido'],,,Gregory,03-2022,https://www.airbnb.cl/rooms/802069527830084345?adults=1&children=0&infants=0&pets=0&check_in=2023-02-22&check_out=2023-02-27&previous_page_section_name=1000
105,"Casa El Milagro, La serena",Alojamiento entero,La Serena,8,5,3, Habitaci칩n,2,privado,70.663,-29.95,-71.2406,"https://maps.google.com/maps?ll=-29.95,-71.2406&z=14&t=m&hl=es&gl=CL&mapclient=apiv3",,Vuelve a conectarte con tus seres queridos en este alojamiento ideal para familias.,['Cocina'],,,Natalia,01-2017,https://www.airbnb.cl/rooms/793450567370063336?adults=1&children=0&infants=0&pets=0&check_in=2023-02-20&check_out=2023-02-27&previous_page_section_name=1000
