,Titulo1,Titulo2,Comuna,Capacidad,Camas,N_Habitaciones,Habitaciones,Baños,Tipo_Baños,Precio,lat,lon,Ubicacion,Ubides,Descripcion,Servicios,Nota,Nnota,Anfitrion,Registro,Link
64,Hermoso condominio frente al mar (II),Condo entero,La Serena,4,2,2, Habitación,2,privado,90.0,-29.91601,-71.27564,"https://maps.google.com/maps?ll=-29.91601,-71.27564&z=14&t=m&hl=es&gl=CL&mapclient=apiv3","Mini market fuera del condominio
Contiguo a La Mía Pizza
Panaderías
Stand de turismo para paseos al observatorio, playas, etc.
Acceso a calle paralela a costanera para evitar congestión en verano.
Muchos restaurantes cercanos al departamento!","Relájate en esta escapada única y tranquila.
Depto. de amplios 2 dormitorios y 2 baños (suite ambos ), terraza con parrilla, cocina completamente equipada!
Termopanel en las habitaciones y calefacción.
Condominio frente al mar. Estacionamiento interior privado.
Instalaciones cuentan con varias piscinas, con olas, para niños, exterior y temperada interior. Jacuzzi, sauna, gimnasio y sala de juegos.


El departamento está equipado para llegar de manera independiente a la hora que quieras!
- cerradora digital
-wifi
- cocina 100% equipada, se entrega esponja y lavaloza.
- futón en la sala
- amplios dormitorios en suite 
- secador de cabello
- sábanas y toallas

Espacios comunes:
• Piscinas Exteriores: piscina con olas, para niños y exterior
• Piscina Temperada
• Sauna y Jacuzzi
• Sala de Juegos
• Sala de Cine
• Sala de Multiuso
• Gimnasio.
• Quinchos y Fogón",['Acceso a la playa'],4.94,16,Andre,02-2017,https://www.airbnb.cl/rooms/54039877?adults=1&children=0&infants=0&pets=0&check_in=2023-03-11&check_out=2023-03-17&previous_page_section_name=1000
65,Hermoso departamento frente al mar en Coquimbo,Condo entero,Coquimbo,6,5,3, Habitación,2,privado,70.0,-29.98053,-71.35064,"https://maps.google.com/maps?ll=-29.98053,-71.35064&z=14&t=m&hl=es&gl=CL&mapclient=apiv3",,"Lleva a toda la familia a este fantástico lugar con muchas zonas para divertirse.
Departamento ubicado en primera línea en playa la Herradura de Coquimbo con piscina,  quincho, zona de juegos infantiles,  acceso directo a la playa, muy central, con locales comerciales, supermercado y movilidad muy cercana, a 10 min de playa Totoralillo, del centro de Coquimbo y 15 min del casino enjoy.",['Vista a la bahía'],5.0,7,Gloria,11-2021,https://www.airbnb.cl/rooms/53127728?adults=1&children=0&infants=0&pets=0&check_in=2023-02-26&check_out=2023-03-03&previous_page_section_name=1000
66,Departamento con vista al mar,Vivienda rentada entero,La Serena,6,5,3, Habitación,2,privado,97.0,-29.92716,-71.27874,"https://maps.google.com/maps?ll=-29.92716,-71.27874&z=14&t=m&hl=es&gl=CL&mapclient=apiv3","Una ubicación privilegiada a medio camino entre las dos mayores atracciones de avenida Del Mar. Está ubicado en el punto medio entre el Casino de Coquimbo y el Faro, lo que permite llegar a cualquiera de estos puntos disfrutando de una rica caminata por la orilla del mar.

Para que se animen a venir a La Serena:

http://www.t13.cl/videos/nacional/hay-ir-vacaciones-coquimbo

http://www.t13.cl/videos/nacional/tendencias/hay-ir-vacaciones-valle-del-elqui

http://www.t13.cl/videos/nacional/tendencias/hay-ir-vacaciones-valle-del-elqui-mistico","Espectacular departamento con vista al mar, piscina y áreas verdes. A solo metros de 4 esquinas, el departamento queda en Avenida Del Mar y tiene vista asegurada al mar desde la terraza y dormitorio principal. La playa se encuentra al cruzar la calle y hay muchos restaurantes en la zona. Buena conectividad para visitar principales atracciones.

El espacio
Una ubicación privilegiada a medio camino entre las dos mayores atracciones de avenida Del Mar. Está ubicado en el punto medio entre el Casino de Coquimbo y el Faro, lo que permite llegar a cualquiera de estos puntos disfrutando de una rica caminata por la orilla del mar.","['Acceso a playa Público o compartido', 'Frente a la playa']",4.67,24,Luz Maria,12-2016,https://www.airbnb.cl/rooms/16342035?adults=1&children=0&infants=0&pets=0&check_in=2023-03-06&check_out=2023-03-13&previous_page_section_name=1000
67,"Departamento, WIFI+TV, Amoblado 3D~2B, La Serena",Vivienda rentada entero,La Serena,6,4,3, Habitación,2,privado,38.0,-29.90165,-71.26225,"https://maps.google.com/maps?ll=-29.90165,-71.26225&z=14&t=m&hl=es&gl=CL&mapclient=apiv3",Es un lugar tranquilo que ayuda al descanso.,"Departamento cuenta con una decoración moderna y acogedora que otorga una estadía muy cómoda, ubicado en condominio con acceso controlado.  Barrio residencial y tranquilo, cerca de Mall Puertas del Mar, del Faro y de las principales avenidas.
Puedes movilizarte fácilmente a la avenida del Mar que cuenta con una gran costa llena de vida y restaurantes.  Puedes organizar paseos al Valle del Elqui, Valle del Encanto, Parque Fray Jorge, etc.   
Un lugar  Ideal para disfrutar en familia y en pareja.


Se dispone de 1 Quitasol y 4 sillas plegables para la playa o para llevar a cualquier sitio a visitar y así disfrutar de un momento cómodo y confortable.  Además está disponible parrilla eléctrica para su utilización en el balcón de forma segura.",['Cocina'],4.77,95,Giovanna,09-2016,https://www.airbnb.cl/rooms/19570644?adults=1&children=0&infants=0&pets=0&check_in=2023-07-23&check_out=2023-07-30&previous_page_section_name=1000
68,Departamento en Puerto Velero a metros de la playa,Vivienda rentada entero,Coquimbo,5,4,2, Habitación,2,privado,150.0,-30.24058,-71.47773,"https://maps.google.com/maps?ll=-30.24058,-71.47773&z=14&t=m&hl=es&gl=CL&mapclient=apiv3",,"Cómodo departamento frente a la playa, a pasos del ascensor para acceder a la playa. El condominio tiene restaurantes, piscinas, gimnasio, minimarket y canchas de futbol, tenis y golf par 3.","['Acceso a la playa', 'Frente a la playa']",4.91,11,Arturo,01-2020,https://www.airbnb.cl/rooms/41380029?adults=1&children=0&infants=0&pets=0&check_in=2023-03-13&check_out=2023-03-20&previous_page_section_name=1000
69,Excelente depto completo - ubicación/full equipado,Condo entero,La Serena,7,4,3, Habitación,2,privado,65.0,-29.90808,-71.26366,"https://maps.google.com/maps?ll=-29.90808,-71.26366&z=14&t=m&hl=es&gl=CL&mapclient=apiv3","Este barrio es bastante nuevo sin embargo cuenta con una de las casas patrimoniales de Gabriela Mistral, ganadora del premio Nobel de literatura. Hay otros hitos como la Biblioteca Regional y El Faro, hay sedes universitarias y variedad de comercio.","Apartamento moderno ubicado en cuarto piso,  servicios incorporados, habitaciones, cocina y baños 100% equipados, de excelente iluminación y ventilación, con balcones en habitación principal y living, orientación norponiente que permite un agradable soleamiento, vista al mar, a los parques y zona de piscinas del condominio. Previa coordinación es posible acceder al área de quinchos y eventos al aire libre.
El estilo y ambientación fue definido por la Arquitecta propietaria del departamento.


Es un departamento muy acogedor y luminoso, puedes llegar caminando a la playa o al centro histórico de la ciudad.",['Vista al mar'],4.22,9,Ricardo Enrique,09-2018,https://www.airbnb.cl/rooms/28632162?adults=1&children=0&infants=0&pets=0&check_in=2023-03-06&check_out=2023-03-11&previous_page_section_name=1000
70,Depto. 3D 2B para 6 personas,Vivienda rentada entero,Coquimbo,6,4,3, Habitación,2,privado,50.0,-29.9008,-71.2632,"https://maps.google.com/maps?ll=-29.9008,-71.2632&z=14&t=m&hl=es&gl=CL&mapclient=apiv3",,"Relájate con toda la familia en este tranquilo lugar para quedarse.
Hermoso departamento en condominio, en sector residencial ubicado a 3 cuadras del Mall Parque Puertas del Mall y con almacenes en la misa cuadra para que puedas realizar tus compras.

El espacio
Departamento equipado full para 6 personas, con  1 dormitorio matrimonial en suite, un segundo dormitorio con 2 camas de 1 plaza y un tercer dormitorio con 1 cama de 1 plaza, más 2 baños, loggia con lavadora propia y cocina totalmente equipada.  El condominio cuenta con seguridad las 24 horas del día, acceso controlado, piscina y estacionamiento propio del depto.
Departamento ubicado en primer piso para un mejor acceso lo que evita ascensor y escaleras.
El horario de ingreso es a las 14 horas y el check out a las 12 del día.",['Cocina'],,,Margarita,12-2017,https://www.airbnb.cl/rooms/783426135463763952?adults=1&children=0&infants=0&pets=0&check_in=2023-03-02&check_out=2023-03-08&previous_page_section_name=1000
71,"""La Choza VIP Turquesa"" La Serena Playa y Casino!",Vivienda rentada entero,Coquimbo,4,3,2, Habitación,2,privado,112.079,-29.94324,-71.2901,"https://maps.google.com/maps?ll=-29.94324,-71.2901&z=14&t=m&hl=es&gl=CL&mapclient=apiv3","Mi departamento, llamado cariñosamente ""La Choza VIP Turquesa"", se encuentra ubicado en el piso 21 de la Torre Arena de Condominio Club Océano, con vista frontal al mar, cruzas la calle Costanera y ya estás en la playa!
Está a aproximadamente 100 metros del casino Enjoy de Coquimbo, y cerca de los mejores restaurantes y bares de la zona.","La Choza VIP Turquesa es mi departamento cuya decoración es moderna, acogedor, cálido, con todo lo que necesites para cocinar si deseas, habilitado para 4 personas y con acceso a la tecnología del momento, Smart TV conectados a TV cable, Home Theater y todo lo puedes enlazar vía Bluetooth a tu celular si prefieres. Cuenta con WI-FI
Además tendrás una espectacular e inigualable vista a la amplia bahía de Coquimbo y La Serena, con parte de la ciudad.
Sólo trae tu mejor libro, disfruta el descanso.


Cuenta con un cómodo juego de terraza para estar compartiendo con tu familia frente al mar, dormitorio principal con cama tamaño King nueva y Smart TV de 48"", segundo dormitorio con 2 camas box spring individuales, dos baños completos con tinas, WI-FI, Smart TV de 48"" conectado a TV Cable y Home Theater en living, DVD, CD y Blue Ray, también pueden conectarse a tu celular a través de Bluetooth.
En la cocina hay hervidor, microondas con grill, termo, hornito eléctrico, y todo lo que necesites para preparar una rica cena con tus amigos o familia.
Aspiradora.
Plancha y mesa para planchado
Estufa a gas
Cuna armable, sólo a pedidos con anticipación y tiene un costo de $5.000",['Vista a la bahía'],4.77,83,Yanitza,01-2012,https://www.airbnb.cl/rooms/14090953?adults=1&children=0&infants=0&pets=0&check_in=2023-02-27&check_out=2023-03-06&previous_page_section_name=1000
72,Departamento en Puerto Velero a metros de la playa,Vivienda rentada entero,Coquimbo,5,4,2, Habitación,2,privado,150.0,-30.24058,-71.47773,"https://maps.google.com/maps?ll=-30.24058,-71.47773&z=14&t=m&hl=es&gl=CL&mapclient=apiv3",,"Cómodo departamento frente a la playa, a pasos del ascensor para acceder a la playa. El condominio tiene restaurantes, piscinas, gimnasio, minimarket y canchas de futbol, tenis y golf par 3.","['Acceso a la playa', 'Frente a la playa']",4.91,11,Arturo,01-2020,https://www.airbnb.cl/rooms/41380029?adults=1&children=0&infants=0&pets=0&check_in=2023-03-13&check_out=2023-03-20&previous_page_section_name=1000
73,Departamento completo y acogedor,Vivienda rentada entero,La Serena,5,2,3, Habitación,2,privado,45.833,-29.91655,-71.21049,"https://maps.google.com/maps?ll=-29.91655,-71.21049&z=14&t=m&hl=es&gl=CL&mapclient=apiv3","Es un barrio joven con no más de 25 años, pero en los últimos años ha crecido mucho, es muy tranquilo y seguro cercano al aeropuerto y a la ruta Del Valle del elqui, a pasos de supermercados, farmacia, y restaurantes","Departamento nuevo muy acogedor y confortable a cinco minutos del centro de la ciudad y dos del aeropuerto a pasos de locomoción colectiva y supermercados

El espacio
Nuevo departamento, con finas terminaciones, cercano a supermercados, farmacias, restaurantes 10 minutos de la playa y a 5 minutos del centro de la ciudad  en un barrio seguro y tranquilo, no te arrepentirás de tu estadía en nuestro hogar.",['Accesos de entrada y salida a pistas de esquí'],4.92,13,Bárbara,07-2016,https://www.airbnb.cl/rooms/26029840?adults=1&children=0&infants=0&pets=0&check_in=2023-02-24&check_out=2023-03-02&previous_page_section_name=1000
74,Hermoso departamento a pasos de avenida del mar,Condo entero,Coquimbo,5,4,2, Habitación,2,privado,72.0,-29.94839,-71.28922,"https://maps.google.com/maps?ll=-29.94839,-71.28922&z=14&t=m&hl=es&gl=CL&mapclient=apiv3","El sector está considerado como el mejor lugar para pasear y divertirse por los turistas, ya que cuenta con una variedad de entretencion y por la cercanía a la playa.","Se arrienda hermoso y acogedor departamento en exclusivo y privilegiado sector de Peñuelas, Coquimbo con una espectacular vista a la bahía.
A solo pasos de la avenida del mar, Casino de juegos Enjoy ,múltiples centros de entretenimiento, Restaurantes, Pubs y Discoteques.

El espacio
Departamento completamente equipado, con todo lo necesario para hacer de su estadia una agradable y acogedora visita a nuestra hermosa Ciudad.
Incluye Wifi, televisor smartv con televisión por iptv.
Dos habitaciones una equipada con cama de dos plazas , con una hermosa vista a la bahía de Coquimbo y avenida del mar, amplio closet y baño en suite con tina y vanitorio.
La otra habitación está equipada con tres camas de una plaza y amplio closet.
Amplio y cómodo, living comedor ,con grandes ventanales con salida al balcón protegido con malla de seguridad.
Cocina espaciosa e independiente, completamente equipada.
El departamento incluye lavadora.",['Vista a la bahía'],5.0,3,Ricardo,07-2022,https://www.airbnb.cl/rooms/665980760755265343?adults=1&children=0&infants=0&pets=0&check_in=2023-02-27&check_out=2023-03-04&previous_page_section_name=1000
75,Excelente Departamento primera línea los Molles,Vivienda rentada entero,Los Molles,4,4,3, Habitación,2,privado,80.0,-32.23593,-71.51151,"https://maps.google.com/maps?ll=-32.23593,-71.51151&z=14&t=m&hl=es&gl=CL&mapclient=apiv3",,"Departamento excelente ubicación ubicado en playa Los Molles, acceso directo a la playa, condominio con ascensor, piscina y Jacuzzi exterior.

El espacio
Piscina de fase 2 en adelante y Jacuzzi en fase 4, Quinchos habilitados","['Acceso a la playa', 'Frente a la playa']",4.53,15,Patricia,01-2021,https://www.airbnb.cl/rooms/47909784?adults=1&children=0&infants=0&pets=0&check_in=2023-02-27&check_out=2023-03-04&previous_page_section_name=1000
76,Piso7 Depto a pasos de playa en La Serena.,Vivienda rentada entero,La Serena,4,3,2, Habitación,2,privado,75.0,-29.93062,-71.27878,"https://maps.google.com/maps?ll=-29.93062,-71.27878&z=14&t=m&hl=es&gl=CL&mapclient=apiv3","El edificio Esta ubicado en el sector de la playa 4 esquinas. Como indicaciones generales, sus distancias son:
- a El Faro de La Serena aprox: Auto 6 minutos; Caminando 40 minutos, según mapas.
- Cercano (2 cuadras) a Av. 4 Esquinas, punto medio entre El Faro de La Serena y Casino de Coquimbo.
El sector cuenta con minimarket, panaderías, pubs y restaurantes. Todo muy cerca, sólo caminando!","Encántate con La Serena y disfruta de sus hermosas playas y agradable clima en este lindo y confortable departamento. Muy bien ubicado, a pasos de la playa y de los mejores restaurantes, pubs y discotecas de la Avenida del Mar. A metros de minimarket, panadería y lavandería. Seguridad las 24 horas.

El espacio
Departamento de 2 dormitorios y 2 baños. Habilitado para 4 personas con todo lo necesario para entregar comodidad a los huéspedes. Departamento ubicado a escasos metros de la playa en el sector 4 esquinas.",['Cocina'],4.95,86,Miguel Angel,10-2016,https://www.airbnb.cl/rooms/19812191?adults=1&children=0&infants=0&pets=0&check_in=2023-03-11&check_out=2023-03-17&previous_page_section_name=1000
77,"Depto 2D2B Piscina, Quincho, Estacionamiento,WiFi!",Condo entero,La Serena,6,5,2, Habitación,2,privado,80.0,-29.92248,-71.27646,"https://maps.google.com/maps?ll=-29.92248,-71.27646&z=14&t=m&hl=es&gl=CL&mapclient=apiv3","Valle del Elqui.
Recova (Mercado de La Serena)
Puerto de Coquimbo
Mall
Outlet
Supermercado.
Aeropuerto","Hermoso departamento frente al mar en sector 4 esquinas, cercano a restaurantes supermercados y un sin fin de atractivos. Pet friendly !!!!!!!

El espacio
Nuevo y acogedor departamento modelo 2B2D estilo mariposa, baño en suite habitación principal, walking closet, wifi y television por cable, malla de seguridad en balcón, piscina y quincho. Frente al mar en el sector 4 esquinas.",['Vista a la marina'],4.91,22,Cristian,11-2019,https://www.airbnb.cl/rooms/44446432?adults=1&children=0&infants=0&pets=0&check_in=2023-03-03&check_out=2023-03-08&previous_page_section_name=1000
78,"Espectacular dpto a pasos de la playa, Los Molles",Vivienda rentada entero,Los Molles,5,4,3, Habitación,2,privado,89.0,-32.23674,-71.51141,"https://maps.google.com/maps?ll=-32.23674,-71.51141&z=14&t=m&hl=es&gl=CL&mapclient=apiv3",,"Espectacular departamento en Los Molles con vista al mar en primera línea, tercer piso. Se ubica frente a la playa, por lo que se puede acceder a ésta con sólo caminar algunos pasos al igual que a restaurantes y a comercios. Se encuentra equipado de manera completa para 5 personas cómodamente alojadas en un ambiente familiar, e incluye DIRECTV en HD además de estacionamiento interno. El condominio cuenta con ascensores, lavandería, una amplia piscina, jacuzzis y quinchos.


Dpto con vista al mar. Acceso a la playa, piscina, restaurantes y comercios con sólo caminar.","['Acceso a la playa', 'Frente a la playa']",4.79,14,Fernando,11-2020,https://www.airbnb.cl/rooms/46264115?adults=1&children=0&infants=0&pets=0&check_in=2023-02-28&check_out=2023-03-05&previous_page_section_name=1000
79,Las Tacas 2021- Veranó 2022,Vivienda rentada entero,Coquimbo,8,7,3, Habitación,2,privado,250.0,-30.08591,-71.37261,"https://maps.google.com/maps?ll=-30.08591,-71.37261&z=14&t=m&hl=es&gl=CL&mapclient=apiv3",,"Lindo y cómodo departamento ubicado en el complejo turístico Las tacas, IV región. Departamento en primera línea, preciosa y despejada vista al mar, jardines y piscina. El complejo privado cuenta con minimarket, restaurantes, locales comerciales, entretenimiento infantil, discotecas (solo en verano). Guardias día y noche. Lugar ideal para pasar las mejores vacaciones familiares.


Departamento primer piso, tres
Dormitorios más dos Baños en primera línea preciosa vista al mar jardines y piscina","['Acceso a la playa', 'Frente a la playa']",5.0,8,María Angélica,06-2019,https://www.airbnb.cl/rooms/35844711?adults=1&children=0&infants=0&pets=0&check_in=2023-03-03&check_out=2023-03-08&previous_page_section_name=1000
80,Disfruta Puerto Velero! Vive el mar ~,Condo entero,Tongoy,6,6,2, Habitación,"2,5",privado,140.0,-30.24383,-71.4789,"https://maps.google.com/maps?ll=-30.24383,-71.4789&z=14&t=m&hl=es&gl=CL&mapclient=apiv3","Puerto Velero es el complejo turístico más grande y completo el norte de Chile, caracterizado por sus lindos paisajes, cómoda y segura estancia.","Este acogedor departamento les ofrecerá una maravillosa experiencia disfrutando del mar, playa, jardines, flora y fauna de la zona y los mas bellos atardeceres. Cuenta con wifi estable ideal para poder trabajar a distancia si es necesario. 
📍Pto Velero, Edificio 14, 3er Piso, Segunda línea 🌅

El espacio
Nuestro departamento se encuentra especialmente habilitado para disfrutar de descanso en la playa, es muy versátil, gran terraza, hermosa vista, bellos atardeceres.  Al interior de un complejo residencial seguro y personal de seguridad 24 horas. También ideal para trabajar a distancia ya que cuenta con wifi rápido y estable. Recuperarás energías y durante temporada alta disfrutaras de actividades para toda la familia. Piscinas de agua dulce y salada, acceso directo a playa Socos, dependencias deportivas (tenis, padel, golf, futbol, acondicionamiento físico), juegos para niños. Restaurants en la playa, Marina. Además contamos con los mejores datos y picadas para disfrutar la magia de Tongoy.",['Vista al mar'],4.75,8,Gabriela,02-2017,https://www.airbnb.cl/rooms/17077985?adults=1&children=0&infants=0&pets=0&check_in=2023-02-28&check_out=2023-03-05&previous_page_section_name=1000
81,Departamento a pasos de El Faro y el mar!,Vivienda rentada entero,La Serena,4,3,2, Habitación,2,privado,36.45,-29.8999,-71.2681,"https://maps.google.com/maps?ll=-29.8999,-71.2681&z=14&t=m&hl=es&gl=CL&mapclient=apiv3","Es un barrio consolidado, se encuentra al lado del Centro Turístico Laguna del Mar.","El departamento está muy cercano a lugares de interés como playas, restaurantes, Mall Puerta del Mar (5 minutos), Bancos, transporte público, arte, cultura y parques. Te va a encantar mi espacio! es un departamento nuevo, muy seguro con guardia las 24 horas y caminando desde la puerta hasta poner los pies en el agua te demoras 8 minutos caminando, si sigues por la playa llegas a el Faro de la Serena. Mi alojamiento es bueno para familias (con hijos).


Si lo necesitas puedo dejar una cuna Pack and Play sin costo adicional.
Esta ubicado en el tercer piso del edificio.",['Cocina'],4.90,20,Melina,04-2012,https://www.airbnb.cl/rooms/16400837?adults=1&children=0&infants=0&pets=0&check_in=2023-04-01&check_out=2023-04-08&previous_page_section_name=1000
82,Exclusivo departamento Laguna del Mar,Condo entero,Coquimbo,5,4,2, Habitación,2,privado,85.0,-29.90057,-71.26993,"https://maps.google.com/maps?ll=-29.90057,-71.26993&z=14&t=m&hl=es&gl=CL&mapclient=apiv3","Primer Resort Urbano cercano a los Mall, a supermercados y los mejores restaurantes de la zona, a 7 minutos del casco histórico de la ciudad. Ubicado frente al mar lo que permite disfrutar sus bondades.","Exclusivo Complejo Turístico Laguna Del Mar único en La Serena. Hermoso departamento con vista al mar y a la laguna, full equipado para 6 pp, dos dormitorios, dos baños, ppal en suite c/ walking closet, ambos con smarTV, cable y wifi, lavadora, terraza  c/ parrilla... todo para unas vacaciones en familia entretenidas y relajadas. Playa privada, deliciosa cafetería en laguna, 5 piscinas con protocolo Covid, actividades recreativas, canchas de tenis... Cercano a Mall, supermercado y restaurantes.


Cómodo departamento de dos dormitorios y dos Baños pensado en la comodidad de los huéspedes, su tranquilidad y entretención. Tiene wifi, ambas habitaciones con smarTV y cable, lavadora y colgador para ayudar en lo cotidiano a parte de una cocina full equipada.",['Vista al jardín'],,,Darlene,09-2016,https://www.airbnb.cl/rooms/47431021?adults=1&children=0&infants=0&pets=0&check_in=2023-02-25&check_out=2023-03-02&previous_page_section_name=1000
83,Cabaña 8 personas Family Los Molles frente al,Loft entero,Chile,8,7,3, Habitación,2,privado,80.0,-32.23858,-71.51169,"https://maps.google.com/maps?ll=-32.23858,-71.51169&z=14&t=m&hl=es&gl=CL&mapclient=apiv3","LOS MOLLES excelente lugar para relajarse con buenísimos panoramas.
Entre las actividades que se pueden realizar tenemos:

- Andar a CABALLO por los campos de Los Molles. (Diferentes alternativas)
- Arriendo y Tours en Bicicleta
- Trekking educativos por el borde del mar e interiores (cerros con excelentes atractivos naturales)
- Clases de RAPEL, descenso en cuerda por Roca.
-Caminata por la reserva ecológica en donde se encuentra el Puquén, las Picinas Naturales , las Terrazas.

Consulta donde pueden realizar dichas actividades.
No te pierdas estas excelentes alternativas en tus vacaciones.","Cabaña duplex con maravillosa vista frente al mar.

El espacio
Excelente ubicación frente al mar para 7 personas",['Cocina'],4.80,20,Nancy,12-2016,https://www.airbnb.cl/rooms/26806619?adults=1&children=0&infants=0&pets=0&check_in=2023-03-01&check_out=2023-03-06&previous_page_section_name=1000
84,Lindo departamento en la playa herradua,Vivienda rentada entero,Coquimbo,6,5,3, Habitación,2,privado,75.0,-29.9798,-71.34787,"https://maps.google.com/maps?ll=-29.9798,-71.34787&z=14&t=m&hl=es&gl=CL&mapclient=apiv3",Es un barrio tranquilo junto al pueblito de la herradura,"Departamento en primer piso  con acceso directo a playa herradura, piscina de más de 1000 metros cuadrados, áreas verdes,estacionamiento propio, 
conserjería y seguridad las 24 horas del día 

""la mejor vista al mar""

El espacio
Los mejores atardeceres",['Vista a la bahía'],4.67,27,Victor,04-2015,https://www.airbnb.cl/rooms/6222237?adults=1&children=0&infants=0&pets=0&check_in=2023-02-26&check_out=2023-03-03&previous_page_section_name=1000
85,Depto amplio y cómodo para 6 a una cuadra playa,Vivienda rentada entero,La Serena,5,5,2, Habitación,2,privado,55.0,-29.93704,-71.28177,"https://maps.google.com/maps?ll=-29.93704,-71.28177&z=14&t=m&hl=es&gl=CL&mapclient=apiv3","A 1 cuadra de la playa.
Desde 2 cuadras empiezas a encontrar restoranes y cafeterías, bares, discos.
A unas 4 cuadras tienes tiendas de comestibles, panadería, botillerías, rotisería, etc.
A 6 cuadras de casino de juegos Enjoy de Coquimbo.","Departamento moderno y luminoso a 1 cuadra avda. costanera. Dormitorio con cama matrimonial, 2 veladores, 2 closet; baño en suite con tina y vanitorio. Segundo dormitorio con camarote nido (3 camas) y closet. 2º baño tb. con tina. Cocina equipada: cocina vitrocerámica, horno eléctrico, microondas, juguera, hervidor, minipimmer, refrigerador. Comedor para 6, sofá, 2 sitiales y futton, tv cable. Amplia terraza norponiente. Estacionamiento, quincho, piscina. Portero eléctrico y conserje 24 hrs.


Departamento espacioso, moderno, bien iluminado; lejos del bullicio de la costanera. Salida directa por calles traseras menos concurridas en verano. Buenas vistas, piscina, quincho, estacionamiento.",['Vista al océano'],4.54,24,Susana,07-2015,https://www.airbnb.cl/rooms/20849688?adults=1&children=0&infants=0&pets=0&check_in=2023-03-23&check_out=2023-03-28&previous_page_section_name=1000
