,Titulo1,Titulo2,Comuna,Capacidad,Camas,N_Habitaciones,Habitaciones,Baños,Tipo_Baños,Precio,lat,lon,Ubicacion,Ubides,Descripcion,Servicios,Nota,Nnota,Anfitrion,Registro,Link
161,Casona con piscina,Casa de campo entero,Vicuña,10,7,5, Habitación,"3,5",privado,150.0,-30.02633,-70.63228,"https://maps.google.com/maps?ll=-30.02633,-70.63228&z=14&t=m&hl=es&gl=CL&mapclient=apiv3",,"Desconectate de tus preocupaciones en esta cómoda  y amplia casa equipada para 10 personas, ideal para familias con piscina y quincho para disfrutar de los soleados días en el valle de elqui la casona está ubicada a 7 min pasado Vicuña frente al pueblo Diaguita más detalles de la ubicacion por interno.",['Vista al valle'],,,Maritza,10-2022,https://www.airbnb.cl/rooms/737681233067389814?adults=1&children=0&infants=0&pets=0&check_in=2023-02-28&check_out=2023-03-06&previous_page_section_name=1000&federated_search_id=c242c7ff-24cf-42c8-b297-f88fc291561d
162,Tranquila Cabaña Cerca de ovalle,Cabaña entero,Ovalle,5,3,2, Habitación,1,privado,80.0,-30.6853,-71.5189,"https://maps.google.com/maps?ll=-30.6853,-71.5189&z=14&t=m&hl=es&gl=CL&mapclient=apiv3",,"Relájate con toda la familia en este tranquilo lugar para quedarse.
Contamos con una piscina privada de 10.5 mt x 5.5 mt exclusiva para quien arriende la cabaña.

hay árboles frutales.
lugar para realizar asados y compartir.
cuenta con tv cable cocina, cocina a leña, refrigerador.

a 10 min de la entrada del parque fray Jorge
a 25 min de Ovalle
a 10 min termas de socos.",['Cocina'],,,Diego,03-2022,https://www.airbnb.cl/rooms/776908346109294031?adults=1&children=0&infants=0&pets=0&check_in=2023-02-19&check_out=2023-02-26&previous_page_section_name=1000&federated_search_id=c242c7ff-24cf-42c8-b297-f88fc291561d
163,Cabañas Los Pipiolos,Cabaña entero,Pisco Elqui,4,3,2, Habitación,1,privado,80.0,-30.12601,-70.49023,"https://maps.google.com/maps?ll=-30.12601,-70.49023&z=14&t=m&hl=es&gl=CL&mapclient=apiv3",,"Relájate con toda la familia en este tranquilo lugar en el corazón del valle de Elqui, espacio natural rodeado por cerros y rio.",['Cocina'],,,Yerko,01-2015,https://www.airbnb.cl/rooms/627391860032897813?adults=1&children=0&infants=0&pets=0&check_in=2023-02-20&check_out=2023-02-25&previous_page_section_name=1000&federated_search_id=c242c7ff-24cf-42c8-b297-f88fc291561d
164,Casa de Campo ubicada a 5 min. de Ovalle.,Villa entero,Ovalle,7,7,3, Habitación,2,privado,140.0,-30.63075,-71.20625,"https://maps.google.com/maps?ll=-30.63075,-71.20625&z=14&t=m&hl=es&gl=CL&mapclient=apiv3","Ubicada en la Comuna de Los Leices (Ovalle). Lugar tranquilo y no llegan ruidos molestos, pasa una acequia con poca agua y está cerca del río Limarí.","Espacios amplios y Seguros. Casa de Campo con piscina 8x4. Terraza con Quincho. Comedor exterior (se acondiciona). Sala con Mesa de Pool Profesional, taca-taca para 8 personas y arcade de los años 80. Cocina y comedor amplio. 2 dormitorios con cama de 2 plazas y 1 dormitorio con 3 camas individuales (se puede agregar 3 camas más en segundo piso). 2 baños completos. Estacionamientos para 3 autos. Ubicación a 5 min. de Ovalle, 50 min. a La Serena. 1 hora a las playas de Tongoy y Guanaqueros.",['Cocina'],,,Elizabeth,08-2022,https://www.airbnb.cl/rooms/750826214433852476?adults=1&children=0&infants=0&pets=0&check_in=2023-02-18&check_out=2023-02-23&previous_page_section_name=1000&federated_search_id=c242c7ff-24cf-42c8-b297-f88fc291561d
165,Casa de campo piscina tinaja uso exclusivo grupos,Cabaña entero,Vicuña,12,10,3, Habitación,2,privado,200.0,-30.03213,-70.7027,"https://maps.google.com/maps?ll=-30.03213,-70.7027&z=14&t=m&hl=es&gl=CL&mapclient=apiv3",,"Casa de Campo Hierro Viejo, lugar único y exclusivo para pasar días de relajo junto a la familia o amigos, contamos con piscina y tinaja para 10 personas, totalmente equipada, cuenta con estacionamiento privado, sector rural a pasos del museo Gabriela Mistral y 5 minutos de la plaza de Vicuña.",['Cocina'],,,Yesika,03-2022,https://www.airbnb.cl/rooms/587130970002398139?adults=1&children=0&infants=0&pets=0&check_in=2023-02-18&check_out=2023-02-23&previous_page_section_name=1000&federated_search_id=c242c7ff-24cf-42c8-b297-f88fc291561d
166,Casa de campo con piscina,Casa de campo entero,Monte Patria,12,9,6, Habitación,"3,5",privado,400.0,-30.72764,-70.87018,"https://maps.google.com/maps?ll=-30.72764,-70.87018&z=14&t=m&hl=es&gl=CL&mapclient=apiv3",,Lleva a toda la familia a este fantástico lugar de tranquilidad y relajo.,['Cocina'],,,Ninive,09-2021,https://www.airbnb.cl/rooms/586926448266505836?adults=1&children=0&infants=0&pets=0&check_in=2023-02-27&check_out=2023-03-04&previous_page_section_name=1000&federated_search_id=c242c7ff-24cf-42c8-b297-f88fc291561d
167,"Pichidangui, Totoralillo, Rocas de San Andrés.",Chalé entero,Pichidangui,8,7,3, Habitación,"2,5",privado,200.0,-32.02924,-71.5163,"https://maps.google.com/maps?ll=-32.02924,-71.5163&z=14&t=m&hl=es&gl=CL&mapclient=apiv3","A 15 km al norte está la ciudad de Los Vilos, donde encuentras Supermercados, Feria de frutas y verduras, Caleta de Pescadores con ventas de pescados y marisco, restorantes.
A 10 kl al Sur está Pichidangui con una playa en bahía, maravillosa e ideal para hacer o tomar clases de deportes náuticos como skysurf y buceo.
De Quilimari a la cordillera encuentras artesanos en cerámica, restorant de comidas típicas y minas de cuarzo.
Playas, Caletas y Reservas Naturales en los alrededores para visitar y disfrutar.","Mi casa está en un lugar muy tranquilo y rural, puedes salir a caminar, andar en bicicleta sin riesgo y recorrer lugares a la orilla del mar.
La casa  es acogedora, luminosa, con todo preparado para que  disfrutes  de tu descanso; con espacios que te harán muy cómoda y grata tu estadía, tales como,  piscina,  quincho,  casita de cuarzo, lugares de lectura, juego de niños, etc. Puedes conocer playas maravillosas, minas de cuarzo, realizar paseos a caballo y buceo entre otros en el sector.


La casa está en el km 210 de la carretera Norte.  10 km después de Pichidangui y a 15 km ante de Los Vilos donde hay supermercados, comercio y ferias para abastecerse sin problemas. Se llega muy fácil, en 2,5 horas desde Santiago.
Durante enero y febrero se arriendan por un mínimo de 12 noches. el resto del año por un mínimo de 6.
Una vez hecha la reserva les envió por correo plano para llegar, datos prácticos sobre la casa e inventario. 
Lugares de interés: Playa Pichidangui (skysurf y buceo) Los Vilos, Bodegón Cultural, Cerámica de Guangualí, Playas cercanas. Encontrarás en la casa una carpeta con datos y actividades en la zona.",['Vista al jardín'],4.87,30,Maria Teresa,04-2016,https://www.airbnb.cl/rooms/13046364?adults=1&children=0&infants=0&pets=0&check_in=2023-02-19&check_out=2023-02-26&previous_page_section_name=1000&federated_search_id=c242c7ff-24cf-42c8-b297-f88fc291561d
168,Cabaña con Piscina Privada,Cabaña entero,El Molle,8,7,2, Habitación,1,privado,117.9,-29.97929,-70.95098,"https://maps.google.com/maps?ll=-29.97929,-70.95098&z=14&t=m&hl=es&gl=CL&mapclient=apiv3",,"Acogedora cabaña en el centro del pueblo turistico de El Molle, con piscina privada con deck de madera y protecciones para niño, quincho, wifi, fogon, terraza, 2 hamacas, 2 cupos de estacionamiento, muy tranquilo, a pasos del rio, restorants, almacenes, trecking, cabalgatas y masajes. Ideal para relajarse y desconectarse.
Solo familias
Minimo 3 noches
Diciembre $80.000
Año Nuevo $200.000
Enero y Febrero $150.000


16307885-6",['Cocina'],,,Carlos,08-2022,https://www.airbnb.cl/rooms/788160810769971112?adults=1&children=0&infants=0&pets=0&check_in=2023-02-20&check_out=2023-02-26&previous_page_section_name=1000&federated_search_id=c242c7ff-24cf-42c8-b297-f88fc291561d
169,"Casa Elba Molle , piscina, mirador al río y+",Casa de campo entero,Vicuña,9,7,3, Habitación,1,privado,132.0,-29.98426,-70.94763,"https://maps.google.com/maps?ll=-29.98426,-70.94763&z=14&t=m&hl=es&gl=CL&mapclient=apiv3",,"Casa Elba Molle es una casa para descansar y recuperar energías en el mágico Valle del Elqui, esta casa cuenta con 4000 mts2 para disfrutar de la naturaleza, cercano a atractivos turísticos de la región, a tan solo 25 minutos de La Serena y Vicuña.
La casa cuenta con:
Piscina
Dos miradores al Valle y Rio
Pérgola
2 parrillas
3 Habitaciones (Capacidad para 9 personas)
1 Baño
Living comedor grande
Cocina amplia, comedor de diario
Ven y disfruta de esta casa en el pueblo del Molle, kilometro 35,4


Gran casa, cuenta con 3 habitaciones (Habitación 1, 1 cama de dos plaza; habitación 2 , 1 cama de dos plazas ; habitación 3, 1 camarote de 1,5 plazas,1 cama de 1,5 plazas, una cama nido de 1,5 y una plaza ).
Patio amplio, tenemos juegos para adultos y niños, dos parrillas disponibles, 1 sector de fogata disponible, dos miradores, 1 canal de regadío, pergola grande, sector de la virgen.",['Vista al canal'],,,Marcelo,05-2019,https://www.airbnb.cl/rooms/53648307?adults=1&children=0&infants=0&pets=0&check_in=2023-02-23&check_out=2023-02-28&previous_page_section_name=1000&federated_search_id=c242c7ff-24cf-42c8-b297-f88fc291561d
170,"Parcela totalmente equipada. Tongoy, Coquimbo.Chile.",Alojamiento entero,Tongoy,Más de 16,13,7, Habitación,3,privado,250.0,-30.2878,-71.51068,"https://maps.google.com/maps?ll=-30.2878,-71.51068&z=14&t=m&hl=es&gl=CL&mapclient=apiv3","A 10 minutos del pueblo de Tongoy, en el cual se encuentran restaurantes típicos de la zona, playas y comercio
También a 10 minutos hacia el sur se encuentra el pintoresco pueblo de de Puerto Aldea, el cual se puede visitar, tiene un restaurant que abre solo en temporada de verano y una caleta.","Maravillosa casa ubicada en parcelas de Pachingo a dos cuadras de Playa Grande,Tongoy.
Casa equipada cuenta con cocina amoblada full,horno eléctrico, microondas,2 refrigeradores,1 freezer, lavadora,parrilla a carbón y parrilla a gas,wok a gas.
Planta baja cuenta con 3 dormitorios y baño completo,cocina,comedor con estancia.Dormitorio con un baño completo independiente.
Piscina privada y 2 kayaks con sus chalecos salvavidas.
Planta alta cuenta con 3 dormitorios,uno en suite y terraza.


Los huéspedes pueden hacer uso de todas las instalaciones, la piscina privada y 2 kayaks.",['Acceso la playa Público o compartido'],4.87,16,Luis,11-2017,https://www.airbnb.cl/rooms/27652742?adults=1&children=0&infants=0&pets=0&check_in=2023-02-27&check_out=2023-03-04&previous_page_section_name=1000&federated_search_id=c242c7ff-24cf-42c8-b297-f88fc291561d
171,Cabaña en el Valle del elqui,Cabaña entero,La Serena,11,9,3, Habitación,3,privado,150.0,-29.87752,-71.22736,"https://maps.google.com/maps?ll=-29.87752,-71.22736&z=14&t=m&hl=es&gl=CL&mapclient=apiv3",,"En este alojamiento se respira tranquilidad: ¡relájate con toda la familia!, ideal para poder conectar con ustedes",['Cocina'],,,Vania,09-2022,https://www.airbnb.cl/rooms/822585368399227593?adults=1&children=0&infants=0&pets=0&check_in=2023-02-27&check_out=2023-03-04&previous_page_section_name=1000&federated_search_id=c242c7ff-24cf-42c8-b297-f88fc291561d
172,"Valle de Elqui, 2 habit dobles, baño privado.",Habitación privada en alojamiento,La Serena,4,2,2, Habitación,1compartido,compartido,90.0,-30.12097,-70.49439,"https://maps.google.com/maps?ll=-30.12097,-70.49439&z=14&t=m&hl=es&gl=CL&mapclient=apiv3",,"Ubicado a pocos pasos de la plaza de Pisco. Muy buen lugar para descansar, relajarse y renovar energías. En el valle encontraras Observatorios, Pisqueras, Cabalgatas, Spa, Trekking, Artesanía y buena gastronomia. 
__ 

Located at few steps from the Pisco main square. Muy buen lugar para descansar, relajarse y recargar las baterías. En Pisco Elqui encontrarás observatorios, fábricas de Pisco, expediciones a caballo, spas, rutas de senderismo y buena gastronomía.",['Cocina'],4.76,29,Jaime,08-2017,https://www.airbnb.cl/rooms/20452258?adults=1&children=0&infants=0&pets=0&check_in=2023-02-28&check_out=2023-03-05&previous_page_section_name=1000&federated_search_id=c242c7ff-24cf-42c8-b297-f88fc291561d
173,Hermoso departamento. Avda. peñuelas a pasos enjoy,Alojamiento entero,Coquimbo,5,6,3, Habitación,1,privado,40.411,-29.94843,-71.2883,"https://maps.google.com/maps?ll=-29.94843,-71.2883&z=14&t=m&hl=es&gl=CL&mapclient=apiv3",,"Hermoso departamento a minutos de la playa y con una excelente conectividad para unas merecidas vacaciones! 

Departamento posicionado en el piso 6, con malla de protección. Completamente equipado para 5 personas en avda. Peñuelas, a pasos de la playa y Enjoy Coquimbo. Cuenta con estacionamiento exclusivo del departamento. El edificio cuenta con piscina, quincho y sala de lavado.

Se aceptan mascotas pequeñas.


El departamento está completamente equipado, con todo lo principal para su estadía.",['Acceso la playa Público o compartido'],4.75,4,Nattia,05-2022,https://www.airbnb.cl/rooms/734034954354310299?adults=1&children=0&infants=0&pets=0&check_in=2023-03-20&check_out=2023-03-26&previous_page_section_name=1000&federated_search_id=c242c7ff-24cf-42c8-b297-f88fc291561d
174,Depto Laguna Del Mar La Serena 3 Dorm Amplio,Alojamiento entero,La Serena,6,5,3, Habitación,2,privado,105.0,-29.8994,-71.2705,"https://maps.google.com/maps?ll=-29.8994,-71.2705&z=14&t=m&hl=es&gl=CL&mapclient=apiv3",Accesos controlados,"Departamento ubicado en resort Laguna del Mar 
ideal para viajes en familia habilitado para 6 personas cómodamente.
El Dpto cuenta con 3 dorm. 2 baño, ropa de cama y sábanas 2 TV de pantalla plana, equipo de música, comedor y cocina totalmente equipada, balcón con vista a la laguna y mar, quinchos al aire libre, lavandería, 2 estacionamientos gratuitos.
Salida directa al Mar. 
 Maravilloso entorno,  jardines 3 piscinas habilitadas y laguna navegable


Cómodamente equipado",['Acceso a la playa'],5.0,3,Lissette,05-2018,https://www.airbnb.cl/rooms/671848940158414029?adults=1&children=0&infants=0&pets=0&check_in=2023-02-27&check_out=2023-03-06&previous_page_section_name=1000&federated_search_id=be067f45-f7eb-4d26-a792-3c258bc41705
175,¡Campo y Playa para disfrutar!,Cabaña entero,La Serena,5,5,2, Habitación,1,privado,92.0,-29.9352,-71.2713,"https://maps.google.com/maps?ll=-29.9352,-71.2713&z=14&t=m&hl=es&gl=CL&mapclient=apiv3","Cerca del lugar se encuentra un Parque de Diversiones, al cual se puede acceder caminando. Es perfecto para llevar a niños.","Nuestras cabañas están totalmente equipadas para que puedas disfrutar de la comodidad como si estuvieras en tu propio hogar. Te entregamos todas las herramientas necesarias para que tengas una linda estadía, haciendo tu viaje mas llevadero y libre de preocupaciones. Este lugar está alejado del ruido molesto, en donde podrás descansar con tranquilidad. Se encuentra envuelto en un ambiente de campo, con amplios terrenos de áreas verdes. Grandes arboles rodean el lugar para entregarte sombra.


Nuestras cabañas tienen fácil acceso por la Ruta 5. Se encuentran a 500 mts. de la playa. ¡Puedes ir caminado! Además están a 5 min. del Mall Plaza La Serena y del supermercado. Encontrarás transporte fuera de las cabañas. ¡Es fantástico! 
Es un lugar único, especialmente hecho para ti. Estarás cerca de todo, pero podrás disfrutar de la magia del campo. ¡Un lugar lleno de sorpresas!",['Cocina'],4.64,11,Claudia,03-2019,https://www.airbnb.cl/rooms/40439340?adults=1&children=0&infants=0&pets=0&check_in=2023-02-19&check_out=2023-02-24&previous_page_section_name=1000&federated_search_id=be067f45-f7eb-4d26-a792-3c258bc41705
176,Villa Toscana,Cabaña entero,La Serena,5,3,2, Habitación,1,privado,85.0,-29.9177,-71.23605,"https://maps.google.com/maps?ll=-29.9177,-71.23605&z=14&t=m&hl=es&gl=CL&mapclient=apiv3",,"Relájate con toda la familia en este tranquilo lugar para quedarse.

Disfruta del aire, paisaje y energía Del Valle de Elqui.",['Cocina'],,,Miriam,12-2014,https://www.airbnb.cl/rooms/796515020329393378?adults=1&children=0&infants=0&pets=0&check_in=2023-02-27&check_out=2023-03-04&previous_page_section_name=1000&federated_search_id=be067f45-f7eb-4d26-a792-3c258bc41705
177,"Casa, Segura con Piscina y Quincho a 900m del mar",Alojamiento entero,Coquimbo,6,6,3, Habitación,2,privado,155.0,-29.96364,-71.30645,"https://maps.google.com/maps?ll=-29.96364,-71.30645&z=14&t=m&hl=es&gl=CL&mapclient=apiv3",Lugar donde está emplazada la casa lugar tranquilo frente a plazas y sector familiar a pocos metros (900) playa para una agradable caminata y cercana a restaurantes,"Confortable Casa con Piscina y Quincho, Wifi Fibra Óptica, Estacionamiento Privado, en excelente sector, tranquilo ubicado en Peñuelas, Coquimbo. Cerca a 900m de la Playa, Restorán, Supermercado, Farmacias, Food Truck, Panaderías, Botillerías, Marisquerías, entre otros.

Cómodos 03 dormitorios, 02 baños, habilitada con 5 camas para 6 personas, 01 dormitorio matrimonial con cama 2 plazas, cocina full equipada.

Se aceptan mascotas (perritos, gatos, etc.).


La propiedad totalmente equipada, limpia y sanitizada para una estadía segura, como estar en tu propia casa, todo lo necesario con camas confortables.",['Acceso la playa Público o compartido'],,,Gabriel,07-2021,https://www.airbnb.cl/rooms/546422314977812852?adults=1&children=0&infants=0&pets=0&check_in=2023-02-24&check_out=2023-03-01&previous_page_section_name=1000&federated_search_id=be067f45-f7eb-4d26-a792-3c258bc41705
178,"Casa con Piscina, 4 Dormitorios.",Alojamiento entero,Pichidangui,9,8,4, Habitación,2,privado,130.0,-32.13928,-71.53131,"https://maps.google.com/maps?ll=-32.13928,-71.53131&z=14&t=m&hl=es&gl=CL&mapclient=apiv3","Lugar tranquila para descanzar, con negocios cercanos y rapido acceso a la playa.","Comoda casa equipada para 9 personas. Amplios espacios.

Con Piscina de 8 x 4 metros.

Terraza con Parilla a Gas.

A 800 metros de la costanera para acceder a la playa.

A 5 min en auto a la playa.
Cerca de la Iglesia y panaderias.

Estacionamiento para 4 autos.


Casa amplia especial para descanzar en familia. Full equipada.",['Wifi'],5.0,11,Viviana,01-2018,https://www.airbnb.cl/rooms/22649973?adults=1&children=0&infants=0&pets=0&check_in=2023-02-28&check_out=2023-03-06&previous_page_section_name=1000&federated_search_id=be067f45-f7eb-4d26-a792-3c258bc41705
179,Casa familiar Equipada Valle de Elqui (Cochiguaz),Casa de campo entero,Paihuano,8,5,4, Habitación,2,privado,160.0,-30.13864,-70.41325,"https://maps.google.com/maps?ll=-30.13864,-70.41325&z=14&t=m&hl=es&gl=CL&mapclient=apiv3","El entorno es natural, a 15 minutos está Montegrande (lugar del sepulcro de Gabriela Mistral) y 20 minutos Pisco Elqui, lugar donde se pueden visitar los viñedos y destilería de pisco, a tres minutos se encuentra el observatorio Cancana, lugar donde se realizan tours astronómicos. En el lugar no existe contaminación de ningún tipo. El vecino más cercano se encuentra a más de 800 metros. La paz y tranquilidad del lugar es impagable, acompañado del misticismo y de los cielos más claros del mundo, la mayor parte del año","Hermosa y acogedora casa para 8 personas, ubicada en el kilómetro 8,5 de Cochiguaz, a 15 minutos de Pisco Elqui. Lugar místico y hermoso, ideal para practicar deporte aventura como trekking, cabalgatas, excursiones, paseos, observar las estrellas (cielos estrellados más limpios del mundo), o simplemente descansar de una forma diferente en contacto con la naturaleza a los pie del monte Cancana (Piedra de Poder),  en lengua nativa, monte venerado por las antiguas culturas Molles y Diaguitas.


Se pueden alojar hasta 8 personas cómodamente, la casa consta de 3 cuartos equipados con camas de 2 plazas y 1 individual con cama de una plaza. Todos con ventanales grandes para mirar las estrellas desde la cama. El entorno es mágico, tranquilo, silencioso y de mucha paz,  enclavado en medio de las montañas de Cochiguaz, en contacto con la naturaleza, donde sólo se escucha el sonido del rio, las aves y el viento. A 15 Minutos en vehículo está Pisco Elqui. Cercano a importantes Pisqueras como los Nichos y Mistral, a 10 minutos está Montegrande donde se puede visitar el  Museo de Gabriela Mistral, la escuela y su tumba. A 3 minutos de la casa por el camino de Cochiguaz, está el Observatorio Cancana, donde podrá disfrutar de observaciones astronómicas.",['Cocina'],4.18,43,Erwan,05-2015,https://www.airbnb.cl/rooms/6462466?adults=1&children=0&infants=0&pets=0&check_in=2023-02-26&check_out=2023-03-03&previous_page_section_name=1000&federated_search_id=be067f45-f7eb-4d26-a792-3c258bc41705
180,increíble casa a pasos de playa Morrillos,Alojamiento entero,La Hacienda,11,10,4, Habitación,4,privado,335.495,-30.12549,-71.36779,"https://maps.google.com/maps?ll=-30.12549,-71.36779&z=14&t=m&hl=es&gl=CL&mapclient=apiv3",,"Casa con piscina, a pocos pasos  de la playa, 5 minutos caminando por el interior del condominio. 

Full equipada para 11 personas, cuenta con 4D y 4B, incluye sábanas y toallas.  Además tiene amplio living, comedor, cocina súper equipada, logia, piscina y gran terraza. 

El condominio se ubica al norte de los departamentos de morrillos, 15 minutos de coquimbo y 10  minutos de Guanaquero en auto.","['Acceso a playa Público o compartido', 'Frente a la playa']",,,Gonzalo,08-2022,https://www.airbnb.cl/rooms/698748564808746254?adults=1&children=0&infants=0&pets=0&check_in=2023-02-25&check_out=2023-03-02&previous_page_section_name=1000&federated_search_id=be067f45-f7eb-4d26-a792-3c258bc41705
181,Linda casa en Valle del Elqui,Alojamiento entero,Cochiguaz,10,9,5, Habitación,3,privado,250.0,-30.15006,-70.38392,"https://maps.google.com/maps?ll=-30.15006,-70.38392&z=14&t=m&hl=es&gl=CL&mapclient=apiv3",,"Un lugar único para pasarlo bien en familia con acceso directo al río y con una gran piscina. La casa está ubicada en el km 9 del camino de Cochiguaz y pertenece a un condominio privado lo cual asegura tranquilidad y privacidad.
La casa cuenta con 5 dormitorios con capacidad para 10 personas. Tiene 3 baños y cuenta con 2 refrigeradores medianos y lavadora. 
Se arrienda un mínimo de 7 días.",['Acceso a la playa'],,,Gustavo,08-2016,https://www.airbnb.cl/rooms/800713745373100331?adults=1&children=0&infants=0&pets=0&check_in=2023-02-18&check_out=2023-02-24&previous_page_section_name=1000&federated_search_id=be067f45-f7eb-4d26-a792-3c258bc41705
182,Exclusiva casa con vista panorámica al mar,Alojamiento entero,Guanaquero,10,9,3, Habitación,2,privado,255.0,-30.19809,-71.41142,"https://maps.google.com/maps?ll=-30.19809,-71.41142&z=14&t=m&hl=es&gl=CL&mapclient=apiv3",En barrio residencial a 400 mts del mar,"Linda casa minimalista en altura, con gran vista al mar.
Acceso a playa, 5 minutos caminando.

Tres dormitorios, dos baños, cocina americana, loggia, lavadero y servicios.

No se permiten mascotas.",['Vista a la bahía'],5.0,4,Claudia,10-2021,https://www.airbnb.cl/rooms/52806803?adults=1&children=0&infants=0&pets=0&check_in=2023-03-01&check_out=2023-03-08&previous_page_section_name=1000&federated_search_id=be067f45-f7eb-4d26-a792-3c258bc41705
183,El mejor cielo de la cuarta región,Cabaña entero,La Higuera,8,6,2, Habitación,"1,5",privado,120.0,-29.3968,-71.1751,"https://maps.google.com/maps?ll=-29.3968,-71.1751&z=14&t=m&hl=es&gl=CL&mapclient=apiv3",,"Disfruta de una visita memorable cuando te quedes en este lugar único. Ven a disfrutar de un entorno natural en directa conexión con las estrellas y los Loros de tricahue, encontrarás la tranquilidad que necesitas en un espacio solo para ti con bello cielo, armonía y natural. El anfitrión los acompaña en todo momento, les enseña el lugar y su historia. Siempre dispuesto a lo que necesiten para que su estadía sea realmente mágica.

El espacio
Conexión directa conla naturaleza",['Cocina'],,,Soledad,04-2019,https://www.airbnb.cl/rooms/638441300046653879?adults=1&children=0&infants=0&pets=0&check_in=2023-02-18&check_out=2023-02-23&previous_page_section_name=1000&federated_search_id=be067f45-f7eb-4d26-a792-3c258bc41705
184,Hotel y Restaurant Rode Andacollo,Habitación privada en villa,Andacollo,2,1,5, Habitación,1privado,privado,50.0,-30.25437,-71.08434,"https://maps.google.com/maps?ll=-30.25437,-71.08434&z=14&t=m&hl=es&gl=CL&mapclient=apiv3","lugar fuera de la cuidad, a 5 min.","Maravilloso lugar ideal para descansar, desconectarse observando los cielos más limpios y estrellados.
Acceso a restaurant en el mismo lugar y cerca de la iglesia e historia minera de la zona.
Ubicado frente al observatorio Colloguara y la ruta Antakari.
(URL HIDDEN) 

Amplias habitaciones single, matrimoniales, King y conjuntos habitacionales familiares.


Alojamiento en un lugar tranquilo",['Wifi'],5.0,4,Carolina,10-2017,https://www.airbnb.cl/rooms/21587972?adults=1&children=0&infants=0&pets=0&check_in=2023-02-19&check_out=2023-02-24&previous_page_section_name=1000&federated_search_id=be067f45-f7eb-4d26-a792-3c258bc41705
185,Cabaña en Los Molles Vista al Mar,Alojamiento entero,Los Molles,5,4,2, Habitación,1,privado,65.0,-32.23447,-71.4977,"https://maps.google.com/maps?ll=-32.23447,-71.4977&z=14&t=m&hl=es&gl=CL&mapclient=apiv3","Zona muy. Tranquila apta.para el descanso, con una.mezcla.de playa y campo","Cabanas en parcela Con amplia vista al Mar, equipadas para 5 personas ,Piscina,  television Satelital HD, terraza , parrilla, gas de cañeria, todo lo necesario en utensilios de cocina e higiene, muy apropiado para el descanso,

El espacio
5 personas comodamemte en cabaña, parrillas exterior para asados, equipada completa para cocinar, 
dispone de mirador, juegos, Taca Taca, cama elástica,  cancha de voley y basketball, jardines, Iluminada exteriormente con paneles solares","['Acceso a la playa', 'Frente a la playa']",4.76,75,Monica,12-2016,https://www.airbnb.cl/rooms/16578018?adults=1&children=0&infants=0&pets=0&check_in=2023-02-27&check_out=2023-03-04&previous_page_section_name=1000&federated_search_id=be067f45-f7eb-4d26-a792-3c258bc41705
