,Titulo1,Titulo2,Comuna,Capacidad,Camas,N_Habitaciones,Habitaciones,Ba침os,Tipo_Ba침os,Precio,lat,lon,Ubicacion,Ubides,Descripcion,Servicios,Nota,Nnota,Anfitrion,Registro,Link
38,Casa Caleta Vieja Pichidangui,Alojamiento entero,Pichidangui,8,6,3, Habitaci칩n,1,privado,74.128,-32.1344,-71.5324,"https://maps.google.com/maps?ll=-32.1344,-71.5324&z=14&t=m&hl=es&gl=CL&mapclient=apiv3",Tranquilo,Rel치jate con toda la familia en este tranquilo lugar para quedarse.,['Vista al oc칠ano'],5.0,3,Claudio,12-2022,https://www.airbnb.cl/rooms/790674443303604894?adults=1&children=0&infants=0&pets=0&check_in=2023-03-01&check_out=2023-03-06&previous_page_section_name=1000&federated_search_id=4b673232-4497-470b-af29-6751c9e6dac9
39,Caba침a Guanaqueros Villamar,Caba침a entero,Guanaquero,4,3,2, Habitaci칩n,1,privado,75.41,-30.1976,-71.41458,"https://maps.google.com/maps?ll=-30.1976,-71.41458&z=14&t=m&hl=es&gl=CL&mapclient=apiv3","Balneario de Guanaqueros , excelente gastronom칤a de productos del mar , a 12 Km. del Balneario de Tongoy y 40 minutos de las ciudades de Coquimbo y La Serena.","Caba침a 2 dormitorios , 1 con cama europea matrimonial y 1 dormitorio con 2 camas europeas de 1 plaza ellas cuenta con ropa de cama inclu칤do s치banas.
 Ba침o moderno con ducha de plato , Wc y lavamanos a칠reo marca Roca.
Cocina completamente equipada, encimera el칠ctrica   con horno a gas  , microondas,  y refrigerador. 
Living Comedor para 4 persona.
Terraza frente a la caba침a, con asadera el칠ctrica.
Estacionamiento Privado.


Caba침a ideal para el descanso familiar ubicado en el Condominio Villamar, el cual cuenta con guardias privados, una plaza con juegos para ni침os y multicancha., playa ubicada a 7 min. dispone de de TV Cable  , asadera el칠ctrica y estacionamiento privado.",['Acceso la playa P칰blico o compartido'],5.0,4,Erika,12-2022,https://www.airbnb.cl/rooms/777618984747678253?adults=1&children=0&infants=0&pets=0&check_in=2023-03-06&check_out=2023-03-12&previous_page_section_name=1000&federated_search_id=4b673232-4497-470b-af29-6751c9e6dac9
40,Casa acogedora cerca del mar,Alojamiento entero,Guanaqueros,8,8,4, Habitaci칩n,2,privado,100.0,-30.19833,-71.41997,"https://maps.google.com/maps?ll=-30.19833,-71.41997&z=14&t=m&hl=es&gl=CL&mapclient=apiv3",,"Rel치jate con toda la familia en este alojamiento donde la tranquilidad se respira.
Arriendo Comoda casa disponible  desde d칤a jueves 23  febrero adelante.
Ubicada en cruce Guanaqueros-Tongoy, avenida principal frente a la bajada de la playa. Apto para 8 personas m치ximo, 4 dormitorios, 2 ba침os, cocina, lavander칤a, quincho y estacionamiento.",['Acceso a la playa'],,,Clara,06-2019,https://www.airbnb.cl/rooms/41349481?adults=1&children=0&infants=0&pets=0&check_in=2023-03-01&check_out=2023-03-06&previous_page_section_name=1000&federated_search_id=4b673232-4497-470b-af29-6751c9e6dac9
41,Casa Grande Guanaqueros,Alojamiento entero,Guanaquero,8,7,4, Habitaci칩n,2,privado,70.0,-30.19886,-71.41987,"https://maps.google.com/maps?ll=-30.19886,-71.41987&z=14&t=m&hl=es&gl=CL&mapclient=apiv3",Barrio residencial y muy tranquilo,"Casa completamente equipada para siete perdonas. Ubicada en balneario de Guanaqueros. Cada nueva de 150.mts cuadrados construidos

El espacio
Todas dependencias de la casa y sus exteriores",['Costa'],4.0,6,Ruben Antonio,01-2017,https://www.airbnb.cl/rooms/17040237?adults=1&children=0&infants=0&pets=0&check_in=2023-03-01&check_out=2023-03-06&previous_page_section_name=1000&federated_search_id=4b673232-4497-470b-af29-6751c9e6dac9
42,Casa con vista al mar a pasos de la playa,Alojamiento entero,Coquimbo,8,7,3, Habitaci칩n,3,privado,260.0,-30.12522,-71.37006,"https://maps.google.com/maps?ll=-30.12522,-71.37006&z=14&t=m&hl=es&gl=CL&mapclient=apiv3","La propiedad esta en la bahia de Guanaqueros, sobre la larga playa de MORILLOS aleda침a al humedal Adelaida. El lugar es de gran abundancia de aves y pesca (Lenguado, Corvina, Palometa...etc), esta pr칩xima a la caleta de Guanaqueros, dunas de morrillos, Las Tacas y Coquimbo.
La casa es de construcci칩n solida y buenas terminaciones, se ubica a solo 150 mts de la linea de alta marea de manera que la vista es espectacular ya cuenta con grandes ventanales que dan a la terraza. Cuenta con acceso privado a la playa.","Incre칤ble casa con espectacular vista al mar ubicada en segunda linea en condominio privado, a pasos de la playa ( 150 mts, 2 minutos caminando).

La casa tiene 3D  y 3B (1 en suit) cocina americana full equipada , living, comedor, terraza, logia con lavadora y secadora y patio de servicio. Con una capacidad de 8 personas.

Condominio cuenta con seguridad las 24 hrs con nochero y portero permanente.

Ubicado a  15 minutos de Guanaqueros y Coquimbo.


Casa nueva de hormig칩n, un piso (120m2 cubiertos) en parcela 5000 m2 . La propiedad tiene 3D, 3B (1 en suit) , cocina americana, living comedor, logia, patio de servicio, terraza de 50 m2 semi sombra, estacionamiento para 2 veh칤culos.
Actividades recreativas; playa, pesca, buceo, paseos en playa y laguna, naturaleza,  descanso, avistamiento de aves
Condominio cuenta con seguridad las 24 hrs  con portero y nochero permanentes","['Acceso a la playa', 'Frente a la playa']",4.77,13,Paula,02-2018,https://www.airbnb.cl/rooms/47011248?adults=1&children=0&infants=0&pets=0&check_in=2023-03-01&check_out=2023-03-06&previous_page_section_name=1000&federated_search_id=4b673232-4497-470b-af29-6751c9e6dac9
43,Tranquila caba침a cercana a playa grande Tongoy,Caba침a entero,Tongoy,5,4,2, Habitaci칩n,"1,5",privado,110.0,-30.28795,-71.49991,"https://maps.google.com/maps?ll=-30.28795,-71.49991&z=14&t=m&hl=es&gl=CL&mapclient=apiv3",,"Te esperamos en ""La Galerna"" un espacio pensado para quienes disfrutan de la desconexi칩n, la tranquilidad y las noches estrelladas, a solo minutos de las exquisitas playas y el centro de Tongoy.

Nuestra vista hacia los humedales te permite contemplar y ser parte de la naturaleza de la zona. 

Son 4 caba침as equipadas con todo lo necesario para una agradable estadia para 5 personas con estacionamiento privado, seguridad de un condominio de parcelas y acceso directo a Playa Grande.",['Acceso la playa P칰blico o compartido'],4.71,7,Concepcion,06-2019,https://www.airbnb.cl/rooms/734749436153234889?adults=1&children=0&infants=0&pets=0&check_in=2023-03-01&check_out=2023-03-06&previous_page_section_name=1000&federated_search_id=4b673232-4497-470b-af29-6751c9e6dac9
44,"Amplia y acogedora casa en Ensenada, Los Vilos.",Alojamiento entero,Los Vilos,10,9,5, Habitaci칩n,3,privado,150.0,-32.00606,-71.51124,"https://maps.google.com/maps?ll=-32.00606,-71.51124&z=14&t=m&hl=es&gl=CL&mapclient=apiv3","Ensenada es un condominio de parcelas muy tranquilo y seguro. Hay cuidador 24/7 y port칩n el칠ctrico. El entorno natural est치 compuesto principalmente por flora nativa de la regi칩n, lo que le da un encanto 칰nico. La playa del condominio es peque침a y muy pintorezca, tiene quitasoles y juegos para ni침os. Hay muchos lugares para caminar y ver la puesta de sol.","Amplia y acogedora casa inserta en parcela con jard칤n silvestre y vista al mar. La parcela se encuentra dentro del condominio ""Ensenada"", a 15 min al sur de Los Vilos y 15 min al norte de Pichidangui. La casa cuenta con una amplia terraza, piscina con reja de protecci칩n y un rico quincho. Tiene 5 amplios y c칩modos dormitorios,  3 ba침os completos, cocina equipada, lavadora, bosca y toyotomi. La hermosa playa privada del condominio est치 a 5 minutos caminando de la casa.


La casa tiene 5 dormitorios, 4 de ellos con camas matrimoniales y espacio de sobra para poner una cuna pack&play. El 5to dormitorio tiene 2 camarotes y una cama para acomodar ni침os. Hay 3 ba침os completos, todos con ventilaci칩n natural. La cocina est치 semi-incorporada al comedor a trav칠s de un mes칩n y cuenta con todo el equipamiento necesario para cocinar en familia. 

La terraza es muy amplia, soleada y protegida del viento. Contamos con dos quitasoles. La piscina tiene reja de seguridad y reposeras para poner dentro o fuera de la reja, seg칰n sea tu preferencia. El quincho cuenta con una gran parrilla, plancha y horno de barro. Es un espacio perfecto para pasar la tarde completa.",['Costa'],4.85,21,Mane,01-2015,https://www.airbnb.cl/rooms/39203969?adults=1&children=0&infants=0&pets=0&check_in=2023-03-06&check_out=2023-03-11&previous_page_section_name=1000&federated_search_id=4b673232-4497-470b-af29-6751c9e6dac9
45,Casa con vista panor치mica en Ocho Quebradas,Casa de campo entero,Los Vilos,6,5,3, Habitaci칩n,2,privado,180.0,-31.9589,-71.493,"https://maps.google.com/maps?ll=-31.9589,-71.493&z=14&t=m&hl=es&gl=CL&mapclient=apiv3",,"Casa nueva ubicada en Ochoquebradas. Un lugar 칰nico y tranquilo. Casa amplia y luminosa de espacios abiertos con sillones de terraza, parrilla y un gran terreno para que los ni침os jueguen y exploren la naturaleza.
Dentro de Ochoquebradas podr치s disfrutar de agradables caminatas por la antigua linea del tren que te llevar치 por un recorrido arquitect칩nico y natural inolvidable, as칤 como por m칰ltiples roquer칤os y quebradas.  Ubicado a tan solo 5 km de Los Vilos.",['Vista a la bah칤a'],5.0,9,Constanza,02-2021,https://www.airbnb.cl/rooms/673338942247476641?adults=1&children=0&infants=0&pets=0&check_in=2023-03-01&check_out=2023-03-06&previous_page_section_name=1000&federated_search_id=4b673232-4497-470b-af29-6751c9e6dac9
46,"Vacaciones , teletrabajo y Piscina en Los Mollles",Alojamiento entero,La Ligua,6,4,3, Habitaci칩n,2,privado,76.0,-32.238,-71.5158,"https://maps.google.com/maps?ll=-32.238,-71.5158&z=14&t=m&hl=es&gl=CL&mapclient=apiv3","Sector antiguo de Los Molles 2 cuadras a entrada del parque ecol칩gico Puquen. 5 cuadras de la playa (menos de 10 minutos a pie)
Cercano a negocios","Disfruta de la tranquilidad de Los Molles,  mi casa est치 situada en un tranquilo sector de Los Molles, si buscas descansar y disfrutar de la naturaleza este es el lugar indicado. 
Ideal para recargar energ칤as!!!

El espacio
La casa est치 totalmente equipada.  Tres dormitorios con tv cable, S치banas y toallas incluidos. 2 ba침os. 
Tenemos estacionamiento para 2 veh칤culos dentro de la propiedad.
En el exterior puedes disfrutar de la terraza con quincho. 
A partir de mayo frazadas el칠ctricas en todas las camas; estufa a gas. Ideal para disfrutar Los Molles en el invierno.
Wifi ideal para el teletrabajo.",['Acceso a la playa'],4.77,47,Paulina,06-2018,https://www.airbnb.cl/rooms/27329830?adults=1&children=0&infants=0&pets=0&check_in=2023-03-05&check_out=2023-03-10&previous_page_section_name=1000&federated_search_id=4b673232-4497-470b-af29-6751c9e6dac9
47,Casa Tongoy a minutos de Playa Socos!,Bungalow entero,Coquimbo,11,9,4, Habitaci칩n,2,privado,130.0,-30.2494,-71.4985,"https://maps.google.com/maps?ll=-30.2494,-71.4985&z=14&t=m&hl=es&gl=CL&mapclient=apiv3","La casa queda en la hermosa Pen칤nsula de Tongoy y tiene una vista privilegiada de la Bah칤a enfrentando el norte. En el 치rea hay s칩lo casas de veraneo de todo tipo y se respira un ambiente muy tranquilo y casi rural. Las calles son de tierra y las caminatas hacia el mirador y por el per칤metro son muy hermosas.

Los d칤as lunes y viernes hay una feria extraordinaria en la entrada de Tongoy para ir en familia y proveerte de todo tipo de v칤veres, ropa y cachivaches de todo tipo.

Tongoy se ubica en un 치rea bordeada por un sistema de humedales costeros de alta importancia para la conservaci칩n de especies animales y vegetales. Te recomiendo mucho ir acompa침ados con un gu칤a para develar toda su riqueza. Es frecuente ver especies como Cisnes Coscoroba, Taguas, Garzas de todo tipo, patos e incluso Flamencos. Es francamente conmovedor. Trae contigo toda la basura que generes.

Durante los meses de Julio a Octubre es probable que puedas ver el desierto florido en pleno en los roquer칤os costeros de la Pen칤nsula. Es completamente m치gico. Te recomiendo una caminata por ellos sin arrancar flores y mirando bien por donde caminas.","Renovada casa de playa r칰stica ubicada en la Pen칤nsula de Tongoy. Ideal para ir apatotados en familia! 4 habitaciones en total. Dos camas matrimoniales y 7 individuales.  Terraza con preciosa vista, lavadora/secadora, cocina totalmente equipada, parrilla para asados. Vista a la Bah칤a de Tongoy, a siete minutos caminando de Playa Socos. Una oportunidad para relajarse totalmente y disfrutar en familia y recargar energ칤a!
Ojo: esta casa no tiene wifi ni tampoco televisor, nos gusta as칤.


La casa es un espacio muy tranquilo y de relajo espiritual. Hay mucha vida silvestre como aves de todo tipo (Diucas, Tencas, Picaflor del Norte, T칩rtolas, Tortolitas cuyanas, Loicas, Chincoles, Chercanes, Tiuques, Cometocino de Gay, Diuc칩n, Tijerales, Cachuditos, Yales, Chirig칲es, etc.) que llegan hasta el jard칤n. Para atraer estos cohabitantes alados, tenemos un peque침o bebedero en la parte de enfrente del jard칤n. Te invito a que lo rellenes de agua con la manguera que est치 a un costado. Ver치s c칩mo atrae a todo tipo de aves en la ma침ana y por las tardes.

Desde la terraza es posible divisar aves marinas y muy a menudo, delfines saltando en la Bah칤a.",['Vista al jard칤n'],4.78,27,Maripaz,06-2016,https://www.airbnb.cl/rooms/19909993?adults=1&children=0&infants=0&pets=0&check_in=2023-03-12&check_out=2023-03-19&previous_page_section_name=1000&federated_search_id=4b673232-4497-470b-af29-6751c9e6dac9
48,"Hermosa Caba침a en Los Molles, capacidad 5 personas",Caba침a entero,La Ligua,5,4,2, Habitaci칩n,1,privado,66.2,-32.2364,-71.51344,"https://maps.google.com/maps?ll=-32.2364,-71.51344&z=14&t=m&hl=es&gl=CL&mapclient=apiv3",Sector residencial,"hermosas caba침as pareadas, est치 ubicada en sector residencial de Los Molles, a pasos de Bio parque Puqu칠n y playa. Desde sus balcones se puede apreciar el mar. Lugar c칩modo y familiar. 
El balneario es muy tranquilo y la playa es apta para el ba침o y casi sin oleaje. Hay tiendas de buceo y surf, adem치s de una variada oferta gastron칩mica.


Caba침as r칰sticas equipadas para 5 huespedes, muy c칩modas. Cuenta con todo lo necesario para disfrutar del tiempo libre, TV cable, wiffi, terraza.",['Costa'],4.66,29,Marcelo,09-2016,https://www.airbnb.cl/rooms/31262589?adults=1&children=0&infants=0&pets=0&check_in=2023-03-01&check_out=2023-03-06&previous_page_section_name=1000&federated_search_id=4b673232-4497-470b-af29-6751c9e6dac9
49,CASA EN PLAYA LA HERRADURA COQUIMBO,Alojamiento entero,Coquimbo,9,8,3, Habitaci칩n,1,privado,70.0,-29.98134,-71.35144,"https://maps.google.com/maps?ll=-29.98134,-71.35144&z=14&t=m&hl=es&gl=CL&mapclient=apiv3","Coquimbo est치 a 11 km. de La Serena.
La Playa La Herradura tiene una extensi칩n de 4 km. Se caracteriza por sus aguas tranquilas, ideal para nadar sin riesgos.","Vista incomparable, a 42 pasos de la playa.100 mt. CONSTRU칈DOS.
COCINA AMERICANA,CON BAR.
REFRIGERADOR,COCINA,
MICROONDAS,LAVADORA.
TV CABLE.
LIVING CON 2 SOFA CAMA 2 PLAZAS.
3 DORMITORIOS
TERRAZA (TECHO),DE 100 MT.2
ESTACIONAMIENTO (2 veh칤culos)
ALARMA


LIVING CON 2 SOFA CAMA DE 2 PLAZAS,
3 DORMITORIOS:
     -Principal con cama de 2 pz.
     -2췈 Cama de 1 pz. y camarote de 1 1/2 abajo y 1 pz. arriba.
     -3췈 Camarote de 1 1/2 abajo y 1 pz. arriba.
TERRAZA(TECHO),DE 100 MT.
ESTACIONAMIENTO (2 veh칤culos)
ALARMA.
PRIMERA L칇NEA FRENTE AL MAR",['Vista a la bah칤a'],,,Gema,05-2015,https://www.airbnb.cl/rooms/6498425?adults=1&children=0&infants=0&pets=0&check_in=2023-03-06&check_out=2023-03-11&previous_page_section_name=1000&federated_search_id=4b673232-4497-470b-af29-6751c9e6dac9
50,Casa adecuada para descansar frente a Pichidangui.,Habitaci칩n privada en alojamiento,Regi칩n de Coquimbo,4,4,2, Habitaci칩n,2,privado,49.0,-32.11821,-71.5026,"https://maps.google.com/maps?ll=-32.11821,-71.5026&z=14&t=m&hl=es&gl=CL&mapclient=apiv3","Contamos con amplio comercio a pocas cuadras del condominio y a precios muy convenientes (frutas, verduras, supermercado, mermeladas caseras, longanizas de Chill치n, queso de cabra, carnes de primera, peluquer칤a, etc.).","Caba침a de dos pisos con linda vista al mar y ubicada en un condominio cercano al km 200 de la Ruta 5 Norte y a 6 min del mar, posee:
- 2춿 piso con dormitorio con cama matrimonial, ba침o con tina  y techo de vidrio, adem치s, living -comedor-cocina americana.
- 3춿 piso independiente con dormitorio, cama matrimonial, techo de vidrio, ba침o, salita de estar,  terraza panor치mica con cama de cuarzo.
-  quincho y parrilla,  estacionamiento,  jard칤n.
-  agua potable.
 Es atendida por su propio due침o.


Alojamiento muy acogedor y con linda vista al mar",['Vista a la bah칤a'],4.86,49,Patricio,11-2018,https://www.airbnb.cl/rooms/36571749?adults=1&children=0&infants=0&pets=0&check_in=2023-03-01&check_out=2023-03-06&previous_page_section_name=1000&federated_search_id=4b673232-4497-470b-af29-6751c9e6dac9
51,Acogedora caba침a frente al Mar,Caba침a entero,Los Vilos,4,3,2, Habitaci칩n,1,privado,95.0,-31.90809,-71.49316,"https://maps.google.com/maps?ll=-31.90809,-71.49316&z=14&t=m&hl=es&gl=CL&mapclient=apiv3","En el mismo lugar existe un parque de esculturas que se puede visitar caminando, muy lindo","Mi caba침a esta a 8 km de Los Vilos en un lugar maravilloso, tranquilo, donde podr치n ver atardeceres preciosos",['Vista al mar'],4.76,21,Gladys,11-2017,https://www.airbnb.cl/rooms/48721634?adults=1&children=0&infants=0&pets=0&check_in=2023-03-01&check_out=2023-03-06&previous_page_section_name=1000&federated_search_id=4b673232-4497-470b-af29-6751c9e6dac9
52,Flores y Mar,Caba침a entero,Tongoy,4,4,2, Habitaci칩n,1,privado,85.0,-30.25162,-71.50385,"https://maps.google.com/maps?ll=-30.25162,-71.50385&z=14&t=m&hl=es&gl=CL&mapclient=apiv3",,"Caba침a r칰stica, junto al mar. Disfruta de la tranquilidad de este para칤so. Los jardines est치n dise침ados para relajarse y sentir la naturaleza.
Cuenta con un hermoso quincho con vista al mar. 


(Tarifa aplica para hasta 4 pax
US 20 por persona extra 
Hasta 6 pax maximo x noche)","['Acceso a la playa', 'Frente a la playa']",4.63,17,Gonz,02-2016,https://www.airbnb.cl/rooms/21039234?adults=1&children=0&infants=0&pets=0&check_in=2023-03-04&check_out=2023-03-09&previous_page_section_name=1000&federated_search_id=4b673232-4497-470b-af29-6751c9e6dac9
53,"GRAN CASA DE VERANEO FRENTE AL MAR, Guanaqueros",Alojamiento entero,Coquimbo,14,12,8, Habitaci칩n,5,privado,235.0,-30.19315,-71.40479,"https://maps.google.com/maps?ll=-30.19315,-71.40479&z=14&t=m&hl=es&gl=CL&mapclient=apiv3",Solo casas de veraneo. Tranquilo y silencioso.,"En GUANAQUEROS. 
C칩moda casa para 14 personas. Acceso directo a playa privada.
Gran living y comedor. Sala de estar, sector de asados, terraza.

Se encuentra dentro de condominio privado con acceso controlado. La casa es exclusiva para los hu칠spedes. No se comparte con nadie.

Ba침os con ducha.
Sector de lavander칤a.
Tiene todo tipo de elementos de cocina (platos, vasos, ollas, etc).
Incluye implementos b치sicos de aseo.

Se requiere llevar s치banas y toallas. Solo tiene crubrecamas y cojines.


Son 4 habitaciones matrimoniales.
Hay 1 dormitorio de servicio con ba침o.
Hay 2 piezas con 2 camas y otra pieza con 3 camas.

Total 16 personas.

4 ba침os adem치s del de servicio.","['Acceso a la playa', 'Frente a la playa']",5.0,6,Valentina,02-2017,https://www.airbnb.cl/rooms/35420560?adults=1&children=0&infants=0&pets=0&check_in=2023-03-01&check_out=2023-03-06&previous_page_section_name=1000&federated_search_id=4b673232-4497-470b-af29-6751c9e6dac9
54,"Arriendo casa en condominio, Los Molles",Alojamiento entero,Los Molles,6,2,2, Habitaci칩n,2,privado,110.0,-32.22335,-71.5096,"https://maps.google.com/maps?ll=-32.22335,-71.5096&z=14&t=m&hl=es&gl=CL&mapclient=apiv3","La casa est치 emplazada en un condominio privado, por lo que es un lugar seguro. Cuenta con caminos interiores donde es posible salir a trotar o andar en bicicleta.","Lugares de inter칠s: Parque El Puquen. Te va a encantar mi espacio por porque el lugar es hermoso, muy tranquilo para descansar y disfrutar con la familia. Mi alojamiento es bueno para parejas y familias (con hijos). La casa est치 ubicada en condominio rocas del mar.

El espacio
Adem치s de contar con una cama king y una matrimonial, la casa cuenta con dos futones, por lo que la capacidad de 칠sta, es para 6 personas.",['Costa'],4.83,50,Alexandra,11-2016,https://www.airbnb.cl/rooms/16095543?adults=1&children=0&infants=0&pets=0&check_in=2023-03-10&check_out=2023-03-15&previous_page_section_name=1000&federated_search_id=e85027d3-35b8-469e-b28c-412266ac9d55
55,Acogedora caba침a frente al Mar,Caba침a entero,Los Vilos,4,3,2, Habitaci칩n,1,privado,95.0,-31.90809,-71.49316,"https://maps.google.com/maps?ll=-31.90809,-71.49316&z=14&t=m&hl=es&gl=CL&mapclient=apiv3","En el mismo lugar existe un parque de esculturas que se puede visitar caminando, muy lindo","Mi caba침a esta a 8 km de Los Vilos en un lugar maravilloso, tranquilo, donde podr치n ver atardeceres preciosos",['Vista al mar'],4.76,21,Gladys,11-2017,https://www.airbnb.cl/rooms/48721634?adults=1&children=0&infants=0&pets=0&check_in=2023-03-01&check_out=2023-03-06&previous_page_section_name=1000&federated_search_id=e85027d3-35b8-469e-b28c-412266ac9d55
56,"Hermosa Caba침a en Los Molles, capacidad 5 personas",Caba침a entero,La Ligua,5,4,2, Habitaci칩n,1,privado,66.2,-32.2364,-71.51344,"https://maps.google.com/maps?ll=-32.2364,-71.51344&z=14&t=m&hl=es&gl=CL&mapclient=apiv3",Sector residencial,"hermosas caba침as pareadas, est치 ubicada en sector residencial de Los Molles, a pasos de Bio parque Puqu칠n y playa. Desde sus balcones se puede apreciar el mar. Lugar c칩modo y familiar. 
El balneario es muy tranquilo y la playa es apta para el ba침o y casi sin oleaje. Hay tiendas de buceo y surf, adem치s de una variada oferta gastron칩mica.


Caba침as r칰sticas equipadas para 5 huespedes, muy c칩modas. Cuenta con todo lo necesario para disfrutar del tiempo libre, TV cable, wiffi, terraza.",['Costa'],4.66,29,Marcelo,09-2016,https://www.airbnb.cl/rooms/31262589?adults=1&children=0&infants=0&pets=0&check_in=2023-03-01&check_out=2023-03-06&previous_page_section_name=1000&federated_search_id=e85027d3-35b8-469e-b28c-412266ac9d55
57,Caba침a II Guanaqueros arriendo solo a familias,Caba침a entero,Guanaqueros,5,4,2, Habitaci칩n,1,privado,95.0,-30.19424,-71.4026,"https://maps.google.com/maps?ll=-30.19424,-71.4026&z=14&t=m&hl=es&gl=CL&mapclient=apiv3",,"Caba침as  equipadas para 5 personas  en exclusivo condominio  Guanaqueros, el mejor lugar para disfrutar , a 5 min caminado a la playa  . Con acceso controlado al condominio y la playa solo para residentes o propietarios.

El espacio
Unos de los mejores lugares por su ubicaci칩n cercan칤a a la playa las caba침as est치n distanciadas unas de otras y el auto queda a la puerta de la caba침a . Todo esto en un terreno de 2500 mts2 cercados y con un port칩n de acceso a las caba침as y al de condominio se ocupa un control remoto , cada caba침a esta equipada con cobertores y polar m치s almohadas para cada cama",['Costa'],5.0,9,Ivan,10-2018,https://www.airbnb.cl/rooms/31065470?adults=1&children=0&infants=0&pets=0&check_in=2023-03-01&check_out=2023-03-06&previous_page_section_name=1000&federated_search_id=e85027d3-35b8-469e-b28c-412266ac9d55
58,Escapada a la Playa! 游끴,Caba침a entero,La Ligua,5,4,2, Habitaci칩n,2,privado,60.0,-32.28103,-71.4705,"https://maps.google.com/maps?ll=-32.28103,-71.4705&z=14&t=m&hl=es&gl=CL&mapclient=apiv3","La ballena se encuentra en el KM 180 de la ruta 5 norte. Es un lugar tranquilo, especial para personas que buscan el descanso y disfrutar de la playa.
La caba침a se encuentra a pasos del mar y de la carretera, y cerca de la avenida principal donde podr치n encontrar almacenes, los cuales se encuentran abiertos todo el a침o.","Hermosa caba침a para 5 personas a pasos de la playa, ubicada en La Ballena, sector playa los Quinquelles. (KM 180, ruta 5 norte) 

La caba침a cuanta con:
- 2 dormitorios
- 2 Ba침os (1 en suite matrimonial) 
- Estacionamiento para m치s de un veh칤culo
- Cocina equipada.
- Living
- TV Cable
- Internet (Wifi)
- Terraza 
- Parrilla exterior
- Patio amplio.


C칩moda caba침a totalmente equipada para 5 personas.","['Acceso a la playa', 'Frente a la playa']",4.57,35,Guillermo,01-2019,https://www.airbnb.cl/rooms/41689866?adults=1&children=0&infants=0&pets=0&check_in=2023-03-01&check_out=2023-03-06&previous_page_section_name=1000&federated_search_id=e85027d3-35b8-469e-b28c-412266ac9d55
