,Titulo1,Titulo2,Comuna,Capacidad,Camas,N_Habitaciones,Habitaciones,Ba침os,Tipo_Ba침os,Precio,lat,lon,Ubicacion,Ubides,Descripcion,Servicios,Nota,Nnota,Anfitrion,Registro,Link
59,Casa de dise침o a pasos de la playa WIFI,Alojamiento entero,Los Molles,8,7,3, Habitaci칩n,2,privado,121.0,-32.24044,-71.51468,"https://maps.google.com/maps?ll=-32.24044,-71.51468&z=14&t=m&hl=es&gl=CL&mapclient=apiv3",,"Vista panor치mica a la playa y el mar, 3 dormitorios, 2 ba침os, para 8 personas. Gran arquitectura, destacada en publicaciones del ramo. 3 balcones con vista al mar y playa, incluyendo uno donde se pueden hacer asados o cenar. Columpio infantil , hamaca, parrilla. A pasos de la playa y de la Reserva el Puqu칠n. Wifi banda ancha fibra 칩ptica (zoom, teams).  Dos habitaciones con escritorio para teletrabajo. Tv satelital, Android TV y Blu Ray colecci칩n de pel칤culas. Equipo de audio para pel칤culas.


Hermosa casa vista al mar y la playa, 3 dormitorios, 2 ba침os, capacidad para 8 personas. Dos pisos, en el primero living comedor, terraza, cocina, dos dormitorios y ba침o. En el segundo, dormitorio con cama doble, terraza, ba침o en suite y espectacular vista al mar. Tambi칠n en el segundo piso, una terraza principal con vista al mar y a la playa, donde se pueden hacer asados, almorzar o cenar. Casa de gran arquitectura, destacada en libros del ramo y publicaciones de dise침o Siete camas, una de dos plazas y seis de una plaza. Adicionalmente hay una cama nido que se puede usar para un ni침o 
 Columpio infantil en el patio 
 Hamaca en balc칩n 
 Parrilla 
 Estacionamientos 
 A pasos de la playa y de la Reserva Natural Puqu칠n 
 TV satelital, Android TV y Blu-Ray con colecci칩n de pel칤culas. Equipo de audio para pel칤culas. Con el Android TV se pueden ver servicios de streaming como Netflix o Amazon Prime (el pasajero debe proveer la cuenta de alguna de estas plataformas) 

Wifi banda ancha fibra 칩ptica, ideal para teletrabajar con zoom, meets o teams. Escritorio de trabajo

Hay descuentos por estad칤as largas 

No fumar dentro de la casa.

Hay dos habitaciones con escritorio y silla para trabajo o estudio remoto. 

Internet wifi fibra 칩ptica.

La mesa fija del comedor es peque침a, apta para cuatro o cinco personas m치ximo. Adicionalmente hay una mesa armable, con bancas armables, para seis u ocho personas, que se puede disponer en el balc칩n del primer piso, al interior del living-comedor o en la terraza principal. 

Por protocolos COVID-19, no se proveen tollas ni s치banas, los pasajeros deben traer las propias. 

Se admiten mascotas pero bajo completa responsabilidad de sus due침os. Se debe dar aviso y dejar un dep칩sito de 50 mil pesos por posibles da침os.

La casa est치 justo en la zona segura para tsunamis. Si hay alarma, hay que quedarse en la casa.

S칤guenos en nuestra cuenta de IG @casanave_losmolles",['Acceso la playa P칰blico o compartido'],4.91,35,Carmen Gloria,02-2021,https://www.airbnb.cl/rooms/48315175?adults=1&children=0&infants=0&pets=0&check_in=2023-03-14&check_out=2023-03-19&previous_page_section_name=1000&federated_search_id=e85027d3-35b8-469e-b28c-412266ac9d55
60,"Casa, vista al mar, a pasos de la playa Los Molles",Caba침a entero,La Ligua,6,6,3, Habitaci칩n,"2,5",privado,120.0,-32.24117,-71.51213,"https://maps.google.com/maps?ll=-32.24117,-71.51213&z=14&t=m&hl=es&gl=CL&mapclient=apiv3",,"Casa completamente equipada a pasos de la costanera y la playa. 
Espectacular vista desde el dormitorio principal, luminosa con rincones muy acogedores. Cuenta con bosca con calefacci칩n a pellet.
Ubicaci칩n privilegiada (segunda linea del mar), accesible a comercios y equipamientos de este balneario que conserva la tranquilidad y caracter칤sticas propias de la localidad. 
Podr치s disfrutar tambi칠n del BioParque Puqu칠n. Destacado como uno de los mejores lugares para realizar buceo. Para 6 personas.","['Acceso a la playa', 'Frente a la playa']",4.80,10,Mane,06-2016,https://www.airbnb.cl/rooms/35961974?adults=1&children=0&infants=0&pets=0&check_in=2023-03-01&check_out=2023-03-08&previous_page_section_name=1000&federated_search_id=e85027d3-35b8-469e-b28c-412266ac9d55
61,Hermosa casa a 100 m de playa y 5 min de Enjoy,Alojamiento entero,La Serena,10,7,4, Habitaci칩n,2,privado,145.0,-29.94297,-71.28735,"https://maps.google.com/maps?ll=-29.94297,-71.28735&z=14&t=m&hl=es&gl=CL&mapclient=apiv3","Cornely 2 se encuentra en un sector tranquilo, con vigilancia constante dado que se encuentra en un sector tur칤stico concurrido. Tendr치s negocios para realizar compras diarias y lo mejor es que puedes acceder caminando a la playa y al Casino Enjoy (5 minutos)","Cornely 2 es una propiedad Pet Friendly que se encuentra ubicada en un sector privilegiado, tranquilo y su cercano a la playa. En tan solo 2 minutos caminando podr치s llegar a la playa, donde podr치s disfrutar un hermoso entorno. En Cornely 2 podr치s disfrutar del sol en el amplio jard칤n trasero que cuenta con quincho y todo tener una linda tarde. 
Cercano a nuestra propiedad podr치s encontrar arriendo de bicicletas, ferias con food truck, ferias estivales y a pocos metros el casino Enjoy.


La casa cuenta con 4 dormitorios con closet.

2 dormitorios con cama matrimonial y amplio closet.

El tercer dormitorio cuenta con 1 cama de una plaza  y un camarote con 2 camas de 1 plaza.  

El cuarto dormitorio consta con 2 camas de una plaza. 

La casa cuenta con 2 ba침os, ambos con tina y duchas. 

Las camas cuentas con almohadas, frazadas y cobertores (las sabanas tienen un costo adicional). La cocina esta equipada con refrigerador, hervidor, microondas, tostadora, horno y cocina, ollas, sartenes, vasos, vajillas, platos, tazas.

La propiedad cuenta con un hermoso y amplio patio trasero, el cual cuenta con un quincho para asados y un comedor para disfrutar con los seres queridos. Adem치s de un amplio espacio con plantas y pasto para poder jugar y disfrutar del sol.",['Costa'],5.0,3,Alejandra,01-2018,https://www.airbnb.cl/rooms/36674730?adults=1&children=0&infants=0&pets=0&check_in=2023-03-01&check_out=2023-03-07&previous_page_section_name=1000&federated_search_id=e85027d3-35b8-469e-b28c-412266ac9d55
62,Punta de choros (Geochoros),Caba침a entero,Conquimbo,6,5,2, Habitaci칩n,1,privado,75.0,-29.2466,-71.4611,"https://maps.google.com/maps?ll=-29.2466,-71.4611&z=14&t=m&hl=es&gl=CL&mapclient=apiv3","El vecindario es tranquilo como el pueblo, se puede caminar y hacer deportes de forma segura.","Caba침as amobladas con cocina y ba침o privado muy cerca de playa, lugar amplios y seguro.

ojo son caba침as ...3 caba침as independientes. Es decir quien arriende es por caba침a la que tiene dos habitaciones ( pieza matrimonial mas pieza con dos camarotes) living, cocina y ba침o.  Todo esto comprende una caba침a.

 importante :   el valor es por cada caba침a por noche (son 3 caba침as con espacio de 6 personas cada una).   *********


El lugar es comodo , seguro, cercano de la playa a unos 3 minutos caminando, contamos con dos espacios para asados y bancas.",['Costa'],4.50,15,Antonio,02-2018,https://www.airbnb.cl/rooms/23459215?adults=1&children=0&infants=0&pets=0&check_in=2023-03-05&check_out=2023-03-11&previous_page_section_name=1000&federated_search_id=e85027d3-35b8-469e-b28c-412266ac9d55
63,Casa adecuada para descansar frente a Pichidangui.,Habitaci칩n privada en alojamiento,Regi칩n de Coquimbo,4,4,2, Habitaci칩n,2,privado,49.0,-32.11821,-71.5026,"https://maps.google.com/maps?ll=-32.11821,-71.5026&z=14&t=m&hl=es&gl=CL&mapclient=apiv3","Contamos con amplio comercio a pocas cuadras del condominio y a precios muy convenientes (frutas, verduras, supermercado, mermeladas caseras, longanizas de Chill치n, queso de cabra, carnes de primera, peluquer칤a, etc.).","Caba침a de dos pisos con linda vista al mar y ubicada en un condominio cercano al km 200 de la Ruta 5 Norte y a 6 min del mar, posee:
- 2춿 piso con dormitorio con cama matrimonial, ba침o con tina  y techo de vidrio, adem치s, living -comedor-cocina americana.
- 3춿 piso independiente con dormitorio, cama matrimonial, techo de vidrio, ba침o, salita de estar,  terraza panor치mica con cama de cuarzo.
-  quincho y parrilla,  estacionamiento,  jard칤n.
-  agua potable.
 Es atendida por su propio due침o.


Alojamiento muy acogedor y con linda vista al mar",['Vista a la bah칤a'],4.86,49,Patricio,11-2018,https://www.airbnb.cl/rooms/36571749?adults=1&children=0&infants=0&pets=0&check_in=2023-03-01&check_out=2023-03-06&previous_page_section_name=1000&federated_search_id=e85027d3-35b8-469e-b28c-412266ac9d55
64,Tongoy Agradable casa nueva en condominio,Alojamiento entero,Coquimbo,6,5,3, Habitaci칩n,1,privado,80.0,-30.2565,-71.47439,"https://maps.google.com/maps?ll=-30.2565,-71.47439&z=14&t=m&hl=es&gl=CL&mapclient=apiv3","Condominio con 치reas comunes de recreaci칩n; piscina , cancha babyfutbol, plazas y 치reas de caminata o bicicletas.","Lugares de inter칠s: Condominio cercano a Tongoy con playas tranquilas, se puede realizar canoa y navegaci칩n. Muchos restaurantes de buena calidad. Existen Buses y taxiscolectivos desde y hacia La Serena y Coquimbo. Aeropuerto en La Serena.. Te va a encantar mi espacio por el ambiente, El barrio, la luz, la comodidad de la cama y las zonas exteriores. Mi alojamiento es bueno para familias (con hijos). Adem치s, se implement칩 otra piscina para ni침os muy cerca de la casa y cancha de tenis y futbol.


Lugar de encuentro familiar tranquilo con observaci칩n de flora y fauna silvestre",['Acceso la playa P칰blico o compartido'],5.0,3,Ariel,03-2017,https://www.airbnb.cl/rooms/30936531?adults=1&children=0&infants=0&pets=0&check_in=2023-03-06&check_out=2023-03-11&previous_page_section_name=1000&federated_search_id=e85027d3-35b8-469e-b28c-412266ac9d55
65,Casa 3 dormitorio con vista al mar,Alojamiento entero,Pichidangui,6,6,3, Habitaci칩n,2,privado,110.0,-32.13556,-71.53481,"https://maps.google.com/maps?ll=-32.13556,-71.53481&z=14&t=m&hl=es&gl=CL&mapclient=apiv3",Est치 frente al paseo de la costanera y lo tur칤stico de balneario,"Casa grande con vista panor치mica del mar, muy c칩moda, con chimenea, jacuzzi y todo lo necesario para tener una agradable estad칤a","['Acceso a playa P칰blico o compartido', 'Frente a la playa']",4.61,46,Ruby Sabrina,11-2016,https://www.airbnb.cl/rooms/20267504?adults=1&children=0&infants=0&pets=0&check_in=2023-03-05&check_out=2023-03-12&previous_page_section_name=1000&federated_search_id=e85027d3-35b8-469e-b28c-412266ac9d55
66,Cruzas la calle y est치s en la playa!,Alojamiento entero,Los Molles,8,7,3, Habitaci칩n,2,privado,100.0,-32.23821,-71.51241,"https://maps.google.com/maps?ll=-32.23821,-71.51241&z=14&t=m&hl=es&gl=CL&mapclient=apiv3","La casa est치 al frente de la playa, cerca de toda la zona de comercio de los Molles, tambi칠n est치 cerca de todos los atractivos tur칤sticos de la zona","Al frente de la playa, solo cruzas la calle  y ya est치s en la arena!...cerca de todo el comercio restaurantes, almacenes etc, llegas y te olvidas del auto!
3 dorm, dos ba침os, estacionamiento para dos autos, una Tereza en alto para ver mejor la playa de Los Molles.
Cerca de todos los restorant y comercio de los molles.
Parrilla a carb칩n.
Cuenta con rampa para silla de ruedas o coche de beb칠
La estad칤a no incluye s치banas ni toallas


La casa se encuentra al frente de la playa de Los Molles... ubicaci칩n ideal para disfrutar de tus d칤as de descanso, muy central cerca de todos los restorant, almacenes, feria artesanal, atractivos naturales puquen, rocas negras, las Terrazas...","['Acceso a la playa', 'Frente a la playa']",4.76,39,Mariajose,02-2016,https://www.airbnb.cl/rooms/22921404?adults=1&children=0&infants=0&pets=0&check_in=2023-03-07&check_out=2023-03-12&previous_page_section_name=1000&federated_search_id=e85027d3-35b8-469e-b28c-412266ac9d55
67,Flores y Mar,Caba침a entero,Tongoy,4,4,2, Habitaci칩n,1,privado,85.0,-30.25162,-71.50385,"https://maps.google.com/maps?ll=-30.25162,-71.50385&z=14&t=m&hl=es&gl=CL&mapclient=apiv3",,"Caba침a r칰stica, junto al mar. Disfruta de la tranquilidad de este para칤so. Los jardines est치n dise침ados para relajarse y sentir la naturaleza.
Cuenta con un hermoso quincho con vista al mar. 


(Tarifa aplica para hasta 4 pax
US 20 por persona extra 
Hasta 6 pax maximo x noche)","['Acceso a la playa', 'Frente a la playa']",4.63,17,Gonz,02-2016,https://www.airbnb.cl/rooms/21039234?adults=1&children=0&infants=0&pets=0&check_in=2023-03-04&check_out=2023-03-09&previous_page_section_name=1000&federated_search_id=e85027d3-35b8-469e-b28c-412266ac9d55
68,Caba침a a pasos de la playa (7),Caba침a entero,Coquimbo,4,3,2, Habitaci칩n,1,privado,45.0,-29.9478,-71.2906,"https://maps.google.com/maps?ll=-29.9478,-71.2906&z=14&t=m&hl=es&gl=CL&mapclient=apiv3",,"Caba침a equipada para 4 personas, tenemos 16 caba침as en total, cada caba침a tiene un estacionamiento disponible. Ubicada en el epicentro de Pe침uelas, al lado del Casino Enjoy, a una cuadra de la playa, cercana a restaurantes, pubs, centros comerciales, outlet, servicentros, a dos cuadras de la carretera panamericana RUTA 5. La playa es la m치s tranquila y de mejor oleaje para disfrutar de la calidez del clima.",['Acceso a la playa'],,,Caba침as Pe침uelas Diamond,12-2022,https://www.airbnb.cl/rooms/801575400989874468?adults=1&children=0&infants=0&pets=0&check_in=2023-03-01&check_out=2023-03-06&previous_page_section_name=1000&federated_search_id=e85027d3-35b8-469e-b28c-412266ac9d55
69,Casa granero en Playa Grande Tongoy,Caba침a entero,Tongoy,6,5,3, Habitaci칩n,"1,5",privado,150.0,-30.2946,-71.5367,"https://maps.google.com/maps?ll=-30.2946,-71.5367&z=14&t=m&hl=es&gl=CL&mapclient=apiv3","El barrio es principalmente naturaleza, un humedal, el oc칠ano y la playa.","Esta casa, ha sido especialmente dise침ada  para disfrutar del entorno natural. Para experimentar la puesta de sol desde su terraza en la azotea. Un lugar que evoca las antiguas casas de campo, combinadas con productos contempor치neos.

Acceso de los hu칠spedes
Los hu칠spedes podr치n acceder al espacio completo de la casa, al gran jard칤n y a las instalaciones exteriores. Los hu칠spedes tambi칠n pueden llegar al humedal en un par de minutos o caminar a la hermosa playa a solo 15 minutos de la casa",['Vista al valle'],5.0,3,Jorge,05-2015,https://www.airbnb.cl/rooms/665518914328051294?adults=1&children=0&infants=0&pets=0&check_in=2023-03-01&check_out=2023-03-06&previous_page_section_name=1000&federated_search_id=e85027d3-35b8-469e-b28c-412266ac9d55
70,Casa de piedra los Molles,Alojamiento entero,Los Molles,4,2,2, Habitaci칩n,2,privado,70.0,-32.23643,-71.51801,"https://maps.google.com/maps?ll=-32.23643,-71.51801&z=14&t=m&hl=es&gl=CL&mapclient=apiv3",,"La casa se ubica en un barrio privilegiado de los Molles, tranquilo y seguro.

Acceso de los hu칠spedes
La propiedad tiene dos casa que son independientes pero tienen una misma entrada.",['Costa'],4.67,3,Silvana,03-2016,https://www.airbnb.cl/rooms/31265736?adults=1&children=0&infants=0&pets=0&check_in=2023-03-01&check_out=2023-03-08&previous_page_section_name=1000&federated_search_id=e85027d3-35b8-469e-b28c-412266ac9d55
71,Acogedora casa en Los Vilos,Alojamiento entero,Los Vilos,6,7,3, Habitaci칩n,2,privado,54.0,-31.90259,-71.49527,"https://maps.google.com/maps?ll=-31.90259,-71.49527&z=14&t=m&hl=es&gl=CL&mapclient=apiv3",,"Rel치jate con toda la familia en esta casa
acogedora ubicada en Los Vilos, donde la
tranquilidad se respira, se encuentra pocos
metros de la playa y cercano a restaurantes.
Casa para 6 personas, cuenta con 3
habitaciones, matrimonial en suit, 2 ba침os,
living con tv cable, comedor, cocina
equipada, estacionamiento para 1 auto
dentro de la propiedad, balcon y patio
trasero.",['Acceso a la playa'],,,Ana,01-2023,https://www.airbnb.cl/rooms/811107329479952838?adults=1&children=0&infants=0&pets=0&check_in=2023-03-01&check_out=2023-03-06&previous_page_section_name=1000&federated_search_id=e85027d3-35b8-469e-b28c-412266ac9d55
72,Casa adecuada para descansar frente a Pichidangui.,Habitaci칩n privada en alojamiento,Regi칩n de Coquimbo,4,4,2, Habitaci칩n,2,privado,49.0,-32.11821,-71.5026,"https://maps.google.com/maps?ll=-32.11821,-71.5026&z=14&t=m&hl=es&gl=CL&mapclient=apiv3","Contamos con amplio comercio a pocas cuadras del condominio y a precios muy convenientes (frutas, verduras, supermercado, mermeladas caseras, longanizas de Chill치n, queso de cabra, carnes de primera, peluquer칤a, etc.).","Caba침a de dos pisos con linda vista al mar y ubicada en un condominio cercano al km 200 de la Ruta 5 Norte y a 6 min del mar, posee:
- 2춿 piso con dormitorio con cama matrimonial, ba침o con tina  y techo de vidrio, adem치s, living -comedor-cocina americana.
- 3춿 piso independiente con dormitorio, cama matrimonial, techo de vidrio, ba침o, salita de estar,  terraza panor치mica con cama de cuarzo.
-  quincho y parrilla,  estacionamiento,  jard칤n.
-  agua potable.
 Es atendida por su propio due침o.


Alojamiento muy acogedor y con linda vista al mar",['Vista a la bah칤a'],4.86,49,Patricio,11-2018,https://www.airbnb.cl/rooms/36571749?adults=1&children=0&infants=0&pets=0&check_in=2023-03-01&check_out=2023-03-06&previous_page_section_name=1000&federated_search_id=e2516cb1-a0c0-49fe-82b1-880acddd83e3
73,Acogedora casa en Los Vilos,Alojamiento entero,Los Vilos,6,7,3, Habitaci칩n,2,privado,54.0,-31.90259,-71.49527,"https://maps.google.com/maps?ll=-31.90259,-71.49527&z=14&t=m&hl=es&gl=CL&mapclient=apiv3",,"Rel치jate con toda la familia en esta casa
acogedora ubicada en Los Vilos, donde la
tranquilidad se respira, se encuentra pocos
metros de la playa y cercano a restaurantes.
Casa para 6 personas, cuenta con 3
habitaciones, matrimonial en suit, 2 ba침os,
living con tv cable, comedor, cocina
equipada, estacionamiento para 1 auto
dentro de la propiedad, balcon y patio
trasero.",['Acceso a la playa'],,,Ana,01-2023,https://www.airbnb.cl/rooms/811107329479952838?adults=1&children=0&infants=0&pets=0&check_in=2023-03-01&check_out=2023-03-06&previous_page_section_name=1000&federated_search_id=e2516cb1-a0c0-49fe-82b1-880acddd83e3
74,Mi Refugio,Alojamiento entero,La Ligua,10,6,4, Habitaci칩n,2,privado,170.0,-32.2051,-71.51616,"https://maps.google.com/maps?ll=-32.2051,-71.51616&z=14&t=m&hl=es&gl=CL&mapclient=apiv3","Condominio Tranquilo, con vista maravillosa, puesta de sol hermosa.....seguridad las 24 horas del dia.","Casa en terreno de 5.000 m2, ubicada en condominio ""Rocas del Mar"" se encuentra entre Los Molles y Pichidangui. La ubicaci칩n exacta es el kilometro 189 de la ruta 5 Norte. Condominio con vigilancia las 24 horas del d칤a al igual que la conserjer칤a, funciona las 24 horas.

El espacio
Espacio amplio con una vista maravillosa, piscina de 12 x4 metros.",['Costa'],4.83,19,Veronica,02-2016,https://www.airbnb.cl/rooms/35824356?adults=1&children=0&infants=0&pets=0&check_in=2023-03-06&check_out=2023-03-12&previous_page_section_name=1000&federated_search_id=e2516cb1-a0c0-49fe-82b1-880acddd83e3
75,"Casa de veraneo en Huentelauqu칠n, Cond. Agua Dulce",Alojamiento entero,Canela,10,10,3, Habitaci칩n,2,privado,250.0,-31.51928,-71.55705,"https://maps.google.com/maps?ll=-31.51928,-71.55705&z=14&t=m&hl=es&gl=CL&mapclient=apiv3",,"Un lugar para relajarte junto a tu familia. 

Preciosa casa, a pasos de una excelente playa, en un entorno tranquilo, condominio seguro, bien equipado, rodeado de vegetaci칩n natural, para quedarse y enamorarse.

El espacio
La casa cuenta con:
- Terraza con vista al mar
- Hall de entrada
- Living, comedor y cocina
- Pieza matrimonial (2 personas)
- Pieza con 2 camarotes (4 personas)
- Pieza con 2 camarotes (4 personas)
- 2 ba침os",['Acceso la playa Privado'],5.0,5,Camila,02-2020,https://www.airbnb.cl/rooms/53829301?adults=1&children=0&infants=0&pets=0&check_in=2023-03-01&check_out=2023-03-08&previous_page_section_name=1000&federated_search_id=e2516cb1-a0c0-49fe-82b1-880acddd83e3
76,Caba침a 4 personas Pe침uelas (9),Caba침a entero,Coquimbo,4,3,2, Habitaci칩n,1,privado,35.835,-29.9478,-71.2906,"https://maps.google.com/maps?ll=-29.9478,-71.2906&z=14&t=m&hl=es&gl=CL&mapclient=apiv3","Caba침a equipada para 4 personas, tenemos 14 caba침as en total. Los accesos son controlados 24/7, cada caba침a tiene un estacionamiento disponible. Ubicada en el epicentro de Pe침uelas, al lado del Casino Enjoy, a una cuadra de la playa, cercana a restaurantes, pubs, centros comerciales, outlet, servicentros, a dos cuadras de la carretera panamericana RUTA 5. La playa es la m치s tranquila y de mejor oleaje para disfrutar de la calidez del clima.
Alrededor se encuentra el Casino Enjoy, las mejores playas de Pe침uelas, Pueblito Pe침uelas, centros comerciales, restaurantes, pubs. Cercano a la RUTA 5, carretera Panamericana, estaciones de servicio, supermercados.","Caba침a equipada para 4 personas, tenemos 14 caba침as en total. Los accesos son controlados 24/7, cada caba침a tiene un estacionamiento disponible
Ubicada en el epicentro de Pe침uelas, al lado del Casino Enjoy, a una cuadra de la playa, cercana a restaurantes, pubs, centros comerciales, outlet, servicentros, a dos cuadras de la carretera panamericana RUTA 5. La playa es la m치s tranquila y de mejor oleaje para disfrutar de la calidez del clima.",['Acceso a la playa'],,,Caba침as Pe침uelas Diamond,12-2022,https://www.airbnb.cl/rooms/792657381591005849?adults=1&children=0&infants=0&pets=0&check_in=2023-03-04&check_out=2023-03-09&previous_page_section_name=1000&federated_search_id=e2516cb1-a0c0-49fe-82b1-880acddd83e3
77,"Arena y mar, descansa sereno!",Alojamiento entero,Elqui,8,4,3, Habitaci칩n,2,privado,63.148,-29.88252,-71.27285,"https://maps.google.com/maps?ll=-29.88252,-71.27285&z=14&t=m&hl=es&gl=CL&mapclient=apiv3",,"Rel치jate en esta escapada 칰nica y tranquila. A pasos de la playa, con extensas 치reas para disfrutar y caminar por la arena mientras el mar moja tus pies. Contamos con todas las comodidades para un excelente descanso, 치rea de comedor al aire libre, escuchar los cantos de los canarios y otras aves. Piscina para los hij@s, area de juegos para ellos. Mini granja educativa para los hijos si quieren aprender m치s de conejos, gallinas, patos, entre otros. Y muchas m치s experiencias para ti y tu familia.",['Vista al patio'],,,Edu,04-2016,https://www.airbnb.cl/rooms/792166177114481279?adults=1&children=0&infants=0&pets=0&check_in=2023-03-01&check_out=2023-03-06&previous_page_section_name=1000&federated_search_id=e2516cb1-a0c0-49fe-82b1-880acddd83e3
78,Vistas de un mill칩n de d칩lares al Pac칤fico,Caba침a entero,Los Molles,5,2,2, Habitaci칩n,2,privado,131.206,-32.28186,-71.46992,"https://maps.google.com/maps?ll=-32.28186,-71.46992&z=14&t=m&hl=es&gl=CL&mapclient=apiv3","Esta es una comunidad cerrada (el acceso al veh칤culo est치 restringido). Hay muchos senderos de tierra hasta el oc칠ano o hacia los bosques. La orilla en la parte inferior de esta propiedad es rocosa con piscinas de marea. Las playas de arena est치n a menos de un kil칩metro de distancia. A veces se puede ver gente recogiendo algas en la orilla o peque침os barcos en el mar. Si tienes suerte ver치s delfines, leones marinos, ballenas, 치guilas, serpientes y escorpiones. Hay peque침as tiendas a cuatro cuadras de distancia. El restaurante m치s cercano est치 a seis kil칩metros de distancia en Los Molles.","Caba침a junto al mar. Para los hu칠spedes que buscan NATURALEZA. 춰Se admiten perros! 
Lugar oculto a 2 horas al norte de Santiago. 춰Surf a pocos kil칩metros de distancia!
춰NO ES para hu칠spedes que quieren hormig칩n limpio en la ciudad! La caba침a es de madera y tiene 25 a침os. 
춰No hay vecinos!
2500 metros cuadrados.
Senderismo alrededor
de 2 camas de dos plazas.
Para las evaluaciones de Airbnb de la b칰squeda de Ocean Escape on de la planta baja 
PROPIEDAD EN PRIMERA L칈NEA
NADA entre t칰 y el oc칠ano.
A 2 horas al norte de Santiago entre Pichicuy y Los Molles
No se permiten ni침os de la comunidad cerrada.


Decorada por los propietarios viaja por 츼frica, Oriente Medio e India, esta caba침a rezuma ambiente. Arriba hay sala de estar, dormitorio, cocina y un peque침o ba침o. En la planta baja tiene dormitorio, cocina peque침a y ba침o grande. Tanto en la planta superior como en la inferior tiene camas dobles, agua caliente, cocinas y duchas. En la planta baja se accede por una escalera exterior. 

Al igual que muchas 치reas costeras, el clima es variable. El sol algunos d칤as y las nubes, otros. El invierno es de mayo a septiembre. Tanto en la planta superior como en la inferior tienen fant치sticas vistas al mar y camas dobles. 

Puede hacer fr칤o por la noche, 춰trae un su칠ter! Esto es semi desierto con cielos nocturnos muy despejados. El agua de manantial se trae con un cami칩n, por lo que se agradece la conservaci칩n. Toda el agua de la cocina, el ba침o y la ducha alimenta las muchas plantas del jard칤n. 

Te invitamos a traer a tu perro, 춰pero lo siento, no hay ni침os!","['Acceso a playa P칰blico o compartido', 'Frente a la playa']",,,Lorraine,06-2014,https://www.airbnb.cl/rooms/3219000?adults=1&children=0&infants=0&pets=0&check_in=2023-03-01&check_out=2023-03-06&previous_page_section_name=1000&federated_search_id=e2516cb1-a0c0-49fe-82b1-880acddd83e3
