,Titulo1,Titulo2,Comuna,Capacidad,Camas,N_Habitaciones,Habitaciones,Baños,Tipo_Baños,Precio,lat,lon,Ubicacion,Ubides,Descripcion,Servicios,Nota,Nnota,Anfitrion,Registro,Link
106,Casa en Paihuano,Alojamiento entero,Paihuano,6,5,3, Habitación,1,privado,55.0,-30.03097,-70.52155,"https://maps.google.com/maps?ll=-30.03097,-70.52155&z=14&t=m&hl=es&gl=CL&mapclient=apiv3","El sector es muy tranquilo y los vecinos son muy amables, al igual que en todo Paihuano. La Casa se encuentra próxima a negocios, al río, al estadio y al centro cultural y biblioteca de Paihuano.","Amplia y cómoda casa en Paihuano, ideal para familias numerosas. Frente a dos plazoletas y frente al estadio de Paihuano. Se encuentra a pasos del río y el Centro Cultural y Biblioteca de Paihuano.

El espacio
La casa es cálida, amplia y cómoda. La cocina se encuentra completamente equipada para preparar comidas. El patio es amplio y hay disponibilidad para utilizar la parrilla, hay mesas y sillas.",['Vista a las montañas'],4.86,8,John,10-2015,https://www.airbnb.cl/rooms/23483153?adults=1&children=0&infants=0&pets=0&check_in=2023-02-19&check_out=2023-02-24&previous_page_section_name=1000
107,"Casa Residencial Coquimbo, Chile",Alojamiento entero,Coquimbo,4,3,2, Habitación,2,privado,75.0,-29.96666,-71.30195,"https://maps.google.com/maps?ll=-29.96666,-71.30195&z=14&t=m&hl=es&gl=CL&mapclient=apiv3","Nuestra casa se encuentra en un vecindario tranquilo y seguro, rodeado de hermosos parques y jardines. Puedes disfrutar de paseos relajantes por las calles arboladas mientras admiras la belleza natural del vecindario. Los parques cercanos ofrecen una amplia variedad de actividades al aire libre, desde senderismo y ciclismo, hasta juegos para niños y áreas de picnic. Es un lugar perfecto para relajarse y desconectar del estrés de la vida cotidiana, mientras disfrutas de la naturaleza y del aire fresco.","¡Disfruta tu verano en nuestra hermosa casa de arriendo! Acogedora y espaciosa, cerca de las playas de Coquimbo. Con cocina, camas cómodas y sala de estar. Vecindario seguro, tranquilo, cerca de supermercados, restaurantes. A pocos pasos del mar y cerca de atracciones turísticas. ¡No pierdas esta oportunidad! ¡Te esperamos! Además, está cerca de la ciudad, para que puedas disfrutar de todo lo que ofrece. Un lugar perfecto para descansar y disfrutar de la naturaleza.


Experimenta una estancia acogedora en nuestra amplia y espectacular casa. Con espacios amplios y elegantes, nuestra casa es el lugar perfecto para relajarse y disfrutar. Las habitaciones están bien iluminadas y con cómodas camas.  Con un patio y una terraza privada, podrás disfrutar de una vista impresionante mientras disfrutas del sol y de la brisa del mar. Además, la casa cuenta con una decoración acogedora y todas las comodidades necesarias para una estancia cómoda. ¡No pierdas la oportunidad de experimentar la vida acogedora en nuestra hermosa casa! ¡Te esperamos!",['Vista a la bahía'],,,Rodrigo,02-2019,https://www.airbnb.cl/rooms/32293241?adults=1&children=0&infants=0&pets=0&check_in=2023-02-18&check_out=2023-02-23&previous_page_section_name=1000
108,Preciosa casa en Huentelauquén,Alojamiento entero,Canela,6,6,2, Habitación,2,privado,133.0,-31.5292,-71.57235,"https://maps.google.com/maps?ll=-31.5292,-71.57235&z=14&t=m&hl=es&gl=CL&mapclient=apiv3",,"Casa en 2da línea con increíble vista despejada, a 5 minutos caminando de 2 playas maravillosas. Perfecto para desconectarse, descansar y disfrutar de un paisaje único, clima cálido y cielos estrellados. La casa es totalmente autosustentable, la energía funciona con paneles solares y el agua es de un estanque propio. Sin duda, una experiencia imperdible.","['Acceso a la playa', 'Frente a la playa']",4.65,62,Soledad,01-2017,https://www.airbnb.cl/rooms/21963437?adults=1&children=0&infants=0&pets=0&check_in=2023-02-27&check_out=2023-03-06&previous_page_section_name=1000
109,Dominga Lodge valle de Elqui,Cabaña entero,La Serena,4,3,2, Habitación,1,privado,85.5,-29.9851,-71.06561,"https://maps.google.com/maps?ll=-29.9851,-71.06561&z=14&t=m&hl=es&gl=CL&mapclient=apiv3",,,['Cocina'],4.86,7,José,08-2018,https://www.airbnb.cl/rooms/32768011?adults=1&children=0&infants=0&pets=0&check_in=2023-03-01&check_out=2023-03-06&previous_page_section_name=1000
110,De Tongoy a las estrellas,Alojamiento entero,Tongoy ,8,7,3, Habitación,"2,5",privado,145.0,-30.25865,-71.47327,"https://maps.google.com/maps?ll=-30.25865,-71.47327&z=14&t=m&hl=es&gl=CL&mapclient=apiv3","Disfruta de la tranquilidad del sector,
por la noches podrás observar las estrellas.
La casa está cercana a otros balnearios, como Puerto Velero, Guanaqueros. también a la Ciudades de La Serena y Coquimbo para disfrutar de la gastronomía y aprovechar una escapada al valle de Elqui para conocer y degustar el Pisco famoso de la zona","Disfruta de la tranquilidad de una parcela y la cercanía de la playa.
una casa con grandes espacios para compartir con la familia y los amigos .
terraza techada y otro espacio al aire libre. una salamandra para disfrutar del calorcito de hogar.
Amplios espacios para estacionaiento, parrilla para hacer un asado.


Los huéspedes tienen acceso a la casa completa, al patio y terreno de la parcela, donde hay variedad de árboles, espacios de terrazas interior, balcón, tinaja de agua caliente. terraza al aire libre.",['Vista al jardín'],5.0,9,Nelly,11-2019,https://www.airbnb.cl/rooms/39837823?adults=1&children=0&infants=0&pets=0&check_in=2023-03-14&check_out=2023-03-19&previous_page_section_name=1000
111,De Tongoy a las estrellas,Alojamiento entero,Tongoy ,8,7,3, Habitación,"2,5",privado,145.0,-30.25865,-71.47327,"https://maps.google.com/maps?ll=-30.25865,-71.47327&z=14&t=m&hl=es&gl=CL&mapclient=apiv3","Disfruta de la tranquilidad del sector,
por la noches podrás observar las estrellas.
La casa está cercana a otros balnearios, como Puerto Velero, Guanaqueros. también a la Ciudades de La Serena y Coquimbo para disfrutar de la gastronomía y aprovechar una escapada al valle de Elqui para conocer y degustar el Pisco famoso de la zona","Disfruta de la tranquilidad de una parcela y la cercanía de la playa.
una casa con grandes espacios para compartir con la familia y los amigos .
terraza techada y otro espacio al aire libre. una salamandra para disfrutar del calorcito de hogar.
Amplios espacios para estacionaiento, parrilla para hacer un asado.


Los huéspedes tienen acceso a la casa completa, al patio y terreno de la parcela, donde hay variedad de árboles, espacios de terrazas interior, balcón, tinaja de agua caliente. terraza al aire libre.",['Vista al jardín'],5.0,9,Nelly,11-2019,https://www.airbnb.cl/rooms/39837823?adults=1&children=0&infants=0&pets=0&check_in=2023-03-14&check_out=2023-03-19&previous_page_section_name=1000
112,Lodge Roca Tongoy,Villa entero,Tongoy,5,4,2, Habitación,"2,5",privado,144.0,-30.24943,-71.50175,"https://maps.google.com/maps?ll=-30.24943,-71.50175&z=14&t=m&hl=es&gl=CL&mapclient=apiv3","La casa está cerca de todo, para las compras es ideal moverse en auto o bicicleta. En el centro del pueblo hay todo tipo de equipamientos y servicios, hay nueva sede Banco Estado. La feria libre es los días lunes y viernes en la calle del liceo y la Caleta pesquera abre todos los días. El camiónde la basura pasa todas las semanas de manera normal por Avenida Costanera, no por Urmeneta. No deje la basura en calle Urmeneta porque se forma un microbasural.","Una casa de playa super cómoda y de estilo único, ideal para relajarse y desconectarse de todo. Espectacularvista al mar, jardines y espacios para descansar y mirar el mar. Mobiliario sencillo y confortable. A cuatro cuadras de la playa Socos.

El espacio
Casa principal equipada para 5 personas cómodamente. Dormitorio en suite, dormitorio secundario y estar en segundo piso, cocina comedor y living pequeño, grandes terrazas.",['Vista a la bahía'],4.44,16,Carmina,02-2018,https://www.airbnb.cl/rooms/39665418?adults=1&children=0&infants=0&pets=0&check_in=2023-02-26&check_out=2023-03-04&previous_page_section_name=1000
113,"Casa con Piscina en Guanaqueros, IV región, Chile.",Cabaña entero,Coquimbo,7,5,3, Habitación,2,privado,72.0,-30.19463,-71.41238,"https://maps.google.com/maps?ll=-30.19463,-71.41238&z=14&t=m&hl=es&gl=CL&mapclient=apiv3","Tranquilo, residencial.","Casa con bella vista al mar en todos los recintos, 
Guanaqueros posee una maravillosa playa, soleado clima y exquisita gastronomía. 
Dos dormitorios con cama matrimonial y uno con camas gemelas, dos baños,  cocina americana, estar comedor, 70m2.
Terraza en altura con vista al mar.
TV cable, lavavajillas, lavadora, microhondas, juguera, colchones de resortes en buen estado.
Amplia Piscina con deck  y gran Quincho de uso exclusivo,  terreno de 1200m2.   Sector el  Oasis, al sur de cabañas Nenita.


En la playa cercana, El Oasis, se ubica un grato restaurante tipo chiringuito ubicado a orillas del mar, frente a la casa hay una plazoleta con juegos infantiles, el barrio es residencial y el poco ruido y tranquilidad permiten un grato descanso.",['Vista a la bahía'],4.50,5,Silvia,12-2013,https://www.airbnb.cl/rooms/31292860?adults=1&children=0&infants=0&pets=0&check_in=2023-03-05&check_out=2023-03-12&previous_page_section_name=1000
114,Casa en Valle del Elqui,Alojamiento entero,Paihuano,5,4,2, Habitación,1,privado,95.0,-30.20233,-70.48809,"https://maps.google.com/maps?ll=-30.20233,-70.48809&z=14&t=m&hl=es&gl=CL&mapclient=apiv3",,"Casa para 5 personas a orillas del río claro, pesca de río, quinchos, reposeras, hamacas, terraza, chimenea, para disfrutar de la tranquilidad y naturaleza del valle de elqui, dormitorios con escotillas para ver las estrellas, estacionamiento, agua caliente, a 10 minutos de Pisco Elqui.

Acceso de los huéspedes
Acceso completo a domicilio privado.",['Acceso al lago'],4.29,7,Ernesto Eduardo,01-2018,https://www.airbnb.cl/rooms/31048856?adults=1&children=0&infants=0&pets=0&check_in=2023-02-19&check_out=2023-02-25&previous_page_section_name=1000
115,Casa en Condominio Agua Dulce Huentelauquen,Villa entero,Angostura,6,4,3, Habitación,3,privado,220.0,-31.52223,-71.55345,"https://maps.google.com/maps?ll=-31.52223,-71.55345&z=14&t=m&hl=es&gl=CL&mapclient=apiv3","The house is located inside Agua Dulce condominium, which features direct beach access, football pit, tennis court and several trekking and walking trails.
Supermarket and shops can be found at Huentelauquen, the closest town, which is about 10 minutes from the Villa","CASA QUEBRADA. Nature and reconnection!
A special place to spend time with love ones, relax, chill and explore. Our Villa combines a stunning spot at the edge of a cliff with full sea view. The deco is stylish and charming with art on every single room!

El espacio
A house at the edge of a cliff with perfect sea view and amazing nature surrounding the house. Our place is nicely decorated with art in every room. A large terrace with an outdoor jacuzzi plus a bbq area make it perfect for a family holiday",['Vista a la bahía'],4.78,18,Maria,02-2014,https://www.airbnb.cl/rooms/50591250?adults=1&children=0&infants=0&pets=0&check_in=2023-03-13&check_out=2023-03-18&previous_page_section_name=1000
116,"Ensenada km 213, Sector Pichidangui",Alojamiento entero,Pichidangui,10,7,4, Habitación,3,privado,170.0,-32.11055,-71.52166,"https://maps.google.com/maps?ll=-32.11055,-71.52166&z=14&t=m&hl=es&gl=CL&mapclient=apiv3",,"Casa amplia, cómoda,  estilo mediterráneo, sólida, bien mantenida y decorada, full equipada. Ubicada en Condominio Ensenada, en el Km 213, el cual tiene playa privada de arenas blancas, quitasoles de totora y juegos para niños.

El espacio
Tiene 4 dormitorios, 2 de estos con cama Matrimonial, un tercero individual , y el cuarto con acceso independiente el cual tiene 2 camas individuales. Además hay un sofá cama en el living y una cama pequeña de niños en la habitación 2.
Está muy cerca de la playa, para ir caminando. 
Condominio muy tranquilo, seguro y de buen nivel.",['Vista al océano'],,,Francisco,08-2015,https://www.airbnb.cl/rooms/10474743?adults=1&children=0&infants=0&pets=0&check_in=2023-02-26&check_out=2023-03-03&previous_page_section_name=1000
117,La Isla de Tongoy,Alojamiento entero,Coquimbo,12,10,4, Habitación,3,privado,150.0,-30.25091,-71.50036,"https://maps.google.com/maps?ll=-30.25091,-71.50036&z=14&t=m&hl=es&gl=CL&mapclient=apiv3",,"Hermosa casa en la península de Tongoy, zona segura de tsunami, equipada para 12 personas y estacionamiento para tres vehículos, hermosa vista a puerto velero y playa blanca, por temas de contingencia sanitaria no se incluyen sábanas ni toallas hasta nuevo aviso por normas de Airbnb.",['Cocina'],4.77,14,Manuel,12-2019,https://www.airbnb.cl/rooms/41223277?adults=1&children=0&infants=0&pets=0&check_in=2023-02-26&check_out=2023-03-03&previous_page_section_name=1000
118,"Casa de campo, con vista al mar",Casa de campo entero,Tongoy,6,5,3, Habitación,2,privado,115.0,-30.25635,-71.46995,"https://maps.google.com/maps?ll=-30.25635,-71.46995&z=14&t=m&hl=es&gl=CL&mapclient=apiv3",,"Relájate con toda la familia en este tranquilo lugar para quedarse.

El espacio
Casa en una parcela muy cómoda y bien equipada",['Vista a la playa'],4.71,7,Anita Maria,04-2019,https://www.airbnb.cl/rooms/40800270?adults=1&children=0&infants=0&pets=0&check_in=2023-02-19&check_out=2023-02-24&previous_page_section_name=1000
119,Departamento magnífico en Serena,Alojamiento entero,La Serena,5,4,3, Habitación,1,privado,47.5,-29.89037,-71.24963,"https://maps.google.com/maps?ll=-29.89037,-71.24963&z=14&t=m&hl=es&gl=CL&mapclient=apiv3",Condominio tranquilo y con acceso controlado 24 hrs.,"Maravilloso dpto ubicado con excelente acceso por la ruta 5 norte, a 7 minutos de la playa. Dpto equipado con elementos de primera calidad, sabanas y plumones de pluma, toallas, quincho, piscina, estacionamiento privado, acceso controlado 24 hrs, amplia terraza cerrada con Termo panel, cocina encimera, juegos infantiles, calefacción y TV cable, Wifi, a cuadras de supermercados y bomba de servicio.


El Dpto cuenta con todos los utensilios para cocinar, baño con agua caliente, lavadora disponible para utilizar, equipo de musica y TV en living Smart TV, Wifi",['Cocina'],4.64,22,Alejandro,12-2017,https://www.airbnb.cl/rooms/22097135?adults=1&children=0&infants=0&pets=0&check_in=2023-02-23&check_out=2023-03-02&previous_page_section_name=1000
120,Casa para vacaciones,Villa entero,La Serena,4,3,2, Habitación,1,privado,30.96,-29.87058,-71.27038,"https://maps.google.com/maps?ll=-29.87058,-71.27038&z=14&t=m&hl=es&gl=CL&mapclient=apiv3","Ubicada Sector Caleta San Pedro, calle Maria Elena Aguilera Rubina 556, La casa queda a 800 metros del mar, cerca del centro Gastronómico del lugar, 8 min del centro, 13 minutos de 4 esquinas, además pueden ir caminando por el borde costero a Serena Golf y llegar hasta la reserva de Punta Teatinos, en YouTube encontrará un video de Caleta San Pedro","Casa ubicada en el Sector de Caleta San Pedro de La Serena calle Maria Elena Aguilera,  cerca de la playa 🌅, del centro Gastronómico🍽, a 
8 minutos en vehículo llegará al centro Colonial de la ciudad de La Serena, también a 10 min del Faro monumental, a  13 min de 4 esquinas y a 20 min de la ciudad de Coquimbo
amplio estacionamiento ( acceso portón eléctrico)
2 habitaciones con piso flotante
1 🛌de 2 plazas 
1 🛌 nido (1.5 🛌y 1 🛌)
wifi
Quincho Rústico
2📺
cafetera
✅️🐾


La casa fue refacccionada por el dueño para que los huéspedes se sientan como si fuese en su hogar, es un sector tranquilo tiene acceso al mar pueden disfrutar caminando del sector Caleta San Pedro hasta Serena Golf y por último llegar a Punta de Teatinos.
https://youtu.be/ufwDoidNJ_k",['Vista al patio'],5.0,8,Roberto,09-2019,https://www.airbnb.cl/rooms/54110452?adults=1&children=0&infants=0&pets=0&check_in=2023-05-14&check_out=2023-05-19&previous_page_section_name=1000
121,Departamento Excelente Ubicación,Alojamiento entero,La Serena,4,2,2, Habitación,1,privado,40.8,-29.905,-71.26174,"https://maps.google.com/maps?ll=-29.905,-71.26174&z=14&t=m&hl=es&gl=CL&mapclient=apiv3",,"Disfruta de la sencillez de este alojamiento tranquilo y céntrico ubicado en el barrio Puertas del Mar. 
2 habitaciones 1 baño
Wifi
TV Cable
Cocina equipada
Conserje las 24 hrs
Balcón 
Cercano a Malls, Supermercados, Centro, Plaza de Armas, Jardín Japonés, Faro Monumental, Cines, etc...",['Cocina'],5.0,3,Rodrigo,03-2019,https://www.airbnb.cl/rooms/41586341?adults=1&children=0&infants=0&pets=0&check_in=2023-02-24&check_out=2023-03-01&previous_page_section_name=1000
122,"Hermosa casa en condominio, jacuzzi y vista al mar",Casa de campo entero,Los Molles,8,7,3, Habitación,2,privado,155.0,-32.23256,-71.50407,"https://maps.google.com/maps?ll=-32.23256,-71.50407&z=14&t=m&hl=es&gl=CL&mapclient=apiv3","Condominio tranquilo y seguro, con flora y fauna nativa de la zona (podrás ver zorros, liebres y hermosas aves, entre otras especies), en donde puedes salir a caminar o hace deporte, reservar la cancha de fútbol/pádel y jugar en la plaza de juegos. Ambiente muy agradable y familiar.","Hermosa casa full equipada para alojar 8 adultos (+1 niñ@ y 1 bebé) con vista al mar, jacuzzi en amplia terraza y mini cancha de fútbol. 

Dentro del condominio Rocas Del Mar (con seguridad 24/7,  canchas de fútbol/pádel, senderos para deporte y plaza de juegos infantiles a 200 metros de la casa), estás a 5 minutos en auto de la playa. Los Molles es famoso por sus escuelas de buceo y el Bioparque Puquén.

¡Vive una experiencia de tranquilidad, descanso y desconexión que jamás vas a olvidar!


Moderna casa de campo en condominio. Full equipada con tres habitaciones y capacidad para 8 adultos. Gran terraza con vista al mar, tranquila y silenciosa. Jacuzzi al aire libre para 4 personas y  mini cancha de futbol.",['Vista a la bahía'],4.93,15,Rodrigo,10-2016,https://www.airbnb.cl/rooms/658836724167165160?adults=1&children=0&infants=0&pets=0&check_in=2023-03-13&check_out=2023-03-18&previous_page_section_name=1000
123,Casa cómoda en Coquimbo se aceptan mascotas.,Alojamiento entero,Coquimbo,6,5,3, Habitación,2,privado,68.333,-29.9934,-71.34845,"https://maps.google.com/maps?ll=-29.9934,-71.34845&z=14&t=m&hl=es&gl=CL&mapclient=apiv3","Cuenta con estacionamientos autorizados en calle, frente a plaza con juegos y mini cancha. Se encuentra en zona segura de maremotos. Casa habitación de 96 metros cuadrados útiles en 206 metros de terreno.","Barrio consolidado de la Herradura Oriente en Coquimbo, cercano al Balneario La Herradura, supermercados y salida a Ruta 5

El espacio
Casa habitación de dos piso segundo piso en suite. Casa habitación de 96 metros cuadrados útiles en espacio de terreno de 200 metros cuadrados",['Vista a la bahía'],4.89,9,Ary,03-2018,https://www.airbnb.cl/rooms/31159868?adults=1&children=0&infants=0&pets=0&check_in=2023-02-26&check_out=2023-03-04&previous_page_section_name=1000
124,Casa La Herradura Oriente Sur,Alojamiento entero,Coquimbo,5,5,3, Habitación,"1,5",privado,40.833,-29.9935,-71.3599,"https://maps.google.com/maps?ll=-29.9935,-71.3599&z=14&t=m&hl=es&gl=CL&mapclient=apiv3",,Relájate con toda la familia en este alojamiento donde la tranquilidad se respira.,['Cocina'],,,Jesús Alonso,04-2017,https://www.airbnb.cl/rooms/758143630692496608?adults=1&children=0&infants=0&pets=0&check_in=2023-02-28&check_out=2023-03-06&previous_page_section_name=1000
125,Casa granero en Playa Grande Tongoy,Cabaña entero,Tongoy,6,5,3, Habitación,"1,5",privado,170.0,-30.2946,-71.5367,"https://maps.google.com/maps?ll=-30.2946,-71.5367&z=14&t=m&hl=es&gl=CL&mapclient=apiv3","El barrio es principalmente naturaleza, un humedal, el océano y la playa.","Esta casa, ha sido especialmente diseñada  para disfrutar del entorno natural. Para experimentar la puesta de sol desde su terraza en la azotea. Un lugar que evoca las antiguas casas de campo, combinadas con productos contemporáneos.

Acceso de los huéspedes
Los huéspedes podrán acceder al espacio completo de la casa, al gran jardín y a las instalaciones exteriores. Los huéspedes también pueden llegar al humedal en un par de minutos o caminar a la hermosa playa a solo 15 minutos de la casa",['Vista al valle'],5.0,3,Jorge,05-2015,https://www.airbnb.cl/rooms/665518914328051294?adults=1&children=0&infants=0&pets=0&check_in=2023-02-20&check_out=2023-02-25&previous_page_section_name=1000
126,Exquisita casa vista al mar,Bungalow entero,Coquimbo,6,4,2, Habitación,2,privado,150.0,-29.98696,-71.38114,"https://maps.google.com/maps?ll=-29.98696,-71.38114&z=14&t=m&hl=es&gl=CL&mapclient=apiv3","Muy cerca de Coquimbo pero no se ve ni se escucha. Rico silencio, nadie molesta, casi nadie alrededor. Bajar al mar por senderos diaguitas milenarios con flora propia de la zona. Recomendable pantalon largo y zapato de treking. Playas en Totoralillo, Guanaqueros, Tongoy, La Serena.
Avistamiento de ballenas y delfines en Chañaral de Aceituno y Punta de Choros.
Vicuña, Cochiguaz, Observatorio Mamayuca, otras localidades y multiples restoranes en el Valle del Elqui interesantes de conocer.
Restoranes en Avda del Mar en Serena, Tongoy, Guanaqueros y Totoralillo. Barrio Ingles en Coquimbo y Museo Arqueologico en Serena valen la pena.","Muy silencioso, preciosa vista al mar desde todas las piezas, ricas terrazas, Hot Tub con vista privilegiada, bracero y parrilla en terraza interior, 2 piezas amplias con baños privados, cocina americana bien equipada, amplio estacionamiento, estacion de trabajo, calefaccion combustion lenta, ideal para dos parejas y eventualmente dos niños. Relájate en esta escapada única y tranquila.


Muy cerca de Coquimbo pero no se ve ni se escucha. Playas en Totoralillo, Guanaqueros, Tongoy, La Serena, avistamiento de ballenas y delfines en Chañaral de Aceituno y Punta de Choros.
Vicuña, Cochiguaz, Observatorio Mamayuca, otras localidades y multiples restoranes en el Valle del Elqui  interesantes de conocer.
Restoranes en Avda del Mar en Serena, Tongoy, Guanaqueros y Totoralillo",['Vista a la bahía'],,,Juan Pablo,02-2019,https://www.airbnb.cl/rooms/796993034856852946?adults=1&children=0&infants=0&pets=0&check_in=2023-02-22&check_out=2023-02-27&previous_page_section_name=1000
127,Gran casa en Totoralillo con vista al mar y más!,Casa de campo entero,Totoralillo,12,10,4, Habitación,"4,5",privado,260.811,-30.06154,-71.36812,"https://maps.google.com/maps?ll=-30.06154,-71.36812&z=14&t=m&hl=es&gl=CL&mapclient=apiv3",,"730 m² de entretención!  Cuenta con piscina, cama saltarina, quincho, taca-taca, mesa de pool y mucho espacio para jugar!

4 habitaciones, cada una con baño privado:
-3 con una cama de dos plazas y una cama nido.
-1 con una cama de dos plazas. 

Luminoso living (bellas puestas de sol), mesas grandes para comer, 4 estacionamientos, y a solo 5 minutos en auto de la playa.

*Desayuno opcional por $7500
-Pan ciabatta aliado/palta jamón/huevo
-Trozo de pastel
- te/café/leche
- Fruta/yogurt con cereal",['Vista al mar'],,,Macarena,08-2021,https://www.airbnb.cl/rooms/758653560599739892?adults=1&children=0&infants=0&pets=0&check_in=2023-02-26&check_out=2023-03-03&previous_page_section_name=1000
128,"Casa del Valle, Lugar soñado.",Casa de campo entero,La Serena,12,9,4, Habitación,4,privado,280.0,-29.92458,-71.21694,"https://maps.google.com/maps?ll=-29.92458,-71.21694&z=14&t=m&hl=es&gl=CL&mapclient=apiv3",,"Esta casa está preparada para un grupo de 12 a 15 personas, completamente equipada, con hermosas y amplias áreas verdes, gran Piscina, Gimnasio, Quincho y horno de barro, mesa de ping pong, mesa de mini ping pong, Taca Taca o futbol de mesa, tina de madera de agua caliente a leña, 4 dormitorios, 4 baños, Wi-Fi, hermosas y acogedoras decoraciones ideal para venir a relajarse y llenarse de energía del valle del Elqui. Está ubicada hacia el valle Km 14, a 15 min del centro y  25 min de la playa.",['Cocina'],5.0,5,Víctor,12-2022,https://www.airbnb.cl/rooms/787658634284634599?adults=1&children=0&infants=0&pets=0&check_in=2023-02-26&check_out=2023-03-03&previous_page_section_name=1000
129,Hermosa Casa Tongoy,Alojamiento entero,Coquimbo,8,14,3, Habitación,1,privado,90.0,-30.25824,-71.47477,"https://maps.google.com/maps?ll=-30.25824,-71.47477&z=14&t=m&hl=es&gl=CL&mapclient=apiv3",cercano al estero del pueblo y rodeado de Flora y fauna,"Casa cómoda en condominio,  con 3 habitaciones,  2 TV con cable, 2 piscinas grandes,  estacionamiento para 3 habitaciones. 
Hermoso entorno natural. ( Flora y fauna)

El espacio
lugar tranquilo , cómodo,  limpio, agua caliente 2 tv con cable.","['Acceso a playa Público o compartido', 'Frente a la playa']",4.67,9,Elianira,11-2018,https://www.airbnb.cl/rooms/46571997?adults=1&children=0&infants=0&pets=0&check_in=2023-02-27&check_out=2023-03-04&previous_page_section_name=1000
