,Titulo1,Titulo2,Comuna,Capacidad,Camas,N_Habitaciones,Habitaciones,Ba침os,Tipo_Ba침os,Precio,lat,lon,Ubicacion,Ubides,Descripcion,Servicios,Nota,Nnota,Anfitrion,Registro,Link
0,"caba침a ,grandiosa vista al mar,fog칩n,tranquilidad.",Caba침a entero,La Serena,4,2,2, Habitaci칩n,1,privado,30.0,-29.72279,-71.32457,"https://maps.google.com/maps?ll=-29.72279,-71.32457&z=14&t=m&hl=es&gl=CL&mapclient=apiv3","En el lugar existen negocios,servicio de almuerzo s y teter칤a con delivery ,est치 en un sector privado,f치cil acceso al mar ,mucha tranquilidad,se pueden ver ballenas y delfines,la flora en primavera cuando llueve es hermosa , ac치 la llamamos desierto florido.","La caba침a esta ubicada en el borde costero ,el Arrayan costero a 20 min al norte de La Serena,con energ칤a solar ,lugar m치gico donde puedes ver ballenas y delfines,muy tranquilo,excelente vista  y acceso directo al mar,muy seguro ,el sector cuenta con negocio,ideal para desconectarse,descansar,disfrutar el borde costero,desde la caba침a puedes llegar en poco tiempo a los centros tur칤sticos mas importantes de la cuarta regi칩n, como el valle del Elqui,Punta de Choros .,Cha침aral de aceituno.


La caba침a es un lugar maravilloso  para descansar y desconectarse ,hermosos atardeceres,bella vista al mar,fogata para compartir momentos inolvidables.",['Acceso la playa Privado'],4.78,41,Jessica,11-2018,https://www.airbnb.cl/rooms/34479498?adults=1&children=0&infants=0&pets=0&check_in=2023-03-11&check_out=2023-03-16&previous_page_section_name=1000
1,Casa con Piscina privada Alma Del Elqui,Casa de campo entero,La Serena,8,6,3, Habitaci칩n,2,privado,132.0,-30.0203,-70.5248,"https://maps.google.com/maps?ll=-30.0203,-70.5248&z=14&t=m&hl=es&gl=CL&mapclient=apiv3","Es un barrio muy tranquilo con vecinos muy hospitalarios, el nombre del callej칩n es de aguirre, debido a la primera familia que lleg칩 al sector en el siglo pasado, esta cercado con muros de piedras (pircas) de al menos 200 a침os algunos de estos del tiempo de los diaguitas. El pueblo de paihuano est치 a 1 kilometro aprox, donde encontraras negocios, restaurantes, posta de urgencias, bomberos, carabineros, etc. puedes ir en auto o caminando (30 minutos)","Casa Alma del Elqui, Est치 ubicado antes de llegar a Paihuano Pueblo, inserto en medio del Valle, en ambiente r칰stico con maderas nobles y muros de piedras natural del mismo valle de Elqui, las sentir치s cargadas de pura energ칤a positiva, para que te encuentres contigo mismo, es un para칤so inspirador, especial para compartir en familia, seres queridos y ense침arles a tus hijos sobre las constelaciones en las noches estrelladas.


Es una casa con piscina de uso exclusivo para los hu칠spedes, 
Es un espacio verde en contraste con el marr칩n de los cerros y el azul del cielo. una imagen perfecta para guardar en su memoria.",['Cocina'],4.73,86,Claudio Contreras,12-2015,https://www.airbnb.cl/rooms/21867642?adults=1&children=0&infants=0&pets=0&check_in=2023-03-03&check_out=2023-03-08&previous_page_section_name=1000
2,"Embalse puclaro, valle del elqui",Caba침a entero,Vicu침a,5,4,3, Habitaci칩n,2,privado,85.276,-30.0033,-70.8409,"https://maps.google.com/maps?ll=-30.0033,-70.8409&z=14&t=m&hl=es&gl=CL&mapclient=apiv3","se ubica a unos 400 metros de la carretera (ruta 41) al costado de Villa Puclaro. Con una subida de unos 50 mts. Un poco complicada, pero lo dem치s es con adocretos.","Un lugar tranquilo para relajarse, amplio terreno, piscina, parrilla. A 10 minutos de vicu침a y a 35 minutos de la serena, preciosa vista y d칤as de sol desde temprano.",['Vista al jard칤n'],,,Macarena,09-2022,https://www.airbnb.cl/rooms/763852230237366836?adults=1&children=0&infants=0&pets=0&check_in=2023-02-19&check_out=2023-02-24&previous_page_section_name=1000
3,Valle del Limar칤. Tranquilidad y descanso,Caba침a entero,Ovalle,5,4,2, Habitaci칩n,1,privado,70.0,-30.754,-70.8434,"https://maps.google.com/maps?ll=-30.754,-70.8434&z=14&t=m&hl=es&gl=CL&mapclient=apiv3","El lugar es muy rural. Solo peque침os almacenes .Est치 a 38 km de la ciudad de Ovalle. En el Valle del Limar칤 IV regi칩n Coquimbo Siguiendo al interior del valle encontrar치 la belleza de grandes vi침edos, plantaciones de c칤tricos, paltos duraznos y otros, que cuelgan de los cerros. Podr치s visitar Pisqueras, pueblos t칤picos antiguos y artesan칤as en especial de Lapil치zuli. En kms. cercanos se puede visitar una reserva arqueol칩gica diaguita llamada ""Valle del encanto"" con incre칤bles petroglifos.","Parcela de agrado donde se adecu칩 esta caba침a. Es para quienes deseen conocer las bellezas y la paz del Valle del Limar칤 . Materiales r칰sticos. Rodeado de 치rboles frutales y naturaleza nortina  de la que pueden disfrutar incluyendo los cielos estrellados o las noches de Luna llena.

El espacio
Est치 equipada con todo lo necesario para cocinar.. Posee un hermoso quincho para los asados. Tambi칠n pueden conseguir una persona que pueda colaborar en hacer comida o comprar, como pan amasado etc.",['Vista al canal'],4.95,19,Migdalel,11-2019,https://www.airbnb.cl/rooms/40566558?adults=1&children=0&infants=0&pets=0&check_in=2023-03-03&check_out=2023-03-09&previous_page_section_name=1000
4,"Casa Luz. EN LA PLAYA. Las Mostazas, Guanaqueros",Alojamiento entero,Coquimbo,8,7,3, Habitaci칩n,"3,5",privado,275.0,-30.18138,-71.39205,"https://maps.google.com/maps?ll=-30.18138,-71.39205&z=14&t=m&hl=es&gl=CL&mapclient=apiv3","El condominio esta a 10 minutos en auto del pueblo de Guanaqueros, 20 de Tongoy donde hay almacenes, ferias 2 d칤as a la semana donde comprar frutas verduras y varias cosas m치s, adem치s de caletas para abastecerse de mariscos y pescado.","Una casa preciosa,  hecha con mucho amor, en la playa misma, patitas en la arena. A 50 pasos del mar. Un lugar tranquilo, maravilloso, de conexi칩n con la naturaleza. Dan ganas de quedarse para siempre :)

Ecol칩gica, bien aislada, full el칠ctrica, con paneles solares y reutilizaci칩n de aguas para el jard칤n. 

Esta dentro del condominio Las Mostazas. En una playa incre칤ble. A 10 mins en auto de Guanaqueros, 20 de Tongoy y 45 de la serena. Llegan las compras del Jumbo a la puerta de la casa.


La casa tiene 3 piezas ricas, cada una con su ba침o. M치s un ba침o de servicio o de playa y parrilla. Tiene un espacio com칰n grande con una barra y un comedor grande tambi칠n. Una rica y amplia terraza con parrilla, fog칩n, estar reposeras y comedor exteriores. 

Hay en la parte de abajo del jard칤n una zona de fogata, tambi칠n con parrilla y mes칩n para hacer un asado mas acampado. 

Dejamos siempre 2 stand up paddle y salvavidas de distintos tama침os para salir a remar por el mar. Una experiencia preciosa.

Hay tambi칠n para el fin del d칤a, y con la
idea de cuidar el agua, una ducha playera, justo antes de la subida a la casa, para ba침arse r치pido y sacarse la sal y arena antes de subir.","['Acceso a playa P칰blico o compartido', 'Frente a la playa']",5.0,15,Camila,05-2014,https://www.airbnb.cl/rooms/53001224?adults=1&children=0&infants=0&pets=0&check_in=2023-03-08&check_out=2023-03-13&previous_page_section_name=1000
5,"Caba침a M치gica en Valle del Elqui, Alcohuaz",Caba침a entero,Paihuano,5,3,2, Habitaci칩n,2,privado,100.0,-30.029,-70.5164,"https://maps.google.com/maps?ll=-30.029,-70.5164&z=14&t=m&hl=es&gl=CL&mapclient=apiv3","cerca de lugares para realizar caminatas, cabalgatas etc","Disfruta de esta hermosa  y equipada caba침a, en este magn칠tico y relajador lugar, en medio de las monta침as m치s energ칠ticas del mundo junto a un cielo excepcional.
Nos encontramos en un sector donde puedes disfrutar de actividades al aire libre para ni침os y adultos. Como escaladas en Bulder (Arawi Lodge) , trekking a los diferentes senderos cercanos,  un hermoso tour a vi침a Alcohuaz, as칤  como tambi칠n emocionantes cabalgatas en medio de las monta침as.


c칩moda cocina americana equipada, sala de estar con Chimenea Bosca, dos ba침os con tina, una habitaci칩n con 1 cama de 2 plazas , una habitaci칩n dos camas  1 1/2  plaza y un sill칩n cama en living. Parrilla en terraza techada, y una hermosa piscina frente a las monta침as bajo un espectacular cielo.",['Vista a las monta침as'],5.0,5,Margarita Soledad,04-2021,https://www.airbnb.cl/rooms/554588697359312470?adults=1&children=0&infants=0&pets=0&check_in=2023-02-18&check_out=2023-02-23&previous_page_section_name=1000
6,Encantadora caba침a en el valle de elqui,Caba침a entero,Paiguano,4,3,2, Habitaci칩n,1,privado,65.0,-29.99527,-70.5357,"https://maps.google.com/maps?ll=-29.99527,-70.5357&z=14&t=m&hl=es&gl=CL&mapclient=apiv3",,"Ven a disfrutar junto a tu familia a 칠ste hermoso valle de elqui. Lugar tranquilo para relajarte y disfrutar del entorno.

La caba침a est치 completamente equipada, ubicada  en un lugar estrat칠gico en el valle a unos 15 kil칩metros de Pisco Elqui y sus pisqueras y a unos 20 kil칩metros de Vicu침a.

El lugar es tranquilo, rural y campestre ideal para disfrutar de la naturaleza y por las noches ver la inmensidad de los cielos m치s claros de Chile.",['Vista al canal'],5.0,4,Yasm칤n Rocio,05-2019,https://www.airbnb.cl/rooms/35478813?adults=1&children=0&infants=0&pets=0&check_in=2023-03-05&check_out=2023-03-12&previous_page_section_name=1000
7,"PUNTA DE CHOROS Estupenda casa, maravillosa vista",Alojamiento entero,Punta de Choros,8,7,3, Habitaci칩n,3,privado,320.0,-29.2559,-71.4556,"https://maps.google.com/maps?ll=-29.2559,-71.4556&z=14&t=m&hl=es&gl=CL&mapclient=apiv3",,Crea recuerdos inolvidables en este alojamiento 칰nico y familiar. Tendras una experiencia unica en este lugar localizado en la reserva natural de Humboldt,"['Acceso a la playa', 'Frente a la playa']",5.0,6,Isabel,09-2017,https://www.airbnb.cl/rooms/562982356188294762?adults=1&children=0&infants=0&pets=0&check_in=2023-03-01&check_out=2023-03-06&previous_page_section_name=1000
8,Caba침a rustica moderna frente al mar.,Caba침a entero,La Ligua,7,6,3, Habitaci칩n,1,privado,76.0,-32.28273,-71.47133,"https://maps.google.com/maps?ll=-32.28273,-71.47133&z=14&t=m&hl=es&gl=CL&mapclient=apiv3",,"Maravillosa caba침a rustica frente al mar. Ideal para familias que buscan tranquilidad. En un espacio totalmente seguro, ideal para descansar.

Otros aspectos a destacar
Por protocolos covid la caba침a no cuenta con toallas, como medida preventiva te recomendamos traer las tuyas. Adem치s tiene un suministro 1.000 litros de agua, en caso de necesitar la recarga extra, tiene un valor de $10.000.
La tinaja ( hot tub) es un servicio adicional, no est치 incluida dentro del valor de la caba침a.","['Acceso a playa P칰blico o compartido', 'Frente a la playa']",4.81,63,Jazmin,07-2021,https://www.airbnb.cl/rooms/51299856?adults=1&children=0&infants=0&pets=0&check_in=2023-03-12&check_out=2023-03-18&previous_page_section_name=1000
9,Parcela de ensue침o en el Valle del Elqui,Alojamiento entero,Paihuano,6,3,2, Habitaci칩n,2,privado,132.0,-30.07391,-70.49276,"https://maps.google.com/maps?ll=-30.07391,-70.49276&z=14&t=m&hl=es&gl=CL&mapclient=apiv3","Ambiente rural, con acceso en camino de tierra de menos de 500m, rodeado de parcelas y de vi침as.","Desconecta de tus preocupaciones en este espacio tan amplio y sereno. Disfruta una vista privilegiada de los astros en esta c칩moda casa con una piscina grande para refrescarse y una peque침a para los ni침os. Con una arquitectura moderna, ubicado a minutos de Paihuano y de Pisco Elqui, ven a disfrutar de la magia de este lugar, la artesan칤a, el pisco, el vino y la naturaleza.


Cuenta con una habitaci칩n con una cama matrimonial y ba침o privado y otra habitaci칩n con dos camas matrimoniales",['Vista al patio'],,,Carla,12-2022,https://www.airbnb.cl/rooms/784690699421424634?adults=1&children=0&infants=0&pets=0&check_in=2023-02-23&check_out=2023-02-28&previous_page_section_name=1000
10,Don Hugo Casa de campo,Alojamiento entero,Vicu침a,6,6,3, Habitaci칩n,"2,5",privado,160.0,-30.0286,-70.67362,"https://maps.google.com/maps?ll=-30.0286,-70.67362&z=14&t=m&hl=es&gl=CL&mapclient=apiv3",Esta a 800 metros del pueblo el Arenal donde hay dos tiendas de abarrotes la antigua estaci칩n del ten elquino y Pisquera Aba que ofrece tours,"Casa de campo de 7 hect치reas. Cuenta con piscina de 14 metros de largo y 5 de ancho, jard칤n de 5 mil metros, arboles frutales y vi침a de 4 ha y 2 ha de paltos. Terraza al jard칤n y a la piscina. Terrazas frente a cada habitaci칩n. Cocina amplia con artefactos para cocinar, y todo lo necesario. Un cuarto principal con cama king Size y ba침o privado para 2 PP, un segundo cuarto para 2 PP con dos camas individuales un tercer cuarto mas peque침o para 2PP, comparten amplio ba침o completo. ba침o de visita",['Vista a las monta침as'],4.0,4,Hugo,09-2018,https://www.airbnb.cl/rooms/778848553920885672?adults=1&children=0&infants=0&pets=0&check_in=2023-02-19&check_out=2023-02-24&previous_page_section_name=1000
11,caba침a para 4 personas,Caba침a entero,Pisco Elqui,5,3,3, Habitaci칩n,1,privado,49.0,-30.12537,-70.49741,"https://maps.google.com/maps?ll=-30.12537,-70.49741&z=14&t=m&hl=es&gl=CL&mapclient=apiv3","Pisco Elqui, es tranquilo excepto en enero, febrero, julio y septiembre, llegan gran cantidad de turistas en especial j칩venes. Un lindo pueblo, donde encuentras, almacenes, frutas frescas, botillerias, restaurantes y tour astron칩micas, buenos vinos, caminatas","Disfruta la sencillez de esta caba침a,  tranquilo y c칠ntrico. Tenemos estacionamiento gratuito en la calle y uno a la entrada No apto para autos bajos.  Caba침a madera, cocina comedor, 3 habitaciones un Estar y  un ba침o amplio y  patio interior.
Este es un lugar rodeado de flores y vistas a las monta침as.  IMPORTANTE, NO ES un lugar para personas que exigen lujo y elegancia,  rural, limpio,   comodidades de una caba침a de monta침a,  cuenta con refrigerador, cocina equipada, toalla, ropa de cama.


un lugar privado, sencillo, con hermosas vistas a la monta침a y un jard칤n  de flores y  noches de estrellas.  Un antejardin de bamb칰",['Vista al patio'],,,Teresa,04-2016,https://www.airbnb.cl/rooms/775918811182860609?adults=1&children=0&infants=0&pets=0&check_in=2023-02-20&check_out=2023-02-25&previous_page_section_name=1000
12,"Caba침a Oasis diaguitas, Valle del Elqui.",Caba침a entero,Diaguitas,2,5,2, Habitaci칩n,1,privado,50.0,-30.02551,-70.64388,"https://maps.google.com/maps?ll=-30.02551,-70.64388&z=14&t=m&hl=es&gl=CL&mapclient=apiv3","Es un sector muy tranquilo a 1.5 km del pueblo de Diaguitas, donde vivimos 12 familias, cada una cuenta con casi 1 hect치rea de tierra fertil con arboles frutales organicos y caba침as para el turismo. La gran mayoria de los vecinos se dedica al arriendo de caba침as, carpinteria, agricultura y turismo.","La caba침a esta ubicada  a los pies de la monta침a Mamalluca, espec칤ficamente en el Pueblo de Diaguitas, a solo 1 hora de La Serena y a 8 Km de Vicu침a. Si lo que buscas es desconexion  y relajo esta es tu opci칩n. 
Tambi칠n contamos con un  espacio donde encontraras informaci칩n tur칤stica, jugos naturales, desayunos, s치ndwich, arriendo de bicicletas y mas.
* Las caba침as no cuentan con wifi, pero podemos compartir en casos puntuales.


La caba침a cuenta con todo lo necesario para disfrutar de una c칩moda estad칤a , tiene dos habitaciones separadas, un ba침o privado, una cocina c치lida con luz natural, el living comedor y una amplia terraza techada, donde podr치s disfrutar de los atardeceres mas coloridos que hayas visto.  Los espacios est치n bien distribuidos .Esta construida sobre pilares   de 70 cm .con una terraza de madera desde donde se puede contemplar las monta침as  y el Valle de Elqui. Tambi칠n cuenta con estacionamiento y un espacio com칰n  con hamacas. Por las noches pueden disfrutar del maravilloso cielo estrellado y en el dia de un entorno natural que invita al relajo y contemplaci칩n.",['Acceso al lago'],4.87,45,Erika,08-2018,https://www.airbnb.cl/rooms/27523453?adults=1&children=0&infants=0&pets=0&check_in=2023-02-17&check_out=2023-02-22&previous_page_section_name=1000
13,Casa grande y acogedora,Alojamiento entero,Coquimbo,9,7,5, Habitaci칩n,3,privado,160.0,-30.2804,-71.5018,"https://maps.google.com/maps?ll=-30.2804,-71.5018&z=14&t=m&hl=es&gl=CL&mapclient=apiv3",,"Desconecta de tus preocupaciones en este espacio tan amplio y sereno. Con linda vista a Tongoy y al paisaje del norte, con un cielo impactante y un silencio maravilloso. La playa esta muy cerca y el clima siempre acompa침a.

Otros aspectos a destacar
Tenemos opci칩n de arriendo de jacuzzi por d칤as.",['Acceso la playa P칰blico o compartido'],5.0,4,Karina,02-2019,https://www.airbnb.cl/rooms/676974841375185230?adults=1&children=0&infants=0&pets=0&check_in=2023-02-22&check_out=2023-02-27&previous_page_section_name=1000
14,Eco Loft en Huentelauqu칠n Norte,Alojamiento entero,Canela,5,5,2, Habitaci칩n,1,privado,135.0,-31.53321,-71.57294,"https://maps.google.com/maps?ll=-31.53321,-71.57294&z=14&t=m&hl=es&gl=CL&mapclient=apiv3",,"Sorprendente Loft Playero, gran vista panor치mica al mar y valles interiores, a pasos de playa Agua Dulce y muy cerca de otras lindas playas: El Pe침칩n, Maitencillo
Ideal para escapada de fin de semana, desconexi칩n y relajo garantizado Disfrutar de una impactante naturaleza, de los mejores cielos estrellados del norte, paseos por el borde costero, humedales, etc 
Casa sustentable, funciona con energ칤a el칠ctrica solar y el agua con cami칩n aljibe, lo que invita a un uso responsable de estos recursos


Interior amplio y luminoso, cuenta con cocina totalmente equipada, un ba침o, dos dormitorios semi-integrados al estar comedor, fog칩n y parrilla en espacio exterior inmerso en la vegetaci칩n del lugar, todo con espectaculares vistas al mar y borde costero.",['Acceso a la playa'],,,Juan Ignacio,07-2014,https://www.airbnb.cl/rooms/774791051381010082?adults=1&children=0&infants=0&pets=0&check_in=2023-02-27&check_out=2023-03-06&previous_page_section_name=1000
15,Caba침a equipada frente al observatorio Mamalluca.,Caba침a entero,Vicu침a,5,4,2, Habitaci칩n,1,privado,46.286,-29.98689,-70.67867,"https://maps.google.com/maps?ll=-29.98689,-70.67867&z=14&t=m&hl=es&gl=CL&mapclient=apiv3",,"Caba침a ubicada a los pies del cerro Mamalluca, en una parcela , frente al observatorio Mamalluca, a 15 minutos de la ciudad de Vicu침a, ideal para desconectarse, estar en pareja o venir con amigos, hacer observaci칩n a cielo abierto, astro-fotograf칤a . Espacio libre de discriminaci칩n.

El espacio
El espacio es aislado de urbanizaciones, con cielos n칤tidos para observaci칩n de los astros.
La caba침a cuenta con sistema fotovoltaico y agua de vertiente,agua caliente en ba침o.",['Vista a las monta침as'],4.78,49,Ignacio,01-2013,https://www.airbnb.cl/rooms/41068557?adults=1&children=0&infants=0&pets=0&check_in=2023-02-22&check_out=2023-03-01&previous_page_section_name=1000
16,Caba침as hogare침as con piscina Los trigales,Caba침a entero,Guanaqueros,4,4,2, Habitaci칩n,1,privado,55.012,-30.21586,-71.41684,"https://maps.google.com/maps?ll=-30.21586,-71.41684&z=14&t=m&hl=es&gl=CL&mapclient=apiv3","Ambiente muy tranquilo, el sector es muy hogare침o y seguro ya que nuestros abuelos viven al lado en otra parcela y hay vigilancia","Rel치jate con toda la familia en este tranquilo lugar para quedarse.
cuenta con piscina amplio lugar para mascotas
Contamos con una caba침a bien equipada con cocina, living comedor,ba침o con tina y dos dormitorios 
cuenta con TV CABLE 
agua caliente 
lugar super tranquilo


Espacio amplio para jugar o correr",['Cocina'],,,Gabriel Anibal,01-2023,https://www.airbnb.cl/rooms/795827064237298169?adults=1&children=0&infants=0&pets=0&check_in=2023-02-24&check_out=2023-03-02&previous_page_section_name=1000
17,Depto. interior a minutos de la playa y valleElqui,Alojamiento entero,La Serena,4,3,2, Habitaci칩n,1,privado,62.7,-29.9319,-71.24327,"https://maps.google.com/maps?ll=-29.9319,-71.24327&z=14&t=m&hl=es&gl=CL&mapclient=apiv3","El barrio es precioso, residencial, muy tranquilo y con mucha vegetaci칩n y parques. Adem치s, cerca hay negocios, panader칤a, supermercados, restaurantes, gasolinera, cajeros, etc. Dejar칠 un mapa con todas las indicaciones para que disfrutes tu estad칤a al m치ximo!!!","Nuestro espacio es un departamento conectado y ubicado al interior de una casa de gran tama침o, decorado y hecho con mucho cari침o. Cuenta con un dormitorio con cama matrimonial y TV, uno con cama peque침a. Una cocina grande con comedor, living/biblioteca con fut칩n, ba침o, un huerto y espacio exterior que es muy agradable para comer, meditar jugar o disfrutar de la tranquilidad del sector, donde abundan los 치rboles, las plazas y todo tipo de servicios (pubs, supermercado, restaurantes, etc.)


Nuestro espacio es encantador, pues lo hemos hecho poco a poco con cari침o y dedicaci칩n junto a mi hija. Adem치s, es c칩modo y en el entorno se respira la paz del sector con su abundante vegetaci칩n. Sin embargo, a pocos minutos en veh칤culo ya est치s en la playa o en el centro de la ciudad.",['Vista a las monta침as'],4.94,17,Josefa,01-2023,https://www.airbnb.cl/rooms/34742564?adults=1&children=0&infants=0&pets=0&check_in=2023-02-17&check_out=2023-02-22&previous_page_section_name=1000
18,"Arriendo de Caba침a N춿1 en Los Vilos, IV Reg",Caba침a entero,Los Vilos,5,5,3, Habitaci칩n,1,privado,65.0,-31.9099,-71.4976,"https://maps.google.com/maps?ll=-31.9099,-71.4976&z=14&t=m&hl=es&gl=CL&mapclient=apiv3",,"Arriendo de Caba침a en Los Vilos para empresas, viajeros y/o turistas.

Caba침a cuenta con 3 dormitorios, 1 ba침os, living comedor y TV Cable.

Ubicada en calle 1 sur con esquina 3 oriente, sector ideal para empresas que vengan por proyectos y/o trabajos de largo plazo.

Cuenta con 4 camas individuales y una matrimonial.
El precio incluye gastos comunes de agua, luz, TV cable, Wifi y servicio de aseo diario.

Ven a disfrutar de la tranquilidad, relajo y belleza de Los Vilos.",['Cocina'],4.50,4,Julio,07-2022,https://www.airbnb.cl/rooms/729669509532154948?adults=1&children=0&infants=0&pets=0&check_in=2023-02-19&check_out=2023-02-24&previous_page_section_name=1000
19,Casa campo con piscina y tinaja,Alojamiento entero,Coquimbo,11,8,4, Habitaci칩n,"2,5",privado,88.2,-30.06,-71.2537,"https://maps.google.com/maps?ll=-30.06,-71.2537&z=14&t=m&hl=es&gl=CL&mapclient=apiv3",,Lleva a toda la familia a este fant치stico lugar con muchas zonas para disfrutar de unos d칤as de relajo .,['Vista a las monta침as'],5.0,5,Enrique,11-2020,https://www.airbnb.cl/rooms/792865932033552118?adults=1&children=0&infants=0&pets=0&check_in=2023-03-02&check_out=2023-03-07&previous_page_section_name=1000
20,Refugio de Monta침a en valle Choapa,Casa de campo entero,Cuncumen,4,4,2, Habitaci칩n,1,privado,65.0,-31.9116,-70.622,"https://maps.google.com/maps?ll=-31.9116,-70.622&z=14&t=m&hl=es&gl=CL&mapclient=apiv3",,"Caba침a en la monta침a a 50 metros Del R칤o Choapa, en un valle inexplorado de monta침as, pozones y cascadas. A los pies de la cordillera de los Andes cercano al pueblo Cuncumen. 

La casa est치 en una parcela familiar de 9 hect치reas. Ideal para venir en familia o para explorar las monta침as de la zona.

Dos habitaciones y capacidad para 4 personas en 3 c칩modas camas. Hay una cama extra para ni침os.",['Vista al desierto'],,,Meli,03-2015,https://www.airbnb.cl/rooms/789215504949612908?adults=1&children=0&infants=0&pets=0&check_in=2023-02-17&check_out=2023-02-22&previous_page_section_name=1000
