,Titulo1,Titulo2,Comuna,Capacidad,Camas,N_Habitaciones,Habitaciones,Baños,Tipo_Baños,Precio,lat,lon,Ubicacion,Ubides,Descripcion,Servicios,Nota,Nnota,Anfitrion,Registro,Link
0,Hermoso Departamento frente al mar,Vivienda rentada entero,Coquimbo,4,3,2, Habitación,2,privado,79.2,-30.1938,-71.4312,"https://maps.google.com/maps?ll=-30.1938,-71.4312&z=14&t=m&hl=es&gl=CL&mapclient=apiv3",,"Relájate en este espacio full equipado, tranquilo y elegante. 
Ideal para disfrutar en pareja o en familia, con vista al mar en primera línea frente a la bahía de Coquimbo y La Serena. 
Se encuentra ubicado a 16 km de Aeropuerto, a 2 km del casino Enjoy y la vida nocturna. 
Cercano a supermercados, restaurantes.


Departamento ubicado en piso 8, Full equipado para 3-4 personas.
Cuenta con dormitorio principal con cama de 2 plazas, baño en suite y un amplio closet y otra habitación con cama de 1 plaza y media y si desea se ofrece un cómodo futón. 
Cocina equipada.
Posee un amplio balcón que conecta al living para contemplar los maravillosos y coloridos atardeceres. 
El edificio posee Conserjería y Vigilancia 24/7.",['Vista a la bahía'],,,Daniela,09-2022,https://www.airbnb.cl/rooms/823868696363988381?adults=1&children=0&infants=0&pets=0&check_in=2023-02-22&check_out=2023-02-27&previous_page_section_name=1000&federated_search_id=cf39da70-ecec-477e-ad9f-ba06ba825709
1,Maravilloso depto Puerto Velero 3D 3B,Vivienda rentada entero,Puerto Velero,8,6,3, Habitación,3,privado,140.0,-30.2368,-71.4774,"https://maps.google.com/maps?ll=-30.2368,-71.4774&z=14&t=m&hl=es&gl=CL&mapclient=apiv3",,"Sorprendente y relájate como nunca en este hermoso y exclusivo lugar, ubicado en un quinto piso, con doble terraza, donde tendrás unos amaneceres inolvidables y unas puestas de sol soñadas. 
Disfruta tu estadía con playas privadas paradisíacas, piscinas de agua dulce y salada. Supermercados  en el interior del resort, como también restoranes y diversas actividades para grandes y pequeños.
Como si fuera poco, tienes lugares cercanos como tongoy, guanaquero donde encontrarás ostiones y ostras.


Tranquilidad y belleza en el entorno.",['Vista a la bahía'],,,Andres,01-2017,https://www.airbnb.cl/rooms/806689333270005138?adults=1&children=0&infants=0&pets=0&check_in=2023-02-26&check_out=2023-03-03&previous_page_section_name=1000&federated_search_id=cf39da70-ecec-477e-ad9f-ba06ba825709
2,Hermoso departamento frontal primera línea,Vivienda rentada entero,La Serena,5,3,2, Habitación,2,privado,57.571,-29.9143,-71.27547,"https://maps.google.com/maps?ll=-29.9143,-71.27547&z=14&t=m&hl=es&gl=CL&mapclient=apiv3",,"Hermoso departamento frontal primera línea, de la terraza una vista a toda la Avenida del Mar y la playa. Piso 7, Estacionamiento, 2d 2b y 1 futón, piso flotante nuevo, cocina americana, TV, Wi Fi, Juegos de Mesa para jugar en familia y una linda hamaca en terraza. Equipamiento Edificio: Gimnasio, cancha de tenis, sala de pool, piscina, sauna, quincho, conserje 24/7, juegos para niño, áreas verdes, sala de eventos. Las camas cuentan con sábanas y cobertor. se dejan 2 Toallas desechables",['Vista a la bahía'],4.92,74,Jorge,02-2019,https://www.airbnb.cl/rooms/53990952?adults=1&children=0&infants=0&pets=0&check_in=2023-03-08&check_out=2023-03-15&previous_page_section_name=1000&federated_search_id=cf39da70-ecec-477e-ad9f-ba06ba825709
3,Depto. recién renovado - Zona libre Tsunami,Vivienda rentada entero,Coquimbo,6,3,2, Habitación,2,privado,33.0,-29.96006,-71.34082,"https://maps.google.com/maps?ll=-29.96006,-71.34082&z=14&t=m&hl=es&gl=CL&mapclient=apiv3","Este departamento se encuentra en una ubicación privilegiada. Esta a solo dos cuadras del centro y cinco cuadras del nuevo Mall Vivo de Coquimbo. En la primera planta, por afuera se encuentra un negocio. Tambien, detrás del edificio hay un negocio donde puede comprar prácticamente de todo (esta en la esquina de O'Higgins con Montt).
Camino hacia el centro se encuentra el supermercado Santa Isabel que se encuentra en calle Anibal Pïnto 1551.","El departamento (74 metros cuadrados) cuenta con dormitorio matrimonial con baño, pieza de visitas (dos camas), baño de visitas, un  living comedor con sofá cama de plaza y media.   TV Directv Glod.  El edificio  esta ubicado a 5 min. caminando del centro de Coquimbo y a 7  min. en vehículo de la playa la Herradura y playa de coquimbo. El departamento tiene mallas de protección para niños. Vista a toda la bahía de Coquimbo y la Serena desde el mirador que se encuentra arriba del edificio.


Este departamento esta ubicado en un edificio que esta a 5 minutos caminando del Mall Coquimbo  y 7 minutos en vehículo de la Playa de La Herradura y de la Playa de Coquimbo.",['Cocina'],4.78,96,Humberto,05-2013,https://www.airbnb.cl/rooms/16670535?adults=1&children=0&infants=0&pets=0&check_in=2023-02-26&check_out=2023-03-03&previous_page_section_name=1000&federated_search_id=cf39da70-ecec-477e-ad9f-ba06ba825709
4,Las Tacas - Arriendo depto. Vista al Mar- Coquimbo,Vivienda rentada entero,Coquimbo,8,7,3, Habitación,2,privado,168.0,-30.08489,-71.37271,"https://maps.google.com/maps?ll=-30.08489,-71.37271&z=14&t=m&hl=es&gl=CL&mapclient=apiv3","El condominio cuenta con Restaurantes, mini market, pescadería, y todo lo necesario para el día a dia","Departamento en Las Tacas para 8 personas a 150 mts de la playa , con una vista privilegiada al mar y la bahía. Totalmente equipado. 3 dormitorios, principal en suite, 2 baños, Terraza.

Accesos controlados, piscina, áreas verdes, estupenda playa, minimarket, pescaderia, restaurant, canchas de Tenis y Paddle, Quincho para asados, escuela de surf y buceo, etc.
Senderos para pasear, trotar, andar en bicicleta


Las Tacas esta ubicado a 15 km al sur de Coquimbo. Es un balneario que permite muchas alternativas diferentes tanto en la playa como deportivas, además de su cercanía a diferentes puntos atractivos de la IV Region, como La Serena, El valle de Elqui, Punta de Choros, Parque Fray Jorge, etc. 
Cuenta con un completo equipamiento, servicios y  seguridad que dan tranquilidad y entretención a toda la familia.",['Vista a la bahía'],5.0,38,Manuel,12-2015,https://www.airbnb.cl/rooms/21726892?adults=1&children=0&infants=0&pets=0&check_in=2023-03-02&check_out=2023-03-07&previous_page_section_name=1000&federated_search_id=cf39da70-ecec-477e-ad9f-ba06ba825709
5,Espectacular Depto con enorme jardín y vista,Vivienda rentada entero,Puerto Velero,6,7,4, Habitación,3,privado,210.714,-30.237,-71.47854,"https://maps.google.com/maps?ll=-30.237,-71.47854&z=14&t=m&hl=es&gl=CL&mapclient=apiv3","El Condominio Puerto Velero cuenta con numerosas piscinas de uso abierto para todos los huéspedes, dos piscinas de mar, restoranes y bares con excelente y variada cocina. Cuenta con vigilancia 24/7 y amplio esparcimiento y diversión para niños, jóvenes y adultos.
Además cuenta con supermercado, canchas deportivas (tenis, fútbol, volleyboll), spa, gimnasio, cancha de golf y marina. La playa Socos, por su parte, es quizás la mejor playa de Chile.
Tongoy se encuentra a solo 10 minutos en auto y cuenta con farmacias, supermercados, verdulerías, feria, caleta de pescadores, excelentes restoranes y lugares para pasear.","Este departamento cuenta con amplio espacio de esparcimiento y privacidad para sus ocupantes. 3 baños equipados con ducha, 4 habitaciones, cocina con full equipamiento, lavavajillas, lavarropas y secadora. 
El departamento cuenta con living cómodo, espacioso y acogedor. El comedor cuenta con amplia y elegante mesa de piedra. 
La terraza da a un enorme jardín y a una asombrosa vista a la Bahía de Tongoy.

Por 35mil extra al día puedes contratar los servicios de cocinera y asesora del hogar.


El departamento está amoblado con motivos marítimos y se encuentra a una distancia equidistante entre la playa y la piscina de mar.",['Vista a la bahía'],4.79,19,Fran,05-2012,https://www.airbnb.cl/rooms/574678466386909984?adults=1&children=0&infants=0&pets=0&check_in=2023-02-27&check_out=2023-03-06&previous_page_section_name=1000&federated_search_id=cf39da70-ecec-477e-ad9f-ba06ba825709
6,Departamento 3er piso Primera Línea La Herradura,Vivienda rentada entero,Coquimbo,7,6,3, Habitación,2,privado,50.0,-29.98279,-71.35332,"https://maps.google.com/maps?ll=-29.98279,-71.35332&z=14&t=m&hl=es&gl=CL&mapclient=apiv3",,"Lindo y nuevo departamento ubicado en la primera línea de la playa de La Herradura con acceso directo a la playa, piscina y gimanasio disponibles. Ubicado en el tercer piso con vista a toda la bahía de La Herradura.",['Vista a la bahía'],4.71,51,Federico,03-2014,https://www.airbnb.cl/rooms/47720891?adults=1&children=0&infants=0&pets=0&check_in=2023-03-13&check_out=2023-03-18&previous_page_section_name=1000&federated_search_id=cf39da70-ecec-477e-ad9f-ba06ba825709
7,Primera Linea - Vista espectacular al mar,Vivienda rentada entero,Puerto Velero,8,7,3, Habitación,3,privado,217.143,-30.24035,-71.47932,"https://maps.google.com/maps?ll=-30.24035,-71.47932&z=14&t=m&hl=es&gl=CL&mapclient=apiv3",,"Condominio de máxima y confort.
Minimarket, cancha golf par 3, canchas de Tenis, Gimnasio y Piscina temperada

Departamento full equipado.
Cocina completa con  lavavajillas, lavadora y secadora.
2 SMART TV LCD HD y  Cable.
Wi Fi
a 60 metros de ascensor a playa.
Cuenta con acceso directo a playa, 50 metros aprox.
Acceso directo a piscinas y piscinas de mar, 60 metros aprox
 2 estacionamientos


a 5 minutos de Tongoy,  para la compra de suministros y especialmente de mariscos. Tongoy cuenta además con una caleta de pescadores y restaurantes de muy buen nivel","['Acceso a la playa', 'Frente a la playa']",,,Fernando,05-2015,https://www.airbnb.cl/rooms/6783292?adults=1&children=0&infants=0&pets=0&check_in=2023-02-26&check_out=2023-03-05&previous_page_section_name=1000&federated_search_id=cf39da70-ecec-477e-ad9f-ba06ba825709
8,Espectacular vista y ubicación en Puerto Velero!,Vivienda rentada entero,Coquimbo,5,4,2, Habitación,2,privado,152.0,-30.24608,-71.45949,"https://maps.google.com/maps?ll=-30.24608,-71.45949&z=14&t=m&hl=es&gl=CL&mapclient=apiv3",,"PH en Puerto Velero con espectacular vista panorámica al mar. Se ubica a solo pasos de la playa y piscinas del resort. Posee 2 dormitorios y 2 baños completamente equipado para 5 personas. Perfecto para familias con niños o parejas.

La propiedad cuenta con wifi, Smart TV de 75 y 55’’ con acceso a Netflix y Amazon Prime para noches de cine. Gran estacionamiento privado techado. Incluye sábanas y toallas.


El departamento posee lavavajilla, lavadora/secadora, micro-onda, hervidor eléctrico, juguera, secador de pelo, parrilla eléctrica y TV 75’ y 55’.

El condominio cuenta con múltiples areas verdes, piscinas, piscinas naturales, zona de quinchos, canchas de tennis, golf, pádel y futbolito. También hay Restaurant, cafetería, mini-market, zona de Spa, peluquería entre otros servicios.

Actividades especiales en temporada alta : yoga, escuela de futbol, voleibol, patrulla infantil, entre otros

Acceso controlado. Seguridad las 24 horas.

Tongoy se encuentra a 10 minutos en auto.

Guanaqueros a 13 minutos en auto.

Coquimbo y La Serena a 35 minutos en Auto.

Ovalle a 50 minutos en auto.",['Vista a la bahía'],4.91,35,Pedro,12-2015,https://www.airbnb.cl/rooms/46584343?adults=1&children=0&infants=0&pets=0&check_in=2023-02-26&check_out=2023-03-03&previous_page_section_name=1000&federated_search_id=cf39da70-ecec-477e-ad9f-ba06ba825709
9,Maravilloso Departamento con SPA Frente al Mar.,Vivienda rentada entero,Coquimbo,6,5,2, Habitación,2,privado,99.0,-29.9825,-71.3522,"https://maps.google.com/maps?ll=-29.9825,-71.3522&z=14&t=m&hl=es&gl=CL&mapclient=apiv3","Es de primer nivel, no existe delincuencia en el sector y la conectividad es muy buena ya que se llega por la Ruta 5 Norte y desde allí se accede a Supermercados, hospital, lugares de esparcimiento, otras playas, etc.","Arriendo precioso Departamento con SPA en Condominio Costa Herradura de Coquimbo.
Se ubica en Primera Linea Costera, piso 6, JUSTO FRENTE AL MAR equipado completamente con todo lo necesario para darse unos merecidos días de descanso. Tiene en la azotea un SPA con instalaciones gratuitas de Baños de Vapor, Sauna, Gimnasio y ademas un Jacuzzi panorámico a bajo costo con vista al mar y las estrellas, previa reserva
Cuenta ademas con una hermosa Piscina, Quinchos y acceso directo a la Playa.


Este departamento es nuevo y de alta calidad, se ubica en la mejor playa de Coquimbo, es como estár en la playa misma. El sector es bastante bueno, se puede caminar de noche y día sin preocupaciones, no hay saturación vehicular, hay buenos restaurantes cerca, lugares de esparcimiento, muy buena conectividad, los jardines del condominio son hermosos e incluso se pueden practicar deportes náuticos ya que el mar es muy tranquilo. En el edificio se alquilan Kayaks para salir a navegar durante el día con precios especiales para huéspedes. En suma, es un paraíso.",['Vista a la bahía'],4.85,153,Isabel,09-2018,https://www.airbnb.cl/rooms/23963186?adults=1&children=0&infants=0&pets=0&check_in=2023-02-27&check_out=2023-03-04&previous_page_section_name=1000&federated_search_id=cf39da70-ecec-477e-ad9f-ba06ba825709
10,"Excelente Dpto equipado Condominio nuevo,Vista mar",Condo entero,La Serena,4,3,2, Habitación,2,privado,49.0,-29.92516,-71.27619,"https://maps.google.com/maps?ll=-29.92516,-71.27619&z=14&t=m&hl=es&gl=CL&mapclient=apiv3",,"Condominio nuevo  a pasos de la playa (Terrazas del Sol 3 ). Vista al mar ; ubicación en zona segura y  Restaurantes.  
Depto para 4 personas. Pacífico esq Los Perales, a una cuadra de la playa. 2 dormitorios 2 baños Dormitorio 1: cama matrimonial con baño. Dormitorio 2: 2 camas 1 plaza. Closets en todos los dormitorios. Living comedor. TV más Netflix.  Cocina. Piso 6 con vista al mar, 2 ascensores. Estacionamiento. Conserjería 24 horas, piscina, lavandería. gimnasio, quincho, juegos infantiles.


Ubicado en sector privilegiado y exclusivo   , cerca de playa, restaurantes, etc.
Sector seguro.
Acceso a TV (dos) , wi fi  e   incluye Netflix.",['Acceso a la playa'],5.0,20,Jorge Felipe,06-2019,https://www.airbnb.cl/rooms/35709967?adults=1&children=0&infants=0&pets=0&check_in=2023-02-27&check_out=2023-03-05&previous_page_section_name=1000&federated_search_id=cf39da70-ecec-477e-ad9f-ba06ba825709
11,"Playa Blanca, Tongoy, Coquimbo, La Serena, Chile",Vivienda rentada entero,Playa Blanca,7,8,3, Habitación,2,privado,200.0,-30.22204,-71.47724,"https://maps.google.com/maps?ll=-30.22204,-71.47724&z=14&t=m&hl=es&gl=CL&mapclient=apiv3","Muchos lugares cerca para ir a visitar como Tongoy donde sus ostiones son maravillosos, restaurantes típicos deliciosos. Mercado dos veces por semana donde se encuentra desde frutas y verduras hasta ropa y artesanía. También está cerca de totoralillo para quienes quieren disfrutar del surf. Coquimbo y La Serena están a 30 minutos en automovil.","Este departamento está ubicado en primera linea frente al mar, tiene tres piscinas una de ellas es temperada, jacuzzi común,gimnasio, sauna, cancha de paddle tennis,restaurant y pequeño almacén. 
Espacio de mucha luz, consta de dos terrazas una techada y sobre ella una segunda que está  en lo más alto del edificio donde se puede en observar el paisaje a la redonda. 
Cocina americana para cocinar mirando el mar. 
Livin comedor, dormitorio principal y segundo dormitorio todos con vista al mar.
.


Este departamento que fue mi casa por dos años, es un lugar especial donde encuentras paz, tranquilidad, vida al aire libre. Perdido entre desierto y mar pasé un tiempo importante escibiendo y disfrutando del océano. Deportes náuticos, caminatas a la puesta de sol. Es un lugar que te hace sentirte parte de él desde siempre y para siempre.",['Cocina'],4.71,34,Zorka,05-2018,https://www.airbnb.cl/rooms/24771937?adults=1&children=0&infants=0&pets=0&check_in=2023-03-03&check_out=2023-03-08&previous_page_section_name=1000&federated_search_id=cf39da70-ecec-477e-ad9f-ba06ba825709
12,"Departamento a pasos de la playa, Peñuelas",Vivienda rentada entero,Coquimbo,5,4,2, Habitación,2,privado,63.0,-29.95875,-71.30974,"https://maps.google.com/maps?ll=-29.95875,-71.30974&z=14&t=m&hl=es&gl=CL&mapclient=apiv3",,"Disfruta de una rica estadía frente al mar, con bellos atardeceres, una vista hacia toda la costa y todas las comodidades necesarias. Cuenta con piscina, quinchos y gimnasio. A pasos de la playa si quieres renovarte de energías. Muy cerca de restaurantes.

Otros aspectos a destacar
El departamento sólo cuenta con toallas de mano.

Está en un 5to piso, estacionamiento dentro del condominio.","['Acceso a la playa', 'Frente a la playa']",4.85,114,Maria Jose,04-2018,https://www.airbnb.cl/rooms/47566645?adults=1&children=0&infants=0&pets=0&check_in=2023-03-05&check_out=2023-03-11&previous_page_section_name=1000&federated_search_id=cf39da70-ecec-477e-ad9f-ba06ba825709
13,"♥ Tu Destino, Tu Vista, Tu SPA ☀",Vivienda rentada entero,Coquimbo,4,3,2, Habitación,2,privado,80.0,-29.9825,-71.3522,"https://maps.google.com/maps?ll=-29.9825,-71.3522&z=14&t=m&hl=es&gl=CL&mapclient=apiv3","Área tranquila y exclusiva en playa La Herradura. Minimarket, restaurantes y miradores a pocos pasos de distancia.

En auto: Cine y Mall Vivo Coquimbo a 6 minutos, Supermercado Santa Isabel y Telepizza a 3 minutos, Casino Enjoy Coquimbo a sólo 10 minutos. La Serena a 15 minutos.

Turismo: Puedes llegar en 90 minutos a Pisco Elqui, una experiencia inolvidable. Si contratas alguna agencia turística en la región, puedes llegar a la hermosa Isla Damas.","Nuestros huéspedes lo dicen: Es el lugar perfecto para vacaciones o escapes de la ciudad ☀.
Te ofrecemos un lugar Nuevo e Impecable, con una Vista infinita al mar, Spa,  Acceso directo a la playa, Piscina, ¡y mucho más!
Tendrás 2 habitaciones, 2 baños completos, cocina full-equipada, TV cable, HBO Max, Wifi, Audio bluetooth, Libros y  más. ¡Nuestra hospitalidad hará que te sientas como en casa!. 
Nos encargaremos de que tu experiencia sea increíble y garantizamos que vas a volver a visitarnos ♥.


Completamente equipado (utensilios de cocina, ollas, vajilla, cubiertos, vasos, copas, ... ¡todo lo que imaginas! ).
Incluye sistema de sonido portátil Bose (bluetooth), WiFi de alta velocidad y calidad, HBO Max, TV cable, libros, revistas, 1 silla de playa, sombrilla y mucho más. ¿Necesitas algo adicional? ¡Consúltanos y veremos cómo ayudarte!",['Vista a la marina'],4.98,127,Carlos,06-2017,https://www.airbnb.cl/rooms/19311735?adults=1&children=0&infants=0&pets=0&check_in=2023-03-01&check_out=2023-03-06&previous_page_section_name=1000&federated_search_id=cf39da70-ecec-477e-ad9f-ba06ba825709
14,Acogedor y moderno departamento en Puerto Velero,Vivienda rentada entero,Coquimbo,5,4,2, Habitación,2,privado,180.0,-30.23936,-71.47585,"https://maps.google.com/maps?ll=-30.23936,-71.47585&z=14&t=m&hl=es&gl=CL&mapclient=apiv3","En las cercanías están las cafeterías, piscinas, playa, restaurantes, clases deportivas, spa, tiendas, lugares para trotar, senderos y juegos para niños. También existen canchas de golf, fútbol, tenis, quinchos para asados, marina, clases de buceo dentro del resort.","Acogedor, moderno y nuevo departamento en Puerto Velero pensado para el relajo: terraza equipada, cómodas camas, equipamiento de primer nivel, acceso restringido y seguridad.
Habitación principal con cama King y baño en suite, y resto con camas de plaza y media, con colchones ortopédicos.
Internet fibra óptica, televisión, cocina completa, lavadora, calefacción y termopanel, cafetera, sistema de iluminación. 
Tranquilidad junto a todas las comodidades.


Ubicado en un primer piso, tiene un acceso único a la piscina y hacia los jardines del edificio, con entrada directa desde la terraza y una fabulosa vista del atardecer en la playa.
Dos estacionamientos disponibles para mayor comodidad.",['Vista al horizonte de la ciudad'],4.79,62,Diego,03-2018,https://www.airbnb.cl/rooms/31240047?adults=1&children=0&infants=0&pets=0&check_in=2023-02-26&check_out=2023-03-03&previous_page_section_name=1000&federated_search_id=cf39da70-ecec-477e-ad9f-ba06ba825709
15,La Mejor Vista Al Mar,Vivienda rentada entero,Coquimbo,6,5,2, Habitación,2,privado,130.0,-29.95827,-71.30862,"https://maps.google.com/maps?ll=-29.95827,-71.30862&z=14&t=m&hl=es&gl=CL&mapclient=apiv3",,"Departamento nuevo, full equipado al frente del mar, vista extraordinaria de la bahía Serena Coquimbo, con lavandería, gimnasio, estacionamiento, quincho, piscina grande y pequeña, sala de juegos multiuso , cerca de centro gastronómico de peñuelas y enjoy coquimbo.

El espacio
Ideal para descansar, vacaciones, caminatas por la playa y/o running, bicicletas, skyters, voleball playa.. natación,",['Cocina'],4.54,13,Jorge,01-2019,https://www.airbnb.cl/rooms/42878228?adults=1&children=0&infants=0&pets=0&check_in=2023-02-25&check_out=2023-03-02&previous_page_section_name=1000&federated_search_id=cf39da70-ecec-477e-ad9f-ba06ba825709
16,Hermoso departamento en Puerto Velero.,Vivienda rentada entero,Puerto Velero,6,6,2, Habitación,2,privado,85.0,-30.23872,-71.47572,"https://maps.google.com/maps?ll=-30.23872,-71.47572&z=14&t=m&hl=es&gl=CL&mapclient=apiv3",,,['Cocina'],4.63,43,Carolina,06-2018,https://www.airbnb.cl/rooms/32515647?adults=1&children=0&infants=0&pets=0&check_in=2023-03-12&check_out=2023-03-17&previous_page_section_name=1000&federated_search_id=cf39da70-ecec-477e-ad9f-ba06ba825709
17,Necesitas varias camas ? Dos Estacionamientos ?,Condo entero,Coquimbo,10,8,3, Habitación,2,privado,55.569,-29.9782,-71.2488,"https://maps.google.com/maps?ll=-29.9782,-71.2488&z=14&t=m&hl=es&gl=CL&mapclient=apiv3","Sector Residencial con buenos accesos. Si quieres trasladarte a varios balneareos de la region o el valle del Elqui, el depto esta ubicado estrategicamente, permientiendo escapar del taco de la Ruta 5 y la Avenida del Mar. Tiene varios supermercados alrededor y el mas cercano es Tottus a 2 KM. Botillerias, verdulerias, comida china y rapida general a una cuadra del condominio.

Si llegas desde Santiago, puedes esquivar el taco de la ruta 5 Norte que comienza en La Herradura. Como ?? ingresando por la Ruta 427 que conecta Tongoy con la carretera Ovalle-Coquimbo. Waze siempre te manda por esta opción en horarios de punta.","Muy comodo en primer piso , 90 mt2 (precio varia según la cantidad de huespedes), todos en sus respectivas camas. Cuenta con quincho y sala de estar para reuniones familiares, zona de juegos y piscina. Wifi Movistar 500, SmatTV de 58 y 43 pulgs,  Dos Estacionamientos.
Princial en Suite con Cama Matrimonial.
Seg Dormitorio con Camarote modular: 4 Cam  1 Plaza
Tercer Domitorio con Camorote modular: 2 Cams de 1 Plaza y 1 Cama Matrimonial. Se reciben mascotas


Ideal para un grupo numeroso ( en mi familia cercana somos 10 y por eso esta bien habilitado), no existen muchas ofertas con este equilibrio de  precio y calidad.  Generalmente a los deptos en la zona, les agregan futon o sofacama, aqui  dejamos libre el living y comedor para compartir con la familia, mientras el resto  pueden seguir teniendo un sueño reparador sueño hasta la hora que quieran ¡¡¡",['Vista a las montañas'],4.75,16,Jorge,05-2019,https://www.airbnb.cl/rooms/53362038?adults=1&children=0&infants=0&pets=0&check_in=2023-02-27&check_out=2023-03-04&previous_page_section_name=1000&federated_search_id=cf39da70-ecec-477e-ad9f-ba06ba825709
18,Las Tacas Excelente Vista y Primera Linea,Vivienda rentada entero,Coquimbo,7,5,3, Habitación,2,privado,120.0,-30.08486,-71.37193,"https://maps.google.com/maps?ll=-30.08486,-71.37193&z=14&t=m&hl=es&gl=CL&mapclient=apiv3",El resort de Las Tacas es un lugar muy seguro con un espacio muy acogedor y familiar. Está a 30 minutos de la Serena hacia el norte y a pocos minutos de Tongoy y Guanaqueros hacia el Sur.,"Resort de Las Tacas es uno de los más importantes que existen en Chile.
Un lugar para disfrutar del relajo y las bondades de la cuarta región.
Una Playa increíble y exclusiva.

El espacio
Resort Las Tacas, cuya playa es un paraíso, podrás disfrutar de una experiencia increíble.",['Vista a la bahía'],4.79,14,Javier,02-2015,https://www.airbnb.cl/rooms/10336321?adults=1&children=0&infants=0&pets=0&check_in=2023-03-08&check_out=2023-03-13&previous_page_section_name=1000&federated_search_id=291957dd-4002-4e6d-b6f9-3584054e94d9
19,Primera Línea Dúplex / 2 Estacionamientos,Vivienda rentada entero,Puerto Velero,8,6,3, Habitación,3,privado,258.0,-30.2365,-71.4779,"https://maps.google.com/maps?ll=-30.2365,-71.4779&z=14&t=m&hl=es&gl=CL&mapclient=apiv3",,"Un lugar perfecto para descansar y vacacionar en un condominio tranquilo , familiar y seguro . 
 En primera línea con hermosas vista al mar y a Tongoy , hermosos jardines , piscinas , canchas de tenis , sector de parrillas , supermercado , SPA, marina , restaurantes , funicular  a la playa, canchas de fútbol, pádel , campo de golf .... y más.

Departamento muy bien equipado y con disponibilidad de dos estacionamientos .",['Vista al océano'],,,Rossana,01-2016,https://www.airbnb.cl/rooms/779926591564831409?adults=1&children=0&infants=0&pets=0&check_in=2023-02-28&check_out=2023-03-05&previous_page_section_name=1000&federated_search_id=291957dd-4002-4e6d-b6f9-3584054e94d9
