,Titulo1,Titulo2,Comuna,Capacidad,Camas,N_Habitaciones,Habitaciones,Baños,Tipo_Baños,Precio,lat,lon,Ubicacion,Ubides,Descripcion,Servicios,Nota,Nnota,Anfitrion,Registro,Link
44,Despertar frente al mar.,Vivienda rentada entero,Coquimbo,5,4,2, Habitación,2,privado,68.0,-29.983,-71.3574,"https://maps.google.com/maps?ll=-29.983,-71.3574&z=14&t=m&hl=es&gl=CL&mapclient=apiv3","Sector tranquilo, a pocas cuadras de restoranes y supermercado, farmacia , cafes.
Barrio residencial socioeconómico alto.
Frente al mar (pie en la arena), salida directa al playa sin calles de por medio.
El sector posee un paseo peatonal costero y un Club de Yates para visitar.","Vista panorámica a la bahía hace que te sientas como en un barco.
Abres una puerta y ya estas caminando en la playa,  podrás disfrutar la amplia piscina y jardines , o pasar un momento en la terraza observando el mar...si te aventuras puedes salir a navegar en un Kayak disponible.
El Lugar posee todo lo que necesitas, esta totalmente alagado, con elementos de buena calidad y nuevos. Nos preocupamos de afinar detalles y limpieza, de modo que tu llegada este todo perfecto.


Cada día es una postal diferente, el sol y su atardeceres,  dormir con un suave sonido al mar, hacen una experiencia inolvidable. La decoración bajo un concepto de  mezcla rústica, moderna y antigua dan gran calidez al lugar. Se han incluido diferentes mejoras al departamento. 
El departamento cuenta con todo los elementos necesarios, el dpto esta full equipado lavadora de ropa y lavavajillas, internet, Netflix, toallas, sabanas etc
Increíble vista y directa al mar, departamento ubicado en piso 14 en los mejores pisos del edificio.
El condominio posee quincho, juegos para niños y un lindo parque. 
Nos esmeramos en entregar a usted un departamento en perfecta limpieza.
No necesitas usar llaves ya que el acceso es digital con código, lo que facilita tu llegada.",['Vista a la bahía'],4.97,35,Alejandro,04-2016,https://www.airbnb.cl/rooms/12252514?adults=1&children=0&infants=0&pets=0&check_in=2023-02-26&check_out=2023-03-03&previous_page_section_name=1000
45,Depto. 3D+2B acceso directo a Playa La Herradura,Vivienda rentada entero,Coquimbo,6,5,3, Habitación,2,privado,118.0,-29.9805,-71.3495,"https://maps.google.com/maps?ll=-29.9805,-71.3495&z=14&t=m&hl=es&gl=CL&mapclient=apiv3",,"Precioso Depto con una vista inigualable con 3 dormitorios y todos con ventanas termopanel aislante de ruidos, 2 baños, loggia, 1 estacionamiento, ropa de cama, artículos de aseo gratuitos, cocina totalmente equipada y acceso privado directo a la bella playa La Herradura, frente a supermercados, farmacias y 5 min en auto del centro de Coquimbo.

Edificio con Quinchos, 3 piscinas, gimnasio, sala de juego con mesa de pin pong y variados juegos para niños. Mar muy tranquilo, ideal para los niños.","['Acceso a la playa', 'Frente a la playa']",4.76,34,Gio,01-2018,https://www.airbnb.cl/rooms/22768876?adults=1&children=0&infants=0&pets=0&check_in=2023-02-21&check_out=2023-02-26&previous_page_section_name=1000
46,Hermoso departamento La Serena Ocean Side,Vivienda rentada entero,La Serena,3,3,2, Habitación,2,privado,77.0,-29.91441,-71.27463,"https://maps.google.com/maps?ll=-29.91441,-71.27463&z=14&t=m&hl=es&gl=CL&mapclient=apiv3","Admira las hermosas vistas al océano Pacífico en el corazón de Avenida del Mar desde este hermoso departamento en la mejor ubicación con bajada inmediata a la playa para hacer caminatas con tranquilidad, trote, ciclovía, Surf, respirar aire limpio y disfrutar de un exquisito mar y playas que están entre las preferidas de los turistas. Al llegar la tarde la actividad aumenta siendo este lugar uno de los más atractivos punto de encuentro de las distintas generaciones, que invita, a extranjeros y chilenos de todo el país en donde se podrán encontrar desde restaurante de rica gastronomía, diversos panoramas y más que lo convierten en un lugar ideal para el relax y la diversión.","Disfrutarás tu estadía, con vistas panorámicas al mar, bajada inmediata a la playa, para tranquilas caminatas, trote, ciclovía, surf,  cercano a restaurantes de excelente gastronomía. Aire limpio y disfrutar un exquisito mar y playas que están entre las preferidas de los turistas. Estos diversos panoramas  y más  lo convierten en un lugar ideal para el relax y la diversión. 

¡Deja el Cemento por la Arena y las Calles por el Mar! Y no pierdas la oportunidad de alojarte. ¡Estás a un solo Click!


Los espacios en el interior son acogedores, cálidos y confortables, totalmente amoblado y moderna decoración; incluye ropa de cama, toallas, cocina totalmente equipada, Smartv, cable satelital, WiFi gratuita, un estacionamiento privado. El establecimiento cuenta con servicios algunos con pago extra en conserjería:  sala de lavado y secado, tennis court/baby-football , sauna, salas de juegos, pool, ping pong, fitness center, piscina adultos y niños. 

Ideal para vacaciones en familia, turismo MICE , viajes de negocios junto con vistas panorámicas  al mar se transforman en el lugar preciso para un perfecto descanso.

*INCLUYE AMENITIES",['Vista al océano'],4.58,24,Eduardo,11-2021,https://www.airbnb.cl/rooms/53610966?adults=1&children=0&infants=0&pets=0&check_in=2023-03-19&check_out=2023-03-24&previous_page_section_name=1000
47,Jardin del Mar Departamento Av. del mar La Serena,Condo entero,Coquimbo,5,4,2, Habitación,2,privado,88.0,-29.9466,-71.292,"https://maps.google.com/maps?ll=-29.9466,-71.292&z=14&t=m&hl=es&gl=CL&mapclient=apiv3","Frente a la playa.
Barrio tranquilo.
A pasos de casino Enjoy de Coquimbo.
Cercano a restaurantes y pubs.
12 km de playa con calle y ciclovía.","- 2 dormitorios (ambos con closet).
- 2 baños.
- Dormitorio principal con cama queen.
- Segundo dormitorio con camarote y cama nido. 
- Cocina americana totalmente equipada, superficie de granito.
- Living y comedor.
- TV cable.
- Calefacción.
- Balcón con vista al mar.
- Malla de protección en el balcón.
- Internet.


Ubicado en el edificio Jardín del Mar.
Frente a la playa, ideal para caminar, restaurantes cercanos.",['Vista al océano'],4.84,19,Paola,08-2017,https://www.airbnb.cl/rooms/20192856?adults=1&children=0&infants=0&pets=0&check_in=2023-02-25&check_out=2023-03-02&previous_page_section_name=1000
48,Departamento de lujo en Puerto Velero,Vivienda rentada entero,Puerto Velero,8,7,3, Habitación,3,privado,140.0,-30.24266,-71.47825,"https://maps.google.com/maps?ll=-30.24266,-71.47825&z=14&t=m&hl=es&gl=CL&mapclient=apiv3","Puerto Velero es una de las mejores playas del norte de Chile, tiene buen clima durante todo el año y está cerca de Tongoy, donde se puede disfrutar de pescados y mariscos frescos.","Amplio departamento para 8 personas, ubicado en primera línea de Puerto Velero, con maravillosa vista a la bahía de Tongoy, a pasos del funicular que baja a la playa. Un estacionamiento privado. Decoración moderna, todo impecable para su estadía.

Acceso de los huéspedes
Puerto velero cuenta con playa privada, varios jardines, una marina, piscinas, instalaciones para deportes acuáticos, canchas de tenis y fútbol.","['Acceso a la playa', 'Frente a la playa']",4.82,22,Milena,04-2017,https://www.airbnb.cl/rooms/18304401?adults=1&children=0&infants=0&pets=0&check_in=2023-03-05&check_out=2023-03-10&previous_page_section_name=1000
49,"Fabuloso a pasos del mar, mega piscina y equipado.",Vivienda rentada entero,La Serena,5,4,2, Habitación,2,privado,49.99,-29.9239,-71.2765,"https://maps.google.com/maps?ll=-29.9239,-71.2765&z=14&t=m&hl=es&gl=CL&mapclient=apiv3","Una calle tranquila, sin pubs ni discoteques. Claro que si lo deseas, podrás caminar algunos minutos y te encontrarás con lo mejor de la vida nocturna de la Avenida del Mar. Minimarkets, cafés y restoranes, a pasos.","Este departamento con vista al mar, full equipado está situado en el elegante sector de la av. del mar de la serena, y solo a 1 minuto a pie de la playa. Wifi 400 megas, 2 baños, lavadora, cocina full equipada, y capacidad de hasta 5 personas (dos en cama matrimonial, y 3 en litera con cama nido). Cuenta con closets (placard) y bodega para guardar maletas. Estacionamiento privado sin techo para vehículos grandes. Juegos infantiles, piscina semi olímpica para adulto y niños. Pet friendly.


Lo que hace especial a este apartamento es la combinación de interior y exterior. En el interior, encontraras un piso nuevo y moderno con una terraza con vista al mar ideal para tener desayunos y cenas maravillosas. 

El apartamento está compuesto por 2 habitaciones, 2 baños (1 en suite), 1 cocina americana, un living (sala de estar) y una terraza. 
La cocina está equipada por completo. La sala de estar tiene un smartTV para que conectes tus series favoritas;  también hay lavadora para que laves tu ropa sin gastar en lavanderías. La wifi es de alta velocidad. 
Si así también lo quieres, te puedo dejar sabanas y toallas adicionales a las que ya hay disponibles. 
Para guardar tus cosas, tenemos amplios closets (placard) en el interior del apartamento. Si aún así necesitas más espacio, tenemos una bodega disponible. 
En el exterior encontrarás un edificio con acceso controlado las 24 horas; estacionamientos amplios (nuestro aparcadero no tiene limitaciones de techo, por lo que puedes ingresar fácilmente con tu 4 x 4 con maletero); guardias que vigilan la seguridad todo el tiempo. 

También encontrarás un pequeño parque interior para que pasees con tus niños o con tu mascota, o simplemente para bajar a leer un libro al caer la tarde. Hay dos piscinas, una para adultos y otra para niños. Además hay juegos infantiles.
En la azotea encontrarás mesas y sillas para subir a tomar un té (o un mate), mirando la hermosa bahía de La Serena, o si prefieres, podrás preparar un rico asado en la barcacoa ubicada en esa área. 

La playa está a solo un minuto caminando. 
La calle donde está ubicado el edificio no tiene pubs ni restoranes que te hagan ruido durante la noche. Pero si quieres salir de fiesta, a minutos caminando encontrarás los mejores pubs y restoranes de la ciudad. 

También contamos con espacios para teletrabajar cómodamente. 

¿Quieres irte después del almuerzo? No te preocupes, podemos conversar sobre tus necesidades, para que no andes corriendo a última hora.",['Vista al océano'],4.97,38,Luis,02-2016,https://www.airbnb.cl/rooms/11549383?adults=1&children=0&infants=0&pets=0&check_in=2023-03-27&check_out=2023-04-01&previous_page_section_name=1000
50,Hermoso Departamento Playa La Herradura,Condo entero,Coquimbo,6,4,2, Habitación,2,privado,74.0,-29.97991,-71.34752,"https://maps.google.com/maps?ll=-29.97991,-71.34752&z=14&t=m&hl=es&gl=CL&mapclient=apiv3","Sector residencial muy tranquilo y tradicional.
Ideal para familias, se puede salir a caminar y a comprar alimentos cerca con seguridad.","Arriendo Hermoso Departamento Nuevo 9°Piso, a pasos de la playa, frente a La Herradura con Vista al Mar desde todos los ángulos.
Equipado para 4 a 6 personas.
2 dormitorios y 2 baños ambos en suite.
Ambiente seguro y tranquilo, ideal para familias, sólo 5 dptos. por piso.
Cocina americana full equipada.
Terraza.
Estacionamiento.
Conserjería y Seguridad 24 horas.
Piscina, Juegos infantiles, Quincho y Áreas verdes.
Cercano a supermercado, restaurante y locales comerciales.
No se admiten Mascotas.


Luminoso departamento con vista al mar, a pasos de la playa, cerca del Mercado de Coquimbo donde puedes disfrutar de deliciosos pescados y mariscos a precios convenientes, excelente conectividad para visitar La Serena y sus alrededores.",['Vista a la bahía'],4.83,23,Maria Luz,08-2018,https://www.airbnb.cl/rooms/27727014?adults=1&children=0&infants=0&pets=0&check_in=2023-02-25&check_out=2023-03-02&previous_page_section_name=1000
51,"La Serena Refugio Trinidad, depto de 2 dormitorios",Vivienda rentada entero,La Serena,5,4,2, Habitación,2,privado,65.0,-29.93645,-71.28053,"https://maps.google.com/maps?ll=-29.93645,-71.28053&z=14&t=m&hl=es&gl=CL&mapclient=apiv3",,"Arriendo departamento amoblado y full equipado en Avenida Pacifico con calle Los Lucumos, La Serena. A una cuadra de Avenida Costanera (playa).
Tiene 2 dormitorios, con capacidad para 5 personas.
Arriendo diario exclusivo departamento acogedor y completamente equipado, en piso nueve, Condominio Terrazas del Sol. Avenida Pacifico Nº4883. 
Ubicación perfecta para temporada de invierno y verano. 
Departamento de 56M2, 2 dormitorio, con terraza y estacionamiento.",['Acceso la playa Público o compartido'],4.50,18,Solange,10-2016,https://www.airbnb.cl/rooms/31243595?adults=1&children=0&infants=0&pets=0&check_in=2023-02-26&check_out=2023-03-03&previous_page_section_name=1000
52,"Departamento La Herradura, vista a toda la playa",Vivienda rentada entero,Coquimbo,7,5,3, Habitación,2,privado,75.0,-29.9815,-71.34973,"https://maps.google.com/maps?ll=-29.9815,-71.34973&z=14&t=m&hl=es&gl=CL&mapclient=apiv3",Es un.lugar muy tranquilo y bonito,"Bien iluminado, a orillas de la pla, con salida privada a la playa, vista privilegiada a la bahia de la Herradura y de Coquimbo, se puede ir caminando al pueblito de la Herradura, al supermercado,locomocion a la salida del edificio, salida directa carretera. En siete minutos se llega en auto a Coquimbo y en 20 o menos a Serena, cercano a playas importantes como totoralillo, las tacas,lugar tranquilo para descansar solo o en familia,playa mansa


Cómodo departamento nuevo sin uso con tres dormitorios, malla de protección en todas las ventanas, vista privilegiada al mar amplia, primera linea, se sale del edificio y se llega a la playa por un acceso privado. Como tiene piscina se puede disfrutar al mismo tiempo de la piscina, quinchos, juegos y la playa","['Acceso a la playa', 'Frente a la playa']",4.37,19,Claudia,08-2017,https://www.airbnb.cl/rooms/31126256?adults=1&children=0&infants=0&pets=0&check_in=2023-02-24&check_out=2023-03-01&previous_page_section_name=1000
53,Dpto. La serena. Condominio Altos del milagro II.,Condo entero,La Serena,7,5,3, Habitación,2,privado,61.0,-29.94359,-71.24746,"https://maps.google.com/maps?ll=-29.94359,-71.24746&z=14&t=m&hl=es&gl=CL&mapclient=apiv3","Barrio residencial, tranquilo y seguro, cómo amplia vista, supermercados cerca, restaurantes (comida peruana, sushi, hamburguesería, etc) y stripcenter cercano y a la mano. Movilización de fácil acceso,","Cómodo departamento en área residencial, espacioso e iluminado, perfecto para descanso, full equipado para 5 personas, a 5 minutos en auto de la avenida del mar (playa) y a 1 hora aproximada del valle del Elqui, a pasos de supermercado (Unimarc cuatro esquinas) estacionamiento privado, piscina, áreas verdes, quincho para asados, sala de recreación.


Departamento con 3 habitaciones, una con cama matrimonial, televisor, terraza y baño privado, otra con camarote desmontable y una tercera habitación con cama nido, 2 baños individuales en perfecto estado, living comedor con smartv, wifi, futón, y mesa para 6-7 personas, terraza con mesa, sillas y parrilla, cocina amplia y aparte full equipada y con logia.",['Vista al horizonte de la ciudad'],5.0,33,Gonzalo,11-2018,https://www.airbnb.cl/rooms/30152447?adults=1&children=0&infants=0&pets=0&check_in=2023-02-28&check_out=2023-03-05&previous_page_section_name=1000
54,Departamento frente al Mar,Vivienda rentada entero,Coquimbo,4,4,2, Habitación,2,privado,65.0,-29.95652,-71.30923,"https://maps.google.com/maps?ll=-29.95652,-71.30923&z=14&t=m&hl=es&gl=CL&mapclient=apiv3","Condominio Costa Peñuelas cuenta con 2 grandes piscinas rodeadas de hermosas areas verdes , juegos infantiles , salon de juegos , Pool , taca taca , ping pong , hermosos quinchos para hacer asados en familia .
Skate park y pequeño gimnasio al aire libre en la playa .
Cercano a los mejores restaurantes tipicos de la zona , a los cuales puedes ir caminando .","Departamento frente al mar ,impecable , soleado muy iluminado con  una vista maravillosa a la playa Administrado por sus dueños , lo que lñe garantiza una atencion cordial y personalizada

Acceso de los huéspedes
D","['Acceso a la playa', 'Frente a la playa']",4.92,13,Ana Luz,05-2017,https://www.airbnb.cl/rooms/21523825?adults=1&children=0&infants=0&pets=0&check_in=2023-02-28&check_out=2023-03-05&previous_page_section_name=1000
55,Nuevo dpto a pasos del mar y El Faro!!!,Vivienda rentada entero,La Serena,4,3,2, Habitación,2,privado,40.0,-29.8999,-71.2697,"https://maps.google.com/maps?ll=-29.8999,-71.2697&z=14&t=m&hl=es&gl=CL&mapclient=apiv3","Es un barrio residencial consolidado, se encuentra al lado del Centro Turístico Laguna del Mar.","El departamento está muy cercano a lugares de interés como playas, restaurantes, Mall Puerta del Mar (5 minutos), Bancos, transporte público, arte, cultura y parques. Te va a encantar mi espacio! es un departamento nuevo, muy seguro con guardia las 24 horas y caminando desde la puerta hasta poner los pies en el agua te demoras 8 minutos caminando, si sigues por la playa llegas a el Faro de la Serena. Mi alojamiento es bueno para familias (con hijos).


Si lo necesitas puedo dejar una cuna Pack and Play sin costo adicional. Esta ubicado en el cuarto piso del edificio.",['Costa'],4.75,16,Melina,04-2012,https://www.airbnb.cl/rooms/22422536?adults=1&children=0&infants=0&pets=0&check_in=2023-04-08&check_out=2023-04-13&previous_page_section_name=1000
56,Cómodo depto en Los Molles - A pasos de la playa,Vivienda rentada entero,La Ligua,4,3,2, Habitación,2,privado,85.0,-32.2365,-71.5123,"https://maps.google.com/maps?ll=-32.2365,-71.5123&z=14&t=m&hl=es&gl=CL&mapclient=apiv3","Los Molles es un balneario muy tranquilo y familiar.
Hay un parque cerca del condominio y la playa a metros
Playa apta para el baño y deportes acuáticos (windsurf, surf, buceo, kayak, etc)","Esta en ""Condominio Bordemar Los Molles"" Con vista lateral al mar y a pasos de la playa

2 dormitorios, 2 baños, Equipado para 4 personas. 1 cama matrimonial y 1 litera, 1 sofá cama en living. SIN SÁBANAS NI TOALLAS (COVID)

Esta en 4to piso, sin ascensor.  Tenemos WIFI! No hay tv cable ni TV abierta, pero hay un Apple TV!

PISCINA (adultos y niños)

Frente a la caleta, Restaurantes y parque Puquén. 

Está a 2 horas de Santiago (187 kms)

Playa apta para el baño y deportes

ESTACIONAMIENTO


Es muy cómodo y familiar, está equipado para 4 personas",['Vista al jardín'],4.77,48,Eva,09-2014,https://www.airbnb.cl/rooms/27568901?adults=1&children=0&infants=0&pets=0&check_in=2023-02-21&check_out=2023-02-26&previous_page_section_name=1000
57,Departamento La Serena - Vacaciones,Condo entero,La Serena,4,4,2, Habitación,2,privado,82.143,-29.9043,-71.27425,"https://maps.google.com/maps?ll=-29.9043,-71.27425&z=14&t=m&hl=es&gl=CL&mapclient=apiv3","El barrio es residencial, muy tranquilo. El condominio está al final de la avenida principal, justo frente a la playa.","Espectacular departamento en condominio Laguna del Mar. Cercano a terminal de buses. Acceso exclusivo. Piscina, kayak. Cuenta con wifi y tv satelital

El espacio
El departamento es muy cómodo, tiene una terraza habilitada con una parrilla a gas y una gran vista al océano.",['Cocina'],4.91,54,Carolina,05-2015,https://www.airbnb.cl/rooms/6587223?adults=1&children=0&infants=0&pets=0&check_in=2023-02-26&check_out=2023-03-05&previous_page_section_name=1000
58,Dpto. La serena. Condominio Altos del milagro II.,Condo entero,La Serena,7,5,3, Habitación,2,privado,61.0,-29.94359,-71.24746,"https://maps.google.com/maps?ll=-29.94359,-71.24746&z=14&t=m&hl=es&gl=CL&mapclient=apiv3","Barrio residencial, tranquilo y seguro, cómo amplia vista, supermercados cerca, restaurantes (comida peruana, sushi, hamburguesería, etc) y stripcenter cercano y a la mano. Movilización de fácil acceso,","Cómodo departamento en área residencial, espacioso e iluminado, perfecto para descanso, full equipado para 5 personas, a 5 minutos en auto de la avenida del mar (playa) y a 1 hora aproximada del valle del Elqui, a pasos de supermercado (Unimarc cuatro esquinas) estacionamiento privado, piscina, áreas verdes, quincho para asados, sala de recreación.


Departamento con 3 habitaciones, una con cama matrimonial, televisor, terraza y baño privado, otra con camarote desmontable y una tercera habitación con cama nido, 2 baños individuales en perfecto estado, living comedor con smartv, wifi, futón, y mesa para 6-7 personas, terraza con mesa, sillas y parrilla, cocina amplia y aparte full equipada y con logia.",['Vista al horizonte de la ciudad'],5.0,33,Gonzalo,11-2018,https://www.airbnb.cl/rooms/30152447?adults=1&children=0&infants=0&pets=0&check_in=2023-02-28&check_out=2023-03-05&previous_page_section_name=1000
59,Vista increíble! A pasos de la playa y casino.,Vivienda rentada entero,Coquimbo,5,4,2, Habitación,2,privado,51.0,-29.94576,-71.28995,"https://maps.google.com/maps?ll=-29.94576,-71.28995&z=14&t=m&hl=es&gl=CL&mapclient=apiv3",,"Este lugar tiene una ubicación estratégica. Justo detrás del casino Enjoy, a pasos de la playa, restaurantes, ferias artesanales y mall outlet.

El departamento tiene 2 dormitorios, ambos con baño, separados por el espacio común cocina-living-comedor.

Incluye Estacionamiento. 

El departamento está en el piso 19, con una vista despejada increíble al mar hacia Coquimbo. 

Edificio nuevo, cerca de todo, seguro y tranquilo. Cuenta con piscina, sala de juegos, lavandería, zona asados.",['Vista al mar'],4.86,7,Karene,04-2017,https://www.airbnb.cl/rooms/52991646?adults=1&children=0&infants=0&pets=0&check_in=2023-03-07&check_out=2023-03-12&previous_page_section_name=1000
60,Departamento frente al Faro y playa,Vivienda rentada entero,La Serena,4,4,2, Habitación,2,privado,85.0,-29.9059,-71.2737,"https://maps.google.com/maps?ll=-29.9059,-71.2737&z=14&t=m&hl=es&gl=CL&mapclient=apiv3",,"Este lugar tiene una ubicación estratégica: ¡será muy fácil planear tu visita!
Vista directa al Faro ,frente a la playa , piscina , quincho, wifi, estacionamiento techado.","['Acceso a la playa', 'Frente a la playa']",5.0,4,Roxana,08-2021,https://www.airbnb.cl/rooms/785286316685025873?adults=1&children=0&infants=0&pets=0&check_in=2023-03-06&check_out=2023-03-11&previous_page_section_name=1000
61,Departamento nuevo con espectacular vista al mar.,Vivienda rentada entero,Coquimbo,4,3,2, Habitación,2,privado,67.178,-29.9372,-71.2822,"https://maps.google.com/maps?ll=-29.9372,-71.2822&z=14&t=m&hl=es&gl=CL&mapclient=apiv3",Es un barrio tranquilo muy cerca de la playa y de restoranes y casino de primera gama.,"Espectacular departamento, nuevo, con vista al mar, para 4 personas, dos baños, cocina equipada, terraza amplia, quincho en la azotea del edificio, con espectacular Piscina, estacionamiento privado, conserjería las 24 horas, Tv Cable. Todo esto a pasos de la playa de La Serena y restoranes. 
Se puede ir caminando al casino Enjoy de Peñuelas, disfrutar de paseos por  la avenida del mar y la playa de La Serena.


Es un departamento de primera categoría, nuevo, con todos sus utensilios para 4 personas con una vista en segunda línea al mar a puerto de Coquimbo,  queda 600 metros de restoranes y casino Enjoy. Tiene piscina y estacionamiento privado.","['Acceso a la playa', 'Frente a la playa']",4.91,76,José Ignacio,09-2014,https://www.airbnb.cl/rooms/12006184?adults=1&children=0&infants=0&pets=0&check_in=2023-02-27&check_out=2023-03-04&previous_page_section_name=1000
62,"""Departamento Seahorse & Beach. La Serena""",Vivienda rentada entero,Coquimbo,4,3,2, Habitación,2,privado,90.0,-29.94563,-71.28885,"https://maps.google.com/maps?ll=-29.94563,-71.28885&z=14&t=m&hl=es&gl=CL&mapclient=apiv3",,"Seahorse & Beach La Serena es un hermoso departamento nuevo, ubicado en la mejor zona del borde costero.  Cuenta con una vista priviligiada a la bahía de coquimbo y la Serena.
Disponible para 4 personas y cuenta con todas las comodidades de tu hogar como smart TV, piscina, gimnasio y todo esto frente al mar. 
Recomendaciones: Solo disfrutar....


Cuenta con piscina al aire libre tanto para niños y adultos","['Acceso a la playa', 'Frente a la playa']",4.81,38,Juan,06-2016,https://www.airbnb.cl/rooms/15845145?adults=1&children=0&infants=0&pets=0&check_in=2023-03-01&check_out=2023-03-06&previous_page_section_name=1000
63,"Departamento en La Serena, Jardín del Mar",Vivienda rentada entero,La Serena,5,5,2, Habitación,2,privado,86.857,-29.94513,-71.28858,"https://maps.google.com/maps?ll=-29.94513,-71.28858&z=14&t=m&hl=es&gl=CL&mapclient=apiv3","Edificio esta en Plena Costanera al Costado del Casino Enjoy, Se puede Acceder a Múltiples restaurantes, Cocinerías, Pubs a pasos del Edificio. Ubicado Frente a la Playa.
a 20 min del Terminal Buses la Serena
a 45 min del Aeropuerto de la Serena","Departamento en Condominio Jardín del Mar, Piso 17 Primera Línea. Completamente Equipado.
Taifas Temporada Baja (Marzo a 15 Dic) $ 70.000
Tarifa Temporada Alta (15 Dic a Febrero) $ 97.000
Vacaciones Invierno $ 70.000


2 Dormitorios con baño Individual cada uno.
84 m2 incluye Terraza",['Vista a la bahía'],4.81,17,Fernando,05-2017,https://www.airbnb.cl/rooms/19799358?adults=1&children=0&infants=0&pets=0&check_in=2023-03-01&check_out=2023-03-08&previous_page_section_name=1000
