,Link,Anfitrion,Descripcion,Precio,Comuna,Region,Titulo1,lat,long,ScarpDate,Direccion,Detalles
0,https://www.facebook.com/marketplace/item/5870288539724679/?ref=search&referral_code=null&referral_story_type=post&tracking=browse_serp%3Afc8ce8be-eb5c-42c6-976d-868486b0cee0,Claudia del Pino,"Departamentos 3 dormitorios y 2 baños, en perfecto estado, con mucha luz, completamente amoblado y equipado, con bonita vista, con ascensor, con estacionamiento, cerca de centros comerciales y cerca de la playa.

En edificio con ascensor,  y en Condominio con conserjería día y noche.

OFERTA para 6 personas a sólo $65.000.- diarios.

Incluye servicios básicos, TV cable,  wifi, lavadora y estacionamiento. Ver menos",65000.0,La Serena,Coquimbo,💝ARRIENDO por Día en Puerta del Mar 6 personas con estacionamiento ⛱,-29.902038574219,-71.251831054688,15-02-2023,,
0,https://www.facebook.com/marketplace/item/726126475493853/?ref=search&referral_code=null&referral_story_type=post&tracking=browse_serp%3Afc8ce8be-eb5c-42c6-976d-868486b0cee0,Patricia Gonzalez,"ULTIMAS FECHAS DISPONIBLES POR VACACIONES Y DISPONIBILIDA PARA ESTUDIANTES DEDE MARZO A DICIEMBRE
29 DE ENERO AL 01 DE FEBRERO
11 y 12 DE FEBRERO
20 DE FEBRERO EN ADELANTE.
ARRIENDO MI DEPARTAMENTO PARA VACIONES Y O ESTUDIANTES EN LA SERENA. UBICADO EN PLENA AV. CUATRO ESQUINAS CON HORTENSIA BUSTAMANTE. FRENTE LA UIVERSIDAD EL ALBA CONDÓMINO REINOS DE ESPAÑA.. SEGURIDAD 24/7 ESTACIONAMIENTO, DIRECTV POR RECARGA, WIFI..3 DORMITORIOS FULL EQUIPADO PARA 6 PERSONA. A PASOS DE LA PLAYA. RESTAURANTE, FUENTES DE SODA, COMIDA RÁPIDA , FERIA ARTESANAL, JUEGOS, CACINOS, FARO,ETC... 15
MINUTOS DEL AEROPUERTO. TRATO DIRECTO CON LA DUEÑA. WHATSAPP +569 90526218. TAMBIEN NOS PUEDES ENCONTRAR EN APP ""AIRBNB""https://www.airbnb.cl/rooms/54392371...FECHAS DISPONIBLE
60mil diario. ingreso 15:00 con salida 12:00 Ver menos",1,La Serena,Coquimbo,3 habitaciones 1 baño Departamento/condominio,-29.9213,-71.27079,15-02-2023,Camino Hortensia Bustamante,"['Detalles de la unidad', 'Departamento/condominio', '3 dormitorios · 1 baño']"
0,https://www.facebook.com/marketplace/item/1251346512121681/?ref=search&referral_code=null&referral_story_type=post&tracking=browse_serp%3Afc8ce8be-eb5c-42c6-976d-868486b0cee0,Orban Fuentes,Se arrienda cómodo departamento por día de 2 habitaciones ubicados en en el centro con buen vista cerca del casino Ver menos,45000.0,Viña del Mar,Valparaíso,Departamento por día,-33.027648925781,-71.548461914062,15-02-2023,,
0,https://www.facebook.com/marketplace/item/585190126422551/?ref=search&referral_code=null&referral_story_type=post&tracking=browse_serp%3Afc8ce8be-eb5c-42c6-976d-868486b0cee0,Fabiola Lisboa Fernandez,"Lindo departamento de un dormitorio y 1 baño. Ubicado en sector Puertas del Mar, frente a Laguna del Mar. Cuenta con estacionamiento y bodega.el valor de arriendo incluye gastos comunes. Se paga mes de arriendo, mes de garantía y comisión de corretaje. Debe presentar documentos para acreditar renta. Contarse al [hidden information].",400000.0,La Serena,Coquimbo,Arriendo lindo Departamento de Marzo A Diciembre.,-29.924011230469,-71.240844726562,15-02-2023,,
0,https://www.facebook.com/marketplace/item/1171263470185641/?ref=search&referral_code=null&referral_story_type=post&tracking=browse_serp%3Afc8ce8be-eb5c-42c6-976d-868486b0cee0,C Mella Andrade,"Arriendo cabañas en totoralillo, equipada para 6 personas. A pasos de la playa de totoralillo. ",70000.0,Coquimbo,Coquimbo,Arriendo por noche,-29.951477050781,-71.339721679688,15-02-2023,,
