,Link,Anfitrion,Descripcion,Precio,Comuna,Region,Titulo1,lat,long,ScarpDate
0,https://www.facebook.com/marketplace/item/921137005979075/?ref=search&referral_code=null&referral_story_type=post&tracking=browse_serp%3A3ac19b09-393a-40e8-8827-e190c3820940,Alex Cortes,Se arrienda cabaña familiar para descanso. Ubicada en Gabriela mistral.valle de elqui la serena.. habilitada para 6 personas..consta de quincho y piscina privada..lugar acogedor especial para el descanso a 15 minutos de la serena..lugar muy tranquilo( no apto para fiestas).. Ver menos,70000.0,La Serena,Coquimbo,Arriendo por dia valle elqui,-29.902038574219,-71.251831054688,14-02-2023
0,https://www.facebook.com/marketplace/item/2289646847869750/?ref=search&referral_code=null&referral_story_type=post&tracking=browse_serp%3A3ac19b09-393a-40e8-8827-e190c3820940,Carito Del Pilar Astudillo Astudillo,"Se arrienda cabaña totalmente equipada para 5 a 6 personas,a 10 minutos del balneario de Guanaquero [hidden information] Ver menos",60000.0,La Serena,Coquimbo,Arriendo cabaña,-29.907531738281,-71.251831054688,14-02-2023
0,https://www.facebook.com/marketplace/item/1377404322798723/?ref=search&referral_code=null&referral_story_type=post&tracking=browse_serp%3A3ac19b09-393a-40e8-8827-e190c3820940,Gisselle Menares,"Hermoso Depto en Condominio Asturias (Francisco de Aguirre con Federico Arcos) a 10 minutos de la playa caminando. Equipado hasta 4 personas todo Nuevo. Es 2do Piso.
Cuenta con 2 habitaciones, una matrimonial y otra con 2 camas, 1 baño, living Comedor, terraza, Wifi, estacionamiento, quincho, conserjería las 24 horas, cerca de supermercados, mall playa, bares.
No se acepta mascotas.
Disponible todo el Año por arriendo diario
Mínimo 4 noches de arriendo
- Valor $45.000 por noche Temporada alta (hasta 4 personas) Dic- Ene
- valor $45.000 por noche Año nuevo y Febrero
Consultas y reservas llamar o WhatsApp [hidden information] Ver menos",45000.0,La Serena,Coquimbo,Arriendo depto por temporada verano,-29.907531738281,-71.262817382812,14-02-2023
