,Link,Anfitrion,Descripcion,Precio,Comuna,Region,Titulo1,lat,long,ScarpDate,Direccion,Detalles
0,https://www.facebook.com/marketplace/item/869573317682882/?ref=search&referral_code=null&referral_story_type=post&tracking=browse_serp%3A3ac19b09-393a-40e8-8827-e190c3820940,Hierbas Catandog,"habitación de arriendo diario con baño privado y entrada independiente. Cuenta con cama 2 plazas, TV por cable, mueble, agua caliente, velador WiFi, derecho  a uso de cocina y lavadora automática. No se cuenta con estacionamiento pero puede dejarse el vehículo fuera de la casa. Valor diario $25.000. Es en la Serena a diez minutos del centro y recova en locomoción ➕5️⃣6️⃣9️⃣5️⃣4️⃣1️⃣9️⃣8️⃣9️⃣7️⃣8️⃣ se cancela al momento de llegar Ver menos",25000.0,La Serena,Coquimbo,Pieza diaria con baño privado,-29.902038574219,-71.251831054688,14-02-2023,,
0,https://www.facebook.com/marketplace/item/685332489903073/?ref=search&referral_code=null&referral_story_type=post&tracking=browse_serp%3A3ac19b09-393a-40e8-8827-e190c3820940,Francisca Javiera España Castro,"Se arriendan casas, cabañas y departamentos cercanas a Avenida del Mar,  a pasos de La Herradura, El milagro, consultas por interno,  fechas y precios. Ver menos",,La Serena,Coquimbo,"Se arrienda solo diario , casas, cabañas, y deptos. La Serena- Coquimbo. Disponibles desde el 16.",-29.902038574219,-71.251831054688,14-02-2023,,
0,https://www.facebook.com/marketplace/item/509220521385428/?ref=search&referral_code=null&referral_story_type=post&tracking=browse_serp%3A3ac19b09-393a-40e8-8827-e190c3820940,Francisca Javiera España Castro,"Se arrienda hermoso departamento, ubicado en segunda línea con vista al mar, cercano a Enjoy, tercer piso, piscina, estacionamiento, a 3 minutos caminando hasta la playa.
máximo para 4 personas, disponible desde el 16 de febrero, mínimo 4 noches. Ver menos",,La Serena,Coquimbo,"Se arrienda hermoso departamento segunda línea,desde el 16, max 4 personas, mínimo cuatro noches.",-29.902038574219,-71.251831054688,14-02-2023,,
0,https://www.facebook.com/marketplace/item/2380751822087192?ref=search&referral_code=null&referral_story_type=post&tracking=browse_serp%3A3ac19b09-393a-40e8-8827-e190c3820940,Jany Sarmiento,"Hermoso depto para 2 personas, ubicado en barrio Puertas del Mar, condominio a pasos de la playa, malls, supermercados, terminal de buses y centro de La Serena. Ubicado en pimer piso. Completamente equipado, 1D,1B, cocina, logia, balcón. Seguridad las 24 hrs, acceso controlado, estacionamiento, quincho, piscina, juegos para niños, lindas áreas verdes. Ambiente tranquilo y cómodo, ideal para descansar.
*Disponible desde el 10 al 13 y desde el 22 al 28 de febrero*
*Arriendo mínimo 3 noches*
*No se aceptan mascotas*
* No se permite fumar al interior del depto*
*No se arrienda con sábanas* Ver menos",40000.0,La Serena,Coquimbo,Arriendo departamento a pasos de la playa,-29.902038574219,-71.251831054688,14-02-2023,,
0,https://www.facebook.com/marketplace/item/514104277293630/?ref=search&referral_code=null&referral_story_type=post&tracking=browse_serp%3A3ac19b09-393a-40e8-8827-e190c3820940,Juan VR,,20000.0,Coquimbo,Coquimbo,ARRIENDO DIARIO COQUIMBO PARA PASAR LA NOCHE,-29.956970214844,-71.350708007812,14-02-2023,,
