,Link,Comuna,Camas,Baños,Capacidad,Habitaciones,Precio,Nota,Nnota,Descripción,Titulo1,Titulo2,Servicios,Anfitrion,Registro,Ubides,Ubicacion,Tipo
0,https://www.airbnb.cl/rooms/41591068?adults=1&children=0&infants=0&pets=0&check_in=2023-02-19&check_out=2023-02-25&previous_page_section_name=1000,"['La Serena, Coquimbo, Chile']",['5 camas'],['1 baño'],['6 huéspedes'],['3 habitaciones'],"['$50,000\xa0CLP\xa0']",[],[],"['Condominio ubicado frente a Mall Puertas del mar, Supermercado Hiper Lider, Tienda jhonsson etc, a 5 minutos de la playa en vehículo, el departamento está equipado para 6 personas, con TV satelital y WiFi, estacionamiento privado, resguardado por circuito de cámaras instaladas en el condominio, el servicio de guardias trabaja las 24 hrs.', 'Sector céntrico y seguro de la Serena, ubicado en un condominio con seguridad las 24 horas, cuenta con cámaras de seguridad y estacionamiento gratuito.']",['DEPARTAMENTO 410 PUERTAS DEL MAR'],['Vivienda rentada entero - Anfitrión:\xa0Eduardo'],"[<Element 'div' class=('_19xnuo97',)>, <Element 'div' class=('_19xnuo97',)>, <Element 'div' class=('_19xnuo97',)>, <Element 'div' class=('_19xnuo97',)>, <Element 'div' class=('_19xnuo97',)>, <Element 'div' class=('_19xnuo97',)>, <Element 'div' class=('_19xnuo97',)>]",['Anfitrión: Eduardo'],['Se registró en diciembre de 2018'],"['sector tranquilo, a pasos de mall, playa, supermercado,  parque pedro de valdivia, parque japones entre otros']",[],
1,https://www.airbnb.cl/rooms/31645327?adults=1&children=0&infants=0&pets=0&check_in=2023-02-03&check_out=2023-02-08&previous_page_section_name=1000,"['Coquimbo, Región de Coquimbo, Chile']",['1 cama'],['1 baño'],['2 huéspedes'],['1 habitación'],"['$32,220\xa0CLP\xa0']",['4.92 ·'],['24 reseñas'],"['Acogedora cabaña de 50mt2 , 01 habitación, living comedor  para 2 personas:', ' Wifi, TV cable, cocina, baño privado, excelente ubicación, cerca de la playa, restaurantes y centros comerciales, fácil locomoción. Ubicado en un barrio tranquilo, con bajo ruido ambiente,  Incluye sábanas y toallas, el entorno lo rodea un hermoso jardín con variadas plantas y cactus, un sector con mesa y asadera, estacionamiento privado y seguro.', 'La habitación con baño privado , terraza con buenas vistas, pieza habilitado con un sillón muy cómodo refrigerador, hervidor, microondas platos vasos, cocina eléctrica de dos platos.']","['Acogedora cabañita en Coquimbo, lugar tranquilo 🏖🌞']",['Casa de huéspedes entero - Anfitrión:\xa0Patricio'],"[<Element 'div' class=('_19xnuo97',)>, <Element 'div' class=('_19xnuo97',)>, <Element 'div' class=('_19xnuo97',)>, <Element 'div' class=('_19xnuo97',)>, <Element 'div' class=('_19xnuo97',)>, <Element 'div' class=('_19xnuo97',)>, <Element 'div' class=('_19xnuo97',)>]",['Anfitrión: Patricio'],['Se registró en enero de 2019'],"['La Barra de Coquimbo. Los mejores Sandwich, completos, variedad de as, quesadillas, cervezas artesanales, jugos naturales, almuerzos. ', 'Universidad Católica del Norte con sus extensas áreas verdes acuarios y vistas inmejorables.']","['https://maps.google.com/maps?ll=-29.96244,-71.34579&z=14&t=m&hl=es&gl=CL&mapclient=apiv3']",
2,https://www.airbnb.cl/rooms/47452794?adults=1&children=0&infants=0&pets=0&check_in=2023-03-02&check_out=2023-03-07&previous_page_section_name=1000,"['Coquimbo, Chile']",['3 camas'],['2 baños'],['4 huéspedes'],['2 habitaciones'],"['$42,000\xa0CLP\xa0']",['4.69 ·'],['13 reseñas'],"['El edificio cuenta con piscina, sector de acondicionamiento físico y zona para asados con dos quinchos. El depto fue diseñado especialmente para una excelente experiencia. Incluye: escritorio como estación de trabajo, lavadora, 1 televisor smart, 1 televisor QLED 50” de última generación en living, parrilla eléctrica,muebles y camas de excelente calidad. Sábanas de 300 hilos, sandwichera,cafetera nespresso, juguera, hervidor, microondas, refrigerador, entre otros. No se acepta fumar al interior.', 'Todo el departamento y con pago extra a la comunidad áreas comunes como quincho']",['Departamento con vista al mar (Puerta Del Mar)'],['Condo entero - Anfitrión:\xa0Felipe'],"[<Element 'div' class=('_19xnuo97',)>, <Element 'div' class=('_19xnuo97',)>, <Element 'div' class=('_19xnuo97',)>, <Element 'div' class=('_19xnuo97',)>, <Element 'div' class=('_19xnuo97',)>, <Element 'div' class=('_19xnuo97',)>, <Element 'div' class=('_19xnuo97',)>]",['Anfitrión: Felipe'],['Se registró en abril de 2015'],[],"['https://maps.google.com/maps?ll=-29.89879,-71.2699&z=14&t=m&hl=es&gl=CL&mapclient=apiv3']",
3,https://www.airbnb.cl/rooms/15726610?adults=1&children=0&infants=0&pets=0&check_in=2024-01-05&check_out=2024-01-10&previous_page_section_name=1000,"['Coquimbo, Región de Coquimbo, Chile']",['3 camas'],['1 baño'],['2 huéspedes'],['1 habitación'],"['$24,371\xa0CLP\xa0']",['4.96 ·'],['24 reseñas'],"['Es una cabaña interior ubicada a 5 minutos caminando de  playa La Herradura, ideal para pareja sola o con niños ya que cuenta con un sillón cama,  baño privado con agua caliente, cocina americana,  completamente equipada con refrigerador, microondas. Tiene, wifi y tv streaming', 'Lugares de interés: la playa y increíbles vistas. ', 'El alojamiento es bueno para parejas y aventureros. Cuenta con estacionamiento compartido.', 'Ambiente familiar y cercanía a la playa.']",['CABAÑA/ CASA  EN COQUIMBO EN PLAYA LA HERRADURA.'],['Casa de huéspedes entero - Anfitrión:\xa0Michele'],"[<Element 'div' class=('_19xnuo97',)>, <Element 'div' class=('_19xnuo97',)>, <Element 'div' class=('_19xnuo97',)>, <Element 'div' class=('_19xnuo97',)>, <Element 'div' class=('_19xnuo97',)>, <Element 'div' class=('_19xnuo97',)>, <Element 'div' class=('_19xnuo97',)>]",['Anfitrión: Michele'],['Se registró en febrero de 2016'],"['Zona residencial, muy tranquila, con locales comerciales a una cuadra.']","['https://maps.google.com/maps?ll=-29.985,-71.3594&z=14&t=m&hl=es&gl=CL&mapclient=apiv3']",
4,https://www.airbnb.cl/rooms/37782379?adults=1&children=0&infants=0&pets=0&check_in=2023-02-24&check_out=2023-03-01&previous_page_section_name=1000,"['La Herradura, Región de Coquimbo, Chile']",['3 camas'],['1 baño'],['4 huéspedes'],['2 habitaciones'],"['$55,000\xa0CLP\xa0']",['5.0 ·'],['6 reseñas'],"['✨Depto ✨totalmente  equipado para 4 personas (incluidos niños), frente a Playa la Herradura🏖️🌊( pasarela de 3 minutos caminado muy segura para llegar a Playa). Piso 4, con todo lo necesario para que tú y tú familia disfruten de sus vacaciones, cercano a supermercado, restaurantes.', '*Balneario Guanaqueros 15 minutos', '*Balneario Totoralillo 10 minutos.', 'Condominio consta de piscina, quincho, juego para niños, conserjería 24/7 , seguridad. Estacionamiento por Depto, privado.', '🚫NO WIFI', '🚫NO MASCOTAS', 'Dpto Hermoso totalmente equipado, para 4 personas, para una agradable estadía, estacionamiento privado y numerado incluido en subterráneo.✨.']","['✨Family Relax! Frente a Playa Herradura, 2D,1B⛱️✨']",['Apartamento con servicios incluidos entero - Anfitrión:\xa0Nevenka'],"[<Element 'div' class=('_19xnuo97',)>, <Element 'div' class=('_19xnuo97',)>, <Element 'div' class=('_19xnuo97',)>, <Element 'div' class=('_19xnuo97',)>, <Element 'div' class=('_19xnuo97',)>, <Element 'div' class=('_19xnuo97',)>]",['Anfitrión: Nevenka'],['Se registró en marzo de 2018'],"['Lugar frente a Playa Herradura, con vista a la ciudad. Cercano a restaurantes, balneario la herradura, supermercado, farmacia, bencinera,cajeros y locomoción. Muy cercano a todos los lugares para conocer de la ciudad de Coquimbo, fácil de llegar ya que esta al costado ruta 5.']","['https://maps.google.com/maps?ll=-29.9816,-71.3494&z=14&t=m&hl=es&gl=CL&mapclient=apiv3']",
5,https://www.airbnb.cl/rooms/817256678659656810?adults=1&children=0&infants=0&pets=0&check_in=2023-02-07&check_out=2023-02-12&previous_page_section_name=1000,"['Coquimbo, Chile']",['1 cama'],['1 baño'],['2 huéspedes'],['1 habitación'],['\xa0'],[],[],"['Acogedor y conveniente minicasa para dos personas, todos sus espacios son independientes, nada es compartido. Cuenta con una cama de dos plazas, baño, cocina, comedor, sofá, estacionamiento, terraza, zona de juegos infantiles, áreas verdes natural y en pasto sintético, además el sitio cuenta con hermosa vista al mar.']",['Acogedor departamento'],['Minicasa - Anfitrión:\xa0Constanza'],"[<Element 'div' class=('_19xnuo97',)>, <Element 'div' class=('_19xnuo97',)>, <Element 'div' class=('_19xnuo97',)>, <Element 'div' class=('_19xnuo97',)>, <Element 'div' class=('_19xnuo97',)>, <Element 'div' class=('_19xnuo97',)>, <Element 'div' class=('_19xnuo97',)>]",['Anfitrión: Constanza'],['Se registró en diciembre de 2018'],[],"['https://maps.google.com/maps?ll=-29.96975,-71.32157&z=14&t=m&hl=es&gl=CL&mapclient=apiv3']",
6,https://www.airbnb.cl/rooms/35522055?adults=1&children=0&infants=0&pets=0&check_in=2023-03-03&check_out=2023-03-08&previous_page_section_name=1000,"['Coquimbo, Región de Coquimbo, Chile']",['1 cama'],['1 baño'],['2 huéspedes'],['1 habitación'],"['$39,800\xa0CLP\xa0']",['4.95 ·'],['111 reseñas'],"['Exclusivo departamento, moderno, cómodo y seguro. Ideal para una grata estancia de viajeros de paso o escapada. Se encuentra en el piso 15° con una vista panorámica inigualable, amplio balcón.', 'Estacionamiento al interior del recinto, Wifi, gimnasio, quincho, piscina. Lavandería (con tarjeta de prepago).', 'A pasos de Hospital San Pablo, UCN, Estadio Francisco Sánchez Rumoroso, Mezquita.', 'El departamento es hermoso, delicadamente decorado, grandes ventanales y amplio balcón que permiten una vista panorámica insuperable. ', 'Completamente equipado, todo nuevo.']","['Exclusivo, perfecto!! Hermosa vista.']",['Vivienda rentada entero - Anfitrión: Patricia\xa0Angelica'],"[<Element 'div' class=('_19xnuo97',)>, <Element 'div' class=('_19xnuo97',)>, <Element 'div' class=('_19xnuo97',)>, <Element 'div' class=('_19xnuo97',)>, <Element 'div' class=('_19xnuo97',)>, <Element 'div' class=('_19xnuo97',)>]",['Anfitrión: Patricia Angelica'],['Se registró en mayo de 2019'],[],"['https://maps.google.com/maps?ll=-29.96611,-71.33803&z=14&t=m&hl=es&gl=CL&mapclient=apiv3']",
7,https://www.airbnb.cl/rooms/30584591?adults=1&children=0&infants=0&pets=0&check_in=2023-02-28&check_out=2023-03-06&previous_page_section_name=1000,"['Coquimbo, Región de Coquimbo, Chile']",['3 camas'],['1 baño'],['4 huéspedes'],['1 habitación'],"['$29,325\xa0CLP\xa0']",['4.19 ·'],['17 reseñas'],"['Departamento habilitado para 4 personas, equipado con todo lo necesario para que  puedan disfrutar de una cómoda estadía. Rodeado de áreas verdes, a solo metros de la playa con excelentes restaurantes que se consiguen caminando, sin necesidad de transporte.  Lugares hermosos y cercanos a visitar, como el Valle del El qui,  observatorios,  Punta de Choro,  Isla Damas., y muchos mas.', 'La Serena con todo su esplendor, casino y el muy  reconocido mercado LA Recova a solo 35 minutos en transporte.', 'El departamento esta enclavado en un barrio residencial, a cuadras del club de yates.', 'No necesita de auto, ni pagar estacionamiento para ir a la playa o ir a un restaurantes, todo lo consigue caminando.']",['agradable y cómodo departamento cerca de todo'],['Condo entero - Anfitrión: Ana\xa0Maria'],"[<Element 'div' class=('_19xnuo97',)>, <Element 'div' class=('_19xnuo97',)>, <Element 'div' class=('_19xnuo97',)>, <Element 'div' class=('_19xnuo97',)>, <Element 'div' class=('_19xnuo97',)>, <Element 'div' class=('_19xnuo97',)>]",['Anfitrión: Ana Maria'],['Se registró en diciembre de 2018'],"['barrio tranquilo y precioso. No vendedores inoportunos, No exceso de trafico.']","['https://maps.google.com/maps?ll=-29.97826,-71.35022&z=14&t=m&hl=es&gl=CL&mapclient=apiv3']",
8,https://www.airbnb.cl/rooms/789890340746298265?adults=1&children=0&infants=0&pets=0&check_in=2023-02-03&check_out=2023-02-08&previous_page_section_name=1000,"['Coquimbo, Chile']",['1 cama'],['2 baños compartidos'],['3 huéspedes'],['1 habitación'],"['$17,500\xa0CLP\xa0']",['5.0 ·'],['4 reseñas'],"['Habitación matrimonial, cama de 2 plazas. Es una verdadera picada del hospedaje. Sencillo, sin nada de lujos, pero confortable y con lo necesario. Ideal para aventureros. a 20 minutos del centro de coquimbo, a 20 minutos del centro de Serena, a 15 minutos de Playa Peñuelas y Casino de Juegos. Para 2 persona idealmente, extra señalar 3 huéspedes en sistema y tiene valor adicional.', 'El espacio es un lugar sencillo, como cualquier lugar del Chile profundo, sin embargo es acogedor. Aunque sin lujos, tienes un lugar tranquilo, la habitacion es linda y tiene lo indispensable para que puedas descansar. Estamos Justo en medio de las comunas de La Serena y Coquimbo. Y hay transporte público para ambas ciudades. ', 'La habitación cuenta con su cama, TV pantalla plana, TV Cable y WiFi. La Casa cuenta con dos baños de uso compartido, también con una cocina para la realización de labores básicas. No hay lujos, es un lugar sencillo pero muy confortable.']",['Habitación Matrimonial N°2'],['Habitación privada en alojamiento - Anfitrión: Juan\xa0Luis'],"[<Element 'div' class=('_19xnuo97',)>, <Element 'div' class=('_19xnuo97',)>, <Element 'div' class=('_19xnuo97',)>, <Element 'div' class=('_19xnuo97',)>, <Element 'div' class=('_19xnuo97',)>, <Element 'div' class=('_19xnuo97',)>, <Element 'div' class=('_19xnuo97',)>]",['Anfitrión: Juan Luis'],['Se registró en diciembre de 2022'],"['La casa está ubicada a media cuadra de carabineros, y un consultorio con atención médica y urgencias. Con supermercado a algunas cuadras y negocios de barrio múltiples. Con transporte público hacia Coquimbo y La Serena.  Y un buffet low cost a 3 casas de distancia. El barrio no es un lugar turístico, pero tiene la enorme ventaja que desde aquí puedes movilizarte a los mejores lugares turísticos de la región  a solo 15 o 20 minutos.']","['https://maps.google.com/maps?ll=-29.96189,-71.25757&z=14&t=m&hl=es&gl=CL&mapclient=apiv3']",
9,https://www.airbnb.cl/rooms/42494465?adults=1&children=0&infants=0&pets=0&check_in=2023-02-05&check_out=2023-02-11&previous_page_section_name=1000,"['Coquimbo, Chile']",['4 camas'],['1 baño'],['4 huéspedes'],['3 habitaciones'],"['$49,000\xa0CLP\xa0']",[],[],['Relájate con toda la familia en este tranquilo lugar para quedarse.'],['Casa para vacacionar en Coquimbo'],['Alojamiento entero - Anfitrión:\xa0Dolores'],"[<Element 'div' class=('_19xnuo97',)>, <Element 'div' class=('_19xnuo97',)>, <Element 'div' class=('_19xnuo97',)>, <Element 'div' class=('_19xnuo97',)>, <Element 'div' class=('_19xnuo97',)>, <Element 'div' class=('_19xnuo97',)>, <Element 'div' class=('_19xnuo97',)>]",['Anfitrión: Dolores'],['Se registró en enero de 2017'],[],"['https://maps.google.com/maps?ll=-29.99192,-71.33511&z=14&t=m&hl=es&gl=CL&mapclient=apiv3']",
10,https://www.airbnb.cl/rooms/802282613812707061?adults=1&children=0&infants=0&pets=0&check_in=2023-02-16&check_out=2023-02-21&previous_page_section_name=1000,"['Coquimbo, Chile']",['4 camas'],['1 baño'],['5 huéspedes'],['3 habitaciones'],"['$55,000\xa0CLP\xa0']",[],[],"['departamento a pasos de playa La Herradura, cerca de supermercados y farmacias.', 'Ven a disfrutar con tu familia y disfrutar del clima veraniego']",['Arriendo depto pasos de la playa'],['Vivienda rentada entero - Anfitrión:\xa0Katherine'],"[<Element 'div' class=('_19xnuo97',)>, <Element 'div' class=('_19xnuo97',)>, <Element 'div' class=('_19xnuo97',)>, <Element 'div' class=('_19xnuo97',)>, <Element 'div' class=('_19xnuo97',)>, <Element 'div' class=('_19xnuo97',)>, <Element 'div' class=('_19xnuo97',)>]",['Anfitrión: Katherine'],['Se registró en julio de 2022'],[],"['https://maps.google.com/maps?ll=-29.9821,-71.3497&z=14&t=m&hl=es&gl=CL&mapclient=apiv3']",
11,https://www.airbnb.cl/rooms/13233076?adults=1&children=0&infants=0&pets=0&check_in=2023-03-01&check_out=2023-03-06&previous_page_section_name=1000,"['Coquimbo, Región de Coquimbo, Chile']",['3 camas'],['1 baño'],['4 huéspedes'],['2 habitaciones'],"['$40,000\xa0CLP\xa0']",['4.74 ·'],['181 reseñas'],"['Lugares de interés: El Departamento se encuentra a tres minutos caminando del casino Enjoy y Avenida del Mar, en una zona llena de restaurants, vida en familia y bares para pasar un buen rato en La Serena. A su vez, se encuentra a dos minutos caminando de la Ruta 5 donde se puede tomar locomoción a todos los lugares de interés en Serena y Coquimbo. Mi alojamiento es bueno para parejas, viajeros de negocios y familias (con hijos).', 'The flat is fully equipped with everything needed for work-or holidays travels. Wifi can be found on site, cable TV comfortable sofa-bed and all kitchen tools to make your stay as comfortable as possible.']","['Departamento La Serena, junto a casino Enjoy']",['Vivienda rentada entero - Anfitrión:\xa0Francisco'],"[<Element 'div' class=('_19xnuo97',)>, <Element 'div' class=('_19xnuo97',)>, <Element 'div' class=('_19xnuo97',)>, <Element 'div' class=('_19xnuo97',)>, <Element 'div' class=('_19xnuo97',)>, <Element 'div' class=('_19xnuo97',)>, <Element 'div' class=('_19xnuo97',)>]",['Anfitrión: Francisco'],['Se registró en octubre de 2015'],"['The neighborhood is a Tourist place full of restaurants, bars, Casino, shops and family friendly places. You are also well communicated to most Shopping centers and La Serena and Coquimbo by public transportation.']","['https://maps.google.com/maps?ll=-29.94942,-71.28917&z=14&t=m&hl=es&gl=CL&mapclient=apiv3']",
12,https://www.airbnb.cl/rooms/48384226?adults=1&children=0&infants=0&pets=0&check_in=2023-02-17&check_out=2023-02-22&previous_page_section_name=1000,"['Coquimbo, Chile']",['5 camas'],['1 baño'],['4 huéspedes'],['3 habitaciones'],"['$51,200\xa0CLP\xa0']",['4.68 ·'],['53 reseñas'],"['Disfruta de tu estadia en La Serena, departamento ambientado en lo minimalista, con todas las comodidades que necesitas para venir a descansar o hacer negocios.', 'A solo 5 minutos del centro de La Serena y de la playa.', 'Condominio Espacio Urbano III ', 'A minutos de Supermercado y grandes tiendas.', 'Sábanas y Toallas incluidas.', 'Sin ascensor', 'Departamento con ambientación minimalista.']","['Comodidad, excelente ubicación y Tranquilidad']",['Vivienda rentada entero - Anfitrión:\xa0Alex'],"[<Element 'div' class=('_19xnuo97',)>, <Element 'div' class=('_19xnuo97',)>, <Element 'div' class=('_19xnuo97',)>, <Element 'div' class=('_19xnuo97',)>, <Element 'div' class=('_19xnuo97',)>, <Element 'div' class=('_19xnuo97',)>, <Element 'div' class=('_19xnuo97',)>]",['Anfitrión: Alex'],['Se registró en septiembre de 2018'],"['Es un Condominio familiar, cómodo y tranquilo. ', 'Servicio de Conserjeria y vigilancia las 24 horas, no hay ascensor']","['https://maps.google.com/maps?ll=-29.89823,-71.25993&z=14&t=m&hl=es&gl=CL&mapclient=apiv3']",
13,https://www.airbnb.cl/rooms/565351020421358732?adults=1&children=0&infants=0&pets=0&check_in=2023-03-06&check_out=2023-03-11&previous_page_section_name=1000,"['Coquimbo, Chile']",['2 camas'],['1 baño'],['3 huéspedes'],['2 habitaciones'],"['$18,000\xa0CLP\xa0']",[],[],['Disfruta de la sencillez de este alojamiento tranquilo y céntrico. Ideal para recorrer las Playas de Coquimbo y La Serena y pagar lo justo.'],"['Mini dpto equipado , céntrico y con conectividad']",['Vivienda rentada entero - Anfitrión:\xa0Cristian'],"[<Element 'div' class=('_19xnuo97',)>, <Element 'div' class=('_19xnuo97',)>, <Element 'div' class=('_19xnuo97',)>, <Element 'div' class=('_19xnuo97',)>, <Element 'div' class=('_19xnuo97',)>, <Element 'div' class=('_19xnuo97',)>, <Element 'div' class=('_19xnuo97',)>]",['Anfitrión: Cristian'],['Se registró en agosto de 2017'],[],"['https://maps.google.com/maps?ll=-29.96808,-71.32033&z=14&t=m&hl=es&gl=CL&mapclient=apiv3']",
14,https://www.airbnb.cl/rooms/801575400989874468?adults=1&children=0&infants=0&pets=0&check_in=2023-02-27&check_out=2023-03-04&previous_page_section_name=1000,"['Coquimbo, Chile']",['3 camas'],['1 baño'],['4 huéspedes'],['2 habitaciones'],"['$32,639\xa0CLP\xa0']",[],[],"['Cabaña equipada para 4 personas, tenemos 16 cabañas en total, cada cabaña tiene un estacionamiento disponible. Ubicada en el epicentro de Peñuelas, al lado del Casino Enjoy, a una cuadra de la playa, cercana a restaurantes, pubs, centros comerciales, outlet, servicentros, a dos cuadras de la carretera panamericana RUTA 5. La playa es la más tranquila y de mejor oleaje para disfrutar de la calidez del clima.']",['Cabaña a pasos de la playa (7)'],['Cabaña entero - Anfitrión: Cabañas Peñuelas\xa0Diamond'],"[<Element 'div' class=('_19xnuo97',)>, <Element 'div' class=('_19xnuo97',)>, <Element 'div' class=('_19xnuo97',)>, <Element 'div' class=('_19xnuo97',)>, <Element 'div' class=('_19xnuo97',)>, <Element 'div' class=('_19xnuo97',)>, <Element 'div' class=('_19xnuo97',)>]",['Anfitrión: Cabañas Peñuelas Diamond'],['Se registró en diciembre de 2022'],[],"['https://maps.google.com/maps?ll=-29.9478,-71.2906&z=14&t=m&hl=es&gl=CL&mapclient=apiv3']",
15,https://www.airbnb.cl/rooms/791278153741394231?adults=1&children=0&infants=0&pets=0&check_in=2023-02-18&check_out=2023-02-24&previous_page_section_name=1000,"['La Serena, Coquimbo, Chile']",['3 camas'],['1 baño'],['4 huéspedes'],['2 habitaciones'],"['$45,000\xa0CLP\xa0']",[],[],['Lindo departamento familiar cercano al faro'],['Departamento cerca del Faro'],['Vivienda rentada entero - Anfitrión:\xa0Carolina'],"[<Element 'div' class=('_19xnuo97',)>, <Element 'div' class=('_19xnuo97',)>, <Element 'div' class=('_19xnuo97',)>, <Element 'div' class=('_19xnuo97',)>, <Element 'div' class=('_19xnuo97',)>, <Element 'div' class=('_19xnuo97',)>, <Element 'div' class=('_19xnuo97',)>]",['Anfitrión: Carolina'],['Se registró en febrero de 2018'],[],"['https://maps.google.com/maps?ll=-29.9074,-71.2698&z=14&t=m&hl=es&gl=CL&mapclient=apiv3']",
16,https://www.airbnb.cl/rooms/31231267?adults=1&children=0&infants=0&pets=0&check_in=2023-03-02&check_out=2023-03-07&previous_page_section_name=1000,"['Coquimbo, Región de Coquimbo, Chile']",['3 camas'],['1 baño'],['4 huéspedes'],['3 habitaciones'],"['$38,000\xa0CLP\xa0']",['4.87 ·'],['133 reseñas'],"['Te encantará mi departamento de espacios iluminados, acogedores y limpios. Tendrás todo lo necesario para pasar una buena estancia con comodidad. Cuenta con  un excelente acceso a zonas de interés turístico, playa, casino de juegos de Coquimbo, restaurantes, paseos a pié o renta de bicicletas.  Supermercado, centros comerciales y servicios accesibles.', 'El edificio cuenta con servicio de vigilancia para mantener la seguridad en los accesos.  Estacionamiento exclusivo y gratuito.']",['Departamento a 2 minutos de Playa Peñuelas.'],['Condo entero - Anfitrión:\xa0Marcela'],"[<Element 'div' class=('_19xnuo97',)>, <Element 'div' class=('_19xnuo97',)>, <Element 'div' class=('_19xnuo97',)>, <Element 'div' class=('_19xnuo97',)>, <Element 'div' class=('_19xnuo97',)>]",['Anfitrión: Marcela'],['Se registró en diciembre de 2013'],"['Sector residencial turístico, cercano a playas, casino de juegos, gastronomía y otras atracciones. Zona segura y agradable, de día y de noche.']","['https://maps.google.com/maps?ll=-29.94776,-71.28982&z=14&t=m&hl=es&gl=CL&mapclient=apiv3']",
17,https://www.airbnb.cl/rooms/741186949587156016?adults=1&children=0&infants=0&pets=0&check_in=2023-02-10&check_out=2023-02-15&previous_page_section_name=1000,"['Coquimbo, Chile']",['1 cama'],['1 baño compartido'],['2 huéspedes'],['1 habitación'],"['$23,000\xa0CLP\xa0']",['4.86 ·'],['7 reseñas'],"['Habitación con cama matrimonial dentro de condominio con cierre perimetral. ', 'Lugar a 5 minutos de la playa en vehiculo, aprox. 20 o 25 minuto a pie.', 'Ideal para parejas que buscan un lugar seguro y acogedor.', '1 baño completo compartido,cocina compartida completa con refrigerador,hervidor,vajilla y utensilios basicos.', 'Sala de estar compartida con 2 sofas y Wi-Fi.', 'Estacionamiento interior techado.', 'Ofrecemos servicio de lavandería.', '2 huespedes como maximo incluyendo niños mayores de 2 años', 'Recibimos con mucho cariño a nuestros huéspedes y hacemos nuestro mayor esfuerzo para que se sientan cómodos y agradados. Nos preocupamos especialmente de la higiene y limpieza de la habitación entre un huésped y otro.', 'Durante la estadía nos mantenemos atentos para orientarlos en lo que respecta a lugares interesantes de visitar, medios de transporte, gastronomía o cualquier necesidad que se presente.', 'Nuestro objetivo es que tengan el mejor recuerdo de nuestro espacio.']",['Habitación 5 minutos de la playa'],['Habitación privada en casa de huéspedes - Anfitrión:\xa0Matias'],"[<Element 'div' class=('_19xnuo97',)>, <Element 'div' class=('_19xnuo97',)>, <Element 'div' class=('_19xnuo97',)>, <Element 'div' class=('_19xnuo97',)>, <Element 'div' class=('_19xnuo97',)>, <Element 'div' class=('_19xnuo97',)>, <Element 'div' class=('_19xnuo97',)>]",['Anfitrión: Matias'],['Se registró en diciembre de 2017'],"['La casa se encuentra en un condominio cerrado en el sector El Rosario de Peñuelas, un barrio muy tranquilo y seguro, con 2 supermercados a los que se puede llegar fácilmente a pie (un Lider y un Santa Isabel), 2 farmacias, 2 servicentros, strip center y Outlet. ', 'Transporte público a 1 cuadra con locomoción hacia La Serena, Coquimbo y sector playa. También se puede llegar a la playa caminando en no más de 20 minutos, o en vehículo en 5 minutos.', 'El sector es conocido por ser tranquilo, silencioso y tener un ambiente familiar, las calles no son muy transitadas por vehículos y es un lindo barrio residencial para salir a recorrer caminando. No es problemático llegar tarde puesto que aún de noche no es para nada un sector peligroso.']","['https://maps.google.com/maps?ll=-29.97021,-71.30341&z=14&t=m&hl=es&gl=CL&mapclient=apiv3']",
