,Link,Comuna,Camas,Baños,Capacidad,Habitaciones,Precio,Nota,Nnota,Descripción,Titulo1,Titulo2,Servicios,Anfitrion,Registro,Ubides,Ubicacion,Tipo
181,https://www.airbnb.cl/rooms/812492203966922706?adults=1&children=0&infants=0&pets=0&check_in=2023-02-12&check_out=2023-02-19&previous_page_section_name=1000,"['La Serena, Coquimbo, Chile']",['5 camas'],['2 baños'],['6 huéspedes'],['3 habitaciones'],"['$50,316\xa0CLP\xa0']",[],[],"['Relájate con toda la familia en este tranquilo lugar para quedarse.', 'Equipado para seis personas con las comodidades para que pases las vacaciones en La serena.', '✅15 minutos de la playa ', '✅15 minutos del centro y Recova ', '✅Supermercado a dos cuadras ', '✅Centro comercial cerca. ', '✅Restaurante cerca.', '✅10 minutos del Mall plaza La Serena.', '✅3 Dormitorios 2 Baños. ', '✅Sector Milagro Dos ( sector Oriente)', 'Habitaciones con espacio suficiente para que descanses y disfrutes tus Vacaciones.']",['Depa en La serena'],['Vivienda rentada entero - Anfitrión:\xa0Francisca'],"[<Element 'div' class=('_19xnuo97',)>, <Element 'div' class=('_19xnuo97',)>, <Element 'div' class=('_19xnuo97',)>, <Element 'div' class=('_19xnuo97',)>, <Element 'div' class=('_19xnuo97',)>, <Element 'div' class=('_19xnuo97',)>, <Element 'div' class=('_19xnuo97',)>]",['Anfitrión: Francisca'],['Se registró en marzo de 2019'],[],"['https://maps.google.com/maps?ll=-29.9494,-71.2529&z=14&t=m&hl=es&gl=CL&mapclient=apiv3']",
182,https://www.airbnb.cl/rooms/29308538?adults=1&children=0&infants=0&pets=0&check_in=2023-09-16&check_out=2023-09-22&previous_page_section_name=1000,"['Guanaqueros, Coquimbo Region, Chile']",['4 camas'],['1 baño'],['5 huéspedes'],['2 habitaciones'],"['$55,000\xa0CLP\xa0']",['4.82 ·'],['22 reseñas'],"['Acogedora Cabaña a tres cuadras de una de las más bellas y tranquilas playas de Chile.', 'Ideal para relajarse y compartir unas vacaciones en familia.', 'Con un clima privilegiado donde siempre prevalece el sol. La Camanchaca matinal (bruma costera) resulta ideal para realizar caminatas, paseos en bicicleta por la playa o treking por el cerro. ', 'Ubicada a pocas cuadras del centro del pueblo, en una zona residencial y tranquila.', 'Hablamos inglés.', 'Queremos que tu estadía en Guanaqueros sea inolvidable.', 'La cabaña de madera es pequeña pero confortable, con amplios espacios exteriores para estar al aire libre.', 'Cuenta con los utensilios de cocina necesarios.', 'No se incluyen toallas ni ropa de cama.']","['Cabaña Villa Pacífico en Guanaqueros, Chile']",['Cabaña entero - Anfitrión:\xa0Andrea'],"[<Element 'div' class=('_19xnuo97',)>, <Element 'div' class=('_19xnuo97',)>, <Element 'div' class=('_19xnuo97',)>, <Element 'div' class=('_19xnuo97',)>, <Element 'div' class=('_19xnuo97',)>, <Element 'div' class=('_19xnuo97',)>, <Element 'div' class=('_19xnuo97',)>]",['Anfitrión: Andrea'],['Se registró en septiembre de 2016'],[],"['https://maps.google.com/maps?ll=-30.19826,-71.4274&z=14&t=m&hl=es&gl=CL&mapclient=apiv3']",
183,https://www.airbnb.cl/rooms/784116000465463300?adults=1&children=0&infants=0&pets=0&check_in=2023-02-19&check_out=2023-02-24&previous_page_section_name=1000,"['La Serena, Coquimbo, Chile']",['4 camas'],['1 baño'],['5 huéspedes'],['3 habitaciones'],"['$36,000\xa0CLP\xa0']",[],[],"['Casa tipo depto ubicada en avenida principal, cercana a supermercado, negocios, playa faro, comida rápida.', 'Casa pequeña, cuenta con 3 habitaciones, 1 baño.', 'pieza 1: cama matrimonial', 'Pieza 2: litera/ camarote', 'Pieza 3; cama 1,5', 'En caso de necesitar estacionamiento, habilitamos uno  a 5 minutos caminando de la casa.']","['Casa tipo depto 5 personas, La Serena']",['Alojamiento entero - Anfitrión:\xa0Bárbara'],"[<Element 'div' class=('_19xnuo97',)>, <Element 'div' class=('_19xnuo97',)>, <Element 'div' class=('_19xnuo97',)>, <Element 'div' class=('_19xnuo97',)>, <Element 'div' class=('_19xnuo97',)>, <Element 'div' class=('_19xnuo97',)>, <Element 'div' class=('_19xnuo97',)>]",['Anfitrión: Bárbara'],['Se registró en enero de 2018'],['Vecindario con gran circulación por estar en avenida principal.'],"['https://maps.google.com/maps?ll=-29.90192,-71.26447&z=14&t=m&hl=es&gl=CL&mapclient=apiv3']",
184,https://www.airbnb.cl/rooms/707174959506550079?adults=1&children=0&infants=0&pets=0&check_in=2023-02-08&check_out=2023-02-13&previous_page_section_name=1000,"['Coquimbo, Chile']",['1 cama'],['1 baño privado'],['2 huéspedes'],['1 habitación'],"['$30,000\xa0CLP\xa0']",[],[],"['Disfruta de mi cómoda habitación matrimonial en sector de Peñuelas, Coquimbo. Incluye baño privado, caja fuerte, wi fi, tv con cable, ventanales y mesa', 'Casa ubicada en un sector residencial tranquilo, cercano a supermercado, gimnasio, playa, almacenes y restaurantes. Cuenta con acceso a uber, taxi y microbus.']",['Pieza cerca de av del mar y playa (1D/1B)'],['Habitación privada en casa particular - Anfitrión:\xa0Berta'],"[<Element 'div' class=('_19xnuo97',)>, <Element 'div' class=('_19xnuo97',)>, <Element 'div' class=('_19xnuo97',)>, <Element 'div' class=('_19xnuo97',)>, <Element 'div' class=('_19xnuo97',)>, <Element 'div' class=('_19xnuo97',)>, <Element 'div' class=('_19xnuo97',)>]",['Anfitrión: Berta'],['Se registró en enero de 2018'],"['Lugar tranquilo, a cuadras de playa, restaurantes, casino, gimnasio y supermercado.']","['https://maps.google.com/maps?ll=-29.96141,-71.29957&z=14&t=m&hl=es&gl=CL&mapclient=apiv3']",
185,https://www.airbnb.cl/rooms/31207097?adults=1&children=0&infants=0&pets=0&check_in=2023-02-22&check_out=2023-02-28&previous_page_section_name=1000,"['La Serena, Región de Coquimbo, Chile']",['4 camas'],['1 baño'],['5 huéspedes'],['3 habitaciones'],"['$48,000\xa0CLP\xa0']",[],[],"['Depto.  muy bien ubicado, cerca de la ciudad y de la playa ( El Faro ), dificio  antisismico.  Ubicado en un tercer piso, a un costado de mall puertas del mar,  supermercado, servicios entretención, banco, cajeros automáticos. Amoblado hasta para 5 personas,  logia con lavadora , camas individuales, iluminado naturalmente, cuenta con balcón y una amplia vista. cuenta con piscina,  quincho,  juegos infantiles y estacionamiento, guardia 24 horas, vigilancia por circuito cerrado, portón electrico.', 'Acogedor Depto. muy  iluminado, muy bien ubicado, en tercer piso,  con amplia vista orientación frontal al Sur y  lateral ( hacia el mar ) , encontrarás muy cerca un Hipermercado Lider y Mall Puertas del Mar entre otros, queda cerca de la ciudad y del Faro ( 5 ministos en auto ) . Desde el balcón del Dpto. se ve directamente la piscina y quincho. Amoblado y alhajado hasta para hasta 5 personas,  el Depto. no está adecuado para niños ni infantes menores de 1 año, no cuenta con malla en balcón ni cuna. ', ' Se encuentra  en diagonal al supermercado Hiper Lider, también cuenta con banco, cajeros automáticos.']",['307- Hermoso Dpto. en La Serena'],['Vivienda rentada entero - Anfitrión:\xa0Roxana'],"[<Element 'div' class=('_19xnuo97',)>, <Element 'div' class=('_19xnuo97',)>, <Element 'div' class=('_19xnuo97',)>, <Element 'div' class=('_19xnuo97',)>, <Element 'div' class=('_19xnuo97',)>, <Element 'div' class=('_19xnuo97',)>, <Element 'div' class=('_19xnuo97',)>]",['Anfitrión: Roxana'],['Se registró en diciembre de 2018'],"['Cerca de la playa ( 5 minutos del Faro en vehículo ) y del centro de la ciudad ( 5 minutos en auto), muy central, depto. muy grato y cómodo, Supermercado y tiendas, locales de comida, cerca del Banco, cajeros automáticos, etc. Cuenta con servicios y entretención  cerca del Depto. .']","['https://maps.google.com/maps?ll=-29.89711,-71.26057&z=14&t=m&hl=es&gl=CL&mapclient=apiv3']",
186,https://www.airbnb.cl/rooms/28014395?adults=1&children=0&infants=0&pets=0&check_in=2023-03-05&check_out=2023-03-11&previous_page_section_name=1000,"['Coquimbo, Región de Coquimbo, Chile']",['5 camas'],['2 baños'],['6 huéspedes'],['3 habitaciones'],"['$46,800\xa0CLP\xa0']",['5.0 ·'],['17 reseñas'],"['Excelente departamento en piso 18(ultimo piso), poco ruido, la mejor vista al oriente. Completamente privado, equipado, con estacionamiento seguro y exclusivo y en la mejor ubicación de la IV región.', 'Solo necesitas traer tus sabanas, toallas y tu mercadería para disfrutar de tus vacaciones.', 'Piscina, Juegos infantiles, Sala wifi, Lavanderia. Piscina cerrada por temporda 2021.']",['Departamento La Serena/Peñuelas. A pasos del Mar'],['Vivienda rentada entero - Anfitrión:\xa0Jose'],"[<Element 'div' class=('_19xnuo97',)>, <Element 'div' class=('_19xnuo97',)>, <Element 'div' class=('_19xnuo97',)>, <Element 'div' class=('_19xnuo97',)>, <Element 'div' class=('_19xnuo97',)>, <Element 'div' class=('_19xnuo97',)>]",['Anfitrión: Jose'],['Se registró en febrero de 2017'],"['El mejor sector de la IV region. Ubicado atrás de casino enjoy, a pasos del mar, accesible en auto emplazado al lado de la autopista 5 norte, a 20 minutos del terminal de buses de la Serena e igualmente de Coquimbo. A 30 minutos del aeropuerto. Sector lleno de restaurantes, locales nocturnos, playa y sectores para conocer. Sector muy seguro y especial para hacer deportes al lado del mar, aprovechar la piscina o disfrutar del mar sin necesidad de ir en vehículo.']","['https://maps.google.com/maps?ll=-29.943,-71.28686&z=14&t=m&hl=es&gl=CL&mapclient=apiv3']",
187,https://www.airbnb.cl/rooms/47720891?adults=1&children=0&infants=0&pets=0&check_in=2023-03-18&check_out=2023-03-23&previous_page_section_name=1000,"['Coquimbo, Chile']",['6 camas'],['2 baños'],['7 huéspedes'],['3 habitaciones'],['\xa0'],['4.71 ·'],['51 reseñas'],"['Lindo y nuevo departamento ubicado en la primera línea de la playa de La Herradura con acceso directo a la playa, piscina y gimanasio disponibles. Ubicado en el tercer piso con vista a toda la bahía de La Herradura.']",['Departamento 3er piso Primera Línea La Herradura'],['Vivienda rentada entero - Anfitrión:\xa0Federico'],"[<Element 'div' class=('_19xnuo97',)>, <Element 'div' class=('_19xnuo97',)>, <Element 'div' class=('_19xnuo97',)>, <Element 'div' class=('_19xnuo97',)>, <Element 'div' class=('_19xnuo97',)>, <Element 'div' class=('_19xnuo97',)>, <Element 'div' class=('_19xnuo97',)>]",['Anfitrión: Federico'],['Se registró en marzo de 2014'],[],"['https://maps.google.com/maps?ll=-29.98279,-71.35332&z=14&t=m&hl=es&gl=CL&mapclient=apiv3']",
188,https://www.airbnb.cl/rooms/797273244952638528?adults=1&children=0&infants=0&pets=0&check_in=2023-02-19&check_out=2023-02-25&previous_page_section_name=1000,"['Coquimbo, Chile']",['3 camas'],['2 baños'],['4 huéspedes'],['2 habitaciones'],"['$75,833\xa0CLP\xa0']",[],[],"['Ubicado en condominio con acceso privado, a pasos de la playa, restaurantes, pubs, mall y casino Enjoy coquimbo.', 'Con una vista panorámica al mar. ', 'Tiene estacionamiento propio en segundo nivel.', 'Condominio cuenta con lavandería, quincho, piscina y estacionamiento bicicletas.', 'Malla seguridad niños en balcón.', 'Wifi', 'TV Internet Zapping (Roku)', 'Sábanas y toalla de baño incluidas.', 'Acogedor departamento para 4 personas. Totalmente equipado , con ubicación privilegiada.', 'Maravillosa vista al mar y puesta de Sol sobre Coquimbo.', 'A pasos de casino enjoy, restaurantes y locales comerciales.', 'Playa a 50 metros.', 'Permitirán unas agradables vacaciones sin depender de contar con vehículo.']",['Apartamento 2D/2B con vista panorámica al mar'],['Vivienda rentada entero - Anfitrión:\xa0Ricardo'],"[<Element 'div' class=('_19xnuo97',)>, <Element 'div' class=('_19xnuo97',)>, <Element 'div' class=('_19xnuo97',)>, <Element 'div' class=('_19xnuo97',)>, <Element 'div' class=('_19xnuo97',)>, <Element 'div' class=('_19xnuo97',)>, <Element 'div' class=('_19xnuo97',)>]",['Anfitrión: Ricardo'],['Se registró en agosto de 2017'],[],"['https://maps.google.com/maps?ll=-29.9467,-71.2895&z=14&t=m&hl=es&gl=CL&mapclient=apiv3']",
189,https://www.airbnb.cl/rooms/797805477357883673?adults=1&children=0&infants=0&pets=0&check_in=2023-02-03&check_out=2023-02-10&previous_page_section_name=1000,"['Elqui, Coquimbo, Chile']",['1 cama'],['1 baño privado'],['2 huéspedes'],['1 habitación'],['\xa0'],[],[],"['Te encantará esta escapada única a pasos de playa la herradura, supermercados, locales comerciales y locomoción. Sector seguro y cómodo.', 'Minidepto equipado para dos, super acogedor a quienes deseen pasar unos días por la ciudad']",['Arriendo depto interior por días'],['Habitación privada en minicasa - Anfitrión:\xa0Valeria'],"[<Element 'div' class=('_19xnuo97',)>, <Element 'div' class=('_19xnuo97',)>, <Element 'div' class=('_19xnuo97',)>, <Element 'div' class=('_19xnuo97',)>, <Element 'div' class=('_19xnuo97',)>, <Element 'div' class=('_19xnuo97',)>, <Element 'div' class=('_19xnuo97',)>]",['Anfitrión: Valeria'],['Se registró en febrero de 2020'],[],"['https://maps.google.com/maps?ll=-29.98366,-71.34347&z=14&t=m&hl=es&gl=CL&mapclient=apiv3']",
190,https://www.airbnb.cl/rooms/21534637?adults=1&children=0&infants=0&pets=0&check_in=2023-02-20&check_out=2023-02-25&previous_page_section_name=1000,"['La Serena, Coquimbo, Chile']",['4 camas'],['1 baño'],['4 huéspedes'],['2 habitaciones'],"['$100,000\xa0CLP\xa0']",[],[],"['Relájate con toda la familia en este tranquilo lugar para quedarse.', 'Depto en primera línea con vista privilegiada de la playa y monumento el faro.', 'Con fáciles accesos  a distintos lugares turísticos.', 'Completamente equipado, solo tienes que llegar con el ánimo de disfrutar.', 'El depto dispone de 1 cama king con colchón de espuma nuevo especial para descansar. 2 camas de 1’plaza y 1 futón en el living. Se dispone de sábanas para todas las camas.']",['Relajo frente al Mar'],['Vivienda rentada entero - Anfitrión:\xa0Natalia'],"[<Element 'div' class=('_19xnuo97',)>, <Element 'div' class=('_19xnuo97',)>, <Element 'div' class=('_19xnuo97',)>, <Element 'div' class=('_19xnuo97',)>, <Element 'div' class=('_19xnuo97',)>, <Element 'div' class=('_19xnuo97',)>, <Element 'div' class=('_19xnuo97',)>]",['Anfitrión: Natalia'],['Se registró en enero de 2017'],"['Frente a monumento el faro, cercano a centro comercial con supermercado y tiendas de distintos tipos, y una infinidad de restaurantes y cafés para hacer de tu estadía lo más grata posible sin necesidad de  usar automóvil ni exponerte a la búsqueda de estacionamientos.']","['https://maps.google.com/maps?ll=-29.90561,-71.27321&z=14&t=m&hl=es&gl=CL&mapclient=apiv3']",
191,https://www.airbnb.cl/rooms/791874475765663310?adults=1&children=0&infants=0&pets=0&check_in=2023-02-18&check_out=2023-02-23&previous_page_section_name=1000,"['Coquimbo, Chile']",['1 cama'],['1 baño'],['2 huéspedes'],['1 habitación'],"['$27,000\xa0CLP\xa0']",[],[],"['Acogedor y conveniente mini departamento entero, disponible para estadías largas y vacacionales. cuenta con comodas dependencias independientes,  es una mini casa ideal para una estadía de dos, hasta tres personas. el recinto cuenta con hermosa vista al mar,  áreas verdes, zona de juegos infantiles y amplia zona de áreas verdes en  pasto sintético.']",['Acogedor departamento en Coquimbo vista al mar 6'],['Minicasa - Anfitrión:\xa0Constanza'],"[<Element 'div' class=('_19xnuo97',)>, <Element 'div' class=('_19xnuo97',)>, <Element 'div' class=('_19xnuo97',)>, <Element 'div' class=('_19xnuo97',)>, <Element 'div' class=('_19xnuo97',)>, <Element 'div' class=('_19xnuo97',)>, <Element 'div' class=('_19xnuo97',)>]",['Anfitrión: Constanza'],['Se registró en diciembre de 2018'],[],"['https://maps.google.com/maps?ll=-29.96887,-71.32674&z=14&t=m&hl=es&gl=CL&mapclient=apiv3']",
192,https://www.airbnb.cl/rooms/32307529?adults=1&children=0&infants=0&pets=0&check_in=2023-02-28&check_out=2023-03-06&previous_page_section_name=1000,"['Coquimbo, Región de Coquimbo, Chile']",['3 camas'],['2 baños'],['4 huéspedes'],['3 habitaciones'],"['$51,588\xa0CLP\xa0']",['5.0 ·'],['13 reseñas'],"['Mi  depto. ', 'Esta ubicado en la zona turística  mas importante de Coquimbo ,en el sector de Penuelas,detrás del Casino de juegos, es acogedor y tranquilo a una cuadra de la avenida del mar.', 'Queda cerca de mall vivo,ferias artesanales,mini supermercados,a una cuadra de la carretera ', 'etc.']",['marina sol III depto. jeny'],['Vivienda rentada entero - Anfitrión:\xa0Jeny'],"[<Element 'div' class=('_19xnuo97',)>, <Element 'div' class=('_19xnuo97',)>, <Element 'div' class=('_19xnuo97',)>, <Element 'div' class=('_19xnuo97',)>, <Element 'div' class=('_19xnuo97',)>]",['Anfitrión: Jeny'],['Se registró en febrero de 2019'],[],"['https://maps.google.com/maps?ll=-29.94503,-71.28735&z=14&t=m&hl=es&gl=CL&mapclient=apiv3']",
193,https://www.airbnb.cl/rooms/625243042937067772?adults=1&children=0&infants=0&pets=0&check_in=2023-02-23&check_out=2023-02-28&previous_page_section_name=1000,"['La Serena, Coquimbo, Chile']",['4 camas'],['1 baño'],['4 huéspedes'],['2 habitaciones'],"['$50,000\xa0CLP\xa0']",['4.71 ·'],['7 reseñas'],"['Tu familia estará cerca de todo cuando te quedes en este alojamiento, cerca de restaurantes. pubs, discos, negocios, etc! Departamentos SIN ascensor']",['318 Lindo apartamento a pasos de la playa'],['Vivienda rentada entero - Anfitrión:\xa0Consuelo'],"[<Element 'div' class=('_19xnuo97',)>, <Element 'div' class=('_19xnuo97',)>, <Element 'div' class=('_19xnuo97',)>, <Element 'div' class=('_19xnuo97',)>, <Element 'div' class=('_19xnuo97',)>, <Element 'div' class=('_19xnuo97',)>, <Element 'div' class=('_19xnuo97',)>]",['Anfitrión: Consuelo'],['Se registró en mayo de 2019'],[],"['https://maps.google.com/maps?ll=-29.92799,-71.27589&z=14&t=m&hl=es&gl=CL&mapclient=apiv3']",
194,https://www.airbnb.cl/rooms/46313742?adults=1&children=0&infants=0&pets=0&check_in=2023-03-03&check_out=2023-03-09&previous_page_section_name=1000,"['La Serena, Coquimbo, Chile']",['4 camas'],['1 baño'],['5 huéspedes'],['2 habitaciones'],"['$60,000\xa0CLP\xa0']",[],[],"['Acogedor departamento ubicado a una cuadra de la playa, de locales de entretención, restaurantes, negocios y feria artesanal. Ideal para familia de 5 personas con movilización propia. A 5 minutos de mall La Serena y Outlet Peñuelas.', 'Condominio privado con seguridad las 24 horas del día.', 'El departamento está en completa disposición para los huéspedes. ', 'Pueden utilizar quincho y piscina según disponibilidad en conserjería.']",['Departamento Acogedor a una cuadra de la playa.'],['Condo entero - Anfitrión:\xa0Washington'],"[<Element 'div' class=('_19xnuo97',)>, <Element 'div' class=('_19xnuo97',)>, <Element 'div' class=('_19xnuo97',)>, <Element 'div' class=('_19xnuo97',)>, <Element 'div' class=('_19xnuo97',)>, <Element 'div' class=('_19xnuo97',)>]",['Anfitrión: Washington'],['Se registró en diciembre de 2019'],"['Playa, restaurantes, pubs, negocios, feria artesanal.']","['https://maps.google.com/maps?ll=-29.94096,-71.28469&z=14&t=m&hl=es&gl=CL&mapclient=apiv3']",
195,https://www.airbnb.cl/rooms/808014321392448804?adults=1&children=0&infants=0&pets=0&check_in=2023-02-27&check_out=2023-03-04&previous_page_section_name=1000,"['La Serena, Coquimbo, Chile']",['3 camas'],['1 baño'],['4 huéspedes'],['2 habitaciones'],['\xa0'],[],[],"['Este lugar tiene una ubicación estratégica en el mejor sector de la región, ideal para disfrutar en familia o con amigos. ', 'Ven a disfrutar de las hermosas playas, valle del Elqui y mucho más.']",['Dpto a pasos del mar'],['Vivienda rentada entero - Anfitrión:\xa0Isenia'],"[<Element 'div' class=('_19xnuo97',)>, <Element 'div' class=('_19xnuo97',)>, <Element 'div' class=('_19xnuo97',)>, <Element 'div' class=('_19xnuo97',)>, <Element 'div' class=('_19xnuo97',)>, <Element 'div' class=('_19xnuo97',)>]",['Anfitrión: Isenia'],['Se registró en noviembre de 2021'],[],"['https://maps.google.com/maps?ll=-29.9473,-71.2903&z=14&t=m&hl=es&gl=CL&mapclient=apiv3']",
196,https://www.airbnb.cl/rooms/721807439741071318?adults=1&children=0&infants=0&pets=0&check_in=2023-02-05&check_out=2023-02-10&previous_page_section_name=1000,"['La Serena, Coquimbo, Chile']",['1 cama'],['1 baño'],['2 huéspedes'],['1 habitación'],"['$43,200\xa0CLP\xa0']",['4.73 ·'],['15 reseñas'],"['Disfruta de la sencillez de este alojamiento tranquilo y céntrico. con muy buena ubicación. Cerca de universidades, supermercados, farmacia, bancos, hospital de la serena, y buena conectividad con aeropuerto.']",['Departamento entero en la serena.'],['Alojamiento vacacional entero - Anfitrión:\xa0Francisco'],"[<Element 'div' class=('_19xnuo97',)>, <Element 'div' class=('_19xnuo97',)>, <Element 'div' class=('_19xnuo97',)>, <Element 'div' class=('_19xnuo97',)>, <Element 'div' class=('_19xnuo97',)>, <Element 'div' class=('_19xnuo97',)>, <Element 'div' class=('_19xnuo97',)>]",['Anfitrión: Francisco'],['Se registró en diciembre de 2017'],"['Sector cuenta con supermercado, farmacia, estaciones de servicio.']","['https://maps.google.com/maps?ll=-29.92017,-71.23858&z=14&t=m&hl=es&gl=CL&mapclient=apiv3']",
197,https://www.airbnb.cl/rooms/582755424858917675?adults=1&children=0&infants=0&pets=0&check_in=2023-03-01&check_out=2023-03-06&previous_page_section_name=1000,"['La Serena, Coquimbo, Chile']",['4 camas'],['1 baño'],['5 huéspedes'],['2 habitaciones'],"['$58,410\xa0CLP\xa0']",['4.64 ·'],['22 reseñas'],"['Laguna del Mar - La Serena, es un Departamento increíble para hasta 5 personas ubicado en la mejor zona de La Serena.', 'Departamento en Resort Laguna del Mar ideal para familias o grupo de amigos para unas tranquilas y merecidas vacaciones, increíble vista en un lugar hermoso y único en La Serena.', 'El Departamento está equipado con 1 Cama Matrimonial, 1 Cama individual y 1 Litera con 2 camas para niños hasta 70kg', 'Living con SmartTV', 'Internet Alta Velocidad', 'Cocina equipada', 'Ropa de cama y baño', 'Resort Laguna del Mar – La Serena', 'El departamento se encuentra en la Torre Playa Marina, la cual es uno de los edificios centrales, por lo que la vista que obtendrá es real y no sacada de imágenes promocionales.', 'El resort se encuentra en la línea de la playa y cuenta además, con salida controlada al mar para su mayor seguridad.', 'Dormitorio principal con cama matrimonial y 1 dormitorio con 1 cama individual y 1 litera con dos camas para niños.', 'Wifi de alta velocidad, SmartTV con servicios de Streaming, Secador de pelo, Colgador de ropa, cocina full equipada, Ropa de cama.', 'Cercano a atracciones que ofrece la región, tales como El Faro, Av. Del Mar, Shopping y restaurantes a pie o en vehículo.', 'Antes y después de cada estadía, se procede a realizar un riguroso y completo proceso de desinfección y sanitización para su tranquilidad y seguridad.']",['Departamento Resort Urbano Familiar Laguna del Mar'],['Alojamiento vacacional entero - Anfitrión:\xa0José'],"[<Element 'div' class=('_19xnuo97',)>, <Element 'div' class=('_19xnuo97',)>, <Element 'div' class=('_19xnuo97',)>, <Element 'div' class=('_19xnuo97',)>, <Element 'div' class=('_19xnuo97',)>, <Element 'div' class=('_19xnuo97',)>, <Element 'div' class=('_19xnuo97',)>]",['Anfitrión: José'],['Se registró en junio de 2016'],[],"['https://maps.google.com/maps?ll=-29.89843,-71.26979&z=14&t=m&hl=es&gl=CL&mapclient=apiv3']",
198,https://www.airbnb.cl/rooms/16703230?adults=1&children=0&infants=0&pets=0&check_in=2023-02-04&check_out=2023-02-09&previous_page_section_name=1000,"['La Serena, Coquimbo Region, Chile']",['1 cama'],['1 baño privado'],['2 huéspedes'],['1 habitación'],"['$25,000\xa0CLP\xa0']",['4.83 ·'],['29 reseñas'],"['Sector tranquilo y seguro , a 10 minutos de la playa y centro de la serena en auto. contamos con estacionamiento , locomoción cerca y supermercados. Ademas espacio para compartir con los anfritriones hay parrilla para  asado y area de fumadores...', 'Es solo habitactiones no la casa ... una villa tranquila y segura ... contamos con 1 habitacion con 1baños y area para fumadores y estacionamiento...']",['Habitacion  Ambiente Familiar y segura ...'],['Habitación privada en alojamiento - Anfitrión:\xa0Jacqueline'],"[<Element 'div' class=('_19xnuo97',)>, <Element 'div' class=('_19xnuo97',)>, <Element 'div' class=('_19xnuo97',)>, <Element 'div' class=('_19xnuo97',)>, <Element 'div' class=('_19xnuo97',)>, <Element 'div' class=('_19xnuo97',)>, <Element 'div' class=('_19xnuo97',)>]",['Anfitrión: Jacqueline'],['Se registró en enero de 2017'],['lugar tranquilo y gente muy amable ...ademas contamos con muchos ninimarket y plazas para caminar y hacer ajercicios...'],"['https://maps.google.com/maps?ll=-29.88451,-71.25354&z=14&t=m&hl=es&gl=CL&mapclient=apiv3']",
