,Link,Comuna,Camas,Baños,Capacidad,Habitaciones,Precio,Nota,Nnota,Descripción,Titulo1,Titulo2,Servicios,Anfitrion,Registro,Ubides,Ubicacion,Tipo
0,https://www.airbnb.cl/rooms/759398378928078753?adults=1&children=0&infants=0&pets=0&check_in=2023-02-24&check_out=2023-03-02&previous_page_section_name=1000,"['Coquimbo, Chile']",['1 cama'],['1 baño'],['2 huéspedes'],['1 habitación'],"['$43,333\xa0CLP\xa0']",['4.86 ·'],['7 reseñas'],"['Disfruta de la sencillez de este alojamiento tranquilo y céntrico. Para disfrutar con una pareja.A pasos del mall , supermercado líder y centro de Coquimbo. A solo minutos de  playas y casino de juegos. Avenida costanera con amplia variedad de restaurantes y pubs', 'Departamento tipo estudio ,un solo ambiente como se ve en la foto principal , ideal para una pareja, full equipado']",['Depto  estudio  con terraza y piscina'],['Alojamiento vacacional entero - Anfitrión:\xa0Marycarmen'],"[<Element 'div' class=('_19xnuo97',)>, <Element 'div' class=('_19xnuo97',)>, <Element 'div' class=('_19xnuo97',)>, <Element 'div' class=('_19xnuo97',)>, <Element 'div' class=('_19xnuo97',)>, <Element 'div' class=('_19xnuo97',)>]",['Anfitrión: Marycarmen'],['Se registró en noviembre de 2022'],[],"['https://maps.google.com/maps?ll=-29.96276,-71.33546&z=14&t=m&hl=es&gl=CL&mapclient=apiv3']",
1,https://www.airbnb.cl/rooms/41591068?adults=1&children=0&infants=0&pets=0&check_in=2023-02-19&check_out=2023-02-25&previous_page_section_name=1000,"['La Serena, Coquimbo, Chile']",['5 camas'],['1 baño'],['6 huéspedes'],['3 habitaciones'],"['$50,000\xa0CLP\xa0']",[],[],"['Condominio ubicado frente a Mall Puertas del mar, Supermercado Hiper Lider, Tienda jhonsson etc, a 5 minutos de la playa en vehículo, el departamento está equipado para 6 personas, con TV satelital y WiFi, estacionamiento privado, resguardado por circuito de cámaras instaladas en el condominio, el servicio de guardias trabaja las 24 hrs.', 'Sector céntrico y seguro de la Serena, ubicado en un condominio con seguridad las 24 horas, cuenta con cámaras de seguridad y estacionamiento gratuito.']",['DEPARTAMENTO 410 PUERTAS DEL MAR'],['Vivienda rentada entero - Anfitrión:\xa0Eduardo'],"[<Element 'div' class=('_19xnuo97',)>, <Element 'div' class=('_19xnuo97',)>, <Element 'div' class=('_19xnuo97',)>, <Element 'div' class=('_19xnuo97',)>, <Element 'div' class=('_19xnuo97',)>, <Element 'div' class=('_19xnuo97',)>, <Element 'div' class=('_19xnuo97',)>]",['Anfitrión: Eduardo'],['Se registró en diciembre de 2018'],"['sector tranquilo, a pasos de mall, playa, supermercado,  parque pedro de valdivia, parque japones entre otros']",[],
2,https://www.airbnb.cl/rooms/47452794?adults=1&children=0&infants=0&pets=0&check_in=2023-03-02&check_out=2023-03-07&previous_page_section_name=1000,"['Coquimbo, Chile']",['3 camas'],['2 baños'],['4 huéspedes'],['2 habitaciones'],"['$42,000\xa0CLP\xa0']",['4.69 ·'],['13 reseñas'],"['El edificio cuenta con piscina, sector de acondicionamiento físico y zona para asados con dos quinchos. El depto fue diseñado especialmente para una excelente experiencia. Incluye: escritorio como estación de trabajo, lavadora, 1 televisor smart, 1 televisor QLED 50” de última generación en living, parrilla eléctrica,muebles y camas de excelente calidad. Sábanas de 300 hilos, sandwichera,cafetera nespresso, juguera, hervidor, microondas, refrigerador, entre otros. No se acepta fumar al interior.', 'Todo el departamento y con pago extra a la comunidad áreas comunes como quincho']",['Departamento con vista al mar (Puerta Del Mar)'],['Condo entero - Anfitrión:\xa0Felipe'],"[<Element 'div' class=('_19xnuo97',)>, <Element 'div' class=('_19xnuo97',)>, <Element 'div' class=('_19xnuo97',)>, <Element 'div' class=('_19xnuo97',)>, <Element 'div' class=('_19xnuo97',)>, <Element 'div' class=('_19xnuo97',)>, <Element 'div' class=('_19xnuo97',)>]",['Anfitrión: Felipe'],['Se registró en abril de 2015'],[],"['https://maps.google.com/maps?ll=-29.89879,-71.2699&z=14&t=m&hl=es&gl=CL&mapclient=apiv3']",
3,https://www.airbnb.cl/rooms/647315445811511959?adults=1&children=0&infants=0&pets=0&check_in=2023-02-06&check_out=2023-02-12&previous_page_section_name=1000,"['Coquimbo, Chile']",['3 camas'],['1 baño'],['4 huéspedes'],['2 habitaciones'],"['$90,000\xa0CLP\xa0']",['5.0 ·'],['7 reseñas'],"['Relájate en esta escapada única y tranquila, a pasos de la playa, casino Enjoy y Pueblito Peñuelas. ', 'Disfruta de su terraza con espectacular vista al mar, en zona gastronómica y de entretención, con ciclovias y fácil acceso. ', 'Depto totalmente equipado, 2 dormitorios, 1 baño, ropa de cama, toallas,  SmatTV y', 'Wifi.', 'El edificio tiene piscina de temporada, quinchos, lavandería de pago en zonas comunes. Cuenta con  estacionamiento propio, acceso controlado y seguridad las 24 hrs.', 'El departamento cuenta con espacios acogedores de concepto abierto, orientados hacia lindas vistas, ideal para disfrutar de grandiosas panorámicas al mar, amaneceres y atardeceres, desde la tranquilidad de su estar, terraza y dormitorio principal.', 'Los materiales de construcción y terminaciones son de excelente calidad, por ejemplo todas sus ventanas son termopaneles lo cual asegura una temperatura interior confortable, además de permitir la iluminación y ventilación natural de los recintos.', 'Entre sus terminaciones destacan pisos de porcelanatos, muy higiénicos y facil de sanitizar. ', 'Cuenta con cocina americana tipo vitrocerámica  con campana, equipada  con todo lo necesario, para que puedas disfrutar tu estancia. ', 'Para compras y abastecimiento facil,  a la vuelta del depto,  por calle Peñuelas Norte, hay varios locales de comida preparada y minimarket,  donde podrás encontrar productos frescos tales como frutas, verduras, pan, alimentos varios, congelados, bebidas y  licores.', 'La hora del check out es a las 15:00 hrs. para que puedas con tranquilidad preparar tu regreso a tu hogar.']",['Sorprendentes vistas al mar desde un piso 23'],['Vivienda rentada entero - Anfitrión: María\xa0Carolina'],"[<Element 'div' class=('_19xnuo97',)>, <Element 'div' class=('_19xnuo97',)>, <Element 'div' class=('_19xnuo97',)>, <Element 'div' class=('_19xnuo97',)>, <Element 'div' class=('_19xnuo97',)>, <Element 'div' class=('_19xnuo97',)>, <Element 'div' class=('_19xnuo97',)>]",['Anfitrión: María Carolina'],['Se registró en junio de 2022'],"['Emplazado en el lindo balneario de Peñuelas, zona turística, gastronómica y cultural, ubicada a 9 kms. del aeropuerto Florida de la Serena. ', 'Sector con playas tranquilas y aptas para el baño, donde podrás hacer deportes náuticos, práctica de pesca, gimnasia entretenida  y disfrutar de tranquilas caminatas por el borde costero.', 'Ubicado en el corazón de Peñuelas, con ciclovía hacia el puerto de Coquimbo y Faro Monumental y con locomoción colectiva próxima al alojamiento. ', 'El edificio se encuentra emplazado detrás del casino Enjoy Coquimbo, a 5 minutos a pie del Pueblito Peñuelas y a 10 del mall Patio Outlet Peñuelas.', 'No olvides visitar la caleta de pescadores, donde podrás conseguir pescados y mariscos frescos, el tradicional sándwich de pescado, ceviches y empanadas, a precios muy convenientes.']","['https://maps.google.com/maps?ll=-29.94631,-71.28886&z=14&t=m&hl=es&gl=CL&mapclient=apiv3']",
4,https://www.airbnb.cl/rooms/15726610?adults=1&children=0&infants=0&pets=0&check_in=2024-01-05&check_out=2024-01-10&previous_page_section_name=1000,"['Coquimbo, Región de Coquimbo, Chile']",['3 camas'],['1 baño'],['2 huéspedes'],['1 habitación'],"['$24,371\xa0CLP\xa0']",['4.96 ·'],['24 reseñas'],"['Es una cabaña interior ubicada a 5 minutos caminando de  playa La Herradura, ideal para pareja sola o con niños ya que cuenta con un sillón cama,  baño privado con agua caliente, cocina americana,  completamente equipada con refrigerador, microondas. Tiene, wifi y tv streaming', 'Lugares de interés: la playa y increíbles vistas. ', 'El alojamiento es bueno para parejas y aventureros. Cuenta con estacionamiento compartido.', 'Ambiente familiar y cercanía a la playa.']",['CABAÑA/ CASA  EN COQUIMBO EN PLAYA LA HERRADURA.'],['Casa de huéspedes entero - Anfitrión:\xa0Michele'],"[<Element 'div' class=('_19xnuo97',)>, <Element 'div' class=('_19xnuo97',)>, <Element 'div' class=('_19xnuo97',)>, <Element 'div' class=('_19xnuo97',)>, <Element 'div' class=('_19xnuo97',)>, <Element 'div' class=('_19xnuo97',)>, <Element 'div' class=('_19xnuo97',)>]",['Anfitrión: Michele'],['Se registró en febrero de 2016'],"['Zona residencial, muy tranquila, con locales comerciales a una cuadra.']","['https://maps.google.com/maps?ll=-29.985,-71.3594&z=14&t=m&hl=es&gl=CL&mapclient=apiv3']",
5,https://www.airbnb.cl/rooms/771874614900510523?adults=1&children=0&infants=0&pets=0&check_in=2023-02-04&check_out=2023-02-09&previous_page_section_name=1000,"['Coquimbo, Chile']",['2 camas'],['1 baño compartido'],['3 huéspedes'],['1 habitación'],"['$14,000\xa0CLP\xa0']",['4.40 ·'],['5 reseñas'],"['Disfruta de unas merecidas vacaciones junto a tu acompañante en ""Alojamientos Hildita', 'Contamos con habitaciones  con entrada 100% independiente para mayor privacidad, en sector tranquilo y seguro. ', 'Cuenta con:', '-2 camas de una plaza c/u', '-Escritorio y closet', '-TV Con cable', '-Baño compartido con Calefont', '-área común con microondas/hervidor (sin cocina)', '-Wifi', 'No es centrico pero tiene Locomoción justo en frente para coquimbo y La Serena (7 minutos del centro en colectivo)', 'Solo contamos con un estaconamiento por lo que en caso de requerir debe consultar disponibilidad antes']",['Habitación privada 2 camas Coquimbo'],['Habitación privada en casa de huéspedes - Anfitrión:\xa0Natacha'],"[<Element 'div' class=('_19xnuo97',)>, <Element 'div' class=('_19xnuo97',)>, <Element 'div' class=('_19xnuo97',)>, <Element 'div' class=('_19xnuo97',)>, <Element 'div' class=('_19xnuo97',)>, <Element 'div' class=('_19xnuo97',)>, <Element 'div' class=('_19xnuo97',)>]",['Anfitrión: Natacha'],['Se registró en abril de 2019'],[],"['https://maps.google.com/maps?ll=-29.97161,-71.32039&z=14&t=m&hl=es&gl=CL&mapclient=apiv3']",
6,https://www.airbnb.cl/rooms/817414444582921645?adults=1&children=0&infants=0&pets=0&check_in=2023-02-19&check_out=2023-02-24&previous_page_section_name=1000,"['Coquimbo, Chile']",['3 camas'],['2 baños'],['4 huéspedes'],['2 habitaciones'],"['$70,000\xa0CLP\xa0']",[],[],"['Lugar tranquilo y cómodo para disfrutar en familia. Departamento ubicado a solo pasos de la playa y del Casino Enjoy Coquimbo en un sector tranquilo a una cuadra del Pueblito Peñuelas y del Mall Vivo. En un entorno tranquilo y a solo 5 minutos caminando de la playa,  de la Avenida del Mar y los mejores restaurantes y bares de la Avenida del Mar.', 'Cuenta con dos habitaciones y dos baños.', 'Una habitación con cama doble y la otra habitación con dos camas individuales.']",['Depto. frente a Casino Enjoy'],['Vivienda rentada entero - Anfitrión:\xa0Sergio'],"[<Element 'div' class=('_19xnuo97',)>, <Element 'div' class=('_19xnuo97',)>, <Element 'div' class=('_19xnuo97',)>, <Element 'div' class=('_19xnuo97',)>, <Element 'div' class=('_19xnuo97',)>, <Element 'div' class=('_19xnuo97',)>, <Element 'div' class=('_19xnuo97',)>]",['Anfitrión: Sergio'],['Se registró en enero de 2019'],[],"['https://maps.google.com/maps?ll=-29.94535,-71.28775&z=14&t=m&hl=es&gl=CL&mapclient=apiv3']",
7,https://www.airbnb.cl/rooms/48384226?adults=1&children=0&infants=0&pets=0&check_in=2023-02-28&check_out=2023-03-05&previous_page_section_name=1000,"['Coquimbo, Chile']",['5 camas'],['1 baño'],['4 huéspedes'],['3 habitaciones'],"['$35,000\xa0CLP\xa0']",['4.68 ·'],['53 reseñas'],"['Disfruta de tu estadia en La Serena, departamento ambientado en lo minimalista, con todas las comodidades que necesitas para venir a descansar o hacer negocios.', 'A solo 5 minutos del centro de La Serena y de la playa.', 'Condominio Espacio Urbano III ', 'A minutos de Supermercado y grandes tiendas.', 'Sábanas y Toallas incluidas.', 'Sin ascensor', 'Departamento con ambientación minimalista.']","['Comodidad, excelente ubicación y Tranquilidad']",['Vivienda rentada entero - Anfitrión:\xa0Alex'],"[<Element 'div' class=('_19xnuo97',)>, <Element 'div' class=('_19xnuo97',)>, <Element 'div' class=('_19xnuo97',)>, <Element 'div' class=('_19xnuo97',)>, <Element 'div' class=('_19xnuo97',)>, <Element 'div' class=('_19xnuo97',)>, <Element 'div' class=('_19xnuo97',)>]",['Anfitrión: Alex'],['Se registró en septiembre de 2018'],"['Es un Condominio familiar, cómodo y tranquilo. ', 'Servicio de Conserjeria y vigilancia las 24 horas, no hay ascensor']","['https://maps.google.com/maps?ll=-29.89823,-71.25993&z=14&t=m&hl=es&gl=CL&mapclient=apiv3']",
8,https://www.airbnb.cl/rooms/654554114275861971?adults=1&children=0&infants=0&pets=0&check_in=2023-02-28&check_out=2023-03-05&previous_page_section_name=1000,"['Coquimbo, Chile']",['5 camas'],['2 baños'],['6 huéspedes'],['3 habitaciones'],"['$47,600\xa0CLP\xa0']",['4.93 ·'],['15 reseñas'],"['Departamento Nuevo, frente al Mar, 3 Habitaciones, 2 baños, Piso 2, bonita vista a la playa, Coquimbo  y La Serena. ', 'Amplio, estacionamiento, gimnasio']","['Departamento Frente al Mar, 3 piezas, 2 baños.']",['Vivienda rentada entero - Anfitrión:\xa0Rodrigo'],"[<Element 'div' class=('_19xnuo97',)>, <Element 'div' class=('_19xnuo97',)>, <Element 'div' class=('_19xnuo97',)>, <Element 'div' class=('_19xnuo97',)>, <Element 'div' class=('_19xnuo97',)>, <Element 'div' class=('_19xnuo97',)>, <Element 'div' class=('_19xnuo97',)>]",['Anfitrión: Rodrigo'],['Se registró en diciembre de 2016'],[],"['https://maps.google.com/maps?ll=-29.95829,-71.3096&z=14&t=m&hl=es&gl=CL&mapclient=apiv3']",
9,https://www.airbnb.cl/rooms/35522055?adults=1&children=0&infants=0&pets=0&check_in=2023-03-03&check_out=2023-03-08&previous_page_section_name=1000,"['Coquimbo, Región de Coquimbo, Chile']",['1 cama'],['1 baño'],['2 huéspedes'],['1 habitación'],"['$39,800\xa0CLP\xa0']",['4.95 ·'],['111 reseñas'],"['Exclusivo departamento, moderno, cómodo y seguro. Ideal para una grata estancia de viajeros de paso o escapada. Se encuentra en el piso 15° con una vista panorámica inigualable, amplio balcón.', 'Estacionamiento al interior del recinto, Wifi, gimnasio, quincho, piscina. Lavandería (con tarjeta de prepago).', 'A pasos de Hospital San Pablo, UCN, Estadio Francisco Sánchez Rumoroso, Mezquita.', 'El departamento es hermoso, delicadamente decorado, grandes ventanales y amplio balcón que permiten una vista panorámica insuperable. ', 'Completamente equipado, todo nuevo.']","['Exclusivo, perfecto!! Hermosa vista.']",['Vivienda rentada entero - Anfitrión: Patricia\xa0Angelica'],"[<Element 'div' class=('_19xnuo97',)>, <Element 'div' class=('_19xnuo97',)>, <Element 'div' class=('_19xnuo97',)>, <Element 'div' class=('_19xnuo97',)>, <Element 'div' class=('_19xnuo97',)>, <Element 'div' class=('_19xnuo97',)>]",['Anfitrión: Patricia Angelica'],['Se registró en mayo de 2019'],[],"['https://maps.google.com/maps?ll=-29.96611,-71.33803&z=14&t=m&hl=es&gl=CL&mapclient=apiv3']",
10,https://www.airbnb.cl/rooms/17386052?adults=1&children=0&infants=0&pets=0&check_in=2023-03-06&check_out=2023-03-11&previous_page_section_name=1000,"['Coquimbo, Región de Coquimbo, Chile']",['3 camas'],['2 baños'],['4 huéspedes'],['2 habitaciones'],"['$55,000\xa0CLP\xa0']",['4.42 ·'],['56 reseñas'],"['Muy iluminado, excelente vista al puerto de Coquimbo y a lugares históricos como la  Cruz del Mileno y el  Centro Mohammed VI para el Diálogo de las Civilizaciones, mas conocido como la Mezquita y próxima inauguración de Museo del Mar. El departamento se encuentra a pasos de supermercado, centro comercial y mercado de Coquimbo, a orilla de la playa.', 'Excelente vista al puerto de Coquimbo desde un piso 21, a dos cuadras de Mall y Supermercado, frente a la costanera, piscina, juegos infantiles, estacionamiento, lavandería y quinchos, acceso controlado. Cuenta con TV satelital (2 televisores), no tiene WiFi.']",['Departamento vista al mar y Puerto de Coquimbo'],['Vivienda rentada entero - Anfitrión: Julio\xa0Alejandro'],"[<Element 'div' class=('_19xnuo97',)>, <Element 'div' class=('_19xnuo97',)>, <Element 'div' class=('_19xnuo97',)>, <Element 'div' class=('_19xnuo97',)>, <Element 'div' class=('_19xnuo97',)>, <Element 'div' class=('_19xnuo97',)>]",['Anfitrión: Julio Alejandro'],['Se registró en agosto de 2016'],"['Sector tranquilo, popular, alejado del centro, al lado de la playa y a pasos del puerto y centro histórico de Coquimbo, barrio Ingles, además muy cerca supermercados y Mall Vivo Coquimbo, con patios de comidas, múltiples tiendas y entretención.']","['https://maps.google.com/maps?ll=-29.9598,-71.3326&z=14&t=m&hl=es&gl=CL&mapclient=apiv3']",
11,https://www.airbnb.cl/rooms/30584591?adults=1&children=0&infants=0&pets=0&check_in=2023-02-28&check_out=2023-03-06&previous_page_section_name=1000,"['Coquimbo, Región de Coquimbo, Chile']",['3 camas'],['1 baño'],['4 huéspedes'],['1 habitación'],"['$29,325\xa0CLP\xa0']",['4.19 ·'],['17 reseñas'],"['Departamento habilitado para 4 personas, equipado con todo lo necesario para que  puedan disfrutar de una cómoda estadía. Rodeado de áreas verdes, a solo metros de la playa con excelentes restaurantes que se consiguen caminando, sin necesidad de transporte.  Lugares hermosos y cercanos a visitar, como el Valle del El qui,  observatorios,  Punta de Choro,  Isla Damas., y muchos mas.', 'La Serena con todo su esplendor, casino y el muy  reconocido mercado LA Recova a solo 35 minutos en transporte.', 'El departamento esta enclavado en un barrio residencial, a cuadras del club de yates.', 'No necesita de auto, ni pagar estacionamiento para ir a la playa o ir a un restaurantes, todo lo consigue caminando.']",['agradable y cómodo departamento cerca de todo'],['Condo entero - Anfitrión: Ana\xa0Maria'],"[<Element 'div' class=('_19xnuo97',)>, <Element 'div' class=('_19xnuo97',)>, <Element 'div' class=('_19xnuo97',)>, <Element 'div' class=('_19xnuo97',)>, <Element 'div' class=('_19xnuo97',)>, <Element 'div' class=('_19xnuo97',)>]",['Anfitrión: Ana Maria'],['Se registró en diciembre de 2018'],"['barrio tranquilo y precioso. No vendedores inoportunos, No exceso de trafico.']","['https://maps.google.com/maps?ll=-29.97826,-71.35022&z=14&t=m&hl=es&gl=CL&mapclient=apiv3']",
12,https://www.airbnb.cl/rooms/789869399053479583?adults=1&children=0&infants=0&pets=0&check_in=2023-02-06&check_out=2023-02-11&previous_page_section_name=1000,"['Coquimbo, Chile']",['1 cama'],['2 baños compartidos'],['2 huéspedes'],['1 habitación'],"['$13,000\xa0CLP\xa0']",[],[],"['Habitación individual, cama de 1 .5 plazas. Es una verdadera picada del hospedaje. Sencillo, sin nada de lujos, pero confortable y con lo necesario. Ideal para aventureros. A 20 minutos del centro de coquimbo, a 20 minutos del centro de Serena, a 15 minutos de Playa Peñuelas y Casino de Juegos. Para 1 persona idealmente, extra señalar 2 huéspedes en sistema y tiene valor adicional.', 'El espacto es un lugar sencillo, como cualquier lugar del Chile profundo, sin embargo es acogedor. Aunque sin lujos, tienes un lugar tranquilo, la habitacion es linda y tiene lo indispensable para que puedas descansar. Estamos Justo en medio de las comunas de La Serena y Coquimbo. Y hay transporte público para ambas ciudades.']",['Habitación sencilla N°4'],['Habitación privada en alojamiento - Anfitrión: Juan\xa0Luis'],"[<Element 'div' class=('_19xnuo97',)>, <Element 'div' class=('_19xnuo97',)>, <Element 'div' class=('_19xnuo97',)>, <Element 'div' class=('_19xnuo97',)>, <Element 'div' class=('_19xnuo97',)>, <Element 'div' class=('_19xnuo97',)>, <Element 'div' class=('_19xnuo97',)>]",['Anfitrión: Juan Luis'],['Se registró en diciembre de 2022'],"['La casa está ubicada a media cuadra de carabineros, y un consultorio con atención médica y urgencias. Con supermercado a algunas cuadras y negocios de barrio múltiples. Con transporte público hacia Coquimbo y La Serena.  Y un buffet low cost a 3 casas de distancia. El barrio no es un lugar turístico, pero tiene la enorme ventaja que desde aquí puedes movilizarte a los mejores lugares turísticos de la región  a solo 15 o 20 minutos.']","['https://maps.google.com/maps?ll=-29.9624,-71.2571&z=14&t=m&hl=es&gl=CL&mapclient=apiv3']",
13,https://www.airbnb.cl/rooms/28523842?adults=1&children=0&infants=0&pets=0&check_in=2023-02-21&check_out=2023-02-26&previous_page_section_name=1000,"['La Serena, Región de Coquimbo, Chile']",['3 camas'],['2 baños'],['4 huéspedes'],['2 habitaciones'],['\xa0'],['4.91 ·'],['165 reseñas'],"['Apartamento luminoso, a pasos de la  avenida del mar,  donde podrás disfrutar de una agradable playa, ideal para vacaciones en familia o en pareja, viajes de trabajo o de estudio. En los alrededores podrás  encontrar: minimarket, Panaderias y una diversa zona de restaurantes, ademas de los mejores Pubs de la ciudad, y así poder deleitarse la vida diurna y nocturna en la Serena.', 'Nuestro departamento se encuentra en el piso 7 del edificio, se accede por medio de ascensor, posee una linda vista al Cerro grande y una encantadora pero rápida vista al mar y a la ciudad de Coquimbo, ademas cuenta con cocina equipada, barra americana, sala de estar y buena conexión a Wifi de 300 MB, Smart TV en living y habitación principal con Netflix y TV cable.']","['Departamento a pasos de la playa, 2 a 4 personas']",['Vivienda rentada entero - Anfitrión: Hernán Y\xa0Paola'],"[<Element 'div' class=('_19xnuo97',)>, <Element 'div' class=('_19xnuo97',)>, <Element 'div' class=('_19xnuo97',)>, <Element 'div' class=('_19xnuo97',)>, <Element 'div' class=('_19xnuo97',)>, <Element 'div' class=('_19xnuo97',)>]",['Anfitrión: Hernán Y Paola'],['Se registró en septiembre de 2017'],"['El vecindario es muy tranquilo, seguro e iluminado. a una cuadra de la avenida del mar y por lo tanto de la playa, en sus alrededores encontraras, supermarket, panaderías, restaurantes y pubs.', 'El condominio esta a:', '2.8 km del Mall Plaza La Serena', '3.1 km del faro', '3.3 km de la Avenida Francisco Aguirre ', '7.0 km del Aeropuerto La Florida']","['https://maps.google.com/maps?ll=-29.93165,-71.27873&z=14&t=m&hl=es&gl=CL&mapclient=apiv3']",
14,https://www.airbnb.cl/rooms/565351020421358732?adults=1&children=0&infants=0&pets=0&check_in=2023-03-06&check_out=2023-03-11&previous_page_section_name=1000,"['Coquimbo, Chile']",['2 camas'],['1 baño'],['3 huéspedes'],['2 habitaciones'],"['$18,000\xa0CLP\xa0']",[],[],['Disfruta de la sencillez de este alojamiento tranquilo y céntrico. Ideal para recorrer las Playas de Coquimbo y La Serena y pagar lo justo.'],"['Mini dpto equipado , céntrico y con conectividad']",['Vivienda rentada entero - Anfitrión:\xa0Cristian'],"[<Element 'div' class=('_19xnuo97',)>, <Element 'div' class=('_19xnuo97',)>, <Element 'div' class=('_19xnuo97',)>, <Element 'div' class=('_19xnuo97',)>, <Element 'div' class=('_19xnuo97',)>, <Element 'div' class=('_19xnuo97',)>, <Element 'div' class=('_19xnuo97',)>]",['Anfitrión: Cristian'],['Se registró en agosto de 2017'],[],"['https://maps.google.com/maps?ll=-29.96808,-71.32033&z=14&t=m&hl=es&gl=CL&mapclient=apiv3']",
15,https://www.airbnb.cl/rooms/741186949587156016?adults=1&children=0&infants=0&pets=0&check_in=2023-02-10&check_out=2023-02-15&previous_page_section_name=1000,"['Coquimbo, Chile']",['1 cama'],['1 baño compartido'],['2 huéspedes'],['1 habitación'],"['$23,000\xa0CLP\xa0']",['4.86 ·'],['7 reseñas'],"['Habitación con cama matrimonial dentro de condominio con cierre perimetral. ', 'Lugar a 5 minutos de la playa en vehiculo, aprox. 20 o 25 minuto a pie.', 'Ideal para parejas que buscan un lugar seguro y acogedor.', '1 baño completo compartido,cocina compartida completa con refrigerador,hervidor,vajilla y utensilios basicos.', 'Sala de estar compartida con 2 sofas y Wi-Fi.', 'Estacionamiento interior techado.', 'Ofrecemos servicio de lavandería.', '2 huespedes como maximo incluyendo niños mayores de 2 años', 'Recibimos con mucho cariño a nuestros huéspedes y hacemos nuestro mayor esfuerzo para que se sientan cómodos y agradados. Nos preocupamos especialmente de la higiene y limpieza de la habitación entre un huésped y otro.', 'Durante la estadía nos mantenemos atentos para orientarlos en lo que respecta a lugares interesantes de visitar, medios de transporte, gastronomía o cualquier necesidad que se presente.', 'Nuestro objetivo es que tengan el mejor recuerdo de nuestro espacio.']",['Habitación 5 minutos de la playa'],['Habitación privada en casa de huéspedes - Anfitrión:\xa0Matias'],"[<Element 'div' class=('_19xnuo97',)>, <Element 'div' class=('_19xnuo97',)>, <Element 'div' class=('_19xnuo97',)>, <Element 'div' class=('_19xnuo97',)>, <Element 'div' class=('_19xnuo97',)>, <Element 'div' class=('_19xnuo97',)>, <Element 'div' class=('_19xnuo97',)>]",['Anfitrión: Matias'],['Se registró en diciembre de 2017'],"['La casa se encuentra en un condominio cerrado en el sector El Rosario de Peñuelas, un barrio muy tranquilo y seguro, con 2 supermercados a los que se puede llegar fácilmente a pie (un Lider y un Santa Isabel), 2 farmacias, 2 servicentros, strip center y Outlet. ', 'Transporte público a 1 cuadra con locomoción hacia La Serena, Coquimbo y sector playa. También se puede llegar a la playa caminando en no más de 20 minutos, o en vehículo en 5 minutos.', 'El sector es conocido por ser tranquilo, silencioso y tener un ambiente familiar, las calles no son muy transitadas por vehículos y es un lindo barrio residencial para salir a recorrer caminando. No es problemático llegar tarde puesto que aún de noche no es para nada un sector peligroso.']","['https://maps.google.com/maps?ll=-29.97021,-71.30341&z=14&t=m&hl=es&gl=CL&mapclient=apiv3']",
