,Link,Comuna,Camas,Baños,Capacidad,Habitaciones,Precio,Nota,Nnota,Descripción,Titulo1,Titulo2,Servicios,Anfitrion,Registro,Ubides,Ubicacion,Tipo
72,https://www.airbnb.cl/rooms/813125918177869025?adults=1&children=0&infants=0&pets=0&check_in=2023-02-10&check_out=2023-02-15&previous_page_section_name=1000,"['Coquimbo, Chile']",['3 camas'],['1 baño'],['6 huéspedes'],['3 habitaciones'],['\xa0'],[],[],"['Relájate con toda la familia en este alojamiento donde la tranquilidad se respira , a minutos de playa la herradura', 'ambiente cálido,  cercano a playa supermercado farmacia ,áreas verde , parrilla , estacionamiento ,cama nido y matrimoniales , se permite mascotas con papitos responsables']",['Casa para turistas 6 Personas Coquimbo'],['Alojamiento entero - Anfitrión:\xa0Felipe'],"[<Element 'div' class=('_19xnuo97',)>, <Element 'div' class=('_19xnuo97',)>, <Element 'div' class=('_19xnuo97',)>, <Element 'div' class=('_19xnuo97',)>, <Element 'div' class=('_19xnuo97',)>, <Element 'div' class=('_19xnuo97',)>, <Element 'div' class=('_19xnuo97',)>]",['Anfitrión: Felipe'],['Se registró en enero de 2023'],[],"['https://maps.google.com/maps?ll=-29.98703,-71.33805&z=14&t=m&hl=es&gl=CL&mapclient=apiv3']",
73,https://www.airbnb.cl/rooms/817977392683558721?adults=1&children=0&infants=0&pets=0&check_in=2023-02-05&check_out=2023-02-11&previous_page_section_name=1000,"['Coquimbo, Chile']",['3 camas'],['2 baños'],['5 huéspedes'],['2 habitaciones'],"['$95,700\xa0CLP\xa0']",[],[],"['Espectacular departamento de 2 dormitorios y 2 baños ubicado en el mejor sector de Coquimbo. Pensado para viajeros corporativos en grupo y aquellos que desean un escape en familia. Este departamento se encuentra completamente equipado para  garantizar una estadía tranquila y cómoda. ¡Simplemente lo Mejor PuertoHerradura!', 'Apartamento provisto de todo lo que un grupo de viajeros o familia pueda necesitar (incluye sabanas y toallas para su uso): ', '-Cocina completamente equipada con refrigerador, cocina encimera eléctrica. campana de extracción, microondas.', '-Cómodo sofá, una  habitación principal con cama 2 plazas, amplio closet, una habitación con 1 cama de una plaza y 1 camarote. Terraza con malla de seguridad. ', '-Cocina equipada con encimera vitrocerámica, campana, horno eléctrico. Muebles cocina con cubierta de granito.', '-Terraza con barandas de cristal. Cerámica en terraza y logia.', 'Su pequeña terraza te invitará a relajarte y a disfrutar del atardecer']",['Depto a Estrenar 2D2B  PuertoHerradura Parking Ser'],['Vivienda rentada entero - Anfitrión:\xa0HomChile'],"[<Element 'div' class=('_19xnuo97',)>, <Element 'div' class=('_19xnuo97',)>, <Element 'div' class=('_19xnuo97',)>, <Element 'div' class=('_19xnuo97',)>, <Element 'div' class=('_19xnuo97',)>, <Element 'div' class=('_19xnuo97',)>, <Element 'div' class=('_19xnuo97',)>]",['Anfitrión: HomChile'],['Se registró en agosto de 2019'],"['El condominio es privado, ideal para parejas y familias que deseen un escape de la rutina y descansar. Se encuentra en uno de los balnearios más importantes de la IV Región, a pasos de la playa La Herradura, que se caracteriza por sus aguas tranquilas ideal para bañarse y practicar deportes náuticos. ', 'El proyecto goza de una excelente conectividad con el centro de Coquimbo y La Serena. El condominio  está situado en uno de los sectores con mayor plusvalía y en uno de los balnearios más importantes con acceso directo a la playa y excelente conectividad por su cercanía a las principales vías de comunicación, además de tener cercanía con servicios como lo son supermercados, hospital, farmacias, bencinera, bares, restaurantes, transporte y turismo', ""Dirección: Ambrosio O'higgins 759, La Serena, Coquimbo, Chile""]","['https://maps.google.com/maps?ll=-29.97584,-71.34288&z=14&t=m&hl=es&gl=CL&mapclient=apiv3']",
74,https://www.airbnb.cl/rooms/619597178748624791?adults=1&children=0&infants=0&pets=0&check_in=2023-02-19&check_out=2023-02-26&previous_page_section_name=1000,"['La Serena, Coquimbo, Chile']",['2 camas'],['1 baño'],['3 huéspedes'],['2 habitaciones'],['\xa0'],['4.89 ·'],['18 reseñas'],"['Desde este alojamiento podrás disfrutar del fácil acceso a todo.  Un departamento amplio, completamente renovado y equipado, ubicado cerca de las principales calles de la ciudad, universidad e institutos, centros comerciales, Hospital, Plaza de Armas, servicios públicos y terminal de buses.', 'Es importante que sepas que este departamento, dada su ubicación, no cuenta con estacionamiento. ', 'Durante temporada alta (enero a febrero), no se ofrece servicio de toallas.', 'Una habitación con una cama de 2 plazas, y una habitación con cama de 1 1/2 plaza.']",['Hermoso departamento en pleno centro de La Serena'],['Condo entero - Anfitrión: María\xa0Isabel'],"[<Element 'div' class=('_19xnuo97',)>, <Element 'div' class=('_19xnuo97',)>, <Element 'div' class=('_19xnuo97',)>, <Element 'div' class=('_19xnuo97',)>, <Element 'div' class=('_19xnuo97',)>, <Element 'div' class=('_19xnuo97',)>, <Element 'div' class=('_19xnuo97',)>]",['Anfitrión: María Isabel'],['Se registró en enero de 2018'],[],"['https://maps.google.com/maps?ll=-29.90765,-71.25527&z=14&t=m&hl=es&gl=CL&mapclient=apiv3']",
75,https://www.airbnb.cl/rooms/53784246?adults=1&children=0&infants=0&pets=0&check_in=2023-04-10&check_out=2023-04-16&previous_page_section_name=1000,"['Coquimbo, Chile']",['2 camas'],['2 baños'],['4 huéspedes'],['2 habitaciones'],"['$36,499\xa0CLP\xa0']",['4.92 ·'],['24 reseñas'],"['Dpto ubicado en prímera línea de la playa de La Herradura, la cual cuenta con arenas blancas y finas en una extensión de 2 KM.', 'Condominio cuenta con piscinas (Libre uso), quinchos, gimnasio, sauna, jacuzzi (Se reservan), acceso directo a la playa.', 'Un lugar ideal para descansar y disfrutar del mar y  de una bella vista a la Bahia.']",['Hermoso dpto. en la bella playa de La Herradura.'],['Condo entero - Anfitrión:\xa0Ricardo'],"[<Element 'div' class=('_19xnuo97',)>, <Element 'div' class=('_19xnuo97',)>, <Element 'div' class=('_19xnuo97',)>, <Element 'div' class=('_19xnuo97',)>, <Element 'div' class=('_19xnuo97',)>, <Element 'div' class=('_19xnuo97',)>, <Element 'div' class=('_19xnuo97',)>]",['Anfitrión: Ricardo'],['Se registró en junio de 2017'],[],"['https://maps.google.com/maps?ll=-29.98148,-71.35313&z=14&t=m&hl=es&gl=CL&mapclient=apiv3']",
76,https://www.airbnb.cl/rooms/804240761392817178?adults=1&children=0&infants=0&pets=0&check_in=2023-02-27&check_out=2023-03-06&previous_page_section_name=1000,"['Coquimbo, Chile']",['2 camas'],['2 baños'],['4 huéspedes'],['2 habitaciones'],['\xa0'],[],[],['Este lugar tiene una ubicación estratégica: ¡será muy fácil planear tu visita!'],['Departamento frente al mar'],['Vivienda rentada entero - Anfitrión:\xa0Claudio'],"[<Element 'div' class=('_19xnuo97',)>, <Element 'div' class=('_19xnuo97',)>, <Element 'div' class=('_19xnuo97',)>, <Element 'div' class=('_19xnuo97',)>, <Element 'div' class=('_19xnuo97',)>, <Element 'div' class=('_19xnuo97',)>, <Element 'div' class=('_19xnuo97',)>]",['Anfitrión: Claudio'],['Se registró en enero de 2023'],[],"['https://maps.google.com/maps?ll=-29.9826,-71.3522&z=14&t=m&hl=es&gl=CL&mapclient=apiv3']",
77,https://www.airbnb.cl/rooms/52354278?adults=1&children=0&infants=0&pets=0&check_in=2023-03-01&check_out=2023-03-06&previous_page_section_name=1000,"['Coquimbo, Chile']",['2 camas'],['1 baño'],['3 huéspedes'],['1 habitación'],"['$35,000\xa0CLP\xa0']",['4.82 ·'],['78 reseñas'],"['Hermosa vista a La Herradura de Coquimbo. A pasos de la playa, supermercados y muchos servicios. Conectividad insuperable.  Higiene, seguridad y seriedad. Habitación matrimonial y futón para un tercer huésped. Totalmente equipado. Cuenta estacionamiento propio al interior del edificio en el sector techado para dos vehículos.', 'Ascensor a pasos del departamento.  Sin escalones, es ideal para personas con dificultad para desplazamiento']",['Departamento con hermosa vista a La Herradura#'],['Condo entero - Anfitrión:\xa0Marcela'],"[<Element 'div' class=('_19xnuo97',)>, <Element 'div' class=('_19xnuo97',)>, <Element 'div' class=('_19xnuo97',)>, <Element 'div' class=('_19xnuo97',)>, <Element 'div' class=('_19xnuo97',)>, <Element 'div' class=('_19xnuo97',)>, <Element 'div' class=('_19xnuo97',)>]",['Anfitrión: Marcela'],['Se registró en septiembre de 2021'],"['Barrio Residencial, cercano a diferentes servicios y locomoción colectiva, muy seguro']","['https://maps.google.com/maps?ll=-29.98,-71.348&z=14&t=m&hl=es&gl=CL&mapclient=apiv3']",
78,https://www.airbnb.cl/rooms/817614338403527568?adults=1&children=0&infants=0&pets=0&check_in=2023-02-19&check_out=2023-02-25&previous_page_section_name=1000,"['La Serena, Coquimbo, Chile']",['5 camas'],['2 baños'],['5 huéspedes'],['2 habitaciones'],"['$60,116\xa0CLP\xa0']",[],[],['Disfruta de la sencillez de este alojamiento tranquilo y céntrico. A passo de casino enjoy y de playa. Deja tu auto estcionado mientras puedes disfrutar de playa caminando'],['Depto piso 15  lugar tranquilo'],['Vivienda rentada entero - Anfitrión:\xa0Carlos'],"[<Element 'div' class=('_19xnuo97',)>, <Element 'div' class=('_19xnuo97',)>, <Element 'div' class=('_19xnuo97',)>, <Element 'div' class=('_19xnuo97',)>, <Element 'div' class=('_19xnuo97',)>, <Element 'div' class=('_19xnuo97',)>, <Element 'div' class=('_19xnuo97',)>]",['Anfitrión: Carlos'],['Se registró en septiembre de 2021'],[],"['https://maps.google.com/maps?ll=-29.9433,-71.28707&z=14&t=m&hl=es&gl=CL&mapclient=apiv3']",
79,https://www.airbnb.cl/rooms/15454382?adults=1&children=0&infants=0&pets=0&check_in=2023-03-07&check_out=2023-03-12&previous_page_section_name=1000,"['La Serena, Región de Coquimbo, Chile']",['1 cama'],['1 baño'],['2 huéspedes'],['1 habitación'],"['$38,691\xa0CLP\xa0']",['4.60 ·'],['116 reseñas'],"['Espectacular departamento para 2 personas, equipado con cama king  y living - cocina completamente equipada.  Se encuentra en primera línea frente al mar. Es recomendable para parejas.', 'Es un departamento ideal para los que buscan distraerse en la playa y pasear por la avenida del mar, gran conectividad con el centro de la ciudad, cercano a malls, supermercados, pub, etc.', 'El departamento posee WIFI, TV cable no está incluido.', 'Estacionamiento Privado Cubierto']",['Departamento Vista Espectacular!'],['Condo entero - Anfitrión:\xa0Pablo'],"[<Element 'div' class=('_19xnuo97',)>, <Element 'div' class=('_19xnuo97',)>, <Element 'div' class=('_19xnuo97',)>, <Element 'div' class=('_19xnuo97',)>, <Element 'div' class=('_19xnuo97',)>, <Element 'div' class=('_19xnuo97',)>, <Element 'div' class=('_19xnuo97',)>]",['Anfitrión: Pablo'],['Se registró en octubre de 2016'],[],"['https://maps.google.com/maps?ll=-29.9051,-71.2731&z=14&t=m&hl=es&gl=CL&mapclient=apiv3']",
80,https://www.airbnb.cl/rooms/46875361?adults=1&children=0&infants=0&pets=0&check_in=2023-02-19&check_out=2023-02-25&previous_page_section_name=1000,"['La Serena, Coquimbo, Chile']",['1 cama'],['1 baño privado'],['1 huésped'],['1 habitación'],"['$24,500\xa0CLP\xa0']",['4.81 ·'],['72 reseñas'],"['Sector cerca de la playa  alrededor ferias artesanales,bares ,restaurant acceso ruta 5 locomocion colectiva .', 'Cerca del mall de la Serena facil de llegar y centro historico.', 'Jardines, piscina']",['Te va encantar el clima y la tranquilidad'],['Habitación privada en vivienda rentada - Anfitrión: Ricardo\xa0Segundo'],"[<Element 'div' class=('_19xnuo97',)>, <Element 'div' class=('_19xnuo97',)>, <Element 'div' class=('_19xnuo97',)>, <Element 'div' class=('_19xnuo97',)>, <Element 'div' class=('_19xnuo97',)>]",['Anfitrión: Ricardo Segundo'],['Se registró en junio de 2019'],[],[],
81,https://www.airbnb.cl/rooms/815452415653180350?adults=1&children=0&infants=0&pets=0&check_in=2023-02-05&check_out=2023-02-11&previous_page_section_name=1000,"['Coquimbo, Chile']",['4 camas'],['2 baños'],['6 huéspedes'],['3 habitaciones'],['\xa0'],[],[],"['Tu familia estará cerca de todo cuando te quedes en este alojamiento céntrico. ', '3 habitación y 2 baños', 'Living-comedor', 'Cocina', 'Estacionamiento', 'habilitada para 6 personas ', 'Ubicados Sindempart Margarita -Copihues', '5 min de la playa la herradura caminando', 'Supermercado y locomoción a poco minutos']",['Alojamiento en Coquimbo'],['Alojamiento entero - Anfitrión:\xa0Vadeska'],"[<Element 'div' class=('_19xnuo97',)>, <Element 'div' class=('_19xnuo97',)>, <Element 'div' class=('_19xnuo97',)>, <Element 'div' class=('_19xnuo97',)>, <Element 'div' class=('_19xnuo97',)>, <Element 'div' class=('_19xnuo97',)>, <Element 'div' class=('_19xnuo97',)>]",['Anfitrión: Vadeska'],['Se registró en enero de 2023'],"['cerca de playa la herradura', 'supermercado santa Isabel', 'juegos mecánicos', 'restaurante']","['https://maps.google.com/maps?ll=-29.98212,-71.34325&z=14&t=m&hl=es&gl=CL&mapclient=apiv3']",
82,https://www.airbnb.cl/rooms/795900738010477548?adults=1&children=0&infants=0&pets=0&check_in=2023-02-12&check_out=2023-02-17&previous_page_section_name=1000,"['Coquimbo, Chile']",['4 camas'],['1 baño'],['5 huéspedes'],['2 habitaciones'],"['$53,000\xa0CLP\xa0']",[],[],"['Tu familia disfrutará en  un  alojamiento céntrico ,   cercano a Mall y centros comerciales, a cinco minutos de la playa,  buena conectividad y transporte público a la puerta. Es un lugar seguro con estacionamiento,  conserjería las 24 horas, cámaras de seguridad y acceso  controlado. Hermosa vista a la Bahía de Coquimbo y La Serena. Recién remodelado.']",['Vacaciones en un lugar cómodo y seguro.'],['Vivienda rentada entero - Anfitrión:\xa0Ana'],"[<Element 'div' class=('_19xnuo97',)>, <Element 'div' class=('_19xnuo97',)>, <Element 'div' class=('_19xnuo97',)>, <Element 'div' class=('_19xnuo97',)>, <Element 'div' class=('_19xnuo97',)>, <Element 'div' class=('_19xnuo97',)>, <Element 'div' class=('_19xnuo97',)>]",['Anfitrión: Ana'],['Se registró en junio de 2019'],"['Barrio central, en el que se encuentra ubicada la Universidad Católica del Norte , la Caleta de Guayacán en la que se encuentra un centro gastronómico y paseos en lancha hacia la Herradura.']","['https://maps.google.com/maps?ll=-29.96097,-71.34258&z=14&t=m&hl=es&gl=CL&mapclient=apiv3']",
83,https://www.airbnb.cl/rooms/810164906967096182?adults=1&children=0&infants=0&pets=0&check_in=2023-03-01&check_out=2023-03-06&previous_page_section_name=1000,"['Coquimbo, Chile']",['2 camas'],['1 baño'],['3 huéspedes'],['Estudio'],"['$35,000\xa0CLP\xa0']",[],[],"['Se arrienda por temporada de vacaciones,   hermosa Cabaña Loft (1 ambiente) con vista panorámica a la bahía de Coquimbo, para 2 y hasta 3 personas. Cocina americana equipada, comedor, shower baño en tina, calefon, habitación equipada, internet y a 5 minutos del centro y 20 mtos., de la playa ! estacionamiento. ', '  ""Coquimbo... Lugar de aguas tranquilas, para disfrutar en familia..."" TE ESPERAMOS!!!', 'cabaña de un ambiente , sin living, solo cocina comedor y habitacion']",['cabaña con vista a la bahía 2'],['Cabaña entero - Anfitrión:\xa0Francisca'],"[<Element 'div' class=('_19xnuo97',)>, <Element 'div' class=('_19xnuo97',)>, <Element 'div' class=('_19xnuo97',)>, <Element 'div' class=('_19xnuo97',)>, <Element 'div' class=('_19xnuo97',)>, <Element 'div' class=('_19xnuo97',)>]",['Anfitrión: Francisca'],['Se registró en noviembre de 2022'],[],"['https://maps.google.com/maps?ll=-29.9454,-71.339&z=14&t=m&hl=es&gl=CL&mapclient=apiv3']",
84,https://www.airbnb.cl/rooms/34334431?adults=1&children=0&infants=0&pets=0&check_in=2023-02-15&check_out=2023-02-20&previous_page_section_name=1000,"['La Serena, Coquimbo, Chile']",['2 camas'],['2 baños'],['3 huéspedes'],['2 habitaciones'],"['$40,200\xa0CLP\xa0']",[],[],"['Disfruta de la calidez de este acogedor alojamiento muy tranquilo y céntrico. Cuenta con amplias áreas verdes, piscina, juegos infantiles a pasos de supermercados y principales vías de acceso a atractivos turísticos de la región', 'Las habitaciones se encuentran equipadas completamente son confortables y con cortinas que permiten manejar el paso de la luz']",['Agradable departamento'],['Condo entero - Anfitrión:\xa0Andrea'],"[<Element 'div' class=('_19xnuo97',)>, <Element 'div' class=('_19xnuo97',)>, <Element 'div' class=('_19xnuo97',)>, <Element 'div' class=('_19xnuo97',)>, <Element 'div' class=('_19xnuo97',)>, <Element 'div' class=('_19xnuo97',)>, <Element 'div' class=('_19xnuo97',)>]",['Anfitrión: Andrea'],['Se registró en enero de 2017'],"['Muy tranquilo, en general es un condominio familiar']",[],
85,https://www.airbnb.cl/rooms/779842565951735639?adults=1&children=0&infants=0&pets=0&check_in=2023-03-06&check_out=2023-03-12&previous_page_section_name=1000,"['Coquimbo, Chile']",['3 camas'],['2 baños'],['6 huéspedes'],['3 habitaciones'],"['$75,000\xa0CLP\xa0']",['5.0 ·'],['8 reseñas'],"['Amplio y cómodo departamento en primera línea, habilitado para un grato descanso en familia, ubicado en segundo piso con acceso controlado, ascensores y estacionamiento subterráneo. Condominio cuenta con áreas comunes (Quincho, gimnasio, salón de eventos y una gran piscina con áreas verdes). Posee un acceso directo desde el condominio a playa La Herradura.']",['Amplio departamento La Herradura'],['Condo entero - Anfitrión:\xa0Eliana'],"[<Element 'div' class=('_19xnuo97',)>, <Element 'div' class=('_19xnuo97',)>, <Element 'div' class=('_19xnuo97',)>, <Element 'div' class=('_19xnuo97',)>, <Element 'div' class=('_19xnuo97',)>, <Element 'div' class=('_19xnuo97',)>]",['Anfitrión: Eliana'],['Se registró en agosto de 2017'],"['Lugar tranquilo cercano a comercio, mercados y diversos deportes acuáticos']","['https://maps.google.com/maps?ll=-29.9803,-71.35&z=14&t=m&hl=es&gl=CL&mapclient=apiv3']",
86,https://www.airbnb.cl/rooms/770402773942046023?adults=1&children=0&infants=0&pets=0&check_in=2023-02-21&check_out=2023-02-28&previous_page_section_name=1000,"['Coquimbo, Chile']",['5 camas'],['2 baños'],['6 huéspedes'],['3 habitaciones'],"['$110,000\xa0CLP\xa0']",[],[],"['Disfruta en este maravilloso departamento amplio y full equipado. Ideal para familias que gustan relajarse y compartir.', 'Con una vista directa al mar y unos atardeceres con increíble colores', 'Céntrico y a pasos del casino enjoy Coquimbo.', 'Full equipado para 5 o 6 personas. Tiene un dormitorio principal con baño en suite y balcón que conecta también al Living. Demás habitaciones cuentan con dos camas, amplios closet y vista. Cuenta con un estacionamiento.']",['Depto con hermosa vista al mar'],['Vivienda rentada entero - Anfitrión:\xa0Margarita'],"[<Element 'div' class=('_19xnuo97',)>, <Element 'div' class=('_19xnuo97',)>, <Element 'div' class=('_19xnuo97',)>, <Element 'div' class=('_19xnuo97',)>, <Element 'div' class=('_19xnuo97',)>, <Element 'div' class=('_19xnuo97',)>, <Element 'div' class=('_19xnuo97',)>]",['Anfitrión: Margarita'],['Se registró en noviembre de 2021'],"['Cuenta con salida a la costanera donde se encuentran diversos restaurantes, a menos de 15 min del Casino Enjoy Coquimbo, se encuentra el Mallplaza La Serena y supermercado']","['https://maps.google.com/maps?ll=-29.96001,-71.31053&z=14&t=m&hl=es&gl=CL&mapclient=apiv3']",
87,https://www.airbnb.cl/rooms/46992150?adults=1&children=0&infants=0&pets=0&check_in=2023-02-28&check_out=2023-03-07&previous_page_section_name=1000,"['Coquimbo, Chile']",['5 camas'],['2 baños'],['6 huéspedes'],['2 habitaciones'],['\xa0'],['4.85 ·'],['33 reseñas'],"['Edificio nuevo frente a la playa, cercano a casino de juegos y restaurantes.', 'Departamento de 2 dormitorios, 2 baños...excelente ubicación y acceso (sin tacos), a pocas cuadras de casino de juegos y principales restaurantes de la zona.', 'Balcón amplio con hermosa vista a toda la bahía y horizonte.']",['Maravilloso departamento frente a la playa.'],['Vivienda rentada entero - Anfitrión:\xa0Cristian'],"[<Element 'div' class=('_19xnuo97',)>, <Element 'div' class=('_19xnuo97',)>, <Element 'div' class=('_19xnuo97',)>, <Element 'div' class=('_19xnuo97',)>, <Element 'div' class=('_19xnuo97',)>, <Element 'div' class=('_19xnuo97',)>, <Element 'div' class=('_19xnuo97',)>]",['Anfitrión: Cristian'],['Se registró en diciembre de 2015'],"['Costanera, playas, amplías veredas para', 'Caminar y trotar. Cíclovia de más de 10 km entre La Serena y Coquimbo.']","['https://maps.google.com/maps?ll=-29.95685,-71.30993&z=14&t=m&hl=es&gl=CL&mapclient=apiv3']",
88,https://www.airbnb.cl/rooms/803088516400118620?adults=1&children=0&infants=0&pets=0&check_in=2023-02-03&check_out=2023-02-08&previous_page_section_name=1000,"['La Serena, Coquimbo, Chile']",['2 camas'],['1 baño compartido'],['1 huésped'],['2 habitaciones'],"['$25,000\xa0CLP\xa0']",['5.0 ·'],['3 reseñas'],"['Si buscas una habitación cercana a la playa, cómoda y amigable.', 'Esta es una gran opción.', '- 1 Habitación ', '- 1 o 2 camas de una plaza ', '- acceso a cocina, living y comedor', '- baño compartido ', '- lugar seguro y tranquilo ', '- a pasos de la playa y centros comerciales', '- anfitrión viajero, respetuoso con los huéspedes y el ambiente']",['Habitación una o dos camas'],['Habitación privada en cabaña - Anfitrión:\xa0Juan'],"[<Element 'div' class=('_19xnuo97',)>, <Element 'div' class=('_19xnuo97',)>, <Element 'div' class=('_19xnuo97',)>, <Element 'div' class=('_19xnuo97',)>, <Element 'div' class=('_19xnuo97',)>, <Element 'div' class=('_19xnuo97',)>, <Element 'div' class=('_19xnuo97',)>]",['Anfitrión: Juan'],['Se registró en octubre de 2020'],"['Es un terreno con varias personas, las cuales tienen un buen vivir y no molestan.']","['https://maps.google.com/maps?ll=-29.91929,-71.26842&z=14&t=m&hl=es&gl=CL&mapclient=apiv3']",
89,https://www.airbnb.cl/rooms/35316460?adults=1&children=0&infants=0&pets=0&check_in=2023-02-06&check_out=2023-02-12&previous_page_section_name=1000,"['Coquimbo, Región de Coquimbo, Chile']",['2 camas'],"['2,5 baños compartidos']",['2 huéspedes'],['1 habitación'],['\xa0'],['4.94 ·'],['52 reseñas'],"['Alojamiento en Sector Residencial,  con 2 baños, uno para mujeres y otro para varones. Lejos del ruido, muy seguro y tranquilo, ideal para descansar. Cuenta con supermercado Jumbo a menos de 1km, Además, de poseer conectividad directa con el centro de la ciudad, a sólo 10 mins en vehículo del terminal de buses o aeropuerto. ', ""A comfortable hostel with 2 bathrooms, one of them for men and  another for women in a residential area, quite secure, ideal for resting. It's got a supermarket at only 1 k"", 'Espacio cómodo, cuenta con tres habitaciones para arrendar. Eso si, hay 2 baños, uno para hombres y otro para mujeres.  Posee Internet veloz y pueden utilizar cualquier espacio de la casa.', ""It's a comfortable place, for one person or two in a private room, 2 bathrooms, for men and another exclusive for women it’s quite near of the center by car. You may also use every electronic devices or area of it. It's got a speedy WiFi and a supermarket at 1km from home.""]",['Pieza 1 o 2 personas con 2 baños'],['Habitación privada en alojamiento - Anfitrión:\xa0Diego'],"[<Element 'div' class=('_19xnuo97',)>, <Element 'div' class=('_19xnuo97',)>, <Element 'div' class=('_19xnuo97',)>, <Element 'div' class=('_19xnuo97',)>, <Element 'div' class=('_19xnuo97',)>, <Element 'div' class=('_19xnuo97',)>, <Element 'div' class=('_19xnuo97',)>]",['Anfitrión: Diego'],['Se registró en abril de 2016'],"['Tranquilidad y conectividad. ', 'Its quietness and connectivity.']","['https://maps.google.com/maps?ll=-29.9213,-71.22895&z=14&t=m&hl=es&gl=CL&mapclient=apiv3']",
90,https://www.airbnb.cl/rooms/792972868262013691?adults=1&children=0&infants=0&pets=0&check_in=2023-02-12&check_out=2023-02-17&previous_page_section_name=1000,"['La Serena, Coquimbo, Chile']",['3 camas'],['1 baño'],['5 huéspedes'],['2 habitaciones'],"['$36,000\xa0CLP\xa0']",[],[],"['Casa cercana a Playa, supermercados, en barrio tranquilo , entrada auto ,patio amplio , ideal para familia. Se aceptan mascotas.']","['Casa acogedora, 2 dormitorios equipada.']",['Alojamiento entero - Anfitrión:\xa0David'],"[<Element 'div' class=('_19xnuo97',)>, <Element 'div' class=('_19xnuo97',)>, <Element 'div' class=('_19xnuo97',)>, <Element 'div' class=('_19xnuo97',)>, <Element 'div' class=('_19xnuo97',)>, <Element 'div' class=('_19xnuo97',)>, <Element 'div' class=('_19xnuo97',)>]",['Anfitrión: David'],['Se registró en diciembre de 2022'],"['Barrio tranquilo , con áreas verdes, cercano a centros comerciales, a 5 minutos de playas y del Casino de Juegos de Coquimbo, de fácil acceso.']","['https://maps.google.com/maps?ll=-29.9513,-71.2692&z=14&t=m&hl=es&gl=CL&mapclient=apiv3']",
91,https://www.airbnb.cl/rooms/795216992957788896?adults=1&children=0&infants=0&pets=0&check_in=2023-02-19&check_out=2023-02-24&previous_page_section_name=1000,"['La Serena, Coquimbo, Chile']",['3 camas'],['1 baño'],['4 huéspedes'],['2 habitaciones'],"['$55,000\xa0CLP\xa0']",[],[],"['Se arrienda departamento para 4 personas en La Serena, ubicación a pasos de líder y mall puerta del mar y a 6 cuadras de la playa, tiene sala de lavado y quincho con vista al mar']",['Departamento 4 personas'],['Vivienda rentada entero - Anfitrión:\xa0José'],"[<Element 'div' class=('_19xnuo97',)>, <Element 'div' class=('_19xnuo97',)>, <Element 'div' class=('_19xnuo97',)>, <Element 'div' class=('_19xnuo97',)>, <Element 'div' class=('_19xnuo97',)>]",['Anfitrión: José'],['Se registró en febrero de 2021'],[],"['https://maps.google.com/maps?ll=-29.89948,-71.25947&z=14&t=m&hl=es&gl=CL&mapclient=apiv3']",
