,Link,Comuna,Camas,Baños,Capacidad,Habitaciones,Precio,Nota,Nnota,Descripción,Titulo1,Titulo2,Servicios,Anfitrion,Registro,Ubides,Ubicacion,Tipo
110,https://www.airbnb.cl/rooms/14127583?adults=1&children=0&infants=0&pets=0&check_in=2023-02-04&check_out=2023-02-09&previous_page_section_name=1000,"['Coquimbo, Región de Coquimbo, Chile']",['4 camas'],['1 baño'],['5 huéspedes'],['2 habitaciones'],"['$70,000\xa0CLP\xa0']",['4.71 ·'],['21 reseñas'],"['Arriendo mi casa en Sindempart, la ubicación es estratégica, a pocas cuadras de la playa La Herradura y a 10 minutos del centro de Coquimbo.', 'La casa está totalmente equipada, cuenta con 2 dormitorios ( uno con cama matrimonial y el otro con un camarote y una cama de plaza y media ) Living, comedor, cocina completamente equipada, un baño, patio con linda parrilla. Tiene lavadora automatica.', 'Estacionamiento para un vehiculo.', 'Por protocolo COVID por favor traer tus propias sábanas y almohadas', 'Linda casa equipada con todo lo que usted necesita para tener una estadía muy agradable en Coquimbo, una confortable cama doble, una cocina totalmente equipada, Internet -WIFI, TV -Smart (Con acceso a internet), sofá,  baño con tina, lavadora, etc.', 'El TV está conectado a internet. Así, usted tendrá acceso a APPS instaladas donde podrá ver películas, series documentales, noticias, etc., en diferentes lenguas. Igualmente podrá navegar en internet o simplemente consultar su correo.']",['Arriendo mi casa en Sindempart para turistas'],['Alojamiento entero - Anfitrión:\xa0Eliana'],"[<Element 'div' class=('_19xnuo97',)>, <Element 'div' class=('_19xnuo97',)>, <Element 'div' class=('_19xnuo97',)>, <Element 'div' class=('_19xnuo97',)>, <Element 'div' class=('_19xnuo97',)>, <Element 'div' class=('_19xnuo97',)>, <Element 'div' class=('_19xnuo97',)>]",['Anfitrión: Eliana'],['Se registró en julio de 2016'],"['Sindempart es un barrio seguro, se encuentra cerca de  distintos comercios, amasanderia,almacenes, supermercados, etc.']","['https://maps.google.com/maps?ll=-29.9827,-71.3421&z=14&t=m&hl=es&gl=CL&mapclient=apiv3']",
111,https://www.airbnb.cl/rooms/727560596945664275?adults=1&children=0&infants=0&pets=0&check_in=2023-02-22&check_out=2023-02-27&previous_page_section_name=1000,"['La Serena, Coquimbo, Chile']",['1 cama'],['1 baño'],['2 huéspedes'],['1 habitación'],"['$42,000\xa0CLP\xa0']",[],[],"['Disfruta de la sencillez de este alojamiento tranquilo y céntrico.', 'Se arrienda Departamento en la Serena.', 'Ubicado en Federico Arcos 397 Condominio Alto la Serena IV.', 'Torre B, piso 9', ' 15 minutos de playa el Faro', ' 15 minutos del centro de la ciudad', ' A una cuadra de Supermercado Lider Mall puertas del Mar', ' Habitacion en suite', ' Wifi, TV ', ' Piscina', ' Cocina equipada', ' Quincho', ' Terraza ', ' Estacionamiento propio', 'Valor 42.000 por noche', 'Capacidad para 2 personas', 'Minimo 3 noches', 'Entrada y salida 13:00 Horas.']",['Se Arrienda departamento en la Serena'],['Condo entero - Anfitrión:\xa0Evelyn'],"[<Element 'div' class=('_19xnuo97',)>, <Element 'div' class=('_19xnuo97',)>, <Element 'div' class=('_19xnuo97',)>, <Element 'div' class=('_19xnuo97',)>, <Element 'div' class=('_19xnuo97',)>, <Element 'div' class=('_19xnuo97',)>]",['Anfitrión: Evelyn'],['Se registró en septiembre de 2022'],['Lugar tranquilo y centrico'],"['https://maps.google.com/maps?ll=-29.89804,-71.26006&z=14&t=m&hl=es&gl=CL&mapclient=apiv3']",
112,https://www.airbnb.cl/rooms/15842089?adults=1&children=0&infants=0&pets=0&check_in=2023-03-02&check_out=2023-03-09&previous_page_section_name=1000,"['Coquimbo, Región de Coquimbo, Chile']",['5 camas'],['2 baños'],['6 huéspedes'],['2 habitaciones'],"['$49,500\xa0CLP\xa0']",['4.89 ·'],['9 reseñas'],"['OPORTUNIDAD UNICA REBAJADO - Departamento nuevo de lujo ubicado en sector Casino Enjoy, en la mejor ubicación de la avenida del mar a 30 mts de la playa. Completamente amoblado y equipado, cocina horno eléctrico, microondas, refrigerador, lavadora de ropa, tv cable , wi-fi y malla de seguridad en terraza.  Gran piscina para niños y adultos. Lavandería, amplio y cómodo, dormitorios con vista, increíble terraza y vista privilegiada al mar. Ideal para parejas o familias con hijos.', 'Departamentos nuevos de lujo ""Costa elqui""costado del casino, frente al mar.']","['Depto. Lujo La Serena , Costa Elqui-Casino Enjoy']",['Vivienda rentada entero - Anfitrión:\xa0Nicolas'],"[<Element 'div' class=('_19xnuo97',)>, <Element 'div' class=('_19xnuo97',)>, <Element 'div' class=('_19xnuo97',)>, <Element 'div' class=('_19xnuo97',)>, <Element 'div' class=('_19xnuo97',)>, <Element 'div' class=('_19xnuo97',)>, <Element 'div' class=('_19xnuo97',)>]",['Anfitrión: Nicolas'],['Se registró en noviembre de 2016'],"['La mejor ubicación de la venida del mar al lado del casino, playa en frente, restaurantes.']","['https://maps.google.com/maps?ll=-29.9479,-71.2909&z=14&t=m&hl=es&gl=CL&mapclient=apiv3']",
113,https://www.airbnb.cl/rooms/816814990752851027?adults=1&children=0&infants=0&pets=0&check_in=2023-02-22&check_out=2023-02-28&previous_page_section_name=1000,"['La Serena, Coquimbo, Chile']",['3 camas'],['1 baño'],['4 huéspedes'],['3 habitaciones'],"['$35,329\xa0CLP\xa0']",[],[],"['Se arrienda departamento en La Serena, sector puertas del mar, cercano a universidades, supermercado, terminal, mall, centro de serena, avenida del mar y el faro.', 'El depto. esta en el cuarto piso y cuenta con 3 piezas y un baño. Esta equipado para vivir comodamente las mejores vacaciones, cocina y baño full equipados. El condominio cuenta con quincho y piscina. ', 'Se arrienda por dia, semanas o el mes entero, se hace precio por cantidad de dias arrendados. Valor por dia: 35 mil; 90 mil 3 dias.']",['Departamento La Serena'],['Vivienda rentada entero - Anfitrión:\xa0Gonzalo'],"[<Element 'div' class=('_19xnuo97',)>, <Element 'div' class=('_19xnuo97',)>, <Element 'div' class=('_19xnuo97',)>, <Element 'div' class=('_19xnuo97',)>, <Element 'div' class=('_19xnuo97',)>, <Element 'div' class=('_19xnuo97',)>, <Element 'div' class=('_19xnuo97',)>]",['Anfitrión: Gonzalo'],['Se registró en enero de 2023'],[],"['https://maps.google.com/maps?ll=-29.9044,-71.2617&z=14&t=m&hl=es&gl=CL&mapclient=apiv3']",
114,https://www.airbnb.cl/rooms/53784246?adults=1&children=0&infants=0&pets=0&check_in=2023-04-10&check_out=2023-04-15&previous_page_section_name=1000,"['Coquimbo, Chile']",['2 camas'],['2 baños'],['4 huéspedes'],['2 habitaciones'],"['$36,449\xa0CLP\xa0']",['4.92 ·'],['24 reseñas'],"['Dpto ubicado en prímera línea de la playa de La Herradura, la cual cuenta con arenas blancas y finas en una extensión de 2 KM.', 'Condominio cuenta con piscinas (Libre uso), quinchos, gimnasio, sauna, jacuzzi (Se reservan), acceso directo a la playa.', 'Un lugar ideal para descansar y disfrutar del mar y  de una bella vista a la Bahia.']",['Hermoso dpto. en la bella playa de La Herradura.'],['Condo entero - Anfitrión:\xa0Ricardo'],"[<Element 'div' class=('_19xnuo97',)>, <Element 'div' class=('_19xnuo97',)>, <Element 'div' class=('_19xnuo97',)>, <Element 'div' class=('_19xnuo97',)>, <Element 'div' class=('_19xnuo97',)>, <Element 'div' class=('_19xnuo97',)>, <Element 'div' class=('_19xnuo97',)>]",['Anfitrión: Ricardo'],['Se registró en junio de 2017'],[],"['https://maps.google.com/maps?ll=-29.98148,-71.35313&z=14&t=m&hl=es&gl=CL&mapclient=apiv3']",
115,https://www.airbnb.cl/rooms/786427647744315235?adults=1&children=0&infants=0&pets=0&check_in=2023-02-25&check_out=2023-03-03&previous_page_section_name=1000,"['Coquimbo, Chile']",['4 camas'],['2 baños'],['5 huéspedes'],['2 habitaciones'],"['$65,000\xa0CLP\xa0']",[],[],"['Edificio Marina Horizonte III, ubicado en segunda linea de mar, a pasos del  Casino Enjoy, la playa, Restaurantes y pubs, con un entorno seguro y tranquilo y acceso controlado al edificio. ', 'Departamento de 2 dormitorios y 2  baños,  en piso 2, tiene Wifi, Smart tv. El edificio cuenta con piscina, juegos infantiles, quincho, lavandería y un bello jardín. Estacionamiento gratuito.']","['Depto a pasos de la playa, Enjoy']",['Vivienda rentada entero - Anfitrión:\xa0Alejandra'],"[<Element 'div' class=('_19xnuo97',)>, <Element 'div' class=('_19xnuo97',)>, <Element 'div' class=('_19xnuo97',)>, <Element 'div' class=('_19xnuo97',)>, <Element 'div' class=('_19xnuo97',)>, <Element 'div' class=('_19xnuo97',)>, <Element 'div' class=('_19xnuo97',)>]",['Anfitrión: Alejandra'],['Se registró en julio de 2021'],"['Sector tranquilo y seguro, acceso controlado al edificio']","['https://maps.google.com/maps?ll=-29.9457,-71.2885&z=14&t=m&hl=es&gl=CL&mapclient=apiv3']",
116,https://www.airbnb.cl/rooms/626901133416659497?adults=1&children=0&infants=0&pets=0&check_in=2023-03-05&check_out=2023-03-10&previous_page_section_name=1000,"['Coquimbo, Chile']",['2 camas'],['1 baño'],['3 huéspedes'],['1 habitación'],"['$35,000\xa0CLP\xa0']",['4.98 ·'],['43 reseñas'],"['Departamento céntrico a metros del Hospital San Pablo de Coquimbo y cercado de lugares de interés turístico como la Cruz del tercer milenio, estadio mundialista Fco Sánchez Rumoroso, Mesquita, playas, Barrio inglés y puerto de Coquimbo.', 'Locomoción para La Serena a metros del edificio.', 'Cuenta con una cama matrimonial y un sillón cama de plaza y media.']","['Departamento acogedor, ideal para parejas 405']",['Condo entero - Anfitrión:\xa0Felipe'],"[<Element 'div' class=('_19xnuo97',)>, <Element 'div' class=('_19xnuo97',)>, <Element 'div' class=('_19xnuo97',)>, <Element 'div' class=('_19xnuo97',)>, <Element 'div' class=('_19xnuo97',)>, <Element 'div' class=('_19xnuo97',)>, <Element 'div' class=('_19xnuo97',)>]",['Anfitrión: Felipe'],['Se registró en diciembre de 2017'],[],"['https://maps.google.com/maps?ll=-29.9663,-71.3385&z=14&t=m&hl=es&gl=CL&mapclient=apiv3']",
117,https://www.airbnb.cl/rooms/45690885?adults=1&children=0&infants=0&pets=0&check_in=2023-02-26&check_out=2023-03-03&previous_page_section_name=1000,"['La Serena, Coquimbo, Chile']",['2 camas'],['2 baños'],['4 huéspedes'],['2 habitaciones'],"['$58,000\xa0CLP\xa0']",['4.99 ·'],['71 reseñas'],"['Departamento completamente equipado, a sólo 1 cuadra la avenida del mar. Inmejorable ubicación, cerca de la playa pero a la vez muy tranquilo. Dos piezas equipadas con camas dobles (una de 2 plazas en pieza principal, y una tamaño full en segunda pieza). ', 'Cuenta con televisión, microondas, plancha, secador de pelo, calefactor, lavadora y parrilla eléctrica. ', 'Equipado para un máximo de 4 personas.', 'Ubicado en un 4tp piso, en edificio de 10 pisos con ascensor. Vista al norte', 'Hermoso departamento, con todo lo necesario para una cómoda estadía (parrilla eléctrica, plancha, secador de pelo, microondas, wifi, netflix, zapping tv).', 'A sólo una cuadra de la playa, cercano a restaurantes, bares, cafés. Muy tranquilo en las noches para un buen descanso.']",['Depto de 2piezas matrimoniales muy cercano a playa'],['Vivienda rentada entero - Anfitrión:\xa0Alicia'],"[<Element 'div' class=('_19xnuo97',)>, <Element 'div' class=('_19xnuo97',)>, <Element 'div' class=('_19xnuo97',)>, <Element 'div' class=('_19xnuo97',)>, <Element 'div' class=('_19xnuo97',)>]",['Anfitrión: Alicia'],['Se registró en abril de 2013'],[],"['https://maps.google.com/maps?ll=-29.92123,-71.27503&z=14&t=m&hl=es&gl=CL&mapclient=apiv3']",
118,https://www.airbnb.cl/rooms/6845843?adults=1&children=0&infants=0&pets=0&check_in=2023-02-20&check_out=2023-02-27&previous_page_section_name=1000,"['Coquimbo, Región de Coquimbo, Chile']",['3 camas'],['1 baño'],['4 huéspedes'],['2 habitaciones'],"['$39,000\xa0CLP\xa0']",['5.0 ·'],['22 reseñas'],"['A diferencia de los alojamientos que se encuentran en primera línea, aquí tienes todo a mano, supermercado, farmacia, redbanc, transporte público, almacenes de barrio, etc. La propiedad cuenta con wifi, tv cable, estacionamiento interior con portón electrónico entre otras cosas, y está ubicada en un tranquilo barrio residencial dentro de la zona de seguridad marítima. ', 'Tu casa en la IV Región...simplemente perfecta!', 'La casa está completamente habilitada para un máximo de 4 personas, con dos habitaciones, tres camas, un baño, cocina totalmente equipada, sala de lavado y planchado, wifi, tv cable, entrada de auto con control remoto, calefont automático, horno/microondas, parrilla para asados, citófonos interno, externo, jardín y patio interior. Usted se encontrará con una casa linda, limpia e iluminada por el sol. Excelentemente ubicada en el centro de un tranquilo barrio residencial a solo 3 minutos de la Playa en auto y a 10 minutos del puerto y centro de la ciudad de Coquimbo.']","['Excelente Ubicación, WIFI, TV Cable']",['Alojamiento entero - Anfitrión:\xa0Martina'],"[<Element 'div' class=('_19xnuo97',)>, <Element 'div' class=('_19xnuo97',)>, <Element 'div' class=('_19xnuo97',)>, <Element 'div' class=('_19xnuo97',)>, <Element 'div' class=('_19xnuo97',)>, <Element 'div' class=('_19xnuo97',)>, <Element 'div' class=('_19xnuo97',)>]",['Anfitrión: Martina'],['Se registró en marzo de 2015'],"['Tienes cerca todo lo que necesitas, incluso puedes ir caminando a comprar pan amasado o al supermercado, farmacia, redbanc, pizzería, etc., por que la casa se encuentra en el centro de un barrio residencial, el cual, además es muy tranquilo y seguro. La playa más cercana llamada La Herradura, se encuentra a tres minutos en auto y a unos pocos minutos más si vas caminando.']","['https://maps.google.com/maps?ll=-29.99016,-71.34062&z=14&t=m&hl=es&gl=CL&mapclient=apiv3']",
119,https://www.airbnb.cl/rooms/686536538687934970?adults=1&children=0&infants=0&pets=0&check_in=2023-02-05&check_out=2023-02-12&previous_page_section_name=1000,"['La Serena, Coquimbo, Chile']",['1 cama'],['1 baño'],['3 huéspedes'],['1 habitación'],['\xa0'],[],[],"['los apartamentos se encuentran a pocas cuadras de playa, casino, restoranes, una avenida muy agradable de recorrer y todo a unos pasos.']",['apartamentos cercanos a playa'],['Vivienda rentada entero - Anfitrión:\xa0Omar'],"[<Element 'div' class=('_19xnuo97',)>, <Element 'div' class=('_19xnuo97',)>, <Element 'div' class=('_19xnuo97',)>, <Element 'div' class=('_19xnuo97',)>, <Element 'div' class=('_19xnuo97',)>, <Element 'div' class=('_19xnuo97',)>]",['Anfitrión: Omar'],['Se registró en agosto de 2022'],[],"['https://maps.google.com/maps?ll=-29.9519,-71.2647&z=14&t=m&hl=es&gl=CL&mapclient=apiv3']",
120,https://www.airbnb.cl/rooms/34742564?adults=1&children=0&infants=0&pets=0&check_in=2023-02-05&check_out=2023-02-10&previous_page_section_name=1000,"['La Serena, Región de Coquimbo, Chile']",['3 camas'],['1 baño'],['4 huéspedes'],['2 habitaciones'],"['$53,900\xa0CLP\xa0']",['4.94 ·'],['16 reseñas'],"['Nuestro espacio es un departamento conectado y ubicado al interior de una casa de gran tamaño, decorado y hecho con mucho cariño. Cuenta con un dormitorio con cama matrimonial y TV, uno con cama pequeña. Una cocina grande con comedor, living/biblioteca con futón, baño, un huerto y espacio exterior que es muy agradable para comer, meditar jugar o disfrutar de la tranquilidad del sector, donde abundan los árboles, las plazas y todo tipo de servicios (pubs, supermercado, restaurantes, etc.)', 'Nuestro espacio es encantador, pues lo hemos hecho poco a poco con cariño y dedicación junto a mi hija. Además, es cómodo y en el entorno se respira la paz del sector con su abundante vegetación. Sin embargo, a pocos minutos en vehículo ya estás en la playa o en el centro de la ciudad.']",['Depto. interior a minutos de la playa y valleElqui'],['Alojamiento entero - Anfitrión:\xa0Josefa'],"[<Element 'div' class=('_19xnuo97',)>, <Element 'div' class=('_19xnuo97',)>, <Element 'div' class=('_19xnuo97',)>, <Element 'div' class=('_19xnuo97',)>, <Element 'div' class=('_19xnuo97',)>, <Element 'div' class=('_19xnuo97',)>, <Element 'div' class=('_19xnuo97',)>]",['Anfitrión: Josefa'],['Se registró en enero de 2023'],"['El barrio es precioso, residencial, muy tranquilo y con mucha vegetación y parques. Además, cerca hay negocios, panadería, supermercados, restaurantes, gasolinera, cajeros, etc. Dejaré un mapa con todas las indicaciones para que disfrutes tu estadía al máximo!!!']","['https://maps.google.com/maps?ll=-29.9319,-71.24327&z=14&t=m&hl=es&gl=CL&mapclient=apiv3']",
121,https://www.airbnb.cl/rooms/29818991?adults=1&children=0&infants=0&pets=0&check_in=2023-02-19&check_out=2023-02-24&previous_page_section_name=1000,"['Elqui, Región de Coquimbo, Chile']",['1 cama'],['2 baños'],['2 huéspedes'],['1 habitación'],"['$60,000\xa0CLP\xa0']",['4.54 ·'],['24 reseñas'],"['Todo lo que necesitas para sentirte en el mar, privilegiada vista a toda la costanera, playa a pasos de la puerta.', 'Lujoso edificio, piscina y juegos para niños.', 'El departamento no cuenta con toallas y se recomienda traer sus propias sábanas.', 'A partir de marzo 2022 el departamento cuenta con Wifi fibra óptica, y televisión por app con 2800 canales, series y películas.']",['Primera fila para 2 personas'],['Condo entero - Anfitrión:\xa0Paulina'],"[<Element 'div' class=('_19xnuo97',)>, <Element 'div' class=('_19xnuo97',)>, <Element 'div' class=('_19xnuo97',)>, <Element 'div' class=('_19xnuo97',)>, <Element 'div' class=('_19xnuo97',)>, <Element 'div' class=('_19xnuo97',)>]",['Anfitrión: Paulina'],['Se registró en noviembre de 2018'],"['El caos del verano no lo sientes, el lugar más tranquilo de toda la avenida del mar, además de contar con playas ideales para nadar y hacer deportes náuticos']","['https://maps.google.com/maps?ll=-29.95457,-71.30153&z=14&t=m&hl=es&gl=CL&mapclient=apiv3']",
122,https://www.airbnb.cl/rooms/612910956131019321?adults=1&children=0&infants=0&pets=0&check_in=2023-02-04&check_out=2023-02-09&previous_page_section_name=1000,"['La Serena, Coquimbo, Chile']",['1 cama'],['1 baño compartido'],['2 huéspedes'],['2 habitaciones'],"['$20,990\xa0CLP\xa0']",['4.43 ·'],['7 reseñas'],"['Disfruta de la sencillez de este alojamiento tranquilo y céntrico, cerca de la ciudad, los supermercados y el transporte local.']",['Espacio alegre de 2 dormitorios con estacionamiento gratuito'],['Habitación privada en alojamiento - Anfitrión:\xa0Estefano'],"[<Element 'div' class=('_19xnuo97',)>, <Element 'div' class=('_19xnuo97',)>, <Element 'div' class=('_19xnuo97',)>, <Element 'div' class=('_19xnuo97',)>, <Element 'div' class=('_19xnuo97',)>, <Element 'div' class=('_19xnuo97',)>, <Element 'div' class=('_19xnuo97',)>]",['Anfitrión: Estefano'],['Se registró en septiembre de 2019'],[],[],
123,https://www.airbnb.cl/rooms/15548526?adults=1&children=0&infants=0&pets=0&check_in=2023-02-11&check_out=2023-02-18&previous_page_section_name=1000,"['Coquimbo, Región de Coquimbo, Chile']",['3 camas'],['1 baño'],['3 huéspedes'],['2 habitaciones'],"['$60,000\xa0CLP\xa0']",['4.76 ·'],['29 reseñas'],"['Lugares de interes: A pasos de la tranquila playa del sector Peñuelas, frente al casino Enjoy. Gran oferta gastronómica de especialidad mariscos y pescado frescos día a día.  ', 'Te va encantar mi espacio: El departamento posee una gran luz natural, sentirás la brisa marina, haciendo mas agradable y relajante tu estadía. El complejo esta equipado con quinchos, piscina, salones de evento, lavandería, zonas wifi y la entrada es controlada por conserjes para brindarte mayor seguridad!', 'Mi depto es muy acojedor,full equipado,excelente ubicacion llegas caminando a la playa,tambien a outlet,casino enjoy,restorant,caleta de pescadores,extensas playas desde Coquimbo a La Serena']",['Acogedor dpto playa Peñuelas Casino Enjoy & Outlet'],['Vivienda rentada entero - Anfitrión:\xa0Soledad'],"[<Element 'div' class=('_19xnuo97',)>, <Element 'div' class=('_19xnuo97',)>, <Element 'div' class=('_19xnuo97',)>, <Element 'div' class=('_19xnuo97',)>, <Element 'div' class=('_19xnuo97',)>, <Element 'div' class=('_19xnuo97',)>, <Element 'div' class=('_19xnuo97',)>]",['Anfitrión: Soledad'],['Se registró en octubre de 2016'],"['Mi depto esta ubicada en una de las mejores playas de la zona, con todos los servicios y entretenciones que requieres para pasar una lindas vacaciones, quedaras encantado']","['https://maps.google.com/maps?ll=-29.94948,-71.28754&z=14&t=m&hl=es&gl=CL&mapclient=apiv3']",
124,https://www.airbnb.cl/rooms/792145927365467485?adults=1&children=0&infants=0&pets=0&check_in=2023-02-10&check_out=2023-02-15&previous_page_section_name=1000,"['La Serena, Coquimbo, Chile']",['4 camas'],['1 baño'],['5 huéspedes'],['3 habitaciones'],"['$69,813\xa0CLP\xa0']",[],[],"['Relájate con toda la familia en este tranquilo lugar para quedarse.', 'Departamento full Equipado con excelente ubicación, La Serena', 'CONDOMINIO PORTAL PACIFICO ll.', 'Se Arrienda Departamento con acogedores espacios, cuenta con 3 amplias habitaciones, 1 baños, living y cocina americana, estacionamiento y piscina.', 'A pasos de universidades, mall, supermercados y a minutos de la playa.', 'Condominio con seguridad 24 hrs. Y buen acceso a locomoción.', 'Atenderemos cualquier consulta👌']",['Condominio Portal Pacífico II'],['Vivienda rentada entero - Anfitrión:\xa0Jaime'],"[<Element 'div' class=('_19xnuo97',)>, <Element 'div' class=('_19xnuo97',)>, <Element 'div' class=('_19xnuo97',)>, <Element 'div' class=('_19xnuo97',)>, <Element 'div' class=('_19xnuo97',)>, <Element 'div' class=('_19xnuo97',)>, <Element 'div' class=('_19xnuo97',)>]",['Anfitrión: Jaime'],['Se registró en enero de 2020'],"['Muy tranquilo y transitable, bajo flujo de automóviles particulares']","['https://maps.google.com/maps?ll=-29.9075,-71.2699&z=14&t=m&hl=es&gl=CL&mapclient=apiv3']",
125,https://www.airbnb.cl/rooms/54004045?adults=1&children=0&infants=0&pets=0&check_in=2023-02-23&check_out=2023-02-28&previous_page_section_name=1000,"['La Serena, Coquimbo, Chile']",['3 camas'],['2 baños'],['5 huéspedes'],['3 habitaciones'],"['$44,940\xa0CLP\xa0']",['4.53 ·'],['15 reseñas'],"['Tu familia estará cerca de todo cuando te quedes en este alojamiento a 10 minutos del centro de la serena y 15 de playa.', 'Departamento en 1er piso con estacionamiento frente al depto. (Estacionamiento preferente) Lavandería, wifi, smart TV ', '*importante: 3 dormitorios equipados (2 camas de dos plazas, 1 un futon de plaza). ', '2 baños (uno en suite)', 'Consejería 24/7', 'Quincho', 'Juegos para niños', 'cámaras de seguridad ', '*SE solicita a los huéspedes traer sus sábanas como medida preventiva. *', 'Amplio departamento, full equipado, cocina cuenta con horno eléctrico, microondas, cafetera, hervidor, refrigerador, Internet y cable.', 'No tiene lavadora']",['Increíble departamento familiar 3 dorm 2 baños'],['Alojamiento vacacional entero - Anfitrión: Valentina\xa0Nicol'],"[<Element 'div' class=('_19xnuo97',)>, <Element 'div' class=('_19xnuo97',)>, <Element 'div' class=('_19xnuo97',)>, <Element 'div' class=('_19xnuo97',)>, <Element 'div' class=('_19xnuo97',)>, <Element 'div' class=('_19xnuo97',)>, <Element 'div' class=('_19xnuo97',)>]",['Anfitrión: Valentina Nicol'],['Se registró en febrero de 2017'],"['Barrio residencial en la serena, a minutos de supermercados y bencineras y locomoción']","['https://maps.google.com/maps?ll=-29.88977,-71.24042&z=14&t=m&hl=es&gl=CL&mapclient=apiv3']",
126,https://www.airbnb.cl/rooms/792972868262013691?adults=1&children=0&infants=0&pets=0&check_in=2023-02-12&check_out=2023-02-17&previous_page_section_name=1000,"['La Serena, Coquimbo, Chile']",['3 camas'],['1 baño'],['5 huéspedes'],['2 habitaciones'],"['$36,000\xa0CLP\xa0']",[],[],"['Casa cercana a Playa, supermercados, en barrio tranquilo , entrada auto ,patio amplio , ideal para familia. Se aceptan mascotas.']","['Casa acogedora, 2 dormitorios equipada.']",['Alojamiento entero - Anfitrión:\xa0David'],"[<Element 'div' class=('_19xnuo97',)>, <Element 'div' class=('_19xnuo97',)>, <Element 'div' class=('_19xnuo97',)>, <Element 'div' class=('_19xnuo97',)>, <Element 'div' class=('_19xnuo97',)>, <Element 'div' class=('_19xnuo97',)>, <Element 'div' class=('_19xnuo97',)>]",['Anfitrión: David'],['Se registró en diciembre de 2022'],"['Barrio tranquilo , con áreas verdes, cercano a centros comerciales, a 5 minutos de playas y del Casino de Juegos de Coquimbo, de fácil acceso.']","['https://maps.google.com/maps?ll=-29.9513,-71.2692&z=14&t=m&hl=es&gl=CL&mapclient=apiv3']",
127,https://www.airbnb.cl/rooms/54296204?adults=1&children=0&infants=0&pets=0&check_in=2023-02-18&check_out=2023-02-23&previous_page_section_name=1000,"['Coquimbo, Chile']",['3 camas'],['1 baño'],['4 huéspedes'],['2 habitaciones'],"['$50,000\xa0CLP\xa0']",['4.50 ·'],['8 reseñas'],['Tu familia estará cerca de todo cuando te quedes en este alojamiento céntrico.'],"['Hermoso apartamento, lugar residencial']",['Vivienda rentada entero - Anfitrión:\xa0Damian'],"[<Element 'div' class=('_19xnuo97',)>, <Element 'div' class=('_19xnuo97',)>, <Element 'div' class=('_19xnuo97',)>, <Element 'div' class=('_19xnuo97',)>, <Element 'div' class=('_19xnuo97',)>, <Element 'div' class=('_19xnuo97',)>, <Element 'div' class=('_19xnuo97',)>]",['Anfitrión: Damian'],['Se registró en enero de 2022'],[],"['https://maps.google.com/maps?ll=-29.96656,-71.3393&z=14&t=m&hl=es&gl=CL&mapclient=apiv3']",
